"Status","Start Time","Stop Time","Duration in ms","Parent Suite","Suite","Sub Suite","Test Class","Test Method","Name","Description"
"passed","Mon Oct 16 05:32:32 UTC 2023","Mon Oct 16 05:32:37 UTC 2023","4751","","Дисциплина","Страница дисциплины","DisciplineAnalyticsTests","CheckStubIsDisplayedIfNoStudentsInDiscipline","Страница аналитика дисциплины: отображается заглушка, если в дисциплине нет студентов или активностей",""
"passed","Mon Oct 16 05:27:43 UTC 2023","Mon Oct 16 05:27:51 UTC 2023","8068","Активность","Контрольная","Результат прохождения теста","TestActivityResultTests","MarkIncorrectAnswerThatWasMarkedAsCorrect","Результат прохождения: можно отметить 'Не верно' ответ вопроса, который был отмечен как 'Верно'",""
"passed","Mon Oct 16 05:31:19 UTC 2023","Mon Oct 16 05:31:22 UTC 2023","2831","","Дисциплина","Редактирование дисциплины","DisciplineEditingValidationTests","CheckImpossibilityTurnOnOrOffIOT","Редактирование дисциплины: невозможно отключить ИОТ, если в дисциплине есть активности",""
"passed","Mon Oct 16 05:30:41 UTC 2023","Mon Oct 16 05:30:57 UTC 2023","16416","","Дисциплина","Настройка чата дисциплины","DisciplineChatBlockTests","CheckBlockAndUnblockChatDiscipline","Редактирование дисциплины: блокировка чата дисциплины",""
"passed","Mon Oct 16 05:32:43 UTC 2023","Mon Oct 16 05:32:48 UTC 2023","5355","","Дисциплина","Редактирование дисциплины","DisContingentEditingValidationTests","CheckOnlyCohortGroupsAreShownInListOfGroups","Редактирование дисциплины: в выпадающем списке поля Группы отображаются только группы потока",""
"passed","Mon Oct 16 05:33:06 UTC 2023","Mon Oct 16 05:33:12 UTC 2023","6098","","Библиотека","","BulkActionsLibraryTests","CheckConfirmModalIsAppearWhenRemovingSelectedItems","Библиотека: при попытке удалить выбранных элементов отображается модалка подтверждения",""
"passed","Mon Oct 16 05:25:42 UTC 2023","Mon Oct 16 05:26:04 UTC 2023","21775","","Активность","Обычная активность","ActivityContentVisibilityTests","CheckHideMaterial","Редактирование активности: можно скрыть материал",""
"passed","Mon Oct 16 05:25:46 UTC 2023","Mon Oct 16 05:25:52 UTC 2023","5593","","Активность","Обычная активность","ActivityDurationTests","CheckEditVolumeActivityWithCorrectValues","Редактирование активности: успешное сохранение при корректных значениях в поля 'Объём'",""
"passed","Mon Oct 16 05:32:40 UTC 2023","Mon Oct 16 05:32:54 UTC 2023","13821","","Библиотека","","LibraryActionPanelTests","CheckSwitchToAnotherLibrary","Библиотека, плиточный вид: можно переключаться на другую Библиотеку",""
"passed","Mon Oct 16 05:32:59 UTC 2023","Mon Oct 16 05:33:20 UTC 2023","20616","","Материал","Конструктор теста","TestAddingQuestionsTests","CheckAddMultipleChoiceTestQuestion","Конструктор теста: можно добавить вопрос с типом ответа “Выбор из вариантов”",""
"passed","Mon Oct 16 05:34:43 UTC 2023","Mon Oct 16 05:34:49 UTC 2023","5312","","Организация","Мой тариф","MyPlanOrganizationPageTests","CheckNoAccessAuditorToRatePage","Страница Мой тариф: проверка перехода аудитора по прямой ссылке",""
"passed","Mon Oct 16 05:28:25 UTC 2023","Mon Oct 16 05:28:41 UTC 2023","15375","","Чат","Личный чат","PersonalChatTests","CheckEditLastMessageInPersonalChat","Список чатов - личный чат: можно редактировать сообщение в течение 4 часов после отправки",""
"passed","Mon Oct 16 05:29:57 UTC 2023","Mon Oct 16 05:29:59 UTC 2023","2045","","Поток","Редактирование потока","CohortEditingValidationTests","CheckIsNotPossibleSelectingCheckboxRegistrationLinkInEditingCohort","Редактирование потока ДО (СЗ): нет возможности выбрать галку ‘Разрешена регистрация по ссылке’",""
"passed","Mon Oct 16 05:32:51 UTC 2023","Mon Oct 16 05:32:56 UTC 2023","4578","","Библиотека","","StudentLibraryTests","CheckAvailabilityOfContentCreation","Библиотека студента: недоступно создание материалов кроме добавления файла и создания текстового материала",""
"passed","Mon Oct 16 05:28:30 UTC 2023","Mon Oct 16 05:28:32 UTC 2023","1634","","Поток","Создание потока","CohortCreationTests","CheckCancelCohortCreationByDirectLink","Создание потока ДО: работает кнопка 'Отмена', если страница создание был открыть по прямой ссылке",""
"passed","Mon Oct 16 05:26:53 UTC 2023","Mon Oct 16 05:27:29 UTC 2023","36717","","Активность","Шаблон активности контрольной","TestTemplateAddingTests","CheckAddFileToTestActivityTemplate","Редактирование шаблона контрольной: можно загрузить материал типа файл с компьютера",""
"passed","Mon Oct 16 05:27:35 UTC 2023","Mon Oct 16 05:27:46 UTC 2023","10982","Активность","Контрольная","Прохождение теста","TestActivityStatusWithOneAttemptTests","CheckStatusScoreColorAndIcon","Страница командной контрольной: статус и цвет у количества баллов в попытке различаются в зависимости от успешности",""
"passed","Mon Oct 16 05:26:41 UTC 2023","Mon Oct 16 05:26:48 UTC 2023","7161","Активность","Контрольная","Прохождение теста","TestActivityPassingTests","PassingTest","Прохождение теста: можно пройти тест командной контрольной",""
"passed","Mon Oct 16 05:29:02 UTC 2023","Mon Oct 16 05:29:09 UTC 2023","6792","","Чат","Чат решения","TaskChatTests","CheckSendFileMessageInTaskChat","Список чатов - обсуждение решения: можно прикрепить и отправить файл с компьютера",""
"passed","Mon Oct 16 05:27:41 UTC 2023","Mon Oct 16 05:27:48 UTC 2023","6957","","Активность","Шаблон активности контрольной","TestTemplateEditingTests","EditingGradeFieldsInTestActivityTemplate","Редактирование шаблона контрольной: переключение значения в поле 'Оценка'",""
"passed","Mon Oct 16 05:34:38 UTC 2023","Mon Oct 16 05:34:58 UTC 2023","19844","","Материал","Конструктор тест-тренажера","TestTrainAddingQuestionsTests","CheckAddQuestionInTestTrainSort","Конструктор теста-тренажера: можно добавить вопрос с типом ответа “Сортировка”",""
"passed","Mon Oct 16 05:32:59 UTC 2023","Mon Oct 16 05:33:03 UTC 2023","3609","","Библиотека","","LibraryActionPanelTests","CheckFindMaterialsByType","Библиотека, плиточный вид: работает поиск по типу материала",""
"passed","Mon Oct 16 05:25:15 UTC 2023","Mon Oct 16 05:25:24 UTC 2023","9081","","Активность","Задание","TaskActivityMulticriteriaTests","CheckCreateTaskWithoutNameOfCriteria","Создание задания: нельзя создать задание с критериями, если не заполнены названия критериев",""
"passed","Mon Oct 16 05:35:38 UTC 2023","Mon Oct 16 05:35:48 UTC 2023","10194","","Расписание","","ScheduleSettingsTests","BlackoutNameSchedule","Страница расписания: проверка затемнения прошедших активностей",""
"passed","Mon Oct 16 05:32:42 UTC 2023","Mon Oct 16 05:32:51 UTC 2023","9764","","Дисциплина","Создание дисциплины","DisContingentCreationTests","CheckCreateDisciplineByCheckingBoxAllCohortStudents","Создание дисциплины: есть возможность создать дисциплину выбрав галку ‘Все студенты потока’",""
"passed","Mon Oct 16 05:29:32 UTC 2023","Mon Oct 16 05:29:36 UTC 2023","4180","","Поток","Редактирование потока","CohortEditingValidationTests","CheckEditCohortIfEachDateNotFilled","Редактирование потока: ошибка валидации, если дата начала не заполнена",""
"passed","Mon Oct 16 05:24:59 UTC 2023","Mon Oct 16 05:25:17 UTC 2023","18429","","Активность","Обычная активность","ActivityAddingTests","CheckAddFileMaterialActivity","Редактирование активности: можно загрузить материал типа файл с компьютера",""
"passed","Mon Oct 16 05:25:05 UTC 2023","Mon Oct 16 05:25:15 UTC 2023","9639","","Активность","Обычная активность","ActivityEditingTests","CheckEditTypeActivity","Редактирование активности: можно переключать значения в поле 'Тип активности'",""
"passed","Mon Oct 16 05:27:36 UTC 2023","Mon Oct 16 05:27:43 UTC 2023","6328","Активность","Контрольная","Результат прохождения теста","TestActivityResultTests","CheckMarkCorrectTextOrFileAnswer","Результат прохождения: можно отметить 'Верно' ответ вопроса с типом ответа свободный ответ или файл",""
"passed","Mon Oct 16 05:26:07 UTC 2023","Mon Oct 16 05:26:19 UTC 2023","12758","","Активность","Обычная активность","ActivityAddingTests","CheckAddTestSimulatorNotInControlTypeActivity","Редактирование активности: можно добавить материал типа тест-тренажёра из библиотеки не в контрольную",""
"passed","Mon Oct 16 05:30:28 UTC 2023","Mon Oct 16 05:30:33 UTC 2023","5520","","Дисциплина","Страница дисциплины","DisciplineAnalyticsTests","CheckThreeDotMenuOnAnalyticsTabIsDisplayed","Страница аналитика дисциплины: наличие тридот меню на вкладке “Аналитика”",""
"failed","Mon Oct 16 05:38:43 UTC 2023","Mon Oct 16 05:39:17 UTC 2023","34593","","Чат","Групповой чат","GroupChatTests","CheckSendGroupChatToArchive","Список чатов - групповой чат: можно отправить чат в архив",""
"passed","Mon Oct 16 05:31:15 UTC 2023","Mon Oct 16 05:31:22 UTC 2023","7098","","Дисциплина","Страница дисциплины","DisciplineMarksAndAttendanceTests","CheckFinalGradesByTeacher","Страница оценок дисциплины: работает кнопка 'Итоговые оценки (ведомость)' у преподавателя",""
"passed","Mon Oct 16 05:33:07 UTC 2023","Mon Oct 16 05:33:20 UTC 2023","12934","","Библиотека","","LibraryInListViewTests","CheckRenameMaterialInListView","Библиотека, списочный вид: можно переименовать материал",""
"passed","Mon Oct 16 05:26:23 UTC 2023","Mon Oct 16 05:26:31 UTC 2023","8322","","Активность","Задание","TaskActivityTeacherTests","CheckGradeSolutionIncorrectValues","Страница решение задания: отображение ошибки валидации для поля баллы с значением 'отлично'",""
"passed","Mon Oct 16 05:34:56 UTC 2023","Mon Oct 16 05:35:00 UTC 2023","3711","","Организация","Создание организации","OrganizationCreationTests","CheckCopyNameToShortnameByDoubleClicking","Создание организации: можно скопировать название в поле краткое название двойным кликом",""
"passed","Mon Oct 16 05:27:44 UTC 2023","Mon Oct 16 05:27:53 UTC 2023","9290","","Активность","Обычный шаблон активности","TemplateEditingTests","CheckClearAddedTagsFromActivityTemplate","Редактирование шаблона активности: можно очистить теги знаний",""
"passed","Mon Oct 16 05:27:15 UTC 2023","Mon Oct 16 05:27:31 UTC 2023","16290","Активность","Контрольная","Прохождение теста","TestActivityStatusWithTwoOrMoreAttemptsTests","ResultOfPassingDependOnSettings","Страница командной контрольной: результат тестирования из попытках зависеть от настройки 'За лучшую попытку'",""
"passed","Mon Oct 16 05:32:51 UTC 2023","Mon Oct 16 05:33:01 UTC 2023","9448","","Дисциплина","Создание дисциплины","DisContingentCreationTests","CheckCreateDisciplineByUncheckingBoxAllCohortStudents","Создание дисциплины: есть возможность создать дисциплину сняв галку ‘Все студенты потока’",""
"passed","Mon Oct 16 05:31:01 UTC 2023","Mon Oct 16 05:31:11 UTC 2023","10271","","Дисциплина","Создание дисциплины","DisciplineCreationValidationTests","CheckIfCreditValuesNotAllowed","Создание дисциплины ДО: отображение ошибки валидации для поля 'Кредиты' с значением 0",""
"passed","Mon Oct 16 05:34:07 UTC 2023","Mon Oct 16 05:34:15 UTC 2023","8170","","Материал","Конструктор тест-тренажера","TestTrainCreationTests","TestCreation","Конструктор теста-тренажера: создание теста-тренажера",""
"passed","Mon Oct 16 05:26:18 UTC 2023","Mon Oct 16 05:26:33 UTC 2023","14498","","Активность","Обычная активность","ActivityEditingTests","CheckDeleteActivityWithoutGrades","Редактирование активности: можно удалить активность без оценок",""
"passed","Mon Oct 16 05:29:53 UTC 2023","Mon Oct 16 05:30:01 UTC 2023","8296","","Поток","Создание потока","CohortCreationTests","CheckCreateCohortBySelectingCheckboxRegistrationLink","Создание потока ДО: можно создать поток, выбрав галку ‘Разрешена регистрация по ссылке’",""
"passed","Mon Oct 16 05:32:30 UTC 2023","Mon Oct 16 05:32:37 UTC 2023","6704","","Библиотека","","BulkActionsLibraryTests","CheckInSelectModeFirstElementIsSelected","Библиотека: при переходе в режим выбора первый элемент должен быть выбран",""
"passed","Mon Oct 16 05:30:27 UTC 2023","Mon Oct 16 05:30:38 UTC 2023","10308","","Чат","Групповой чат","GroupChatTests","CheckDeleteMessageInGroupChat","Список чатов - групповой чат: можно удалить сообщение",""
"passed","Mon Oct 16 05:25:34 UTC 2023","Mon Oct 16 05:25:41 UTC 2023","6897","","Активность","Обычная активность","ActivityEditingFormatTests","CheckRandomSetTypeActivityGetFormatIndependancyStudy","Редактирование активности: автоматическое переключение на самостоятельное изучение при выборе конкретных типов",""
"passed","Mon Oct 16 05:34:02 UTC 2023","Mon Oct 16 05:34:08 UTC 2023","5907","","Материал","Конструктор теста","TestQuestionAnswersValidationTests","CheckRemoveCommentInTestAnswer","Конструктор теста: можно удалить комментарий к варианту ответа",""
"passed","Mon Oct 16 05:25:52 UTC 2023","Mon Oct 16 05:25:56 UTC 2023","4166","","Активность","Обычная активность","ActivityDurationTests","CheckEditVolumeActivityWithIncorrectValues","Редактирование активности: отображение ошибки валидации для поля 'Объём' с отрицательным значением",""
"passed","Mon Oct 16 05:29:30 UTC 2023","Mon Oct 16 05:29:34 UTC 2023","3123","","Поток","Редактирование потока","CohortEditingTests","CheckEditCohortByFillingMaxNumberOfStudents","Редактирование потока: успешное сохранение, с корректными значениями в поле ‘Максимальное количество студентов’",""
"passed","Mon Oct 16 05:34:35 UTC 2023","Mon Oct 16 05:34:46 UTC 2023","10928","","Материал","Конструктор теста","TestQuestionAnswersValidationTests","CheckEditCommentInTestAnswer","Конструктор теста: можно изменить комментарий к варианту ответа",""
"passed","Mon Oct 16 05:30:32 UTC 2023","Mon Oct 16 05:30:46 UTC 2023","14636","","Дисциплина","Редактирование дисциплины","DisciplineDurationTests","CheckIfDatesFilledCorrectInDiscipline","Редактирование дисциплины: успешное сохранение, если обе даты корректно заполнены",""
"passed","Mon Oct 16 05:28:39 UTC 2023","Mon Oct 16 05:28:45 UTC 2023","5797","","Поток","Создание потока","CohortCreationValidationTests","CheckCreateCohortIfEachDateNotFilled","Создание потока: ошибка валидации, если дата окончания  не указана",""
"passed","Mon Oct 16 05:33:33 UTC 2023","Mon Oct 16 05:33:39 UTC 2023","6468","","Материал","Конструктор тест-тренажера","TestTrainBlocksAndVariantsValidationTests","EditTestTrainBlockName","Конструктор теста-тренажера: можно переименовать блок",""
"passed","Mon Oct 16 05:29:06 UTC 2023","Mon Oct 16 05:29:11 UTC 2023","4931","","Поток","Редактирование потока","CohortEditingTests","CheckCancelCohortEditing","Редактирование потока ДО: работает кнопка 'Отмена', если страница редактирование был открыть со страницы потока",""
"passed","Mon Oct 16 05:31:26 UTC 2023","Mon Oct 16 05:31:32 UTC 2023","5468","","Дисциплина","Редактирование дисциплины","DisciplineEditingValidationTests","CheckIfCreditNotFilled","Редактирование дисциплины: отображение ошибки валидации для поля 'Кредиты' с отрицательным значением",""
"passed","Mon Oct 16 05:29:42 UTC 2023","Mon Oct 16 05:29:51 UTC 2023","9335","","Чат","Мини-чат страницы решений","TaskPageMiniChatTests","CheckAddReactionToLastMessageInTaskPageMiniChat","Чат на странице решения: можно добавить реакцию на сообщение",""
"passed","Mon Oct 16 05:25:39 UTC 2023","Mon Oct 16 05:25:50 UTC 2023","10865","","Активность","Задание","TaskActivityMulticriteriaTests","CheckCreateTaskWithValuesInCriteria","Создание задания: можно задать значения критерия (заполнены поля значения и баллов)",""
"passed","Mon Oct 16 05:31:19 UTC 2023","Mon Oct 16 05:31:32 UTC 2023","12837","","Дисциплина","Страница дисциплины","DisciplineAnalyticsTests","CheckHideFiltersOfAnalyticsTable","Страница аналитика дисциплины: можно скрывать фильтры таблицы аналитики",""
"passed","Mon Oct 16 05:35:26 UTC 2023","Mon Oct 16 05:35:39 UTC 2023","12537","","Профиль","","GeneralUserInfoEditingTests","ValidatingUserNameFields","Редактирование профиля пользователя: можно изменить ФИО",""
"passed","Mon Oct 16 05:33:19 UTC 2023","Mon Oct 16 05:33:40 UTC 2023","20980","","Библиотека","","LibraryInTileViewTests","CheckCopyMaterialToCatalogInTileView","Библиотека, плиточный вид: можно скопировать материал в другой каталог",""
"passed","Mon Oct 16 05:27:21 UTC 2023","Mon Oct 16 05:27:25 UTC 2023","3781","Активность","Контрольная","Прохождение теста","TestActivityStatusWithOneAttemptTests","StatusChangesIfMinThresholdChanges","Страница командной контрольной: статус меняется, если преподаватель меняет минимальный порог баллов",""
"passed","Mon Oct 16 05:31:52 UTC 2023","Mon Oct 16 05:32:03 UTC 2023","10871","","Дисциплина","Страница дисциплины","DisciplineRightMenuTests","CheckDisCreditsAndVolumeIsDisplayed","Страница дисциплины: отображаются кредиты и объём дисциплины",""
"passed","Mon Oct 16 05:26:47 UTC 2023","Mon Oct 16 05:26:55 UTC 2023","8123","Активность","Контрольная","Результат прохождения теста","TestActivityResultTests","StudentCanViewDetailedResultInfo","Результат прохождения: студент не может просматривать подробную информацию о результатах, если отключена соответственная опция",""
"passed","Mon Oct 16 05:25:29 UTC 2023","Mon Oct 16 05:25:32 UTC 2023","2778","","Активность","Задание","TaskActivityTeacherTests","CheckGotoSolutions","Страница активности: работает кнопка 'Перейти к решениям' для преподавателя",""
"passed","Mon Oct 16 05:27:57 UTC 2023","Mon Oct 16 05:28:33 UTC 2023","36115","","Чат","Мини-чат группового чата","GroupMiniChatTests","CheckSendTextMessageInGroupMiniChat","Миничат - групповой чат: можно отправить текстовое сообщение",""
"passed","Mon Oct 16 05:26:10 UTC 2023","Mon Oct 16 05:26:18 UTC 2023","8113","","Активность","Задание","TaskWithSolutionStudentTests","CheckAbilityToEvaluateAnotherStudentsSolution","Страница решение задания: можно оценить решения другого студента, если включена 'Взаимопроверка'",""
"passed","Mon Oct 16 05:26:18 UTC 2023","Mon Oct 16 05:26:22 UTC 2023","4358","Активность","Контрольная","Редактирование контрольной","TestActivityEditingTests","ErrorWithIncorrectValueNumberOfAttemptsInTestActivity","Редактирование контрольной: отображение ошибки валидации для поля 'Количество попыток сдачи' с отрицательным значением",""
"passed","Mon Oct 16 05:28:27 UTC 2023","Mon Oct 16 05:28:42 UTC 2023","14784","","Чат","Чат решения","TaskChatTests","CheckEditLastMessageInTaskChat","Список чатов - обсуждение решения: можно редактировать сообщение в течение 4 часов после отправки",""
"passed","Mon Oct 16 05:29:40 UTC 2023","Mon Oct 16 05:29:49 UTC 2023","8821","","Чат","Личный чат","PersonalChatTests","CheckAddReactionToLastMessageInPersonalChat","Список чатов - личный чат: можно добавить реакцию на сообщение",""
"passed","Mon Oct 16 05:32:17 UTC 2023","Mon Oct 16 05:32:21 UTC 2023","3477","","Дисциплина","Создание дисциплины","DisContingentCreationValidationTests","CheckIsDisabledCheckboxAllStudentInCreatingDiscipline","Создание дисциплины (СЗ): галка ‘Все студенты потока’ дизаблена и невозможно его снять",""
"passed","Mon Oct 16 05:35:03 UTC 2023","Mon Oct 16 05:35:30 UTC 2023","26517","","Материал","Конструктор теста","TestAddingQuestionsTests","CheckAddSortingTestQuestion","Конструктор теста: можно добавить вопрос с типом ответа “Сортировка”",""
