"Status","Start Time","Stop Time","Duration in ms","Parent Suite","Suite","Sub Suite","Test Class","Test Method","Name","Description"
"passed","Wed Oct 11 05:36:31 UTC 2023","Wed Oct 11 05:36:39 UTC 2023","8000","","Чат","Личный чат","PersonalChatTests","CheckDeleteMessageInPersonalChat","Список чатов - личный чат: можно удалить сообщение",""
"passed","Wed Oct 11 05:37:45 UTC 2023","Wed Oct 11 05:37:49 UTC 2023","3674","","Дисциплина","Создание дисциплины","DisContingentCreationValidationTests","CheckIsDisabledCheckboxAllStudentInCreatingDiscipline","Создание дисциплины (СЗ): галка ‘Все студенты потока’ дизаблена и невозможно его снять",""
"passed","Wed Oct 11 05:41:58 UTC 2023","Wed Oct 11 05:42:01 UTC 2023","2741","","Расписание","","ScheduleSettingsTests","ChangeTextBlackoutNameSchedule","Страница расписания: проверка изменения текста затемнения прошедших активностей",""
"passed","Wed Oct 11 05:40:31 UTC 2023","Wed Oct 11 05:40:45 UTC 2023","13776","","Материал","Конструктор тест-тренажера","TestTrainBlocksAndVariantsValidationTests","DeleteBlockTestTrain","Конструктор теста-тренажера: можно удалить блок",""
"passed","Wed Oct 11 05:36:19 UTC 2023","Wed Oct 11 05:36:23 UTC 2023","4027","","Дисциплина","Редактирование дисциплины","DisciplineAccessTests","CheckIfStudentChangeDiscipline","Редактирование дисциплины: нет возможности редактировать у студента",""
"passed","Wed Oct 11 05:30:41 UTC 2023","Wed Oct 11 05:30:46 UTC 2023","5326","","Активность","Задание","TaskActivityTeacherTests","CheckSetIndividualDate","Страница решение задания: можно установить индивидуальный срок сдачи",""
"passed","Wed Oct 11 05:32:36 UTC 2023","Wed Oct 11 05:32:44 UTC 2023","8205","Активность","Контрольная","Результат прохождения теста","TestActivityResultTests","ClockIconAndTruFalseButtonsAreDisplayed","Результат прохождения: отображается иконка часы, кнопки верно и неверно в вопросах с типом ответа свободный ответ или файл",""
"passed","Wed Oct 11 05:41:29 UTC 2023","Wed Oct 11 05:41:40 UTC 2023","11070","","Программа","","ProgramCreationTests","CreateAdditionalProgramFillAllFields","Cоздание обр программы ДПО: если заполнить все поля",""
"passed","Wed Oct 11 05:35:25 UTC 2023","Wed Oct 11 05:36:09 UTC 2023","43582","","Поток","Создание потока","CohortCreationTests","CheckCreateCohortFromTemplateWhenAllRequiredFieldsAreFilled","Создание потока ДО: можно создать поток из шаблона, если все обязательные поля корректно заполнены",""
"skipped","Wed Oct 11 05:45:46 UTC 2023","Wed Oct 11 05:45:47 UTC 2023","380","","Библиотека","","LibraryMaterialTests","CheckVisibilityOfLaTeXMaterialPreview","Превью материала: LaTeX отображается как PDF",""
"passed","Wed Oct 11 05:38:21 UTC 2023","Wed Oct 11 05:38:25 UTC 2023","3154","","Дисциплина","Шаблон дисциплины","DisTemplateTests","CheckCreateDisTemplateIfRequiredFieldsNotFilled","Создание шаблона дисциплины: невозможно создать шаблон, если не заполнены обязательные поля",""
"passed","Wed Oct 11 05:35:35 UTC 2023","Wed Oct 11 05:35:42 UTC 2023","6908","","Чат","Мини-чат страницы решений","TaskPageMiniChatTests","CheckSendFileMessageInTaskPageMiniChat","Чат на странице решения: можно прикрепить и отправить файл с компьютера",""
"passed","Wed Oct 11 05:32:21 UTC 2023","Wed Oct 11 05:32:34 UTC 2023","13476","","Активность","Обычный шаблон активности","TemplateAddingTests","CheckAddTestSimulatorNotInControlTypeTemplate","Редактирование шаблона активности: можно добавить материал типа тест-тренажёра из библиотеки не в контрольную",""
"passed","Wed Oct 11 05:45:00 UTC 2023","Wed Oct 11 05:45:36 UTC 2023","36071","","Чат","Групповой чат","GroupChatTests","CheckFindSentMessageInGroupChat","Список чатов - групповой чат: можно найти отправленное сообщение",""
"passed","Wed Oct 11 05:40:45 UTC 2023","Wed Oct 11 05:40:57 UTC 2023","11939","","Материал","Конструктор тест-тренажера","TestTrainSettingsValidationTests","EditTestTrainDescription","Конструктор теста-тренажера: можно изменить описание теста-тренажера",""
"passed","Wed Oct 11 05:31:48 UTC 2023","Wed Oct 11 05:31:55 UTC 2023","6897","","Активность","Обычный шаблон активности","TemplateEditingValidationTests","CheckNegativeEditVolumeActivityTemplate","Редактирование шаблона активности: отображение ошибки валидации для поля 'Объём' с отрицательным значением",""
"passed","Wed Oct 11 05:33:15 UTC 2023","Wed Oct 11 05:33:28 UTC 2023","13506","Активность","Контрольная","Страница контрольной","TestCommandActivityTests","DeleteCommandToControlTypeActivityInCommandMode","Страница командной контрольной: можно удалить команду",""
"passed","Wed Oct 11 05:33:02 UTC 2023","Wed Oct 11 05:33:07 UTC 2023","5102","Активность","Контрольная","Прохождение теста","TestActivityStatusWithOneAttemptTests","StatusChangesIfMinThresholdChanges","Страница командной контрольной: статус меняется, если преподаватель меняет минимальный порог баллов",""
"passed","Wed Oct 11 05:37:06 UTC 2023","Wed Oct 11 05:37:13 UTC 2023","7273","","Дисциплина","Редактирование дисциплины","DisciplineEditingTests","CheckSwitchLanguage","Редактирование дисциплины: можно переключать значения в поле 'Язык'",""
"passed","Wed Oct 11 05:39:48 UTC 2023","Wed Oct 11 05:40:00 UTC 2023","11746","","Библиотека","","LibraryInListViewTests","CheckEditMaterialViaActionsButton","Библиотека, списочный вид: можно редактировать материал через actions-кнопки",""
"passed","Wed Oct 11 05:41:44 UTC 2023","Wed Oct 11 05:41:47 UTC 2023","3354","","Расписание","","ScheduleTests","ActiveTidayButtonSchedule","Страница расписания: проверка кликабельности Сегодня",""
"failed","Wed Oct 11 05:45:41 UTC 2023","Wed Oct 11 05:45:56 UTC 2023","15199","","Библиотека","","BulkActionsLibraryTests","CheckMoveMultipleSelectedItemsToAnotherDirectory","Библиотека: можно переместить несколько выбранных элементов в другой каталог",""
"passed","Wed Oct 11 05:39:00 UTC 2023","Wed Oct 11 05:39:15 UTC 2023","15472","","Дисциплина","Шаблон дисциплины","DisTemplateTests","CheckCreateActivityInDisTemplate","Страница шаблона дисциплины: можно добавить шаблон активности создав его",""
"passed","Wed Oct 11 05:34:07 UTC 2023","Wed Oct 11 05:34:19 UTC 2023","11395","","Чат","Чат решения","TaskChatTests","CheckSendTextMessageInTaskChat","Список чатов - обсуждение решения: можно отправить текстовое сообщение",""
"passed","Wed Oct 11 05:38:55 UTC 2023","Wed Oct 11 05:39:14 UTC 2023","19472","","Библиотека","","BulkActionsLibraryTests","CheckCancelSelectedItems","Библиотека: можно отменить режим выбора, нажав на кнопку “Отмена” или сняв отметки с выбранных элементов",""
"passed","Wed Oct 11 05:31:50 UTC 2023","Wed Oct 11 05:32:06 UTC 2023","15678","Активность","Контрольная","Редактирование контрольной","TestActivityAddingTests","CheckAddFileToTestActivity","Редактирование контрольной: можно загрузить материал типа файл с компьютера",""
"passed","Wed Oct 11 05:32:39 UTC 2023","Wed Oct 11 05:32:41 UTC 2023","2599","","Активность","Обычная активность","ActivityEditingTests","CheckDeleteActivityWithGrades","Редактирование активности: невозможно удалить активность с оценками",""
"passed","Wed Oct 11 05:30:54 UTC 2023","Wed Oct 11 05:31:06 UTC 2023","11557","","Активность","Задание","TaskActivityTeacherTests","CheckGradeSolutionValueAboveAndBelowScore","Страница решение задания: можно оценить решения значением выше минимального порога баллов",""
"passed","Wed Oct 11 05:38:34 UTC 2023","Wed Oct 11 05:38:39 UTC 2023","5389","","Дисциплина","Редактирование дисциплины","DisContingentEditingValidationTests","CheckGroupsAndStudentsFiledsIsAppearInEditing","Редактирование дисциплины: после снятии галки ‘Все студенты потока’ появляется поля Группы и Студенты",""
"passed","Wed Oct 11 05:40:45 UTC 2023","Wed Oct 11 05:40:58 UTC 2023","12941","","Материал","Конструктор тест-тренажера","TestTrainBlocksAndVariantsValidationTests","CheckRemoveQuestionFromTestTrain","Конструктор теста-тренажера: можно удалить вопрос",""
"passed","Wed Oct 11 05:40:42 UTC 2023","Wed Oct 11 05:40:50 UTC 2023","7781","","Материал","Конструктор теста","TestSettingsValidationTests","EditTestTimeLimit","Конструктор теста: можно изменить временной лимит",""
"passed","Wed Oct 11 05:41:37 UTC 2023","Wed Oct 11 05:41:39 UTC 2023","2224","","Программа","","ProgramEditingTests","CheckRemoveProgramWithNationalProject","Редактирование программы ДО: невозможно удалить программу с проектом СЗ",""
"passed","Wed Oct 11 05:35:35 UTC 2023","Wed Oct 11 05:35:43 UTC 2023","7393","","Чат","Групповой чат","GroupChatTests","CheckSendFileMessageInGroupChat","Список чатов - групповой чат: можно прикрепить и отправить файл с компьютера",""
"passed","Wed Oct 11 05:40:28 UTC 2023","Wed Oct 11 05:40:37 UTC 2023","8748","","Материал","Конструктор теста","TestQuestionAnswersValidationTests","CheckRemoveAnswerFromMultipleChoiceQuestion","Конструктор теста: можно удалить вариант ответа из вопроса с типом ответа 'Выбор из вариантов'",""
"passed","Wed Oct 11 05:41:16 UTC 2023","Wed Oct 11 05:41:18 UTC 2023","2357","","Организация","Создание организации","OrganizationCreationTests","CheckCopyNameToShortnameByDoubleClicking","Создание организации: можно скопировать название в поле краткое название двойным кликом",""
"passed","Wed Oct 11 05:35:24 UTC 2023","Wed Oct 11 05:35:35 UTC 2023","10940","","Чат","Групповой чат","GroupChatTests","CheckSendEmojiInGroupChat","Список чатов - групповой чат: можно отправить смайлики",""
"passed","Wed Oct 11 05:31:43 UTC 2023","Wed Oct 11 05:31:47 UTC 2023","3918","","Активность","Обычный шаблон активности","TemplateEditingTests","CheckEditActivityTemplate","Редактирование шаблона активности: работает кнопка 'Редактировать' для преподавателя",""
"passed","Wed Oct 11 05:32:53 UTC 2023","Wed Oct 11 05:33:00 UTC 2023","7481","Активность","Контрольная","Редактирование контрольной","TestActivityEditingTests","SuccessSaveWithPositiveValueMinThresholdInTestActivity","Редактирование контрольной: успешное сохранение при положительных значениях в поле 'Минимальный порог баллов'",""
"passed","Wed Oct 11 05:36:17 UTC 2023","Wed Oct 11 05:36:25 UTC 2023","7923","","Поток","Создание потока","CohortCreationTests","CheckCreateCohortByFillingMaxNumberOfStudents","Создание потока: можно создать поток, заполнив поле ‘Максимальное количество студентов’",""
"passed","Wed Oct 11 05:33:51 UTC 2023","Wed Oct 11 05:34:02 UTC 2023","11593","","Чат","Чат для заметок","NotesChatTests","CheckSendTextMessageInNotesChat","Список чатов - чат для заметок: можно отправить текстовое сообщение",""
"passed","Wed Oct 11 05:36:37 UTC 2023","Wed Oct 11 05:36:43 UTC 2023","6846","","Дисциплина","Настройка чата дисциплины","DisciplineChatBlockTests","CheckNotAccessOpenChatActivity","Страница активности: отсутствия доступа к кнопке 'Открыть чат активности', если чат дисциплины заблокирован",""
"passed","Wed Oct 11 05:38:25 UTC 2023","Wed Oct 11 05:38:35 UTC 2023","10249","","Дисциплина","Шаблон дисциплины","DisTemplateTests","CheckAddModuleInDisTemplate","Страница шаблона дисциплины: можно добавить модуль",""
"passed","Wed Oct 11 05:32:44 UTC 2023","Wed Oct 11 05:32:53 UTC 2023","9362","Активность","Контрольная","Результат прохождения теста","TestActivityResultTests","TeacherCanLeaveCommentOnAnswer","Результат прохождения: преподаватель может оставить комментарий к ответу, если включена опция подробная информация о результатах",""
"passed","Wed Oct 11 05:41:24 UTC 2023","Wed Oct 11 05:41:31 UTC 2023","7086","","Материал","Конструктор тест-тренажера","TestTrainQuestionAnswersValidationTests","CheckRemoveAnswerFromComparisionQuestionInTestTrain","Конструктор теста-тренажера: можно удалить один вариант на сопоставление из вопроса с типом ответа ‘Сопоставление’",""
"passed","Wed Oct 11 05:32:28 UTC 2023","Wed Oct 11 05:32:37 UTC 2023","9192","","Активность","Обычный шаблон активности","TemplateEditingTests","CheckEditVolumeActivityTemplate","Редактирование шаблона активности: успешное сохранение при корректных значениях в поля 'Объём'",""
"passed","Wed Oct 11 05:39:14 UTC 2023","Wed Oct 11 05:39:19 UTC 2023","4983","","Библиотека","","LibraryActionPanelTests","CheckFindMaterialsByType","Библиотека, плиточный вид: работает поиск по типу материала",""
"passed","Wed Oct 11 05:41:44 UTC 2023","Wed Oct 11 05:41:50 UTC 2023","6004","","Программа","","ProgramInfoPageTests","CheckNoAccessStudentToMaterialsEducationalProgramArchive","Страница обр программы: Студенты не имеют доступ к материалам архивной обр программы по прямой ссылки ",""
"passed","Wed Oct 11 05:45:01 UTC 2023","Wed Oct 11 05:45:22 UTC 2023","20537","Активность","Контрольная","Прохождение теста","TestActivityStatusWithTwoOrMoreAttemptsTests","ResultOfPassingDependOnSettings","Страница индивидуальной контрольной: результат тестирования из попытках зависеть от настройки 'За лучшую попытку'",""
"passed","Wed Oct 11 05:32:01 UTC 2023","Wed Oct 11 05:32:06 UTC 2023","5373","","Активность","Обычный шаблон активности","TemplateEditingValidationTests","CheckNegativeEditVolumeActivityTemplate","Редактирование шаблона активности: отображение ошибки валидации для поля 'Объём' с значением > 100",""
"passed","Wed Oct 11 05:39:05 UTC 2023","Wed Oct 11 05:39:14 UTC 2023","8850","","Библиотека","","LibraryActionPanelTests","CheckFindMaterialByName","Библиотека, плиточный вид: можно найти материал в поиске по названию",""
"passed","Wed Oct 11 05:37:54 UTC 2023","Wed Oct 11 05:38:09 UTC 2023","14678","","Дисциплина","Редактирование дисциплины","DisciplineEditingTests","CheckDeleteDisciplineWithoutGrades","Редактирование дисциплины: можно удалить дисциплину без оценок",""
"passed","Wed Oct 11 05:37:10 UTC 2023","Wed Oct 11 05:37:17 UTC 2023","6083","","Дисциплина","Редактирование дисциплины","DisciplineDurationTests","CheckIfStartDateEmptyInDiscipline","Редактирование дисциплины: наличия ошибки если поле дата начала пустое",""
"passed","Wed Oct 11 05:32:14 UTC 2023","Wed Oct 11 05:32:26 UTC 2023","11923","Активность","Контрольная","Результат прохождения теста","TestActivityResultTests","StudentCanViewDetailedResultInfo","Результат прохождения: студент может просматривать подробную информацию о результатах, если включена соответственная опция",""
"passed","Wed Oct 11 05:36:45 UTC 2023","Wed Oct 11 05:37:20 UTC 2023","35778","","Чат","Групповой чат","GroupChatTests","CheckSendGroupChatToArchive","Список чатов - групповой чат: можно отправить чат в архив",""
"passed","Wed Oct 11 05:38:50 UTC 2023","Wed Oct 11 05:39:07 UTC 2023","17911","","Дисциплина","Редактирование дисциплины","DisContingentEditingTests","CheckRemoveGroupAndStudentFromDiscipline","Редактирование дисциплины: открепления от дисциплины групп и студентов",""
"passed","Wed Oct 11 05:38:18 UTC 2023","Wed Oct 11 05:38:33 UTC 2023","15422","","Библиотека","","LibraryInTileViewTests","CheckRenameCatalog","Библиотека, плиточный вид: можно переименовать каталог",""
"passed","Wed Oct 11 05:33:40 UTC 2023","Wed Oct 11 05:33:48 UTC 2023","8215","","Активность","Шаблон активности контрольной","TestTemplateEditingTests","EditingGradeFieldsInTestActivityTemplate","Редактирование шаблона контрольной: переключение значения в поле 'Оценка'",""
"passed","Wed Oct 11 05:40:52 UTC 2023","Wed Oct 11 05:40:59 UTC 2023","7591","","Материал","Конструктор теста","TestQuestionAnswersValidationTests","CheckRemoveAnswerFromSortingQuestion","Конструктор теста: можно удалить опцию из вопроса с типом ответа 'Сортировка'",""
"passed","Wed Oct 11 05:40:11 UTC 2023","Wed Oct 11 05:40:21 UTC 2023","9884","","Материал","Конструктор теста","TestQuestionAnswersValidationTests","CheckAddCommentInTestAnswer","Конструктор теста: можно добавить комментарий к варианту ответа",""
"passed","Wed Oct 11 05:37:21 UTC 2023","Wed Oct 11 05:37:26 UTC 2023","5302","","Дисциплина","Редактирование дисциплины","DisciplineEditingTests","CheckSetDescriptionField","Редактирование дисциплины: можно изменить описание",""
"passed","Wed Oct 11 05:37:18 UTC 2023","Wed Oct 11 05:37:21 UTC 2023","3590","","Дисциплина","Редактирование дисциплины","DisciplineEditingValidationTests","CheckIfCreditNotFilled","Редактирование дисциплины: отображение ошибки валидации для поля 'Кредиты' с значением 0",""
"passed","Wed Oct 11 05:32:08 UTC 2023","Wed Oct 11 05:32:21 UTC 2023","12303","","Активность","Обычный шаблон активности","TemplateAddingTests","CheckAddTestNotInControlTypeActivityTemplate","Редактирование шаблона активности: наличия ошибки при добавлении теста из библиотеки не в контрольную",""
"passed","Wed Oct 11 05:30:29 UTC 2023","Wed Oct 11 05:30:36 UTC 2023","7278","","Активность","Задание","TaskWithoutSolutionStudentTests","CheckSendTextSolution","Страница решение задания: можно отправить текстовый ответ",""
"passed","Wed Oct 11 05:42:06 UTC 2023","Wed Oct 11 05:42:13 UTC 2023","7033","","Профиль","","GeneralUserInfoEditingTests","CheckBirthField","Редактирование профиля пользователя: можно изменить дату рождения",""
"passed","Wed Oct 11 05:31:17 UTC 2023","Wed Oct 11 05:31:20 UTC 2023","3177","","Активность","Задание","TaskWithSolutionStudentTests","CheckAbilityToSeeListSolutions","Страница решение задания: можно просмотреть список всех решений, если включена 'Решения открыты всем'",""
"passed","Wed Oct 11 05:41:14 UTC 2023","Wed Oct 11 05:41:16 UTC 2023","1878","","Организация","Страница организации","OrganizationPageTests","CheckTooltipIsDisplayedByHoverProjectIcon","Страница организации: отображается тултип при наведении на иконку участника проекта",""
"passed","Wed Oct 11 05:39:46 UTC 2023","Wed Oct 11 05:40:00 UTC 2023","13329","","Библиотека","","LibraryActionPanelTests","CheckChangeViewOfLibraryInTileView","Библиотека: можно переключать текущий вид библиотеки со “Списка” на “Плитку”",""
"passed","Wed Oct 11 05:35:31 UTC 2023","Wed Oct 11 05:35:39 UTC 2023","7308","","Чат","Дисциплина","DisciplineChatTests","CheckSendMessageByTappingEnterInDisciplineChat","Список чатов - комната дисциплины: можно отправить сообщения по нажатию на Enter",""
"passed","Wed Oct 11 05:36:49 UTC 2023","Wed Oct 11 05:36:57 UTC 2023","7897","","Дисциплина","Создание дисциплины","DisciplineCreationValidationTests","CheckIfShortnameNotFilledInCreation","Создание дисциплины ДО: отображение ошибки валидации для поля 'Краткое название', если поле не заполнено",""
"passed","Wed Oct 11 05:38:26 UTC 2023","Wed Oct 11 05:38:35 UTC 2023","9099","","Библиотека","","BulkActionsLibraryTests","CheckInSelectModeFirstElementIsSelected","Библиотека: при переходе в режим выбора первый элемент должен быть выбран",""
"passed","Wed Oct 11 05:39:20 UTC 2023","Wed Oct 11 05:39:36 UTC 2023","15600","","Материал","Конструктор теста","TestQuestionAnswersValidationTests","CheckAddAnswerVariantInMultipleChoiceTestQuestion","Конструктор теста: можно добавить еще один вариант ответа в вопрос с типом ответа 'Выбор из вариантов'",""
"passed","Wed Oct 11 05:36:20 UTC 2023","Wed Oct 11 05:36:33 UTC 2023","12651","","Дисциплина","Страница дисциплины","DisciplineActivitiesBlockTests","CheckAddModuleInDiscipline","Страница дисциплины: создание модуля",""
"passed","Wed Oct 11 05:37:13 UTC 2023","Wed Oct 11 05:37:23 UTC 2023","10193","","Дисциплина","Создание дисциплины","DisciplineCreationTests","CreatDisciplineFromDisciplineTemplateWithActivities","Создание дисциплины ДО: можно создать дисциплину из шаблона дисциплины с активностями",""
