"Status","Start Time","Stop Time","Duration in ms","Parent Suite","Suite","Sub Suite","Test Class","Test Method","Name","Description"
"passed","Thu Nov 16 06:09:27 UTC 2023","Thu Nov 16 06:09:37 UTC 2023","10379","Активность","Контрольная","Прохождение теста","TestActivityStatusWithOneAttemptTests","CheckStatusScoreColorAndIcon","Страница индивидуальной контрольной: статус и цвет у количества баллов в попытке различаются в зависимости от успешности",""
"passed","Thu Nov 16 06:16:08 UTC 2023","Thu Nov 16 06:16:18 UTC 2023","10213","","Материал","Конструктор тест-тренажера","TestTrainQuestionsValidationTests","CheckAndUncheckAnswerOptionInTestTrain","Конструктор теста-тренажера: возможность снять отметку “верный” у варианта ответа",""
"passed","Thu Nov 16 06:13:44 UTC 2023","Thu Nov 16 06:13:56 UTC 2023","11814","","Дисциплина","Шаблон дисциплины","DisTemplateTests","CheckCreateActivityInDisTemplate","Страница шаблона дисциплины: можно добавить шаблон активности создав его",""
"failed","Thu Nov 16 06:19:50 UTC 2023","Thu Nov 16 06:19:51 UTC 2023","672","","Дисциплина","Редактирование дисциплины","DisContingentEditingTests","CheckAddTeacherByUserInfoInEditing","Редактирование дисциплины: добавление преподавателя по email’у","
SetUp SetUp method failed
"
"passed","Thu Nov 16 06:07:32 UTC 2023","Thu Nov 16 06:07:40 UTC 2023","8063","","Активность","Задание","TaskActivityTeacherTests","CheckGradeSolutionIncorrectValues","Отображение ошибки валидации для поля баллы с отрицательным значением",""
"passed","Thu Nov 16 06:16:24 UTC 2023","Thu Nov 16 06:16:32 UTC 2023","8163","","Профиль","","GeneralUserInfoEditingTests","ValidatingUserNameFields","Редактирование профиля пользователя: можно изменить ФИО",""
"failed","Thu Nov 16 06:19:47 UTC 2023","Thu Nov 16 06:19:47 UTC 2023","262","","Активность","Обычный шаблон активности","TemplateAddingTests","CheckRemoveMaterialActivityTemplate","Редактирование шаблона активности: можно удалять материалы","
SetUp SetUp method failed
"
"passed","Thu Nov 16 06:12:28 UTC 2023","Thu Nov 16 06:12:36 UTC 2023","7744","","Дисциплина","Страница дисциплины","DisciplineAnalyticsTests","CheckHideFiltersOfAnalyticsTable","Страница аналитика дисциплины: можно скрывать фильтры таблицы аналитики",""
"passed","Thu Nov 16 06:08:58 UTC 2023","Thu Nov 16 06:09:02 UTC 2023","4507","Активность","Контрольная","Редактирование контрольной","TestActivityEditingTests","CheckErrorInTimeLimitFieldWithIncorrectValue","Ошибка валидации в поле Временной лимит, если введено отрицательное значение",""
"passed","Thu Nov 16 06:13:53 UTC 2023","Thu Nov 16 06:13:55 UTC 2023","2148","","Подразделения","Страница подразделения","DivisionPageTests","CheckTypeAndHoursOfProgramsIsDisplayed","Лейблы тип и количество часов отображаются под названием программы",""
"passed","Thu Nov 16 06:15:19 UTC 2023","Thu Nov 16 06:15:40 UTC 2023","20541","","Материал","Конструктор теста","TestAddingQuestionsTests","CheckAddFileTestQuestion","Конструктор теста: можно добавить вопрос с типом ответа “Файл”",""
"passed","Thu Nov 16 06:08:49 UTC 2023","Thu Nov 16 06:08:57 UTC 2023","8636","Активность","Контрольная","Прохождение теста","TestActivityPassingTests","PassingTest","Прохождение теста: можно пройти тест командной контрольной",""
"passed","Thu Nov 16 06:10:31 UTC 2023","Thu Nov 16 06:10:34 UTC 2023","3656","","Чат","Групповой чат","GroupChatTests","CheckFindSentMessageInGroupChat","Список чатов - групповой чат: можно найти отправленное сообщение",""
"passed","Thu Nov 16 06:15:56 UTC 2023","Thu Nov 16 06:16:03 UTC 2023","6666","","Материал","Конструктор тест-тренажера","TestTrainSettingsValidationTests","RemoveAuthorInTestTrain","Конструктор теста-тренажера: можно удалить автора",""
"passed","Thu Nov 16 06:13:16 UTC 2023","Thu Nov 16 06:13:20 UTC 2023","3176","","Дисциплина","Шаблон дисциплины","DisTemplateTests","CheckCreateDisTemplateIfRequiredFieldsNotFilled","Создание шаблона дисциплины: невозможно создать шаблон, если не заполнены обязательные поля",""
"passed","Thu Nov 16 06:11:21 UTC 2023","Thu Nov 16 06:11:36 UTC 2023","14284","","Чат","Дисциплина","DisciplineChatTests","CheckPinLastMessageInDisciplineChat","Список чатов - комната дисциплины: можно закреплять сообщения",""
"skipped","Thu Nov 16 06:19:53 UTC 2023","Thu Nov 16 06:19:53 UTC 2023","303","","Библиотека","","LibraryMaterialTests","CheckVisibilityOfLaTeXMaterialPreview","Превью материала: LaTeX отображается как PDF",""
"passed","Thu Nov 16 06:07:12 UTC 2023","Thu Nov 16 06:07:21 UTC 2023","9074","","Активность","Обычная активность","ActivityDurationTests","CheckIfStartDateEmptyInAcivity","Редактирование активности: успешное сохранение, если заполнена только дата окончания",""
"passed","Thu Nov 16 06:08:56 UTC 2023","Thu Nov 16 06:09:09 UTC 2023","12751","Активность","Контрольная","Редактирование контрольной","TestActivityAddingTests","CheckAddTextMaterialToControlTypeActivity","Можно добавить материал типа Текст из Библиотеки в контрольной",""
"passed","Thu Nov 16 06:09:50 UTC 2023","Thu Nov 16 06:10:05 UTC 2023","14734","","Чат","Дисциплина","DisciplineChatTests","CheckEditLastMessageInDisciplineChat","Список чатов - комната дисциплины: можно редактировать сообщение в течение 4 часов после отправки",""
"passed","Thu Nov 16 06:12:37 UTC 2023","Thu Nov 16 06:12:41 UTC 2023","4262","","Дисциплина","Редактирование дисциплины","DisciplineEditingValidationTests","CheckImpossibilityTurnOnOrOffIOT","Редактирование дисциплины: невозможно отключить ИОТ, если в дисциплине есть активности",""
"passed","Thu Nov 16 06:15:30 UTC 2023","Thu Nov 16 06:15:45 UTC 2023","14535","","Библиотека","","LibraryInListViewTests","CheckRemoveCatalogViaActionsButton","Библиотека, списочный вид: можно удалить каталог через actions-кнопки",""
"passed","Thu Nov 16 06:13:19 UTC 2023","Thu Nov 16 06:13:28 UTC 2023","9545","","Дисциплина","Создание дисциплины","DisContingentCreationTests","CheckCreateDisciplineByCheckingBoxAllCohortStudents","Создание дисциплины: есть возможность создать дисциплину выбрав галку ‘Все студенты потока’",""
"passed","Thu Nov 16 06:15:25 UTC 2023","Thu Nov 16 06:15:34 UTC 2023","9335","","Материал","Конструктор теста","TestQuestionAnswersValidationTests","CheckEditCommentInTestAnswer","Конструктор теста: можно изменить комментарий к варианту ответа",""
"passed","Thu Nov 16 06:06:51 UTC 2023","Thu Nov 16 06:07:01 UTC 2023","9762","","Активность","Обычная активность","ActivityCreatingTests","CreateActivityWithoutModule","Cоздание активности: можно создать активность в дисциплине без модуля",""
"passed","Thu Nov 16 06:16:47 UTC 2023","Thu Nov 16 06:16:58 UTC 2023","10222","","Профиль","","AddressAndContactsEditingTests","CheckEmailField","Редактирование профиля пользователя: можно изменить email",""
"passed","Thu Nov 16 06:09:58 UTC 2023","Thu Nov 16 06:10:06 UTC 2023","8572","","Чат","Чат решения","TaskChatTests","CheckSendTextMessageInTaskChat","Список чатов - обсуждение решения: можно отправить текстовое сообщение",""
"passed","Thu Nov 16 06:16:20 UTC 2023","Thu Nov 16 06:16:26 UTC 2023","6001","","Материал","Конструктор тест-тренажера","TestTrainQuestionAnswersValidationTests","CheckRemoveAnswerFromSortingQuestionInTestTrain","Конструктор теста-тренажера: можно удалить опцию из вопроса с типом ответа 'Сортировка'",""
"passed","Thu Nov 16 06:15:13 UTC 2023","Thu Nov 16 06:15:25 UTC 2023","11738","","Материал","Конструктор теста","TestBlocksAndVariantsValidationTests","CheckAddTestBlock","Конструктор теста: можно добавить блок",""
"passed","Thu Nov 16 06:07:23 UTC 2023","Thu Nov 16 06:07:28 UTC 2023","5185","","Активность","Задание","TaskWithSolutionStudentTests","CheckSendSolutionForAnotherStudent","Нет возможности отправить решения за другого студента",""
"passed","Thu Nov 16 06:12:17 UTC 2023","Thu Nov 16 06:12:23 UTC 2023","5714","","Дисциплина","Редактирование дисциплины","DisciplineEditingTests","CheckSetNameField","Редактирование дисциплины: можно изменить название",""
"passed","Thu Nov 16 06:08:42 UTC 2023","Thu Nov 16 06:08:48 UTC 2023","6526","Активность","Контрольная","Редактирование контрольной","TestActivityEditingTests","CheckSuccessSaveWithCorrectValueInNumbOfAttemptsField","Успешное сохранение при корректных значениях в поле Количество попыток сдачи",""
"passed","Thu Nov 16 06:08:47 UTC 2023","Thu Nov 16 06:08:56 UTC 2023","9468","Активность","Контрольная","Прохождение теста","TestActivityStatusWithTwoOrMoreAttemptsTests","StatusExistIfAtLeastOneCompletedAttempt","Страница командной контрольной: статус отображается, если есть хотя бы одна завершенная попытка",""
"passed","Thu Nov 16 06:12:46 UTC 2023","Thu Nov 16 06:12:50 UTC 2023","4617","","Дисциплина","Редактирование дисциплины","DisciplineEditingTests","CheckSetDescriptionField","Редактирование дисциплины: можно изменить описание",""
"passed","Thu Nov 16 06:13:21 UTC 2023","Thu Nov 16 06:13:25 UTC 2023","3881","","Дисциплина","Страница дисциплины","DisciplineAnalyticsTests","CheckStubIsDisplayedIfNoStudentsInDiscipline","Страница аналитика дисциплины: отображается заглушка, если в дисциплине нет студентов или активностей",""
"passed","Thu Nov 16 06:15:38 UTC 2023","Thu Nov 16 06:15:48 UTC 2023","10094","","Материал","Конструктор тест-тренажера","TestTrainSettingsValidationTests","EditTestTrainDescription","Конструктор теста-тренажера: можно изменить описание теста-тренажера",""
"passed","Thu Nov 16 06:12:59 UTC 2023","Thu Nov 16 06:13:03 UTC 2023","3958","","Дисциплина","Страница дисциплины","DisciplineStudentTests","CheckGradingByStudent","Страница оценок дисциплины: невозможности выставления оценки студентом",""
"passed","Thu Nov 16 06:08:48 UTC 2023","Thu Nov 16 06:08:49 UTC 2023","1452","","Активность","Обычный шаблон активности","TemplateEditingValidationTests","CheckNotExistScormResultScoreField","Редактирование шаблона активности: отсутствует поля 'Оценка по SCORM результату', если добавлен SCORM пакет в шаблон активности типов кроме контрольной",""
"passed","Thu Nov 16 06:15:11 UTC 2023","Thu Nov 16 06:15:23 UTC 2023","12310","","Библиотека","","LibraryInTileViewTests","CheckRemoveMaterialInTileView","Библиотека, плиточный вид: можно удалить материал",""
"passed","Thu Nov 16 06:09:37 UTC 2023","Thu Nov 16 06:09:45 UTC 2023","8355","","Активность","Шаблон активности контрольной","TestTemplateEditingTests","CheckEditScoreValueInControlActivityPlan","Можно переключать значения в поле Оценка в шаблон контрольной",""
"passed","Thu Nov 16 06:15:43 UTC 2023","Thu Nov 16 06:15:48 UTC 2023","4268","","Организация","Редактирование организации","OrganizationEditingTests","CheckCancelOrganizationEditing","Редактирование организации: работает кнопка Отмена",""
"passed","Thu Nov 16 06:16:50 UTC 2023","Thu Nov 16 06:16:56 UTC 2023","5578","","Расписание","","ScheduleTests","CheckThreeDayModeIsNotDisplayed","В десктопе нет возможности выбрать режим 3 дня",""
"passed","Thu Nov 16 06:07:10 UTC 2023","Thu Nov 16 06:07:20 UTC 2023","9584","","Активность","Обычная активность","ActivityCreatingTests","CreateActivityInTopic","Cоздание активности: можно создать активность в дисциплине в теме",""
"passed","Thu Nov 16 06:11:14 UTC 2023","Thu Nov 16 06:11:18 UTC 2023","4024","","Поток","Редактирование потока","CohortEditingValidationTests","CheckEditCohortIfEachDateNotFilled","Редактирование потока: ошибка валидации, если дата начала не заполнена",""
"passed","Thu Nov 16 06:13:33 UTC 2023","Thu Nov 16 06:13:45 UTC 2023","11591","","Библиотека","","LibraryInTileViewTests","CheckRenameCatalog","Библиотека, плиточный вид: можно переименовать каталог",""
"passed","Thu Nov 16 06:13:27 UTC 2023","Thu Nov 16 06:13:34 UTC 2023","6583","","Дисциплина","Шаблон дисциплины","DisTemplateTests","CheckAddTopicInDisTemplate","Страница шаблона дисциплины: можно добавить тему",""
"passed","Thu Nov 16 06:09:02 UTC 2023","Thu Nov 16 06:09:09 UTC 2023","6969","Активность","Контрольная","Редактирование контрольной","TestActivityEditingTests","CheckSuccessSaveWithCorrectValueInTimeLimitField","Успешное сохранение при корректных значениях в поле Временной лимит",""
"passed","Thu Nov 16 06:16:25 UTC 2023","Thu Nov 16 06:16:29 UTC 2023","4310","","Расписание","","ScheduleSettingsTests","CheckDisconnectSyncWithGoogleCalendar","Проверка отключения синхронизации с Google календарем",""
"passed","Thu Nov 16 06:10:05 UTC 2023","Thu Nov 16 06:10:16 UTC 2023","10915","","Чат","Дисциплина","DisciplineChatTests","CheckAddQuoteToLastMessageInDisciplineChat","Список чатов - комната дисциплины: можно цитировать сообщению",""
"passed","Thu Nov 16 06:10:40 UTC 2023","Thu Nov 16 06:10:52 UTC 2023","11906","","Поток","Редактирование потока","CohortEditingTests","CheckEditCohortWhenAllRequiredFieldsAreFilled","Редактирование потока: успешное сохранение, если все обязательные поля корректно заполнены",""
"passed","Thu Nov 16 06:14:24 UTC 2023","Thu Nov 16 06:14:35 UTC 2023","10931","","Дисциплина","Редактирование дисциплины","DisContingentEditingTests","CheckRemoveGroupAndStudentFromDiscipline","Редактирование дисциплины: открепления от дисциплины групп и студентов",""
"passed","Thu Nov 16 06:15:49 UTC 2023","Thu Nov 16 06:16:06 UTC 2023","17162","","Материал","Конструктор тест-тренажера","TestTrainAddingQuestionsTests","CheckAddQuestionInTestTrainCompare","Конструктор теста-тренажера: можно добавить вопрос с типом ответа “Сопоставление”",""
"passed","Thu Nov 16 06:09:28 UTC 2023","Thu Nov 16 06:09:30 UTC 2023","1815","Активность","Контрольная","Редактирование контрольной","TestActivityEditingTests","CheckErrorIsAppearIfRemoveTestActivityWithScore","Невозможно удалить контрольную при наличии оценок",""
"passed","Thu Nov 16 06:09:59 UTC 2023","Thu Nov 16 06:10:06 UTC 2023","6961","Активность","Контрольная","Результат прохождения теста","TestActivityResultTests","MarkCorrectAnswerThatWasMarkedAsIncorrect","Результат прохождения: можно отметить 'Верно' ответ вопроса, который был отмечен как 'Не верно'",""
"passed","Thu Nov 16 06:07:40 UTC 2023","Thu Nov 16 06:07:51 UTC 2023","10753","","Активность","Задание","TaskActivityMulticriteriaTests","CheckCreateTaskWithValuesInCriteria","Можно задать значения критерия (заполнены поля значения и баллов)",""
"passed","Thu Nov 16 06:16:07 UTC 2023","Thu Nov 16 06:16:10 UTC 2023","2992","","Программа","","ProgramEditingTests","CheckRemoveProgramWithoutCohort","Редактирование программы ДО: можно удалить программу без потоков",""
"passed","Thu Nov 16 06:12:26 UTC 2023","Thu Nov 16 06:12:32 UTC 2023","6241","","Дисциплина","Страница дисциплины","DisciplineMarksAndAttendanceTests","CheckFinalGradesByTeacher","Страница оценок дисциплины: работает кнопка 'Итоговые оценки (ведомость)' у преподавателя",""
"passed","Thu Nov 16 06:12:19 UTC 2023","Thu Nov 16 06:12:23 UTC 2023","3348","","Чат","Групповой чат","GroupChatTests","CheckAddGroupChatRoomWithoutName","Список чатов - групповой чат: невозможно добавить чат, если не заполнен поля 'Название'",""
"passed","Thu Nov 16 06:16:03 UTC 2023","Thu Nov 16 06:16:10 UTC 2023","6851","","Материал","Конструктор тест-тренажера","TestTrainSettingsValidationTests","AddTagInTestTrain","Конструктор теста-тренажера: можно добавлять теги знаний",""
"passed","Thu Nov 16 06:11:26 UTC 2023","Thu Nov 16 06:11:35 UTC 2023","9142","","Чат","Чат для заметок","NotesChatTests","CheckSendEmojiInNotesChat","Список чатов - чат для заметок: можно отправить смайлики",""
"passed","Thu Nov 16 06:11:02 UTC 2023","Thu Nov 16 06:11:05 UTC 2023","3329","","Чат","Дисциплина","DisciplineChatTests","CheckOpenImageInDisciplineChat","Список чатов - комната дисциплины: можно раскрывать изображения",""
"passed","Thu Nov 16 06:10:52 UTC 2023","Thu Nov 16 06:10:57 UTC 2023","4919","","Чат","Групповой чат","GroupChatTests","CheckFindGroupChatByNameInSearch","Список чатов - групповой чат: можно найти чат в поиске по названию",""
"passed","Thu Nov 16 06:10:29 UTC 2023","Thu Nov 16 06:10:35 UTC 2023","5849","","Поток","Создание потока","CohortCreationValidationTests","CheckCreateCohortIfEachDateNotFilled","Создание потока: ошибка валидации, если дата окончания  не указана",""
"passed","Thu Nov 16 06:16:22 UTC 2023","Thu Nov 16 06:16:33 UTC 2023","10814","","Профиль","","AddressAndContactsEditingTests","CheckCountryField","Редактирование профиля пользователя: можно изменить страну",""
"passed","Thu Nov 16 06:09:47 UTC 2023","Thu Nov 16 06:10:13 UTC 2023","25936","","Звонок","","CallTests","CheckGreenFrameIsDisplayedOnAnotherUsersCard","Страница звонка: отображается зеленая рамка у карточки собеседника при разговоре",""
"passed","Thu Nov 16 06:11:11 UTC 2023","Thu Nov 16 06:11:26 UTC 2023","14922","","Чат","Групповой чат","GroupChatTests","CheckPinLastMessageInGroupChat","Список чатов - групповой чат: можно закреплять сообщения",""
"passed","Thu Nov 16 06:16:27 UTC 2023","Thu Nov 16 06:16:38 UTC 2023","10916","","Профиль","","UserInfoPageTests","CheckAddUserPhotoButtonIsClickable","Страница профиля пользователя: можно загрузить фото",""
"passed","Thu Nov 16 06:16:14 UTC 2023","Thu Nov 16 06:16:25 UTC 2023","10899","","Программа","","ProgramCreationTests","CreateAdditionalProgramFillAllFields","Cоздание обр программы ДПО: если заполнить все поля",""
"passed","Thu Nov 16 06:15:01 UTC 2023","Thu Nov 16 06:15:07 UTC 2023","6456","","Материал","Конструктор теста","TestSettingsValidationTests","AddTagInTest","Конструктор теста: можно добавлять теги знаний",""
"passed","Thu Nov 16 06:13:19 UTC 2023","Thu Nov 16 06:13:29 UTC 2023","10813","","Дисциплина","Редактирование дисциплины","DisContingentEditingValidationTests","CheckAddStudentsInTeachersField","Редактирование дисциплины: наличия ошибки при попытке указать преподавателем студента из поля 'Студенты'",""
"passed","Thu Nov 16 06:16:29 UTC 2023","Thu Nov 16 06:16:36 UTC 2023","7050","","Расписание","","ScheduleSettingsTests","CheckSyncErrorWithGoogleCalendarIsAppear","Проверка некорректного подключения к синхронизации с Google календарем",""
"passed","Thu Nov 16 06:11:54 UTC 2023","Thu Nov 16 06:11:59 UTC 2023","5234","","Дисциплина","Редактирование дисциплины","DisciplineAccessTests","CheckIfAdminEducProgChangeDiscipline","Редактирование дисциплины: есть возможность редактировать у администратора образовательной программы, к которой дисциплина относится",""
"passed","Thu Nov 16 06:15:39 UTC 2023","Thu Nov 16 06:15:49 UTC 2023","10433","","Материал","Конструктор тест-тренажера","TestTrainQuestionsValidationTests","EditCommentInTestTrainQuestion","Конструктор теста-тренажера: можно изменить комментарий к вопросу",""
"passed","Thu Nov 16 06:19:20 UTC 2023","Thu Nov 16 06:19:27 UTC 2023","6632","","Активность","Обычный шаблон активности","TemplateEditingValidationTests","CheckNegativeEditVolumeActivityTemplate","Редактирование шаблона активности: отображение ошибки валидации для поля 'Объём' с значением '0'",""
"passed","Thu Nov 16 06:16:40 UTC 2023","Thu Nov 16 06:16:42 UTC 2023","2691","","Профиль","","AddressAndContactsEditingTests","CheckBlockContactFieldsBeforeInterPassword","Редактирование профиля пользователя: поля 'Контакты' заблокированы до ввода пароля",""
"passed","Thu Nov 16 06:07:16 UTC 2023","Thu Nov 16 06:07:25 UTC 2023","9112","","Активность","Задание","TaskActivityMulticriteriaTests","CheckCreateTaskWithoutNameOfCriteria","Нельзя создать задание с критериями, если не заполнены названия критериев",""
"passed","Thu Nov 16 06:09:21 UTC 2023","Thu Nov 16 06:09:35 UTC 2023","13846","","Звонок","","CallTests","CheckTurnOnOffEquipmentInCall","Страница звонка: можно включить/отключить камеру в звонке",""
