"Status","Start Time","Stop Time","Duration in ms","Parent Suite","Suite","Sub Suite","Test Class","Test Method","Name","Description"
"passed","Tue Feb 06 01:34:15 UTC 2024","Tue Feb 06 01:34:30 UTC 2024","14835","","Дисциплина","Страница дисциплины","DisciplineMarksAndAttendanceTests","CheckGradingByTeacher","Выставление оценки преподавателем в дисциплине",""
"passed","Tue Feb 06 01:32:27 UTC 2024","Tue Feb 06 01:32:46 UTC 2024","18929","","Чат","Мини-чат личного звонка","PersonalChatCallTests","CheckSendEmojiInPersonalCallChat","можно отправить смайлики",""
"passed","Tue Feb 06 01:27:26 UTC 2024","Tue Feb 06 01:27:34 UTC 2024","7477","Активность","Контрольная","Результат прохождения теста","TestActivityResultTests","CheckMarkIncorrectAnswerThatWasMarkedAsCorrect","Можно отметить Неверно на ответ в вопросе, который был отмечен как Верно",""
"passed","Tue Feb 06 01:33:42 UTC 2024","Tue Feb 06 01:33:47 UTC 2024","5152","","Поток","Страница потока","CohortInfoTests","CheckNoAccessStudentToMaterialsCohortArchive","Страница потока: студенты не имеют доступ к материалам архивного потока по прямой ссылки",""
"passed","Tue Feb 06 01:25:37 UTC 2024","Tue Feb 06 01:25:49 UTC 2024","12052","","Активность","Обычная активность","ActivityAddingTests","CheckAddTestNotInControlTypeActivity","Наличия ошибки при добавлении теста из Библиотеки не в Контрольную",""
"passed","Tue Feb 06 01:25:21 UTC 2024","Tue Feb 06 01:25:37 UTC 2024","15493","","Активность","Обычная активность","ActivityAddingTests","CheckAddTextMaterialToActivity","Можно добавить материал типа Текст из Библиотеки в активность",""
"passed","Tue Feb 06 01:32:20 UTC 2024","Tue Feb 06 01:32:26 UTC 2024","5690","","Поток","Создание потока","CohortCreationWarningModalTests","CheckCreateCohortWithMismatchWarningOfDuration","Создание потока: предупреждение о несоответствии длительности потока для программ длительностью 144 часа",""
"passed","Tue Feb 06 01:34:38 UTC 2024","Tue Feb 06 01:34:44 UTC 2024","5368","","Дисциплина","Создание дисциплины","DisContingentCreationValidationTests","CheckUnableAddGroupFromAnotherCohortInCreation","Невозможно добавить группу из стороннего потока",""
"passed","Tue Feb 06 01:26:32 UTC 2024","Tue Feb 06 01:26:45 UTC 2024","12892","Активность","Контрольная","Редактирование контрольной","TestActivityAddingTests","CheckAddTestTrainToControlTypeActivity","Можно добавить материал типа Тест-тренажёр из Библиотеки в контрольную",""
"passed","Tue Feb 06 01:37:46 UTC 2024","Tue Feb 06 01:37:55 UTC 2024","8820","","Материал","Конструктор тест-тренажера","TestTrainSettingsValidationTests","EditTestTrainDescription","Конструктор теста-тренажера: можно изменить описание теста-тренажера",""
"passed","Tue Feb 06 01:34:48 UTC 2024","Tue Feb 06 01:34:58 UTC 2024","9727","","Дисциплина","Создание дисциплины","DisciplineCreationTests","CreatDisciplineFromDisciplineTemplateWithActivities","Можно создать дисциплину ВО из шаблона дисциплины с активностями",""
"passed","Tue Feb 06 01:33:33 UTC 2024","Tue Feb 06 01:33:38 UTC 2024","5056","","Дисциплина","Страница дисциплины","DisciplineAnalyticsTests","CheckThreeDotMenuOnAnalyticsTabIsDisplayed","Наличие тридот меню на вкладке ‘Аналитика’",""
"passed","Tue Feb 06 01:35:31 UTC 2024","Tue Feb 06 01:35:36 UTC 2024","5672","","Подразделения","Создание подразделения","DivisionCreationTests","CheckCancelCreateDivision","Проверка кнопки Отмена при создании подразделения",""
"passed","Tue Feb 06 01:37:37 UTC 2024","Tue Feb 06 01:37:46 UTC 2024","8366","","Материал","Конструктор тест-тренажера","TestTrainQuestionAnswersValidationTests","CheckAddOneMoreAnswerVariantInQuestionWithFreeAnswerExactMatchInTestTrain","Конструктор теста-тренажера: можно добавить еще один вариант ответа в вопрос с типом ответа 'Свободный ответ - точное совпадение'",""
"passed","Tue Feb 06 01:38:12 UTC 2024","Tue Feb 06 01:38:31 UTC 2024","18661","","Материал","Конструктор тест-тренажера","TestTrainAddingQuestionsTests","CheckAddQuestionInTestTrainSort","Конструктор теста-тренажера: можно добавить вопрос с типом ответа “Сортировка”",""
"passed","Tue Feb 06 01:27:01 UTC 2024","Tue Feb 06 01:27:12 UTC 2024","10684","Активность","Контрольная","Прохождение теста","TestActivityPassingTests","CheckAfterPassingTestNumOfAttemptsDecreasedByOne","После прохождения теста количество попыток уменьшилось на единицу",""
"passed","Tue Feb 06 01:33:55 UTC 2024","Tue Feb 06 01:34:02 UTC 2024","6456","","Дисциплина","Страница дисциплины","DisciplineAnalyticsTests","CheckOpenNotificationMailingListFromAnalytics","Можно перейти в рассылку уведомлений из аналитики дисциплины",""
"passed","Tue Feb 06 01:34:25 UTC 2024","Tue Feb 06 01:34:29 UTC 2024","3396","","Дисциплина","Страница дисциплины","DisciplineRightMenuTests","CheckEditButtonForTeacher","Работает кнопка 'Редактировать' для преподавателя",""
"passed","Tue Feb 06 01:26:44 UTC 2024","Tue Feb 06 01:26:48 UTC 2024","4788","","Активность","Обычный шаблон активности","TemplateEditingTests","CheckClearAddedTagsFromActivityTemplate","Можно очистить теги знаний из шаблона активности",""
"passed","Tue Feb 06 01:30:37 UTC 2024","Tue Feb 06 01:30:42 UTC 2024","4772","","Чат","Групповой чат","GroupChatTests","CheckFindGroupChatByNameInSearch","можно найти чат в поиске по названию",""
"passed","Tue Feb 06 01:29:20 UTC 2024","Tue Feb 06 01:29:35 UTC 2024","15524","","Чат","Мини-чат звонка дисциплины","DisciplineRoomChatCallTests","CheckFindSentMessageInDisciplineRoomCallChat","можно найти отправленное сообщение",""
"passed","Tue Feb 06 01:26:15 UTC 2024","Tue Feb 06 01:26:18 UTC 2024","3700","Активность","Задание","Страница решения задания для студента","TaskWithSolutionStudentTests","CheckSendSolutionForAnotherStudent","Нет возможности отправить решение за другого студента",""
"passed","Tue Feb 06 01:33:19 UTC 2024","Tue Feb 06 01:33:39 UTC 2024","19695","","Чат","Мини-чат личного чата","PersonalMiniChatTests","CheckPinLastMessageInPersonalMiniChat","Можно закреплять сообщения в личном чате из миничата",""
"passed","Tue Feb 06 01:31:22 UTC 2024","Tue Feb 06 01:31:33 UTC 2024","11662","","Чат","Мини-чат личного чата","PersonalMiniChatTests","CheckSendTextMessageInPersonalMiniChat","можно отправить текстовое сообщение",""
"passed","Tue Feb 06 01:32:03 UTC 2024","Tue Feb 06 01:32:13 UTC 2024","9209","","Чат","Мини-чат страницы решений","TaskPageMiniChatTests","CheckSendTextMessageInTaskPageMiniChat","можно отправить текстовое сообщение",""
"passed","Tue Feb 06 01:32:16 UTC 2024","Tue Feb 06 01:32:17 UTC 2024","1481","","Поток","Создание потока","CohortCreationTests","CheckCancelCohortCreationByDirectLink","Создание потока ВО: работает кнопка 'Отмена', если страница создание был открыть по прямой ссылке",""
"skipped","Tue Feb 06 01:42:40 UTC 2024","Tue Feb 06 01:42:40 UTC 2024","386","","Библиотека","","LibraryMaterialTests","CheckVisibilityOfLaTeXMaterialPreview","Превью материала: LaTeX отображается как PDF",""
"passed","Tue Feb 06 01:28:24 UTC 2024","Tue Feb 06 01:28:35 UTC 2024","11001","","Чат","Дисциплина","DisciplineRoomChatTests","CheckAddQuoteToLastMessageInDisciplineRoomChat","можно цитировать сообщению",""
"passed","Tue Feb 06 01:32:07 UTC 2024","Tue Feb 06 01:32:22 UTC 2024","15047","","Чат","Чат решения","TaskChatTests","CheckEditLastMessageInTaskChat","можно редактировать сообщение в течение 4 часов после отправки",""
"passed","Tue Feb 06 01:33:41 UTC 2024","Tue Feb 06 01:33:53 UTC 2024","12047","","Чат","Мини-чат решения","TaskMiniChatTests","CheckSendMessageByTappingEnterInTaskMiniChat","можно отправить сообщения по нажатию на Enter",""
"passed","Tue Feb 06 01:32:31 UTC 2024","Tue Feb 06 01:32:38 UTC 2024","6604","","Поток","Создание потока","CohortCreationWarningModalTests","CheckCreateCohortWithoutMismatchWarningOfDuration","Создание потока: нет предупреждения о несоответствии длительности потока для программ длительностью кроме 72, 144 и 256 часов",""
"passed","Tue Feb 06 01:33:51 UTC 2024","Tue Feb 06 01:34:03 UTC 2024","11474","","Дисциплина","Создание дисциплины","DisciplineCreationTests","CreatDisciplineIfReqFieldsAreFilled","Можно создать дисциплину ВО, если заполнены обязательные поля",""
"passed","Tue Feb 06 01:33:07 UTC 2024","Tue Feb 06 01:33:14 UTC 2024","6867","","Чат","Мини-чат страницы решений","TaskPageMiniChatTests","CheckSendMessageByTappingEnterInTaskPageMiniChat","можно отправить сообщения по нажатию на Enter",""
"passed","Tue Feb 06 01:31:59 UTC 2024","Tue Feb 06 01:32:07 UTC 2024","7557","","Чат","Чат решения","TaskChatTests","CheckSendEmptyMessageInTaskChat","невозможно отправить пустое сообщение",""
"passed","Tue Feb 06 01:26:14 UTC 2024","Tue Feb 06 01:26:16 UTC 2024","1999","","Активность","Обычная активность","ActivityEditingTests","CheckDeleteActivityWithGrades","Невозможно удалить активность с оценками",""
"passed","Tue Feb 06 01:27:39 UTC 2024","Tue Feb 06 01:27:49 UTC 2024","10557","Активность","Контрольная","Прохождение теста","TestActivityStatusWithOneAttemptTests","CheckStatusChangesIfMinThresholdChanged","Статус меняется, если преподаватель меняет минимальный порог баллов в командной контрольной",""
"passed","Tue Feb 06 01:31:06 UTC 2024","Tue Feb 06 01:31:09 UTC 2024","3668","","Чат","Мини-чат группового чата","GroupMiniChatTests","CheckOpenImageInGroupMiniChat","можно раскрывать изображения",""
"passed","Tue Feb 06 01:37:23 UTC 2024","Tue Feb 06 01:37:33 UTC 2024","9129","","Материал","Конструктор теста","TestQuestionsValidationTests","CheckAndUncheckAnswerOptionInTest","Конструктор теста: возможность отметить вариант ответа как “верный”",""
"passed","Tue Feb 06 01:38:00 UTC 2024","Tue Feb 06 01:38:01 UTC 2024","1605","","Материал","Конструктор тест-тренажера","TestTrainBlocksAndVariantsValidationTests","ImpossibleToAddVariantInTestTrain","Конструктор теста-тренажера: отсутствует возможность добавить вариант",""
"passed","Tue Feb 06 01:32:21 UTC 2024","Tue Feb 06 01:32:28 UTC 2024","6780","","Чат","Личный чат","PersonalChatTests","CheckSendMessageByTappingEnterInPersonalChat","можно отправить сообщения по нажатию на Enter",""
"passed","Tue Feb 06 01:30:42 UTC 2024","Tue Feb 06 01:31:01 UTC 2024","18719","","Чат","Мини-чат звонка дисциплины","DisciplineRoomChatCallTests","CheckAddReactionToLastMessageInDisciplineRoomCallChat","можно добавить реакцию на сообщение",""
"passed","Tue Feb 06 01:35:17 UTC 2024","Tue Feb 06 01:35:24 UTC 2024","7649","","Дисциплина","Создание дисциплины","DisciplineCreationValidationTests","CheckIfCreditValuesNotAllowed","Отображение ошибки валидации для поля 'Кредиты' со значением > 15 в ВО",""
"passed","Tue Feb 06 01:36:38 UTC 2024","Tue Feb 06 01:36:45 UTC 2024","7460","","Дисциплина","Дисциплина с ИОТ","IOTGraphTests","CheckExpandBlockToFullScreen","Страница дисциплины с ИОТ: можно развернуть граф на весь экран",""
"passed","Tue Feb 06 01:27:06 UTC 2024","Tue Feb 06 01:27:15 UTC 2024","8388","Активность","Шаблон активности контрольной","Редактирование шаблона контрольной","TestTemplateAddingTests","CheckAddFileToControlActivityPlan","Можно загрузить материал типа Файл с компьютера в шаблон контрольной",""
"passed","Tue Feb 06 01:25:58 UTC 2024","Tue Feb 06 01:26:01 UTC 2024","3087","","Активность","Обычный шаблон активности","TemplateAddingTests","CheckScormScoreFieldNotDisplayed","Отсутствует поле Оценка по SCORM результату, если SCORM пакет не добавлен в шаблон активности",""
"passed","Tue Feb 06 01:25:17 UTC 2024","Tue Feb 06 01:25:27 UTC 2024","10064","","Активность","Обычная активность","ActivityDurationTests","CheckIfEndDateEmptyInAcivity","Успешное сохранение, если заполнена только дата начала",""
"passed","Tue Feb 06 01:38:07 UTC 2024","Tue Feb 06 01:38:09 UTC 2024","1911","","Организация","Страница организации","OrganizationPageTests","CheckTooltipIsDisplayedByHoverProjectIcon","Страница организации: отображается тултип при наведении на иконку участника проекта",""
"passed","Tue Feb 06 01:38:29 UTC 2024","Tue Feb 06 01:38:32 UTC 2024","3361","","Программа","","ProgramCreationTests","AddEducationProgaramWithError","Если не заполнить одно обязательное поле у программы ВО",""
"passed","Tue Feb 06 01:38:41 UTC 2024","Tue Feb 06 01:38:50 UTC 2024","8053","","Расписание","","StudentScheduleSettingsTests","CheckDisplayOfCompletedActivities","Проверка отображения пройденных активностей под студентом",""
"passed","Tue Feb 06 01:26:05 UTC 2024","Tue Feb 06 01:26:14 UTC 2024","8755","","Активность","Обычная активность","ActivityEditingTests","CheckDeleteActivityWithoutGrades","Можно удалить активность без оценок",""
"passed","Tue Feb 06 01:39:16 UTC 2024","Tue Feb 06 01:39:20 UTC 2024","4202","","Профиль","","UserInfoPageTests","CheckStudentCanOpenPageOfPassedActivities","Страница профиля пользователя: под студентом можно перейти на страницу пройденных активностей",""
"passed","Tue Feb 06 01:34:07 UTC 2024","Tue Feb 06 01:34:21 UTC 2024","13928","","Чат","Мини-чат решения","TaskMiniChatTests","CheckDeleteMessageInTaskMiniChat","можно удалить сообщение",""
"passed","Tue Feb 06 01:28:25 UTC 2024","Tue Feb 06 01:28:30 UTC 2024","5089","","Чат","Дисциплина","DisciplineChatTests","CheckFindSentMessageInDisciplineChat","Можно найти отправленное сообщение",""
"passed","Tue Feb 06 01:29:44 UTC 2024","Tue Feb 06 01:29:57 UTC 2024","13201","","Чат","Мини-чат звонка дисциплины","DisciplineChatCallTests","CheckOpenImageInDisciplineCallChat","можно раскрывать изображения",""
"passed","Tue Feb 06 01:38:03 UTC 2024","Tue Feb 06 01:38:09 UTC 2024","6264","","Материал","Конструктор тест-тренажера","TestTrainSettingsValidationTests","RemoveAuthorInTestTrain","Конструктор теста-тренажера: можно удалить автора",""
"passed","Tue Feb 06 01:36:57 UTC 2024","Tue Feb 06 01:37:07 UTC 2024","9570","","Материал","Конструктор теста","TestBlocksAndVariantsValidationTests","CheckMigrateTestQuestion","Конструктор теста: можно перенести вопрос в другой вариант",""
"passed","Tue Feb 06 01:31:00 UTC 2024","Tue Feb 06 01:31:18 UTC 2024","17830","","Чат","Мини-чат звонка дисциплины","DisciplineChatCallTests","CheckDeleteMessageInDisciplineCallChat","можно удалить сообщение",""
"passed","Tue Feb 06 01:32:13 UTC 2024","Tue Feb 06 01:32:27 UTC 2024","13875","","Чат","Мини-чат решения","TaskMiniChatTests","CheckSendEmptyMessageInTaskMiniChat","невозможно отправить пустое сообщение",""
"passed","Tue Feb 06 01:39:06 UTC 2024","Tue Feb 06 01:39:09 UTC 2024","2649","","Расписание","","ScheduleTests","CheckMonthModeIsNotDisplayedInMobileVersion","В мобильной версии нет возможности выбрать режим Месяц",""
"passed","Tue Feb 06 01:38:03 UTC 2024","Tue Feb 06 01:38:06 UTC 2024","2853","","Организация","Мой тариф","MyPlanOrganizationPageTests","CheckClickOnLinkActivyUsers","Страница Мой тариф: проверка перехода в профиль пользователя из таблицы активных пользователей",""
"passed","Tue Feb 06 01:32:48 UTC 2024","Tue Feb 06 01:32:57 UTC 2024","8528","","Поток","Создание потока","CohortCreationWarningModalTests","CheckCreateCohortIgnoringMismatchWarningOfDuration","Создание потока: можно создать поток без исправления длительности потока",""
"passed","Tue Feb 06 01:28:52 UTC 2024","Tue Feb 06 01:29:07 UTC 2024","15315","","Чат","Мини-чат звонка дисциплины","DisciplineChatCallTests","CheckFindSentMessageInDisciplineCallChat","можно найти отправленное сообщение",""
"passed","Tue Feb 06 01:35:05 UTC 2024","Tue Feb 06 01:35:13 UTC 2024","7948","","Дисциплина","Шаблон дисциплины","DisTemplateTests","CheckCreateDisTemplateWithFillingAllFields","Можно создать шаблон дисциплины, если заполнены все поля",""
"passed","Tue Feb 06 01:26:19 UTC 2024","Tue Feb 06 01:26:31 UTC 2024","11793","Активность","Контрольная","Создание контрольной","TestActivityCreatingTests","CheckCreateActivityBySpecifyingControlMode","Можно создать контрольную с режимом выполнения Командный",""
"passed","Tue Feb 06 01:27:27 UTC 2024","Tue Feb 06 01:27:39 UTC 2024","11501","Активность","Контрольная","Прохождение теста","TestActivityStatusWithOneAttemptTests","CheckStatusChangesIfMinThresholdChanged","Статус меняется, если преподаватель меняет минимальный порог баллов в индивидуальной контрольной",""
"passed","Tue Feb 06 01:27:02 UTC 2024","Tue Feb 06 01:27:14 UTC 2024","12182","Активность","Контрольная","Прохождение теста","TestActivityStatusWithOneAttemptTests","CheckStatusIsPendingReviewForAttemptsNeedsReview","Статус Ожидает проверки, если в попытке есть хотя бы один вопрос, требующий проверки в индивидуальной контрольной",""
"passed","Tue Feb 06 01:31:52 UTC 2024","Tue Feb 06 01:32:11 UTC 2024","18680","","Чат","Мини-чат для заметок","NotesMiniChatTests","CheckPinLastMessageInNotesMiniChat","можно закреплять сообщения",""
"passed","Tue Feb 06 01:34:09 UTC 2024","Tue Feb 06 01:34:12 UTC 2024","2962","","Дисциплина","Редактирование дисциплины","DisciplineEditingValidationTests","CheckIfDescriptionNotFilledInEditing","Отображение ошибки валидации для поля Описание, если поле не заполнено в дисциплине ДО",""
"passed","Tue Feb 06 01:29:43 UTC 2024","Tue Feb 06 01:29:50 UTC 2024","7652","","Чат","Дисциплина","DisciplineChatTests","CheckMembersOfDisciplineChatIsDisplayed","Отображаются участники чата при клике на блок с аватарками",""
"passed","Tue Feb 06 01:30:01 UTC 2024","Tue Feb 06 01:30:15 UTC 2024","14101","","Чат","Групповой чат","GroupChatTests","CheckCallInGroupChat","можно сделать звонок",""
"passed","Tue Feb 06 01:28:21 UTC 2024","Tue Feb 06 01:28:35 UTC 2024","13813","","Чат","Мини-чат дисциплины","DisciplineMiniChatTests","CheckAddQuoteToLastMessageInDisciplineMiniChat","можно цитировать сообщению",""
"passed","Tue Feb 06 01:26:26 UTC 2024","Tue Feb 06 01:26:33 UTC 2024","6234","Активность","Контрольная","Редактирование контрольной","TestActivityEditingTests","CheckSuccessSaveWithCorrectValueInNumbOfAttemptsField","Успешное сохранение при корректных значениях в поле Количество попыток сдачи",""
"passed","Tue Feb 06 01:42:49 UTC 2024","Tue Feb 06 01:42:52 UTC 2024","2787","","Дисциплина","Редактирование дисциплины","DisciplineEditingValidationTests","CheckIfCreditNotFilled","Отображение ошибки валидации для поля Кредиты с значением > 15 в дисциплине ДО",""
"passed","Tue Feb 06 01:29:33 UTC 2024","Tue Feb 06 01:29:43 UTC 2024","10209","","Чат","Мини-чат дисциплины","DisciplineMiniChatTests","CheckAddReactionToLastMessageInDisciplineMiniChat","можно добавить реакцию на сообщение",""
"passed","Tue Feb 06 01:31:35 UTC 2024","Tue Feb 06 01:31:37 UTC 2024","2315","","Чат","Мини-чат для заметок","NotesMiniChatTests","CheckOpenImageInNotesMiniChat","можно раскрывать изображения",""
"passed","Tue Feb 06 01:30:48 UTC 2024","Tue Feb 06 01:31:07 UTC 2024","18607","","Чат","Мини-чат личного звонка","PersonalChatCallTests","CheckSendTextMessageInPersonalCallChat","можно отправить текстовое сообщение",""
"passed","Tue Feb 06 01:25:22 UTC 2024","Tue Feb 06 01:25:29 UTC 2024","7449","","Активность","Обычная активность","ActivityEditingFormatTests","CheckActivityFormatIndependancyStudy","Проверка формата активности 'Самостоятельное изучение'",""
"passed","Tue Feb 06 01:38:19 UTC 2024","Tue Feb 06 01:38:40 UTC 2024","20485","","Материал","Конструктор теста","TestAddingQuestionsTests","CheckAddSortingTestQuestion","Конструктор теста: можно добавить вопрос с типом ответа “Сортировка”",""
"passed","Tue Feb 06 01:26:46 UTC 2024","Tue Feb 06 01:26:55 UTC 2024","9577","Активность","Контрольная","Результат прохождения теста","TestActivityResultTests","CheckTeacherCanLeaveCommentOnAnswer","Преподаватель может оставить комментарий к ответу, если была отмечена галка Отображать студентам подробную информацию о результатах",""
"passed","Tue Feb 06 01:35:29 UTC 2024","Tue Feb 06 01:35:40 UTC 2024","10805","","Дисциплина","Шаблон дисциплины","DisTemplateTests","CheckAddActivityInDisTemplate","Можно добавить шаблон активности в шаблон дисциплины, выбрав его из библиотеки",""
