"Status","Start Time","Stop Time","Duration in ms","Parent Suite","Suite","Sub Suite","Test Class","Test Method","Name","Description"
"passed","Thu Nov 16 06:07:05 UTC 2023","Thu Nov 16 06:07:16 UTC 2023","11424","","Активность","Задание","TaskActivityMulticriteriaTests","CheckCreateTaskMultiCriteria","Можно создать задание с критерием",""
"passed","Thu Nov 16 06:08:37 UTC 2023","Thu Nov 16 06:08:44 UTC 2023","6754","","Активность","Обычный шаблон активности","TemplateEditingTests","CheckEditDescriptionActivityTemplate","Редактирование шаблона активности: можно изменить описание",""
"passed","Thu Nov 16 06:14:00 UTC 2023","Thu Nov 16 06:14:11 UTC 2023","10176","","Материал","Конструктор теста","TestBlocksAndVariantsValidationTests","CheckAddTestVariant","Конструктор теста: можно добавить вариант",""
"passed","Thu Nov 16 06:14:22 UTC 2023","Thu Nov 16 06:14:41 UTC 2023","18752","","Библиотека","","LibraryInTileViewTests","CheckMoveMaterialToCatalogInTileView","Библиотека, плиточный вид: можно переместить материал в другой каталог",""
"passed","Thu Nov 16 06:12:01 UTC 2023","Thu Nov 16 06:12:16 UTC 2023","15055","","Чат","Чат для заметок","NotesChatTests","CheckPinLastMessageInNotesChat","Список чатов - чат для заметок: можно закреплять сообщения",""
"passed","Thu Nov 16 06:10:24 UTC 2023","Thu Nov 16 06:10:30 UTC 2023","5780","","Поток","Создание потока","CohortCreationWarningModalTests","CheckCreateCohortWithMismatchWarningOfDuration","Создание потока: предупреждение о несоответствии длительности потока для программ длительностью 144 часа",""
"passed","Thu Nov 16 06:06:53 UTC 2023","Thu Nov 16 06:06:59 UTC 2023","5614","","Активность","Задание","TaskActivityMulticriteriaTests","CheckMultiCriteriaCheckboxInTask","Чекбокс многокритериальная проверка отображается, если выбрана стандартная проверка",""
"passed","Thu Nov 16 06:12:08 UTC 2023","Thu Nov 16 06:12:12 UTC 2023","4114","","Дисциплина","Редактирование дисциплины","DisciplineAccessTests","CheckOtherOrgAdminChangeDiscipline","Редактирование дисциплины: нет возможности редактировать у администратора организации, к которому дисциплина НЕ относится",""
"passed","Thu Nov 16 06:16:10 UTC 2023","Thu Nov 16 06:16:13 UTC 2023","2686","","Программа","","ProgramEditingTests","CheckRemoveEducPaidProgramWithoutCohort","Редактирование программы ДО: можно удалить платную программу без потоков",""
"passed","Thu Nov 16 06:11:25 UTC 2023","Thu Nov 16 06:11:26 UTC 2023","1521","","Поток","Завершение обучения","EducationCompletionPageTests","CheckTransitionToCohortInfoPage","Переход со страницы завершения обучения на страницу потока",""
"passed","Thu Nov 16 06:07:12 UTC 2023","Thu Nov 16 06:07:15 UTC 2023","3872","","Активность","Задание","TaskWithSolutionStudentTests","CheckSendFileSolution","Можно отправить файловый ответ",""
"passed","Thu Nov 16 06:07:03 UTC 2023","Thu Nov 16 06:07:12 UTC 2023","9050","","Активность","Обычная активность","ActivityDurationTests","CheckIfEndDateEmptyInAcivity","Редактирование активности: успешное сохранение, если заполнена только дата начала",""
"passed","Thu Nov 16 06:08:53 UTC 2023","Thu Nov 16 06:09:06 UTC 2023","12650","Активность","Контрольная","Страница контрольной","TestCommandActivityTests","CheckAddTeamToCommandControlActivity","Можно добавить команду в командной контрольной",""
"passed","Thu Nov 16 06:10:18 UTC 2023","Thu Nov 16 06:10:23 UTC 2023","4924","","Поток","Создание потока","CohortCreationValidationTests","CheckCreateCohortIfNameNotFilled","Создание потока: ошибка валидации, если название не указано",""
"passed","Thu Nov 16 06:11:26 UTC 2023","Thu Nov 16 06:11:33 UTC 2023","7597","","Чат","Групповой чат","GroupChatTests","CheckDeleteMessageInGroupChat","Список чатов - групповой чат: можно удалить сообщение",""
"passed","Thu Nov 16 06:10:40 UTC 2023","Thu Nov 16 06:10:49 UTC 2023","8494","","Чат","Чат решения","TaskChatTests","CheckSendEmojiInTaskChat","Список чатов - обсуждение решения: можно отправить смайлики",""
"passed","Thu Nov 16 06:14:21 UTC 2023","Thu Nov 16 06:14:27 UTC 2023","6156","","Библиотека","","LibraryActionPanelTests","CheckChangeViewOfLibraryInTileView","Библиотека: можно переключать текущий вид Библиотеки с “Плитка” на “Список”",""
"passed","Thu Nov 16 06:16:19 UTC 2023","Thu Nov 16 06:16:27 UTC 2023","8798","","Материал","Конструктор тест-тренажера","TestTrainSettingsValidationTests","ClearTagsFromTestTrain","Конструктор теста-тренажера: можно удалить теги знаний",""
"passed","Thu Nov 16 06:07:30 UTC 2023","Thu Nov 16 06:07:35 UTC 2023","4542","","Активность","Обычная активность","ActivityDurationTests","CheckEditVolumeActivityWithCorrectValues","Редактирование активности: успешное сохранение при корректных значениях в поля 'Объём'",""
"passed","Thu Nov 16 06:07:30 UTC 2023","Thu Nov 16 06:07:33 UTC 2023","3036","","Активность","Задание","TaskWithSolutionStudentTests","CheckAbilityToSeeListSolutions","Можно просмотреть список всех решений, если включена 'Решения открыты всем'",""
"passed","Thu Nov 16 06:12:53 UTC 2023","Thu Nov 16 06:12:57 UTC 2023","4330","","Дисциплина","Редактирование дисциплины","DisciplineEditingValidationTests","CheckDeleteDisciplineWithGrades","Редактирование дисциплины: невозможно удалить дисциплину с оценками",""
"passed","Thu Nov 16 06:13:01 UTC 2023","Thu Nov 16 06:13:06 UTC 2023","4874","","Дисциплина","Создание дисциплины","DisContingentCreationValidationTests","CheckOnlyCohortStudentsAreShownInListOfStudents","Создание дисциплины: в выпадающем списке поля Студенты отображаются только студенты потока",""
"passed","Thu Nov 16 06:08:26 UTC 2023","Thu Nov 16 06:08:37 UTC 2023","10422","","Активность","Обычный шаблон активности","TemplateEditingTests","CheckEditNameActivityTemplate","Редактирование шаблона активности: можно изменить название",""
"passed","Thu Nov 16 06:10:12 UTC 2023","Thu Nov 16 06:10:26 UTC 2023","14680","","Чат","Личный чат","PersonalChatTests","CheckEditLastMessageInPersonalChat","Список чатов - личный чат: можно редактировать сообщение в течение 4 часов после отправки",""
"passed","Thu Nov 16 06:11:52 UTC 2023","Thu Nov 16 06:12:01 UTC 2023","8111","","Чат","Чат для заметок","NotesChatTests","CheckAddReactionToLastMessageInNotesChat","Список чатов - чат для заметок: можно добавить реакцию на сообщение",""
"passed","Thu Nov 16 06:10:36 UTC 2023","Thu Nov 16 06:10:43 UTC 2023","6723","","Поток","Создание потока","CohortCreationWarningModalTests","CheckCreateCohortWithoutMismatchWarningOfDuration","Создание потока: нет предупреждения о несоответствии длительности потока для программ длительностью кроме 72, 144 и 256 часов",""
"passed","Thu Nov 16 06:12:01 UTC 2023","Thu Nov 16 06:12:10 UTC 2023","8556","","Дисциплина","Редактирование дисциплины","DisciplineDurationTests","CheckIfDatesFilledCorrectInDiscipline","Редактирование дисциплины: успешное сохранение, если обе даты корректно заполнены",""
"failed","Thu Nov 16 06:19:13 UTC 2023","Thu Nov 16 06:19:48 UTC 2023","35439","","Активность","Обычная активность","ActivityEditingFormatTests","CheckRandomSetTypeActivityGetFormatIndependancyStudy","Редактирование активности: автоматическое переключение на самостоятельное изучение при выборе конкретных типов",""
"passed","Thu Nov 16 06:10:43 UTC 2023","Thu Nov 16 06:10:54 UTC 2023","10908","","Поток","Создание потока","CohortCreationWarningModalTests","CheckCreateCohortAfterChangeMismatchWarningOfDuration","Создание потока: можно создать поток после внесения правок в длительность потока",""
"passed","Thu Nov 16 06:16:26 UTC 2023","Thu Nov 16 06:16:35 UTC 2023","8112","","Материал","Конструктор тест-тренажера","TestTrainQuestionAnswersValidationTests","AddCommentInTestTrainAnswer","Конструктор теста-тренажера: можно изменить комментарий к варианту ответа",""
"passed","Thu Nov 16 06:09:51 UTC 2023","Thu Nov 16 06:10:08 UTC 2023","17499","Активность","Контрольная","Прохождение теста","TestActivityStatusWithTwoOrMoreAttemptsTests","ResultOfPassingDependOnSettings","Страница командной контрольной: результат тестирования из попытках зависеть от настройки 'За последнюю попытку'",""
"passed","Thu Nov 16 06:09:13 UTC 2023","Thu Nov 16 06:09:22 UTC 2023","9474","Активность","Контрольная","Результат прохождения теста","TestActivityResultTests","TeacherCanLeaveCommentOnAnswer","Результат прохождения: преподаватель может изменить комментарий к ответу, если включена опция подробная информация о результатах",""
"passed","Thu Nov 16 06:16:22 UTC 2023","Thu Nov 16 06:16:31 UTC 2023","8865","","Расписание","","ScheduleTests","CheckStubIsDisplayedIfNoEvents","Отображается заглушка в режиме Расписание, если нет событий",""
"passed","Thu Nov 16 06:11:02 UTC 2023","Thu Nov 16 06:11:03 UTC 2023","1287","","Поток","Создание потока","CohortCreationValidationTests","CheckCreateCohortBySelectingCheckboxRegistrationLinkInProgramNatDemography","Создание потока ДО (СЗ): нет возможности выбрать галку ‘Разрешена регистрация по ссылке’",""
"passed","Thu Nov 16 06:07:40 UTC 2023","Thu Nov 16 06:07:48 UTC 2023","8111","","Активность","Задание","TaskActivityTeacherTests","CheckGradeSolutionIncorrectValues","Отображение ошибки валидации для поля баллы, если вводить пробел",""
"passed","Thu Nov 16 06:06:58 UTC 2023","Thu Nov 16 06:07:07 UTC 2023","9081","","Активность","Задание","TaskWithoutSolutionStudentTests","CheckSendTextSolution","Можно отправить текстовый ответ",""
"passed","Thu Nov 16 06:07:09 UTC 2023","Thu Nov 16 06:07:32 UTC 2023","22571","","Активность","Обычная активность","ActivityContentVisibilityTests","CheckHideMaterial","Редактирование активности: можно скрыть материал",""
"passed","Thu Nov 16 06:09:23 UTC 2023","Thu Nov 16 06:09:35 UTC 2023","11879","","Активность","Шаблон активности контрольной","TestTemplateCreatingTests","CheckExecModeTestActivityTemplate","Можно создать шаблон контрольной с режимом выполнения Командный",""
"passed","Thu Nov 16 06:12:18 UTC 2023","Thu Nov 16 06:12:21 UTC 2023","3166","","Дисциплина","Страница дисциплины","DisciplineActivitiesBlockTests","CheckActivityVolumeIsDisplayed","Страница дисциплины: отображается объём ОА",""
"passed","Thu Nov 16 06:16:27 UTC 2023","Thu Nov 16 06:16:35 UTC 2023","7246","","Материал","Конструктор тест-тренажера","TestTrainSettingsValidationTests","EditTestTrainStudyTime","Конструктор теста-тренажера: можно изменить время изучения",""
"passed","Thu Nov 16 06:13:48 UTC 2023","Thu Nov 16 06:14:11 UTC 2023","23434","","Библиотека","","LibraryInListViewTests","CheckCopyMaterialToCatalogInListView","Библиотека, списочный вид: можно скопировать материал в другой каталог",""
"passed","Thu Nov 16 06:12:47 UTC 2023","Thu Nov 16 06:12:49 UTC 2023","2802","","Дисциплина","Страница дисциплины","DisciplineRightMenuTests","CheckEditButtonForTeacher","Страница дисциплины: работает кнопка 'Редактировать' для преподавателя",""
"passed","Thu Nov 16 06:13:27 UTC 2023","Thu Nov 16 06:13:37 UTC 2023","10281","","Библиотека","","LibraryActionPanelTests","CheckCreateCatalog","Библиотека, плиточный вид: можно создать каталог",""
"passed","Thu Nov 16 06:06:59 UTC 2023","Thu Nov 16 06:07:05 UTC 2023","6129","","Активность","Задание","TaskActivityMulticriteriaTests","CheckMultiCriteriaCheckboxInTask","Чекбокс многокритериальная проверка не отображается, если выбрана взаимопроверка",""
"passed","Thu Nov 16 06:08:43 UTC 2023","Thu Nov 16 06:08:56 UTC 2023","13203","Активность","Контрольная","Редактирование контрольной","TestActivityAddingTests","CheckAddTestTrainToControlTypeActivity","Можно добавить материал типа Тест-тренажёр из Библиотеки в контрольной",""
"passed","Thu Nov 16 06:09:01 UTC 2023","Thu Nov 16 06:09:10 UTC 2023","8701","","Активность","Обычный шаблон активности","TemplateEditingTests","CheckEditVolumeActivityTemplate","Редактирование шаблона активности: успешное сохранение при корректных значениях в поля 'Объём'",""
"passed","Thu Nov 16 06:12:38 UTC 2023","Thu Nov 16 06:12:48 UTC 2023","10134","","Дисциплина","Создание дисциплины","DisciplineCreationValidationTests","CheckIfCreditValuesNotAllowed","Создание дисциплины ДО: отображение ошибки валидации для поля 'Кредиты' с значением > 15",""
"passed","Thu Nov 16 06:14:32 UTC 2023","Thu Nov 16 06:14:47 UTC 2023","14898","","Библиотека","","BulkActionsLibraryTests","CheckRemoveMultipleSelectedItems","Библиотека: можно удалить несколько выбранных элементов",""
"passed","Thu Nov 16 06:12:17 UTC 2023","Thu Nov 16 06:12:19 UTC 2023","2234","","Чат","Групповой чат","GroupChatTests","CheckMembersOfGroupChatIsDisplayed","Список чатов - групповой чат: отображаются участники чата при клике на блок с аватарками",""
"passed","Thu Nov 16 06:11:36 UTC 2023","Thu Nov 16 06:11:38 UTC 2023","1418","","Поток","Редактирование потока","CohortEditingValidationTests","CheckIsNotPossibleEditCohort","Редактирование потока ДО (СЗ): нет возможности редактировать поток программы 2021 года, если в нем есть слушатели",""
"passed","Thu Nov 16 06:09:28 UTC 2023","Thu Nov 16 06:09:31 UTC 2023","3412","Активность","Контрольная","Прохождение теста","TestActivityPassingTests","ImpossiblePassTestAfterTheEndOfActivity","Прохождение теста: невозможно пройти тест после окончания активности",""
"passed","Thu Nov 16 06:10:55 UTC 2023","Thu Nov 16 06:10:57 UTC 2023","2197","","Чат","Чат решения","TaskChatTests","CheckOpenImageInTaskChat","Список чатов - обсуждение решения: можно раскрывать изображения",""
"passed","Thu Nov 16 06:15:09 UTC 2023","Thu Nov 16 06:15:22 UTC 2023","13168","","Материал","Конструктор тест-тренажера","TestTrainBlocksAndVariantsValidationTests","DeleteBlockTestTrain","Конструктор теста-тренажера: можно удалить блок",""
"passed","Thu Nov 16 06:11:42 UTC 2023","Thu Nov 16 06:11:44 UTC 2023","2510","","Чат","Чат для заметок","NotesChatTests","CheckOpenImageInNotesChat","Список чатов - чат для заметок: можно раскрывать изображения",""
"passed","Thu Nov 16 06:13:37 UTC 2023","Thu Nov 16 06:13:47 UTC 2023","9471","","Библиотека","","LibraryActionPanelTests","CheckCreateTextMaterial","Библиотека, плиточный вид: можно создать материал типа 'Текстовый материал'",""
"passed","Thu Nov 16 06:10:28 UTC 2023","Thu Nov 16 06:10:33 UTC 2023","4684","","Чат","Дисциплина","DisciplineChatTests","CheckFindSentMessageInDisciplineChat","Список чатов - комната дисциплины: можно найти отправленное сообщение",""
"passed","Thu Nov 16 06:13:02 UTC 2023","Thu Nov 16 06:13:07 UTC 2023","5100","","Дисциплина","Редактирование дисциплины","DisciplineEditingTests","CheckClearAddedTagsFromDiscipline","Редактирование дисциплины: можно очистить теги знаний",""
"passed","Thu Nov 16 06:09:39 UTC 2023","Thu Nov 16 06:09:46 UTC 2023","7319","","Чат","Групповой чат","GroupChatTests","CheckSendTextMessageInGroupChat","Список чатов - групповой чат: можно отправить текстовое сообщение",""
"passed","Thu Nov 16 06:10:42 UTC 2023","Thu Nov 16 06:10:50 UTC 2023","7388","","Чат","Групповой чат","GroupChatTests","CheckSendFileMessageInGroupChat","Список чатов - групповой чат: можно прикрепить и отправить файл с компьютера",""
"passed","Thu Nov 16 06:15:25 UTC 2023","Thu Nov 16 06:15:39 UTC 2023","14100","","Материал","Конструктор теста","TestBlocksAndVariantsValidationTests","DeleteTestBlock","Конструктор теста: можно удалить блок",""
"passed","Thu Nov 16 06:12:37 UTC 2023","Thu Nov 16 06:12:46 UTC 2023","8990","","Дисциплина","Редактирование дисциплины","DisciplineEditingTests","CheckSwitchControlType","Редактирование дисциплины: можно переключать значения в поле 'Вид контроля'",""
"passed","Thu Nov 16 06:09:22 UTC 2023","Thu Nov 16 06:09:30 UTC 2023","8867","Активность","Контрольная","Страница контрольной","TestCommandActivityTests","CheckRemoveTeamFromCommandControlActivity","Можно удалить команду в командной контрольной",""
"passed","Thu Nov 16 06:13:31 UTC 2023","Thu Nov 16 06:13:44 UTC 2023","12244","","Подразделения","Страница подразделения","DivisionPageTests","CheckTransitionToDivisionLibraryPage","Работает переход к библиотеке подразделения",""
"passed","Thu Nov 16 06:13:40 UTC 2023","Thu Nov 16 06:13:45 UTC 2023","5491","","Библиотека","","LibraryMaterialTests","CheckMyLibraryBreadCrumb","Страница материала: работает хлебная крошка 'Моя библиотека'",""
"passed","Thu Nov 16 06:17:19 UTC 2023","Thu Nov 16 06:17:28 UTC 2023","9011","","Расписание","","ScheduleSettingsTests","CheckTextOfShowPastActivitiesButtonIsChanged","Изменение текста кнопки после показа прошедших активностей в списке настроек",""
"passed","Thu Nov 16 06:11:33 UTC 2023","Thu Nov 16 06:11:40 UTC 2023","6947","","Дисциплина","Редактирование дисциплины","DisciplineAccessTests","CheckIfTeacherChangeDiscipline","Редактирование дисциплины: есть возможность редактировать у преподавателя этой дисциплины",""
"passed","Thu Nov 16 06:06:51 UTC 2023","Thu Nov 16 06:06:55 UTC 2023","4045","","Активность","Обычная активность","ActivityEditingTests","CheckEditActivity","Редактирование активности: работает кнопка 'Редактировать' для преподавателя",""
"passed","Thu Nov 16 06:12:18 UTC 2023","Thu Nov 16 06:12:23 UTC 2023","5442","","Дисциплина","Редактирование дисциплины","DisciplineDurationTests","CheckIfEndDateEmptyInDiscipline","Редактирование дисциплины: наличия ошибки если поле дата окончания пустое",""
"passed","Thu Nov 16 06:08:28 UTC 2023","Thu Nov 16 06:08:49 UTC 2023","20779","Активность","Контрольная","Прохождение теста","TestActivityPassingTests","PassingTest","Прохождение теста: можно пройти тест индивидуальной контрольной",""
"passed","Thu Nov 16 06:12:16 UTC 2023","Thu Nov 16 06:12:24 UTC 2023","8034","","Чат","Чат для заметок","NotesChatTests","CheckDeleteMessageInNotesChat","Список чатов - чат для заметок: можно удалить сообщение",""
"passed","Thu Nov 16 06:07:21 UTC 2023","Thu Nov 16 06:07:30 UTC 2023","8874","","Активность","Обычная активность","ActivityDurationTests","ErrorWhenEndDateLessStartDateInActivity","Редактирование активности: отображение ошибки валидации для полей даты, если дата окончания меньше даты начала",""
"passed","Thu Nov 16 06:13:21 UTC 2023","Thu Nov 16 06:13:31 UTC 2023","10623","","Подразделения","Страница подразделения","DivisionPageTests","CheckUploadOrDeleteAvatarForDivision","Можно загрузить/удалить аватар для подразделения",""
"passed","Thu Nov 16 06:07:03 UTC 2023","Thu Nov 16 06:07:15 UTC 2023","12082","","Активность","Обычная активность","ActivityAddingTests","CheckAddTextMaterialToActivity","Можно добавить материал типа Текст из Библиотеки в активность",""
"passed","Thu Nov 16 06:11:31 UTC 2023","Thu Nov 16 06:11:37 UTC 2023","6231","","Поток","Страница потока","CohortInfoTests","CheckAccessStudentToActivityCohortArchive","Страница потока: после восстановления из архива восстанавливается доступ к активностям",""
"passed","Thu Nov 16 06:08:55 UTC 2023","Thu Nov 16 06:09:06 UTC 2023","11882","Активность","Контрольная","Прохождение теста","TestActivityStatusWithOneAttemptTests","StatusIsPendingReviewForAttemptsNeedsReview","Страница индивидуальной контрольной: статус ожидает проверки, если в попытке есть хотя бы один вопрос, требующий проверки",""
"passed","Thu Nov 16 06:12:28 UTC 2023","Thu Nov 16 06:12:53 UTC 2023","24994","","Дисциплина","Страница дисциплины","DisciplineStudentTests","CheckPinDisciplineForStudent","Работает кнопка закрепления/открепления из главного меню для студента",""
"passed","Thu Nov 16 06:07:02 UTC 2023","Thu Nov 16 06:07:07 UTC 2023","4221","","Активность","Обычная активность","ActivityEditingTests","CheckEditNameActivity","Редактирование активности: можно изменить название",""
