"Status","Start Time","Stop Time","Duration in ms","Parent Suite","Suite","Sub Suite","Test Class","Test Method","Name","Description"
"passed","Wed Jun 19 07:34:48 UTC 2024","Wed Jun 19 07:34:55 UTC 2024","7072","","Профиль","","GeneralUserInfoEditingTests","CheckBirthField","Редактирование профиля пользователя: можно изменить дату рождения",""
"passed","Wed Jun 19 07:36:02 UTC 2024","Wed Jun 19 07:36:08 UTC 2024","5300","","Профиль","","UserInfoPageTests","CheckBlockOfPassedActivitiesAreDisplayedForTeacher","Страница профиля пользователя: под преподавателем отображаются пройденные активности студента",""
"passed","Wed Jun 19 07:41:00 UTC 2024","Wed Jun 19 07:41:15 UTC 2024","15486","","Материал","Конструктор тест-тренажера","TestTrainQuestionsValidationTests","CheckAndUncheckAnswerOptionInTestTrain","Конструктор теста-тренажера: возможность отметить вариант ответа как “верный”",""
"passed","Wed Jun 19 07:22:33 UTC 2024","Wed Jun 19 07:22:41 UTC 2024","8246","Активность","Обычная активность","Редактирование активности","ActivityEditingTests","CheckOffRatingActivity","Проверка выключения опции выставления оценки за активность",""
"passed","Wed Jun 19 07:24:27 UTC 2024","Wed Jun 19 07:24:49 UTC 2024","21836","","Чат","Чат дисциплины","DisciplineChatTests","CheckDisciplineChatIsOpened","Можно открыть чат дисциплины",""
"passed","Wed Jun 19 07:27:11 UTC 2024","Wed Jun 19 07:27:16 UTC 2024","4330","","Чат","Личный чат","PersonalChatTests","CheckFindPersonalChatByNameInSearch","Можно найти личный чат в поиске по названию",""
"passed","Wed Jun 19 07:34:30 UTC 2024","Wed Jun 19 07:34:42 UTC 2024","11641","","Профиль","","AddressAndContactsEditingTests","CheckCityField","Редактирование профиля пользователя: можно изменить город",""
"passed","Wed Jun 19 07:26:51 UTC 2024","Wed Jun 19 07:26:58 UTC 2024","7516","","Чат","Чат для заметок","NotesChatTests","CheckSendEmojiInNotesChat","Можно отправить смайлики в чате для заметок",""
"passed","Wed Jun 19 07:27:37 UTC 2024","Wed Jun 19 07:27:45 UTC 2024","7660","","Дисциплина","Создание дисциплины","DisciplineCreationValidationTests","CheckIfCreditValuesNotAllowed","Отображение ошибки валидации для поля 'Кредиты' со значением 0 в ДО",""
"passed","Wed Jun 19 07:27:42 UTC 2024","Wed Jun 19 07:27:48 UTC 2024","5514","","Дисциплина","Редактирование дисциплины","DisciplineDurationTests","CheckIfEndDateEmptyInDiscipline","Ошибка валидации, если поле Дата окончания не заполнено",""
"passed","Wed Jun 19 07:32:05 UTC 2024","Wed Jun 19 07:32:13 UTC 2024","8676","","Материал","Конструктор тест-тренажера","TestTrainBlocksAndVariantsValidationTests","EditTestTrainBlockName","Конструктор теста-тренажера: можно переименовать блок",""
"passed","Wed Jun 19 07:34:55 UTC 2024","Wed Jun 19 07:34:57 UTC 2024","2080","","Расписание","","ScheduleTests","CheckMonthModeIsNotDisplayedInMobileVersion","В мобильной версии нет возможности выбрать режим Месяц",""
"passed","Wed Jun 19 07:32:49 UTC 2024","Wed Jun 19 07:33:02 UTC 2024","13352","","Материал","Конструктор теста","TestQuestionAnswersValidationTests","CheckRemoveAnswerFromComparisionQuestion","Конструктор теста: можно удалить один вариант на сопоставление из вопроса с типом ответа ‘Сопоставление’",""
"passed","Wed Jun 19 07:34:21 UTC 2024","Wed Jun 19 07:34:26 UTC 2024","5292","","Расписание","","ScheduleTests","CheckTransitionToSchedulePage","Расписание можно открыть из блока Ближайшие активности",""
"passed","Wed Jun 19 07:34:19 UTC 2024","Wed Jun 19 07:34:33 UTC 2024","14309","","Программа","","ProgramCreationTests","CreateAdditionalProgramFillAllFields","Если заполнить все поля программы ДПО",""
"passed","Wed Jun 19 07:28:14 UTC 2024","Wed Jun 19 07:28:34 UTC 2024","19498","","Дисциплина","Страница дисциплины","DisciplineMarksAndAttendanceTests","CheckAddTotalFormula","Добавление формулы промежуточного результата дисциплины",""
"passed","Wed Jun 19 07:31:14 UTC 2024","Wed Jun 19 07:32:08 UTC 2024","53598","","Библиотека","","RemovingTemplatesTests","CheckDeleteDisciplineTemplate","Страница библиотеки: можно удалить шаблон дисциплины",""
"passed","Wed Jun 19 07:25:35 UTC 2024","Wed Jun 19 07:25:43 UTC 2024","8367","","Чат","Групповой чат","GroupChatTests","CheckSendGroupChatToArchive","Можно отправить групповой чат в архив",""
"passed","Wed Jun 19 07:34:52 UTC 2024","Wed Jun 19 07:34:55 UTC 2024","2920","","Расписание","","ScheduleTests","CheckThreeDayModeIsDisplayedInMobileVersion","Проверка отображение режима 3 дня в мобильной версии",""
"passed","Wed Jun 19 07:22:40 UTC 2024","Wed Jun 19 07:22:45 UTC 2024","5049","Активность","Контрольная","Редактирование контрольной","TestActivityEditingTests","CheckErrorInNumOfAttemptsFieldWithIncorrectValue","Ошибка валидации в поле Количество попыток сдачи, если введено значение больше 20",""
"passed","Wed Jun 19 07:31:30 UTC 2024","Wed Jun 19 07:31:52 UTC 2024","21412","","Библиотека","","LibraryInListViewTests","CheckEditMaterialViaActionsButton","Библиотека, списочный вид: можно редактировать материал через actions-кнопки",""
"passed","Wed Jun 19 07:22:45 UTC 2024","Wed Jun 19 07:22:53 UTC 2024","8424","Активность","Обычная активность","Редактирование активности","ActivityEditingTests","CheckSertificationDisciplineActivity","Проверка включения опции Аттестация по дисциплине",""
"passed","Wed Jun 19 07:29:28 UTC 2024","Wed Jun 19 07:29:33 UTC 2024","5152","","Подразделения","Создание подразделения","DivisionCreationTests","CheckCreateDivisionIfRequiredFieldsNotFilled","Ошибка валидации в обязательных полях, если они не заполнены",""
"passed","Wed Jun 19 07:24:21 UTC 2024","Wed Jun 19 07:24:23 UTC 2024","2248","Активность","Контрольная","Редактирование контрольной","TestActivityEditingTests","CheckErrorIsAppearIfRemoveTestActivityWithScore","Невозможно удалить контрольную при наличии оценок",""
"passed","Wed Jun 19 07:29:28 UTC 2024","Wed Jun 19 07:29:36 UTC 2024","8019","","Библиотека","","BulkActionsLibraryTests","CheckChooseButtonExistInMenu","Библиотека: наличие пункта “Выбрать” в меню при правом клике на каталог или материал",""
"passed","Wed Jun 19 07:33:29 UTC 2024","Wed Jun 19 07:34:01 UTC 2024","31365","","Материал","Конструктор теста","TestAddingQuestionsTests","CheckAddSortingTestQuestion","Конструктор теста: можно добавить вопрос с типом ответа “Сортировка”",""
"passed","Wed Jun 19 07:31:15 UTC 2024","Wed Jun 19 07:31:28 UTC 2024","13320","","Материал","Конструктор теста","TestQuestionAnswersValidationTests","CheckAddOneMoreAnswerVariantInQuestionWithFreeAnswerExactMatch","Конструктор теста: можно добавить еще один вариант ответа в вопрос с типом ответа 'Свободный ответ - точное совпадение'",""
"passed","Wed Jun 19 07:31:06 UTC 2024","Wed Jun 19 07:31:23 UTC 2024","16822","","Библиотека","","LibraryActionPanelTests","CheckAddFileToLibrary","Библиотека, плиточный вид: можно загрузить материал типа “Файл” с компьютера",""
"passed","Wed Jun 19 07:34:17 UTC 2024","Wed Jun 19 07:34:28 UTC 2024","10485","","Программа","","ProgramInfoPageTests","CheckNoAccessStudentToActivityEducationalProgramArchive","Студенты не имеют доступ к активностям архивной образовательной программы",""
"passed","Wed Jun 19 07:27:45 UTC 2024","Wed Jun 19 07:27:53 UTC 2024","7975","","Дисциплина","Создание дисциплины","DisciplineCreationValidationTests","CheckIfCreditValuesNotAllowed","Отображение ошибки валидации для поля 'Кредиты' с отрицательным значением в ДО",""
"passed","Wed Jun 19 07:29:55 UTC 2024","Wed Jun 19 07:30:19 UTC 2024","24307","","Библиотека","","LibraryInListViewTests","CheckMoveMaterialToCatalogInListView","Библиотека, списочный вид: можно переместить материал в другой каталог",""
"passed","Wed Jun 19 07:24:35 UTC 2024","Wed Jun 19 07:24:45 UTC 2024","9668","","Чат","Групповой чат","GroupChatMessageActionTests","CheckEditLastMessageInGroupChat","Можно редактировать сообщение в течение 4 часов после отправки в групповом чате",""
"passed","Wed Jun 19 07:27:31 UTC 2024","Wed Jun 19 07:27:40 UTC 2024","8861","","Дисциплина","Редактирование дисциплины","DisciplineAccessTests","CheckIfAdminPodrChangeDiscipline","У администратора подразделения, к которому дисциплина относится, есть возможность редактирования",""
"passed","Wed Jun 19 07:26:09 UTC 2024","Wed Jun 19 07:26:13 UTC 2024","3609","","Чат","Групповой чат","GroupChatMessageTests","CheckOpenImageInGroupChat","Можно раскрывать изображения в групповом чате",""
"passed","Wed Jun 19 07:25:55 UTC 2024","Wed Jun 19 07:26:00 UTC 2024","4497","","Чат","Групповой чат","GroupChatMessageActionTests","CheckClosedDiscussionPanelInGroupChat","Закрытие панели обсуждения в групповом чате",""
"passed","Wed Jun 19 07:21:14 UTC 2024","Wed Jun 19 07:21:49 UTC 2024","35272","Активность","Обычная активность","Редактирование активности","ActivityContentVisibilityTests","CheckHideMaterial","Можно скрыть материал",""
"passed","Wed Jun 19 07:21:21 UTC 2024","Wed Jun 19 07:21:38 UTC 2024","16370","Активность","Задание","Страница решения задания для студента","TaskWithoutSolutionStudentTests","CheckSendTextAndFileSolution","Можно отправить ответ в виде текста и файла",""
"passed","Wed Jun 19 07:27:57 UTC 2024","Wed Jun 19 07:28:50 UTC 2024","53529","","Дисциплина","Страница дисциплины","DisciplineStudentTests","CheckPinDisciplineForStudent","Работает кнопка закрепления/открепления из главного меню для студента",""
"passed","Wed Jun 19 07:35:32 UTC 2024","Wed Jun 19 07:35:38 UTC 2024","5297","","Профиль","","UserInfoPageTests","CheckTransitionToEditProfileWorks","Страница профиля пользователя: кнопка 'Редактировать' работает для пользователя",""
"passed","Wed Jun 19 07:35:16 UTC 2024","Wed Jun 19 07:35:29 UTC 2024","12839","","Расписание","","ScheduleSettingsTests","CheckDisplayOfPastActivities","Проверка отображения прошедших активностей",""
"passed","Wed Jun 19 07:28:59 UTC 2024","Wed Jun 19 07:29:05 UTC 2024","5566","","Дисциплина","Редактирование дисциплины","DisciplineEditingTests","CheckCancelButtonWork","Работает кнопка Отмена",""
"passed","Wed Jun 19 07:34:22 UTC 2024","Wed Jun 19 07:34:27 UTC 2024","4301","","Организация","Страница организации","OrganizationPageTests","CheckTransitionToStaffImportPage","Страница организации: работает переход к странице импорта сотрудников",""
"passed","Wed Jun 19 07:27:00 UTC 2024","Wed Jun 19 07:27:04 UTC 2024","3791","","Дисциплина","Редактирование дисциплины","DisciplineAccessTests","CheckIfTeacherChangeDiscipline","У преподавателя этой дисциплины есть возможность редактирования",""
"passed","Wed Jun 19 07:26:04 UTC 2024","Wed Jun 19 07:26:13 UTC 2024","9239","","Чат","Обсуждение решения","TaskChatTests","CheckEditLastMessageInTaskChat","Можно редактировать сообщение в течение 4 часов после отправки в обсуждении решения",""
"passed","Wed Jun 19 07:29:52 UTC 2024","Wed Jun 19 07:30:00 UTC 2024","7854","","Подразделения","Страница подразделения","DivisionPageTests","CheckCloseAndOpenDivision","Можно закрыть/открыть подразделение под суперадминистратором",""
"passed","Wed Jun 19 07:31:25 UTC 2024","Wed Jun 19 07:31:38 UTC 2024","12861","","Материал","Конструктор теста","TestSettingsValidationTests","AddAuthorInTest","Конструктор теста: можно добавить автора",""
"passed","Wed Jun 19 07:23:33 UTC 2024","Wed Jun 19 07:23:39 UTC 2024","5571","Активность","Контрольная","Создание контрольной","TestActivityCreatingTests","CheckScoreFieldAppearsIfNumOfAttemptsMoreThanOne","Появление поля Оценка, если количество попыток больше одной",""
"passed","Wed Jun 19 07:27:38 UTC 2024","Wed Jun 19 07:27:54 UTC 2024","15958","","Дисциплина","Настройка чата дисциплины","DisciplineChatBlockTests","CheckBlockAndUnblockChatDiscipline","Проверка отключения чата дисциплины в уже созданной дисциплине",""
"passed","Wed Jun 19 07:21:40 UTC 2024","Wed Jun 19 07:21:48 UTC 2024","8391","Активность","Задание","Страница решения задания для преподавателя","TaskActivityTeacherTests","CheckGradeSolutionIncorrectValues","Отображение ошибки валидации для поля Баллы с отрицательным значением",""
"passed","Wed Jun 19 07:30:40 UTC 2024","Wed Jun 19 07:30:52 UTC 2024","12387","","Библиотека","","BulkActionsLibraryTests","CheckConfirmModalIsAppearWhenRemovingSelectedItems","Библиотека: при попытке удалить выбранных элементов отображается модалка подтверждения",""
"passed","Wed Jun 19 07:26:32 UTC 2024","Wed Jun 19 07:26:38 UTC 2024","5897","","Поток","Создание потока","CohortCreationWarningModalTests","CheckCreateCohortWithMismatchWarningOfDuration","Создание потока: предупреждение о несоответствии длительности потока для программ длительностью 256 часов",""
"passed","Wed Jun 19 07:33:57 UTC 2024","Wed Jun 19 07:34:05 UTC 2024","8626","","Программа","","ProgramCreationTests","CreateHighProgramOverviewFields","Заполнить только обязательные поля у программы ДПО",""
"passed","Wed Jun 19 07:24:22 UTC 2024","Wed Jun 19 07:24:53 UTC 2024","31117","Активность","Контрольная","Редактирование контрольной","TestActivityAddingTests","CheckAddScormPackageToControlTypeActivity","Можно добавить SCORM-пакет из Библиотеки в контрольную",""
"passed","Wed Jun 19 07:29:33 UTC 2024","Wed Jun 19 07:29:52 UTC 2024","18555","","Подразделения","Создание подразделения","DivisionCreationTests","CheckCancelCreateDivision","Проверка кнопки Отмена при создании подразделения",""
"passed","Wed Jun 19 07:24:01 UTC 2024","Wed Jun 19 07:24:23 UTC 2024","21384","Активность","Контрольная","Прохождение теста","TestActivityStatusWithOneAttemptTests","CheckStatusScoreColorAndIcon","Статус и цвет у количества баллов в попытке различаются в зависимости от успешности в командной контрольной",""
"passed","Wed Jun 19 07:27:07 UTC 2024","Wed Jun 19 07:27:12 UTC 2024","4318","","Поток","Страница потока","CohortInfoTests","CheckNotAccessToUploadsForStudents","Страница потока: отсутствие доступа студента к выгрузкам",""
"passed","Wed Jun 19 07:28:53 UTC 2024","Wed Jun 19 07:29:01 UTC 2024","7829","","Дисциплина","Страница дисциплины","DisciplineAnalyticsTests","CheckStudentActivityGraphIsDisplayed","Проверка отображения в аналитике графика действий студента",""
"passed","Wed Jun 19 07:31:28 UTC 2024","Wed Jun 19 07:31:44 UTC 2024","16007","","Материал","Конструктор теста","TestQuestionAnswersValidationTests","CheckAddOneMoreOptionInComparisonTestQuestion","Конструктор теста: можно добавить еще один вариант на сопоставление в вопрос с типом ответа 'Сопоставление'",""
"passed","Wed Jun 19 07:32:23 UTC 2024","Wed Jun 19 07:32:34 UTC 2024","10829","","Материал","Конструктор теста","TestSettingsValidationTests","EditTestStudyTime","Конструктор теста: можно изменить время изучения",""
"passed","Wed Jun 19 07:21:50 UTC 2024","Wed Jun 19 07:22:13 UTC 2024","22966","Активность","Обычная активность","Редактирование активности","ActivityEditingTests","CheckEditValueScormResultScore","Можно переключать значения в поле 'Оценка по SCORM результату'",""
"passed","Wed Jun 19 07:34:05 UTC 2024","Wed Jun 19 07:34:12 UTC 2024","6413","","Программа","","ProgramCreationTests","CheckCancelCreatingProgram","Проверка кнопки Отмена у программы ДПО",""
"passed","Wed Jun 19 07:32:43 UTC 2024","Wed Jun 19 07:32:55 UTC 2024","11960","","Материал","Конструктор теста","TestSettingsValidationTests","EditTestTimeLimit","Конструктор теста: можно изменить временной лимит",""
"passed","Wed Jun 19 07:24:06 UTC 2024","Wed Jun 19 07:24:18 UTC 2024","11315","Активность","Контрольная","Результат прохождения теста","TestActivityResultTests","CheckMarkIncorrectAnswerThatWasMarkedAsCorrect","Можно отметить Неверно на ответ в вопросе, который был отмечен как Верно",""
"passed","Wed Jun 19 07:22:57 UTC 2024","Wed Jun 19 07:23:12 UTC 2024","14815","Активность","Контрольная","Создание контрольной","TestActivityCreatingTests","CheckCreateActivityBySpecifyingControlMode","Можно создать контрольную с режимом выполнения Индивидуальный",""
"passed","Wed Jun 19 07:22:58 UTC 2024","Wed Jun 19 07:23:05 UTC 2024","6785","Активность","Задание","Страница решения задания для студента","TaskWithSolutionStudentTests","CheckSendSolutionForAnotherStudent","Нет возможности отправить решение за другого студента",""
"passed","Wed Jun 19 07:30:02 UTC 2024","Wed Jun 19 07:30:11 UTC 2024","9416","","Экзамен","Создание экзамена","ExamCreateEditTests","ErrorDeleteExam","Ошибка при удаление экзамена",""
"passed","Wed Jun 19 07:25:11 UTC 2024","Wed Jun 19 07:25:18 UTC 2024","6724","","Чат","Групповой чат","GroupChatTests","CheckFindGroupChatByNameInSearch","Можно найти групповой чат в поиске по названию",""
"passed","Wed Jun 19 07:28:14 UTC 2024","Wed Jun 19 07:28:24 UTC 2024","9868","","Дисциплина","Страница дисциплины","DisciplineAnalyticsTests","CheckFilterByStudentName","Проверка фильтра аналитики по имени студента",""
"passed","Wed Jun 19 07:35:54 UTC 2024","Wed Jun 19 07:36:02 UTC 2024","8802","","Профиль","","UserInfoPageTests","CheckSetPassword","Страница профиля пользователя: можно изменить пароль",""
"passed","Wed Jun 19 07:27:08 UTC 2024","Wed Jun 19 07:27:10 UTC 2024","2625","","Поток","Редактирование потока","CohortEditingValidationTests","CheckIsNotPossibleRemoveCohortWithSemestersOrDisciplines","Редактирование потока: нет возможности удалить поток, если есть хотя бы одна дисциплина или семестр",""
"passed","Wed Jun 19 07:26:13 UTC 2024","Wed Jun 19 07:26:22 UTC 2024","8861","","Чат","Групповой чат","GroupChatMessageTests","CheckSendMessageByTappingEnterInGroupChat","Можно отправить сообщение по нажатию на Enter в групповом чате",""
"failed","Wed Jun 19 07:39:58 UTC 2024","Wed Jun 19 07:40:12 UTC 2024","13971","","Чат","Личный чат","PersonalChatTests","CheckStartDiscussionUnderLeftSideMessageInPersonalChat","Можно ответить на сообщение в личном чате",""
"passed","Wed Jun 19 07:27:58 UTC 2024","Wed Jun 19 07:28:08 UTC 2024","9910","","Дисциплина","Редактирование дисциплины","DisciplineAccessTests","CheckIfSuperAdminChangeDiscipline","У суперадминистратора есть возможность редактирования",""
"passed","Wed Jun 19 07:34:10 UTC 2024","Wed Jun 19 07:34:25 UTC 2024","15478","","Расписание","","StudentScheduleSettingsTests","CheckAbilityToHideCompletedActivities","Проверка возможности скрыть пройденные активности под студентом",""
"passed","Wed Jun 19 07:25:30 UTC 2024","Wed Jun 19 07:25:38 UTC 2024","8488","","Чат","Групповой чат","GroupChatMessageActionTests","CheckAddQuoteToLeftSideMessageInGroupChat","Можно цитировать сообщение другого участника в групповом чате",""
"passed","Wed Jun 19 07:26:30 UTC 2024","Wed Jun 19 07:26:33 UTC 2024","3340","","Чат","Миничат страницы решений","TaskPageMiniChatTests","CheckOpenImageInTaskPageMiniChat","Можно раскрывать изображения в миничате страницы решений",""
"passed","Wed Jun 19 07:27:02 UTC 2024","Wed Jun 19 07:27:11 UTC 2024","8731","","Чат","Личный чат","PersonalChatTests","CheckAddNewPersonalChat","Можно добавить новый личный чат",""
"passed","Wed Jun 19 07:27:04 UTC 2024","Wed Jun 19 07:27:08 UTC 2024","3599","","Чат","Чат для заметок","NotesChatTests","CheckOpenImageInNotesChat","Можно раскрывать изображения в чате для заметок",""
"passed","Wed Jun 19 07:30:11 UTC 2024","Wed Jun 19 07:30:18 UTC 2024","7029","","Экзамен","Создание экзамена","ExamCreateEditTests","CheckEditExamName","Проверка на редактирование названия экзамена",""
"passed","Wed Jun 19 07:22:12 UTC 2024","Wed Jun 19 07:22:17 UTC 2024","4396","","Активность","Обычный шаблон активности","TemplateEditingValidationTests","CheckEditActivityTemplateVolumeWithIncorrectValue","Ошибка валидации в поле Объем в академических часах, если введено отрицательное значение",""
