"Status","Start Time","Stop Time","Duration in ms","Parent Suite","Suite","Sub Suite","Test Class","Test Method","Name","Description"
"passed","Wed Oct 11 05:36:56 UTC 2023","Wed Oct 11 05:37:00 UTC 2023","4614","","Дисциплина","Создание дисциплины","DisciplineCreationTests","CancelCreatingDiscipline"," Cоздание дисциплины в потоке ДО: работает кнопка 'Отмена'",""
"passed","Wed Oct 11 05:33:29 UTC 2023","Wed Oct 11 05:33:38 UTC 2023","8854","","Чат","Дисциплина","DisciplineChatTests","CheckSendEmptyMessageInDisciplineChat","Список чатов - комната дисциплины: невозможно отправить пустое сообщение",""
"passed","Wed Oct 11 05:31:47 UTC 2023","Wed Oct 11 05:31:55 UTC 2023","7935","","Активность","Обычный шаблон активности","TemplateEditingTests","CheckEditTypeActivityTemplate","Редактирование шаблона активности: можно переключать значения в поле 'Тип активности'",""
"passed","Wed Oct 11 05:40:57 UTC 2023","Wed Oct 11 05:41:07 UTC 2023","9911","","Материал","Конструктор тест-тренажера","TestTrainSettingsValidationTests","AddAuthorInTestTrain","Конструктор теста-тренажера: можно добавить автора",""
"passed","Wed Oct 11 05:34:03 UTC 2023","Wed Oct 11 05:34:14 UTC 2023","11019","","Чат","Личный чат","PersonalChatTests","CheckSendEmptyMessageInPersonalChat","Список чатов - личный чат: невозможно отправить пустое сообщение",""
"passed","Wed Oct 11 05:36:14 UTC 2023","Wed Oct 11 05:36:19 UTC 2023","5686","","Дисциплина","Редактирование дисциплины","DisciplineAccessTests","CheckIfTeacherChangeDiscipline","Редактирование дисциплины: есть возможность редактировать у преподавателя этой дисциплины",""
"passed","Wed Oct 11 05:38:48 UTC 2023","Wed Oct 11 05:38:57 UTC 2023","9222","","Дисциплина","Редактирование дисциплины","DisContingentEditingValidationTests","CheckOnlyCohortStudentsAreShownInListOfStudents","Редактирование дисциплины: в выпадающем списке поля Студенты отображаются только студенты потока",""
"passed","Wed Oct 11 05:42:03 UTC 2023","Wed Oct 11 05:42:13 UTC 2023","10672","","Профиль","","AddressAndContactsEditingTests","CheckEmailField","Редактирование профиля пользователя: можно изменить email",""
"passed","Wed Oct 11 05:41:39 UTC 2023","Wed Oct 11 05:41:44 UTC 2023","5250","","Программа","","ProgramEditingTests","CheckRemoveProgramFromItsAdministrator","Редактирование программы ДО: нет возможности удаления программы у его админа",""
"passed","Wed Oct 11 05:37:53 UTC 2023","Wed Oct 11 05:38:00 UTC 2023","7008","","Дисциплина","Страница дисциплины","DisciplineStudentTests","CheckAttendanceByStudent","Страница посещаемости дисциплины: невозможности отметки/снятия посещаемости студентом",""
"passed","Wed Oct 11 05:36:31 UTC 2023","Wed Oct 11 05:36:35 UTC 2023","3215","","Дисциплина","Страница дисциплины","DisciplineAnalyticsTests","CheckThreeDotMenuOnAnalyticsTabIsDisplayed","Страница аналитика дисциплины: наличие тридот меню на вкладке “Аналитика”",""
"passed","Wed Oct 11 05:34:48 UTC 2023","Wed Oct 11 05:34:56 UTC 2023","7470","","Чат","Чат для заметок","NotesChatTests","CheckFindSentMessageInNotesChat","Список чатов - чат для заметок: можно найти отправленное сообщение",""
"passed","Wed Oct 11 05:33:06 UTC 2023","Wed Oct 11 05:33:10 UTC 2023","3946","Активность","Контрольная","Прохождение теста","TestActivityPassingTests","ImpossiblePassTestAfterTheEndOfActivity","Прохождение теста: невозможно пройти тест после окончания активности",""
"passed","Wed Oct 11 05:41:34 UTC 2023","Wed Oct 11 05:41:42 UTC 2023","7903","","Расписание","","ScheduleTests","PlugIfNoEventsSchedule","Страница расписания: если нет событий отображается заглушка",""
"passed","Wed Oct 11 05:40:54 UTC 2023","Wed Oct 11 05:40:58 UTC 2023","4467","","Организация","Мой тариф","MyPlanOrganizationPageTests","CheckOpenMyPlanPageFromOrganizationPage","Страница организации: переход на страницу Мой тариф",""
"passed","Wed Oct 11 05:42:01 UTC 2023","Wed Oct 11 05:42:10 UTC 2023","9228","","Расписание","","ScheduleSettingsTests","ShowLastActivitySchedule","Страница расписания: проверка показать прошедшие активности",""
"passed","Wed Oct 11 05:41:38 UTC 2023","Wed Oct 11 05:41:48 UTC 2023","9858","","Материал","Конструктор тест-тренажера","TestTrainQuestionAnswersValidationTests","AddCommentInTestTrainAnswer","Конструктор теста-тренажера: можно изменить комментарий к варианту ответа",""
"passed","Wed Oct 11 05:32:06 UTC 2023","Wed Oct 11 05:32:21 UTC 2023","15975","Активность","Контрольная","Редактирование контрольной","TestActivityAddingTests","AddTestToTestActivity","Редактирование контрольной: можно добавить материал типа тест из библиотеки",""
"passed","Wed Oct 11 05:36:15 UTC 2023","Wed Oct 11 05:36:17 UTC 2023","1637","","Поток","Завершение обучения","EducationCompletionPageTests","CheckTransitionToCohortInfoPage","Переход со страницы завершения обучения на страницу потока",""
"passed","Wed Oct 11 05:37:42 UTC 2023","Wed Oct 11 05:38:02 UTC 2023","19823","","Дисциплина","Страница дисциплины","DisciplineMarksAndAttendanceTests","ChecEditTotalFormula","Страница оценок дисциплины: редактирования формулы промежуточного результата",""
"passed","Wed Oct 11 05:32:26 UTC 2023","Wed Oct 11 05:32:36 UTC 2023","10015","Активность","Контрольная","Результат прохождения теста","TestActivityResultTests","StudentCanViewDetailedResultInfo","Результат прохождения: студент не может просматривать подробную информацию о результатах, если отключена соответственная опция",""
"passed","Wed Oct 11 05:41:22 UTC 2023","Wed Oct 11 05:41:30 UTC 2023","8274","","Материал","Конструктор тест-тренажера","TestTrainSettingsValidationTests","ChangeLevelAssimilationInTestTrainTag","Конструктор теста-тренажера: можно изменить уровень усвоения в добавленном теге знаний",""
"passed","Wed Oct 11 05:39:39 UTC 2023","Wed Oct 11 05:39:49 UTC 2023","10003","","Материал","Конструктор теста","TestSettingsValidationTests","AddAuthorInTest","Конструктор теста: можно добавить автора",""
"passed","Wed Oct 11 05:32:06 UTC 2023","Wed Oct 11 05:32:20 UTC 2023","14856","","Активность","Обычная активность","ActivityAddingTests","CheckAddScormPackageActivity","Редактирование активности: можно добавить материал типа SCORM из библиотеки",""
"passed","Wed Oct 11 05:35:00 UTC 2023","Wed Oct 11 05:35:09 UTC 2023","8513","","Поток","Создание потока","CohortCreationTests","CheckCancelCohortCreation","Создание потока ДО: работает кнопка 'Отмена', если страница создание был открыть со страницы программы",""
"passed","Wed Oct 11 05:31:06 UTC 2023","Wed Oct 11 05:31:17 UTC 2023","11198","","Активность","Задание","TaskActivityTeacherTests","CheckGradeSolutionValueAboveAndBelowScore","Страница решение задания: можно оценить решения значением ниже минимального порога баллов",""
"passed","Wed Oct 11 05:42:13 UTC 2023","Wed Oct 11 05:42:18 UTC 2023","4230","","Профиль","","UserInfoPageTests","CheckStudentCanOpenPageOfPassedActivities","Страница профиля пользователя: под студентом можно перейти на страницу пройденных активностей",""
"passed","Wed Oct 11 05:38:13 UTC 2023","Wed Oct 11 05:38:26 UTC 2023","12467","","Дисциплина","Создание дисциплины","DisContingentCreationTests","CheckCreateDisciplineByCheckingBoxAllCohortStudents","Создание дисциплины: есть возможность создать дисциплину выбрав галку ‘Все студенты потока’",""
"passed","Wed Oct 11 05:31:26 UTC 2023","Wed Oct 11 05:31:36 UTC 2023","9731","","Активность","Задание","TaskActivityTeacherTests","CheckGradeSolutionIncorrectValues","Страница решение задания: отображение ошибки валидации для поля баллы, если вводить пробел",""
"passed","Wed Oct 11 05:41:47 UTC 2023","Wed Oct 11 05:41:50 UTC 2023","3266","","Расписание","","ScheduleTests","DesktopScheduleNoChooseThreeDaysMode","Страница расписания: в десктопе нет возможности выбрать 3 дня",""
"passed","Wed Oct 11 05:35:22 UTC 2023","Wed Oct 11 05:35:30 UTC 2023","8154","","Чат","Чат для заметок","NotesChatTests","CheckSendMessageByTappingEnterInNotesChat","Список чатов - чат для заметок: можно отправить сообщения по нажатию на Enter",""
"passed","Wed Oct 11 05:41:56 UTC 2023","Wed Oct 11 05:42:06 UTC 2023","9995","","Профиль","","GeneralUserInfoEditingTests","CheckUserNameFiledsInTransliteration","Редактирование профиля пользователя: можно изменить ФИО в транслитерации",""
"passed","Wed Oct 11 05:35:49 UTC 2023","Wed Oct 11 05:36:07 UTC 2023","17474","","Чат","Дисциплина","DisciplineChatTests","CheckPinLastMessageInDisciplineChat","Список чатов - комната дисциплины: можно закреплять сообщения",""
"passed","Wed Oct 11 05:33:10 UTC 2023","Wed Oct 11 05:33:13 UTC 2023","2510","Активность","Контрольная","Редактирование контрольной","TestActivityEditingTests","ErrorWhenDeletingTestActivityWithAttempts","Редактирование контрольной: невозможно удалить контрольную при наличии оценок",""
"passed","Wed Oct 11 05:45:40 UTC 2023","Wed Oct 11 05:45:47 UTC 2023","6195","","Дисциплина","Редактирование дисциплины","DisContingentEditingValidationTests","CheckUnableAddGroupFromAnotherCohortInEditing","Редактирование дисциплины: невозможно добавить группу из стороннего потока",""
"passed","Wed Oct 11 05:38:06 UTC 2023","Wed Oct 11 05:38:11 UTC 2023","4965","","Подразделения","","DivisionCommonTests","CreateDivision","Создать подразделение заполнить только обязательные поля",""
"passed","Wed Oct 11 05:40:21 UTC 2023","Wed Oct 11 05:40:31 UTC 2023","10318","","Материал","Конструктор тест-тренажера","TestTrainCreationTests","TestCreation","Конструктор теста-тренажера: создание теста-тренажера",""
"skipped","Wed Oct 11 05:45:47 UTC 2023","Wed Oct 11 05:45:47 UTC 2023","336","","Библиотека","","LibraryMaterialTests","CheckVisibilityOfLaTeXMaterialPage","Страница материала: проверка отображения LaTeX материала",""
"passed","Wed Oct 11 05:31:32 UTC 2023","Wed Oct 11 05:31:48 UTC 2023","15307","","Активность","Обычная активность","ActivityDurationTests","ErrorWhenEndDateLessStartDateInActivity","Редактирование активности: отображение ошибки валидации для полей даты, если дата окончания меньше даты начала",""
"passed","Wed Oct 11 05:36:25 UTC 2023","Wed Oct 11 05:36:31 UTC 2023","6587","","Дисциплина","Страница дисциплины","DisciplineAnalyticsTests","CheckDisciplineAnalyticsIsOpen","Страница аналитика дисциплины: при переходе на вкладку “Аналитика” открывается аналитика дисциплины",""
"passed","Wed Oct 11 05:37:26 UTC 2023","Wed Oct 11 05:37:42 UTC 2023","16280","","Дисциплина","Страница дисциплины","DisciplineMarksAndAttendanceTests","CheckAddTotalFormula","Страница оценок дисциплины: добавления формулы промежуточного результата",""
"passed","Wed Oct 11 05:35:57 UTC 2023","Wed Oct 11 05:36:03 UTC 2023","5864","","Поток","Редактирование потока","CohortEditingValidationTests","CheckEditCohortIfNameNotFilled","Редактирование потока: ошибка валидации, если название не заполнено",""
"passed","Wed Oct 11 05:38:14 UTC 2023","Wed Oct 11 05:38:21 UTC 2023","7365","","Подразделения","","DivisionCommonTests","CreateDivisionAllRequiredFields","Cоздание подразделения заполнить все поля",""
"passed","Wed Oct 11 05:30:23 UTC 2023","Wed Oct 11 05:30:53 UTC 2023","30299","","Активность","Обычная активность","ActivityContentVisibilityTests","CheckVisibilityMaterialDuringActivity","Редактирование активности: видимость материала во время проведения активности",""
"passed","Wed Oct 11 05:34:33 UTC 2023","Wed Oct 11 05:34:48 UTC 2023","15269","","Чат","Чат для заметок","NotesChatTests","CheckAddQuoteToLastMessageInNotesChat","Список чатов - чат для заметок: можно цитировать сообщению",""
"passed","Wed Oct 11 05:41:31 UTC 2023","Wed Oct 11 05:41:34 UTC 2023","3222","","Программа","","ProgramEditingTests","CheckRemoveEducPaidProgramWithoutCohort","Редактирование программы ДО: можно удалить платную программу без потоков",""
"passed","Wed Oct 11 05:38:18 UTC 2023","Wed Oct 11 05:38:26 UTC 2023","8147","","Библиотека","","BulkActionsLibraryTests","CheckAppearanceOfMoveDeleteAndCancelButtons","Библиотека: появление кнопок переместить, удалить, и отмена при активации режима выбора",""
"passed","Wed Oct 11 05:32:41 UTC 2023","Wed Oct 11 05:32:48 UTC 2023","7273","Активность","Контрольная","Редактирование контрольной","TestActivityEditingTests","SuccessSaveWithPositiveValueTimeLimitInTestActivity","Редактирование контрольной: успешное сохранение при положительных значениях в поле 'Временной лимит'",""
"passed","Wed Oct 11 05:36:05 UTC 2023","Wed Oct 11 05:36:09 UTC 2023","4159","","Поток","Страница потока","CohortInfoTests","CheckWindowsRestoreCohortArchive","Страница потока: при восстановлении потока из архива появляется модалка подтверждения действия",""
"passed","Wed Oct 11 05:36:09 UTC 2023","Wed Oct 11 05:36:14 UTC 2023","4678","","Поток","Страница потока","CohortInfoTests","CheckNotAccessToUploadsForStudents","Страница потока: отсутствие доступа студента к выгрузкам",""
"passed","Wed Oct 11 05:35:54 UTC 2023","Wed Oct 11 05:36:02 UTC 2023","8346","","Чат","Групповой чат","GroupChatTests","CheckSendMessageByTappingEnterInGroupChat","Список чатов - групповой чат: можно отправить сообщения по нажатию на Enter",""
"passed","Wed Oct 11 05:35:39 UTC 2023","Wed Oct 11 05:35:49 UTC 2023","10557","","Чат","Дисциплина","DisciplineChatTests","CheckAddReactionToLastMessageInDisciplineChat","Список чатов - комната дисциплины: можно добавить реакцию на сообщение",""
"passed","Wed Oct 11 05:37:58 UTC 2023","Wed Oct 11 05:38:10 UTC 2023","11879","","Дисциплина","Шаблон дисциплины","DisTemplateTests","CheckCreateDisTemplateWithFillingRequiredFields","Создание шаблона дисциплины: можно создать шаблон, если заполнены все обязательные поля",""
"passed","Wed Oct 11 05:31:12 UTC 2023","Wed Oct 11 05:31:21 UTC 2023","9138","","Активность","Обычная активность","ActivityEditingTests","CheckEditDescriptionActivity","Редактирование активности: можно изменить описание",""
"passed","Wed Oct 11 05:38:48 UTC 2023","Wed Oct 11 05:39:11 UTC 2023","22428","","Библиотека","","LibraryInTileViewTests","CheckMoveMaterialToCatalogInTileView","Библиотека, плиточный вид: можно переместить материал в другой каталог",""
"passed","Wed Oct 11 05:31:33 UTC 2023","Wed Oct 11 05:31:44 UTC 2023","11100","","Активность","Задание","TaskWithSolutionStudentTests","CheckAbilityToEvaluateAnotherStudentsSolution","Страница решение задания: можно оценить решения другого студента, если включена 'Взаимопроверка'",""
"failed","Wed Oct 11 05:45:22 UTC 2023","Wed Oct 11 05:45:42 UTC 2023","20630","Активность","Контрольная","Прохождение теста","TestActivityStatusWithTwoOrMoreAttemptsTests","ResultOfPassingDependOnSettings","Страница командной контрольной: результат тестирования из попытках зависеть от настройки 'За лучшую попытку'",""
"passed","Wed Oct 11 05:36:45 UTC 2023","Wed Oct 11 05:36:55 UTC 2023","10357","","Дисциплина","Редактирование дисциплины","DisciplineDurationTests","CheckIfDatesFilledCorrectInDiscipline","Редактирование дисциплины: успешное сохранение, если обе даты корректно заполнены",""
"passed","Wed Oct 11 05:31:27 UTC 2023","Wed Oct 11 05:32:08 UTC 2023","40469","","Активность","Обычная активность","ActivityContentVisibilityTests","CheckVisibilityMaterialOutsideTimeActivity","Редактирование активности: видимость материала вне времени проведения активности",""
"passed","Wed Oct 11 05:38:15 UTC 2023","Wed Oct 11 05:38:25 UTC 2023","10007","","Библиотека","","LibraryActionPanelTests","CheckCreateCatalog","Библиотека, плиточный вид: можно создать каталог",""
"passed","Wed Oct 11 05:41:04 UTC 2023","Wed Oct 11 05:41:09 UTC 2023","4822","","Организация","Редактирование организации","OrganizationEditingTests","CheckCancelOrganizationEditing","Редактирование организации: работает кнопка Отмена",""
"passed","Wed Oct 11 05:37:46 UTC 2023","Wed Oct 11 05:37:51 UTC 2023","4902","","Чат","Групповой чат","GroupChatTests","CheckMembersOfGroupChatIsDisplayed","Список чатов - групповой чат: отображаются участники чата при клике на блок с аватарками",""
"passed","Wed Oct 11 05:30:22 UTC 2023","Wed Oct 11 05:30:31 UTC 2023","9478","","Активность","Задание","TaskActivityMulticriteriaTests","CheckMultiCriteriaCheckboxInTask","Создание задания: чекбокс многокритериальная проверка отображается, если выбрана стандартная проверка",""
"passed","Wed Oct 11 05:36:35 UTC 2023","Wed Oct 11 05:36:55 UTC 2023","20306","","Дисциплина","Страница дисциплины","DisciplineAnalyticsTests","CheckExportDisciplineAnalytics","Страница аналитика дисциплины: работает экспорт аналитики дисциплины",""
"passed","Wed Oct 11 05:32:06 UTC 2023","Wed Oct 11 05:32:10 UTC 2023","4677","","Активность","Обычная активность","ActivityDurationTests","CheckEditVolumeActivityWithIncorrectValues","Редактирование активности: отображение ошибки валидации для поля 'Объём' с значением > 100",""
"passed","Wed Oct 11 05:35:55 UTC 2023","Wed Oct 11 05:36:07 UTC 2023","11584","","Чат","Мини-чат страницы решений","TaskPageMiniChatTests","CheckAddReactionToLastMessageInTaskPageMiniChat","Чат на странице решения: можно добавить реакцию на сообщение",""
"passed","Wed Oct 11 05:41:35 UTC 2023","Wed Oct 11 05:41:46 UTC 2023","11071","","Профиль","","AddressAndContactsEditingTests","CheckCountryField","Редактирование профиля пользователя: можно изменить страну",""
"passed","Wed Oct 11 05:30:51 UTC 2023","Wed Oct 11 05:31:00 UTC 2023","8586","","Активность","Задание","TaskWithSolutionStudentTests","CheckEditSolution","Страница решение задания: можно редактировать решения",""
"passed","Wed Oct 11 05:32:06 UTC 2023","Wed Oct 11 05:32:08 UTC 2023","1680","","Активность","Обычный шаблон активности","TemplateEditingValidationTests","CheckNotExistScormResultScoreField","Редактирование шаблона активности: отсутствует поля 'Оценка по SCORM результату', если добавлен SCORM пакет в шаблон активности типов кроме контрольной",""
"passed","Wed Oct 11 05:35:10 UTC 2023","Wed Oct 11 05:35:18 UTC 2023","8014","","Чат","Чат для заметок","NotesChatTests","CheckSendFileMessageInNotesChat","Список чатов - чат для заметок: можно прикрепить и отправить файл с компьютера",""
"passed","Wed Oct 11 05:35:38 UTC 2023","Wed Oct 11 05:35:56 UTC 2023","18116","","Чат","Чат для заметок","NotesChatTests","CheckPinLastMessageInNotesChat","Список чатов - чат для заметок: можно закреплять сообщения",""
"passed","Wed Oct 11 05:30:46 UTC 2023","Wed Oct 11 05:31:08 UTC 2023","21854","","Активность","Обычная активность","ActivityDurationTests","CheckIfDatesFilledCorrectInAcivity","Редактирование активности: успешное сохранение, если обе даты корректно заполнены",""
"passed","Wed Oct 11 05:38:25 UTC 2023","Wed Oct 11 05:38:40 UTC 2023","15405","","Библиотека","","LibraryActionPanelTests","CheckCreateTextMaterial","Библиотека, плиточный вид: можно создать материал типа 'Текстовый материал'",""
"passed","Wed Oct 11 05:41:45 UTC 2023","Wed Oct 11 05:41:58 UTC 2023","12409","","Профиль","","UserInfoPageTests","CheckAddUserPhotoButtonIsClickable","Страница профиля пользователя: можно загрузить фото",""
"passed","Wed Oct 11 05:34:44 UTC 2023","Wed Oct 11 05:34:52 UTC 2023","7591","","Поток","Создание потока","CohortCreationValidationTests","CheckCreateCohortIfEachDateNotFilled","Создание потока: ошибка валидации, если дата окончания  не указана",""
"passed","Wed Oct 11 05:37:05 UTC 2023","Wed Oct 11 05:37:13 UTC 2023","8500","","Дисциплина","Создание дисциплины","DisciplineCreationValidationTests","CheckIfCreditValuesNotAllowed","Создание дисциплины ДО: отображение ошибки валидации для поля 'Кредиты' с значением 0",""
