"Status","Start Time","Stop Time","Duration in ms","Parent Suite","Suite","Sub Suite","Test Class","Test Method","Name","Description"
"passed","Thu Mar 13 07:20:14 UTC 2025","Thu Mar 13 07:20:52 UTC 2025","37780","","Дисциплина","Редактирование дисциплины","DisciplineDurationTests","ErrorWhenEndDateLessStartDateInDiscipline","Ошибка валидации, если дата окончания меньше даты начала",""
"passed","Thu Mar 13 07:09:40 UTC 2025","Thu Mar 13 07:10:19 UTC 2025","39285","Активность","Контрольная","Редактирование контрольной","TestActivityEditingTests","CheckSuccessSaveWithCorrectValueInMinThresholdField","Успешное сохранение при корректных значениях в поле Минимальный порог баллов",""
"passed","Thu Mar 13 07:27:50 UTC 2025","Thu Mar 13 07:28:04 UTC 2025","13684","","Библиотека","","LibraryActionPanelTests","CheckFindMaterialsByType","Библиотека, плиточный вид: работает поиск по типу материала",""
"passed","Thu Mar 13 07:07:08 UTC 2025","Thu Mar 13 07:07:47 UTC 2025","38896","Активность","Контрольная","Редактирование контрольной","TestActivityAddingTests","CheckAddTextMaterialToControlTypeActivity","Можно добавить материал типа Текст из Библиотеки в контрольную",""
"passed","Thu Mar 13 07:02:17 UTC 2025","Thu Mar 13 07:02:51 UTC 2025","33602","Активность","Обычная активность","Редактирование активности","ActivityDurationTests","CheckIfStartDateEmptyInAcivity","Успешное сохранение, если заполнена только дата окончания",""
"passed","Thu Mar 13 07:06:35 UTC 2025","Thu Mar 13 07:06:58 UTC 2025","23420","Активность","Контрольная","Прохождение теста","TestActivityStatusWithOneAttemptTests","CheckNoStatusWithOneIncompleteAttempt","Отсутствует статус и иконка для одной незавершенной попытки в командной контрольной",""
"passed","Thu Mar 13 07:12:42 UTC 2025","Thu Mar 13 07:13:10 UTC 2025","28214","","Чат","Личный чат","PersonalChatTests","CheckSendEmptyMessageInPersonalChat","Невозможно отправить пустое сообщение в личном чате",""
"passed","Thu Mar 13 07:23:16 UTC 2025","Thu Mar 13 07:23:30 UTC 2025","14681","","Подразделения","Редактирование подразделения","DivisionEditingTests","CheckEditDivisionName","Можно редактировать название подразделения",""
"passed","Thu Mar 13 07:05:35 UTC 2025","Thu Mar 13 07:06:01 UTC 2025","25901","Активность","Обычная активность","Редактирование активности","ActivityEditingTests","CheckActivityMaxThreshold","Проверка установки Максимального порога баллов в активности Кода будущего",""
"passed","Thu Mar 13 07:04:18 UTC 2025","Thu Mar 13 07:04:37 UTC 2025","19608","Активность","Задание","Страница решения задания для преподавателя","TaskActivityTeacherTests","CheckGradeSolutionIncorrectValues","Отображение ошибки валидации для поля Баллы со значением отлично",""
"passed","Thu Mar 13 07:32:11 UTC 2025","Thu Mar 13 07:32:38 UTC 2025","26793","","Материал","Конструктор теста","TestSettingsValidationTests","EditTestStudyTime","Конструктор теста: можно изменить время изучения",""
"passed","Thu Mar 13 07:18:40 UTC 2025","Thu Mar 13 07:19:04 UTC 2025","23413","","Дисциплина","Редактирование дисциплины","DisciplineAccessTests","CheckIfOtherTeacherChangeDiscipline","У преподавателя другой дисциплины нет возможности редактирования",""
"passed","Thu Mar 13 07:14:51 UTC 2025","Thu Mar 13 07:15:03 UTC 2025","11994","","Чат","Групповой чат","GroupChatMessageActionTests","CheckClosedDiscussionPanelInGroupChat","Закрытие панели обсуждения в групповом чате",""
"passed","Thu Mar 13 07:09:35 UTC 2025","Thu Mar 13 07:09:58 UTC 2025","23606","Активность","Шаблон активности контрольной","Редактирование шаблона контрольной","TestTemplateEditingTests","CheckErrorInEditingNumOfAttemptsWithIncorrectValue","Ошибка валидации в поле Количество попыток сдачи, если введено значение больше 20",""
"passed","Thu Mar 13 07:43:53 UTC 2025","Thu Mar 13 07:44:24 UTC 2025","30613","","Дисциплина","Создание дисциплины","DisContingentCreationTests","CheckAddTeacherByUserInfoInCreation","Добавление преподавателя по email",""
"passed","Thu Mar 13 07:21:25 UTC 2025","Thu Mar 13 07:21:38 UTC 2025","13594","","Дисциплина","Страница дисциплины","DisciplineRightMenuTests","CheckEditButtonForTeacher","Работает кнопка 'Редактировать' для преподавателя",""
"passed","Thu Mar 13 07:23:46 UTC 2025","Thu Mar 13 07:24:08 UTC 2025","22096","","Дисциплина","Редактирование дисциплины","DisContingentEditingTests","CheckRemoveTeacherFromDiscipline","Открепление преподавателя от дисциплины",""
"passed","Thu Mar 13 07:31:43 UTC 2025","Thu Mar 13 07:32:11 UTC 2025","27996","","Материал","Конструктор теста","TestSettingsValidationTests","ClearTagsFromTest","Конструктор теста: можно удалить теги знаний",""
"passed","Thu Mar 13 07:21:20 UTC 2025","Thu Mar 13 07:21:41 UTC 2025","20203","","Дисциплина","Редактирование дисциплины","DisciplineAccessTests","CheckIfSuperAdminChangeDiscipline","У суперадминистратора есть возможность редактирования",""
"passed","Thu Mar 13 07:15:34 UTC 2025","Thu Mar 13 07:15:59 UTC 2025","25501","","Чат","Личный чат","PersonalChatTests","CheckSendFileMessageInPersonalChat","Можно прикрепить и отправить файл с компьютера в личном чате",""
"passed","Thu Mar 13 07:44:54 UTC 2025","Thu Mar 13 07:45:25 UTC 2025","30502","Активность","Контрольная","Прохождение теста","TestActivityStatusWithTwoOrMoreAttemptsTests","CheckResultOfPassingDependOnSettings","Результат тестирования в попытках зависит от настройки За последнюю попытку в индивидуальной контрольной",""
"broken","Thu Mar 13 07:45:00 UTC 2025","Thu Mar 13 07:45:38 UTC 2025","37976","Активность","Контрольная","Результат прохождения теста","TestActivityResultTests","CheckTeacherCanLeaveCommentOnAnswer","Преподаватель может удалить комментарий к ответу, если была отмечена галка Отображать студентам подробную информацию о результатах",""
"passed","Thu Mar 13 07:28:30 UTC 2025","Thu Mar 13 07:29:02 UTC 2025","31604","","Библиотека","","LibraryInListViewTests","CheckEditMaterialViaActionsButton","Библиотека, списочный вид: можно редактировать материал через actions-кнопки",""
"passed","Thu Mar 13 07:12:27 UTC 2025","Thu Mar 13 07:13:01 UTC 2025","34092","","Чат","Чат дисциплины","DisciplineChatTests","CheckAddQuoteToLastMessageInDisciplineChat","Можно цитировать сообщение в чате дисциплины",""
"passed","Thu Mar 13 07:26:15 UTC 2025","Thu Mar 13 07:27:04 UTC 2025","48485","","Библиотека","","RemovingTemplatesTests","CheckDeleteProgramTemplate","Страница библиотеки: можно удалить шаблон программы",""
"passed","Thu Mar 13 07:29:50 UTC 2025","Thu Mar 13 07:30:39 UTC 2025","48380","","Библиотека","","LibraryInListViewTests","CheckCopyMaterialViaActionsButton","Библиотека, списочный вид: можно скопировать материал через actions-кнопки",""
"passed","Thu Mar 13 07:25:20 UTC 2025","Thu Mar 13 07:25:39 UTC 2025","18979","","Экзамен","","ExamPageTests","DeleteExaminationPlatform","Удаление экзаменационной площадки",""
"passed","Thu Mar 13 07:42:45 UTC 2025","Thu Mar 13 07:43:21 UTC 2025","35401","Активность","Контрольная","Результат прохождения теста","TestActivityResultTests","CheckStudentCanViewDetailedResultInfo","Студент не может просматривать подробную информацию о результатах, если соответствующий чекбокс выключен",""
"passed","Thu Mar 13 07:34:23 UTC 2025","Thu Mar 13 07:34:37 UTC 2025","13894","","Программа","","ProgramEditingTests","CheckRemoveEducPaidProgramWithoutCohort","Можно удалить платную программу без потоков программы ДО",""
"passed","Thu Mar 13 07:44:24 UTC 2025","Thu Mar 13 07:44:51 UTC 2025","26898","","Дисциплина","Создание дисциплины","DisContingentCreationTests","CheckAddTeacherByUserInfoInCreation","Добавление преподавателя из списка",""
"passed","Thu Mar 13 07:47:08 UTC 2025","Thu Mar 13 07:47:30 UTC 2025","22464","","Материал","Конструктор тест-тренажера","TestTrainAddingQuestionsTests","CheckAddQuestionInTestTrainFreeAnswerWithDiapason","Конструктор теста-тренажера: можно добавить вопрос с типом ответа “Свободный ответ” - “Диапазон”",""
"passed","Thu Mar 13 07:28:26 UTC 2025","Thu Mar 13 07:29:27 UTC 2025","60583","","Материал","Конструктор теста","TestAddingQuestionsTests","CheckAddQuestionWithFreeAnswerExactMatch","Конструктор теста: можно добавить вопрос с типом ответа “Свободный ответ” - “Точное совпадение”",""
"passed","Thu Mar 13 07:16:56 UTC 2025","Thu Mar 13 07:17:24 UTC 2025","28810","","Чат","Обсуждение решения","TaskChatTests","CheckAddReactionToLastMessageInTaskChat","Можно добавить реакцию на сообщение в обсуждении решения",""
"passed","Thu Mar 13 07:14:57 UTC 2025","Thu Mar 13 07:15:31 UTC 2025","33883","","Чат","Чат дисциплины","DisciplineChatTests","CheckSendEmojiInDisciplineChat","Можно отправить смайлик в чате дисциплины",""
"passed","Thu Mar 13 07:22:35 UTC 2025","Thu Mar 13 07:22:48 UTC 2025","13297","","Дисциплина","Страница дисциплины","DisciplineStudentTests","CheckAttendanceByStudent","У студента нет возможности отметить/снять посещаемость",""
"passed","Thu Mar 13 07:17:32 UTC 2025","Thu Mar 13 07:17:49 UTC 2025","17101","","Поток","Завершение обучения","EducationCompletionPageTests","CheckTransitionToEducationCompletionPageCodeOfFuture","Переход со страницы потока на страницу завершения обучения потока для потоков Кода Будущего",""
"passed","Thu Mar 13 07:03:16 UTC 2025","Thu Mar 13 07:04:24 UTC 2025","68695","Активность","Задание","Страница решения задания для студента","TaskWithSolutionStudentTests","CheckSendAnotherFileSolution","Можно добавить ещё один файл в решение",""
"passed","Thu Mar 13 07:16:26 UTC 2025","Thu Mar 13 07:16:53 UTC 2025","27698","","Чат","Чат дисциплины","DisciplineChatTests","CheckSendMessageByTappingEnterInDisciplineChat","Можно отправить сообщение по нажатию на Enter в чате дисциплины",""
"passed","Thu Mar 13 07:47:31 UTC 2025","Thu Mar 13 07:47:53 UTC 2025","21616","","Материал","Конструктор теста","TestAddingQuestionsTests","CheckAddComparisonTestQuestion","Конструктор теста: можно добавить вопрос с типом ответа “Сопоставление”",""
"passed","Thu Mar 13 07:04:37 UTC 2025","Thu Mar 13 07:04:46 UTC 2025","8696","Активность","Задание","Страница решения задания для преподавателя","TaskActivityTeacherTests","CheckSendSolutionForRevision","Можно отправить решение на доработку",""
"passed","Thu Mar 13 07:21:56 UTC 2025","Thu Mar 13 07:22:18 UTC 2025","21598","","Дисциплина","Создание дисциплины","DisContingentCreationValidationTests","CheckUnableAddGroupFromAnotherCohortInCreation","Невозможно добавить группу из стороннего потока",""
"failed","Thu Mar 13 07:43:48 UTC 2025","Thu Mar 13 07:44:04 UTC 2025","16919","","Поток","Редактирование потока","CohortEditingValidationTests","CheckIsNotPossibleChangeDatesInEditingCohort","Редактирование потока ДО (СЗ): нет возможности изменить даты потока, если в нем есть слушатели",""
"passed","Thu Mar 13 07:44:26 UTC 2025","Thu Mar 13 07:44:53 UTC 2025","27108","","Подразделения","Страница подразделения","DivisionPageTests","CheckTransitionToDivisionLibraryPage","Работает переход к библиотеке подразделения",""
"passed","Thu Mar 13 07:08:09 UTC 2025","Thu Mar 13 07:08:54 UTC 2025","44992","Активность","Контрольная","Создание контрольной","TestActivityCreatingTests","CheckModalAppearsIfTimeIsNotSpecified","Появление модалки при сохранении, если не было указано время проведения",""
"passed","Thu Mar 13 07:00:39 UTC 2025","Thu Mar 13 07:00:52 UTC 2025","13014","Активность","Задание","Страница решения задания для преподавателя","TaskActivityTeacherTests","CheckGradeSolutionWithoutValue","Кнопка Оценить некликабельна, если решение еще не оценено",""
"passed","Thu Mar 13 07:14:47 UTC 2025","Thu Mar 13 07:15:00 UTC 2025","12893","","Чат","Личный чат","PersonalChatTests","CheckFindSentMessageInPersonalChat","Можно найти отправленное сообщение в личном чате",""
"passed","Thu Mar 13 07:23:57 UTC 2025","Thu Mar 13 07:24:05 UTC 2025","7516","","Подразделения","Создание подразделения","DivisionCreationTests","CheckCreateDivisionIfRequiredFieldsNotFilled","Ошибка валидации в обязательных полях, если они не заполнены",""
"passed","Thu Mar 13 07:14:45 UTC 2025","Thu Mar 13 07:15:05 UTC 2025","20206","","Поток","Создание потока","CohortCreationWarningModalTests","CheckCreateCohortWithMismatchWarningOfDuration","Создание потока: предупреждение о несоответствии длительности потока для программ длительностью 144 часа",""
"passed","Thu Mar 13 07:42:11 UTC 2025","Thu Mar 13 07:42:43 UTC 2025","31913","Активность","Задание","Страница решения задания для преподавателя","TaskActivityTeacherTests","CheckGradeSolutionWithZeroValue","Можно оценить решения значением 0",""
"passed","Thu Mar 13 07:04:43 UTC 2025","Thu Mar 13 07:05:10 UTC 2025","26981","Активность","Обычная активность","Редактирование активности","ActivityDurationTests","CheckEditActivityVolumeWithIncorrectValue","Отображение ошибки валидации для поля Объем в академических часах со значением больше 100",""
"passed","Thu Mar 13 07:13:14 UTC 2025","Thu Mar 13 07:13:38 UTC 2025","24599","","Поток","Создание потока","CohortCreationTests","CheckCancelCohortCreation","Создание потока ДО: работает кнопка 'Отмена', если страница создание был открыть со страницы программы",""
"passed","Thu Mar 13 07:27:13 UTC 2025","Thu Mar 13 07:27:59 UTC 2025","46112","","Библиотека","","LibraryInListViewTests","CheckRenameMaterialInListView","Библиотека, списочный вид: можно переименовать материал",""
"passed","Thu Mar 13 07:47:03 UTC 2025","Thu Mar 13 07:47:15 UTC 2025","11891","","Профиль","","AddressAndContactsEditingTests","CheckCityField","Редактирование профиля пользователя: можно изменить город",""
"passed","Thu Mar 13 07:25:13 UTC 2025","Thu Mar 13 07:25:31 UTC 2025","17500","","Экзамен","","ExamCreateEditTests","ErrorDeleteExam","Ошибка при удаление экзамена",""
"broken","Thu Mar 13 07:42:08 UTC 2025","Thu Mar 13 07:42:50 UTC 2025","41798","Активность","Контрольная","Прохождение теста","TestActivityStatusWithTwoOrMoreAttemptsTests","CheckStatusExistIfAtLeastOneCompletedAttempt","Статус отображается, если есть хотя бы одна завершенная попытка в индивидуальной контрольной",""
"passed","Thu Mar 13 07:24:15 UTC 2025","Thu Mar 13 07:24:51 UTC 2025","35992","","Дисциплина","Страница дисциплины","DisciplineMarksAndAttendanceTests","CheckAttendanceByTeacher","Преподаватель может поставить/убрать галочку посещаемости",""
"passed","Thu Mar 13 07:33:07 UTC 2025","Thu Mar 13 07:33:44 UTC 2025","36588","","Материал","Конструктор теста","TestQuestionAnswersValidationTests","CheckEditCommentInTestAnswer","Конструктор теста: можно изменить комментарий к варианту ответа",""
"passed","Thu Mar 13 07:21:13 UTC 2025","Thu Mar 13 07:21:23 UTC 2025","10486","","Дисциплина","Редактирование дисциплины","DisciplineEditingValidationTests","CheckImpossibilityTurnOnOrOffIOT","Невозможно отключить ИОТ, если в дисциплине есть активности",""
"passed","Thu Mar 13 07:01:55 UTC 2025","Thu Mar 13 07:02:35 UTC 2025","40290","Активность","Задание","Создание задания","TaskActivityCreatingTests","CheckCreateTaskWithMutualVerification","Можно создать активность типа Задание с взаимопроверкой",""
"passed","Thu Mar 13 07:13:54 UTC 2025","Thu Mar 13 07:14:20 UTC 2025","26105","","Чат","Миничат страницы решений","TaskPageMiniChatTests","CheckSendEmptyMessageInTaskPageMiniChat","Невозможно отправить пустое сообщение в миничате страницы решений",""
"passed","Thu Mar 13 07:17:25 UTC 2025","Thu Mar 13 07:17:57 UTC 2025","32597","","Поток","Страница потока","CohortInfoTests","CheckNotAccessToUploadsForStudents","Страница потока: отсутствие доступа студента к выгрузкам",""
"passed","Thu Mar 13 07:16:28 UTC 2025","Thu Mar 13 07:16:43 UTC 2025","14714","","Поток","Создание потока","CohortCreationValidationTests","CheckCreateCohortIfStartAndEndDateNotFilled","Создание потока: ошибка валидации, если даты начала и окончания не указаны",""
"passed","Thu Mar 13 07:33:13 UTC 2025","Thu Mar 13 07:33:34 UTC 2025","20892","","Материал","Конструктор тест-тренажера","TestTrainSettingsValidationTests","RemoveAuthorInTestTrain","Конструктор теста-тренажера: можно удалить автора",""
"passed","Thu Mar 13 07:07:24 UTC 2025","Thu Mar 13 07:07:59 UTC 2025","34682","Активность","Контрольная","Прохождение теста","TestActivityPassingTests","CheckContinueAnIncompleteAttempt","Можно продолжить выполнение незавершенной попытки",""
"passed","Thu Mar 13 07:21:49 UTC 2025","Thu Mar 13 07:22:28 UTC 2025","39490","","Дисциплина","Страница дисциплины","DisciplineRightMenuTests","CreateTemplateFromDiscipline","Создание шаблона из дисциплины",""
"passed","Thu Mar 13 07:42:29 UTC 2025","Thu Mar 13 07:42:38 UTC 2025","8771","","Чат","Чат дисциплины","DisciplineChatTests","CheckFindSentMessageInDisciplineChat","Можно найти отправленное сообщение в чате дисциплины",""
"passed","Thu Mar 13 07:16:03 UTC 2025","Thu Mar 13 07:16:20 UTC 2025","16505","","Чат","Чат для заметок","NotesChatTests","CheckOpenImageInNotesChat","Можно раскрывать изображения в чате для заметок",""
"passed","Thu Mar 13 07:13:10 UTC 2025","Thu Mar 13 07:13:51 UTC 2025","41184","","Чат","Личный чат","PersonalChatTests","CheckEditLastMessageInPersonalChat","Можно редактировать сообщение в течение 4 часов после отправки в личном чате",""
"passed","Thu Mar 13 07:24:18 UTC 2025","Thu Mar 13 07:24:45 UTC 2025","26998","","Дисциплина","Создание дисциплины","DisContingentCreationTests","CheckCreateDisciplineByUncheckingBoxAllCohortStudents","Можно создать дисциплину, отключив чекбокс ‘Все студенты потока’",""
"passed","Thu Mar 13 07:11:11 UTC 2025","Thu Mar 13 07:11:29 UTC 2025","18390","Активность","Шаблон активности контрольной","Редактирование шаблона контрольной","TestTemplateEditingTests","CheckSuccessEditingMinThresholdWithCorrectValue","Успешное сохранение при корректных значениях в поле Минимальный порог баллов",""
"broken","Thu Mar 13 07:43:59 UTC 2025","Thu Mar 13 07:44:33 UTC 2025","34714","","Дисциплина","Страница дисциплины","DisciplineStudentTests","CheckPinDisciplineForStudent","Работает кнопка закрепления/открепления из главного меню для студента",""
"passed","Thu Mar 13 07:22:21 UTC 2025","Thu Mar 13 07:22:35 UTC 2025","13981","","Дисциплина","Страница дисциплины","DisciplineStudentTests","CheckGradingByStudent","У студента нет возможности выставить оценку",""
"passed","Thu Mar 13 07:23:40 UTC 2025","Thu Mar 13 07:23:48 UTC 2025","7518","","Подразделения","Редактирование подразделения","DivisionEditingTests","CheckDeleteDivisionType","Невозможно сохранить подразделение очистив поле Тип",""
"passed","Thu Mar 13 07:25:45 UTC 2025","Thu Mar 13 07:26:06 UTC 2025","21187","","Дисциплина","Редактирование дисциплины","DisContingentEditingTests","CheckCreateDisciplineByUncheckingBoxAllCohortStudents","Есть возможность сохранить дисциплину, сняв галку Все студенты потока",""
"passed","Thu Mar 13 07:34:41 UTC 2025","Thu Mar 13 07:34:49 UTC 2025","8210","","Организация","Страница организации","OrganizationPageTests","CheckTransitionToStaffImportPage","Работает переход к странице импорта сотрудников",""
"passed","Thu Mar 13 07:25:45 UTC 2025","Thu Mar 13 07:26:07 UTC 2025","21589","","Библиотека","","BulkActionsLibraryTests","CheckInSelectModeFirstElementIsSelected","Библиотека: при переходе в режим выбора первый элемент должен быть выбран",""
"passed","Thu Mar 13 07:23:04 UTC 2025","Thu Mar 13 07:23:23 UTC 2025","19189","","Подразделения","Создание подразделения","DivisionCreationTests","CheckCreateDivisionWithFillingRequiredFields","Можно создать подразделение, если заполнены только обязательные поля",""
