"Status","Start Time","Stop Time","Duration in ms","Parent Suite","Suite","Sub Suite","Test Class","Test Method","Name","Description"
"passed","Mon Nov 20 05:24:16 UTC 2023","Mon Nov 20 05:24:26 UTC 2023","9650","Активность","Контрольная","Результат прохождения теста","TestActivityResultTests","CheckMarkIncorrectTextOrFileAnswer","Результат прохождения: можно отметить 'Не верно' ответ вопроса с типом ответа свободный ответ или файл",""
"passed","Mon Nov 20 05:30:14 UTC 2023","Mon Nov 20 05:30:25 UTC 2023","11180","","Материал","Конструктор тест-тренажера","TestTrainBlocksAndVariantsValidationTests","AddBlockTestTrain","Конструктор теста-тренажера: можно добавить блок",""
"passed","Mon Nov 20 05:29:30 UTC 2023","Mon Nov 20 05:29:49 UTC 2023","19455","","Материал","Конструктор теста","TestAddingQuestionsTests","CheckAddQuestionWithFreeAnswerManualCheck","Конструктор теста: можно добавить вопрос с типом ответа “Свободный ответ” - “Ручная проверка”",""
"passed","Mon Nov 20 05:30:57 UTC 2023","Mon Nov 20 05:31:09 UTC 2023","12123","","Организация","Создание организации","OrganizationCreationTests","CheckCreateOrganization","Создание организации: можно создать организацию, если заполнены только обязательные поля",""
"passed","Mon Nov 20 05:28:17 UTC 2023","Mon Nov 20 05:28:32 UTC 2023","14472","","Дисциплина","Создание дисциплины","DisContingentCreationTests","CheckAddTeacherByUserInfoInCreation","Создание дисциплины: добавление преподавателя по ссылке на профиль",""
"passed","Mon Nov 20 05:23:21 UTC 2023","Mon Nov 20 05:23:33 UTC 2023","11986","Активность","Контрольная","Прохождение теста","TestActivityPassingTests","CheckCancelSendingForReview","Можно отменить отправку на проверку (Изменить ответы)",""
"passed","Mon Nov 20 05:29:14 UTC 2023","Mon Nov 20 05:29:21 UTC 2023","6336","","Библиотека","","LibraryActionPanelTests","CheckFindMaterialByName","Библиотека, плиточный вид: можно найти материал в поиске по названию",""
"passed","Mon Nov 20 05:27:27 UTC 2023","Mon Nov 20 05:27:32 UTC 2023","4353","","Чат","Групповой чат","GroupChatTests","CheckAddGroupChatRoomWithoutName","Список чатов - групповой чат: невозможно добавить чат, если не заполнен поля 'Название'",""
"passed","Mon Nov 20 05:30:55 UTC 2023","Mon Nov 20 05:31:03 UTC 2023","8719","","Материал","Конструктор тест-тренажера","TestTrainSettingsValidationTests","AddAuthorInTestTrain","Конструктор теста-тренажера: можно добавить автора",""
"passed","Mon Nov 20 05:28:17 UTC 2023","Mon Nov 20 05:28:34 UTC 2023","17491","","Дисциплина","Редактирование дисциплины","DisContingentEditingTests","CheckAddTeacherByUserInfoInEditing","Редактирование дисциплины: добавление преподавателя из списка",""
"passed","Mon Nov 20 05:27:25 UTC 2023","Mon Nov 20 05:27:29 UTC 2023","4480","","Дисциплина","Редактирование дисциплины","DisciplineEditingValidationTests","CheckIfDescriptionNotFilledInEditing","Редактирование дисциплины: отображение ошибки валидации для поля 'Описание', если поле не заполнено",""
"passed","Mon Nov 20 05:24:59 UTC 2023","Mon Nov 20 05:25:14 UTC 2023","15296","","Чат","Личный чат","PersonalChatTests","CheckAddQuoteToLastMessageInPersonalChat","Список чатов - личный чат: можно цитировать сообщению",""
"passed","Mon Nov 20 05:25:27 UTC 2023","Mon Nov 20 05:25:36 UTC 2023","8956","","Поток","Создание потока","CohortCreationWarningModalTests","CheckCreateCohortWithoutMismatchWarningOfDuration","Создание потока: нет предупреждения о несоответствии длительности потока для программ длительностью кроме 72, 144 и 256 часов",""
"passed","Mon Nov 20 05:31:51 UTC 2023","Mon Nov 20 05:31:59 UTC 2023","7457","","Профиль","","AddressAndContactsEditingTests","CheckCityField","Редактирование профиля пользователя: можно изменить город",""
"passed","Mon Nov 20 05:23:07 UTC 2023","Mon Nov 20 05:23:30 UTC 2023","22325","Активность","Контрольная","Прохождение теста","TestActivityStatusWithTwoOrMoreAttemptsTests","ResultOfPassingDependOnSettings","Страница индивидуальной контрольной: результат тестирования из попытках зависеть от настройки 'За лучшую попытку'",""
"passed","Mon Nov 20 05:28:21 UTC 2023","Mon Nov 20 05:28:24 UTC 2023","2825","","Дисциплина","Страница дисциплины","DisciplineStudentTests","CheckGradesDropdownForStudent","Страница оценок дисциплины: отсутствия кнопки 'Итоговые оценки (ведомость)' у студента",""
"passed","Mon Nov 20 05:28:02 UTC 2023","Mon Nov 20 05:28:17 UTC 2023","15082","","Дисциплина","Создание дисциплины","DisContingentCreationTests","CheckAddTeacherByUserInfoInCreation","Создание дисциплины: добавление преподавателя из списка",""
"passed","Mon Nov 20 05:24:22 UTC 2023","Mon Nov 20 05:24:33 UTC 2023","11326","","Чат","Чат решения","TaskChatTests","CheckSendTextMessageInTaskChat","Список чатов - обсуждение решения: можно отправить текстовое сообщение",""
"passed","Mon Nov 20 05:22:05 UTC 2023","Mon Nov 20 05:22:10 UTC 2023","4638","","Активность","Обычная активность","ActivityDurationTests","CheckEditVolumeActivityWithIncorrectValues","Редактирование активности: отображение ошибки валидации для поля 'Объём' с значением '0'",""
"passed","Mon Nov 20 05:32:17 UTC 2023","Mon Nov 20 05:32:20 UTC 2023","2734","","Расписание","","ScheduleTests","CheckMonthModeIsNotDisplayedInMobileVersion","В мобильной версии нет возможности выбрать режим Месяц",""
"failed","Mon Nov 20 05:34:52 UTC 2023","Mon Nov 20 05:35:06 UTC 2023","13487","Активность","Контрольная","Создание контрольной","TestActivityCreatingTests","CheckModalAppearsIfTimeIsNotSpecified","Появление модалки при сохранении, если не было указано время проведения",""
"passed","Mon Nov 20 05:30:04 UTC 2023","Mon Nov 20 05:30:10 UTC 2023","5451","","Материал","Конструктор теста","TestQuestionAnswersValidationTests","CheckRemoveCommentInTestAnswer","Конструктор теста: можно удалить комментарий к варианту ответа",""
"passed","Mon Nov 20 05:22:01 UTC 2023","Mon Nov 20 05:22:09 UTC 2023","8338","","Активность","Задание","TaskActivityTeacherTests","CheckGradeSolutionIncorrectValues","Отображение ошибки валидации для поля баллы с отрицательным значением",""
"passed","Mon Nov 20 05:23:37 UTC 2023","Mon Nov 20 05:23:53 UTC 2023","15835","Активность","Контрольная","Прохождение теста","TestActivityStatusWithOneAttemptTests","CheckStatusScoreColorAndIcon","Страница индивидуальной контрольной: статус и цвет у количества баллов в попытке различаются в зависимости от успешности",""
"passed","Mon Nov 20 05:21:56 UTC 2023","Mon Nov 20 05:22:06 UTC 2023","9521","","Активность","Задание","TaskWithSolutionStudentTests","CheckAbilityToEditAssessmentOfAnotherStudentsSolution","Можно редактировать поставленную оценку к решении другого студента, если включена 'Взаимопроверка'",""
"passed","Mon Nov 20 05:21:29 UTC 2023","Mon Nov 20 05:21:37 UTC 2023","8049","","Активность","Обычная активность","ActivityEditingFormatTests","CheckActivityFormatIndependancyStudy","Редактирование активности: проверка формата активности самостоятельное изучение",""
"passed","Mon Nov 20 05:23:06 UTC 2023","Mon Nov 20 05:23:13 UTC 2023","6441","Активность","Контрольная","Редактирование контрольной","TestActivityEditingTests","CheckErrorInTimeLimitFieldWithIncorrectValue","Ошибка валидации в поле Временной лимит, если введено отрицательное значение",""
"passed","Mon Nov 20 05:26:20 UTC 2023","Mon Nov 20 05:26:23 UTC 2023","2149","","Поток","Завершение обучения","EducationCompletionPageTests","FindStudentWithName","Поиск студента по ФИО на странице завершения обучения потока",""
"passed","Mon Nov 20 05:26:42 UTC 2023","Mon Nov 20 05:26:49 UTC 2023","7552","","Поток","Редактирование потока","CohortEditingValidationTests","CheckIsNotPossibleChangeDatesInEditingCohort","Редактирование потока ДО (СЗ): нет возможности изменить даты потока, если в нем есть слушатели",""
"passed","Mon Nov 20 05:30:12 UTC 2023","Mon Nov 20 05:30:31 UTC 2023","18968","","Материал","Конструктор тест-тренажера","TestTrainAddingQuestionsTests","CheckAddQuestionInTestTrainFreeAnswerWithEqual","Конструктор теста-тренажера: можно добавить вопрос с типом ответа “Свободный ответ” - “Точное совпадение”",""
"passed","Mon Nov 20 05:29:09 UTC 2023","Mon Nov 20 05:29:13 UTC 2023","4052","","Библиотека","","StudentLibraryTests","CheckAvailabilityOfContentCreation","Библиотека студента: недоступно создание материалов кроме добавления файла и создания текстового материала",""
"passed","Mon Nov 20 05:28:42 UTC 2023","Mon Nov 20 05:28:47 UTC 2023","4715","","Библиотека","","BulkActionsLibraryTests","CheckAppearanceOfMoveDeleteAndCancelButtons","Библиотека: появление кнопок переместить, удалить, и отмена при активации режима выбора",""
"passed","Mon Nov 20 05:22:34 UTC 2023","Mon Nov 20 05:22:51 UTC 2023","17240","Активность","Контрольная","Результат прохождения теста","TestActivityResultTests","StudentCanViewDetailedResultInfo","Результат прохождения: студент может просматривать подробную информацию о результатах, если включена соответственная опция",""
"passed","Mon Nov 20 05:24:49 UTC 2023","Mon Nov 20 05:25:05 UTC 2023","16268","","Чат","Групповой чат","GroupChatTests","CheckCallInGroupChat","Список чатов - групповой чат: можно сделать звонок",""
"passed","Mon Nov 20 05:21:01 UTC 2023","Mon Nov 20 05:21:21 UTC 2023","20198","","Активность","Обычная активность","ActivityDurationTests","CheckIfDatesFilledCorrectInAcivity","Редактирование активности: успешное сохранение, если обе даты корректно заполнены",""
"passed","Mon Nov 20 05:29:23 UTC 2023","Mon Nov 20 05:29:30 UTC 2023","6909","","Дисциплина","Редактирование дисциплины","DisContingentEditingTests","CheckEditDisciplineByCheckingBoxAllCohortStudents","Редактированиедисциплины: есть возможность сохранить дисциплину выбрав галку ‘Все студенты потока’",""
"passed","Mon Nov 20 05:28:27 UTC 2023","Mon Nov 20 05:28:32 UTC 2023","4934","","Дисциплина","Страница дисциплины","DisciplineStudentTests","CheckGradingByStudent","Страница оценок дисциплины: невозможности выставления оценки студентом",""
"passed","Mon Nov 20 05:29:48 UTC 2023","Mon Nov 20 05:29:57 UTC 2023","8460","","Материал","Конструктор теста","TestSettingsValidationTests","AddAuthorInTest","Конструктор теста: можно добавить автора",""
"passed","Mon Nov 20 05:24:10 UTC 2023","Mon Nov 20 05:24:20 UTC 2023","9123","","Чат","Групповой чат","GroupChatTests","CheckSendEmptyMessageInGroupChat","Список чатов - групповой чат: невозможно отправить пустое сообщение",""
"passed","Mon Nov 20 05:24:30 UTC 2023","Mon Nov 20 05:24:47 UTC 2023","16287","","Чат","Мини-чат группового чата","GroupMiniChatTests","CheckCallInGroupMiniChat","Миничат - групповой чат: можно сделать звонок",""
"passed","Mon Nov 20 05:27:01 UTC 2023","Mon Nov 20 05:27:19 UTC 2023","17650","","Дисциплина","Создание дисциплины","DisciplineCreationTests","CreatDisciplineIfReqFieldsAreFilled","Создание дисциплины ДО: можно создать дисциплину, если заполнены обязательные поля",""
"passed","Mon Nov 20 05:26:10 UTC 2023","Mon Nov 20 05:26:17 UTC 2023","6727","","Чат","Мини-чат страницы решений","TaskPageMiniChatTests","CheckSendMessageByTappingEnterInTaskPageMiniChat","Чат на странице решения: можно отправить сообщения по нажатию на Enter",""
"passed","Mon Nov 20 05:21:01 UTC 2023","Mon Nov 20 05:21:28 UTC 2023","26680","","Активность","Обычная активность","ActivityContentVisibilityTests","CheckVisibilityMaterialDuringActivity","Редактирование активности: видимость материала во время проведения активности",""
"passed","Mon Nov 20 05:27:17 UTC 2023","Mon Nov 20 05:27:20 UTC 2023","3885","","Дисциплина","Редактирование дисциплины","DisciplineEditingValidationTests","CheckIfNameNotFilledInEditing","Редактирование дисциплины: отображение ошибки валидации для поля 'Название', если поле не заполнено",""
"passed","Mon Nov 20 05:27:08 UTC 2023","Mon Nov 20 05:27:11 UTC 2023","3408","","Дисциплина","Страница дисциплины","DisciplineActivitiesBlockTests","CheckActivityVolumeIsDisplayed","Страница дисциплины: отображается объём ОА",""
"passed","Mon Nov 20 05:31:14 UTC 2023","Mon Nov 20 05:31:34 UTC 2023","20038","","Материал","Конструктор теста","TestAddingQuestionsTests","CheckAddSortingTestQuestion","Конструктор теста: можно добавить вопрос с типом ответа “Сортировка”",""
"passed","Mon Nov 20 05:25:41 UTC 2023","Mon Nov 20 05:25:45 UTC 2023","3796","","Поток","Редактирование потока","CohortEditingTests","CheckEditCohortByCheckingCheckboxRegistrationLink","Редактирование потока ДО: успешное сохранение, при отметке/снятии галки ‘Разрешена регистрация по ссылке’",""
"passed","Mon Nov 20 05:26:58 UTC 2023","Mon Nov 20 05:27:02 UTC 2023","4542","","Дисциплина","Редактирование дисциплины","DisciplineAccessTests","CheckOtherOrgAdminChangeDiscipline","Редактирование дисциплины: нет возможности редактировать у администратора организации, к которому дисциплина НЕ относится",""
"passed","Mon Nov 20 05:23:58 UTC 2023","Mon Nov 20 05:24:16 UTC 2023","18154","","Активность","Шаблон активности контрольной","TestTemplateCreatingTests","CheckExecModeTestActivityTemplate","Можно создать шаблон контрольной с режимом выполнения Индивидуальный",""
"failed","Mon Nov 20 05:34:46 UTC 2023","Mon Nov 20 05:34:46 UTC 2023","358","","Активность","Шаблон активности контрольной","TestTemplateEditingTests","CheckErrorInEditingNumOfAttemptsWithIncorrectValue","Ошибка валидации в поле Количество попыток сдачи, если введено значение больше 20",""
"passed","Mon Nov 20 05:22:17 UTC 2023","Mon Nov 20 05:22:25 UTC 2023","8589","","Активность","Задание","TaskActivityTeacherTests","CheckGradeSolutionIncorrectValues","Отображение ошибки валидации для поля баллы с значением 'отлично'",""
"passed","Mon Nov 20 05:29:37 UTC 2023","Mon Nov 20 05:29:48 UTC 2023","10091","","Библиотека","","BulkActionsLibraryTests","CheckConfirmModalIsAppearWhenRemovingSelectedItems","Библиотека: при попытке удалить выбранных элементов отображается модалка подтверждения",""
"passed","Mon Nov 20 05:26:04 UTC 2023","Mon Nov 20 05:26:21 UTC 2023","17154","","Чат","Групповой чат","GroupChatTests","CheckPinLastMessageInGroupChat","Список чатов - групповой чат: можно закреплять сообщения",""
"passed","Mon Nov 20 05:26:07 UTC 2023","Mon Nov 20 05:26:16 UTC 2023","8968","","Чат","Дисциплина","DisciplineChatTests","CheckAddReactionToLastMessageInDisciplineChat","Список чатов - комната дисциплины: можно добавить реакцию на сообщение",""
"passed","Mon Nov 20 05:29:18 UTC 2023","Mon Nov 20 05:29:37 UTC 2023","19411","","Библиотека","","BulkActionsLibraryTests","CheckMoveMultipleSelectedItemsToAnotherDirectory","Библиотека: можно переместить несколько выбранных элементов в другой каталог",""
"passed","Mon Nov 20 05:30:10 UTC 2023","Mon Nov 20 05:30:16 UTC 2023","5929","","Материал","Конструктор теста","TestQuestionAnswersValidationTests","CheckRemoveAnswerFromMultipleChoiceQuestion","Конструктор теста: можно удалить вариант ответа из вопроса с типом ответа 'Выбор из вариантов'",""
"passed","Mon Nov 20 05:30:45 UTC 2023","Mon Nov 20 05:30:55 UTC 2023","9811","","Материал","Конструктор тест-тренажера","TestTrainSettingsValidationTests","EditTestTrainDescription","Конструктор теста-тренажера: можно изменить описание теста-тренажера",""
"passed","Mon Nov 20 05:27:19 UTC 2023","Mon Nov 20 05:27:25 UTC 2023","5923","","Дисциплина","Создание дисциплины","DisciplineCreationTests","CancelCreatingDiscipline"," Cоздание дисциплины в потоке ДО: работает кнопка 'Отмена'",""
"passed","Mon Nov 20 05:27:46 UTC 2023","Mon Nov 20 05:28:00 UTC 2023","13888","","Дисциплина","Страница дисциплины","DisciplineRightMenuTests","CreateTemplateFromDiscipline","Страница дисциплины: создание шаблона из дисциплины",""
"passed","Mon Nov 20 05:30:24 UTC 2023","Mon Nov 20 05:30:30 UTC 2023","6043","","Материал","Конструктор теста","TestBlocksAndVariantsValidationTests","CheckRenameTestBlock","Конструктор теста: можно переименовать блок",""
"passed","Mon Nov 20 05:22:06 UTC 2023","Mon Nov 20 05:22:08 UTC 2023","2144","","Активность","Задание","TaskWithSolutionStudentTests","CheckImpossibilityToEditAnotherStudentsSolutionGrade","Нет возможности оценить решения другого студента, если не включена 'Взаимопроверка'",""
"passed","Mon Nov 20 05:27:09 UTC 2023","Mon Nov 20 05:27:16 UTC 2023","6919","","Дисциплина","Редактирование дисциплины","DisciplineAccessTests","CheckIfSuperAdminChangeDiscipline","Редактирование дисциплины: есть возможность редактировать у суперадминистратора",""
"passed","Mon Nov 20 05:27:28 UTC 2023","Mon Nov 20 05:28:21 UTC 2023","53369","","Дисциплина","Страница дисциплины","DisciplineStudentTests","CheckPinDisciplineForStudent","Работает кнопка закрепления/открепления из главного меню для студента",""
"passed","Mon Nov 20 05:21:06 UTC 2023","Mon Nov 20 05:21:14 UTC 2023","7262","","Активность","Задание","TaskActivityMulticriteriaTests","CheckMultiCriteriaCheckboxInTask","Чекбокс многокритериальная проверка не отображается, если выбрана взаимопроверка",""
"passed","Mon Nov 20 05:29:59 UTC 2023","Mon Nov 20 05:30:10 UTC 2023","10954","","Материал","Конструктор теста","TestQuestionsValidationTests","CheckEditTestQuestionPionts","Конструктор теста: можно изменить баллы для вопроса",""
"passed","Mon Nov 20 05:26:16 UTC 2023","Mon Nov 20 05:26:36 UTC 2023","19635","","Чат","Дисциплина","DisciplineChatTests","CheckPinLastMessageInDisciplineChat","Список чатов - комната дисциплины: можно закреплять сообщения",""
"passed","Mon Nov 20 05:28:35 UTC 2023","Mon Nov 20 05:28:43 UTC 2023","8459","","Дисциплина","Шаблон дисциплины","DisTemplateTests","CheckAddTopicInDisTemplate","Страница шаблона дисциплины: можно добавить тему",""
"passed","Mon Nov 20 05:26:17 UTC 2023","Mon Nov 20 05:26:30 UTC 2023","12846","","Чат","Мини-чат страницы решений","TaskPageMiniChatTests","CheckAddReactionToLastMessageInTaskPageMiniChat","Чат на странице решения: можно добавить реакцию на сообщение",""
"passed","Mon Nov 20 05:22:10 UTC 2023","Mon Nov 20 05:22:14 UTC 2023","4602","","Активность","Обычная активность","ActivityDurationTests","CheckEditVolumeActivityWithIncorrectValues","Редактирование активности: отображение ошибки валидации для поля 'Объём' с значением > 100",""
"passed","Mon Nov 20 05:29:13 UTC 2023","Mon Nov 20 05:29:15 UTC 2023","1446","","Библиотека","","StudentLibraryTests","CheckStudentNotAllowedPutContentInStock","Страница материала: студенту недоступно выставление своего материала на Биржу",""
"failed","Mon Nov 20 05:35:27 UTC 2023","Mon Nov 20 05:35:58 UTC 2023","30931","","Активность","Обычный шаблон активности","TemplateAddingTests","CheckAddScormPackageActivityTemplate","Редактирование шаблона активности: можно добавить материал типа SCORM из библиотеки",""
"passed","Mon Nov 20 05:26:30 UTC 2023","Mon Nov 20 05:26:39 UTC 2023","9146","","Чат","Мини-чат страницы решений","TaskPageMiniChatTests","CheckDeleteMessageInTaskPageMiniChat","Чат на странице решения: можно удалить сообщение",""
"passed","Mon Nov 20 05:21:16 UTC 2023","Mon Nov 20 05:21:28 UTC 2023","12324","","Активность","Обычная активность","ActivityCreatingTests","CreateActivityInModule","Cоздание активности: можно создать активность в дисциплине в модуле",""
"passed","Mon Nov 20 05:22:19 UTC 2023","Mon Nov 20 05:22:29 UTC 2023","10392","Активность","Контрольная","Редактирование контрольной","TestActivityAddingTests","CheckAddFileToControlTypeActivity","Можно загрузить материал типа Файл с компьютера в контрольную",""
