"Status","Start Time","Stop Time","Duration in ms","Parent Suite","Suite","Sub Suite","Test Class","Test Method","Name","Description"
"passed","Wed Jun 19 07:22:24 UTC 2024","Wed Jun 19 07:22:27 UTC 2024","2736","","Активность","Обычный шаблон активности","TemplateEditingValidationTests","CheckScormResultScoreFieldNotDisplayed","Отсутствует поле Оценка по SCORM результату, если SCORM пакет был добавлен не в контрольную",""
"passed","Wed Jun 19 07:22:20 UTC 2024","Wed Jun 19 07:22:24 UTC 2024","4349","","Активность","Обычный шаблон активности","TemplateEditingValidationTests","CheckEditActivityTemplateVolumeWithIncorrectValue","Ошибка валидации в поле Объем в академических часах, если введено значение больше 100",""
"passed","Wed Jun 19 07:28:00 UTC 2024","Wed Jun 19 07:28:14 UTC 2024","14000","","Дисциплина","Страница дисциплины","DisciplineMarksAndAttendanceTests","CheckGradingByTeacher","Выставление оценки преподавателем в дисциплине",""
"passed","Wed Jun 19 07:23:14 UTC 2024","Wed Jun 19 07:23:36 UTC 2024","21993","Активность","Контрольная","Прохождение теста","TestActivityStatusWithTwoOrMoreAttemptsTests","CheckStatusExistIfAtLeastOneCompletedAttempt","Статус отображается, если есть хотя бы одна завершенная попытка в индивидуальной контрольной",""
"passed","Wed Jun 19 07:27:08 UTC 2024","Wed Jun 19 07:27:12 UTC 2024","3931","","Дисциплина","Редактирование дисциплины","DisciplineAccessTests","CheckIfOtherTeacherChangeDiscipline","У преподавателя другой дисциплины нет возможности редактирования",""
"passed","Wed Jun 19 07:20:48 UTC 2024","Wed Jun 19 07:21:02 UTC 2024","13754","Активность","Задание","Создание задания","TaskActivityCreatingTests","CheckCreateTaskActivity","Можно создать активность типа Задание, если заполнены все обязательные поля",""
"passed","Wed Jun 19 07:22:53 UTC 2024","Wed Jun 19 07:23:24 UTC 2024","30961","Активность","Контрольная","Редактирование контрольной","TestActivityAddingTests","CheckAddTestToControlTypeActivity","Можно добавить материал типа Тест из Библиотеки в контрольную",""
"passed","Wed Jun 19 07:31:31 UTC 2024","Wed Jun 19 07:32:06 UTC 2024","34608","","Материал","Конструктор теста","TestAddingQuestionsTests","CheckAddQuestionWithFreeAnswerExactMatch","Конструктор теста: можно добавить вопрос с типом ответа “Свободный ответ” - “Точное совпадение”",""
"passed","Wed Jun 19 07:27:34 UTC 2024","Wed Jun 19 07:27:44 UTC 2024","10814","","Чат","Чат для заметок","NotesChatTests","CheckDeleteMessageInNotesChat","Можно удалить сообщение из чата для заметок",""
"passed","Wed Jun 19 07:24:23 UTC 2024","Wed Jun 19 07:24:46 UTC 2024","23468","Активность","Контрольная","Прохождение теста","TestActivityStatusWithOneAttemptTests","CheckStatusIsPendingReviewForAttemptsNeedsReview","Статус Ожидает проверки, если в попытке есть хотя бы один вопрос, требующий проверки в индивидуальной контрольной",""
"passed","Wed Jun 19 07:23:27 UTC 2024","Wed Jun 19 07:23:36 UTC 2024","9389","Активность","Контрольная","Результат прохождения теста","TestActivityResultTests","CheckTeacherCanLeaveCommentOnAnswer","Преподаватель может изменить комментарий к ответу, если была отмечена галка Отображать студентам подробную информацию о результатах",""
"passed","Wed Jun 19 07:28:49 UTC 2024","Wed Jun 19 07:29:01 UTC 2024","11623","","Дисциплина","Страница дисциплины","DisciplineMarksAndAttendanceTests","CheckAttendanceByTeacher","Преподаватель может поставить/убрать галочку посещаемости",""
"passed","Wed Jun 19 07:22:17 UTC 2024","Wed Jun 19 07:22:20 UTC 2024","3573","","Активность","Обычный шаблон активности","TemplateEditingValidationTests","CheckEditActivityTemplateVolumeWithIncorrectValue","Ошибка валидации в поле Объем в академических часах, если введено значение 0",""
"passed","Wed Jun 19 07:26:38 UTC 2024","Wed Jun 19 07:26:45 UTC 2024","7122","","Поток","Создание потока","CohortCreationWarningModalTests","CheckCreateCohortWithoutMismatchWarningOfDuration","Создание потока: нет предупреждения о несоответствии длительности потока для программ длительностью кроме 72, 144 и 256 часов",""
"passed","Wed Jun 19 07:24:41 UTC 2024","Wed Jun 19 07:24:52 UTC 2024","10366","","Чат","Групповой чат","GroupChatMessageTests","CheckSendTextMessageInGroupChat","Можно отправить текстовое сообщение в групповом чате",""
"passed","Wed Jun 19 07:34:32 UTC 2024","Wed Jun 19 07:34:39 UTC 2024","6955","","Организация","Страница организации","OrganizationPageTests","CheckIconAndTooltipDisplayedForClosedDivision","Страница организации: у закрытых подразделений отображается иконка и тултип",""
"passed","Wed Jun 19 07:30:01 UTC 2024","Wed Jun 19 07:30:16 UTC 2024","14900","","Библиотека","","LibraryInTileViewTests","CheckRenameCatalog","Библиотека, плиточный вид: можно переименовать каталог",""
"passed","Wed Jun 19 07:39:58 UTC 2024","Wed Jun 19 07:40:09 UTC 2024","10615","","Чат","Чат дисциплины","DisciplineChatTests","CheckSendEmojiInDisciplineChat","Можно отправить смайлик в чате дисциплины",""
"passed","Wed Jun 19 07:21:57 UTC 2024","Wed Jun 19 07:22:04 UTC 2024","7709","Активность","Задание","Страница решения задания для преподавателя","TaskActivityTeacherTests","CheckGradeSolutionIncorrectValues","Отображение ошибки валидации для поля Баллы со значением отлично",""
"passed","Wed Jun 19 07:23:52 UTC 2024","Wed Jun 19 07:24:22 UTC 2024","29714","Активность","Контрольная","Редактирование контрольной","TestActivityAddingTests","CheckAddTextMaterialToControlTypeActivity","Можно добавить материал типа Текст из Библиотеки в контрольную",""
"passed","Wed Jun 19 07:27:15 UTC 2024","Wed Jun 19 07:27:24 UTC 2024","9024","","Чат","Чат для заметок","NotesChatTests","CheckAddReactionToLastMessageInNotesChat","Можно добавить реакцию на сообщение в чате для заметок",""
"passed","Wed Jun 19 07:25:30 UTC 2024","Wed Jun 19 07:25:39 UTC 2024","9135","","Чат","Личный чат","PersonalChatTests","CheckSendTextMessageInPersonalChat","Можно отправить текстовое сообщение в личном чате",""
"passed","Wed Jun 19 07:29:14 UTC 2024","Wed Jun 19 07:29:21 UTC 2024","6893","","Дисциплина","Редактирование дисциплины","DisContingentEditingValidationTests","CheckIsDisabledCheckboxAllStudentInEditingDiscipline","Галка Все студенты потока задизейблена и невозможно ее снять, если дисциплина относится к Нацпроекту",""
"passed","Wed Jun 19 07:24:58 UTC 2024","Wed Jun 19 07:25:05 UTC 2024","7313","","Чат","Чат дисциплины","DisciplineChatTests","CheckSendEmptyMessageInDisciplineChat","Невозможно отправить пустое сообщение в чате дисциплины",""
"passed","Wed Jun 19 07:33:33 UTC 2024","Wed Jun 19 07:33:45 UTC 2024","11465","","Материал","Конструктор тест-тренажера","TestTrainQuestionAnswersValidationTests","RemoveAnswerFromQuestionInTestTrain","Конструктор теста-тренажера: можно удалить вариант ответа из вопроса с типом ответа 'Выбор из вариантов'",""
"skipped","Wed Jun 19 07:40:57 UTC 2024","Wed Jun 19 07:40:57 UTC 2024","283","","Библиотека","","LibraryMaterialTests","CheckVisibilityOfLaTeXMaterialPreview","Превью материала: LaTeX отображается как PDF",""
"passed","Wed Jun 19 07:27:20 UTC 2024","Wed Jun 19 07:27:25 UTC 2024","5209","","Дисциплина","Страница дисциплины","DisciplineAnalyticsTests","CheckThreeDotMenuOnAnalyticsTabIsDisplayed","Наличие тридот меню на вкладке ‘Аналитика’",""
"passed","Wed Jun 19 07:25:44 UTC 2024","Wed Jun 19 07:25:52 UTC 2024","8303","","Чат","Миничат страницы решений","TaskPageMiniChatTests","CheckSendTextMessageInTaskPageMiniChat","Можно отправить текстовое сообщение в миничате страницы решений",""
"passed","Wed Jun 19 07:22:17 UTC 2024","Wed Jun 19 07:22:31 UTC 2024","14115","","Активность","Обычный шаблон активности","TemplateEditingTests","CheckEditTypeInActivityTemplate","Можно переключать значения в поле Тип активности",""
"passed","Wed Jun 19 07:34:33 UTC 2024","Wed Jun 19 07:34:40 UTC 2024","6681","","Материал","Конструктор тест-тренажера","TestTrainQuestionAnswersValidationTests","CheckRemoveCommentFromTestTrainAnswer","Конструктор теста-тренажера: проверка ошибки валидации при удалении комментария к варианту ответа",""
"passed","Wed Jun 19 07:23:59 UTC 2024","Wed Jun 19 07:24:34 UTC 2024","35312","Активность","Контрольная","Прохождение теста","TestActivityStatusWithTwoOrMoreAttemptsTests","CheckResultOfPassingDependOnSettings","Результат тестирования в попытках зависит от настройки За лучшую попытку в индивидуальной контрольной",""
"skipped","Wed Jun 19 07:40:57 UTC 2024","Wed Jun 19 07:40:57 UTC 2024","283","","Библиотека","","LibraryMaterialTests","CheckVisibilityOfLaTeXMaterialPage","Страница материала: проверка отображения LaTeX материала",""
"passed","Wed Jun 19 07:23:26 UTC 2024","Wed Jun 19 07:23:43 UTC 2024","16343","Активность","Контрольная","Прохождение теста","TestActivityStatusWithOneAttemptTests","CheckNoStatusWithOneIncompleteAttempt","Отсутствует статус и иконка для одной незавершенной попытки в командной контрольной",""
"passed","Wed Jun 19 07:24:33 UTC 2024","Wed Jun 19 07:24:59 UTC 2024","25619","","Звонок","","CallTests","CheckGreenFrameIsDisplayedOnAnotherUsersCard","Страница звонка: отображается зеленая рамка у карточки собеседника при разговоре",""
"passed","Wed Jun 19 07:25:02 UTC 2024","Wed Jun 19 07:25:19 UTC 2024","17462","Активность","Шаблон активности контрольной","Редактирование шаблона контрольной","TestTemplateEditingTests","CheckEditValueScormResultScoreInTemplate","Можно переключать значения в поле Оценка по SCORM результату в шаблон контрольной",""
"passed","Wed Jun 19 07:21:14 UTC 2024","Wed Jun 19 07:21:29 UTC 2024","14546","Активность","Задание","Создание задания","TaskActivityCreatingTests","CheckCreateTaskWithMutualVerification","Можно создать активность типа Задание с взаимопроверкой",""
"passed","Wed Jun 19 07:26:31 UTC 2024","Wed Jun 19 07:26:34 UTC 2024","3291","","Поток","Редактирование потока","CohortEditingValidationTests","CheckEditCohortIfEachDateNotFilled","Редактирование потока: ошибка валидации, если дата начала не заполнена",""
"passed","Wed Jun 19 07:30:34 UTC 2024","Wed Jun 19 07:30:56 UTC 2024","22089","","Библиотека","","LibraryInTileViewTests","CheckMoveMaterialToCatalogInTileView","Библиотека, плиточный вид: можно переместить материал в другой каталог",""
"passed","Wed Jun 19 07:28:45 UTC 2024","Wed Jun 19 07:28:54 UTC 2024","9362","","Дисциплина","Шаблон дисциплины","DisTemplateTests","CheckCreateDisTemplateWithFillingRequiredFields","Можно создать шаблон дисциплины, если заполнены все обязательные поля",""
"passed","Wed Jun 19 07:22:41 UTC 2024","Wed Jun 19 07:22:45 UTC 2024","3385","Активность","Обычная активность","Редактирование активности","ActivityEditingTests","CheckOnRatingActivity","Проверка включения опции выставления оценки за активность",""
"passed","Wed Jun 19 07:28:24 UTC 2024","Wed Jun 19 07:28:36 UTC 2024","11943","","Дисциплина","Страница дисциплины","DisciplineAnalyticsTests","CheckFilterByGroupName","Проверка фильтра аналитики по названию группы",""
"passed","Wed Jun 19 07:34:55 UTC 2024","Wed Jun 19 07:35:07 UTC 2024","11654","","Профиль","","AddressAndContactsEditingTests","CheckEmailField","Редактирование профиля пользователя: можно изменить email",""
"passed","Wed Jun 19 07:31:36 UTC 2024","Wed Jun 19 07:31:52 UTC 2024","15789","","Библиотека","","LibraryActionPanelTests","CheckChangeViewOfLibraryInTileView","Библиотека: можно переключать текущий вид библиотеки со “Списка” на “Плитку”",""
"passed","Wed Jun 19 07:26:26 UTC 2024","Wed Jun 19 07:26:32 UTC 2024","5853","","Поток","Создание потока","CohortCreationWarningModalTests","CheckCreateCohortWithMismatchWarningOfDuration","Создание потока: предупреждение о несоответствии длительности потока для программ длительностью 144 часа",""
"passed","Wed Jun 19 07:25:53 UTC 2024","Wed Jun 19 07:26:03 UTC 2024","9928","","Чат","Групповой чат","GroupChatMessageTests","CheckSendEmojiInGroupChat","Можно отправить смайлики в групповом чате",""
"passed","Wed Jun 19 07:25:18 UTC 2024","Wed Jun 19 07:25:31 UTC 2024","12904","","Чат","Групповой чат","GroupChatTests","CheckChangeGroupChatName","Можно изменить название группового чата",""
"passed","Wed Jun 19 07:34:04 UTC 2024","Wed Jun 19 07:34:11 UTC 2024","6274","","Программа","","ProgramEditingTests","CheckRemoveProgramWithoutCohort","Можно удалить программу ДО без потоков",""
"passed","Wed Jun 19 07:29:12 UTC 2024","Wed Jun 19 07:29:32 UTC 2024","20034","","Дисциплина","Шаблон дисциплины","DisTemplateTests","CheckAddModuleInDisTemplate","Можно добавить модуль в шаблон дисциплины",""
"passed","Wed Jun 19 07:31:12 UTC 2024","Wed Jun 19 07:31:30 UTC 2024","18279","","Библиотека","","LibraryInListViewTests","CheckRemoveMaterialInListView","Библиотека, списочный вид: можно удалить материал",""
"passed","Wed Jun 19 07:24:34 UTC 2024","Wed Jun 19 07:25:08 UTC 2024","34301","Активность","Контрольная","Прохождение теста","TestActivityStatusWithTwoOrMoreAttemptsTests","CheckResultOfPassingDependOnSettings","Результат тестирования в попытках зависит от настройки За лучшую попытку в командной контрольной",""
"passed","Wed Jun 19 07:23:37 UTC 2024","Wed Jun 19 07:23:52 UTC 2024","14825","Активность","Контрольная","Страница контрольной","TestCommandActivityTests","CheckAddTeamToCommandControlActivity","Можно добавить команду в командной контрольной",""
"passed","Wed Jun 19 07:22:07 UTC 2024","Wed Jun 19 07:22:17 UTC 2024","10127","Активность","Обычная активность","Редактирование активности","ActivityAddingTests","CheckAbsenceScormScoreField","Отсутствие поля Оценка по SCORM результату, если не добавлен SCORM пакет",""
"passed","Wed Jun 19 07:21:39 UTC 2024","Wed Jun 19 07:21:54 UTC 2024","14952","Активность","Обычная активность","Редактирование активности","ActivityEditingFormatTests","CheckAutomaticallySwitchesToSelfStudyFormat","Автоматическое переключение на формат Самостоятельное изучение при выборе определенных типов активности",""
"passed","Wed Jun 19 07:27:20 UTC 2024","Wed Jun 19 07:27:28 UTC 2024","7817","","Дисциплина","Страница дисциплины","DisciplineActivitiesBlockTests","CheckCancelAddModule","Отмена создания модуля у дисциплины",""
"passed","Wed Jun 19 07:23:56 UTC 2024","Wed Jun 19 07:24:13 UTC 2024","17129","Активность","Шаблон активности контрольной","Создание шаблона контрольной","TestTemplateCreatingTests","CheckExecModeTestActivityTemplate","Можно создать шаблон контрольной с режимом выполнения Командный",""
"passed","Wed Jun 19 07:24:21 UTC 2024","Wed Jun 19 07:24:33 UTC 2024","12266","","Звонок","","CallTests","CheckTurnOnOffEquipmentInCall","Страница звонка: можно включить/отключить микрофон в звонке",""
"passed","Wed Jun 19 07:27:28 UTC 2024","Wed Jun 19 07:27:41 UTC 2024","13084","","Дисциплина","Страница дисциплины","DisciplineActivitiesBlockTests","CheckAddTopicInDiscipline","Создание темы у дисциплины",""
"passed","Wed Jun 19 07:22:05 UTC 2024","Wed Jun 19 07:22:25 UTC 2024","19994","Активность","Задание","Страница решения задания для студента","TaskWithSolutionStudentTests","CheckEditSolution","Можно изменить текст и файл решения",""
"passed","Wed Jun 19 07:21:11 UTC 2024","Wed Jun 19 07:21:18 UTC 2024","7743","Активность","Задание","Страница решения задания для преподавателя","TaskActivityTeacherTests","CheckGradeSolutionWithZeroValue","Можно оценить решения значением 0",""
"passed","Wed Jun 19 07:28:29 UTC 2024","Wed Jun 19 07:28:45 UTC 2024","16397","","Дисциплина","Редактирование дисциплины","DisciplineEditingTests","CheckAddTagInDiscipline","Можно добавлять теги знаний",""
"passed","Wed Jun 19 07:33:27 UTC 2024","Wed Jun 19 07:33:39 UTC 2024","11799","","Материал","Конструктор тест-тренажера","TestTrainQuestionsValidationTests","RemoveCommentInTestTrainQuestion","Конструктор теста-тренажера: можно удалить комментарий к вопросу",""
"passed","Wed Jun 19 07:26:14 UTC 2024","Wed Jun 19 07:26:19 UTC 2024","4793","","Поток","Создание потока","CohortCreationValidationTests","CheckCreateCohortIfNameNotFilled","Создание потока: ошибка валидации, если название не указано",""
"passed","Wed Jun 19 07:26:43 UTC 2024","Wed Jun 19 07:26:49 UTC 2024","5748","","Чат","Обсуждение решения","TaskChatTests","CheckAddReactionToLastMessageInTaskChat","Можно добавить реакцию на сообщение в обсуждении решения",""
"passed","Wed Jun 19 07:34:15 UTC 2024","Wed Jun 19 07:34:20 UTC 2024","5017","","Расписание","","ScheduleSettingsTests","CheckDisconnectSyncWithGoogleCalendar","Проверка отключения синхронизации с Google календарем",""
"passed","Wed Jun 19 07:23:05 UTC 2024","Wed Jun 19 07:23:34 UTC 2024","28739","Активность","Обычная активность","Редактирование активности","ActivityAddingTests","CheckRemoveMaterialActivity","Можно удалять материалы",""
"passed","Wed Jun 19 07:31:23 UTC 2024","Wed Jun 19 07:31:36 UTC 2024","13366","","Библиотека","","LibraryActionPanelTests","CheckChangeViewOfLibraryInTileView","Библиотека: можно переключать текущий вид Библиотеки с “Плитка” на “Список”",""
"passed","Wed Jun 19 07:24:33 UTC 2024","Wed Jun 19 07:24:46 UTC 2024","12812","Активность","Шаблон активности контрольной","Редактирование шаблона контрольной","TestTemplateEditingTests","CheckSuccessEditingMinThresholdWithCorrectValue","Успешное сохранение при корректных значениях в поле Минимальный порог баллов",""
"passed","Wed Jun 19 07:25:58 UTC 2024","Wed Jun 19 07:26:08 UTC 2024","10076","","Чат","Миничат страницы решений","TaskPageMiniChatTests","CheckEditLastMessageInTaskPageMiniChat","Можно редактировать сообщение в течение 4 часов после отправки в миничате страницы решений",""
"passed","Wed Jun 19 07:27:14 UTC 2024","Wed Jun 19 07:27:20 UTC 2024","5385","","Дисциплина","Настройка чата дисциплины","DisciplineChatBlockTests","CheckChatMissingFromList","Отключенный чат дисциплины отсутствует в списке чатов",""
"passed","Wed Jun 19 07:26:55 UTC 2024","Wed Jun 19 07:27:02 UTC 2024","7161","","Чат","Личный чат","PersonalChatTests","CheckDeleteMessageInPersonalChat","Можно удалить сообщение из личного чата",""
"passed","Wed Jun 19 07:21:38 UTC 2024","Wed Jun 19 07:21:58 UTC 2024","20695","Активность","Задание","Страница решения задания для студента","TaskWithoutSolutionStudentTests","CheckAccessFormWithoutSolution","Отправка решений после даты окончания активности",""
"passed","Wed Jun 19 07:22:56 UTC 2024","Wed Jun 19 07:23:11 UTC 2024","14942","","Активность","Обычный шаблон активности","TemplateEditingTests","CheckAddTagInActivityTemplate","Можно добавлять теги знаний к шаблону активности",""
"passed","Wed Jun 19 07:25:56 UTC 2024","Wed Jun 19 07:26:03 UTC 2024","6879","","Чат","Личный чат","PersonalChatTests","CheckAddQuoteToLastMessageInPersonalChat","Можно цитировать сообщение в личном чате",""
"passed","Wed Jun 19 07:23:50 UTC 2024","Wed Jun 19 07:23:52 UTC 2024","2972","Активность","Шаблон активности контрольной","Редактирование шаблона контрольной","TestTemplateEditingTests","CheckErrorInEditingNumOfAttemptsWithIncorrectValue","Ошибка валидации в поле Количество попыток сдачи, если введено значение больше 20",""
"passed","Wed Jun 19 07:32:25 UTC 2024","Wed Jun 19 07:32:37 UTC 2024","11146","","Материал","Конструктор тест-тренажера","TestTrainCreationTests","TestCreation","Конструктор теста-тренажера: создание теста-тренажера",""
"passed","Wed Jun 19 07:23:42 UTC 2024","Wed Jun 19 07:23:46 UTC 2024","4090","Активность","Шаблон активности контрольной","Редактирование шаблона контрольной","TestTemplateEditingTests","CheckErrorInEditingNumOfAttemptsWithIncorrectValue","Ошибка валидации в поле Количество попыток сдачи, если введено отрицательное значение",""
