"Status","Start Time","Stop Time","Duration in ms","Parent Suite","Suite","Sub Suite","Test Class","Test Method","Name","Description"
"passed","Tue Sep 03 05:55:35 UTC 2024","Tue Sep 03 05:55:43 UTC 2024","8248","","Поток","Создание потока","CohortCreationTests","CheckCancelCohortCreation","Создание потока ВО: работает кнопка 'Отмена', если страница создание был открыть со страницы программы",""
"passed","Tue Sep 03 06:06:34 UTC 2024","Tue Sep 03 06:06:44 UTC 2024","9600","","Профиль","","GeneralUserInfoEditingTests","ValidatingUserNameFields","Редактирование профиля пользователя: можно изменить ФИО",""
"passed","Tue Sep 03 05:56:44 UTC 2024","Tue Sep 03 05:56:48 UTC 2024","4302","","Поток","Редактирование потока","CohortEditingValidationTests","CheckEditCohortIfEachDateNotFilled","Редактирование потока: ошибка валидации, если дата начала не заполнена",""
"passed","Tue Sep 03 06:05:35 UTC 2024","Tue Sep 03 06:05:46 UTC 2024","10819","","Материал","Конструктор тест-тренажера","TestTrainSettingsValidationTests","EditTestTrainStudyTime","Конструктор теста-тренажера: можно изменить время изучения",""
"passed","Tue Sep 03 05:52:23 UTC 2024","Tue Sep 03 05:52:28 UTC 2024","5072","","Чат","Чат комнаты дисциплины","DisciplineRoomChatMessageTests","CheckOpenImageInDisciplineRoomChat","Можно раскрывать изображения в чате комнаты дисциплины",""
"passed","Tue Sep 03 05:58:25 UTC 2024","Tue Sep 03 05:58:43 UTC 2024","17450","","Дисциплина","Страница дисциплины","DisciplineMarksAndAttendanceTests","CheckGradingByTeacher","Выставление оценки преподавателем в дисциплине",""
"passed","Tue Sep 03 05:56:23 UTC 2024","Tue Sep 03 05:56:30 UTC 2024","6596","","Поток","Редактирование потока","CohortEditingTests","CheckCancelCohortEditing","Редактирование потока ДО: работает кнопка 'Отмена', если страница редактирование был открыть со страницы потока",""
"passed","Tue Sep 03 05:51:21 UTC 2024","Tue Sep 03 05:51:38 UTC 2024","16775","","Чат","Миничат дисциплины","DisciplineMiniChatTests","CheckEditLastMessageInDisciplineMiniChat","Можно редактировать сообщение в течение 4 часов после отправки в миничате дисциплины",""
"passed","Tue Sep 03 05:49:02 UTC 2024","Tue Sep 03 05:49:12 UTC 2024","10273","Активность","Обычная активность","Редактирование активности","ActivityEditingTests","CheckActivityMaxThreshold","Проверка установки Максимального порога баллов в активности Кода будущего",""
"passed","Tue Sep 03 06:06:44 UTC 2024","Tue Sep 03 06:06:48 UTC 2024","3651","","Профиль","","GeneralUserInfoEditingTests","CheckSwitchToOwnTransliteration","Редактирование профиля пользователя: можно переключить свитч транслитерации",""
"passed","Tue Sep 03 06:05:02 UTC 2024","Tue Sep 03 06:05:13 UTC 2024","10851","","Материал","Конструктор тест-тренажера","TestTrainSettingsValidationTests","AddTagInTestTrain","Конструктор теста-тренажера: можно добавлять теги знаний",""
"passed","Tue Sep 03 06:03:33 UTC 2024","Tue Sep 03 06:03:52 UTC 2024","19317","","Материал","Конструктор теста","TestBlocksAndVariantsValidationTests","CheckRemoveQuestionFromTest","Конструктор теста: можно удалить вопрос",""
"passed","Tue Sep 03 05:59:27 UTC 2024","Tue Sep 03 05:59:39 UTC 2024","12604","","Дисциплина","Дисциплина с ИОТ","IOTDisciplineCreationTests","CheckCreatDisciplineWithIOT","Можно создать дисциплину ВО с ИОТ",""
"passed","Tue Sep 03 05:52:04 UTC 2024","Tue Sep 03 05:52:12 UTC 2024","7905","","Чат","Миничат дисциплины","DisciplineMiniChatTests","CheckFindSentMessageInDisciplineMiniChat","Можно найти отправленное сообщение в миничате дисциплины",""
"passed","Tue Sep 03 05:56:28 UTC 2024","Tue Sep 03 05:56:37 UTC 2024","9381","","Чат","Миничат личного чата","PersonalMiniChatTests","CheckAddReactionToLastMessageInPersonalMiniChat","Можно добавить реакцию на сообщение в миничате личного чата",""
"passed","Tue Sep 03 05:48:01 UTC 2024","Tue Sep 03 05:48:14 UTC 2024","12302","Активность","Обычная активность","Редактирование активности","ActivityAddingTests","CheckAbsenceScormScoreField","Отсутствие поля Оценка по SCORM результату, если не добавлен SCORM пакет",""
"passed","Tue Sep 03 05:59:39 UTC 2024","Tue Sep 03 05:59:52 UTC 2024","12510","","Дисциплина","Дисциплина с ИОТ","IOTDisciplineCreationTests","CheckCreatDisciplineWithIOT","Можно создать дисциплину ДО с ИОТ",""
"passed","Tue Sep 03 05:59:10 UTC 2024","Tue Sep 03 05:59:14 UTC 2024","4042","","Дисциплина","Редактирование дисциплины","DisciplineEditingValidationTests","CheckIfCreditNotFilled","Отображение ошибки валидации для поля Кредиты с значением > 15 в дисциплине ДО",""
"passed","Tue Sep 03 06:03:03 UTC 2024","Tue Sep 03 06:03:18 UTC 2024","14864","","Материал","Конструктор теста","TestQuestionsValidationTests","CheckEditTestQuestionPionts","Конструктор теста: можно изменить баллы для вопроса",""
"passed","Tue Sep 03 06:05:05 UTC 2024","Tue Sep 03 06:05:10 UTC 2024","4710","","Организация","Создание организации","OrganizationCreationTests","CheckValidationErrorInRequiredFieldsIfTheyNotFilled","Создание организации: ошибка валидации в обязательных полях, если они не заполнены",""
"passed","Tue Sep 03 05:52:57 UTC 2024","Tue Sep 03 05:53:05 UTC 2024","7611","","Чат","Групповой чат","GroupChatMessageTests","CheckSendEmptyMessageInGroupChat","Невозможно отправить пустое сообщение в групповом чате",""
"passed","Tue Sep 03 05:55:21 UTC 2024","Tue Sep 03 05:55:32 UTC 2024","11184","","Чат","Личный чат","PersonalChatTests","CheckCallInPersonalChat","Можно сделать звонок в личном чате",""
"passed","Tue Sep 03 05:50:40 UTC 2024","Tue Sep 03 05:51:08 UTC 2024","27379","","Звонок","","CallTests","CheckGreenFrameIsDisplayedOnAnotherUsersCard","Страница звонка: отображается зеленая рамка у карточки собеседника при разговоре",""
"passed","Tue Sep 03 06:07:14 UTC 2024","Tue Sep 03 06:07:32 UTC 2024","17056","","Профиль","","AddressAndContactsEditingTests","CheckEmailField","Редактирование профиля пользователя: можно изменить email",""
"passed","Tue Sep 03 06:04:25 UTC 2024","Tue Sep 03 06:04:37 UTC 2024","11758","","Материал","Конструктор теста","TestQuestionAnswersValidationTests","CheckRemoveAnswerFromSortingQuestion","Конструктор теста: можно удалить опцию из вопроса с типом ответа 'Сортировка'",""
"passed","Tue Sep 03 05:54:43 UTC 2024","Tue Sep 03 05:54:49 UTC 2024","5699","","Чат","Миничат группового чата","GroupMiniChatMessageTests","CheckFindSentMessageInGroupMiniChat","Можно найти отправленное сообщение в миничате группового чата",""
"passed","Tue Sep 03 05:49:44 UTC 2024","Tue Sep 03 05:50:13 UTC 2024","29530","Активность","Контрольная","Редактирование контрольной","TestActivityAddingTests","CheckAddTextMaterialToControlTypeActivity","Можно добавить материал типа Текст из Библиотеки в контрольную",""
"passed","Tue Sep 03 05:57:04 UTC 2024","Tue Sep 03 05:57:08 UTC 2024","4501","","Поток","Редактирование потока","CohortEditingTests","CheckEditCohortByFillingMaxNumberOfStudents","Редактирование потока: успешное сохранение, с корректными значениями в поле ‘Максимальное количество студентов’",""
"passed","Tue Sep 03 05:59:03 UTC 2024","Tue Sep 03 05:59:07 UTC 2024","3502","","Дисциплина","Редактирование дисциплины","DisciplineEditingValidationTests","CheckIfCreditNotFilled","Отображение ошибки валидации для поля Кредиты с отрицательным значением в дисциплине ДО",""
"passed","Tue Sep 03 06:05:46 UTC 2024","Tue Sep 03 06:05:52 UTC 2024","6361","","Программа","","ProgramEditingTests","CheckRemoveProgramWithoutCohort","Можно удалить программу ДО без потоков",""
"passed","Tue Sep 03 05:46:46 UTC 2024","Tue Sep 03 05:47:07 UTC 2024","20747","Активность","Обычная активность","Редактирование активности","ActivityDurationTests","CheckIfStartDateEmptyInAcivity","Успешное сохранение, если заполнена только дата окончания",""
"passed","Tue Sep 03 05:58:36 UTC 2024","Tue Sep 03 05:58:47 UTC 2024","11302","","Дисциплина","Страница дисциплины","DisciplineAnalyticsTests","CheckFilterByGroupName","Проверка фильтра аналитики по названию группы",""
"passed","Tue Sep 03 05:56:03 UTC 2024","Tue Sep 03 05:56:13 UTC 2024","10498","","Чат","Миничат личного чата","PersonalMiniChatTests","CheckSendFileMessageInPersonalMiniChat","Можно прикрепить и отправить файл с компьютера в миничате личного чата",""
"passed","Tue Sep 03 05:46:18 UTC 2024","Tue Sep 03 05:46:36 UTC 2024","17899","Активность","Обычная активность","Редактирование активности","ActivityEditingTests","CheckEditActivityName","Можно изменить название",""
"passed","Tue Sep 03 05:46:50 UTC 2024","Tue Sep 03 05:47:12 UTC 2024","22190","Активность","Задание","Страница решения задания для студента","TaskWithoutSolutionStudentTests","CheckSendTextAndFileSolution","Можно отправить ответ в виде текста и файла",""
"passed","Tue Sep 03 05:55:36 UTC 2024","Tue Sep 03 05:55:46 UTC 2024","9557","","Чат","Личный чат","PersonalChatTests","CheckSendEmojiInPersonalChat","Можно отправить смайлики в личном чате",""
"passed","Tue Sep 03 06:04:59 UTC 2024","Tue Sep 03 06:05:03 UTC 2024","3733","","Организация","Мой тариф","MyPlanOrganizationPageTests","CheckAmountDueTooltipAppears","Страница Мой тариф: отображается тултип при наведении курсора на значок i в блоке Расчет данных",""
"passed","Tue Sep 03 05:59:36 UTC 2024","Tue Sep 03 05:59:52 UTC 2024","15610","","Дисциплина","Редактирование дисциплины","DisContingentEditingValidationTests","CheckAddStudentFromGroupInTeachersField","Появление ошибки при попытке указать преподавателем студента из группы",""
"passed","Tue Sep 03 06:07:58 UTC 2024","Tue Sep 03 06:08:05 UTC 2024","6790","","Профиль","","UserInfoPageTests","CheckBlockOfPassedActivitiesAreDisplayedForTeacher","Страница профиля пользователя: под преподавателем отображаются пройденные активности студента",""
"passed","Tue Sep 03 05:58:34 UTC 2024","Tue Sep 03 05:58:39 UTC 2024","5200","","Дисциплина","Страница дисциплины","DisciplineRightMenuTests","CheckOpenDisciplineChatFromDisPage","Можно открыть мини-чат нажав кнопку ‘Открыть чат дисциплины’",""
"passed","Tue Sep 03 05:55:46 UTC 2024","Tue Sep 03 05:55:55 UTC 2024","9050","","Чат","Личный чат","PersonalChatTests","CheckSendFileMessageInPersonalChat","Можно прикрепить и отправить файл с компьютера в личном чате",""
"passed","Tue Sep 03 05:45:47 UTC 2024","Tue Sep 03 05:46:56 UTC 2024","69259","Активность","Обычная активность","Редактирование активности","ActivityAddingTests","CheckAddFileMaterialToActivity","Можно загрузить материал типа Файл с компьютера в активность",""
"passed","Tue Sep 03 05:51:15 UTC 2024","Tue Sep 03 05:51:33 UTC 2024","17543","","Чат","Миничат комнаты дисциплины","DisciplineRoomMiniChatMessageTests","CheckSendTextMessageInDisciplineRoomMiniChat","Можно отправить текстовое сообщение в миничате добавленной комнаты",""
"passed","Tue Sep 03 05:51:32 UTC 2024","Tue Sep 03 05:51:46 UTC 2024","14345","","Чат","Чат комнаты дисциплины","DisciplineRoomChatMessageTests","CheckEditLastMessageInDisciplineRoomChat","Можно редактировать сообщение в течение 4 часов после отправки в чате комнаты дисциплины",""
"broken","Tue Sep 03 05:54:22 UTC 2024","Tue Sep 03 05:54:37 UTC 2024","15074","","Чат","Миничат группового чата","GroupMiniChatTests","CheckChangeGroupChatNameInMinichat","Можно изменить название группового чата в миничате",""
"passed","Tue Sep 03 05:52:56 UTC 2024","Tue Sep 03 05:53:13 UTC 2024","17533","","Чат","Миничат звонка дисциплины","DisciplineChatCallTests","CheckSendMessageByTappingEnterInDisciplineCallChat","Можно отправить сообщение по нажатию на Enter в миничате звонка дисциплины",""
"passed","Tue Sep 03 05:49:46 UTC 2024","Tue Sep 03 05:50:00 UTC 2024","13747","Активность","Контрольная","Результат прохождения теста","TestActivityResultTests","CheckTeacherCanLeaveCommentOnAnswer","Преподаватель может удалить комментарий к ответу, если была отмечена галка Отображать студентам подробную информацию о результатах",""
"passed","Tue Sep 03 05:56:39 UTC 2024","Tue Sep 03 05:56:48 UTC 2024","8874","","Поток","Создание потока","CohortCreationWarningModalTests","CheckCreateCohortWithoutMismatchWarningOfDuration","Создание потока: нет предупреждения о несоответствии длительности потока для программ длительностью кроме 72, 144 и 256 часов",""
"broken","Tue Sep 03 06:01:12 UTC 2024","Tue Sep 03 06:01:50 UTC 2024","37575","","Экзамен","","ExamCreateEditTests","ErrorDeleteExam","Ошибка при удаление экзамена",""
"passed","Tue Sep 03 05:52:35 UTC 2024","Tue Sep 03 05:52:39 UTC 2024","4270","","Чат","Чат дисциплины","DisciplineChatTests","CheckOpenImageInDisciplineChat","Можно раскрывать изображения в чате дисциплины",""
"passed","Tue Sep 03 05:49:50 UTC 2024","Tue Sep 03 05:50:13 UTC 2024","23520","Активность","Контрольная","Прохождение теста","TestActivityStatusWithOneAttemptTests","CheckStatusIsPendingReviewForAttemptsNeedsReview","Статус Ожидает проверки, если в попытке есть хотя бы один вопрос, требующий проверки в индивидуальной контрольной",""
"passed","Tue Sep 03 06:01:56 UTC 2024","Tue Sep 03 06:02:09 UTC 2024","13908","","Библиотека","","StudentLibraryTests","CheckAvailabilityOfContentCreation","Библиотека студента: недоступно создание материалов кроме добавления файла и создания текстового материала",""
"broken","Tue Sep 03 06:00:25 UTC 2024","Tue Sep 03 06:01:19 UTC 2024","53937","","Экзамен","","TestCenterTests","CheckExamineesAuthorization","Проверка авторизации экзаменуемого",""
"passed","Tue Sep 03 06:04:18 UTC 2024","Tue Sep 03 06:04:36 UTC 2024","17888","","Материал","Конструктор теста","TestBlocksAndVariantsValidationTests","DeleteTestBlock","Конструктор теста: можно удалить блок",""
"passed","Tue Sep 03 05:47:27 UTC 2024","Tue Sep 03 05:47:43 UTC 2024","16670","Активность","Обычная активность","Редактирование активности","ActivityDurationTests","CheckEditActivityVolumeWithCorrectValues","Успешное сохранение при корректных значениях в поле Объем в академических часах",""
"passed","Tue Sep 03 05:56:26 UTC 2024","Tue Sep 03 05:56:42 UTC 2024","15894","","Чат","Миничат личного звонка","PersonalChatCallTests","CheckSendMessageByTappingEnterInPersonalCallChat","Можно отправить сообщение по нажатию на Enter в миничате личного звонка",""
"passed","Tue Sep 03 05:59:10 UTC 2024","Tue Sep 03 06:00:02 UTC 2024","52092","","Дисциплина","Редактирование дисциплины","DisContingentEditingTests","CheckAddTeacherByUserInfoInEditing","Редактирование дисциплины: добавление преподавателя по email’у",""
"broken","Tue Sep 03 05:54:22 UTC 2024","Tue Sep 03 05:54:25 UTC 2024","2960","","Чат","Групповой чат","GroupChatTests","CheckAddGroupChatRoomWithoutName","Невозможно добавить групповой чат, если не заполнено поле Название",""
"passed","Tue Sep 03 05:58:43 UTC 2024","Tue Sep 03 05:58:58 UTC 2024","15214","","Дисциплина","Страница дисциплины","DisciplineMarksAndAttendanceTests","CheckAddTotalFormula","Добавление формулы промежуточного результата дисциплины",""
"passed","Tue Sep 03 05:53:08 UTC 2024","Tue Sep 03 05:53:23 UTC 2024","14932","","Чат","Миничат группового звонка","GroupChatCallTests","CheckSendFileMessageInGroupCallChat","Можно прикрепить и отправить файл с компьютера в миничате группового звонка",""
"passed","Tue Sep 03 06:03:41 UTC 2024","Tue Sep 03 06:04:01 UTC 2024","20065","","Материал","Конструктор тест-тренажера","TestTrainBlocksAndVariantsValidationTests","AddBlockTestTrain","Конструктор теста-тренажера: можно добавить блок",""
"passed","Tue Sep 03 05:49:08 UTC 2024","Tue Sep 03 05:49:32 UTC 2024","24068","Активность","Контрольная","Прохождение теста","TestActivityStatusWithOneAttemptTests","CheckStatusScoreColorAndIcon","Статус и цвет у количества баллов в попытке различаются в зависимости от успешности в индивидуальной контрольной",""
"passed","Tue Sep 03 05:58:49 UTC 2024","Tue Sep 03 05:58:52 UTC 2024","2954","","Дисциплина","Редактирование дисциплины","DisciplineEditingValidationTests","CheckImpossibilityTurnOnOrOffIOT","Невозможно отключить ИОТ, если в дисциплине есть активности",""
"passed","Tue Sep 03 05:56:42 UTC 2024","Tue Sep 03 05:56:56 UTC 2024","13679","","Чат","Миничат личного звонка","PersonalChatCallTests","CheckAddReactionToLastMessageInPersonalCallChat","Можно добавить реакцию на сообщение в миничате личного звонка",""
"passed","Tue Sep 03 05:46:00 UTC 2024","Tue Sep 03 05:46:10 UTC 2024","9327","Активность","Задание","Создание задания","TaskActivityMulticriteriaTests","CheckMultiCriteriaCheckboxNotDisplayed","Чекбокс Многокритериальная проверка не отображается, если выбрана опция Взаимопроверка",""
"passed","Tue Sep 03 06:00:36 UTC 2024","Tue Sep 03 06:00:50 UTC 2024","13275","","Дисциплина","Редактирование дисциплины","DisContingentEditingTests","CheckRemoveTeacherFromDiscipline","Открепление преподавателя от дисциплины",""
"passed","Tue Sep 03 05:55:02 UTC 2024","Tue Sep 03 05:55:09 UTC 2024","7790","","Чат","Миничат для заметок","NotesMiniChatTests","CheckAddQuoteToLastMessageInNotesMiniChat","Можно цитировать сообщение в миничате для заметок",""
"passed","Tue Sep 03 05:58:40 UTC 2024","Tue Sep 03 05:58:49 UTC 2024","8784","","Дисциплина","Редактирование дисциплины","DisciplineEditingTests","CheckPossibilityTurnOnIOT","Можно включить/отключить ИОТ, если в дисциплине нет активностей",""
"passed","Tue Sep 03 05:58:08 UTC 2024","Tue Sep 03 05:58:18 UTC 2024","9528","","Дисциплина","Редактирование дисциплины","DisciplineEditingTests","CheckSetShortnameField","Можно изменить краткое название, сделав двойной клик по названию дисциплины",""
"skipped","Tue Sep 03 06:15:31 UTC 2024","Tue Sep 03 06:15:31 UTC 2024","355","","Чат","Личный чат","PersonalChatTests","CheckCopyLeftSideMessageFromPersonalChat","Можно скопировать сообщение из личного чата",""
"passed","Tue Sep 03 06:05:35 UTC 2024","Tue Sep 03 06:05:43 UTC 2024","8310","","Программа","","ProgramCreationTests","CreateHighProgramOverviewFields","Заполнить только обязательные поля у программы ДПО",""
"broken","Tue Sep 03 05:55:40 UTC 2024","Tue Sep 03 05:56:14 UTC 2024","34039","","Чат","Миничат обсуждение решения","TaskMiniChatTests","CheckAddQuoteToLastMessageInTaskMiniChat","Можно цитировать сообщение в миничате обсуждении решения",""
"passed","Tue Sep 03 05:54:42 UTC 2024","Tue Sep 03 05:54:50 UTC 2024","8087","","Чат","Миничат для заметок","NotesMiniChatTests","CheckSendEmptyMessageInNotesMiniChat","Невозможно отправить пустое сообщение в миничате для заметок",""
"passed","Tue Sep 03 06:00:08 UTC 2024","Tue Sep 03 06:00:26 UTC 2024","18018","","Дисциплина","Шаблон дисциплины","DisTemplateTests","CheckAddActivityInDisTemplate","Можно добавить шаблон активности в шаблон дисциплины, выбрав его из библиотеки",""
"passed","Tue Sep 03 05:51:55 UTC 2024","Tue Sep 03 05:52:01 UTC 2024","5367","","Чат","Чат комнаты дисциплины","DisciplineRoomChatMessageTests","CheckFindSentMessageInDisciplineRoomChat","Можно найти отправленное сообщение в чате комнаты дисциплины",""
"passed","Tue Sep 03 06:04:20 UTC 2024","Tue Sep 03 06:04:42 UTC 2024","21372","","Материал","Конструктор тест-тренажера","TestTrainBlocksAndVariantsValidationTests","CheckRemoveTestTrainQuestion","Конструктор теста-тренажера: можно удалить вопрос",""
"passed","Tue Sep 03 05:56:59 UTC 2024","Tue Sep 03 05:57:04 UTC 2024","5560","","Поток","Редактирование потока","CohortEditingValidationTests","CheckEditCohortIfStartDateGreaterThanEndDate","Редактирование потока: ошибка валидации, если дата начала больше чем дата окончания",""
