"Status","Start Time","Stop Time","Duration in ms","Parent Suite","Suite","Sub Suite","Test Class","Test Method","Name","Description"
"passed","Mon Oct 16 05:33:50 UTC 2023","Mon Oct 16 05:33:56 UTC 2023","6164","","Материал","Конструктор теста","TestSettingsValidationTests","AddTagInTest","Конструктор теста: можно добавлять теги знаний",""
"passed","Mon Oct 16 05:36:17 UTC 2023","Mon Oct 16 05:36:25 UTC 2023","7430","","Профиль","","UserInfoPageTests","CheckSetPassword","Страница профиля пользователя: можно изменить пароль",""
"passed","Mon Oct 16 05:33:31 UTC 2023","Mon Oct 16 05:33:41 UTC 2023","9951","","Материал","Конструктор теста","TestQuestionsValidationTests","CheckEditCommentInTestQuestion","Конструктор теста: можно изменить комментарий к вопросу",""
"passed","Mon Oct 16 05:28:05 UTC 2023","Mon Oct 16 05:28:21 UTC 2023","15300","","Чат","Дисциплина","DisciplineChatTests","CheckEditLastMessageInDisciplineChat","Список чатов - комната дисциплины: можно редактировать сообщение в течение 4 часов после отправки",""
"passed","Mon Oct 16 05:38:29 UTC 2023","Mon Oct 16 05:38:43 UTC 2023","13403","","Чат","Чат для заметок","NotesChatTests","CheckFindSentMessageInNotesChat","Список чатов - чат для заметок: можно найти отправленное сообщение",""
"passed","Mon Oct 16 05:35:53 UTC 2023","Mon Oct 16 05:35:55 UTC 2023","2380","","Расписание","","ScheduleTests","MobileVersionScheduleNoChooseMonthMode","Страница расписания: мобильная версия проверка невозможности выбрать режим Месяц",""
"passed","Mon Oct 16 05:30:57 UTC 2023","Mon Oct 16 05:31:09 UTC 2023","12247","","Дисциплина","Настройка чата дисциплины","DisciplineChatBlockTests","CheckBlockAndUnblockChatDiscipline","Редактирование дисциплины: снятия блокировки чата дисциплины",""
"passed","Mon Oct 16 05:31:44 UTC 2023","Mon Oct 16 05:32:03 UTC 2023","18220","","Дисциплина","Редактирование дисциплины","DisContingentEditingTests","CheckAddTeacherByUserInfoInEditing","Редактирование дисциплины: добавление преподавателя по email’у",""
"passed","Mon Oct 16 05:31:00 UTC 2023","Mon Oct 16 05:31:08 UTC 2023","8100","","Чат","Личный чат","PersonalChatTests","CheckFindPersonalChatByNameInSearch","Список чатов - личный чат: можно найти чат в поиске по названию",""
"passed","Mon Oct 16 05:28:34 UTC 2023","Mon Oct 16 05:28:42 UTC 2023","8592","","Чат","Мини-чат страницы решений","TaskPageMiniChatTests","CheckSendEmptyMessageInTaskPageMiniChat","Чат на странице решения: невозможно отправить пустое сообщение",""
"passed","Mon Oct 16 05:33:14 UTC 2023","Mon Oct 16 05:33:22 UTC 2023","8077","","Материал","Конструктор теста","TestBlocksAndVariantsValidationTests","CheckRenameTestVariant","Конструктор теста: можно переименовать вариант",""
"passed","Mon Oct 16 05:30:33 UTC 2023","Mon Oct 16 05:30:41 UTC 2023","7185","","Дисциплина","Настройка чата дисциплины","DisciplineChatBlockTests","CheckNotAccessOpenChatActivity","Страница активности: отсутствия доступа к кнопке 'Открыть чат активности', если чат дисциплины заблокирован",""
"passed","Mon Oct 16 05:32:06 UTC 2023","Mon Oct 16 05:32:15 UTC 2023","8798","","Дисциплина","Страница дисциплины","DisciplineMarksAndAttendanceTests","CheckAttendanceByTeacher","Страница посещаемости дисциплины: отметки/снятия посещаемости преподавателем",""
"passed","Mon Oct 16 05:30:34 UTC 2023","Mon Oct 16 05:30:49 UTC 2023","15141","","Дисциплина","Страница дисциплины","DisciplineActivitiesBlockTests","CheckAddTopicInDiscipline","Страница дисциплины: создание темы",""
"passed","Mon Oct 16 05:31:57 UTC 2023","Mon Oct 16 05:32:08 UTC 2023","10510","","Дисциплина","Редактирование дисциплины","DisContingentEditingValidationTests","CheckUnableAddStudentFromAnotherCohortInEditing","Редактирование дисциплины: невозможно добавить студента из стороннего потока",""
"passed","Mon Oct 16 05:26:16 UTC 2023","Mon Oct 16 05:26:24 UTC 2023","8197","Активность","Контрольная","Создание контрольной","TestActivityCreatingTests","CheckExecModeTestActivity","Создание контрольной: можно создать контрольную с режимом выполнения 'Индивидуальный'",""
"passed","Mon Oct 16 05:33:24 UTC 2023","Mon Oct 16 05:33:29 UTC 2023","5087","","Библиотека","","LibraryActionPanelTests","CheckChangeViewOfLibraryInTileView","Библиотека: можно переключать текущий вид библиотеки со “Списка” на “Плитку”",""
"passed","Mon Oct 16 05:34:43 UTC 2023","Mon Oct 16 05:34:53 UTC 2023","9296","","Материал","Конструктор тест-тренажера","TestTrainSettingsValidationTests","RemoveAuthorInTestTrain","Конструктор теста-тренажера: можно удалить автора",""
"passed","Mon Oct 16 05:28:45 UTC 2023","Mon Oct 16 05:28:49 UTC 2023","3541","","Поток","Создание потока","CohortCreationValidationTests","CheckCreateCohortIfStartAndEndDateAreSame","Создание потока: ошибка валидации, если дата начала и окончания совпадают",""
"passed","Mon Oct 16 05:26:59 UTC 2023","Mon Oct 16 05:27:15 UTC 2023","15694","Активность","Контрольная","Прохождение теста","TestActivityStatusWithTwoOrMoreAttemptsTests","ResultOfPassingDependOnSettings","Страница индивидуальной контрольной: результат тестирования из попытках зависеть от настройки 'За лучшую попытку'",""
"passed","Mon Oct 16 05:28:53 UTC 2023","Mon Oct 16 05:29:05 UTC 2023","12717","","Чат","Личный чат","PersonalChatTests","CheckCallInPersonalChat","Список чатов - личный чат: можно сделать звонок",""
"passed","Mon Oct 16 05:27:18 UTC 2023","Mon Oct 16 05:27:24 UTC 2023","5955","","Активность","Шаблон активности контрольной","TestTemplateEditingTests","ErrorWithIncorrectValueNumberOfAttemptsInTestActivityTemplate","Редактирование шаблона контрольной: отображение ошибки валидации для поля 'Количество попыток сдачи' с отрицательным значением",""
"passed","Mon Oct 16 05:29:51 UTC 2023","Mon Oct 16 05:29:55 UTC 2023","4087","","Поток","Редактирование потока","CohortEditingValidationTests","CheckEditCohortIfStartAndEndDateNotFilled","Редактирование потока: ошибка валидации, если даты начала и окончания не заполнены",""
"passed","Mon Oct 16 05:33:19 UTC 2023","Mon Oct 16 05:33:42 UTC 2023","22953","","Библиотека","","RemovingTemplatesTests","CheckDeleteDisciplineTemplate","Страница библиотеки: можно удалить шаблон дисциплины",""
"passed","Mon Oct 16 05:26:38 UTC 2023","Mon Oct 16 05:26:47 UTC 2023","9877","Активность","Контрольная","Редактирование контрольной","TestActivityEditingTests","EditingGradeFieldsInTestActivity","Редактирование контрольной: можно переключать значения в поле 'Оценка'",""
"passed","Mon Oct 16 05:36:02 UTC 2023","Mon Oct 16 05:36:06 UTC 2023","3882","","Расписание","","ScheduleSettingsTests","ChangeTextShowLastActivitySchedule","Страница расписания: проверка изменение текста показать прошедшие активности",""
"passed","Mon Oct 16 05:29:56 UTC 2023","Mon Oct 16 05:30:05 UTC 2023","9431","","Чат","Чат для заметок","NotesChatTests","CheckAddReactionToLastMessageInNotesChat","Список чатов - чат для заметок: можно добавить реакцию на сообщение",""
"passed","Mon Oct 16 05:30:14 UTC 2023","Mon Oct 16 05:30:19 UTC 2023","5590","","Дисциплина","Редактирование дисциплины","DisciplineAccessTests","CheckIfStudentChangeDiscipline","Редактирование дисциплины: нет возможности редактировать у студента",""
"passed","Mon Oct 16 05:27:48 UTC 2023","Mon Oct 16 05:28:20 UTC 2023","31726","","Звонок","","CallTests","CheckGreenFrameIsDisplayedOnAnotherUsersCard","Страница звонка: отображается зеленая рамка у карточки собеседника при разговоре",""
"passed","Mon Oct 16 05:32:33 UTC 2023","Mon Oct 16 05:32:41 UTC 2023","8762","","Дисциплина","Шаблон дисциплины","DisTemplateTests","CheckAddModuleInDisTemplate","Страница шаблона дисциплины: можно добавить модуль",""
"passed","Mon Oct 16 05:27:30 UTC 2023","Mon Oct 16 05:27:36 UTC 2023","6688","Активность","Контрольная","Результат прохождения теста","TestActivityResultTests","TeacherCannotLeaveCommentOnAnswer","Результат прохождения: преподаватель не может оставить комментарий к ответу, если отключена опция подробная информация о результатах",""
"passed","Mon Oct 16 05:35:18 UTC 2023","Mon Oct 16 05:35:31 UTC 2023","12396","","Расписание","","ScheduleTests","PlugIfNoEventsSchedule","Страница расписания: если нет событий отображается заглушка",""
"passed","Mon Oct 16 05:28:33 UTC 2023","Mon Oct 16 05:28:44 UTC 2023","11429","","Чат","Дисциплина","DisciplineChatTests","CheckCallInDisciplineChat","Список чатов - комната дисциплины: можно сделать звонок",""
"passed","Mon Oct 16 05:29:45 UTC 2023","Mon Oct 16 05:29:49 UTC 2023","3964","","Поток","Страница потока","CohortInfoTests","CheckWindowsSendCohortArchive","Страница потока: при архивации потока появляется модалка подтверждения действия",""
"passed","Mon Oct 16 05:35:15 UTC 2023","Mon Oct 16 05:35:20 UTC 2023","4967","","Программа","","ProgramInfoPageTests","CheckWindowsRestoreArchiveEducationProgram","Страница обр программы: При восстановлении из архива обр программы появляется модалка подтверждения действия",""
"passed","Mon Oct 16 05:34:44 UTC 2023","Mon Oct 16 05:34:51 UTC 2023","6775","","Организация","Редактирование организации","OrganizationEditingTests","CheckCancelOrganizationEditing","Редактирование организации: работает кнопка Отмена",""
"passed","Mon Oct 16 05:32:24 UTC 2023","Mon Oct 16 05:32:30 UTC 2023","5892","","Подразделения","","DivisionCommonTests","CreateDivisionAllRequiredFields","Cоздание подразделения заполнить все поля",""
"passed","Mon Oct 16 05:33:45 UTC 2023","Mon Oct 16 05:33:54 UTC 2023","8653","","Материал","Конструктор теста","TestQuestionAnswersValidationTests","CheckAddOneMoreOptionInSortingTestQuestion","Конструктор теста: можно добавить еще одну опцию в вопрос с типом ответа 'Сортировка'",""
"passed","Mon Oct 16 05:34:33 UTC 2023","Mon Oct 16 05:34:43 UTC 2023","10806","","Материал","Конструктор тест-тренажера","TestTrainSettingsValidationTests","AddAuthorInTestTrain","Конструктор теста-тренажера: можно добавить автора",""
"passed","Mon Oct 16 05:30:30 UTC 2023","Mon Oct 16 05:30:39 UTC 2023","8960","","Дисциплина","Создание дисциплины","DisciplineCreationValidationTests","CheckIfNameNotFilledInCreation","Создание дисциплины ДО: отображение ошибки валидации для поля 'Название', если поле не заполнено",""
"passed","Mon Oct 16 05:25:25 UTC 2023","Mon Oct 16 05:25:36 UTC 2023","10877","","Активность","Обычная активность","ActivityDurationTests","CheckIfStartDateEmptyInAcivity","Редактирование активности: успешное сохранение, если заполнена только дата окончания",""
"passed","Mon Oct 16 05:38:54 UTC 2023","Mon Oct 16 05:39:05 UTC 2023","11380","","Дисциплина","Страница дисциплины","DisciplineRightMenuTests","CheckPinDisciplineForTeacher","Страница дисциплины: работает закрепление или открепление дисциплины в боковом меню для преподавателя",""
"passed","Mon Oct 16 05:30:06 UTC 2023","Mon Oct 16 05:30:15 UTC 2023","9255","","Чат","Личный чат","PersonalChatTests","CheckDeleteMessageInPersonalChat","Список чатов - личный чат: можно удалить сообщение",""
"passed","Mon Oct 16 05:35:56 UTC 2023","Mon Oct 16 05:36:03 UTC 2023","7719","","Профиль","","GeneralUserInfoEditingTests","CheckBirthField","Редактирование профиля пользователя: можно изменить дату рождения",""
"passed","Mon Oct 16 05:30:05 UTC 2023","Mon Oct 16 05:30:22 UTC 2023","16705","","Чат","Чат для заметок","NotesChatTests","CheckPinLastMessageInNotesChat","Список чатов - чат для заметок: можно закреплять сообщения",""
"passed","Mon Oct 16 05:26:50 UTC 2023","Mon Oct 16 05:27:06 UTC 2023","15921","Активность","Контрольная","Страница контрольной","TestCommandActivityTests","EditCommandToControlTypeActivityInCommandMode","Страница командной контрольной: можно редактировать команду",""
"passed","Mon Oct 16 05:31:22 UTC 2023","Mon Oct 16 05:31:26 UTC 2023","4210","","Дисциплина","Редактирование дисциплины","DisciplineEditingValidationTests","CheckIfCreditNotFilled","Редактирование дисциплины: отображение ошибки валидации для поля 'Кредиты' с значением 0",""
"passed","Mon Oct 16 05:29:09 UTC 2023","Mon Oct 16 05:29:19 UTC 2023","10000","","Чат","Личный чат","PersonalChatTests","CheckSendEmojiInPersonalChat","Список чатов - личный чат: можно отправить смайлики",""
"passed","Mon Oct 16 05:32:26 UTC 2023","Mon Oct 16 05:32:30 UTC 2023","4718","","Библиотека","","BulkActionsLibraryTests","CheckAppearanceOfMoveDeleteAndCancelButtons","Библиотека: появление кнопок переместить, удалить, и отмена при активации режима выбора",""
"passed","Mon Oct 16 05:27:02 UTC 2023","Mon Oct 16 05:27:29 UTC 2023","26665","","Активность","Шаблон активности контрольной","TestTemplateCreatingTests","CreateTestActivityTemplate","Создание шаблона контрольной: если заполнены обязательные поля",""
"passed","Mon Oct 16 05:25:19 UTC 2023","Mon Oct 16 05:25:27 UTC 2023","8431","","Активность","Обычная активность","ActivityEditingFormatTests","CheckActivityFormatIsHybrid","Редактирование активности: проверка формата активности гибрид",""
"passed","Mon Oct 16 05:32:28 UTC 2023","Mon Oct 16 05:32:35 UTC 2023","6567","","Дисциплина","Создание дисциплины","DisContingentCreationValidationTests","CheckOnlyCohortStudentsAreShownInListOfStudents","Создание дисциплины: в выпадающем списке поля Студенты отображаются только студенты потока",""
"passed","Mon Oct 16 05:35:00 UTC 2023","Mon Oct 16 05:35:13 UTC 2023","12488","","Материал","Конструктор тест-тренажера","TestTrainSettingsValidationTests","ChangeLevelAssimilationInTestTrainTag","Конструктор теста-тренажера: можно изменить уровень усвоения в добавленном теге знаний",""
"passed","Mon Oct 16 05:30:16 UTC 2023","Mon Oct 16 05:30:23 UTC 2023","6863","","Чат","Дисциплина","DisciplineChatTests","CheckMembersOfDisciplineChatIsDisplayed","Список чатов - комната дисциплины: отображаются участники чата при клике на блок с аватарками",""
"passed","Mon Oct 16 05:33:07 UTC 2023","Mon Oct 16 05:33:12 UTC 2023","5808","","Дисциплина","Редактирование дисциплины","DisContingentEditingTests","CheckEditDisciplineByCheckingBoxAllCohortStudents","Редактированиедисциплины: есть возможность сохранить дисциплину выбрав галку ‘Все студенты потока’",""
"passed","Mon Oct 16 05:34:01 UTC 2023","Mon Oct 16 05:34:20 UTC 2023","19056","","Материал","Конструктор тест-тренажера","TestTrainAddingQuestionsTests","CheckAddQuestionInTestTrainFreeAnswerWithDiapason","Конструктор теста-тренажера: можно добавить вопрос с типом ответа “Свободный ответ” - “Диапазон”",""
"passed","Mon Oct 16 05:31:18 UTC 2023","Mon Oct 16 05:31:31 UTC 2023","12941","","Дисциплина","Создание дисциплины","DisciplineCreationTests","CreatDisciplineFromDisciplineTemplate","Создание дисциплины ДО: можно создать дисциплину из шаблона дисциплины без активностей",""
"passed","Mon Oct 16 05:34:29 UTC 2023","Mon Oct 16 05:34:37 UTC 2023","7396","","Материал","Конструктор теста","TestSettingsValidationTests","EditTestTimeLimit","Конструктор теста: можно изменить временной лимит",""
"passed","Mon Oct 16 05:32:30 UTC 2023","Mon Oct 16 05:32:33 UTC 2023","2926","","Дисциплина","Шаблон дисциплины","DisTemplateTests","CheckCreateDisTemplateIfRequiredFieldsNotFilled","Создание шаблона дисциплины: невозможно создать шаблон, если не заполнены обязательные поля",""
"passed","Mon Oct 16 05:35:11 UTC 2023","Mon Oct 16 05:35:17 UTC 2023","6678","","Программа","","ProgramEditingTests","CheckRemoveProgramFromItsAdministrator","Редактирование программы ДО: нет возможности удаления программы у его админа",""
"passed","Mon Oct 16 05:34:21 UTC 2023","Mon Oct 16 05:34:29 UTC 2023","7453","","Материал","Конструктор теста","TestQuestionAnswersValidationTests","CheckRemoveAnswerFromComparisionQuestion","Конструктор теста: можно удалить один вариант на сопоставление из вопроса с типом ответа ‘Сопоставление’",""
"passed","Mon Oct 16 05:35:29 UTC 2023","Mon Oct 16 05:35:47 UTC 2023","17844","","Профиль","","UserInfoPageTests","CheckAddUserPhotoButtonIsClickable","Страница профиля пользователя: можно загрузить фото",""
"passed","Mon Oct 16 05:30:06 UTC 2023","Mon Oct 16 05:30:14 UTC 2023","7972","","Дисциплина","Редактирование дисциплины","DisciplineAccessTests","CheckIfTeacherChangeDiscipline","Редактирование дисциплины: есть возможность редактировать у преподавателя этой дисциплины",""
"passed","Mon Oct 16 05:27:00 UTC 2023","Mon Oct 16 05:27:11 UTC 2023","11546","Активность","Контрольная","Прохождение теста","TestActivityPassingTests","PossibilityContinueWithIncompleteAttempt","Прохождение теста: можно продолжить выполнение незавершённой попытки",""
"passed","Mon Oct 16 05:30:39 UTC 2023","Mon Oct 16 05:30:50 UTC 2023","11151","","Дисциплина","Создание дисциплины","DisciplineCreationValidationTests","CheckIfShortnameNotFilledInCreation","Создание дисциплины ДО: отображение ошибки валидации для поля 'Краткое название', если поле не заполнено",""
"passed","Mon Oct 16 05:33:19 UTC 2023","Mon Oct 16 05:33:31 UTC 2023","11230","","Материал","Конструктор теста","TestQuestionsValidationTests","CheckAddCommentInTestQuestion","Конструктор теста: можно добавить комментария к вопросу",""
"passed","Mon Oct 16 05:33:48 UTC 2023","Mon Oct 16 05:33:58 UTC 2023","10616","","Материал","Конструктор теста","TestQuestionsValidationTests","CheckEditTestQuestionPionts","Конструктор теста: можно изменить баллы для вопроса",""
"passed","Mon Oct 16 05:34:33 UTC 2023","Mon Oct 16 05:34:35 UTC 2023","1418","","Организация","Мой тариф","MyPlanOrganizationPageTests","CheckAmountDueTooltipAppears","Страница Мой тариф: отображается тултип при наведении курсора на значок i в блоке Расчет данных",""
"passed","Mon Oct 16 05:34:53 UTC 2023","Mon Oct 16 05:34:57 UTC 2023","3998","","Программа","","ProgramEditingTests","CheckRemoveProgramWithoutCohort","Редактирование программы ДО: можно удалить программу без потоков",""
"passed","Mon Oct 16 05:26:38 UTC 2023","Mon Oct 16 05:26:51 UTC 2023","12771","Активность","Контрольная","Прохождение теста","TestActivityStatusWithTwoOrMoreAttemptsTests","StatusExistIfAtLeastOneCompletedAttempt","Страница индивидуальной контрольной: статус отображается, если есть хотя бы одна завершенная попытка",""
"passed","Mon Oct 16 05:25:21 UTC 2023","Mon Oct 16 05:25:33 UTC 2023","11397","","Активность","Обычная активность","ActivityCreatingTests","CreateActivityInTopic","Cоздание активности: можно создать активность в дисциплине в теме",""
"passed","Mon Oct 16 05:27:41 UTC 2023","Mon Oct 16 05:27:54 UTC 2023","12797","","Активность","Обычный шаблон активности","TemplateAddingTests","CheckAddTestSimulatorNotInControlTypeTemplate","Редактирование шаблона активности: можно добавить материал типа тест-тренажёра из библиотеки не в контрольную",""
"passed","Mon Oct 16 05:25:11 UTC 2023","Mon Oct 16 05:25:21 UTC 2023","10302","","Активность","Обычная активность","ActivityCreatingTests","CreateActivityInModule","Cоздание активности: можно создать активность в дисциплине в модуле",""
"passed","Mon Oct 16 05:25:15 UTC 2023","Mon Oct 16 05:25:25 UTC 2023","10040","","Активность","Обычная активность","ActivityDurationTests","CheckIfEndDateEmptyInAcivity","Редактирование активности: успешное сохранение, если заполнена только дата начала",""
"passed","Mon Oct 16 05:33:54 UTC 2023","Mon Oct 16 05:34:02 UTC 2023","8247","","Материал","Конструктор теста","TestQuestionAnswersValidationTests","CheckAddCommentInTestAnswer","Конструктор теста: можно добавить комментарий к варианту ответа",""
