"Status","Start Time","Stop Time","Duration in ms","Parent Suite","Suite","Sub Suite","Test Class","Test Method","Name","Description"
"passed","Tue Feb 06 01:38:54 UTC 2024","Tue Feb 06 01:38:57 UTC 2024","2750","","Профиль","","GeneralUserInfoEditingTests","CheckSwitchToOwnTransliteration","Редактирование профиля пользователя: можно переключить свитч транслитерации",""
"passed","Tue Feb 06 01:35:46 UTC 2024","Tue Feb 06 01:35:57 UTC 2024","10784","","Библиотека","","BulkActionsLibraryTests","CheckSelectMultipleItems","Библиотека: можно выбрать несколько элементов",""
"passed","Tue Feb 06 01:35:59 UTC 2024","Tue Feb 06 01:36:33 UTC 2024","34238","","Библиотека","","LibraryActionPanelTests","CheckSwitchToAnotherLibrary","Библиотека, плиточный вид: можно переключаться на другую Библиотеку",""
"passed","Tue Feb 06 01:29:09 UTC 2024","Tue Feb 06 01:29:29 UTC 2024","20085","","Чат","Групповой чат","GroupChatMessageTests","CheckPinLastMessageInGroupChatByOtherUser","Не администратор чата может закрепить сообщение в групповом чате",""
"passed","Tue Feb 06 01:35:00 UTC 2024","Tue Feb 06 01:35:05 UTC 2024","5624","","Дисциплина","Редактирование дисциплины","DisContingentEditingValidationTests","CheckUnableAddGroupFromAnotherCohortInEditing","Редактирование дисциплины: невозможно добавить группу из стороннего потока",""
"passed","Tue Feb 06 01:25:36 UTC 2024","Tue Feb 06 01:25:45 UTC 2024","8910","","Активность","Обычная активность","ActivityDurationTests","ErrorWhenEndDateLessStartDateInActivity","Отображение ошибки валидации для полей дат, если дата окончания меньше даты начала",""
"passed","Tue Feb 06 01:29:08 UTC 2024","Tue Feb 06 01:29:15 UTC 2024","6478","","Чат","Дисциплина","DisciplineRoomChatTests","CheckSendFileMessageInDisciplineRoomChat","можно прикрепить и отправить файл с компьютера",""
"passed","Tue Feb 06 01:34:50 UTC 2024","Tue Feb 06 01:34:52 UTC 2024","2160","","Дисциплина","Создание дисциплины","DisContingentCreationValidationTests","CheckIsDisabledCheckboxAllStudentInCreatingDiscipline","Чекбокс ‘Все студенты потока’ задизейблен и его невозможно снять",""
"passed","Tue Feb 06 01:26:58 UTC 2024","Tue Feb 06 01:27:11 UTC 2024","13329","Активность","Контрольная","Редактирование контрольной","TestActivityAddingTests","CheckAddScormPackageToControlTypeActivity","Можно добавить SCORM-пакет из Библиотеки в контрольную",""
"passed","Tue Feb 06 01:31:35 UTC 2024","Tue Feb 06 01:31:46 UTC 2024","10717","","Чат","Личный чат","PersonalChatTests","CheckAddQuoteToLastMessageInPersonalChat","можно цитировать сообщению",""
"passed","Tue Feb 06 01:25:23 UTC 2024","Tue Feb 06 01:25:25 UTC 2024","2370","Активность","Задание","Страница решения задания для студента","TaskWithoutSolutionStudentTests","CheckSendEmptySolution","Появление ошибки при отправке пустого решения",""
"passed","Tue Feb 06 01:37:41 UTC 2024","Tue Feb 06 01:37:48 UTC 2024","6820","","Материал","Конструктор теста","TestSettingsValidationTests","EditTestStudyTime","Конструктор теста: можно изменить время изучения",""
"passed","Tue Feb 06 01:37:07 UTC 2024","Tue Feb 06 01:37:19 UTC 2024","12511","","Материал","Конструктор теста","TestBlocksAndVariantsValidationTests","CheckRemoveQuestionFromTest","Конструктор теста: можно удалить вопрос",""
"passed","Tue Feb 06 01:42:33 UTC 2024","Tue Feb 06 01:42:37 UTC 2024","3583","","Дисциплина","Редактирование дисциплины","DisciplineEditingValidationTests","CheckIfCreditNotFilled","Отображение ошибки валидации для поля Кредиты с значением 0 в дисциплине ВО",""
"passed","Tue Feb 06 01:31:05 UTC 2024","Tue Feb 06 01:31:12 UTC 2024","7043","","Чат","Личный чат","PersonalChatTests","CheckSendTextMessageInPersonalChat","можно отправить текстовое сообщение",""
"passed","Tue Feb 06 01:31:28 UTC 2024","Tue Feb 06 01:31:49 UTC 2024","21021","","Чат","Мини-чат группового чата","GroupMiniChatTests","CheckPinLastMessageInGroupMiniChat","Можно закреплять сообщения в миничате группового чата",""
"passed","Tue Feb 06 01:38:31 UTC 2024","Tue Feb 06 01:38:41 UTC 2024","10255","","Расписание","","StudentScheduleSettingsTests","CheckAbilityToHideCompletedActivities","Проверка возможности скрыть пройденные активности под студентом",""
"passed","Tue Feb 06 01:37:58 UTC 2024","Tue Feb 06 01:38:19 UTC 2024","21584","","Материал","Конструктор теста","TestAddingQuestionsTests","CheckAddComparisonTestQuestion","Конструктор теста: можно добавить вопрос с типом ответа “Сопоставление”",""
"passed","Tue Feb 06 01:34:39 UTC 2024","Tue Feb 06 01:34:44 UTC 2024","5169","","Дисциплина","Редактирование дисциплины","DisciplineEditingTests","CheckClearAddedTagsFromDiscipline","Можно очистить теги знаний",""
"passed","Tue Feb 06 01:36:56 UTC 2024","Tue Feb 06 01:37:23 UTC 2024","26627","","Библиотека","","RemovingTemplatesTests","CheckDeleteDisciplineTemplateFromWhichDisciplineIsCreated","Страница библиотеки: можно удалить шаблон дисциплины по которому была создана дисциплина",""
"passed","Tue Feb 06 01:28:38 UTC 2024","Tue Feb 06 01:28:46 UTC 2024","8100","","Чат","Дисциплина","DisciplineChatTests","CheckFindDisciplineChatByNameInSearch","Можно найти чат в поиске по названию",""
"passed","Tue Feb 06 01:30:28 UTC 2024","Tue Feb 06 01:30:35 UTC 2024","6796","","Чат","Групповой чат","GroupChatTests","CheckSendFileMessageInGroupChat","можно прикрепить и отправить файл с компьютера",""
"passed","Tue Feb 06 01:27:50 UTC 2024","Tue Feb 06 01:27:56 UTC 2024","6153","","Чат","Дисциплина","DisciplineRoomChatTests+AccessToClosedRoom","CheckAccessToClosedRoom","отсутствие доступа в закрытую комнату пользователю, не состоящему в ней",""
"passed","Tue Feb 06 01:39:20 UTC 2024","Tue Feb 06 01:39:24 UTC 2024","3868","","Профиль","","UserInfoPageTests","CheckStudentCannotViewPassedActivitiesOfAnotherStudent","Страница профиля пользователя: студент не может посмотреть пройденные активности другого студента",""
"passed","Tue Feb 06 01:34:38 UTC 2024","Tue Feb 06 01:34:48 UTC 2024","10843","","Дисциплина","Создание дисциплины","DisciplineCreationTests","CreatDisciplineFromDisciplineTemplate","Можно создать дисциплину ДО из шаблона дисциплины без активностей",""
"passed","Tue Feb 06 01:35:14 UTC 2024","Tue Feb 06 01:35:18 UTC 2024","4249","","Дисциплина","Страница дисциплины","DisciplineStudentTests","CheckGradingByStudent","У студента нет возможности выставить оценку",""
"passed","Tue Feb 06 01:37:03 UTC 2024","Tue Feb 06 01:37:11 UTC 2024","8142","","Библиотека","","LibraryActionPanelTests","CheckChangeViewOfLibraryInTileView","Библиотека: можно переключать текущий вид библиотеки со “Списка” на “Плитку”",""
"passed","Tue Feb 06 01:33:11 UTC 2024","Tue Feb 06 01:33:17 UTC 2024","5142","","Чат","Личный чат","PersonalChatTests","CheckFindPersonalChatByNameInSearch","можно найти чат в поиске по названию",""
"passed","Tue Feb 06 01:27:54 UTC 2024","Tue Feb 06 01:28:05 UTC 2024","10867","","Чат","Мини-чат дисциплины","DisciplineRoomMiniChatTests","CheckSendTextMessageInDisciplineRoomMiniChat","можно отправить текстовое сообщение",""
"passed","Tue Feb 06 01:38:14 UTC 2024","Tue Feb 06 01:38:18 UTC 2024","4242","","Программа","","ProgramCreationTests","CreateHighProgramOverviewFields","Заполнить только обязательные поля у программы ДПО",""
"passed","Tue Feb 06 01:36:27 UTC 2024","Tue Feb 06 01:36:35 UTC 2024","7836","","Материал","Конструктор теста","TestCreationTests","TestCreation","Конструктор теста: создание теста",""
"passed","Tue Feb 06 01:35:11 UTC 2024","Tue Feb 06 01:35:14 UTC 2024","2717","","Дисциплина","Страница дисциплины","DisciplineStudentTests","CheckNoEditButtonForStudent","Отсутствие кнопки ‘Редактировать’ для студента",""
"passed","Tue Feb 06 01:37:24 UTC 2024","Tue Feb 06 01:37:32 UTC 2024","8502","","Материал","Конструктор теста","TestSettingsValidationTests","ChangeLevelAssimilationInTestTag","Конструктор теста: можно изменить уровень усвоения в добавленном теге знаний",""
"passed","Tue Feb 06 01:28:42 UTC 2024","Tue Feb 06 01:28:55 UTC 2024","12455","","Чат","Групповой чат","GroupChatMessageTests","CheckAddQuoteToLastMessageotherUsersInGroupChat","Можно цитировать сообщение другого участника в групповом чате",""
"passed","Tue Feb 06 01:28:11 UTC 2024","Tue Feb 06 01:28:30 UTC 2024","18640","","Чат","Мини-чат звонка дисциплины","DisciplineRoomChatCallTests","CheckSendEmptyMessageInDisciplineRoomCallChat","невозможно отправить пустое сообщение",""
"passed","Tue Feb 06 01:35:31 UTC 2024","Tue Feb 06 01:35:33 UTC 2024","1522","","Подразделения","Редактирование подразделения","DivisionEditingTests","CheckDeleteDivisionType","Нет возможности удалить значение в поле Тип",""
"passed","Tue Feb 06 01:30:03 UTC 2024","Tue Feb 06 01:30:13 UTC 2024","9833","","Чат","Дисциплина","DisciplineRoomChatTests","CheckChangeDisciplineChatRoomStatus","можно изменить доступ к комнате",""
"passed","Tue Feb 06 01:34:24 UTC 2024","Tue Feb 06 01:34:29 UTC 2024","4467","","Дисциплина","Редактирование дисциплины","DisciplineEditingTests","CheckSetDescriptionField","Можно изменить описание",""
"passed","Tue Feb 06 01:34:51 UTC 2024","Tue Feb 06 01:34:55 UTC 2024","4596","","Дисциплина","Страница дисциплины","DisciplineAnalyticsTests","CheckStudentActivityGraphIsDisplayed","Проверка отображения в аналитике графика действий студента",""
"passed","Tue Feb 06 01:33:35 UTC 2024","Tue Feb 06 01:33:42 UTC 2024","7327","","Поток","Создание потока","CohortCreationTests","CheckCreateCohortBySelectingCheckboxRegistrationLink","Создание потока ДО: можно создать поток, выбрав галку ‘Разрешена регистрация по ссылке’",""
"passed","Tue Feb 06 01:33:05 UTC 2024","Tue Feb 06 01:33:12 UTC 2024","6989","","Поток","Редактирование потока","CohortEditingTests","CheckCreateCohortWithMismatchWarningOfDuration","Редактирование потока: появление модалки, если продолжительность потока меньше часов программы",""
"passed","Tue Feb 06 01:32:55 UTC 2024","Tue Feb 06 01:33:03 UTC 2024","8126","","Чат","Чат решения","TaskChatTests","CheckAddReactionToLastMessageInTaskChat","можно добавить реакцию на сообщение",""
"passed","Tue Feb 06 01:38:27 UTC 2024","Tue Feb 06 01:38:35 UTC 2024","8539","","Материал","Конструктор тест-тренажера","TestTrainQuestionAnswersValidationTests","AddCommentInTestTrainAnswer","Конструктор теста-тренажера: можно изменить комментарий к варианту ответа",""
"passed","Tue Feb 06 01:34:02 UTC 2024","Tue Feb 06 01:34:06 UTC 2024","3692","","Дисциплина","Редактирование дисциплины","DisciplineEditingValidationTests","CheckIfNameNotFilledInEditing","Отображение ошибки валидации для поля Название, если поле не заполнено в дисциплине ДО",""
"passed","Tue Feb 06 01:36:31 UTC 2024","Tue Feb 06 01:36:54 UTC 2024","23181","","Библиотека","","LibraryInTileViewTests","CheckCopyMaterialToCatalogInTileView","Библиотека, плиточный вид: можно скопировать материал в другой каталог",""
"passed","Tue Feb 06 01:25:29 UTC 2024","Tue Feb 06 01:25:37 UTC 2024","7510","","Активность","Обычная активность","ActivityEditingFormatTests","CheckRandomSetTypeActivityGetFormatIndependancyStudy","Автоматическое переключение на ‘Самостоятельное изучение’ при выборе конкретных типов",""
"passed","Tue Feb 06 01:27:27 UTC 2024","Tue Feb 06 01:27:37 UTC 2024","9580","Активность","Шаблон активности контрольной","Создание шаблона контрольной","TestTemplateCreatingTests","CheckExecModeTestActivityTemplate","Можно создать шаблон контрольной с режимом выполнения Индивидуальный",""
"passed","Tue Feb 06 01:42:31 UTC 2024","Tue Feb 06 01:42:38 UTC 2024","7106","","Чат","Дисциплина","DisciplineRoomChatTests","CheckAddDisciplineChatRoom","можно добавить комнату для отдельных студентов",""
"passed","Tue Feb 06 01:38:16 UTC 2024","Tue Feb 06 01:38:24 UTC 2024","7758","","Материал","Конструктор тест-тренажера","TestTrainSettingsValidationTests","ChangeLevelAssimilationInTestTrainTag","Конструктор теста-тренажера: можно изменить уровень усвоения в добавленном теге знаний",""
"passed","Tue Feb 06 01:37:48 UTC 2024","Tue Feb 06 01:37:57 UTC 2024","8843","","Материал","Конструктор теста","TestQuestionAnswersValidationTests","CheckEditCommentInTestAnswer","Конструктор теста: можно изменить комментарий к варианту ответа",""
"passed","Tue Feb 06 01:28:54 UTC 2024","Tue Feb 06 01:28:56 UTC 2024","2520","","Чат","Дисциплина","DisciplineChatTests","CheckOpenImageInDisciplineChat","Можно открыть превью изображения",""
"passed","Tue Feb 06 01:36:57 UTC 2024","Tue Feb 06 01:37:07 UTC 2024","9157","","Материал","Конструктор теста","TestQuestionsValidationTests","CheckEditCommentInTestQuestion","Конструктор теста: можно изменить комментарий к вопросу",""
"passed","Tue Feb 06 01:38:45 UTC 2024","Tue Feb 06 01:38:55 UTC 2024","9930","","Расписание","","ScheduleTests","CheckClickabilityOfTodayButton","Проверка кликабельности кнопки Сегодня, если выбрана не сегодняшняя дата",""
"passed","Tue Feb 06 01:38:03 UTC 2024","Tue Feb 06 01:38:09 UTC 2024","6199","","Материал","Конструктор тест-тренажера","TestTrainQuestionAnswersValidationTests","RemoveAnswerFromQuestionInTestTrain","Конструктор теста-тренажера: можно удалить вариант ответа из вопроса с типом ответа 'Выбор из вариантов'",""
"passed","Tue Feb 06 01:36:47 UTC 2024","Tue Feb 06 01:36:55 UTC 2024","8177","","Материал","Конструктор теста","TestQuestionAnswersValidationTests","CheckAddOneMoreAnswerVariantInQuestionWithFreeAnswerExactMatch","Конструктор теста: можно добавить еще один вариант ответа в вопрос с типом ответа 'Свободный ответ - точное совпадение'",""
"passed","Tue Feb 06 01:29:23 UTC 2024","Tue Feb 06 01:29:31 UTC 2024","8003","","Чат","Дисциплина","DisciplineRoomChatTests","CheckAddReactionToLastMessageInDisciplineRoomChat","можно добавить реакцию на сообщение",""
"passed","Tue Feb 06 01:33:36 UTC 2024","Tue Feb 06 01:33:41 UTC 2024","5146","","Дисциплина","Редактирование дисциплины","DisciplineAccessTests","CheckIfAdminEducProgChangeDiscipline","У администратора ОП, к которой дисциплина относится, есть возможность редактирования",""
"passed","Tue Feb 06 01:37:02 UTC 2024","Tue Feb 06 01:37:11 UTC 2024","8333","","Материал","Конструктор теста","TestQuestionAnswersValidationTests","CheckAddOneMoreOptionInSortingTestQuestion","Конструктор теста: можно добавить еще одну опцию в вопрос с типом ответа 'Сортировка'",""
"passed","Tue Feb 06 01:31:49 UTC 2024","Tue Feb 06 01:31:59 UTC 2024","9847","","Чат","Мини-чат группового чата","GroupMiniChatTests","CheckDeleteMessageInGroupMiniChat","можно удалить сообщение",""
"passed","Tue Feb 06 01:33:09 UTC 2024","Tue Feb 06 01:33:10 UTC 2024","1257","","Поток","Создание потока","CohortCreationValidationTests","CheckCreateCohortBySelectingCheckboxRegistrationLinkInProgramNatDemography","Создание потока ДО (СЗ): нет возможности выбрать галку ‘Разрешена регистрация по ссылке’",""
"passed","Tue Feb 06 01:27:28 UTC 2024","Tue Feb 06 01:27:33 UTC 2024","4802","Активность","Шаблон активности контрольной","Редактирование шаблона контрольной","TestTemplateEditingTests","CheckSuccessEditingTimeLimitWithCorrectValue","Успешное сохранение при корректных значениях в поле Временной лимит",""
"passed","Tue Feb 06 01:31:27 UTC 2024","Tue Feb 06 01:31:34 UTC 2024","7405","","Чат","Чат для заметок","NotesChatTests","CheckSendMessageByTappingEnterInNotesChat","можно отправить сообщения по нажатию на Enter",""
"passed","Tue Feb 06 01:29:12 UTC 2024","Tue Feb 06 01:29:30 UTC 2024","17585","","Чат","Дисциплина","DisciplineChatTests","CheckPinLastMessageInDisciplineChat","Можно закреплять сообщения в чате дисциплины",""
"passed","Tue Feb 06 01:31:52 UTC 2024","Tue Feb 06 01:31:59 UTC 2024","7635","","Чат","Чат решения","TaskChatTests","CheckSendTextMessageInTaskChat","можно отправить текстовое сообщение",""
"passed","Tue Feb 06 01:42:34 UTC 2024","Tue Feb 06 01:42:42 UTC 2024","7832","Активность","Контрольная","Прохождение теста","TestActivityPassingTests","CheckPassingTestInControlActivity","Можно пройти тест командной контрольной",""
"passed","Tue Feb 06 01:25:35 UTC 2024","Tue Feb 06 01:25:48 UTC 2024","12598","","Активность","Обычная активность","ActivityCreatingTests","CheckCreateActivityFromTemplate","Можно создать активность из шаблона",""
"passed","Tue Feb 06 01:38:23 UTC 2024","Tue Feb 06 01:38:27 UTC 2024","4109","","Программа","","ProgramInfoPageTests","CheckWindowsSendEducationProgramToArchive","При архивации образовательной программы появляется модалка подтверждения действия",""
"passed","Tue Feb 06 01:32:46 UTC 2024","Tue Feb 06 01:33:02 UTC 2024","16016","","Чат","Мини-чат личного звонка","PersonalChatCallTests","CheckSendFileMessageInPersonalCallChat","можно прикрепить и отправить файл с компьютера",""
"passed","Tue Feb 06 01:42:40 UTC 2024","Tue Feb 06 01:42:43 UTC 2024","3003","","Дисциплина","Редактирование дисциплины","DisciplineEditingValidationTests","CheckIfCreditNotFilled","Отображение ошибки валидации для поля Кредиты с отрицательным значением в дисциплине ВО",""
"passed","Tue Feb 06 01:28:24 UTC 2024","Tue Feb 06 01:28:42 UTC 2024","18219","","Чат","Групповой чат","GroupChatMessageTests","CopyMessage","Можно скопировать сообщение из группового чата",""
"passed","Tue Feb 06 01:30:12 UTC 2024","Tue Feb 06 01:30:27 UTC 2024","14315","","Чат","Мини-чат группового чата","GroupMiniChatTests","CheckAddQuoteToLastMessageInGroupMiniChat","можно цитировать сообщению",""
"passed","Tue Feb 06 01:38:45 UTC 2024","Tue Feb 06 01:38:54 UTC 2024","8932","","Профиль","","GeneralUserInfoEditingTests","ValidatingUserNameFields","Редактирование профиля пользователя: можно изменить ФИО",""
"passed","Tue Feb 06 01:25:28 UTC 2024","Tue Feb 06 01:25:33 UTC 2024","5398","Активность","Задание","Страница решения задания для преподавателя","TaskActivityTeacherTests","CheckGradeSolutionWithZeroValue","Можно оценить решения значением 0",""
"passed","Tue Feb 06 01:34:00 UTC 2024","Tue Feb 06 01:34:08 UTC 2024","7831","","Дисциплина","Создание дисциплины","DisciplineCreationValidationTests","CheckIfNameNotFilledInCreation","Отображение ошибки валидации для поля 'Название', если поле не заполнено в ДО",""
"passed","Tue Feb 06 01:38:27 UTC 2024","Tue Feb 06 01:38:29 UTC 2024","2190","","Программа","","ProgramEditingTests","CheckRemoveProgramWithNationalProject","Невозможно удалить программу ДО с проектом СЗ",""
"passed","Tue Feb 06 01:32:29 UTC 2024","Tue Feb 06 01:32:32 UTC 2024","3323","","Поток","Создание потока","CohortCreationValidationTests","CheckCreateCohortIfStartAndEndDateAreSame","Создание потока: ошибка валидации, если дата начала и окончания совпадают",""
"passed","Tue Feb 06 01:30:46 UTC 2024","Tue Feb 06 01:30:58 UTC 2024","12427","","Чат","Мини-чат группового чата","GroupMiniChatTests","CheckSendEmojiInGroupMiniChat","можно отправить смайлики",""
"passed","Tue Feb 06 01:31:08 UTC 2024","Tue Feb 06 01:31:18 UTC 2024","9194","","Чат","Чат для заметок","NotesChatTests","CheckSendEmojiInNotesChat","можно отправить смайлики",""
"passed","Tue Feb 06 01:35:54 UTC 2024","Tue Feb 06 01:35:56 UTC 2024","2248","","Подразделения","Страница подразделения","DivisionPageTests","CheckTypeAndHoursOfProgramsIsDisplayed","Лейблы тип и количество часов отображаются под названием программы",""
"passed","Tue Feb 06 01:35:43 UTC 2024","Tue Feb 06 01:35:52 UTC 2024","9236","","Дисциплина","Создание дисциплины","DisContingentCreationTests","CheckCreateDisciplineByUncheckingBoxAllCohortStudents","Можно создать дисциплину, отключив чекбокс ‘Все студенты потока’",""
"passed","Tue Feb 06 01:36:09 UTC 2024","Tue Feb 06 01:36:11 UTC 2024","1447","","Библиотека","","StudentLibraryTests","CheckStudentNotAllowedPutContentInStock","Страница материала: студенту недоступно выставление своего материала на Биржу",""
"passed","Tue Feb 06 01:28:53 UTC 2024","Tue Feb 06 01:28:59 UTC 2024","5694","","Чат","Дисциплина","DisciplineRoomChatTests","CheckFindDisciplineRoomChatByNameInSearch","можно найти чат в поиске по названию",""
