"Status","Start Time","Stop Time","Duration in ms","Parent Suite","Suite","Sub Suite","Test Class","Test Method","Name","Description"
"passed","Wed Jun 19 07:27:04 UTC 2024","Wed Jun 19 07:27:08 UTC 2024","4081","","Дисциплина","Редактирование дисциплины","DisciplineAccessTests","CheckIfStudentChangeDiscipline","У студента нет возможности редактирования",""
"passed","Wed Jun 19 07:22:03 UTC 2024","Wed Jun 19 07:22:09 UTC 2024","5332","Активность","Обычная активность","Редактирование активности","ActivityDurationTests","CheckEditActivityVolumeWithIncorrectValue","Отображение ошибки валидации для поля Объем в академических часах с отрицательным значением",""
"passed","Wed Jun 19 07:20:48 UTC 2024","Wed Jun 19 07:21:14 UTC 2024","25416","Активность","Обычная активность","Редактирование активности","ActivityContentVisibilityTests","CheckVisibilityMaterialDuringActivity","Видимость материала во время проведения активности",""
"passed","Wed Jun 19 07:28:58 UTC 2024","Wed Jun 19 07:29:08 UTC 2024","10370","","Дисциплина","Страница дисциплины","DisciplineRightMenuTests","CheckDisCreditsAndVolumeIsDisplayed","Отображаются кредиты и объем дисциплины",""
"passed","Wed Jun 19 07:25:10 UTC 2024","Wed Jun 19 07:25:19 UTC 2024","9603","","Чат","Групповой чат","GroupChatMessageActionTests","CheckDeleteMessageInGroupChat","Можно удалить сообщение из группового чата",""
"passed","Wed Jun 19 07:27:22 UTC 2024","Wed Jun 19 07:27:35 UTC 2024","13075","","Дисциплина","Редактирование дисциплины","DisciplineDurationTests","CheckIfDatesFilledCorrectInDiscipline","Успешное сохранение, если обе даты заполнены",""
"passed","Wed Jun 19 07:24:53 UTC 2024","Wed Jun 19 07:25:17 UTC 2024","24011","Активность","Шаблон активности контрольной","Редактирование шаблона контрольной","TestTemplateAddingTests","CheckAddTextMaterialToControlActivityPlan","Можно добавить материал типа Текст из Библиотеки в шаблон контрольной",""
"passed","Wed Jun 19 07:34:49 UTC 2024","Wed Jun 19 07:35:02 UTC 2024","13290","","Расписание","","ScheduleSettingsTests","CheckAbilityRemoveBlackoutFromPastActivities","Проверка возможности убрать затемнение у прошедших активностей",""
"passed","Wed Jun 19 07:35:49 UTC 2024","Wed Jun 19 07:35:54 UTC 2024","4768","","Профиль","","UserInfoPageTests","CheckStudentCannotViewPassedActivitiesOfAnotherStudent","Страница профиля пользователя: студент не может посмотреть пройденные активности другого студента",""
"passed","Wed Jun 19 07:24:06 UTC 2024","Wed Jun 19 07:24:19 UTC 2024","12907","Активность","Шаблон активности контрольной","Редактирование шаблона контрольной","TestTemplateEditingTests","CheckEditScoreValueInControlActivityPlan","Можно переключать значения в поле Оценка в шаблон контрольной",""
"passed","Wed Jun 19 07:31:00 UTC 2024","Wed Jun 19 07:31:15 UTC 2024","14843","","Материал","Конструктор теста","TestQuestionAnswersValidationTests","CheckAddAnswerVariantInMultipleChoiceTestQuestion","Конструктор теста: можно добавить еще один вариант ответа в вопрос с типом ответа 'Выбор из вариантов'",""
"passed","Wed Jun 19 07:20:54 UTC 2024","Wed Jun 19 07:21:08 UTC 2024","14296","Активность","Задание","Страница активности","TaskActivityInfoPageTests","CheckTransitionToMySolution","Работает кнопка Мое решение для студента",""
"passed","Wed Jun 19 07:30:46 UTC 2024","Wed Jun 19 07:31:01 UTC 2024","15153","","Материал","Конструктор теста","TestBlocksAndVariantsValidationTests","CheckAddTestVariant","Конструктор теста: можно добавить вариант",""
"passed","Wed Jun 19 07:28:25 UTC 2024","Wed Jun 19 07:28:58 UTC 2024","32503","","Дисциплина","Страница дисциплины","DisciplineRightMenuTests","CreateTemplateFromDiscipline","Создание шаблона из дисциплины",""
"passed","Wed Jun 19 07:32:33 UTC 2024","Wed Jun 19 07:33:03 UTC 2024","29338","","Материал","Конструктор теста","TestAddingQuestionsTests","CheckAddFileTestQuestion","Конструктор теста: можно добавить вопрос с типом ответа “Файл”",""
"passed","Wed Jun 19 07:26:54 UTC 2024","Wed Jun 19 07:26:58 UTC 2024","4549","","Поток","Редактирование потока","CohortEditingTests","CheckRemoveCohortWithoutDisciplinesAndSemesters","Редактирование потока: можно удалить поток без дисциплин и семестров",""
"passed","Wed Jun 19 07:33:43 UTC 2024","Wed Jun 19 07:33:50 UTC 2024","7268","","Организация","Мой тариф","MyPlanOrganizationPageTests","CheckClosedTableActiveUsers","Страница Мой тариф: проверка закрытия таблицы активных пользователей",""
"passed","Wed Jun 19 07:30:18 UTC 2024","Wed Jun 19 07:30:25 UTC 2024","6966","","Библиотека","","StudentLibraryTests","CheckAvailabilityOfContentCreation","Библиотека студента: недоступно создание материалов кроме добавления файла и создания текстового материала",""
"passed","Wed Jun 19 07:22:50 UTC 2024","Wed Jun 19 07:23:05 UTC 2024","15112","Активность","Контрольная","Прохождение теста","TestActivityPassingTests","CheckPassingTestInControlActivity","Можно пройти тест командной контрольной",""
"passed","Wed Jun 19 07:27:28 UTC 2024","Wed Jun 19 07:27:31 UTC 2024","2882","","Дисциплина","Редактирование дисциплины","DisciplineAccessTests","CheckIfOtherAdminPodrChangeDiscipline","У администратора подразделения, к которому дисциплина НЕ относится, нет возможности редактирования",""
"passed","Wed Jun 19 07:26:36 UTC 2024","Wed Jun 19 07:26:48 UTC 2024","11537","","Поток","Редактирование потока","CohortEditingTests","CheckEditCohortWhenAllRequiredFieldsAreFilled","Редактирование потока: успешное сохранение, если все обязательные поля корректно заполнены",""
"passed","Wed Jun 19 07:40:51 UTC 2024","Wed Jun 19 07:41:09 UTC 2024","18128","","Библиотека","","BulkActionsLibraryTests","CheckRemoveMultipleSelectedItems","Библиотека: можно удалить несколько выбранных элементов",""
"passed","Wed Jun 19 07:24:45 UTC 2024","Wed Jun 19 07:24:52 UTC 2024","7301","","Чат","Групповой чат","GroupChatMessageActionTests","CheckAddQuoteToLastMessageInGroupChat","Можно цитировать сообщение в групповом чате",""
"passed","Wed Jun 19 07:20:50 UTC 2024","Wed Jun 19 07:21:07 UTC 2024","17411","Активность","Обычная активность","Редактирование активности","ActivityDurationTests","CheckIfDatesFilledCorrectInAcivity","Успешное сохранение, если обе даты корректно заполнены",""
"passed","Wed Jun 19 07:41:43 UTC 2024","Wed Jun 19 07:42:27 UTC 2024","44097","","Дисциплина","Создание дисциплины","DisContingentCreationTests","CheckAddTeacherByUserInfoInCreation","Добавление преподавателя по ссылке на профиль",""
"passed","Wed Jun 19 07:29:30 UTC 2024","Wed Jun 19 07:29:37 UTC 2024","6446","","Подразделения","Страница подразделения","DivisionPageTests","CheckPinAndUnpinButtonOfDivisionInMainMenu","Работает кнопка закрепления/открепления из главного меню",""
"passed","Wed Jun 19 07:27:07 UTC 2024","Wed Jun 19 07:27:09 UTC 2024","2119","","Поток","Завершение обучения","EducationCompletionPageTests","FindStudentWithName","Поиск студента по ФИО на странице завершения обучения потока",""
"passed","Wed Jun 19 07:27:35 UTC 2024","Wed Jun 19 07:27:42 UTC 2024","7218","","Дисциплина","Редактирование дисциплины","DisciplineDurationTests","ErrorWhenEndDateLessStartDateInDiscipline","Ошибка валидации, если дата окончания меньше даты начала",""
"passed","Wed Jun 19 07:24:46 UTC 2024","Wed Jun 19 07:25:02 UTC 2024","15834","Активность","Шаблон активности контрольной","Редактирование шаблона контрольной","TestTemplateEditingTests","CheckChangeSelectionOfDisplayingDetailedResultCheckbox","Можно отметить/снять галку с чекбокса Отображать студентам подробную информацию о результатах",""
"passed","Wed Jun 19 07:21:01 UTC 2024","Wed Jun 19 07:21:11 UTC 2024","9882","Активность","Задание","Страница решения задания для преподавателя","TaskActivityTeacherTests","CheckSetIndividualDate","Можно установить индивидуальный срок сдачи",""
"passed","Wed Jun 19 07:30:30 UTC 2024","Wed Jun 19 07:30:41 UTC 2024","10969","","Дисциплина","Редактирование дисциплины","DisContingentEditingTests","CheckCreateDisciplineByUncheckingBoxAllCohortStudents","Есть возможность сохранить дисциплину, сняв галку Все студенты потока",""
"passed","Wed Jun 19 07:26:48 UTC 2024","Wed Jun 19 07:26:50 UTC 2024","2911","","Поток","Редактирование потока","CohortEditingTests","CheckEditCohortByCheckingCheckboxRegistrationLink","Редактирование потока ДО: успешное сохранение, при отметке/снятии галки ‘Разрешена регистрация по ссылке’",""
"passed","Wed Jun 19 07:40:58 UTC 2024","Wed Jun 19 07:41:43 UTC 2024","45017","","Дисциплина","Создание дисциплины","DisContingentCreationTests","CheckAddTeacherByUserInfoInCreation","Добавление преподавателя из списка",""
"passed","Wed Jun 19 07:27:53 UTC 2024","Wed Jun 19 07:28:01 UTC 2024","7924","","Дисциплина","Создание дисциплины","DisciplineCreationValidationTests","CheckIfCreditValuesNotAllowed","Отображение ошибки валидации для поля 'Кредиты' со значением > 15 в ДО",""
"passed","Wed Jun 19 07:26:33 UTC 2024","Wed Jun 19 07:26:40 UTC 2024","7073","","Чат","Миничат страницы решений","TaskPageMiniChatTests","CheckSendMessageByTappingEnterInTaskPageMiniChat","Можно отправить сообщение по нажатию на Enter в миничате страницы решений",""
"passed","Wed Jun 19 07:34:14 UTC 2024","Wed Jun 19 07:34:30 UTC 2024","16537","","Профиль","","AddressAndContactsEditingTests","CheckCountryField","Редактирование профиля пользователя: можно изменить страну",""
"passed","Wed Jun 19 07:27:49 UTC 2024","Wed Jun 19 07:28:00 UTC 2024","10686","","Дисциплина","Страница дисциплины","DisciplineMarksAndAttendanceTests","CheckFinalGradesByTeacher","Проверка работы кнопки ‘Итоговые оценки (ведомость)’ у преподавателя",""
"passed","Wed Jun 19 07:28:50 UTC 2024","Wed Jun 19 07:28:58 UTC 2024","7059","","Дисциплина","Страница дисциплины","DisciplineStudentTests","CheckGradesDropdownForStudent","Отсутствие кнопки 'Итоговые оценки (ведомость)' у студента",""
"passed","Wed Jun 19 07:28:34 UTC 2024","Wed Jun 19 07:28:49 UTC 2024","15552","","Дисциплина","Страница дисциплины","DisciplineMarksAndAttendanceTests","ChecEditTotalFormula","Редактирование формулы промежуточного результата дисциплины",""
"passed","Wed Jun 19 07:21:07 UTC 2024","Wed Jun 19 07:21:22 UTC 2024","14876","Активность","Обычная активность","Редактирование активности","ActivityDurationTests","CheckIfEndDateEmptyInAcivity","Успешное сохранение, если заполнена только дата начала",""
"passed","Wed Jun 19 07:22:31 UTC 2024","Wed Jun 19 07:22:50 UTC 2024","19264","Активность","Контрольная","Прохождение теста","TestActivityPassingTests","CheckPassingTestInControlActivity","Можно пройти тест индивидуальной контрольной",""
"passed","Wed Jun 19 07:22:25 UTC 2024","Wed Jun 19 07:22:37 UTC 2024","11617","Активность","Задание","Страница решения задания для студента","TaskWithSolutionStudentTests","CheckDeleteTextAndLeaveOnlyFileOfSolution","Можно удалить текст и оставить только файл решения",""
"passed","Wed Jun 19 07:29:36 UTC 2024","Wed Jun 19 07:29:43 UTC 2024","6830","","Библиотека","","BulkActionsLibraryTests","CheckAppearanceOfMoveDeleteAndCancelButtons","Библиотека: появление кнопок переместить, удалить, и отмена при активации режима выбора",""
"passed","Wed Jun 19 07:25:53 UTC 2024","Wed Jun 19 07:25:57 UTC 2024","3903","","Чат","Групповой чат","GroupChatTests","CheckAddGroupChatRoomWithoutName","Невозможно добавить групповой чат, если не заполнено поле Название",""
"passed","Wed Jun 19 07:31:35 UTC 2024","Wed Jun 19 07:31:46 UTC 2024","11865","","Материал","Конструктор теста","TestQuestionsValidationTests","CheckRemoveCommentInTestQuestion","Конструктор теста: можно удалить комментария к вопросу",""
"passed","Wed Jun 19 07:22:13 UTC 2024","Wed Jun 19 07:22:19 UTC 2024","5588","Активность","Обычная активность","Редактирование активности","ActivityDurationTests","CheckEditActivityVolumeWithIncorrectValue","Отображение ошибки валидации для поля Объем в академических часах со значением больше 100",""
"passed","Wed Jun 19 07:29:01 UTC 2024","Wed Jun 19 07:29:05 UTC 2024","4437","","Дисциплина","Страница дисциплины","DisciplineAnalyticsTests","CheckStubIsDisplayedIfNoStudentsInDiscipline","В аналитики отображается заглушка, если в дисциплине нет студентов или активностей",""
"passed","Wed Jun 19 07:26:45 UTC 2024","Wed Jun 19 07:26:56 UTC 2024","10741","","Поток","Создание потока","CohortCreationWarningModalTests","CheckCreateCohortAfterChangeMismatchWarningOfDuration","Создание потока: можно создать поток после внесения правок в длительность потока",""
"passed","Wed Jun 19 07:28:08 UTC 2024","Wed Jun 19 07:28:42 UTC 2024","33818","","Дисциплина","Создание дисциплины","DisciplineCreationTests","CreatDisciplineFromDisciplineTemplateWithActivities","Можно создать дисциплину ДО из шаблона дисциплины с активностями",""
"passed","Wed Jun 19 07:29:15 UTC 2024","Wed Jun 19 07:29:23 UTC 2024","8292","","Подразделения","Редактирование подразделения","DivisionEditingTests","CheckEditDivisionResponsiblePersons","Можно отредактировать ответственных лиц подразделения",""
"passed","Wed Jun 19 07:24:52 UTC 2024","Wed Jun 19 07:25:00 UTC 2024","8464","","Чат","Групповой чат","GroupChatMessageActionTests","CheckAddReactionToLastMessageInGroupChat","Можно добавить реакцию на сообщение в групповом чате",""
"passed","Wed Jun 19 07:26:58 UTC 2024","Wed Jun 19 07:27:05 UTC 2024","6787","","Поток","Редактирование потока","CohortEditingTests","CheckCreateCohortWithMismatchWarningOfDuration","Редактирование потока: появление модалки, если продолжительность потока меньше часов программы",""
"passed","Wed Jun 19 07:34:42 UTC 2024","Wed Jun 19 07:34:48 UTC 2024","5901","","Профиль","","AddressAndContactsEditingTests","CheckBlockContactFieldsBeforeInterPassword","Редактирование профиля пользователя: поля 'Контакты' заблокированы до ввода пароля",""
"passed","Wed Jun 19 07:20:49 UTC 2024","Wed Jun 19 07:21:20 UTC 2024","30967","Активность","Обычная активность","Редактирование активности","ActivityAddingTests","CheckAddFileMaterialToActivity","Можно загрузить материал типа Файл с компьютера в активность",""
"passed","Wed Jun 19 07:21:40 UTC 2024","Wed Jun 19 07:21:53 UTC 2024","13261","Активность","Обычная активность","Редактирование активности","ActivityDurationTests","ErrorWhenEndDateLessStartDateInActivity","Отображение ошибки валидации для полей дат, если дата окончания меньше даты начала",""
"passed","Wed Jun 19 07:26:40 UTC 2024","Wed Jun 19 07:26:47 UTC 2024","6727","","Чат","Миничат страницы решений","TaskPageMiniChatTests","CheckAddReactionToLastMessageInTaskPageMiniChat","Можно добавить реакцию на сообщение в миничате страницы решений",""
"passed","Wed Jun 19 07:23:05 UTC 2024","Wed Jun 19 07:23:23 UTC 2024","17812","Активность","Контрольная","Прохождение теста","TestActivityPassingTests","CheckAfterPassingTestNumOfAttemptsDecreasedByOne","После прохождения теста количество попыток уменьшилось на единицу",""
"passed","Wed Jun 19 07:27:47 UTC 2024","Wed Jun 19 07:27:51 UTC 2024","3495","","Дисциплина","Редактирование дисциплины","DisciplineEditingValidationTests","CheckIfNameNotFilledInEditing","Отображение ошибки валидации для поля Название, если поле не заполнено в дисциплине ДО",""
"passed","Wed Jun 19 07:26:29 UTC 2024","Wed Jun 19 07:26:36 UTC 2024","7280","","Чат","Чат дисциплины","DisciplineChatTests","CheckSendMessageByTappingEnterInDisciplineChat","Можно отправить сообщение по нажатию на Enter в чате дисциплины",""
"passed","Wed Jun 19 07:24:08 UTC 2024","Wed Jun 19 07:24:21 UTC 2024","13204","","Звонок","","CallTests","CheckTurnOnOffEquipmentInCall","Страница звонка: можно включить/отключить камеру в звонке",""
"passed","Wed Jun 19 07:26:33 UTC 2024","Wed Jun 19 07:26:40 UTC 2024","6207","","Поток","Создание потока","CohortCreationValidationTests","CheckCreateCohortIfStartDateGreaterThanEndDate","Создание потока: ошибка валидации, если дата начала больше чем дата окончания",""
"passed","Wed Jun 19 07:21:15 UTC 2024","Wed Jun 19 07:21:25 UTC 2024","10558","Активность","Задание","Создание задания","TaskActivityMulticriteriaTests","CheckCreateTaskWithoutNameOfCriteria","Нельзя создать активность типа Задание с критериями, если не заполнено название критерия",""
"passed","Wed Jun 19 07:34:28 UTC 2024","Wed Jun 19 07:34:37 UTC 2024","8729","","Профиль","","GeneralUserInfoEditingTests","ValidatingUserNameFields","Редактирование профиля пользователя: можно изменить ФИО",""
"passed","Wed Jun 19 07:33:39 UTC 2024","Wed Jun 19 07:33:48 UTC 2024","9748","","Материал","Конструктор тест-тренажера","TestTrainSettingsValidationTests","RemoveAuthorInTestTrain","Конструктор теста-тренажера: можно удалить автора",""
"passed","Wed Jun 19 07:27:40 UTC 2024","Wed Jun 19 07:28:08 UTC 2024","27372","","Дисциплина","Создание дисциплины","DisciplineCreationTests","CreatDisciplineFromDisciplineTemplate","Можно создать дисциплину ДО из шаблона дисциплины без активностей",""
"passed","Wed Jun 19 07:26:49 UTC 2024","Wed Jun 19 07:26:55 UTC 2024","6506","","Чат","Личный чат","PersonalChatTests","CheckPinLastMessageInPersonalChat","Можно закреплять сообщение в личном чате",""
"passed","Wed Jun 19 07:30:33 UTC 2024","Wed Jun 19 07:31:14 UTC 2024","41838","","Библиотека","","RemovingTemplatesTests","CheckDeleteProgramTemplateFromWhichCohortIsCreated","Страница библиотеки: можно удалить шаблон программы по которому был создан поток",""
"passed","Wed Jun 19 07:23:43 UTC 2024","Wed Jun 19 07:24:01 UTC 2024","18673","Активность","Контрольная","Прохождение теста","TestActivityStatusWithOneAttemptTests","CheckStatusScoreColorAndIcon","Статус и цвет у количества баллов в попытке различаются в зависимости от успешности в индивидуальной контрольной",""
"failed","Wed Jun 19 07:39:58 UTC 2024","Wed Jun 19 07:40:54 UTC 2024","55989","","Чат","Групповой чат","GroupChatMessageTests","CheckFindSentMessageInGroupChat","Можно найти отправленное сообщение в групповом чате",""
"passed","Wed Jun 19 07:26:28 UTC 2024","Wed Jun 19 07:26:34 UTC 2024","6140","","Чат","Обсуждение решения","TaskChatTests","CheckSendFileMessageInTaskChat","Можно прикрепить и отправить файл с компьютера в обсуждении решения",""
"passed","Wed Jun 19 07:31:57 UTC 2024","Wed Jun 19 07:32:21 UTC 2024","23712","","Материал","Конструктор тест-тренажера","TestTrainAddingQuestionsTests","AddQuestionInTestTrain","Конструктор теста-тренажера: можно добавить вопрос с типом ответа “Выбор из вариантов”",""
"passed","Wed Jun 19 07:32:08 UTC 2024","Wed Jun 19 07:33:11 UTC 2024","62683","","Библиотека","","RemovingTemplatesTests","CheckDeleteDisciplineTemplateFromWhichDisciplineIsCreated","Страница библиотеки: можно удалить шаблон дисциплины по которому была создана дисциплина",""
"passed","Wed Jun 19 07:32:34 UTC 2024","Wed Jun 19 07:32:43 UTC 2024","9919","","Материал","Конструктор теста","TestSettingsValidationTests","EditTestPointsLimit","Конструктор теста: можно изменить минимальный порог баллов",""
"passed","Wed Jun 19 07:25:04 UTC 2024","Wed Jun 19 07:25:19 UTC 2024","14565","","Чат","Миничат группового чата","GroupMiniChatMessageTests","CheckSendTextMessageInGroupMiniChat","Можно отправить текстовое сообщение в миничате группового чата",""
"passed","Wed Jun 19 07:22:45 UTC 2024","Wed Jun 19 07:23:06 UTC 2024","21176","Активность","Контрольная","Редактирование контрольной","TestActivityEditingTests","CheckSuccessSaveWithCorrectValueInNumbOfAttemptsField","Успешное сохранение при корректных значениях в поле Количество попыток сдачи",""
