"Status","Start Time","Stop Time","Duration in ms","Parent Suite","Suite","Sub Suite","Test Class","Test Method","Name","Description"
"passed","Wed Aug 16 04:42:57 UTC 2023","Wed Aug 16 04:42:58 UTC 2023","1618","","Программа","","ProgramCreationTests","CheckCancelCreatingProgram","Cоздание обр программы ДПО: проверка кнопки 'Отмена'",""
"passed","Wed Aug 16 04:43:25 UTC 2023","Wed Aug 16 04:43:28 UTC 2023","2665","","Университет","","UniversityTests","CheckClosedTableActiveUsers","Страница Мой тариф: проверка закрытия таблицы активных пользователей",""
"passed","Wed Aug 16 04:37:52 UTC 2023","Wed Aug 16 04:37:57 UTC 2023","5044","","Чат","Дисциплина","DisciplineChatTests","CheckSwitchToAnotherDisciplineChatRoom","Список чатов - комната дисциплины: можно переключать комнаты",""
"passed","Wed Aug 16 04:43:47 UTC 2023","Wed Aug 16 04:43:54 UTC 2023","7429","","Профиль","","UserInfoPageTests","CheckIfUserPhotoCanBeDeleted","Страница профиля пользователя: можно удалить фото",""
"passed","Wed Aug 16 04:38:37 UTC 2023","Wed Aug 16 04:38:40 UTC 2023","3358","","Поток","","CohortInfoTests","CheckWindowsRestoreCohortArchive","Страница потока: При восстановлении из архива потока появляется модалка подтверждения действия",""
"passed","Wed Aug 16 04:34:10 UTC 2023","Wed Aug 16 04:34:12 UTC 2023","2075","","Активность","Контрольная активность","TestActivityEditingTests","ExecutionModeFieldIsNotClickableInTestActivity","Редактирование контрольной: поле 'Режим выполнения' некликабельно",""
"skipped","Wed Aug 16 04:41:00 UTC 2023","Wed Aug 16 04:41:00 UTC 2023","483","","Библиотека","","LibraryMaterialTests","CheckVisibilityOfLaTeXMaterialPreview","Превью материала: LaTeX отображается как PDF",""
"passed","Wed Aug 16 04:40:11 UTC 2023","Wed Aug 16 04:40:25 UTC 2023","14255","","Дисциплина","Страница дисциплины","DisciplineAnalyticsTests","CheckFilterByGroupName","Страница аналитика дисциплины: работает фильтр по названию группы",""
"passed","Wed Aug 16 04:36:44 UTC 2023","Wed Aug 16 04:36:54 UTC 2023","10423","","Чат","Мини-чат личного чата","PersonalMiniChatTests","CheckFindSentMessageInPersonalMiniChat","Миничат - личный чат: можно найти отправленное сообщение",""
"passed","Wed Aug 16 04:40:51 UTC 2023","Wed Aug 16 04:40:56 UTC 2023","5566","","Дисциплина","Редактирование дисциплины","DisContingentEditingValidationTests","CheckOnlyCohortGroupsAreShownInListOfGroups","Редактирование дисциплины: в выпадающем списке поля Группы отображаются только группы потока",""
"passed","Wed Aug 16 04:34:36 UTC 2023","Wed Aug 16 04:34:46 UTC 2023","10489","","Активность","Контрольная активность","TestActivityPassingTests","AfterPassingTheNumberOfAttemptsDecreased","Прохождения теста: после прохождения количество попыток уменьшилось на один",""
"passed","Wed Aug 16 04:35:58 UTC 2023","Wed Aug 16 04:36:08 UTC 2023","9979","","Чат","Дисциплина","DisciplineChatTests","CheckAddQuoteToLastMessageInDisciplineChat","Список чатов - комната дисциплины: можно цитировать сообщению",""
"passed","Wed Aug 16 04:35:33 UTC 2023","Wed Aug 16 04:35:41 UTC 2023","8113","","Чат","Личный чат","PersonalChatTests","CheckSendTextMessageInPersonalChat","Список чатов - личный чат: можно отправить текстовое сообщение",""
"passed","Wed Aug 16 04:37:17 UTC 2023","Wed Aug 16 04:37:38 UTC 2023","20319","","Чат","Личный чат","PersonalChatTests","CheckPinLastMessageInPersonalChat","Список чатов - личный чат: можно закреплять сообщения",""
"passed","Wed Aug 16 04:33:32 UTC 2023","Wed Aug 16 04:33:42 UTC 2023","9601","","Активность","Задание","TaskActivityCreatingTests","CheckCreateTaskIfMinThresholdNotFilled","Создание задания: нельзя создать задание, если поле 'Минимальный порог баллов' не заполнено",""
"passed","Wed Aug 16 04:43:50 UTC 2023","Wed Aug 16 04:44:04 UTC 2023","14324","","Профиль","","GeneralUserInfoEditingTests","CheckUserNameFiledsInTransliteration","Редактирование профиля пользователя: можно изменить ФИО в транслитерации",""
"passed","Wed Aug 16 04:33:46 UTC 2023","Wed Aug 16 04:33:54 UTC 2023","8128","","Активность","Обычная активность","ActivityEditingTests","CheckEditValueScormResultScore","Редактирование активности: можно переключать значения в поле 'Оценка по SCORM результату'",""
"passed","Wed Aug 16 04:41:18 UTC 2023","Wed Aug 16 04:41:23 UTC 2023","4681","","Библиотека","","LibraryActionPanelTests","CheckFindMaterialsByType","Библиотека, плиточный вид: работает поиск по типу материала",""
"passed","Wed Aug 16 04:36:58 UTC 2023","Wed Aug 16 04:37:07 UTC 2023","9349","","Чат","Чат решения","TaskChatTests","CheckDeleteMessageInTaskChat","Список чатов - обсуждение решения: можно удалить сообщение",""
"passed","Wed Aug 16 04:42:24 UTC 2023","Wed Aug 16 04:42:34 UTC 2023","9575","","Материал","Конструктор тест-тренажера","TestTrainQuestionAnswersValidationTests","AddAnswerForQuestionInTestTrain","Конструктор теста-тренажера: можно добавить еще один вариант ответа в вопрос с типом ответа 'Выбор из вариантов'",""
"passed","Wed Aug 16 04:43:28 UTC 2023","Wed Aug 16 04:43:31 UTC 2023","2423","","Университет","","UniversityTests","CheckClickOnLinkActivyUsers","Страница Мой тариф: проверка перехода в профиль пользователя из таблицы активные пользователи",""
"passed","Wed Aug 16 04:41:12 UTC 2023","Wed Aug 16 04:41:39 UTC 2023","26812","","Библиотека","","LibraryInListViewTests","CheckCopyMaterialToCatalogInListView","Библиотека, списочный вид: можно скопировать материал в другой каталог",""
"passed","Wed Aug 16 04:36:06 UTC 2023","Wed Aug 16 04:36:26 UTC 2023","19996","","Чат","Мини-чат группового звонка","GroupChatCallTests","CheckAddQuoteToLastMessageInGroupCallChat","Миничат звонка - групповой чат: можно цитировать сообщению",""
"passed","Wed Aug 16 04:34:22 UTC 2023","Wed Aug 16 04:34:31 UTC 2023","9460","","Активность","Контрольная активность","TestActivityStatusWithTwoOrMoreAttemptsTests","StatusExistIfAtLeastOneCompletedAttempt","Страница индивидуальной контрольной: статус отображается, если есть хотя бы одна завершенная попытка",""
"passed","Wed Aug 16 04:39:59 UTC 2023","Wed Aug 16 04:40:07 UTC 2023","7579","","Дисциплина","Страница дисциплины","DisciplineStudentTests","CheckAttendanceByStudent","Страница посещаемости дисциплины: невозможности отметки/снятия посещаемости студентом",""
"passed","Wed Aug 16 04:43:59 UTC 2023","Wed Aug 16 04:44:09 UTC 2023","9716","","Профиль","","AddressAndContactsEditingTests","CheckCityField","Редактирование профиля пользователя: можно изменить город",""
"passed","Wed Aug 16 04:33:59 UTC 2023","Wed Aug 16 04:34:12 UTC 2023","12642","","Активность","Контрольная активность","TestActivityAddingTests","CheckAddFileToTestActivity","Редактирование контрольной: можно загрузить материал типа файл с компьютера",""
"passed","Wed Aug 16 04:38:52 UTC 2023","Wed Aug 16 04:39:00 UTC 2023","7532","","Поток","","CohortCreationTests","CheckCreateCohortByFillingMaxNumberOfStudents","Создание потока: можно создать поток, заполнив поле ‘Максимальное количество студентов’",""
"passed","Wed Aug 16 04:34:51 UTC 2023","Wed Aug 16 04:34:56 UTC 2023","5468","","Активность","Шаблон активности контрольной","TestTemplateEditingTests","ErrorWithIncorrectValueNumberOfAttemptsInTestActivityTemplate","Редактирование шаблона контрольной: отображение ошибки валидации для поля 'Количество попыток сдачи' с значением '0'",""
"passed","Wed Aug 16 04:39:05 UTC 2023","Wed Aug 16 04:39:09 UTC 2023","4151","","Дисциплина","Редактирование дисциплины","DisciplineAccessTests","CheckIfOtherAdminEducProgChangeDiscipline","Редактирование дисциплины: нет возможности редактировать у администратора образовательной программы, к которой дисциплина НЕ относится",""
"passed","Wed Aug 16 04:34:26 UTC 2023","Wed Aug 16 04:34:34 UTC 2023","8873","","Активность","Обычный шаблон активности","TemplateEditingTests","CheckEditVolumeActivityTemplate","Редактирование шаблона активности: успешное сохранение при корректных значениях в поля 'Объём'",""
"passed","Wed Aug 16 04:34:56 UTC 2023","Wed Aug 16 04:35:03 UTC 2023","7144","","Активность","Контрольная активность","TestActivityEditingTests","SuccessSaveWithPositiveValueMinThresholdInTestActivity","Редактирование контрольной: успешное сохранение при положительных значениях в 'Минимальный порог баллов'",""
"passed","Wed Aug 16 04:39:18 UTC 2023","Wed Aug 16 04:39:23 UTC 2023","4811","","Дисциплина","Редактирование дисциплины","DisciplineAccessTests","CheckIfAdminPodrChangeDiscipline","Редактирование дисциплины: есть возможность редактировать у администратора подразделения, к которому дисциплина относится",""
"passed","Wed Aug 16 04:41:01 UTC 2023","Wed Aug 16 04:41:04 UTC 2023","3005","","Библиотека","","StudentLibraryTests","CheckAvailabilityOfContentCreation","Библиотека студента: недоступно создание материалов кроме добавления файла и создания текстового материала",""
"passed","Wed Aug 16 04:44:17 UTC 2023","Wed Aug 16 04:44:30 UTC 2023","12938","","Профиль","","AddressAndContactsEditingTests","CheckEmailField","Редактирование профиля пользователя: можно изменить email",""
"passed","Wed Aug 16 04:40:12 UTC 2023","Wed Aug 16 04:40:20 UTC 2023","8334","","Дисциплина","Редактирование дисциплины","DisContingentEditingValidationTests","CheckUnableAddGroupFromAnotherCohortInEditing","Редактирование дисциплины: невозможно добавить группу из стороннего потока",""
"passed","Wed Aug 16 04:35:18 UTC 2023","Wed Aug 16 04:35:34 UTC 2023","16763","","Чат","Мини-чат звонка дисциплины","DisciplineChatCallTests","CheckSendEmptyMessageInDisciplineCallChat","Миничат звонка - комната дисциплины: невозможно отправить пустое сообщение",""
"passed","Wed Aug 16 04:36:18 UTC 2023","Wed Aug 16 04:36:36 UTC 2023","18137","","Чат","Мини-чат решения","TaskMiniChatTests","CheckSendTextMessageInTaskMiniChat","Миничат - обсуждение решения: можно отправить текстовое сообщение",""
"passed","Wed Aug 16 04:39:45 UTC 2023","Wed Aug 16 04:39:52 UTC 2023","7227","","Дисциплина","Создание дисциплины","DisciplineCreationValidationTests","CheckIfDescriptionNotFilledInCreation","Создание дисциплины ДО: отображение ошибки валидации для поля 'Описание', если поле не заполнено",""
"failed","Wed Aug 16 04:35:17 UTC 2023","Wed Aug 16 04:35:51 UTC 2023","33868","","Активность","Контрольная активность","TestActivityResultTests","CheckMarkCorrectTextOrFileAnswer","Результат прохождения теста: можно отметить 'Верно' ответ вопроса с типом ответа свободный ответ или файл",""
"passed","Wed Aug 16 04:37:46 UTC 2023","Wed Aug 16 04:37:55 UTC 2023","9089","","Поток","","CohortCreationValidationTests","CheckCreateCohortIfStartDateGreaterThanEndDate","Создание потока: ошибка валидации, если дата начала больше чем дата окончания",""
"passed","Wed Aug 16 04:38:41 UTC 2023","Wed Aug 16 04:38:57 UTC 2023","15474","","Чат","Мини-чат группового звонка","GroupChatCallTests","CheckDeleteMessageInGroupCallChat","Миничат звонка - групповой чат: можно удалить сообщение",""
"passed","Wed Aug 16 04:33:11 UTC 2023","Wed Aug 16 04:33:21 UTC 2023","10026","","Активность","Задание","TaskActivityCreatingTests","CheckCreateTaskWithOpenSolutions","Создание задания: можно создать задание с открытыми решениями",""
"passed","Wed Aug 16 04:35:18 UTC 2023","Wed Aug 16 04:35:27 UTC 2023","8820","","Чат","Мини-чат для заметок","NotesMiniChatTests","CheckSendTextMessageInNotesMiniChat","Миничат - чат для заметок: можно отправить текстовое сообщение",""
"passed","Wed Aug 16 04:40:44 UTC 2023","Wed Aug 16 04:40:52 UTC 2023","7347","","Библиотека","","LibraryActionPanelTests","CheckCreateCatalog","Библиотека, плиточный вид: можно создать каталог",""
"passed","Wed Aug 16 04:34:21 UTC 2023","Wed Aug 16 04:34:25 UTC 2023","3580","","Активность","Контрольная активность","TestActivityEditingTests","ErrorWithIncorrectValueNumberOfAttemptsInTestActivity","Редактирование контрольной: отображение ошибки валидации для поля 'Количество попыток сдачи' с значением > 20",""
"passed","Wed Aug 16 04:38:12 UTC 2023","Wed Aug 16 04:38:23 UTC 2023","10332","","Поток","","CohortCreationValidationTests","CheckCreateCohortFromUnsuitableTemplate","Создание потока ДО: невозможно создать поток из шаблона программы ВО",""
"passed","Wed Aug 16 04:33:01 UTC 2023","Wed Aug 16 04:33:15 UTC 2023","13666","","Активность","Обычная активность","ActivityEditingTests+ActivityAddingTests","CheckAddFileMaterialActivity","Редактирование активности: можно загрузить материал типа файл с компьютера",""
"passed","Wed Aug 16 04:33:03 UTC 2023","Wed Aug 16 04:33:09 UTC 2023","5948","","Активность","Задание","TaskActivityMulticriteriaTests","CheckMultiCriteriaCheckboxInTask","Создание задания: чекбокс многокритериальная проверка отображается, если выбрана стандартная проверка",""
"passed","Wed Aug 16 04:36:59 UTC 2023","Wed Aug 16 04:37:11 UTC 2023","12102","","Чат","Мини-чат страницы решений","TaskPageMiniChatTests","CheckSendTextMessageInTaskPageMiniChat","Чат обсуждение решения: можно отправить текстовое сообщение",""
"passed","Wed Aug 16 04:34:37 UTC 2023","Wed Aug 16 04:34:49 UTC 2023","11697","","Активность","Шаблон активности контрольной","TestTemplateAddingTests","CheckAddFileToTestActivityTemplate","Редактирование шаблона контрольной: можно загрузить материал типа файл с компьютера",""
"passed","Wed Aug 16 04:35:50 UTC 2023","Wed Aug 16 04:35:53 UTC 2023","3761","","Чат","Чат для заметок","NotesChatTests","CheckFindSentMessageInNotesChat","Список чатов - чат для заметок: можно найти отправленное сообщение",""
"passed","Wed Aug 16 04:35:13 UTC 2023","Wed Aug 16 04:35:18 UTC 2023","5119","","Активность","Шаблон активности контрольной","TestTemplateEditingTests","SuccessSaveWithPositiveValueTimeLimitInTestActivityTemplate","Редактирование шаблона контрольной: успешное сохранение при положительных значениях в 'Временной лимит'",""
"passed","Wed Aug 16 04:37:38 UTC 2023","Wed Aug 16 04:37:47 UTC 2023","9167","","Чат","Личный чат","PersonalChatTests","CheckDeleteMessageInPersonalChat","Список чатов - личный чат: можно удалить сообщение",""
"passed","Wed Aug 16 04:33:45 UTC 2023","Wed Aug 16 04:33:47 UTC 2023","2115","","Активность","Задание","TaskWithSolutionStudentTests","CheckImpossibilityToEditAnotherStudentsSolutionGrade","Страница решение задания: нет возможности оценить решения другого студента, если не включена 'Взаимопроверка'",""
"passed","Wed Aug 16 04:36:43 UTC 2023","Wed Aug 16 04:36:53 UTC 2023","10031","","Чат","Дисциплина","DisciplineChatTests","CheckSendFileMessageInDisciplineChat","Список чатов - комната дисциплины: можно прикрепить и отправить файл с компьютера",""
"passed","Wed Aug 16 04:36:39 UTC 2023","Wed Aug 16 04:36:48 UTC 2023","8736","","Чат","Личный чат","PersonalChatTests","CheckSendFileMessageInPersonalChat","Список чатов - личный чат: можно прикрепить и отправить файл с компьютера",""
"passed","Wed Aug 16 04:37:28 UTC 2023","Wed Aug 16 04:37:44 UTC 2023","15623","","Поток","","CohortCreationTests","CheckCreateCohortWhenAllRequiredFieldsAreFilled","Создание потока ВО: можно создать поток, если все обязательные поля корректно заполнены",""
"passed","Wed Aug 16 04:42:48 UTC 2023","Wed Aug 16 04:43:17 UTC 2023","28855","","Библиотека","","LibraryInListViewTests","CheckCopyMaterialViaActionsButton","Библиотека, списочный вид: можно скопировать материал через actions-кнопки",""
"passed","Wed Aug 16 04:40:03 UTC 2023","Wed Aug 16 04:40:07 UTC 2023","3504","","Дисциплина","Создание дисциплины","DisContingentCreationValidationTests","CheckIsDisabledCheckboxAllStudentInCreatingDiscipline","Создание дисциплины (СЗ): галка ‘Все студенты потока’ дизаблена и невозможно его снять",""
"passed","Wed Aug 16 04:43:01 UTC 2023","Wed Aug 16 04:43:08 UTC 2023","6442","","Расписание","","ScheduleSettingsTests","DisconnectWithSyncGoogleCalendar","Страница расписания: проверка отключения синхронизации с google календарем",""
"passed","Wed Aug 16 04:37:57 UTC 2023","Wed Aug 16 04:38:02 UTC 2023","5007","","Чат","Дисциплина","DisciplineChatTests","CheckMembersOfDisciplineChatIsDisplayed","Список чатов - комната дисциплины: отображаются участники чата при клике на блок с аватарками",""
"passed","Wed Aug 16 04:36:32 UTC 2023","Wed Aug 16 04:36:55 UTC 2023","22691","","Чат","Мини-чат звонка дисциплины","DisciplineChatCallTests","CheckSendEmojiInDisciplineCallChat","Миничат звонка - комната дисциплины: можно отправить смайлики",""
"passed","Wed Aug 16 04:43:57 UTC 2023","Wed Aug 16 04:44:04 UTC 2023","7314","","Профиль","","UserInfoPageTests","CheckTransitionToEditProfileWorks","Страница профиля пользователя: работает кнопка 'Редактировать' для пользователя",""
"passed","Wed Aug 16 04:40:25 UTC 2023","Wed Aug 16 04:40:38 UTC 2023","12062","","Дисциплина","Страница дисциплины","DisciplineAnalyticsTests","CheckResetButton","Страница аналитика дисциплины: работает кнопка “Сбросить”",""
"passed","Wed Aug 16 04:39:18 UTC 2023","Wed Aug 16 04:39:23 UTC 2023","5867","","Поток","","CohortEditingValidationTests","CheckIsNotPossibleRemoveCohortInProgramNatDemography","Редактирование потока ДО (СЗ): нет возможности удалить поток",""
"passed","Wed Aug 16 04:39:11 UTC 2023","Wed Aug 16 04:39:22 UTC 2023","11769","","Дисциплина","Страница дисциплины","DisciplineActivitiesBlockTests","CheckAddTopicInDiscipline","Страница дисциплины: создание темы",""
"passed","Wed Aug 16 04:33:18 UTC 2023","Wed Aug 16 04:33:31 UTC 2023","12904","","Активность","Обычный шаблон активности","TemplateAddingTests","CheckAddFileMaterialActivityTemplate","Редактирование шаблона активности: можно загрузить материал типа файл с компьютера",""
"passed","Wed Aug 16 04:40:44 UTC 2023","Wed Aug 16 04:40:45 UTC 2023","1311","","Подразделения","","DivisionCommonTests","CreateDivisionIfrequiredNotFields","Cоздание подразделения если не заполнено обязательно поле",""
"passed","Wed Aug 16 04:34:26 UTC 2023","Wed Aug 16 04:34:40 UTC 2023","13998","","Активность","Контрольная активность","TestActivityAddingTests","AddTestSimulatorToTestActivity","Редактирование контрольной: можно добавить материал типа тест-тренажёр из библиотеки",""
"passed","Wed Aug 16 04:33:36 UTC 2023","Wed Aug 16 04:33:46 UTC 2023","10388","","Активность","Обычная активность","ActivityEditingTests","CheckClearAddedTagsFromActivity","Редактирование активности: можно очистить теги знаний",""
"passed","Wed Aug 16 04:42:50 UTC 2023","Wed Aug 16 04:43:01 UTC 2023","10916","","Материал","Конструктор тест-тренажера","TestTrainQuestionsValidationTests","CheckAndUncheckAnswerOptionInTestTrain","Конструктор теста-тренажера: возможность отметить вариант ответа как “верный”",""
"passed","Wed Aug 16 04:33:15 UTC 2023","Wed Aug 16 04:33:27 UTC 2023","11320","","Активность","Обычная активность","ActivityEditingTests+ActivityDurationTests","CheckIfEndDateEmptyInAcivity","Редактирование активности: успешное сохранение, если заполнена только дата начала",""
"passed","Wed Aug 16 04:43:29 UTC 2023","Wed Aug 16 04:43:39 UTC 2023","10440","","Материал","Конструктор тест-тренажера","TestTrainSettingsValidationTests","ClearTagsFromTestTrain","Конструктор теста-тренажера: можно удалить теги знаний",""
"passed","Wed Aug 16 04:33:01 UTC 2023","Wed Aug 16 04:33:11 UTC 2023","9995","","Активность","Обычная активность","ActivityCreatingTests","CreateActivityWithoutModule","Cоздание активности: можно создать активность в дисциплине без модуля",""
"passed","Wed Aug 16 04:41:59 UTC 2023","Wed Aug 16 04:42:09 UTC 2023","10848","","Материал","Конструктор теста","TestQuestionsValidationTests","CheckAndUncheckAnswerOptionInTest","Конструктор теста: проставление отметки верности варианта ответа",""
