"Status","Start Time","Stop Time","Duration in ms","Parent Suite","Suite","Sub Suite","Test Class","Test Method","Name","Description"
"passed","Wed Aug 16 04:43:39 UTC 2023","Wed Aug 16 04:43:44 UTC 2023","4085","","Расписание","","ScheduleSettingsTests","ChangeTextShowLastActivitySchedule","Страница расписания: проверка изменение текста показать прошедшие активности",""
"passed","Wed Aug 16 04:36:18 UTC 2023","Wed Aug 16 04:36:32 UTC 2023","13771","","Чат","Мини-чат звонка дисциплины","DisciplineChatCallTests","CheckFindSentMessageInDisciplineCallChat","Миничат звонка - комната дисциплины: можно найти отправленное сообщение",""
"passed","Wed Aug 16 04:39:27 UTC 2023","Wed Aug 16 04:39:30 UTC 2023","3180","","Дисциплина","Страница дисциплины","DisciplineActivitiesBlockTests","CheckActivityVolumeIsDisplayed","Страница дисциплины: отображается объём ОА",""
"passed","Wed Aug 16 04:40:22 UTC 2023","Wed Aug 16 04:40:32 UTC 2023","9101","","Дисциплина","Шаблон дисциплины","DisTemplateTests","CheckCreateDisTemplateWithFillingAllFields","Создание шаблона дисциплины: можно создать шаблон, если заполнены все поля",""
"passed","Wed Aug 16 04:37:24 UTC 2023","Wed Aug 16 04:37:39 UTC 2023","14789","","Чат","Мини-чат группового звонка","GroupChatCallTests","CheckOpenImageInGroupCallChat","Миничат звонка - групповой чат: можно раскрывать изображения",""
"passed","Wed Aug 16 04:38:15 UTC 2023","Wed Aug 16 04:38:20 UTC 2023","5444","","Поток","","CohortCreationWarningModalTests","CheckCreateCohortWithMismatchWarningOfDuration","Создание потока: предупреждение о несоответствии длительности потока для программ 144 часов",""
"passed","Wed Aug 16 04:39:49 UTC 2023","Wed Aug 16 04:39:59 UTC 2023","9730","","Дисциплина","Создание дисциплины","DisciplineCreationTests","CreatDisciplineFromDisciplineTemplate","Создание дисциплины ДО: можно создать дисциплину из шаблона дисциплины без активностей",""
"passed","Wed Aug 16 04:36:25 UTC 2023","Wed Aug 16 04:36:48 UTC 2023","22956","","Чат","Мини-чат личного звонка","PersonalChatCallTests","CheckAddQuoteToLastMessageInPersonalCallChat","Миничат звонка - личный чат: можно цитировать сообщению",""
"passed","Wed Aug 16 04:36:45 UTC 2023","Wed Aug 16 04:36:58 UTC 2023","12807","","Чат","Чат решения","TaskChatTests","CheckAddReactionToLastMessageInTaskChat","Список чатов - обсуждение решения: можно добавить реакцию на сообщение",""
"passed","Wed Aug 16 04:41:44 UTC 2023","Wed Aug 16 04:41:50 UTC 2023","5927","","Библиотека","","LibraryActionPanelTests","CheckChangeViewOfLibraryInTileView","Библиотека: можно переключать текущий вид библиотеки со “Списка” на “Плитку”",""
"passed","Wed Aug 16 04:34:14 UTC 2023","Wed Aug 16 04:34:29 UTC 2023","14549","","Активность","Обычный шаблон активности","TemplateAddingTests","CheckAddScormPackageActivityTemplate","Редактирование шаблона активности: можно добавить материал типа SCORM из библиотеки",""
"passed","Wed Aug 16 04:40:04 UTC 2023","Wed Aug 16 04:40:22 UTC 2023","17868","","Дисциплина","Страница дисциплины","DisciplineMarksAndAttendanceTests","ChecEditTotalFormula","Страница оценок дисциплины: редактирования формулы промежуточного результата",""
"passed","Wed Aug 16 04:34:21 UTC 2023","Wed Aug 16 04:34:29 UTC 2023","7785","","Активность","Контрольная активность","TestActivityStatusWithOneAttemptTests","NoStatusWithOneIncompleteAttempt","Страница индивидуальной контрольной: отсутствует статус и иконка для одной незавершенной попыткой",""
"passed","Wed Aug 16 04:37:55 UTC 2023","Wed Aug 16 04:38:08 UTC 2023","12897","","Чат","Мини-чат страницы решений","TaskPageMiniChatTests","CheckSendEmojiInTaskInTaskPageMiniChat","Чат обсуждение решения: можно отправить смайлики",""
"passed","Wed Aug 16 04:39:14 UTC 2023","Wed Aug 16 04:39:23 UTC 2023","8997","","Дисциплина","Настройка чата дисциплины","DisciplineChatBlockTests","CheckBlockAndUnblockChatDiscipline","Редактирование дисциплины: блокировка чата дисциплины",""
"passed","Wed Aug 16 04:38:29 UTC 2023","Wed Aug 16 04:38:33 UTC 2023","4391","","Поток","","CohortInfoTests","CheckTransitionToEducationCompletionPage","Переход со страницы потока на страницу завершения обучения потока",""
"passed","Wed Aug 16 04:40:45 UTC 2023","Wed Aug 16 04:41:12 UTC 2023","26476","","Библиотека","","LibraryInListViewTests","CheckMoveMaterialToCatalogInListView","Библиотека, списочный вид: можно переместить материал в другой каталог",""
"passed","Wed Aug 16 04:33:08 UTC 2023","Wed Aug 16 04:33:14 UTC 2023","5955","","Активность","Задание","TaskWithoutSolutionStudentTests","CheckSendTextSolution","Страница решение задания: можно отправить текстовый ответ",""
"passed","Wed Aug 16 04:33:44 UTC 2023","Wed Aug 16 04:33:57 UTC 2023","12936","","Активность","Обычная активность","ActivityEditingTests+ActivityAddingTests","CheckAddScormPackageActivity","Редактирование активности: можно добавить материал типа SCORM из библиотеки",""
"passed","Wed Aug 16 04:40:34 UTC 2023","Wed Aug 16 04:40:42 UTC 2023","7362","","Дисциплина","Шаблон дисциплины","DisTemplateTests","CheckAddModuleInDisTemplate","Страница шаблона дисциплины: можно добавить модуль",""
"passed","Wed Aug 16 04:35:25 UTC 2023","Wed Aug 16 04:35:39 UTC 2023","14687","","Чат","Чат для заметок","NotesChatTests","CheckEditLastMessageInNotesChat","Список чатов - чат для заметок: можно редактировать сообщение в течение 4 часов после отправки",""
"passed","Wed Aug 16 04:41:48 UTC 2023","Wed Aug 16 04:42:00 UTC 2023","12614","","Дисциплина","Дисциплина с ИОТ","IOTThemesAndModulesTests","CheckCreatingBlockWithOtherData","Страница дисциплины с ИОТ: при создании модуля или темы можно пометить их обязательными",""
"failed","Wed Aug 16 04:43:22 UTC 2023","Wed Aug 16 04:43:59 UTC 2023","37557","","Профиль","","AddressAndContactsEditingTests","CheckCountryField","Редактирование профиля пользователя: можно изменить страну",""
"passed","Wed Aug 16 04:33:05 UTC 2023","Wed Aug 16 04:33:13 UTC 2023","7871","","Активность","Обычная активность","ActivityEditingTests","CheckEditTypeActivity","Редактирование активности: можно переключать значения в поле 'Тип активности'",""
"passed","Wed Aug 16 04:39:54 UTC 2023","Wed Aug 16 04:40:05 UTC 2023","10986","","Дисциплина","Страница дисциплины","DisciplineRightMenuTests","CreateTemplateFromDiscipline","Страница дисциплины: создание шаблона из дисциплины",""
"passed","Wed Aug 16 04:37:45 UTC 2023","Wed Aug 16 04:37:52 UTC 2023","7772","","Чат","Дисциплина","DisciplineChatTests","CheckDeleteMessageInDisciplineChat","Список чатов - комната дисциплины: можно удалить сообщение",""
"passed","Wed Aug 16 04:44:15 UTC 2023","Wed Aug 16 04:44:24 UTC 2023","8827","","Профиль","","UserInfoPageTests","CheckSetPassword","Страница профиля пользователя: можно изменить пароль",""
"passed","Wed Aug 16 04:41:04 UTC 2023","Wed Aug 16 04:41:19 UTC 2023","15278","","Библиотека","","LibraryInTileViewTests","CheckRenameMaterialInTileView","Библиотека, плиточный вид: можно переименовать материал",""
"passed","Wed Aug 16 04:43:36 UTC 2023","Wed Aug 16 04:43:44 UTC 2023","8234","","Биржа","","StockMarketLotTests","CheckEditMaterialDescription","Страница лота: можно редактировать описание лота преподавателем, разместившим его на бирже",""
"passed","Wed Aug 16 04:39:13 UTC 2023","Wed Aug 16 04:39:18 UTC 2023","5551","","Дисциплина","Редактирование дисциплины","DisciplineEditingTests","CheckSetNameField","Редактирование дисциплины: можно изменить название",""
"passed","Wed Aug 16 04:36:21 UTC 2023","Wed Aug 16 04:36:28 UTC 2023","6670","","Чат","Мини-чат для заметок","NotesMiniChatTests","CheckSendMessageByTappingEnterInNotesMiniChat","Миничат - чат для заметок: можно отправить сообщения по нажатию на Enter",""
"passed","Wed Aug 16 04:38:58 UTC 2023","Wed Aug 16 04:39:14 UTC 2023","16783","","Чат","Мини-чат личного звонка","PersonalChatCallTests","CheckDeleteMessageInPersonalCallChat","Миничат звонка - личный чат: можно удалить сообщение",""
"passed","Wed Aug 16 04:41:50 UTC 2023","Wed Aug 16 04:42:14 UTC 2023","23391","","Библиотека","","LibraryInTileViewTests","CheckCopyMaterialToCatalogInTileView","Библиотека, плиточный вид: можно скопировать материал в другой каталог",""
"passed","Wed Aug 16 04:40:37 UTC 2023","Wed Aug 16 04:40:39 UTC 2023","2342","","Подразделения","","DivisionCommonTests","CheckCancelCreateDivision","Cоздание подразделения проверка кнопки 'Отмена'",""
"passed","Wed Aug 16 04:37:39 UTC 2023","Wed Aug 16 04:37:46 UTC 2023","6050","","Поток","","CohortCreationValidationTests","CheckCreateCohortIfStartAndEndDateAreSame","Создание потока: ошибка валидации, если дата начала и окончания совпадают",""
"passed","Wed Aug 16 04:40:51 UTC 2023","Wed Aug 16 04:40:56 UTC 2023","4976","","Дисциплина","Страница дисциплины","DisciplineAnalyticsTests","CheckStubIsDisplayedIfNoStudentsInDiscipline","Страница аналитика дисциплины: отображается заглушка, если в дисциплине нет студентов или активностей",""
"passed","Wed Aug 16 04:36:57 UTC 2023","Wed Aug 16 04:37:07 UTC 2023","10114","","Чат","Мини-чат для заметок","NotesMiniChatTests","CheckDeleteMessageInNotesMiniChat","Миничат - чат для заметок: можно удалить сообщение",""
"passed","Wed Aug 16 04:38:44 UTC 2023","Wed Aug 16 04:38:53 UTC 2023","8849","","Поток","","CohortEditingValidationTests","CheckEditCohortIfStartAndEndDateAreSame","Редактирование потока: ошибка валидации, если дата начала и окончания совпадают",""
"passed","Wed Aug 16 04:39:23 UTC 2023","Wed Aug 16 04:39:26 UTC 2023","3358","","Дисциплина","Редактирование дисциплины","DisciplineAccessTests","CheckIfOtherAdminUniverChangeDiscipline","Редактирование дисциплины: нет возможности редактировать у администратора университета, к которому дисциплина НЕ относится",""
"passed","Wed Aug 16 04:42:58 UTC 2023","Wed Aug 16 04:43:03 UTC 2023","5234","","Программа","","ProgramInfoPageTests","CheckNoAccessStudentToActivityEducationalProgramArchive","Страница обр программы: Студенты не имеют доступ к активностям архивной обр программы",""
"passed","Wed Aug 16 04:37:46 UTC 2023","Wed Aug 16 04:37:59 UTC 2023","13172","","Чат","Мини-чат личного звонка","PersonalChatCallTests","CheckOpenImageInPersonalCallChat","Миничат звонка - личный чат: можно раскрывать изображения",""
"passed","Wed Aug 16 04:44:07 UTC 2023","Wed Aug 16 04:44:11 UTC 2023","4123","","Профиль","","UserInfoPageTests","CheckStudentCanOpenPageOfPassedActivities","Страница профиля пользователя: можно перейти на страницу пройденных активностей под студентом",""
"passed","Wed Aug 16 04:38:46 UTC 2023","Wed Aug 16 04:38:47 UTC 2023","1829","","Поток","Завершение обучения","EducationCompletionPageTests","CheckTransitionToCohortInfoPage","Переход со страницы завершения обучения на страницу потока",""
"passed","Wed Aug 16 04:42:18 UTC 2023","Wed Aug 16 04:42:28 UTC 2023","9558","","Материал","Конструктор тест-тренажера","TestTrainCreationTests","TestCreation","Конструктор теста-тренажера: создание теста-тренажера",""
"failed","Wed Aug 16 04:34:48 UTC 2023","Wed Aug 16 04:35:25 UTC 2023","36406","","Активность","Контрольная активность","TestCommandActivityTests","DeleteCommandToControlTypeActivityInCommandMode","Страница активности контрольная: удаление команды",""
"passed","Wed Aug 16 04:39:03 UTC 2023","Wed Aug 16 04:39:06 UTC 2023","3555","","Дисциплина","Настройка чата дисциплины","DisciplineChatBlockTests","CheckChatMissingFromList","Страница чата: отсутствия блокированного чата в списке чатов",""
"passed","Wed Aug 16 04:41:37 UTC 2023","Wed Aug 16 04:41:49 UTC 2023","11621","","Материал","Конструктор теста","TestBlocksAndVariantsValidationTests","DeleteTestVariant","Конструктор теста: можно удалить вариант",""
"passed","Wed Aug 16 04:42:22 UTC 2023","Wed Aug 16 04:42:35 UTC 2023","13316","","Материал","Конструктор теста","TestBlocksAndVariantsValidationTests","AddTestBlock","Конструктор теста: можно добавить блок",""
"passed","Wed Aug 16 04:35:41 UTC 2023","Wed Aug 16 04:35:48 UTC 2023","7383","","Чат","Личный чат","PersonalChatTests","CheckSendEmptyMessageInPersonalChat","Список чатов - личный чат: невозможно отправить пустое сообщение",""
"passed","Wed Aug 16 04:39:23 UTC 2023","Wed Aug 16 04:39:26 UTC 2023","2486","","Поток","","CohortEditingValidationTests","CheckIsNotPossibleRemoveCohortIfItHaveSemestersOrDisciplines","Редактирование потока: нет возможности удалить поток, если есть хотя бы одна дисциплина или семестр",""
"passed","Wed Aug 16 04:36:26 UTC 2023","Wed Aug 16 04:36:43 UTC 2023","16879","","Чат","Чат для заметок","NotesChatTests","CheckPinLastMessageInNotesChat","Список чатов - чат для заметок: можно закреплять сообщения",""
"passed","Wed Aug 16 04:38:52 UTC 2023","Wed Aug 16 04:38:57 UTC 2023","4390","","Дисциплина","Редактирование дисциплины","DisciplineAccessTests","CheckIfTeacherChangeDiscipline","Редактирование дисциплины: есть возможность редактировать у преподавателя этой дисциплины",""
"passed","Wed Aug 16 04:40:15 UTC 2023","Wed Aug 16 04:40:26 UTC 2023","10400","","Дисциплина","Редактирование дисциплины","DisContingentEditingTests","CheckAddTeacherByUserInfoInEditing","Редактирование дисциплины: добавление преподавателя из списка",""
"passed","Wed Aug 16 04:35:38 UTC 2023","Wed Aug 16 04:35:45 UTC 2023","7549","","Чат","Чат решения","TaskChatTests","CheckSendTextMessageInTaskChat","Список чатов - обсуждение решения: можно отправить текстовое сообщение",""
"passed","Wed Aug 16 04:33:09 UTC 2023","Wed Aug 16 04:33:15 UTC 2023","6028","","Активность","Задание","TaskActivityMulticriteriaTests","CheckMultiCriteriaCheckboxInTask","Создание задания: чекбокс многокритериальная проверка не отображается, если выбрана взаимопроверка",""
"passed","Wed Aug 16 04:38:53 UTC 2023","Wed Aug 16 04:39:06 UTC 2023","12368","","Дисциплина","Страница дисциплины","DisciplineActivitiesBlockTests","CheckAddModuleInDiscipline","Страница дисциплины: создание модуля",""
"passed","Wed Aug 16 04:35:48 UTC 2023","Wed Aug 16 04:36:03 UTC 2023","14542","","Чат","Личный чат","PersonalChatTests","CheckEditLastMessageInPersonalChat","Список чатов - личный чат: можно редактировать сообщение в течение 4 часов после отправки",""
"passed","Wed Aug 16 04:37:25 UTC 2023","Wed Aug 16 04:37:26 UTC 2023","1750","","Поток","","CohortCreationTests","CheckCancelCohortCreationByDirectLink","Создание потока ВО: работает кнопка 'Отмена'",""
"passed","Wed Aug 16 04:35:50 UTC 2023","Wed Aug 16 04:36:03 UTC 2023","12914","","Чат","Мини-чат для заметок","NotesMiniChatTests","CheckAddQuoteToLastMessageInNotesMiniChat","Миничат - чат для заметок: можно цитировать сообщению",""
"passed","Wed Aug 16 04:34:40 UTC 2023","Wed Aug 16 04:34:45 UTC 2023","4696","","Активность","Контрольная активность","TestActivityEditingTests","ErrorWithNegativeValueInTimeLimit","Редактирование контрольной: ошибка валидации при отрицательным значением в 'Временной лимит'",""
"passed","Wed Aug 16 04:39:50 UTC 2023","Wed Aug 16 04:39:56 UTC 2023","5773","","Дисциплина","Создание дисциплины","DisContingentCreationValidationTests","CheckUnableAddGroupFromAnotherCohortInCreation","Создание дисциплины: невозможно добавить группу из стороннего потока",""
"passed","Wed Aug 16 04:36:55 UTC 2023","Wed Aug 16 04:37:15 UTC 2023","20714","","Чат","Мини-чат звонка дисциплины","DisciplineChatCallTests","CheckSendFileMessageInDisciplineCallChat","Миничат звонка - комната дисциплины: можно прикрепить и отправить файл с компьютера",""
"passed","Wed Aug 16 04:34:39 UTC 2023","Wed Aug 16 04:34:54 UTC 2023","14598","","Активность","Контрольная активность","TestActivityStatusWithTwoOrMoreAttemptsTests","ResultOfPassingDependOnSettings","Страница индивидуальной контрольной: результат тестирования из попытках зависеть от настройки 'За лучшую попытку'",""
"passed","Wed Aug 16 04:37:21 UTC 2023","Wed Aug 16 04:37:48 UTC 2023","27059","","Чат","Мини-чат решения","TaskMiniChatTests","CheckAddQuoteToLastMessageInTaskMiniChat","Миничат - обсуждение решения: можно цитировать сообщению",""
"passed","Wed Aug 16 04:40:22 UTC 2023","Wed Aug 16 04:40:30 UTC 2023","8412","","Дисциплина","Страница дисциплины","DisciplineMarksAndAttendanceTests","CheckAttendanceByTeacher","Страница посещаемости дисциплины: отметки/снятия посещаемости преподавателем",""
"passed","Wed Aug 16 04:37:39 UTC 2023","Wed Aug 16 04:37:58 UTC 2023","18614","","Чат","Мини-чат группового звонка","GroupChatCallTests","CheckSendMessageByTappingEnterInGroupCallChat","Миничат звонка - групповой чат: можно отправить сообщения по нажатию на Enter",""
"passed","Wed Aug 16 04:35:45 UTC 2023","Wed Aug 16 04:35:52 UTC 2023","7007","","Чат","Чат решения","TaskChatTests","CheckSendEmptyMessageInTaskChat","Список чатов - обсуждение решения: невозможно отправить пустое сообщение",""
"passed","Wed Aug 16 04:39:14 UTC 2023","Wed Aug 16 04:39:22 UTC 2023","7260","","Дисциплина","Создание дисциплины","DisciplineCreationValidationTests","CheckIfNameNotFilledInCreation","Создание дисциплины ДО: отображение ошибки валидации для поля 'Название', если поле не заполнено",""
"failed","Wed Aug 16 04:34:56 UTC 2023","Wed Aug 16 04:34:56 UTC 2023","330","","Активность","Контрольная активность","TestActivityStatusWithOneAttemptTests","StatusChangesIfMinThresholdChanges","Страница командной контрольной: статус меняется, если преподаватель меняет минимальный порог баллов",""
"passed","Wed Aug 16 04:42:20 UTC 2023","Wed Aug 16 04:42:27 UTC 2023","7409","","Материал","Конструктор теста","TestSettingsValidationTests","EditTestStudyTime","Конструктор теста: можно изменить время изучения",""
"passed","Wed Aug 16 04:39:22 UTC 2023","Wed Aug 16 04:39:25 UTC 2023","2708","","Дисциплина","Редактирование дисциплины","DisciplineEditingValidationTests","CheckIfShortnameNotFilledInEditing","Редактирование дисциплины: отображение ошибки валидации для поля 'Краткое название', если поле не заполнено",""
"passed","Wed Aug 16 04:40:36 UTC 2023","Wed Aug 16 04:40:44 UTC 2023","7944","","Дисциплина","Редактирование дисциплины","DisContingentEditingValidationTests","CheckAddStudentsInTeachersField","Редактирование дисциплины: наличия ошибки при попытке указать преподавателем студента из поля 'Студенты'",""
"passed","Wed Aug 16 04:38:20 UTC 2023","Wed Aug 16 04:38:26 UTC 2023","5869","","Поток","","CohortCreationWarningModalTests","CheckCreateCohortWithMismatchWarningOfDuration","Создание потока: предупреждение о несоответствии длительности потока для программ 256 часов",""
"passed","Wed Aug 16 04:39:53 UTC 2023","Wed Aug 16 04:39:57 UTC 2023","3314","","Дисциплина","Редактирование дисциплины","DisciplineEditingValidationTests","CheckIfCreditNotFilled","Редактирование дисциплины: отображение ошибки валидации для поля 'Кредиты' с значением > 15",""
"passed","Wed Aug 16 04:42:43 UTC 2023","Wed Aug 16 04:42:50 UTC 2023","7701","","Материал","Конструктор тест-тренажера","TestTrainQuestionsValidationTests","RemoveCommentInTestTrainQuestion","Конструктор теста-тренажера: можно удалить комментарий к вопросу",""
"passed","Wed Aug 16 04:33:23 UTC 2023","Wed Aug 16 04:33:33 UTC 2023","9987","","Активность","Обычная активность","ActivityCreatingTests","CreateActivityInTopic","Cоздание активности: можно создать активность в дисциплине в теме",""
"passed","Wed Aug 16 04:37:58 UTC 2023","Wed Aug 16 04:38:17 UTC 2023","19490","","Чат","Мини-чат группового звонка","GroupChatCallTests","CheckAddReactionToLastMessageInGroupCallChat","Миничат звонка - групповой чат: можно добавить реакцию на сообщение",""
