"Status","Start Time","Stop Time","Duration in ms","Parent Suite","Suite","Sub Suite","Test Class","Test Method","Name","Description"
"passed","Tue Feb 06 01:33:51 UTC 2024","Tue Feb 06 01:33:54 UTC 2024","3624","","Дисциплина","Редактирование дисциплины","DisciplineAccessTests","CheckOtherOrgAdminChangeDiscipline","У администратора организации, к которой дисциплина НЕ относится, нет возможности редактирования",""
"passed","Tue Feb 06 01:38:43 UTC 2024","Tue Feb 06 01:38:55 UTC 2024","12696","","Программа","","ProgramCreationTests","CreateHighProgramFillAllFields","Если заполнить все поля программы ВО",""
"passed","Tue Feb 06 01:26:31 UTC 2024","Tue Feb 06 01:26:42 UTC 2024","11201","Активность","Контрольная","Создание контрольной","TestActivityCreatingTests","CheckCreateActivityBySpecifyingControlMode","Можно создать контрольную с режимом выполнения Индивидуальный",""
"passed","Tue Feb 06 01:35:06 UTC 2024","Tue Feb 06 01:35:20 UTC 2024","13579","","Дисциплина","Создание дисциплины","DisContingentCreationTests","CheckAddTeacherByUserInfoInCreation","Добавление преподавателя из списка",""
"passed","Tue Feb 06 01:33:42 UTC 2024","Tue Feb 06 01:33:49 UTC 2024","7043","","Поток","Создание потока","CohortCreationTests","CheckCreateCohortByFillingMaxNumberOfStudents","Создание потока: можно создать поток, заполнив поле ‘Максимальное количество студентов’",""
"passed","Tue Feb 06 01:42:23 UTC 2024","Tue Feb 06 01:42:33 UTC 2024","10170","Активность","Контрольная","Прохождение теста","TestActivityStatusWithTwoOrMoreAttemptsTests","CheckStatusExistIfAtLeastOneCompletedAttempt","Статус отображается, если есть хотя бы одна завершенная попытка в индивидуальной контрольной",""
"passed","Tue Feb 06 01:35:01 UTC 2024","Tue Feb 06 01:35:09 UTC 2024","7844","","Дисциплина","Создание дисциплины","DisciplineCreationValidationTests","CheckIfCreditValuesNotAllowed","Отображение ошибки валидации для поля 'Кредиты' с отрицательным значением в ВО",""
"passed","Tue Feb 06 01:25:38 UTC 2024","Tue Feb 06 01:25:48 UTC 2024","10049","Активность","Задание","Создание задания","TaskActivityMulticriteriaTests","CheckCreateTaskWithoutPointOfCriteria","Нельзя создать активность типа Задание с критериями, если не заполнен балл критерия",""
"passed","Tue Feb 06 01:32:38 UTC 2024","Tue Feb 06 01:32:48 UTC 2024","10201","","Поток","Создание потока","CohortCreationWarningModalTests","CheckCreateCohortAfterChangeMismatchWarningOfDuration","Создание потока: можно создать поток после внесения правок в длительность потока",""
"passed","Tue Feb 06 01:38:23 UTC 2024","Tue Feb 06 01:38:25 UTC 2024","1701","","Программа","","ProgramCreationTests","CheckCancelCreatingProgram","Проверка кнопки Отмена у программы ВО",""
"passed","Tue Feb 06 01:37:19 UTC 2024","Tue Feb 06 01:37:24 UTC 2024","5479","","Материал","Конструктор теста","TestQuestionAnswersValidationTests","CheckRemoveCommentInTestAnswer","Конструктор теста: можно удалить комментарий к варианту ответа",""
"passed","Tue Feb 06 01:36:32 UTC 2024","Tue Feb 06 01:36:38 UTC 2024","6592","","Материал","Конструктор теста","TestBlocksAndVariantsValidationTests","CheckDuplicateTestVariant","Конструктор теста: можно дублировать вариант",""
"passed","Tue Feb 06 01:38:15 UTC 2024","Tue Feb 06 01:38:18 UTC 2024","2842","","Программа","","ProgramEditingTests","CheckRemoveProgramWithoutCohort","Можно удалить программу ВО без потоков",""
"passed","Tue Feb 06 01:25:33 UTC 2024","Tue Feb 06 01:25:41 UTC 2024","8321","Активность","Задание","Страница решения задания для преподавателя","TaskActivityTeacherTests","CheckGradeSolutionValueAboveAndBelowScore","Можно оценить решение значением выше минимального порога баллов",""
"passed","Tue Feb 06 01:28:46 UTC 2024","Tue Feb 06 01:28:54 UTC 2024","7191","","Чат","Дисциплина","DisciplineChatTests","CheckSendFileMessageInDisciplineChat","Можно прикрепить и отправить файл с компьютера",""
"passed","Tue Feb 06 01:37:15 UTC 2024","Tue Feb 06 01:37:22 UTC 2024","6565","","Материал","Конструктор тест-тренажера","TestTrainBlocksAndVariantsValidationTests","EditTestTrainBlockName","Конструктор теста-тренажера: можно переименовать блок",""
"passed","Tue Feb 06 01:36:32 UTC 2024","Tue Feb 06 01:36:44 UTC 2024","11882","","Дисциплина","Дисциплина с ИОТ","IOTThemesAndModulesTests","CheckCreatingBlockWithOtherData","Страница дисциплины с ИОТ: при создании модуля или темы можно задать часы",""
"passed","Tue Feb 06 01:36:18 UTC 2024","Tue Feb 06 01:36:23 UTC 2024","4925","","Дисциплина","Редактирование дисциплины","DisContingentEditingTests","CheckCreateDisciplineByUncheckingBoxAllCohortStudents","Есть возможность сохранить дисциплину, сняв галку Все студенты потока",""
"passed","Tue Feb 06 01:27:56 UTC 2024","Tue Feb 06 01:28:14 UTC 2024","17718","","Чат","Мини-чат дисциплины","DisciplineRoomMiniChatTests+AccessToClosedRoom","CheckAccessToClosedRoomInMinichat","отсутствие доступа в закрытую комнату пользователю, не состоящему в ней",""
"passed","Tue Feb 06 01:25:53 UTC 2024","Tue Feb 06 01:26:06 UTC 2024","12780","","Активность","Обычная активность","ActivityAddingTests","CheckAddScormPackageActivity","Можно добавить материал типа SCORM из Библиотеки",""
"passed","Tue Feb 06 01:32:41 UTC 2024","Tue Feb 06 01:33:11 UTC 2024","29976","","Поток","Создание потока","CohortCreationTests","CheckCreateCohortFromTemplateWhenAllRequiredFieldsAreFilled","Создание потока ВО: можно создать поток из шаблона, если все обязательные поля корректно заполнены",""
"passed","Tue Feb 06 01:31:44 UTC 2024","Tue Feb 06 01:32:01 UTC 2024","17292","","Чат","Мини-чат личного чата","PersonalMiniChatTests","CheckEditLastMessageInPersonalMiniChat","можно редактировать сообщение в течение 4 часов после отправки",""
"passed","Tue Feb 06 01:33:02 UTC 2024","Tue Feb 06 01:33:16 UTC 2024","13558","","Чат","Мини-чат личного звонка","PersonalChatCallTests","CheckOpenImageInPersonalCallChat","можно раскрывать изображения",""
"passed","Tue Feb 06 01:35:08 UTC 2024","Tue Feb 06 01:35:11 UTC 2024","2925","","Дисциплина","Страница дисциплины","DisciplineStudentTests","CheckGradesDropdownForStudent","Отсутствие кнопки 'Итоговые оценки (ведомость)' у студента",""
"passed","Tue Feb 06 01:30:19 UTC 2024","Tue Feb 06 01:30:28 UTC 2024","8545","","Чат","Групповой чат","GroupChatTests","CheckSendEmojiInGroupChat","можно отправить смайлики",""
"passed","Tue Feb 06 01:27:12 UTC 2024","Tue Feb 06 01:27:22 UTC 2024","9651","Активность","Контрольная","Прохождение теста","TestActivityPassingTests","CheckContinueAnIncompleteAttempt","Можно продолжить выполнение незавершенной попытки",""
"passed","Tue Feb 06 01:36:17 UTC 2024","Tue Feb 06 01:36:31 UTC 2024","14374","","Библиотека","","LibraryInTileViewTests","CheckMoveMaterialToCatalogInTileView","Библиотека, плиточный вид: можно переместить материал в другой каталог",""
"passed","Tue Feb 06 01:28:30 UTC 2024","Tue Feb 06 01:28:38 UTC 2024","8312","","Чат","Дисциплина","DisciplineChatTests","CheckSendEmojiInDisciplineChat","Можно отправить смайлик",""
"passed","Tue Feb 06 01:25:04 UTC 2024","Tue Feb 06 01:25:13 UTC 2024","8442","","Активность","Обычная активность","ActivityEditingFormatTests","CheckActivityFormatIsOffline","Проверка формата активности ‘Офлайн’",""
"passed","Tue Feb 06 01:25:41 UTC 2024","Tue Feb 06 01:25:50 UTC 2024","8458","Активность","Задание","Страница решения задания для преподавателя","TaskActivityTeacherTests","CheckGradeSolutionValueAboveAndBelowScore","Можно оценить решение значением ниже минимального порога баллов",""
"passed","Tue Feb 06 01:32:33 UTC 2024","Tue Feb 06 01:32:38 UTC 2024","4375","","Поток","Редактирование потока","CohortEditingTests","CheckCancelCohortEditing","Редактирование потока ВО: работает кнопка 'Отмена', если страница редактирование был открыть со страницы потока",""
"passed","Tue Feb 06 01:29:54 UTC 2024","Tue Feb 06 01:29:56 UTC 2024","1987","","Чат","Дисциплина","DisciplineRoomChatTests","CheckMembersOfDisciplineRoomChatIsDisplayed","отображаются участники чата при клике на блок с аватарками",""
"passed","Tue Feb 06 01:30:42 UTC 2024","Tue Feb 06 01:30:49 UTC 2024","6775","","Чат","Групповой чат","GroupChatTests","CheckSendMessageByTappingEnterInGroupChat","можно отправить сообщения по нажатию на Enter",""
"passed","Tue Feb 06 01:26:45 UTC 2024","Tue Feb 06 01:26:58 UTC 2024","13170","Активность","Контрольная","Редактирование контрольной","TestActivityAddingTests","CheckAddTextMaterialToControlTypeActivity","Можно добавить материал типа Текст из Библиотеки в контрольную",""
"passed","Tue Feb 06 01:30:35 UTC 2024","Tue Feb 06 01:30:37 UTC 2024","2162","","Чат","Групповой чат","GroupChatTests","CheckOpenImageInGroupChat","можно раскрывать изображения",""
"passed","Tue Feb 06 01:28:09 UTC 2024","Tue Feb 06 01:28:24 UTC 2024","14616","","Чат","Дисциплина","DisciplineRoomChatTests","CheckEditLastMessageInDisciplineRoomChat","можно редактировать сообщение в течение 4 часов после отправки",""
"passed","Tue Feb 06 01:30:56 UTC 2024","Tue Feb 06 01:31:08 UTC 2024","12623","","Чат","Чат для заметок","NotesChatTests","CheckFindSentMessageInNotesChat","Можно найти отправленное сообщение в чате для заметок",""
"passed","Tue Feb 06 01:28:01 UTC 2024","Tue Feb 06 01:28:09 UTC 2024","7972","","Чат","Дисциплина","DisciplineRoomChatTests","CheckSendEmptyMessageInDisciplineRoomChat","невозможно отправить пустое сообщение",""
"passed","Tue Feb 06 01:37:42 UTC 2024","Tue Feb 06 01:37:48 UTC 2024","5478","","Материал","Конструктор теста","TestQuestionAnswersValidationTests","CheckRemoveAnswerFromSortingQuestion","Конструктор теста: можно удалить опцию из вопроса с типом ответа 'Сортировка'",""
"passed","Tue Feb 06 01:36:01 UTC 2024","Tue Feb 06 01:36:12 UTC 2024","11113","","Дисциплина","Редактирование дисциплины","DisContingentEditingTests","CheckRemoveGroupAndStudentFromDiscipline","Открепление от дисциплины групп и студентов",""
"passed","Tue Feb 06 01:31:37 UTC 2024","Tue Feb 06 01:31:44 UTC 2024","6448","","Чат","Мини-чат для заметок","NotesMiniChatTests","CheckSendMessageByTappingEnterInNotesMiniChat","можно отправить сообщения по нажатию на Enter",""
"passed","Tue Feb 06 01:31:45 UTC 2024","Tue Feb 06 01:31:52 UTC 2024","7655","","Чат","Дисциплина","DisciplineRoomChatTests","CheckRestoreDisciplineChatRoomFromArchive","можно восстановить чат из архива",""
"passed","Tue Feb 06 01:29:48 UTC 2024","Tue Feb 06 01:29:52 UTC 2024","4163","","Чат","Мини-чат дисциплины","DisciplineRoomMiniChatTests","CheckOpenImageInDisciplineRoomMiniChat","можно раскрывать изображения",""
"passed","Tue Feb 06 01:35:32 UTC 2024","Tue Feb 06 01:35:35 UTC 2024","3299","","Дисциплина","Редактирование дисциплины","DisContingentEditingValidationTests","CheckIsDisabledCheckboxAllStudentInEditingDiscipline","Галка Все студенты потока задизейблена и невозможно ее снять, если дисциплина относится к Нацпроекту",""
"passed","Tue Feb 06 01:33:46 UTC 2024","Tue Feb 06 01:33:49 UTC 2024","2946","","Поток","Редактирование потока","CohortEditingValidationTests","CheckIsNotPossibleRemoveCohortWithStudents","Редактирование потока ДО (СЗ): отсутствует кнопка ‘Удалить поток’, если в потоке есть слушатели",""
"passed","Tue Feb 06 01:34:45 UTC 2024","Tue Feb 06 01:34:51 UTC 2024","5935","","Дисциплина","Страница дисциплины","DisciplineAnalyticsTests","CheckActivityAndVolumeTooltipIsDisplayed","В аналитики у заголовков  ‘Активности’ и ‘Объем’ есть тултип",""
"passed","Tue Feb 06 01:37:14 UTC 2024","Tue Feb 06 01:37:37 UTC 2024","23220","","Материал","Конструктор теста","TestAddingQuestionsTests","CheckAddQuestionWithFreeAnswerRange","Конструктор теста: можно добавить вопрос с типом ответа “Свободный ответ” - “Диапазон”",""
"passed","Tue Feb 06 01:30:49 UTC 2024","Tue Feb 06 01:30:56 UTC 2024","7707","","Чат","Групповой чат","GroupChatTests","CheckAddReactionToLastMessageInGroupChat","можно добавить реакцию на сообщение",""
"passed","Tue Feb 06 01:27:37 UTC 2024","Tue Feb 06 01:27:41 UTC 2024","4510","Активность","Шаблон активности контрольной","Редактирование шаблона контрольной","TestTemplateEditingTests","CheckChangeSelectionOfDisplayingDetailedResultCheckbox","Можно отметить/снять галку с чекбокса Отображать студентам подробную информацию о результатах",""
"passed","Tue Feb 06 01:32:01 UTC 2024","Tue Feb 06 01:32:08 UTC 2024","7269","","Чат","Чат для заметок","NotesChatTests","CheckDeleteMessageInNotesChat","можно удалить сообщение",""
"passed","Tue Feb 06 01:34:02 UTC 2024","Tue Feb 06 01:34:09 UTC 2024","7359","","Дисциплина","Страница дисциплины","DisciplineAnalyticsTests","CheckExpandFiltersOfAnalyticsTable","Можно раскрывать фильтры таблицы аналитики",""
"passed","Tue Feb 06 01:27:17 UTC 2024","Tue Feb 06 01:27:32 UTC 2024","14351","","Звонок","","CallTests","CheckTurnOnOffEquipmentInCall","Страница звонка: можно включить/отключить камеру в звонке",""
"passed","Tue Feb 06 01:34:54 UTC 2024","Tue Feb 06 01:35:01 UTC 2024","7576","","Дисциплина","Создание дисциплины","DisciplineCreationValidationTests","CheckIfCreditValuesNotAllowed","Отображение ошибки валидации для поля 'Кредиты' с отрицательным значением в ДО",""
"passed","Tue Feb 06 01:33:08 UTC 2024","Tue Feb 06 01:33:19 UTC 2024","10801","","Чат","Мини-чат личного чата","PersonalMiniChatTests","CheckAddReactionToLastMessageInPersonalMiniChat","можно добавить реакцию на сообщение",""
"passed","Tue Feb 06 01:29:10 UTC 2024","Tue Feb 06 01:29:39 UTC 2024","28787","","Чат","Мини-чат дисциплины","DisciplineRoomMiniChatTests+ChatEditing","CheckChangeDisciplineChatRoomNameInMinichat","Можно изменить название комнаты из миничата",""
"passed","Tue Feb 06 01:33:11 UTC 2024","Tue Feb 06 01:33:35 UTC 2024","24287","","Поток","Создание потока","CohortCreationTests","CheckCreateCohortFromTemplateWhenAllRequiredFieldsAreFilled","Создание потока ДО: можно создать поток из шаблона, если все обязательные поля корректно заполнены",""
"passed","Tue Feb 06 01:42:39 UTC 2024","Tue Feb 06 01:42:50 UTC 2024","11444","","Чат","Мини-чат группового чата","GroupMiniChatTests+ChatEditing","CheckChangeGroupChatNameInMinichat","можно изменить название чата",""
"passed","Tue Feb 06 01:38:51 UTC 2024","Tue Feb 06 01:38:53 UTC 2024","1827","","Биржа","","StockMarketLotTests","CheckTransitionToOwnMaterialPage","Страница лота: кнопка Страница материала работает для преподавателя, выставившего этот материал на Биржу",""
"passed","Tue Feb 06 01:38:18 UTC 2024","Tue Feb 06 01:38:22 UTC 2024","3623","","Программа","","ProgramCreationTests","CreateHighProgramOverviewFields","Заполнить только обязательные поля у программы ВО",""
"passed","Tue Feb 06 01:35:33 UTC 2024","Tue Feb 06 01:35:38 UTC 2024","5666","","Подразделения","Редактирование подразделения","DivisionEditingTests","CheckEditDivisionResponsiblePersons","Можно отредактировать ответственных лиц подразделения",""
"passed","Tue Feb 06 01:28:05 UTC 2024","Tue Feb 06 01:28:16 UTC 2024","10905","","Чат","Мини-чат дисциплины","DisciplineRoomMiniChatTests","CheckSendEmptyMessageInDisciplineRoomMiniChat","невозможно отправить пустое сообщение",""
"passed","Tue Feb 06 01:37:04 UTC 2024","Tue Feb 06 01:37:20 UTC 2024","16416","","Библиотека","","LibraryInListViewTests","CheckMoveMaterialViaActionsButton","Библиотека, списочный вид: можно переместить материал через actions-кнопки",""
"passed","Tue Feb 06 01:31:19 UTC 2024","Tue Feb 06 01:31:26 UTC 2024","7478","","Чат","Групповой чат","GroupChatTests","CheckChangeGroupChatName","можно изменить название чата",""
"passed","Tue Feb 06 01:26:33 UTC 2024","Tue Feb 06 01:26:43 UTC 2024","10052","Активность","Контрольная","Редактирование контрольной","TestActivityEditingTests","CheckEditScoreValueInControlTypeActivity","Можно переключать значения в поле Оценка в контрольной",""
"passed","Tue Feb 06 01:33:39 UTC 2024","Tue Feb 06 01:33:48 UTC 2024","9048","","Чат","Мини-чат личного чата","PersonalMiniChatTests","CheckDeleteMessageInPersonalMiniChat","Можно удалить сообщение в личном чате из миничата",""
"passed","Tue Feb 06 01:25:25 UTC 2024","Tue Feb 06 01:25:31 UTC 2024","6391","Активность","Задание","Страница решения задания для студента","TaskWithoutSolutionStudentTests","CheckSendTextAndFileSolution","Можно отправить ответ в виде текста и файла",""
"passed","Tue Feb 06 01:30:34 UTC 2024","Tue Feb 06 01:30:48 UTC 2024","13776","","Чат","Мини-чат группового звонка","GroupChatCallTests","CheckOpenImageInGroupCallChat","можно раскрывать изображения",""
"passed","Tue Feb 06 01:35:41 UTC 2024","Tue Feb 06 01:35:48 UTC 2024","6538","","Дисциплина","Редактирование дисциплины","DisContingentEditingTests","CheckRemoveTeacherFromDiscipline","Открепление преподавателя от дисциплины",""
"passed","Tue Feb 06 01:42:37 UTC 2024","Tue Feb 06 01:42:40 UTC 2024","3060","","Дисциплина","Редактирование дисциплины","DisciplineEditingValidationTests","CheckIfCreditNotFilled","Отображение ошибки валидации для поля Кредиты с значением 0 в дисциплине ДО",""
"passed","Tue Feb 06 01:35:23 UTC 2024","Tue Feb 06 01:35:27 UTC 2024","3962","","Подразделения","Редактирование подразделения","DivisionEditingTests","CheckEditDivisionName","Можно редактировать название подразделения",""
"passed","Tue Feb 06 01:42:24 UTC 2024","Tue Feb 06 01:42:31 UTC 2024","7121","","Чат","Дисциплина","DisciplineRoomChatTests","CheckAddDisciplineChatRoom","можно добавить комнату для всех участников дисциплины",""
"passed","Tue Feb 06 01:33:12 UTC 2024","Tue Feb 06 01:33:17 UTC 2024","4582","","Поток","Редактирование потока","CohortEditingTests","CheckEditCohortWithFillingAdministratorField","Редактирование потока ТГУ: успешное сохранение, с корректными значениями в поле ‘Администраторы потока’",""
"passed","Tue Feb 06 01:37:54 UTC 2024","Tue Feb 06 01:38:12 UTC 2024","18150","","Материал","Конструктор тест-тренажера","TestTrainAddingQuestionsTests","CheckAddQuestionInTestTrainCompare","Конструктор теста-тренажера: можно добавить вопрос с типом ответа “Сопоставление”",""
"passed","Tue Feb 06 01:34:23 UTC 2024","Tue Feb 06 01:34:31 UTC 2024","8192","","Дисциплина","Создание дисциплины","DisciplineCreationValidationTests","CheckIfDescriptionNotFilledInCreation","Отображение ошибки валидации для поля 'Описание', если поле не заполнено в ВО",""
"passed","Tue Feb 06 01:35:11 UTC 2024","Tue Feb 06 01:35:29 UTC 2024","17180","","Дисциплина","Дисциплина с ИОТ","IOTThemesAndModulesTests","CheckCannotCreateModuleInsideModule","Страница дисциплины с ИОТ: внутри модуля нельзя создать модуль",""
"passed","Tue Feb 06 01:25:45 UTC 2024","Tue Feb 06 01:25:50 UTC 2024","4906","","Активность","Обычная активность","ActivityDurationTests","CheckEditActivityVolumeWithCorrectValues","Успешное сохранение при корректных значениях в поле Объем в академических часах",""
"passed","Tue Feb 06 01:26:19 UTC 2024","Tue Feb 06 01:26:31 UTC 2024","12105","","Активность","Обычная активность","ActivityAddingTests","CheckRemoveMaterialActivity","Можно удалять материалы",""
"passed","Tue Feb 06 01:32:47 UTC 2024","Tue Feb 06 01:32:49 UTC 2024","2043","","Чат","Чат решения","TaskChatTests","CheckOpenImageInTaskChat","можно раскрывать изображения",""
"passed","Tue Feb 06 01:35:59 UTC 2024","Tue Feb 06 01:36:20 UTC 2024","21498","","Дисциплина","Дисциплина с ИОТ","IOTThemesAndModulesTests","CheckCreateActivityInsideTopic","Страница дисциплины с ИОТ: внутри темы можно создать активность",""
"passed","Tue Feb 06 01:31:34 UTC 2024","Tue Feb 06 01:31:43 UTC 2024","8612","","Чат","Чат для заметок","NotesChatTests","CheckAddReactionToLastMessageInNotesChat","можно добавить реакцию на сообщение",""
"passed","Tue Feb 06 01:36:55 UTC 2024","Tue Feb 06 01:37:02 UTC 2024","6989","","Материал","Конструктор теста","TestQuestionAnswersValidationTests","CheckAddOneMoreOptionInComparisonTestQuestion","Конструктор теста: можно добавить еще один вариант на сопоставление в вопрос с типом ответа 'Сопоставление'",""
