"Status","Start Time","Stop Time","Duration in ms","Parent Suite","Suite","Sub Suite","Test Class","Test Method","Name","Description"
"passed","Thu Mar 13 07:29:01 UTC 2025","Thu Mar 13 07:29:28 UTC 2025","26698","","Материал","Конструктор теста","TestQuestionAnswersValidationTests","CheckAddOneMoreOptionInComparisonTestQuestion","Конструктор теста: можно добавить еще один вариант на сопоставление в вопрос с типом ответа 'Сопоставление'",""
"passed","Thu Mar 13 07:14:15 UTC 2025","Thu Mar 13 07:14:51 UTC 2025","36201","","Чат","Групповой чат","GroupChatMessageActionTests","CheckStartDiscussionUnderLeftSideMessageInGroupChat","Начать обсуждение с другим участником в групповом чате",""
"passed","Thu Mar 13 07:13:16 UTC 2025","Thu Mar 13 07:13:54 UTC 2025","37582","","Чат","Миничат страницы решений","TaskPageMiniChatTests","CheckSendTextMessageInTaskPageMiniChat","Можно отправить текстовое сообщение в миничате страницы решений",""
"passed","Thu Mar 13 07:15:18 UTC 2025","Thu Mar 13 07:15:50 UTC 2025","31573","","Чат","Обсуждение решения","TaskChatTests","CheckSendEmojiInTaskChat","Можно отправить смайлик в обсуждении решения",""
"passed","Thu Mar 13 07:36:40 UTC 2025","Thu Mar 13 07:36:44 UTC 2025","4678","","Профиль","","AddressAndContactsEditingTests","CheckUnlockContactFieldsAfterInterPassword","Редактирование профиля пользователя: после ввода пароля можно разблокировать полей 'Контакты'",""
"passed","Thu Mar 13 07:17:24 UTC 2025","Thu Mar 13 07:17:59 UTC 2025","35711","","Чат","Чат дисциплины","DisciplineChatTests","CheckPinLastMessageInDisciplineChat","Можно закреплять сообщение в чате дисциплины",""
"passed","Thu Mar 13 07:33:17 UTC 2025","Thu Mar 13 07:33:32 UTC 2025","14806","","Организация","Создание организации","OrganizationCreationTests","CheckValidationErrorInRequiredFieldsIfTheyNotFilled","Ошибка валидации в обязательных полях, если они не заполнены",""
"passed","Thu Mar 13 07:35:58 UTC 2025","Thu Mar 13 07:36:05 UTC 2025","6795","","Материал","Конструктор тест-тренажера","TestTrainQuestionAnswersValidationTests","CheckRemoveCommentFromTestTrainAnswer","Конструктор теста-тренажера: проверка ошибки валидации при удалении комментария к варианту ответа",""
"passed","Thu Mar 13 07:44:12 UTC 2025","Thu Mar 13 07:44:54 UTC 2025","41692","Активность","Контрольная","Прохождение теста","TestActivityStatusWithTwoOrMoreAttemptsTests","CheckResultOfPassingDependOnSettings","Результат тестирования в попытках зависит от настройки За лучшую попытку в командной контрольной",""
"passed","Thu Mar 13 07:24:39 UTC 2025","Thu Mar 13 07:25:00 UTC 2025","21208","","Дисциплина","Редактирование дисциплины","DisContingentEditingValidationTests","CheckOnlyCohortStudentsAreShownInListOfStudents","В выпадающем списке поля Студенты отображаются только студенты потока при редактировании дисциплины",""
"passed","Thu Mar 13 07:14:27 UTC 2025","Thu Mar 13 07:14:45 UTC 2025","17385","","Поток","Создание потока","CohortCreationWarningModalTests","CheckCreateCohortWithMismatchWarningOfDuration","Создание потока: предупреждение о несоответствии длительности потока для программ длительностью 72 часа",""
"passed","Thu Mar 13 07:00:18 UTC 2025","Thu Mar 13 07:00:53 UTC 2025","35222","Активность","Задание","Создание задания","TaskActivityMulticriteriaTests","CheckMultiCriteriaCheckboxIsDisplayed","Чекбокс Многокритериальная проверка отображается, если выбрана опция Стандартная проверка",""
"passed","Thu Mar 13 07:09:58 UTC 2025","Thu Mar 13 07:10:19 UTC 2025","21186","Активность","Шаблон активности контрольной","Редактирование шаблона контрольной","TestTemplateEditingTests","CheckSuccessEditingNumOfAttemptsWithCorrectValue","Успешное сохранение при корректных значениях в поле Количество попыток сдачи",""
"passed","Thu Mar 13 07:04:14 UTC 2025","Thu Mar 13 07:04:33 UTC 2025","19509","","Активность","Обычный шаблон активности","TemplateEditingTests","CheckEditActivityTemplateName","Можно изменить название шаблона активности",""
"passed","Thu Mar 13 07:06:22 UTC 2025","Thu Mar 13 07:06:42 UTC 2025","19609","Активность","Задание","Страница решения задания для студента","TaskWithSolutionStudentTests","CheckAbilityToEditAssessmentOfAnotherStudentsSolution","Можно редактировать поставленную оценку в решении другого студента, если включена опция Взаимопроверка",""
"passed","Thu Mar 13 07:34:19 UTC 2025","Thu Mar 13 07:34:56 UTC 2025","37201","","Расписание","","ScheduleSettingsTests","CheckConnectSyncWithGoogleCalendar","Проверка подключения синхронизации с Google календарем",""
"passed","Thu Mar 13 07:36:58 UTC 2025","Thu Mar 13 07:37:04 UTC 2025","6334","","Профиль","","UserInfoPageTests","CheckSetPassword","Страница профиля пользователя: можно изменить пароль",""
"passed","Thu Mar 13 07:25:48 UTC 2025","Thu Mar 13 07:26:29 UTC 2025","40417","","Библиотека","","LibraryInTileViewTests","CheckRenameCatalog","Библиотека, плиточный вид: можно переименовать каталог",""
"passed","Thu Mar 13 07:01:58 UTC 2025","Thu Mar 13 07:02:31 UTC 2025","32700","Активность","Задание","Страница решения задания для студента","TaskWithoutSolutionStudentTests","CheckSendTextAndFileSolution","Можно отправить ответ в виде текста и файла",""
"passed","Thu Mar 13 07:00:18 UTC 2025","Thu Mar 13 07:02:07 UTC 2025","109818","Активность","Обычная активность","Редактирование активности","ActivityAddingTests","CheckAddFileMaterialToActivity","Можно загрузить материал типа Файл с компьютера в активность",""
"passed","Thu Mar 13 07:21:01 UTC 2025","Thu Mar 13 07:21:13 UTC 2025","12202","","Дисциплина","Редактирование дисциплины","DisciplineEditingValidationTests","CheckImpossibilityTurnOnOrOffIOT","Невозможно включить ИОТ, если в дисциплине есть активности",""
"passed","Thu Mar 13 07:22:34 UTC 2025","Thu Mar 13 07:22:43 UTC 2025","8600","","Дисциплина","Создание дисциплины","DisContingentCreationValidationTests","CheckIsDisabledCheckboxAllStudentInCreatingDiscipline","Чекбокс ‘Все студенты потока’ задизейблен и его невозможно снять",""
"passed","Thu Mar 13 07:06:51 UTC 2025","Thu Mar 13 07:07:18 UTC 2025","26397","Активность","Контрольная","Редактирование контрольной","TestActivityEditingTests","CheckErrorInNumOfAttemptsFieldWithIncorrectValue","Ошибка валидации в поле Количество попыток сдачи, если введено значение больше 20",""
"passed","Thu Mar 13 07:36:55 UTC 2025","Thu Mar 13 07:36:58 UTC 2025","2919","","Профиль","","UserInfoPageTests","CheckStudentCannotViewPassedActivitiesOfAnotherStudent","Страница профиля пользователя: студент не может посмотреть пройденные активности другого студента",""
"passed","Thu Mar 13 07:22:35 UTC 2025","Thu Mar 13 07:22:48 UTC 2025","12599","","Дисциплина","Редактирование дисциплины","DisciplineEditingTests","CheckCancelButtonWork","Работает кнопка Отмена",""
"passed","Thu Mar 13 07:16:22 UTC 2025","Thu Mar 13 07:16:46 UTC 2025","24094","","Чат","Миничат страницы решений","TaskPageMiniChatTests","CheckSendMessageByTappingEnterInTaskPageMiniChat","Можно отправить сообщение по нажатию на Enter в миничате страницы решений",""
"passed","Thu Mar 13 07:19:15 UTC 2025","Thu Mar 13 07:19:33 UTC 2025","18286","","Чат","Личный чат","PersonalChatTests","CheckFindPersonalChatByNameInSearch","Можно найти личный чат в поиске по названию",""
"passed","Thu Mar 13 07:07:49 UTC 2025","Thu Mar 13 07:08:14 UTC 2025","25399","Активность","Контрольная","Редактирование контрольной","TestActivityEditingTests","CheckEditScoreValueInControlTypeActivity","Можно переключать значения в поле Оценка в контрольной",""
"passed","Thu Mar 13 07:02:54 UTC 2025","Thu Mar 13 07:03:44 UTC 2025","49994","Активность","Обычная активность","Редактирование активности","ActivityEditingTests","CheckEditValueScormResultScore","Можно переключать значения в поле 'Оценка по SCORM результату'",""
"skipped","Thu Mar 13 07:45:25 UTC 2025","Thu Mar 13 07:45:27 UTC 2025","1737","","Библиотека","","LibraryMaterialTests","CheckVisibilityOfLaTeXMaterialPage","Страница материала: проверка отображения LaTeX материала",""
"passed","Thu Mar 13 07:17:36 UTC 2025","Thu Mar 13 07:17:44 UTC 2025","7203","","Поток","Редактирование потока","CohortEditingValidationTests","CheckIsNotPossibleEditCohort","Редактирование потока ДО (СЗ): нет возможности редактировать поток программы 2021 года, если в нем есть слушатели",""
"passed","Thu Mar 13 07:15:05 UTC 2025","Thu Mar 13 07:15:25 UTC 2025","20601","","Поток","Создание потока","CohortCreationWarningModalTests","CheckCreateCohortWithMismatchWarningOfDuration","Создание потока: предупреждение о несоответствии длительности потока для программ длительностью 256 часов",""
"passed","Thu Mar 13 07:20:25 UTC 2025","Thu Mar 13 07:20:42 UTC 2025","16590","","Дисциплина","Редактирование дисциплины","DisciplineEditingValidationTests","CheckIfShortnameNotFilledInEditing","Отображение ошибки валидации для поля Краткое название, если поле не заполнено в дисциплине ДО",""
"passed","Thu Mar 13 07:46:22 UTC 2025","Thu Mar 13 07:46:36 UTC 2025","13811","","Программа","","ProgramInfoPageTests","CheckWindowsRestoreArchiveEducationProgram","При восстановлении из архива образовательной программы появляется модалка подтверждения действия",""
"passed","Thu Mar 13 07:09:02 UTC 2025","Thu Mar 13 07:09:49 UTC 2025","47498","","Чат","Миничат звонка дисциплины","DisciplineChatCallTests","CheckSendTextMessageInDisciplineCallChat","Можно отправить текстовое сообщение в миничате звонка дисциплины",""
"passed","Thu Mar 13 07:27:32 UTC 2025","Thu Mar 13 07:27:50 UTC 2025","18003","","Библиотека","","LibraryActionPanelTests","CheckFindMaterialByName","Библиотека, плиточный вид: можно найти материал в поиске по названию",""
"passed","Thu Mar 13 07:21:38 UTC 2025","Thu Mar 13 07:21:52 UTC 2025","13512","","Дисциплина","Редактирование дисциплины","DisciplineEditingValidationTests","CheckIfCreditNotFilled","Отображение ошибки валидации для поля Кредиты с отрицательным значением в дисциплине ДО",""
"passed","Thu Mar 13 07:18:18 UTC 2025","Thu Mar 13 07:18:29 UTC 2025","11082","","Поток","Редактирование потока","CohortEditingValidationTests","CheckIsNotPossibleRemoveCohortWithStudents","Редактирование потока ДО (СЗ): отсутствует кнопка ‘Удалить поток’, если в потоке есть слушатели",""
"passed","Thu Mar 13 07:10:19 UTC 2025","Thu Mar 13 07:11:05 UTC 2025","46116","Активность","Контрольная","Редактирование контрольной","TestActivityEditingTests","CheckChangeSelectionOfCheckboxDisplayingDetailedResult","Можно отметить/снять галку с чекбокса Отображать студентам подробную информацию о результатах",""
"passed","Thu Mar 13 07:17:13 UTC 2025","Thu Mar 13 07:17:25 UTC 2025","12010","","Поток","Страница потока","CohortInfoTests","CheckWindowsRestoreCohortArchive","Страница потока: при восстановлении потока из архива появляется модалка подтверждения действия",""
"passed","Thu Mar 13 07:03:57 UTC 2025","Thu Mar 13 07:04:14 UTC 2025","16299","","Активность","Обычный шаблон активности","TemplateEditingTests","CheckEditTypeInActivityTemplate","Можно переключать значения в поле Тип активности",""
"passed","Thu Mar 13 07:01:18 UTC 2025","Thu Mar 13 07:01:55 UTC 2025","36615","Активность","Задание","Создание задания","TaskActivityCreatingTests","CheckCreateTaskWithOpenSolutions","Можно создать активность типа Задание с открытыми решениями",""
"passed","Thu Mar 13 07:10:56 UTC 2025","Thu Mar 13 07:11:38 UTC 2025","42406","Активность","Контрольная","Результат прохождения теста","TestActivityResultTests","CheckMarkIncorrectAnswerThatWasMarkedAsCorrect","Можно отметить Неверно на ответ в вопросе, который был отмечен как Верно",""
"passed","Thu Mar 13 07:32:07 UTC 2025","Thu Mar 13 07:32:51 UTC 2025","43695","","Материал","Конструктор тест-тренажера","TestTrainQuestionsValidationTests","EditCommentInTestTrainQuestion","Конструктор теста-тренажера: можно изменить комментарий к вопросу",""
"passed","Thu Mar 13 07:06:48 UTC 2025","Thu Mar 13 07:07:39 UTC 2025","51004","Активность","Контрольная","Создание контрольной","TestActivityCreatingTests","CheckCreateActivityBySpecifyingControlMode","Можно создать контрольную с режимом выполнения Индивидуальный",""
"passed","Thu Mar 13 07:30:38 UTC 2025","Thu Mar 13 07:31:04 UTC 2025","26783","","Материал","Конструктор теста","TestQuestionAnswersValidationTests","CheckRemoveCommentInTestAnswer","Конструктор теста: можно удалить комментарий к варианту ответа",""
"passed","Thu Mar 13 07:14:33 UTC 2025","Thu Mar 13 07:15:28 UTC 2025","54979","","Поток","Создание потока","CohortCreationTests","CheckCreateCohortFromTemplateWhenAllRequiredFieldsAreFilled","Создание потока ДО: можно создать поток из шаблона, если все обязательные поля корректно заполнены",""
"passed","Thu Mar 13 07:23:53 UTC 2025","Thu Mar 13 07:24:18 UTC 2025","25101","","Дисциплина","Создание дисциплины","DisContingentCreationTests","CheckCreateDisciplineByCheckingBoxAllCohortStudents","Можно создать дисциплину, включив чекбокс ‘Все студенты потока’",""
"passed","Thu Mar 13 07:19:04 UTC 2025","Thu Mar 13 07:19:26 UTC 2025","21786","","Дисциплина","Редактирование дисциплины","DisciplineAccessTests","CheckIfOtherAdminEducProgChangeDiscipline","У администратора ОП, к которой дисциплина НЕ относится, нет возможности редактирования",""
"passed","Thu Mar 13 07:29:35 UTC 2025","Thu Mar 13 07:30:09 UTC 2025","34299","","Экзамен","","ExamCreateEditTests","CheckImportStudentViaAddStudentButton","Проверка импорта студентов через кнопку Добавить студента",""
"passed","Thu Mar 13 07:34:01 UTC 2025","Thu Mar 13 07:34:23 UTC 2025","22007","","Программа","","ProgramEditingTests","CheckRemoveProgramWithoutCohort","Можно удалить программу ДО без потоков",""
"passed","Thu Mar 13 07:13:57 UTC 2025","Thu Mar 13 07:14:15 UTC 2025","17494","","Чат","Групповой чат","GroupChatMessageActionTests","CheckOpenDiscussionPanelForLeftMessageInGroupChat","Раскрытие панели обсуждения в групповом чате",""
"passed","Thu Mar 13 07:12:15 UTC 2025","Thu Mar 13 07:12:47 UTC 2025","32088","","Чат","Групповой чат","GroupChatMessageActionTests","CheckDeleteMessageInGroupChat","Можно удалить сообщение из группового чата",""
"passed","Thu Mar 13 07:02:05 UTC 2025","Thu Mar 13 07:02:30 UTC 2025","24986","Активность","Обычная активность","Редактирование активности","ActivityEditingFormatTests","CheckSwitchToOnlineActivityFormatSelfStudy","Можно переключится на формат активности Онлайн - Самостоятельное изучение",""
"passed","Thu Mar 13 07:12:47 UTC 2025","Thu Mar 13 07:13:22 UTC 2025","34598","","Чат","Групповой чат","GroupChatMessageActionTests","CheckDeleteLeftSideMessageInGroupChat","Администратор группового чата может удалить сообщение любого участника",""
"passed","Thu Mar 13 07:19:33 UTC 2025","Thu Mar 13 07:20:17 UTC 2025","44310","","Чат","Личный чат","PersonalChatTests","CheckStartDiscussionUnderLeftSideMessageInPersonalChat","Можно ответить на сообщение в личном чате",""
"passed","Thu Mar 13 07:17:16 UTC 2025","Thu Mar 13 07:17:47 UTC 2025","31000","","Чат","Миничат страницы решений","TaskPageMiniChatTests","CheckDeleteMessageInTaskPageMiniChat","Можно удалить сообщение в миничате страницы решений",""
"passed","Thu Mar 13 07:13:00 UTC 2025","Thu Mar 13 07:14:01 UTC 2025","60910","","Чат","Миничат обсуждение решения","TaskMiniChatTests","CheckSendTextMessageInTaskMiniChat","Можно отправить текстовое сообщение в миничате обсуждении решения",""
"passed","Thu Mar 13 07:14:47 UTC 2025","Thu Mar 13 07:15:15 UTC 2025","27204","","Поток","Создание потока","CohortCreationValidationTests","CheckCreateCohortIfEachDateNotFilled","Создание потока: ошибка валидации, если дата начала не указана",""
"passed","Thu Mar 13 07:16:55 UTC 2025","Thu Mar 13 07:17:15 UTC 2025","19813","","Поток","Создание потока","CohortCreationWarningModalTests","CheckImpossibleCreateCohortIgnoringMismatchWarningOfDuration","Создание потока ДО (СЗ): невозможно создать поток без исправления длительности потока",""
"passed","Thu Mar 13 07:31:36 UTC 2025","Thu Mar 13 07:32:06 UTC 2025","29809","","Материал","Конструктор теста","TestQuestionAnswersValidationTests","CheckRemoveAnswerFromFreeAnswerExactMatchQuestion","Конструктор теста: можно удалить вариант ответа из вопроса с типом ответа 'Свободный ответ' – 'Точное совпадение'",""
"passed","Thu Mar 13 07:32:27 UTC 2025","Thu Mar 13 07:32:35 UTC 2025","7903","","Организация","Мой тариф","MyPlanOrganizationPageTests","CheckOpenTableActiveUsers","Проверка открытия таблицы активных пользователей",""
"passed","Thu Mar 13 07:06:51 UTC 2025","Thu Mar 13 07:07:19 UTC 2025","27994","Активность","Задание","Страница решения задания для студента","TaskWithSolutionStudentTests","CheckAbilityToEvaluateAnotherStudentsSolution","Можно оценить решение другого студента, если включена опция Взаимопроверка",""
"passed","Thu Mar 13 07:27:04 UTC 2025","Thu Mar 13 07:27:34 UTC 2025","30005","","Библиотека","","LibraryInTileViewTests","CheckMoveMaterialToCatalogInTileView","Библиотека, плиточный вид: можно переместить материал в другой каталог",""
"passed","Thu Mar 13 07:02:28 UTC 2025","Thu Mar 13 07:03:01 UTC 2025","32818","Активность","Задание","Создание задания","TaskActivityMulticriteriaTests","CheckCreateTaskWithoutPointOfCriteria","Нельзя создать активность типа Задание с критериями, если не заполнен балл критерия",""
"passed","Thu Mar 13 07:42:53 UTC 2025","Thu Mar 13 07:43:08 UTC 2025","15117","","Чат","Групповой чат","GroupChatMessageTests","CheckFindSentMessageInGroupChat","Можно найти отправленное сообщение в групповом чате",""
"passed","Thu Mar 13 07:15:39 UTC 2025","Thu Mar 13 07:15:58 UTC 2025","19492","","Поток","Создание потока","CohortCreationValidationTests","CheckCreateCohortIfStartAndEndDateAreSame","Создание потока: ошибка валидации, если дата начала и окончания совпадают",""
"passed","Thu Mar 13 07:32:35 UTC 2025","Thu Mar 13 07:32:44 UTC 2025","9387","","Организация","Мой тариф","MyPlanOrganizationPageTests","CheckClosedTableActiveUsers","Проверка закрытия таблицы активных пользователей",""
"passed","Thu Mar 13 07:11:50 UTC 2025","Thu Mar 13 07:12:16 UTC 2025","26902","Активность","Шаблон активности контрольной","Редактирование шаблона контрольной","TestTemplateEditingTests","CheckEditValueScormResultScoreInTemplate","Можно переключать значения в поле Оценка по SCORM результату в шаблон контрольной",""
"passed","Thu Mar 13 07:04:42 UTC 2025","Thu Mar 13 07:05:34 UTC 2025","51782","Активность","Контрольная","Редактирование контрольной","TestActivityAddingTests","CheckAddFileToControlTypeActivity","Можно загрузить материал типа Файл с компьютера в контрольную",""
"passed","Thu Mar 13 07:10:18 UTC 2025","Thu Mar 13 07:10:50 UTC 2025","32191","","Чат","Групповой чат","GroupChatTests","CheckDisciplineRoomIsOpened","Можно открыть групповой чат",""
"passed","Thu Mar 13 07:12:12 UTC 2025","Thu Mar 13 07:12:42 UTC 2025","29789","","Чат","Личный чат","PersonalChatTests","CheckSendTextMessageInPersonalChat","Можно отправить текстовое сообщение в личном чате",""
"passed","Thu Mar 13 07:16:43 UTC 2025","Thu Mar 13 07:17:01 UTC 2025","18098","","Поток","Создание потока","CohortCreationValidationTests","CheckCreateCohortFromUnsuitableTemplate","Создание потока ДО: невозможно создать поток из шаблона программы ВО",""
"passed","Thu Mar 13 07:30:00 UTC 2025","Thu Mar 13 07:30:27 UTC 2025","26107","","Материал","Конструктор теста","TestBlocksAndVariantsValidationTests","CheckRenameTestBlock","Конструктор теста: можно переименовать блок",""
