"Status","Start Time","Stop Time","Duration in ms","Parent Suite","Suite","Sub Suite","Test Class","Test Method","Name","Description"
"passed","Tue Oct 31 06:08:30 UTC 2023","Tue Oct 31 06:08:41 UTC 2023","11301","Активность","Контрольная","Прохождение теста","TestActivityPassingTests","PossibilityContinueWithIncompleteAttempt","Прохождение теста: можно продолжить выполнение незавершённой попытки",""
"passed","Tue Oct 31 06:12:10 UTC 2023","Tue Oct 31 06:12:15 UTC 2023","5198","","Дисциплина","Редактирование дисциплины","DisciplineEditingTests","CheckClearAddedTagsFromDiscipline","Редактирование дисциплины: можно очистить теги знаний",""
"passed","Tue Oct 31 06:12:07 UTC 2023","Tue Oct 31 06:12:16 UTC 2023","9270","","Дисциплина","Страница дисциплины","DisciplineAnalyticsTests","CheckFilterByGroupName","Страница аналитика дисциплины: работает фильтр по названию группы",""
"passed","Tue Oct 31 06:15:08 UTC 2023","Tue Oct 31 06:15:14 UTC 2023","6032","","Материал","Конструктор тест-тренажера","TestTrainQuestionAnswersValidationTests","CheckRemoveAnswerFromComparisionQuestionInTestTrain","Конструктор теста-тренажера: можно удалить один вариант на сопоставление из вопроса с типом ответа ‘Сопоставление’",""
"passed","Tue Oct 31 06:11:30 UTC 2023","Tue Oct 31 06:11:41 UTC 2023","11104","","Дисциплина","Настройка чата дисциплины","DisciplineChatBlockTests","CheckBlockAndUnblockChatDiscipline","Редактирование дисциплины: блокировка чата дисциплины",""
"passed","Tue Oct 31 06:06:47 UTC 2023","Tue Oct 31 06:06:54 UTC 2023","6488","","Активность","Обычная активность","ActivityEditingTests","CheckAddTagInActivity","Редактирование активности: можно добавлять теги знаний",""
"passed","Tue Oct 31 06:12:38 UTC 2023","Tue Oct 31 06:12:45 UTC 2023","6606","","Дисциплина","Шаблон дисциплины","DisTemplateTests","CheckAddTopicInDisTemplate","Страница шаблона дисциплины: можно добавить тему",""
"passed","Tue Oct 31 06:10:34 UTC 2023","Tue Oct 31 06:10:42 UTC 2023","8595","","Поток","Создание потока","CohortCreationWarningModalTests","CheckCreateCohortIgnoringMismatchWarningOfDuration","Создание потока: можно создать поток без исправления длительности потока",""
"passed","Tue Oct 31 06:09:45 UTC 2023","Tue Oct 31 06:09:49 UTC 2023","3594","","Поток","Создание потока","CohortCreationTests","CheckCancelCohortCreation","Создание потока ДО: работает кнопка 'Отмена', если страница создание был открыть со страницы программы",""
"passed","Tue Oct 31 06:12:16 UTC 2023","Tue Oct 31 06:12:26 UTC 2023","10185","","Дисциплина","Страница дисциплины","DisciplineAnalyticsTests","CheckResetButton","Страница аналитика дисциплины: работает кнопка “Сбросить”",""
"passed","Tue Oct 31 06:08:35 UTC 2023","Tue Oct 31 06:08:45 UTC 2023","9542","Активность","Контрольная","Результат прохождения теста","TestActivityResultTests","TeacherCanLeaveCommentOnAnswer","Результат прохождения: преподаватель может изменить комментарий к ответу, если включена опция подробная информация о результатах",""
"passed","Tue Oct 31 06:15:34 UTC 2023","Tue Oct 31 06:15:35 UTC 2023","1681","","Профиль","","UserInfoPageTests","CheckIfUserActivityIsLoading","Страница профиля пользователя: загружается блок 'Работа в Odin' для пользователя",""
"passed","Tue Oct 31 06:10:28 UTC 2023","Tue Oct 31 06:10:39 UTC 2023","10848","","Чат","Мини-чат страницы решений","TaskPageMiniChatTests","CheckSendEmojiInTaskInTaskPageMiniChat","Чат на странице решения: можно отправить смайлики",""
"passed","Tue Oct 31 06:13:12 UTC 2023","Tue Oct 31 06:13:14 UTC 2023","2076","","Подразделения","Страница подразделения","DivisionPageTests","CheckExpandListOfArchivedPrograms","Можно посмотреть список архивных программ",""
"passed","Tue Oct 31 06:09:12 UTC 2023","Tue Oct 31 06:09:20 UTC 2023","7405","","Чат","Групповой чат","GroupChatTests","CheckSendTextMessageInGroupChat","Список чатов - групповой чат: можно отправить текстовое сообщение",""
"passed","Tue Oct 31 06:08:07 UTC 2023","Tue Oct 31 06:08:13 UTC 2023","5601","Активность","Контрольная","Редактирование контрольной","TestActivityEditingTests","EditingGradeFieldsInTestActivity","Редактирование контрольной: можно переключать значения в поле 'Оценка'",""
"passed","Tue Oct 31 06:15:20 UTC 2023","Tue Oct 31 06:15:28 UTC 2023","8072","","Материал","Конструктор тест-тренажера","TestTrainQuestionAnswersValidationTests","AddCommentInTestTrainAnswer","Конструктор теста-тренажера: можно изменить комментарий к варианту ответа",""
"passed","Tue Oct 31 06:13:25 UTC 2023","Tue Oct 31 06:13:46 UTC 2023","20774","","Библиотека","","RemovingTemplatesTests","CheckDeleteProgramTemplateFromWhichCohortIsCreated","Страница библиотеки: можно удалить шаблон программы по которому был создан поток",""
"passed","Tue Oct 31 06:10:25 UTC 2023","Tue Oct 31 06:10:29 UTC 2023","3783","","Чат","Личный чат","PersonalChatTests","CheckFindSentMessageInPersonalChat","Список чатов - личный чат: можно найти отправленное сообщение",""
"passed","Tue Oct 31 06:12:38 UTC 2023","Tue Oct 31 06:12:48 UTC 2023","9475","","Подразделения","Страница подразделения","DivisionPageTests","CheckUploadOrDeleteAvatarForDivision","Можно загрузить/удалить аватар для подразделения",""
"passed","Tue Oct 31 06:10:45 UTC 2023","Tue Oct 31 06:10:47 UTC 2023","2209","","Чат","Личный чат","PersonalChatTests","CheckOpenImageInPersonalChat","Список чатов - личный чат: можно раскрывать изображения",""
"passed","Tue Oct 31 06:10:24 UTC 2023","Tue Oct 31 06:10:30 UTC 2023","6303","","Чат","Групповой чат","GroupChatTests","CheckFindGroupChatByNameInSearch","Список чатов - групповой чат: можно найти чат в поиске по названию",""
"passed","Tue Oct 31 06:10:47 UTC 2023","Tue Oct 31 06:10:54 UTC 2023","7026","","Чат","Личный чат","PersonalChatTests","CheckSendMessageByTappingEnterInPersonalChat","Список чатов - личный чат: можно отправить сообщения по нажатию на Enter",""
"passed","Tue Oct 31 06:14:52 UTC 2023","Tue Oct 31 06:14:56 UTC 2023","3385","","Программа","","ProgramEditingTests","CheckRemoveProgramWithoutCohort","Редактирование программы ДО: можно удалить программу без потоков",""
"passed","Tue Oct 31 06:11:56 UTC 2023","Tue Oct 31 06:12:00 UTC 2023","3877","","Дисциплина","Редактирование дисциплины","DisciplineEditingTests","CheckSetDescriptionField","Редактирование дисциплины: можно изменить описание",""
"passed","Tue Oct 31 06:11:17 UTC 2023","Tue Oct 31 06:11:25 UTC 2023","8063","","Чат","Личный чат","PersonalChatTests","CheckDeleteMessageInPersonalChat","Список чатов - личный чат: можно удалить сообщение",""
"passed","Tue Oct 31 06:13:03 UTC 2023","Tue Oct 31 06:13:15 UTC 2023","11637","","Библиотека","","LibraryInTileViewTests","CheckRenameMaterialInTileView","Библиотека, плиточный вид: можно переименовать материал",""
"passed","Tue Oct 31 06:10:23 UTC 2023","Tue Oct 31 06:10:26 UTC 2023","2889","","Поток","Редактирование потока","CohortEditingTests","CheckEditCohortByCheckingCheckboxRegistrationLink","Редактирование потока ДО: успешное сохранение, при отметке/снятии галки ‘Разрешена регистрация по ссылке’",""
"passed","Tue Oct 31 06:15:13 UTC 2023","Tue Oct 31 06:15:21 UTC 2023","7462","","Расписание","","ScheduleSettingsTests","CheckSyncErrorWithGoogleCalendarIsAppear","Проверка некорректного подключения к синхронизации с Google календарем",""
"passed","Tue Oct 31 06:07:11 UTC 2023","Tue Oct 31 06:07:17 UTC 2023","5510","","Активность","Обычная активность","ActivityEditingFormatTests","CheckRandomSetTypeActivityGetFormatIndependancyStudy","Редактирование активности: автоматическое переключение на самостоятельное изучение при выборе конкретных типов",""
"passed","Tue Oct 31 06:07:53 UTC 2023","Tue Oct 31 06:08:11 UTC 2023","18581","Активность","Контрольная","Прохождение теста","TestActivityPassingTests","PassingTest","Прохождение теста: можно пройти тест индивидуальной контрольной",""
"passed","Tue Oct 31 06:11:28 UTC 2023","Tue Oct 31 06:11:33 UTC 2023","5225","","Дисциплина","Редактирование дисциплины","DisciplineAccessTests","CheckIfAdminPodrChangeDiscipline","Редактирование дисциплины: есть возможность редактировать у администратора подразделения, к которому дисциплина относится",""
"passed","Tue Oct 31 06:09:21 UTC 2023","Tue Oct 31 06:09:27 UTC 2023","5936","","Активность","Шаблон активности контрольной","TestTemplateEditingTests","SuccessSaveWithPositiveValueMinThresholdInTestActivityTemplate","Редактирование шаблона контрольной: успешное сохранение при положительных значениях в 'Минимальный порог баллов'",""
"passed","Tue Oct 31 06:15:31 UTC 2023","Tue Oct 31 06:15:34 UTC 2023","2714","","Расписание","","ScheduleTests","CheckMonthModeIsNotDisplayedInMobileVersion","В мобильной версии нет возможности выбрать режим Месяц",""
"passed","Tue Oct 31 06:10:52 UTC 2023","Tue Oct 31 06:11:07 UTC 2023","15727","","Чат","Дисциплина","DisciplineChatTests","CheckPinLastMessageInDisciplineChat","Список чатов - комната дисциплины: можно закреплять сообщения",""
"passed","Tue Oct 31 06:12:03 UTC 2023","Tue Oct 31 06:12:07 UTC 2023","4160","","Дисциплина","Редактирование дисциплины","DisciplineEditingValidationTests","CheckDeleteDisciplineWithGrades","Редактирование дисциплины: невозможно удалить дисциплину с оценками",""
"passed","Tue Oct 31 06:10:37 UTC 2023","Tue Oct 31 06:10:44 UTC 2023","7860","","Чат","Групповой чат","GroupChatTests","CheckAddReactionToLastMessageInGroupChat","Список чатов - групповой чат: можно добавить реакцию на сообщение",""
"passed","Tue Oct 31 06:06:39 UTC 2023","Tue Oct 31 06:06:48 UTC 2023","9329","","Активность","Обычная активность","ActivityDurationTests","CheckIfEndDateEmptyInAcivity","Редактирование активности: успешное сохранение, если заполнена только дата начала",""
"passed","Tue Oct 31 06:10:29 UTC 2023","Tue Oct 31 06:10:35 UTC 2023","6102","","Чат","Дисциплина","DisciplineChatTests","CheckSendFileMessageInDisciplineChat","Список чатов - комната дисциплины: можно прикрепить и отправить файл с компьютера",""
"passed","Tue Oct 31 06:07:21 UTC 2023","Tue Oct 31 06:07:29 UTC 2023","7316","","Активность","Задание","TaskActivityTeacherTests","CheckGradeSolutionValueAboveAndBelowScore","Можно оценить решения значением выше минимального порога баллов",""
"passed","Tue Oct 31 06:11:02 UTC 2023","Tue Oct 31 06:11:07 UTC 2023","5769","","Поток","Страница потока","CohortInfoTests","CheckNoAccessStudentToActivityCohortArchive","Страница потока: студенты не имеют доступа к активностям архивного потока",""
"passed","Tue Oct 31 06:12:17 UTC 2023","Tue Oct 31 06:12:30 UTC 2023","13289","","Дисциплина","Создание дисциплины","DisContingentCreationTests","CheckAddTeacherByUserInfoInCreation","Создание дисциплины: добавление преподавателя из списка",""
"passed","Tue Oct 31 06:12:04 UTC 2023","Tue Oct 31 06:12:09 UTC 2023","5250","","Дисциплина","Создание дисциплины","DisContingentCreationValidationTests","CheckUnableAddGroupFromAnotherCohortInCreation","Создание дисциплины: невозможно добавить группу из стороннего потока",""
"passed","Tue Oct 31 06:09:52 UTC 2023","Tue Oct 31 06:10:01 UTC 2023","8771","","Чат","Мини-чат страницы решений","TaskPageMiniChatTests","CheckSendEmptyMessageInTaskPageMiniChat","Чат на странице решения: невозможно отправить пустое сообщение",""
"passed","Tue Oct 31 06:14:29 UTC 2023","Tue Oct 31 06:14:48 UTC 2023","18982","","Материал","Конструктор теста","TestAddingQuestionsTests","CheckAddFileTestQuestion","Конструктор теста: можно добавить вопрос с типом ответа “Файл”",""
"passed","Tue Oct 31 06:10:09 UTC 2023","Tue Oct 31 06:10:11 UTC 2023","2610","","Поток","Редактирование потока","CohortEditingTests","CheckCancelCohortEditingByDirectLink","Редактирование потока ДО: работает кнопка 'Отмена', если страница редактирование был открыть по прямой ссылке",""
"skipped","Tue Oct 31 06:17:55 UTC 2023","Tue Oct 31 06:17:56 UTC 2023","376","","Библиотека","","LibraryMaterialTests","CheckVisibilityOfLaTeXMaterialPreview","Превью материала: LaTeX отображается как PDF",""
"passed","Tue Oct 31 06:13:50 UTC 2023","Tue Oct 31 06:14:09 UTC 2023","18247","","Материал","Конструктор тест-тренажера","TestTrainAddingQuestionsTests","CheckAddQuestionInTestTrainFreeAnswerWithEqual","Конструктор теста-тренажера: можно добавить вопрос с типом ответа “Свободный ответ” - “Точное совпадение”",""
"passed","Tue Oct 31 06:14:11 UTC 2023","Tue Oct 31 06:14:22 UTC 2023","10135","","Материал","Конструктор теста","TestQuestionsValidationTests","CheckAndUncheckAnswerOptionInTest","Конструктор теста: возможность снять отметку “верный” у варианта ответа",""
"passed","Tue Oct 31 06:12:23 UTC 2023","Tue Oct 31 06:12:35 UTC 2023","11434","","Дисциплина","Редактирование дисциплины","DisContingentEditingValidationTests","CheckAddStudentFromGroupInTeachersField","Редактирование дисциплины: наличия ошибки при попытке указать преподавателем студента из группы",""
"passed","Tue Oct 31 06:10:49 UTC 2023","Tue Oct 31 06:10:57 UTC 2023","7377","","Поток","Создание потока","CohortCreationTests","CheckCreateCohortBySelectingCheckboxRegistrationLink","Создание потока ДО: можно создать поток, выбрав галку ‘Разрешена регистрация по ссылке’",""
"passed","Tue Oct 31 06:10:12 UTC 2023","Tue Oct 31 06:10:18 UTC 2023","5687","","Поток","Создание потока","CohortCreationValidationTests","CheckCreateCohortIfStartAndEndDateNotFilled","Создание потока: ошибка валидации, если даты начала и окончания не указаны",""
"passed","Tue Oct 31 06:08:20 UTC 2023","Tue Oct 31 06:08:27 UTC 2023","6782","Активность","Контрольная","Результат прохождения теста","TestActivityResultTests","ClockIconAndTruFalseButtonsAreDisplayed","Результат прохождения: отображается иконка часы, кнопки верно и неверно в вопросах с типом ответа свободный ответ или файл",""
"passed","Tue Oct 31 06:14:47 UTC 2023","Tue Oct 31 06:14:54 UTC 2023","6351","","Материал","Конструктор тест-тренажера","TestTrainSettingsValidationTests","AddTagInTestTrain","Конструктор теста-тренажера: можно добавлять теги знаний",""
"passed","Tue Oct 31 06:08:53 UTC 2023","Tue Oct 31 06:09:02 UTC 2023","9268","Активность","Контрольная","Прохождение теста","TestActivityStatusWithOneAttemptTests","CheckStatusScoreColorAndIcon","Страница индивидуальной контрольной: статус и цвет у количества баллов в попытке различаются в зависимости от успешности",""
"passed","Tue Oct 31 06:06:41 UTC 2023","Tue Oct 31 06:06:50 UTC 2023","9194","","Активность","Обычная активность","ActivityCreatingTests","CreateActivityInModule","Cоздание активности: можно создать активность в дисциплине в модуле",""
"passed","Tue Oct 31 06:14:51 UTC 2023","Tue Oct 31 06:14:52 UTC 2023","1112","","Организация","Страница организации","OrganizationPageTests","CheckTransitionToStaffImportPage","Страница организации: работает переход к странице импорта сотрудников",""
"passed","Tue Oct 31 06:17:53 UTC 2023","Tue Oct 31 06:18:06 UTC 2023","12639","","Библиотека","","BulkActionsLibraryTests","CheckMoveMultipleSelectedItemsToAnotherDirectory","Библиотека: можно переместить несколько выбранных элементов в другой каталог",""
"passed","Tue Oct 31 06:06:27 UTC 2023","Tue Oct 31 06:06:32 UTC 2023","4295","","Активность","Задание","TaskActivityMulticriteriaTests","CheckMultiCriteriaCheckboxInTask","Чекбокс многокритериальная проверка не отображается, если выбрана взаимопроверка",""
"passed","Tue Oct 31 06:09:24 UTC 2023","Tue Oct 31 06:09:32 UTC 2023","7464","","Чат","Чат для заметок","NotesChatTests","CheckSendEmptyMessageInNotesChat","Список чатов - чат для заметок: невозможно отправить пустое сообщение",""
"passed","Tue Oct 31 06:15:23 UTC 2023","Tue Oct 31 06:15:26 UTC 2023","3221","","Профиль","","AddressAndContactsEditingTests","CheckBlockContactFieldsBeforeInterPassword","Редактирование профиля пользователя: поля 'Контакты' заблокированы до ввода пароля",""
"passed","Tue Oct 31 06:10:42 UTC 2023","Tue Oct 31 06:10:48 UTC 2023","6233","","Чат","Чат для заметок","NotesChatTests","CheckSendFileMessageInNotesChat","Список чатов - чат для заметок: можно прикрепить и отправить файл с компьютера",""
"passed","Tue Oct 31 06:15:02 UTC 2023","Tue Oct 31 06:15:12 UTC 2023","10673","","Материал","Конструктор тест-тренажера","TestTrainQuestionsValidationTests","CheckAndUncheckAnswerOptionInTestTrain","Конструктор теста-тренажера: возможность снять отметку “верный” у варианта ответа",""
"passed","Tue Oct 31 06:14:19 UTC 2023","Tue Oct 31 06:14:20 UTC 2023","1717","","Материал","Конструктор тест-тренажера","TestTrainBlocksAndVariantsValidationTests","ImpossibleToAddVariantInTestTrain","Конструктор теста-тренажера: отсутствует возможность добавить вариант",""
"passed","Tue Oct 31 06:07:52 UTC 2023","Tue Oct 31 06:07:56 UTC 2023","4046","","Активность","Обычная активность","ActivityDurationTests","CheckEditVolumeActivityWithIncorrectValues","Редактирование активности: отображение ошибки валидации для поля 'Объём' с значением > 100",""
"passed","Tue Oct 31 06:11:15 UTC 2023","Tue Oct 31 06:11:20 UTC 2023","4889","","Дисциплина","Страница дисциплины","DisciplineActivitiesBlockTests","CheckCancelAddModule","Страница дисциплины: отмена создания модуля",""
"passed","Tue Oct 31 06:11:38 UTC 2023","Tue Oct 31 06:11:43 UTC 2023","4618","","Дисциплина","Создание дисциплины","DisciplineCreationTests","CancelCreatingDiscipline"," Cоздание дисциплины в потоке ДО: работает кнопка 'Отмена'",""
"passed","Tue Oct 31 06:10:35 UTC 2023","Tue Oct 31 06:10:37 UTC 2023","2386","","Чат","Дисциплина","DisciplineChatTests","CheckOpenImageInDisciplineChat","Список чатов - комната дисциплины: можно раскрывать изображения",""
"passed","Tue Oct 31 06:12:09 UTC 2023","Tue Oct 31 06:12:16 UTC 2023","6617","","Дисциплина","Создание дисциплины","DisContingentCreationValidationTests","CheckUnableAddStudentFromAnotherCohortInCreation","Создание дисциплины: невозможно добавить студента из стороннего потока",""
"passed","Tue Oct 31 06:09:36 UTC 2023","Tue Oct 31 06:09:46 UTC 2023","10456","","Чат","Дисциплина","DisciplineChatTests","CheckAddQuoteToLastMessageInDisciplineChat","Список чатов - комната дисциплины: можно цитировать сообщению",""
"passed","Tue Oct 31 06:11:05 UTC 2023","Tue Oct 31 06:11:12 UTC 2023","7188","","Чат","Групповой чат","GroupChatTests","CheckChangeGroupChatName","Список чатов - групповой чат: можно изменить название чата",""
"passed","Tue Oct 31 06:13:06 UTC 2023","Tue Oct 31 06:13:25 UTC 2023","19225","","Библиотека","","RemovingTemplatesTests","CheckDeleteProgramTemplate","Страница библиотеки: можно удалить шаблон программы",""
"passed","Tue Oct 31 06:14:52 UTC 2023","Tue Oct 31 06:14:54 UTC 2023","1114","","Организация","Страница организации","OrganizationPageTests","CheckTransitionToEditPage","Страница организации: работает кнопка Редактировать",""
"passed","Tue Oct 31 06:15:27 UTC 2023","Tue Oct 31 06:15:34 UTC 2023","6548","","Профиль","","UserInfoPageTests","CheckIfUserPhotoCanBeDeleted","Страница профиля пользователя: можно удалить фото",""
"passed","Tue Oct 31 06:10:26 UTC 2023","Tue Oct 31 06:10:29 UTC 2023","2649","","Поток","Редактирование потока","CohortEditingTests","CheckEditCohortByFillingMaxNumberOfStudents","Редактирование потока: успешное сохранение, с корректными значениями в поле ‘Максимальное количество студентов’",""
"failed","Tue Oct 31 06:17:44 UTC 2023","Tue Oct 31 06:18:21 UTC 2023","37462","","Чат","Чат для заметок","NotesChatTests","CheckFindSentMessageInNotesChat","Список чатов - чат для заметок: можно найти отправленное сообщение",""
