"Status","Start Time","Stop Time","Duration in ms","Parent Suite","Suite","Sub Suite","Test Class","Test Method","Name","Description"
"passed","Tue Oct 31 06:06:49 UTC 2023","Tue Oct 31 06:06:57 UTC 2023","8251","","Активность","Задание","TaskWithoutSolutionStudentTests","CheckSendTextSolution","Можно отправить текстовый ответ",""
"passed","Tue Oct 31 06:06:51 UTC 2023","Tue Oct 31 06:06:59 UTC 2023","7490","","Активность","Обычная активность","ActivityEditingFormatTests","CheckActivityFormatIsHybrid","Редактирование активности: проверка формата активности гибрид",""
"passed","Tue Oct 31 06:11:16 UTC 2023","Tue Oct 31 06:11:19 UTC 2023","3783","","Дисциплина","Редактирование дисциплины","DisciplineAccessTests","CheckIfOtherAdminEducProgChangeDiscipline","Редактирование дисциплины: нет возможности редактировать у администратора образовательной программы, к которой дисциплина НЕ относится",""
"passed","Tue Oct 31 06:11:43 UTC 2023","Tue Oct 31 06:11:46 UTC 2023","2261","","Дисциплина","Редактирование дисциплины","DisciplineEditingValidationTests","CheckIfShortnameNotFilledInEditing","Редактирование дисциплины: отображение ошибки валидации для поля 'Краткое название', если поле не заполнено",""
"passed","Tue Oct 31 06:11:25 UTC 2023","Tue Oct 31 06:11:42 UTC 2023","16259","","Чат","Личный чат","PersonalChatTests","CheckAddNewPersonalChat","Список чатов - личный чат: можно добавить новый чат",""
"passed","Tue Oct 31 06:11:39 UTC 2023","Tue Oct 31 06:11:45 UTC 2023","5902","","Дисциплина","Страница дисциплины","DisciplineAnalyticsTests","CheckOpenNotificationMailingListFromAnalytics","Страница аналитика дисциплины: можно перейти в рассылку уведомлений",""
"passed","Tue Oct 31 06:10:54 UTC 2023","Tue Oct 31 06:10:57 UTC 2023","3522","","Поток","Страница потока","CohortInfoTests","CheckWindowsRestoreCohortArchive","Страница потока: при восстановлении потока из архива появляется модалка подтверждения действия",""
"passed","Tue Oct 31 06:15:41 UTC 2023","Tue Oct 31 06:15:45 UTC 2023","3554","","Профиль","","UserInfoPageTests","CheckStudentCanOpenPageOfPassedActivities","Страница профиля пользователя: под студентом можно перейти на страницу пройденных активностей",""
"passed","Tue Oct 31 06:14:44 UTC 2023","Tue Oct 31 06:14:48 UTC 2023","4327","","Организация","Мой тариф","MyPlanOrganizationPageTests","CheckNoAccessAuditorToRatePage","Страница Мой тариф: проверка перехода аудитора по прямой ссылке",""
"passed","Tue Oct 31 06:13:36 UTC 2023","Tue Oct 31 06:13:45 UTC 2023","9009","","Материал","Конструктор теста","TestQuestionsValidationTests","CheckEditCommentInTestQuestion","Конструктор теста: можно изменить комментарий к вопросу",""
"failed","Tue Oct 31 06:17:34 UTC 2023","Tue Oct 31 06:17:39 UTC 2023","5066","","Активность","Обычный шаблон активности","TemplateAddingTests","CheckAddFileMaterialActivityTemplate","Редактирование шаблона активности: можно загрузить материал типа файл с компьютера",""
"passed","Tue Oct 31 06:09:42 UTC 2023","Tue Oct 31 06:10:00 UTC 2023","17775","","Чат","Мини-чат решения","TaskMiniChatTests","CheckSendTextMessageInTaskMiniChat","Миничат - обсуждение решения: можно отправить текстовое сообщение",""
"passed","Tue Oct 31 06:12:22 UTC 2023","Tue Oct 31 06:12:33 UTC 2023","10889","","Дисциплина","Страница дисциплины","DisciplineMarksAndAttendanceTests","ChecEditTotalFormula","Страница оценок дисциплины: редактирования формулы промежуточного результата",""
"passed","Tue Oct 31 06:06:42 UTC 2023","Tue Oct 31 06:06:51 UTC 2023","8813","","Активность","Задание","TaskActivityMulticriteriaTests","CheckCreateTaskWithoutNameOfCriteria","Нельзя создать задание с критериями, если не заполнены названия критериев",""
"passed","Tue Oct 31 06:08:54 UTC 2023","Tue Oct 31 06:09:00 UTC 2023","6200","Активность","Контрольная","Результат прохождения теста","TestActivityResultTests","TeacherCannotLeaveCommentOnAnswer","Результат прохождения: преподаватель не может оставить комментарий к ответу, если отключена опция подробная информация о результатах",""
"passed","Tue Oct 31 06:15:45 UTC 2023","Tue Oct 31 06:15:56 UTC 2023","10886","","Расписание","","ScheduleSettingsTests","CheckPastActivitiesIsDisplayed","Проверка отображения прошедших активностей",""
"passed","Tue Oct 31 06:08:41 UTC 2023","Tue Oct 31 06:08:53 UTC 2023","12251","","Активность","Обычный шаблон активности","TemplateAddingTests","CheckAddScormPackageActivityTemplate","Редактирование шаблона активности: можно добавить материал типа SCORM из библиотеки",""
"passed","Tue Oct 31 06:08:22 UTC 2023","Tue Oct 31 06:08:26 UTC 2023","4064","Активность","Контрольная","Редактирование контрольной","TestActivityEditingTests","ErrorWithNegativeValueInMinThreshold","Редактирование контрольной: ошибка валидации при отрицательным значением в поле 'Минимальный порог баллов'",""
"passed","Tue Oct 31 06:08:51 UTC 2023","Tue Oct 31 06:08:56 UTC 2023","5122","","Активность","Шаблон активности контрольной","TestTemplateEditingTests","ErrorWithIncorrectValueNumberOfAttemptsInTestActivityTemplate","Редактирование шаблона контрольной: отображение ошибки валидации для поля 'Количество попыток сдачи' с значением '0'",""
"passed","Tue Oct 31 06:10:57 UTC 2023","Tue Oct 31 06:11:05 UTC 2023","7961","","Чат","Чат для заметок","NotesChatTests","CheckAddReactionToLastMessageInNotesChat","Список чатов - чат для заметок: можно добавить реакцию на сообщение",""
"passed","Tue Oct 31 06:12:57 UTC 2023","Tue Oct 31 06:13:02 UTC 2023","5124","","Библиотека","","LibraryMaterialTests","CheckMyLibraryBreadCrumb","Страница материала: работает хлебная крошка 'Моя библиотека'",""
"passed","Tue Oct 31 06:15:07 UTC 2023","Tue Oct 31 06:15:25 UTC 2023","17890","","Материал","Конструктор теста","TestAddingQuestionsTests","CheckAddSortingTestQuestion","Конструктор теста: можно добавить вопрос с типом ответа “Сортировка”",""
"passed","Tue Oct 31 06:07:31 UTC 2023","Tue Oct 31 06:07:43 UTC 2023","11448","","Активность","Обычная активность","ActivityAddingTests","CheckAddScormPackageActivity","Редактирование активности: можно добавить материал типа SCORM из библиотеки",""
"passed","Tue Oct 31 06:12:26 UTC 2023","Tue Oct 31 06:12:34 UTC 2023","8853","","Дисциплина","Страница дисциплины","DisciplineRightMenuTests","CheckDisCreditsAndVolumeIsDisplayed","Страница дисциплины: отображаются кредиты и объём дисциплины",""
"passed","Tue Oct 31 06:15:39 UTC 2023","Tue Oct 31 06:15:41 UTC 2023","1841","","Профиль","","UserInfoPageTests","CheckBlockOfPassedActivitiesAreDisplayed","Страница профиля пользователя: для студента отображаются пройденные активности",""
"passed","Tue Oct 31 06:13:53 UTC 2023","Tue Oct 31 06:14:08 UTC 2023","15083","","Библиотека","","LibraryInListViewTests","CheckMoveMaterialViaActionsButton","Библиотека, списочный вид: можно переместить материал через actions-кнопки",""
"passed","Tue Oct 31 06:15:14 UTC 2023","Tue Oct 31 06:15:20 UTC 2023","6246","","Материал","Конструктор тест-тренажера","TestTrainQuestionAnswersValidationTests","CheckRemoveAnswerFromSortingQuestionInTestTrain","Конструктор теста-тренажера: можно удалить опцию из вопроса с типом ответа 'Сортировка'",""
"passed","Tue Oct 31 06:11:07 UTC 2023","Tue Oct 31 06:11:13 UTC 2023","6163","","Поток","Редактирование потока","CohortEditingValidationTests","CheckIsNotPossibleChangeDatesInEditingCohort","Редактирование потока ДО (СЗ): нет возможности изменить даты потока, если в нем есть слушатели",""
"passed","Tue Oct 31 06:07:58 UTC 2023","Tue Oct 31 06:08:08 UTC 2023","9988","Активность","Контрольная","Создание контрольной","TestActivityCreatingTests","CheckExecModeTestActivity","Создание контрольной: можно создать контрольную с режимом выполнения 'Командный'",""
"passed","Tue Oct 31 06:10:50 UTC 2023","Tue Oct 31 06:10:55 UTC 2023","5263","","Поток","Редактирование потока","CohortEditingValidationTests","CheckEditCohortIfStartAndEndDateAreSame","Редактирование потока: ошибка валидации, если даты начала и окончания совпадают",""
"passed","Tue Oct 31 06:14:44 UTC 2023","Tue Oct 31 06:15:01 UTC 2023","16613","","Материал","Конструктор тест-тренажера","TestTrainAddingQuestionsTests","CheckAddQuestionInTestTrainSort","Конструктор теста-тренажера: можно добавить вопрос с типом ответа “Сортировка”",""
"passed","Tue Oct 31 06:11:03 UTC 2023","Tue Oct 31 06:11:15 UTC 2023","11449","","Дисциплина","Страница дисциплины","DisciplineActivitiesBlockTests","CheckAddModuleInDiscipline","Страница дисциплины: создание модуля",""
"passed","Tue Oct 31 06:11:13 UTC 2023","Tue Oct 31 06:11:16 UTC 2023","2925","","Поток","Редактирование потока","CohortEditingValidationTests","CheckIsNotPossibleRemoveCohortWithStudents","Редактирование потока ДО (СЗ): отсутствует кнопка ‘Удалить поток’, если в потоке есть слушатели",""
"passed","Tue Oct 31 06:14:47 UTC 2023","Tue Oct 31 06:14:49 UTC 2023","2171","","Организация","Создание организации","OrganizationCreationTests","CheckCopyNameToShortnameByDoubleClicking","Создание организации: можно скопировать название в поле краткое название двойным кликом",""
"passed","Tue Oct 31 06:12:18 UTC 2023","Tue Oct 31 06:12:20 UTC 2023","2211","","Дисциплина","Создание дисциплины","DisContingentCreationValidationTests","CheckGroupsAndStudentsFiledsIsAppearInCreation","Создание дисциплины: после снятии галки ‘Все студенты потока’ появляется поля Группы и Студенты",""
"passed","Tue Oct 31 06:10:56 UTC 2023","Tue Oct 31 06:11:06 UTC 2023","9573","","Чат","Мини-чат страницы решений","TaskPageMiniChatTests","CheckAddReactionToLastMessageInTaskPageMiniChat","Чат на странице решения: можно добавить реакцию на сообщение",""
"passed","Tue Oct 31 06:07:16 UTC 2023","Tue Oct 31 06:07:21 UTC 2023","5260","","Активность","Задание","TaskActivityTeacherTests","CheckGradeSolutionWithZeroValue","Можно оценить решения значением '0'",""
"passed","Tue Oct 31 06:10:32 UTC 2023","Tue Oct 31 06:10:33 UTC 2023","1257","","Поток","Создание потока","CohortCreationValidationTests","CheckCreateCohortBySelectingCheckboxRegistrationLinkInProgramNatDemography","Создание потока ДО (СЗ): нет возможности выбрать галку ‘Разрешена регистрация по ссылке’",""
"passed","Tue Oct 31 06:14:24 UTC 2023","Tue Oct 31 06:14:33 UTC 2023","9304","","Материал","Конструктор тест-тренажера","TestTrainSettingsValidationTests","EditTestTrainDescription","Конструктор теста-тренажера: можно изменить описание теста-тренажера",""
"passed","Tue Oct 31 06:11:18 UTC 2023","Tue Oct 31 06:11:22 UTC 2023","4004","","Дисциплина","Настройка чата дисциплины","DisciplineChatBlockTests","CheckChatMissingFromList","Страница чата: отсутствия блокированного чата в списке чатов",""
"passed","Tue Oct 31 06:13:00 UTC 2023","Tue Oct 31 06:13:06 UTC 2023","5937","","Подразделения","Страница подразделения","DivisionPageTests","CheckPinAndUnpinButtonOfDivisionInMainMenu","Работает кнопка закрепления/открепления из главного меню",""
"passed","Tue Oct 31 06:11:38 UTC 2023","Tue Oct 31 06:11:54 UTC 2023","16069","","Чат","Групповой чат","GroupChatTests","CheckAddGroupChatWithUsers","Список чатов - групповой чат: можно добавить новый чат для групп и студентов",""
"passed","Tue Oct 31 06:07:43 UTC 2023","Tue Oct 31 06:07:54 UTC 2023","11508","","Активность","Обычная активность","ActivityAddingTests","CheckAddTestSimulatorNotInControlTypeActivity","Редактирование активности: можно добавить материал типа тест-тренажёра из библиотеки не в контрольную",""
"passed","Tue Oct 31 06:08:56 UTC 2023","Tue Oct 31 06:09:02 UTC 2023","5502","","Активность","Шаблон активности контрольной","TestTemplateEditingTests","ErrorWithIncorrectValueNumberOfAttemptsInTestActivityTemplate","Редактирование шаблона контрольной: отображение ошибки валидации для поля 'Количество попыток сдачи' с значением > 20",""
"passed","Tue Oct 31 06:12:59 UTC 2023","Tue Oct 31 06:13:00 UTC 2023","1141","","Подразделения","Страница подразделения","DivisionPageTests","CheckTransitionToEditPage","Работает кнопка Редактировать",""
"passed","Tue Oct 31 06:10:06 UTC 2023","Tue Oct 31 06:10:12 UTC 2023","5474","","Поток","Создание потока","CohortCreationWarningModalTests","CheckCreateCohortWithMismatchWarningOfDuration","Создание потока: предупреждение о несоответствии длительности потока для программ длительностью 144 часа",""
"passed","Tue Oct 31 06:10:17 UTC 2023","Tue Oct 31 06:10:24 UTC 2023","6590","","Поток","Создание потока","CohortCreationWarningModalTests","CheckCreateCohortWithoutMismatchWarningOfDuration","Создание потока: нет предупреждения о несоответствии длительности потока для программ длительностью кроме 72, 144 и 256 часов",""
"passed","Tue Oct 31 06:11:53 UTC 2023","Tue Oct 31 06:12:03 UTC 2023","10298","","Дисциплина","Создание дисциплины","DisciplineCreationTests","CreatDisciplineFromDisciplineTemplateWithActivities","Создание дисциплины ДО: можно создать дисциплину из шаблона дисциплины с активностями",""
"passed","Tue Oct 31 06:11:48 UTC 2023","Tue Oct 31 06:11:56 UTC 2023","7567","","Дисциплина","Создание дисциплины","DisciplineCreationValidationTests","CheckIfCreditValuesNotAllowed","Создание дисциплины ДО: отображение ошибки валидации для поля 'Кредиты' с значением 0",""
"passed","Tue Oct 31 06:17:34 UTC 2023","Tue Oct 31 06:17:44 UTC 2023","9738","","Активность","Обычная активность","ActivityDurationTests","ErrorWhenEndDateLessStartDateInActivity","Редактирование активности: отображение ошибки валидации для полей даты, если дата окончания меньше даты начала",""
"passed","Tue Oct 31 06:09:17 UTC 2023","Tue Oct 31 06:09:24 UTC 2023","6858","","Чат","Чат для заметок","NotesChatTests","CheckSendTextMessageInNotesChat","Список чатов - чат для заметок: можно отправить текстовое сообщение",""
"passed","Tue Oct 31 06:13:47 UTC 2023","Tue Oct 31 06:14:08 UTC 2023","21382","","Материал","Конструктор теста","TestAddingQuestionsTests","CheckAddQuestionWithFreeAnswerExactMatch","Конструктор теста: можно добавить вопрос с типом ответа “Свободный ответ” - “Точное совпадение”",""
"passed","Tue Oct 31 06:13:07 UTC 2023","Tue Oct 31 06:13:11 UTC 2023","4540","","Библиотека","","StudentLibraryTests","CheckAvailabilityOfContentCreation","Библиотека студента: недоступно создание материалов кроме добавления файла и создания текстового материала",""
"passed","Tue Oct 31 06:12:53 UTC 2023","Tue Oct 31 06:12:59 UTC 2023","5942","","Библиотека","","BulkActionsLibraryTests","CheckInSelectModeFirstElementIsSelected","Библиотека: при переходе в режим выбора первый элемент должен быть выбран",""
"passed","Tue Oct 31 06:11:52 UTC 2023","Tue Oct 31 06:11:57 UTC 2023","5676","","Дисциплина","Редактирование дисциплины","DisciplineDurationTests","CheckIfStartDateEmptyInDiscipline","Редактирование дисциплины: наличия ошибки если поле дата начала пустое",""
"passed","Tue Oct 31 06:11:05 UTC 2023","Tue Oct 31 06:11:20 UTC 2023","15189","","Чат","Чат для заметок","NotesChatTests","CheckPinLastMessageInNotesChat","Список чатов - чат для заметок: можно закреплять сообщения",""
"passed","Tue Oct 31 06:09:46 UTC 2023","Tue Oct 31 06:09:59 UTC 2023","12991","","Чат","Дисциплина","DisciplineChatTests","CheckCallInDisciplineChat","Список чатов - комната дисциплины: можно сделать звонок",""
"passed","Tue Oct 31 06:08:40 UTC 2023","Tue Oct 31 06:08:41 UTC 2023","1352","","Активность","Обычный шаблон активности","TemplateAddingTests","CheckAbsenceScormScoreFieldActivityTemplate","Редактирование шаблона активности: отсутствия поля оценка по SCORM результату, если не добавлен SCORM пакет",""
"passed","Tue Oct 31 06:11:33 UTC 2023","Tue Oct 31 06:11:37 UTC 2023","3491","","Дисциплина","Редактирование дисциплины","DisciplineAccessTests","CheckOtherOrgAdminChangeDiscipline","Редактирование дисциплины: нет возможности редактировать у администратора организации, к которому дисциплина НЕ относится",""
"passed","Tue Oct 31 06:15:00 UTC 2023","Tue Oct 31 06:15:03 UTC 2023","3214","","Расписание","","ScheduleTests","CheckColorLegendIsDisplayed","Отображается цветовая легенда событий расписания",""
"passed","Tue Oct 31 06:08:00 UTC 2023","Tue Oct 31 06:08:07 UTC 2023","7617","Активность","Контрольная","Редактирование контрольной","TestActivityEditingTests","SuccessSaveWithCorrectValueNumberOfAttemptsInTestActivity","Редактирование контрольной: успешное сохранение при корректных значениях в 'Количество попыток сдачи'",""
"passed","Tue Oct 31 06:11:37 UTC 2023","Tue Oct 31 06:11:55 UTC 2023","18146","","Дисциплина","Редактирование дисциплины","DisciplineAccessTests","CheckOrgAdminChangeDiscipline","Редактирование дисциплины: есть возможность редактировать у администратора организации, к которому дисциплина относится",""
"passed","Tue Oct 31 06:10:01 UTC 2023","Tue Oct 31 06:10:16 UTC 2023","15435","","Чат","Мини-чат страницы решений","TaskPageMiniChatTests","CheckEditLastMessageInTaskPageMiniChat","Чат на странице решения: можно редактировать сообщение в течение 4 часов после отправки",""
"passed","Tue Oct 31 06:08:43 UTC 2023","Tue Oct 31 06:08:48 UTC 2023","4672","Активность","Контрольная","Прохождение теста","TestActivityStatusWithOneAttemptTests","StatusChangesIfMinThresholdChanges","Страница индивидуальной контрольной: статус меняется, если преподаватель меняет минимальный порог баллов",""
"passed","Tue Oct 31 06:09:47 UTC 2023","Tue Oct 31 06:09:58 UTC 2023","11062","","Чат","Чат для заметок","NotesChatTests","CheckAddQuoteToLastMessageInNotesChat","Список чатов - чат для заметок: можно цитировать сообщению",""
"passed","Tue Oct 31 06:08:26 UTC 2023","Tue Oct 31 06:08:40 UTC 2023","13979","","Активность","Шаблон активности контрольной","TestTemplateAddingTests","AddTestToTestActivityTemplate","Редактирование шаблона контрольной: можно добавить материал типа тест из библиотеки",""
"passed","Tue Oct 31 06:10:15 UTC 2023","Tue Oct 31 06:10:23 UTC 2023","8243","","Чат","Чат решения","TaskChatTests","CheckSendEmojiInTaskChat","Список чатов - обсуждение решения: можно отправить смайлики",""
"passed","Tue Oct 31 06:10:34 UTC 2023","Tue Oct 31 06:10:41 UTC 2023","6924","","Поток","Редактирование потока","CohortEditingTests","CheckCreateCohortWithMismatchWarningOfDuration","Редактирование потока: появление модалки, если продолжительность потока меньше часов программы",""
"passed","Tue Oct 31 06:12:26 UTC 2023","Tue Oct 31 06:12:28 UTC 2023","2675","","Дисциплина","Страница дисциплины","DisciplineStudentTests","CheckNoEditButtonForStudent","Страница дисциплины: отсутствия кнопки 'Редактировать' у студента",""
"passed","Tue Oct 31 06:11:46 UTC 2023","Tue Oct 31 06:11:48 UTC 2023","2819","","Дисциплина","Редактирование дисциплины","DisciplineEditingValidationTests","CheckIfDescriptionNotFilledInEditing","Редактирование дисциплины: отображение ошибки валидации для поля 'Описание', если поле не заполнено",""
"passed","Tue Oct 31 06:12:59 UTC 2023","Tue Oct 31 06:13:06 UTC 2023","6856","","Библиотека","","BulkActionsLibraryTests","CheckSelectMultipleItems","Библиотека: можно выбрать несколько элементов",""
"passed","Tue Oct 31 06:13:46 UTC 2023","Tue Oct 31 06:13:53 UTC 2023","6834","","Библиотека","","LibraryInListViewTests","CheckEditMaterialViaActionsButton","Библиотека, списочный вид: можно редактировать материал через actions-кнопки",""
