"Status","Start Time","Stop Time","Duration in ms","Parent Suite","Suite","Sub Suite","Test Class","Test Method","Name","Description"
"passed","Mon Feb 05 06:09:02 UTC 2024","Mon Feb 05 06:09:06 UTC 2024","4368","","Дисциплина","Редактирование дисциплины","DisciplineEditingTests","CheckSetDescriptionField","Можно изменить описание",""
"passed","Mon Feb 05 05:59:14 UTC 2024","Mon Feb 05 05:59:20 UTC 2024","6722","Активность","Задание","Создание задания","TaskActivityMulticriteriaTests","CheckMultiCriteriaCheckboxNotDisplayed","Чекбокс Многокритериальная проверка не отображается, если выбрана опция Взаимопроверка",""
"passed","Mon Feb 05 06:08:11 UTC 2024","Mon Feb 05 06:08:17 UTC 2024","5564","","Дисциплина","Страница дисциплины","DisciplineAnalyticsTests","CheckThreeDotMenuOnAnalyticsTabIsDisplayed","Наличие тридот меню на вкладке ‘Аналитика’",""
"passed","Mon Feb 05 06:08:33 UTC 2024","Mon Feb 05 06:08:38 UTC 2024","5299","","Дисциплина","Создание дисциплины","DisciplineCreationTests","CancelCreatingDiscipline","Проверка кнопки ‘Отмена’ в потоке ВО",""
"passed","Mon Feb 05 06:02:21 UTC 2024","Mon Feb 05 06:02:25 UTC 2024","4084","","Чат","Дисциплина","DisciplineChatTests","CheckFindSentMessageInDisciplineChat","Можно найти отправленное сообщение",""
"passed","Mon Feb 05 06:04:45 UTC 2024","Mon Feb 05 06:04:54 UTC 2024","8285","","Чат","Групповой чат","GroupChatTests","CheckSendGroupChatToArchive","можно отправить чат в архив",""
"passed","Mon Feb 05 06:00:26 UTC 2024","Mon Feb 05 06:00:32 UTC 2024","6352","Активность","Контрольная","Редактирование контрольной","TestActivityEditingTests","CheckSuccessSaveWithCorrectValueInNumbOfAttemptsField","Успешное сохранение при корректных значениях в поле Количество попыток сдачи",""
"passed","Mon Feb 05 06:12:59 UTC 2024","Mon Feb 05 06:13:01 UTC 2024","1862","","Программа","","ProgramCreationTests","CheckCancelCreatingProgram","Проверка кнопки Отмена у программы ДПО",""
"passed","Mon Feb 05 05:59:56 UTC 2024","Mon Feb 05 05:59:59 UTC 2024","2997","","Активность","Обычный шаблон активности","TemplateEditingValidationTests","CheckEditActivityTemplateVolumeWithIncorrectValue","Ошибка валидации в поле Объем в академических часах, если введено значение 0",""
"passed","Mon Feb 05 06:10:46 UTC 2024","Mon Feb 05 06:10:52 UTC 2024","6272","","Дисциплина","Редактирование дисциплины","DisContingentEditingTests","CheckEditDisciplineByCheckingBoxAllCohortStudents","Есть возможность сохранить дисциплину выбрав галку Все студенты потока",""
"passed","Mon Feb 05 05:59:11 UTC 2024","Mon Feb 05 05:59:18 UTC 2024","6957","Активность","Задание","Страница решения задания для преподавателя","TaskActivityTeacherTests","CheckSetIndividualDate","Можно установить индивидуальный срок сдачи",""
"passed","Mon Feb 05 05:59:17 UTC 2024","Mon Feb 05 05:59:27 UTC 2024","9800","Активность","Задание","Создание задания","TaskActivityCreatingTests","CheckCreateTaskWithOpenSolutions","Можно создать активность типа Задание с открытыми решениями",""
"passed","Mon Feb 05 06:10:14 UTC 2024","Mon Feb 05 06:10:21 UTC 2024","6652","","Дисциплина","Редактирование дисциплины","DisContingentEditingTests","CheckRemoveTeacherFromDiscipline","Открепление преподавателя от дисциплины",""
"passed","Mon Feb 05 06:01:09 UTC 2024","Mon Feb 05 06:01:13 UTC 2024","3610","","Активность","Обычная активность","ActivityEditingTests","CheckOnRatingActivity","Проверка включения опции выставления оценки за активность",""
"passed","Mon Feb 05 06:12:13 UTC 2024","Mon Feb 05 06:12:19 UTC 2024","5753","","Материал","Конструктор теста","TestQuestionAnswersValidationTests","CheckRemoveAnswerFromComparisionQuestion","Конструктор теста: можно удалить один вариант на сопоставление из вопроса с типом ответа ‘Сопоставление’",""
"passed","Mon Feb 05 06:13:48 UTC 2024","Mon Feb 05 06:13:51 UTC 2024","3002","","Расписание","","ScheduleTests","CheckMonthModeIsNotDisplayedInMobileVersion","В мобильной версии нет возможности выбрать режим Месяц",""
"passed","Mon Feb 05 06:13:57 UTC 2024","Mon Feb 05 06:14:02 UTC 2024","4680","","Профиль","","UserInfoPageTests","CheckTransitionToEditProfileWorks","Страница профиля пользователя: кнопка 'Редактировать' работает для пользователя",""
"passed","Mon Feb 05 06:00:26 UTC 2024","Mon Feb 05 06:00:36 UTC 2024","10302","Активность","Контрольная","Прохождение теста","TestActivityPassingTests","CheckPassingTestInControlActivity","Можно пройти тест командной контрольной",""
"passed","Mon Feb 05 06:05:19 UTC 2024","Mon Feb 05 06:05:22 UTC 2024","2685","","Чат","Групповой чат","GroupChatTests","CheckMembersOfGroupChatIsDisplayed","отображаются участники чата при клике на блок с аватарками",""
"passed","Mon Feb 05 06:02:54 UTC 2024","Mon Feb 05 06:03:00 UTC 2024","5783","","Чат","Дисциплина","DisciplineRoomChatTests","CheckFindDisciplineRoomChatByNameInSearch","можно найти чат в поиске по названию",""
"passed","Mon Feb 05 06:02:12 UTC 2024","Mon Feb 05 06:02:23 UTC 2024","11109","","Чат","Мини-чат дисциплины","DisciplineRoomMiniChatTests","CheckSendEmptyMessageInDisciplineRoomMiniChat","невозможно отправить пустое сообщение",""
"passed","Mon Feb 05 06:08:35 UTC 2024","Mon Feb 05 06:08:42 UTC 2024","7684","","Дисциплина","Страница дисциплины","DisciplineAnalyticsTests","CheckOpenNotificationMailingListFromAnalytics","Можно перейти в рассылку уведомлений из аналитики дисциплины",""
"passed","Mon Feb 05 06:08:21 UTC 2024","Mon Feb 05 06:08:24 UTC 2024","3351","","Дисциплина","Редактирование дисциплины","DisciplineAccessTests","CheckIfOtherAdminPodrChangeDiscipline","У администратора подразделения, к которому дисциплина НЕ относится, нет возможности редактирования",""
"passed","Mon Feb 05 06:12:02 UTC 2024","Mon Feb 05 06:12:11 UTC 2024","8277","","Материал","Конструктор теста","TestSettingsValidationTests","ChangeLevelAssimilationInTestTag","Конструктор теста: можно изменить уровень усвоения в добавленном теге знаний",""
"passed","Mon Feb 05 06:08:57 UTC 2024","Mon Feb 05 06:09:00 UTC 2024","3296","","Дисциплина","Редактирование дисциплины","DisciplineEditingValidationTests","CheckIfCreditNotFilled","Отображение ошибки валидации для поля Кредиты с значением 0 в дисциплине ВО",""
"passed","Mon Feb 05 06:07:05 UTC 2024","Mon Feb 05 06:07:11 UTC 2024","6187","","Поток","Создание потока","CohortCreationWarningModalTests","CheckCreateCohortWithMismatchWarningOfDuration","Создание потока: предупреждение о несоответствии длительности потока для программ длительностью 144 часа",""
"passed","Mon Feb 05 06:01:33 UTC 2024","Mon Feb 05 06:01:38 UTC 2024","4625","Активность","Шаблон активности контрольной","Редактирование шаблона контрольной","TestTemplateEditingTests","CheckSuccessEditingTimeLimitWithCorrectValue","Успешное сохранение при корректных значениях в поле Временной лимит",""
"passed","Mon Feb 05 06:03:34 UTC 2024","Mon Feb 05 06:03:44 UTC 2024","10327","","Чат","Мини-чат дисциплины","DisciplineRoomMiniChatTests","CheckSendFileMessageInDisciplineRoomMiniChat","можно прикрепить и отправить файл с компьютера",""
"passed","Mon Feb 05 06:09:19 UTC 2024","Mon Feb 05 06:09:34 UTC 2024","14624","","Дисциплина","Создание дисциплины","DisciplineCreationTests","CreatDisciplineFromDisciplineTemplateWithActivities","Можно создать дисциплину ДО из шаблона дисциплины с активностями",""
"passed","Mon Feb 05 06:10:03 UTC 2024","Mon Feb 05 06:10:07 UTC 2024","3640","","Подразделения","Редактирование подразделения","DivisionEditingTests","CheckEditDivisionType","Можно поменять тип подразделения",""
"passed","Mon Feb 05 06:03:18 UTC 2024","Mon Feb 05 06:03:55 UTC 2024","36582","","Чат","Мини-чат дисциплины","DisciplineRoomMiniChatTests+ChatEditing","CheckSendDisciplineChatRoomToArchiveInMinichat","Можно отправить чат в архив",""
"passed","Mon Feb 05 06:10:35 UTC 2024","Mon Feb 05 06:10:47 UTC 2024","12292","","Дисциплина","Дисциплина с ИОТ","IOTThemesAndModulesTests","CheckCannotCreateModuleOrTopicInsideTopic","Страница дисциплины с ИОТ: внутри темы нельзя создать модуль или тему",""
"passed","Mon Feb 05 06:08:16 UTC 2024","Mon Feb 05 06:08:26 UTC 2024","9906","","Дисциплина","Редактирование дисциплины","DisciplineDurationTests","CheckIfDatesFilledCorrectInDiscipline","Успешное сохранение, если обе даты заполнены",""
"passed","Mon Feb 05 06:11:32 UTC 2024","Mon Feb 05 06:11:42 UTC 2024","9525","","Материал","Конструктор теста","TestSettingsValidationTests","EditTestDescription","Конструктор теста: можно изменить описание теста",""
"passed","Mon Feb 05 06:13:55 UTC 2024","Mon Feb 05 06:14:04 UTC 2024","9469","","Расписание","","ScheduleSettingsTests","CheckAbilityToHidePastActivities","Проверка возможности скрыть прошедшие активности",""
"passed","Mon Feb 05 05:59:45 UTC 2024","Mon Feb 05 05:59:55 UTC 2024","9793","","Активность","Обычный шаблон активности","TemplateAddingTests","CheckAddTestNotToControlActivityTemplate","Наличие ошибки при добавлении материала типа Тест из Библиотеки не в контрольную",""
"passed","Mon Feb 05 06:09:02 UTC 2024","Mon Feb 05 06:09:06 UTC 2024","3792","","Дисциплина","Страница дисциплины","DisciplineRightMenuTests","CheckEditButtonForTeacher","Работает кнопка 'Редактировать' для преподавателя",""
"passed","Mon Feb 05 06:07:50 UTC 2024","Mon Feb 05 06:07:55 UTC 2024","4080","","Поток","Редактирование потока","CohortEditingValidationTests","CheckIsNotPossibleRemoveCohortInProgramNatDemography","Редактирование потока ДО (СЗ): нет возможности удалить поток",""
"passed","Mon Feb 05 06:12:15 UTC 2024","Mon Feb 05 06:12:36 UTC 2024","20869","","Материал","Конструктор тест-тренажера","TestTrainAddingQuestionsTests","CheckAddQuestionInTestTrainFreeAnswerWithDiapason","Конструктор теста-тренажера: можно добавить вопрос с типом ответа “Свободный ответ” - “Диапазон”",""
"passed","Mon Feb 05 06:09:39 UTC 2024","Mon Feb 05 06:09:44 UTC 2024","5205","","Дисциплина","Шаблон дисциплины","DisTemplateTests","CheckCreateDisTemplateWithFillingRequiredFields","Можно создать шаблон дисциплины, если заполнены все обязательные поля",""
"passed","Mon Feb 05 06:10:31 UTC 2024","Mon Feb 05 06:10:34 UTC 2024","2095","","Подразделения","Страница подразделения","DivisionPageTests","CheckProjectLabelIsDisplayedForAdditionalPrograms","Лейбл образовательного проекта отображается под названием программы ДО",""
"passed","Mon Feb 05 06:04:47 UTC 2024","Mon Feb 05 06:05:06 UTC 2024","19879","","Чат","Мини-чат звонка дисциплины","DisciplineRoomChatCallTests","CheckAddReactionToLastMessageInDisciplineRoomCallChat","можно добавить реакцию на сообщение",""
"passed","Mon Feb 05 06:02:11 UTC 2024","Mon Feb 05 06:02:25 UTC 2024","14648","","Чат","Мини-чат дисциплины","DisciplineMiniChatTests","CheckAddQuoteToLastMessageInDisciplineMiniChat","можно цитировать сообщению",""
"passed","Mon Feb 05 06:08:50 UTC 2024","Mon Feb 05 06:09:02 UTC 2024","12155","","Дисциплина","Страница дисциплины","DisciplineRightMenuTests","CheckPinDisciplineForTeacher","Работает кнопка закрепления/открепления из главного меню для преподавателя",""
"passed","Mon Feb 05 06:04:54 UTC 2024","Mon Feb 05 06:05:02 UTC 2024","8326","","Чат","Групповой чат","GroupChatTests","CheckRestoreGroupChatFromArchive","можно восстановить чат из архива",""
"passed","Mon Feb 05 06:00:21 UTC 2024","Mon Feb 05 06:00:26 UTC 2024","4914","Активность","Контрольная","Редактирование контрольной","TestActivityEditingTests","CheckErrorInNumOfAttemptsFieldWithIncorrectValue","Ошибка валидации в поле Количество попыток сдачи, если введено значение больше 20",""
"passed","Mon Feb 05 06:06:56 UTC 2024","Mon Feb 05 06:07:10 UTC 2024","14654","","Чат","Мини-чат страницы решений","TaskPageMiniChatTests","CheckAddQuoteToLastMessageInTaskPageMiniChat","можно цитировать сообщению",""
"passed","Mon Feb 05 05:59:05 UTC 2024","Mon Feb 05 05:59:10 UTC 2024","4964","Активность","Задание","Страница активности","TaskActivityInfoPageTests","CheckGotoSolutions","Работает кнопка Перейти к решениям для преподавателя",""
"passed","Mon Feb 05 06:12:56 UTC 2024","Mon Feb 05 06:13:07 UTC 2024","10785","","Материал","Конструктор тест-тренажера","TestTrainQuestionsValidationTests","CheckAndUncheckAnswerOptionInTestTrain","Конструктор теста-тренажера: возможность снять отметку “верный” у варианта ответа",""
"passed","Mon Feb 05 06:00:07 UTC 2024","Mon Feb 05 06:00:11 UTC 2024","4252","","Активность","Обычный шаблон активности","TemplateEditingTests","CheckEditActivityTemplateDescription","Можно изменить описание шаблона активности",""
"passed","Mon Feb 05 06:04:16 UTC 2024","Mon Feb 05 06:04:31 UTC 2024","15216","","Чат","Мини-чат группового чата","GroupMiniChatTests+ChatEditing","CheckChangeGroupChatNameInMinichat","можно изменить название чата",""
"passed","Mon Feb 05 06:12:53 UTC 2024","Mon Feb 05 06:13:02 UTC 2024","8842","","Материал","Конструктор тест-тренажера","TestTrainSettingsValidationTests","ChangeLevelAssimilationInTestTrainTag","Конструктор теста-тренажера: можно изменить уровень усвоения в добавленном теге знаний",""
"passed","Mon Feb 05 06:08:34 UTC 2024","Mon Feb 05 06:08:40 UTC 2024","5920","","Дисциплина","Редактирование дисциплины","DisciplineDurationTests","CheckIfEndDateEmptyInDiscipline","Ошибка валидации, если поле Дата окончания не заполнено",""
"passed","Mon Feb 05 06:00:18 UTC 2024","Mon Feb 05 06:00:31 UTC 2024","13095","Активность","Контрольная","Редактирование контрольной","TestActivityAddingTests","CheckAddTestToControlTypeActivity","Можно добавить материал типа Тест из Библиотеки в контрольную",""
"passed","Mon Feb 05 06:05:47 UTC 2024","Mon Feb 05 06:06:12 UTC 2024","25494","","Чат","Мини-чат группового чата","GroupMiniChatTests","CheckPinLastMessageInGroupMiniChat","Можно закреплять сообщения в миничате группового чата",""
"passed","Mon Feb 05 06:17:30 UTC 2024","Mon Feb 05 06:17:35 UTC 2024","4668","","Чат","Дисциплина","DisciplineRoomChatTests","CheckAddDisciplineChatRoomWithoutName","невозможно добавить комнату, если не заполнен поля 'Название'",""
"passed","Mon Feb 05 06:05:11 UTC 2024","Mon Feb 05 06:05:31 UTC 2024","19835","","Чат","Мини-чат группового звонка","GroupChatCallTests","CheckAddReactionToLastMessageInGroupCallChat","можно добавить реакцию на сообщение",""
"passed","Mon Feb 05 06:02:07 UTC 2024","Mon Feb 05 06:02:21 UTC 2024","13753","","Чат","Дисциплина","DisciplineChatTests","CheckCallInDisciplineChat","Можно сделать звонок",""
"passed","Mon Feb 05 06:01:11 UTC 2024","Mon Feb 05 06:01:21 UTC 2024","10267","Активность","Шаблон активности контрольной","Редактирование шаблона контрольной","TestTemplateAddingTests","CheckAddTestTrainToControlActivityPlan","Можно добавить материал типа Тест-тренажёр из Библиотеки в шаблон контрольной",""
"passed","Mon Feb 05 06:10:28 UTC 2024","Mon Feb 05 06:10:39 UTC 2024","11083","","Библиотека","","BulkActionsLibraryTests","CheckSelectMultipleItems","Библиотека: можно выбрать несколько элементов",""
"passed","Mon Feb 05 06:09:18 UTC 2024","Mon Feb 05 06:09:32 UTC 2024","13205","","Дисциплина","Страница дисциплины","DisciplineMarksAndAttendanceTests","ChecEditTotalFormula","Редактирование формулы промежуточного результата дисциплины",""
"passed","Mon Feb 05 06:02:51 UTC 2024","Mon Feb 05 06:02:58 UTC 2024","6860","","Чат","Дисциплина","DisciplineChatTests","CheckSendMessageByTappingEnterInDisciplineChat","Можно отправить сообщения по нажатию на Enter",""
"passed","Mon Feb 05 06:10:13 UTC 2024","Mon Feb 05 06:10:35 UTC 2024","22152","","Дисциплина","Дисциплина с ИОТ","IOTThemesAndModulesTests","CheckCreateTopicOrActivityInsideModule","Страница дисциплины с ИОТ: внутри модуля можно создать темы или активности",""
"passed","Mon Feb 05 06:07:44 UTC 2024","Mon Feb 05 06:07:50 UTC 2024","6245","","Поток","Создание потока","CohortCreationWarningModalTests","CheckImpossibleCreateCohortIgnoringMismatchWarningOfDuration","Создание потока ДО (СЗ): невозможно создать поток без исправления длительности потока",""
"passed","Mon Feb 05 06:07:38 UTC 2024","Mon Feb 05 06:07:39 UTC 2024","1066","","Поток","Редактирование потока","CohortEditingValidationTests","CheckIsNotPossibleEditCohort","Редактирование потока ДО (СЗ): нет возможности редактировать поток программы 2021 года, если в нем есть слушатели",""
"passed","Mon Feb 05 06:07:47 UTC 2024","Mon Feb 05 06:07:50 UTC 2024","3197","","Поток","Редактирование потока","CohortEditingValidationTests","CheckIsNotPossibleRemoveCohortWithStudents","Редактирование потока ДО (СЗ): отсутствует кнопка ‘Удалить поток’, если в потоке есть слушатели",""
"passed","Mon Feb 05 06:03:43 UTC 2024","Mon Feb 05 06:03:58 UTC 2024","15314","","Чат","Дисциплина","DisciplineChatTests","CheckMembersOfDisciplineChatIsDisplayed","Отображаются участники чата при клике на блок с аватарками",""
"passed","Mon Feb 05 06:10:29 UTC 2024","Mon Feb 05 06:10:35 UTC 2024","6526","","Дисциплина","Редактирование дисциплины","DisContingentEditingValidationTests","CheckOnlyCohortStudentsAreShownInListOfStudents","В выпадающем списке поля Студенты отображаются только студенты потока при редактировании дисциплины",""
"passed","Mon Feb 05 06:06:24 UTC 2024","Mon Feb 05 06:06:39 UTC 2024","14939","","Чат","Мини-чат личного звонка","PersonalChatCallTests","CheckFindSentMessageInPersonalCallChat","можно найти отправленное сообщение",""
"passed","Mon Feb 05 06:00:56 UTC 2024","Mon Feb 05 06:01:01 UTC 2024","4444","Активность","Контрольная","Редактирование контрольной","TestActivityEditingTests","CheckErrorInMinThresholdFieldWithIncorrectValue","Ошибка валидации в поле Минимальный порог баллов, если введено отрицательное значение",""
"passed","Mon Feb 05 06:04:39 UTC 2024","Mon Feb 05 06:04:45 UTC 2024","6534","","Чат","Групповой чат","GroupChatTests","CheckChangeGroupChatName","можно изменить название чата",""
"passed","Mon Feb 05 06:10:25 UTC 2024","Mon Feb 05 06:10:36 UTC 2024","10361","","Дисциплина","Шаблон дисциплины","DisTemplateTests","CheckCreateActivityInDisTemplate","Можно добавить шаблон активности в шаблон дисциплины, создав его",""
"passed","Mon Feb 05 06:17:33 UTC 2024","Mon Feb 05 06:17:46 UTC 2024","13513","","Чат","Мини-чат решения","TaskMiniChatTests","CheckSendEmojiInTaskMiniChat","можно отправить смайлики",""
"passed","Mon Feb 05 06:07:24 UTC 2024","Mon Feb 05 06:07:35 UTC 2024","11533","","Поток","Создание потока","CohortCreationWarningModalTests","CheckCreateCohortAfterChangeMismatchWarningOfDuration","Создание потока: можно создать поток после внесения правок в длительность потока",""
"passed","Mon Feb 05 06:03:37 UTC 2024","Mon Feb 05 06:03:43 UTC 2024","6097","","Чат","Дисциплина","DisciplineChatTests","CheckSwitchToAnotherDisciplineChatRoom","Можно переключаться между комнатами",""
"passed","Mon Feb 05 06:11:25 UTC 2024","Mon Feb 05 06:11:36 UTC 2024","10896","","Материал","Конструктор теста","TestBlocksAndVariantsValidationTests","CheckRemoveTestVariant","Конструктор теста: можно удалить вариант",""
"passed","Mon Feb 05 06:13:09 UTC 2024","Mon Feb 05 06:13:11 UTC 2024","2342","","Программа","","ProgramEditingTests","CheckRemoveProgramWithCohort","Невозможно удалить программу ДО с потоками",""
"passed","Mon Feb 05 06:03:56 UTC 2024","Mon Feb 05 06:04:04 UTC 2024","8367","","Чат","Дисциплина","DisciplineRoomChatTests","CheckDeleteMessageInDisciplineRoomChat","можно удалить сообщение",""
"passed","Mon Feb 05 06:09:26 UTC 2024","Mon Feb 05 06:09:41 UTC 2024","14741","","Дисциплина","Редактирование дисциплины","DisciplineEditingTests","CheckDeleteDisciplineWithoutGrades","Можно удалить дисциплину без оценок",""
"passed","Mon Feb 05 06:07:32 UTC 2024","Mon Feb 05 06:07:55 UTC 2024","22813","","Чат","Мини-чат личного чата","PersonalMiniChatTests","CheckPinLastMessageInPersonalMiniChat","Можно закреплять сообщения в личном чате из миничата",""
