"Status","Start Time","Stop Time","Duration in ms","Parent Suite","Suite","Sub Suite","Test Class","Test Method","Name","Description"
"passed","Wed Oct 11 05:41:29 UTC 2023","Wed Oct 11 05:41:37 UTC 2023","8057","","Расписание","","ScheduleSettingsTests","SyncGoogleCalendar","Страница расписания: проверка подключения синхронизации с google календарем",""
"passed","Wed Oct 11 05:32:15 UTC 2023","Wed Oct 11 05:32:25 UTC 2023","9054","Активность","Контрольная","Прохождение теста","TestActivityStatusWithOneAttemptTests","NoStatusWithOneIncompleteAttempt","Страница индивидуальной контрольной: отсутствует статус и иконка для одной незавершенной попыткой",""
"passed","Wed Oct 11 05:39:28 UTC 2023","Wed Oct 11 05:39:40 UTC 2023","12753","","Материал","Конструктор теста","TestQuestionsValidationTests","CheckAddCommentInTestQuestion","Конструктор теста: можно добавить комментария к вопросу",""
"passed","Wed Oct 11 05:34:19 UTC 2023","Wed Oct 11 05:34:29 UTC 2023","10515","","Чат","Чат решения","TaskChatTests","CheckSendEmptyMessageInTaskChat","Список чатов - обсуждение решения: невозможно отправить пустое сообщение",""
"passed","Wed Oct 11 05:44:51 UTC 2023","Wed Oct 11 05:45:01 UTC 2023","10546","Активность","Контрольная","Прохождение теста","TestActivityStatusWithTwoOrMoreAttemptsTests","StatusExistIfAtLeastOneCompletedAttempt","Страница командной контрольной: статус отображается, если есть хотя бы одна завершенная попытка",""
"passed","Wed Oct 11 05:41:18 UTC 2023","Wed Oct 11 05:41:22 UTC 2023","4665","","Программа","","ProgramCreationTests","CreateHighProgramOverviewFields","Cоздание обр программы ДПО: если заполнить только обязательные поля",""
"passed","Wed Oct 11 05:40:07 UTC 2023","Wed Oct 11 05:40:24 UTC 2023","17566","","Материал","Конструктор тест-тренажера","TestTrainAddingQuestionsTests","AddQuestionInTestTrain","Конструктор теста-тренажера: можно добавить вопрос с типом ответа “Выбор из вариантов”",""
"passed","Wed Oct 11 05:31:27 UTC 2023","Wed Oct 11 05:31:45 UTC 2023","17948","","Активность","Обычная активность","ActivityCreatingTests","CheckCreateActivityFromTemplate","Cоздание активности: можно создать активность из шаблона",""
"passed","Wed Oct 11 05:38:29 UTC 2023","Wed Oct 11 05:38:50 UTC 2023","20237","","Дисциплина","Редактирование дисциплины","DisContingentEditingTests","CheckAddGroupAndStudentToDiscipline","Редактирование дисциплины: добавления к дисциплине групп и студентов",""
"failed","Wed Oct 11 05:45:12 UTC 2023","Wed Oct 11 05:45:44 UTC 2023","31812","","Активность","Обычная активность","ActivityEditingTests","CheckOnRatingActivity","Редактирование активности: проверка вкл выставления оценки за активность",""
"passed","Wed Oct 11 05:41:04 UTC 2023","Wed Oct 11 05:41:24 UTC 2023","19744","","Материал","Конструктор теста","TestAddingQuestionsTests","CheckAddSortingTestQuestion","Конструктор теста: можно добавить вопрос с типом ответа “Сортировка”",""
"passed","Wed Oct 11 05:37:13 UTC 2023","Wed Oct 11 05:37:21 UTC 2023","7394","","Дисциплина","Редактирование дисциплины","DisciplineEditingTests","CheckSwitchControlType","Редактирование дисциплины: можно переключать значения в поле 'Вид контроля'",""
"passed","Wed Oct 11 05:37:02 UTC 2023","Wed Oct 11 05:37:08 UTC 2023","6016","","Дисциплина","Редактирование дисциплины","DisciplineAccessTests","CheckIfSuperAdminChangeDiscipline","Редактирование дисциплины: есть возможность редактировать у суперадминистратора",""
"passed","Wed Oct 11 05:37:51 UTC 2023","Wed Oct 11 05:37:57 UTC 2023","6245","","Чат","Групповой чат","GroupChatTests","CheckAddGroupChatRoomWithoutName","Список чатов - групповой чат: невозможно добавить чат, если не заполнен поля 'Название'",""
"passed","Wed Oct 11 05:41:22 UTC 2023","Wed Oct 11 05:41:25 UTC 2023","2217","","Программа","","ProgramCreationTests","CheckCancelCreatingProgram","Cоздание обр программы ДПО: проверка кнопки 'Отмена'",""
"passed","Wed Oct 11 05:31:04 UTC 2023","Wed Oct 11 05:31:15 UTC 2023","11368","","Активность","Обычная активность","ActivityCreatingTests","CreateActivityInModule","Cоздание активности: можно создать активность в дисциплине в модуле",""
"passed","Wed Oct 11 05:41:09 UTC 2023","Wed Oct 11 05:41:17 UTC 2023","8004","","Материал","Конструктор тест-тренажера","TestTrainQuestionAnswersValidationTests","RemoveAnswerFromQuestionInTestTrain","Конструктор теста-тренажера: можно удалить вариант ответа из вопроса с типом ответа 'Выбор из вариантов'",""
"passed","Wed Oct 11 05:34:14 UTC 2023","Wed Oct 11 05:34:32 UTC 2023","18170","","Чат","Личный чат","PersonalChatTests","CheckEditLastMessageInPersonalChat","Список чатов - личный чат: можно редактировать сообщение в течение 4 часов после отправки",""
"passed","Wed Oct 11 05:41:02 UTC 2023","Wed Oct 11 05:41:16 UTC 2023","13404","","Организация","Создание организации","OrganizationCreationTests","CheckCreateOrganization","Создание организации: можно создать организацию, если заполнены только обязательные поля",""
"passed","Wed Oct 11 05:36:38 UTC 2023","Wed Oct 11 05:36:50 UTC 2023","12333","","Дисциплина","Страница дисциплины","DisciplineActivitiesBlockTests","CheckAddTopicInDiscipline","Страница дисциплины: создание темы",""
"passed","Wed Oct 11 05:37:13 UTC 2023","Wed Oct 11 05:37:22 UTC 2023","8372","","Дисциплина","Создание дисциплины","DisciplineCreationValidationTests","CheckIfCreditValuesNotAllowed","Создание дисциплины ДО: отображение ошибки валидации для поля 'Кредиты' с отрицательным значением",""
"passed","Wed Oct 11 05:36:53 UTC 2023","Wed Oct 11 05:36:58 UTC 2023","5394","","Дисциплина","Редактирование дисциплины","DisciplineEditingTests","CheckSetNameField","Редактирование дисциплины: можно изменить название",""
"passed","Wed Oct 11 05:32:57 UTC 2023","Wed Oct 11 05:33:15 UTC 2023","17923","Активность","Контрольная","Страница контрольной","TestCommandActivityTests","EditCommandToControlTypeActivityInCommandMode","Страница командной контрольной: можно редактировать команду",""
"passed","Wed Oct 11 05:32:50 UTC 2023","Wed Oct 11 05:33:02 UTC 2023","12011","","Активность","Обычный шаблон активности","TemplateAddingTests","CheckRemoveMaterialActivityTemplate","Редактирование шаблона активности: можно удалять материалы",""
"passed","Wed Oct 11 05:35:18 UTC 2023","Wed Oct 11 05:35:22 UTC 2023","3809","","Чат","Чат для заметок","NotesChatTests","CheckOpenImageInNotesChat","Список чатов - чат для заметок: можно раскрывать изображения",""
"passed","Wed Oct 11 05:36:01 UTC 2023","Wed Oct 11 05:36:05 UTC 2023","4526","","Поток","Страница потока","CohortInfoTests","CheckWindowsSendCohortArchive","Страница потока: при архивации потока появляется модалка подтверждения действия",""
"passed","Wed Oct 11 05:40:37 UTC 2023","Wed Oct 11 05:40:44 UTC 2023","7421","","Материал","Конструктор теста","TestQuestionAnswersValidationTests","CheckRemoveAnswerFromFreeAnswerExactMatchQuestion","Конструктор теста: можно удалить вариант ответа из вопроса с типом ответа 'Свободный ответ' – 'Точное совпадение'",""
"passed","Wed Oct 11 05:40:25 UTC 2023","Wed Oct 11 05:40:44 UTC 2023","19181","","Материал","Конструктор теста","TestAddingQuestionsTests","CheckAddFileTestQuestion","Конструктор теста: можно добавить вопрос с типом ответа “Файл”",""
"passed","Wed Oct 11 05:40:50 UTC 2023","Wed Oct 11 05:40:59 UTC 2023","8190","","Материал","Конструктор тест-тренажера","TestTrainQuestionAnswersValidationTests","CheckAddOneMoreOptionInComparisonTestQuestionInTestTrain","Конструктор теста-тренажера: можно добавить еще один вариант на сопоставление в вопрос с типом ответа 'Сопоставление'",""
"passed","Wed Oct 11 05:32:35 UTC 2023","Wed Oct 11 05:32:41 UTC 2023","5253","Активность","Контрольная","Редактирование контрольной","TestActivityEditingTests","ErrorWithNegativeValueInTimeLimit","Редактирование контрольной: ошибка валидации при отрицательным значением в поле 'Временной лимит'",""
"passed","Wed Oct 11 05:37:50 UTC 2023","Wed Oct 11 05:38:06 UTC 2023","15332","","Дисциплина","Редактирование дисциплины","DisContingentEditingTests","CheckAddTeacherByUserInfoInEditing","Редактирование дисциплины: добавление преподавателя из списка",""
"passed","Wed Oct 11 05:34:31 UTC 2023","Wed Oct 11 05:34:37 UTC 2023","5591","","Поток","Создание потока","CohortCreationValidationTests","CheckCreateCohortIfNameNotFilled","Создание потока: ошибка валидации, если название не указано",""
"passed","Wed Oct 11 05:30:46 UTC 2023","Wed Oct 11 05:30:54 UTC 2023","8159","","Активность","Задание","TaskActivityTeacherTests","CheckGradeSolutionWithZeroValue","Страница решение задания: можно оценить решения значением '0'",""
"passed","Wed Oct 11 05:35:29 UTC 2023","Wed Oct 11 05:35:31 UTC 2023","2341","","Чат","Дисциплина","DisciplineChatTests","CheckOpenImageInDisciplineChat","Список чатов - комната дисциплины: можно раскрывать изображения",""
"passed","Wed Oct 11 05:42:11 UTC 2023","Wed Oct 11 05:42:13 UTC 2023","2074","","Профиль","","UserInfoPageTests","CheckBlockOfPassedActivitiesAreDisplayed","Страница профиля пользователя: для студента отображаются пройденные активности",""
"passed","Wed Oct 11 05:40:15 UTC 2023","Wed Oct 11 05:40:26 UTC 2023","10906","","Материал","Конструктор теста","TestSettingsValidationTests","ClearTagsFromTest","Конструктор теста: можно удалить теги знаний",""
"passed","Wed Oct 11 05:37:36 UTC 2023","Wed Oct 11 05:37:50 UTC 2023","14010","","Дисциплина","Редактирование дисциплины","DisContingentEditingTests","CheckAddTeacherByUserInfoInEditing","Редактирование дисциплины: добавление преподавателя по email’у",""
"passed","Wed Oct 11 05:32:09 UTC 2023","Wed Oct 11 05:32:18 UTC 2023","8257","","Активность","Обычный шаблон активности","TemplateEditingTests","CheckAddTagInActivityTemplate","Редактирование шаблона активности: можно добавлять теги знаний",""
"passed","Wed Oct 11 05:41:31 UTC 2023","Wed Oct 11 05:41:34 UTC 2023","3141","","Расписание","","ScheduleTests","ColorLegendSchedule","Страница расписания: цветовая легенда событий расписания",""
"passed","Wed Oct 11 05:31:12 UTC 2023","Wed Oct 11 05:31:17 UTC 2023","5215","","Активность","Задание","TaskWithSolutionStudentTests","CheckTransitionToMySolution","Страница активности: работает кнопка 'Моё решение' для студента",""
"passed","Wed Oct 11 05:39:35 UTC 2023","Wed Oct 11 05:39:49 UTC 2023","13977","","Библиотека","","LibraryInTileViewTests","CheckRemoveCatalog","Библиотека, плиточный вид: можно удалить каталог",""
"passed","Wed Oct 11 05:38:14 UTC 2023","Wed Oct 11 05:38:21 UTC 2023","7568","","Дисциплина","Страница дисциплины","DisciplineAnalyticsTests","CheckStudentActivityGraphIsDisplayed","Страница аналитика дисциплины: отображается график действия студента",""
"passed","Wed Oct 11 05:34:17 UTC 2023","Wed Oct 11 05:34:33 UTC 2023","15792","","Чат","Групповой чат","GroupChatTests","CheckAddQuoteToLastMessageInGroupChat","Список чатов - групповой чат: можно цитировать сообщению",""
"passed","Wed Oct 11 05:41:48 UTC 2023","Wed Oct 11 05:41:54 UTC 2023","6113","","Материал","Конструктор тест-тренажера","TestTrainQuestionAnswersValidationTests","CheckRemoveCommentFromTestTrainAnswer","Конструктор теста-тренажера: проверка ошибки валидации при удалении комментария к варианту ответа",""
"passed","Wed Oct 11 05:37:43 UTC 2023","Wed Oct 11 05:37:47 UTC 2023","3876","","Дисциплина","Страница дисциплины","DisciplineStudentTests","CheckNoEditButtonForStudent","Страница дисциплины: отсутствия кнопки 'Редактировать' у студента",""
"passed","Wed Oct 11 05:33:15 UTC 2023","Wed Oct 11 05:33:22 UTC 2023","6852","","Активность","Шаблон активности контрольной","TestTemplateEditingTests","ErrorWithIncorrectValueNumberOfAttemptsInTestActivityTemplate","Редактирование шаблона контрольной: отображение ошибки валидации для поля 'Количество попыток сдачи' с отрицательным значением",""
"passed","Wed Oct 11 05:34:05 UTC 2023","Wed Oct 11 05:34:13 UTC 2023","7830","","Активность","Шаблон активности контрольной","TestTemplateEditingTests","SwitchCheckboxDisplayStudentsDetailedResultInfoInTestActivityTemplate","Редактирование шаблона контрольной: переключение чекбокса 'Отображать студентам подробную информацию о результатах'",""
"passed","Wed Oct 11 05:34:58 UTC 2023","Wed Oct 11 05:35:07 UTC 2023","9598","","Поток","Создание потока","CohortCreationWarningModalTests","CheckCreateCohortWithMismatchWarningOfDuration","Создание потока: предупреждение о несоответствии длительности потока для программ длительностью 72 часа",""
"passed","Wed Oct 11 05:41:18 UTC 2023","Wed Oct 11 05:41:20 UTC 2023","1363","","Организация","Страница организации","OrganizationPageTests","CheckTransitionToStaffImportPage","Страница организации: работает переход к странице импорта сотрудников",""
"passed","Wed Oct 11 05:34:56 UTC 2023","Wed Oct 11 05:35:10 UTC 2023","14041","","Чат","Чат для заметок","NotesChatTests","CheckSendEmojiInNotesChat","Список чатов - чат для заметок: можно отправить смайлики",""
"passed","Wed Oct 11 05:41:58 UTC 2023","Wed Oct 11 05:42:03 UTC 2023","4900","","Профиль","","AddressAndContactsEditingTests","CheckUnlockContactFieldsAfterInterPassword","Редактирование профиля пользователя: после ввода пароля можно разблокировать полей 'Контакты'",""
"passed","Wed Oct 11 05:41:34 UTC 2023","Wed Oct 11 05:41:37 UTC 2023","3034","","Программа","","ProgramEditingTests","CheckRemoveProgramWithCohort","Редактирование программы ДО: невозможно удалить программу с потоками",""
"failed","Wed Oct 11 05:44:39 UTC 2023","Wed Oct 11 05:45:17 UTC 2023","38039","","Активность","Обычная активность","ActivityAddingTests","CheckAddMaterialFromLibraryActivity","Редактирование активности: можно добавить материал типа текст из библиотеки",""
"passed","Wed Oct 11 05:31:21 UTC 2023","Wed Oct 11 05:31:31 UTC 2023","9540","","Активность","Обычная активность","ActivityEditingTests","CheckAddTagInActivity","Редактирование активности: можно добавлять теги знаний",""
"passed","Wed Oct 11 05:37:22 UTC 2023","Wed Oct 11 05:37:26 UTC 2023","4052","","Дисциплина","Страница дисциплины","DisciplineRightMenuTests","CheckOpenDisciplineChatFromDisPage","Страница дисциплины: можно открыть мини-чат нажав 'Открыть чат дисциплины'",""
"passed","Wed Oct 11 05:33:40 UTC 2023","Wed Oct 11 05:34:06 UTC 2023","25971","","Чат","Мини-чат группового чата","GroupMiniChatTests","CheckSendTextMessageInGroupMiniChat","Миничат - групповой чат: можно отправить текстовое сообщение",""
"passed","Wed Oct 11 05:38:33 UTC 2023","Wed Oct 11 05:38:48 UTC 2023","15167","","Библиотека","","LibraryInTileViewTests","CheckRenameMaterialInTileView","Библиотека, плиточный вид: можно переименовать материал",""
"passed","Wed Oct 11 05:40:59 UTC 2023","Wed Oct 11 05:41:09 UTC 2023","10278","","Материал","Конструктор теста","TestQuestionAnswersValidationTests","CheckEditCommentInTestAnswer","Конструктор теста: можно изменить комментарий к варианту ответа",""
"passed","Wed Oct 11 05:36:28 UTC 2023","Wed Oct 11 05:36:32 UTC 2023","4112","","Дисциплина","Редактирование дисциплины","DisciplineAccessTests","CheckIfOtherAdminEducProgChangeDiscipline","Редактирование дисциплины: нет возможности редактировать у администратора образовательной программы, к которой дисциплина НЕ относится",""
"passed","Wed Oct 11 05:41:37 UTC 2023","Wed Oct 11 05:41:42 UTC 2023","4657","","Расписание","","ScheduleSettingsTests","DisconnectWithSyncGoogleCalendar","Страница расписания: проверка отключения синхронизации с google календарем",""
"passed","Wed Oct 11 05:32:36 UTC 2023","Wed Oct 11 05:32:50 UTC 2023","14347","","Активность","Обычный шаблон активности","TemplateAddingTests","CheckAddScormPackageActivityTemplate","Редактирование шаблона активности: можно добавить материал типа SCORM из библиотеки",""
"passed","Wed Oct 11 05:36:42 UTC 2023","Wed Oct 11 05:36:46 UTC 2023","4773","","Поток","Редактирование потока","CohortEditingValidationTests","CheckIsNotPossibleRemoveCohortInProgramNatDemography","Редактирование потока ДО (СЗ): нет возможности удалить поток",""
"passed","Wed Oct 11 05:45:49 UTC 2023","Wed Oct 11 05:45:57 UTC 2023","8219","","Материал","Конструктор теста","TestSettingsValidationTests","EditTestPointsLimit","Конструктор теста: можно изменить минимальный порог баллов",""
"passed","Wed Oct 11 05:45:47 UTC 2023","Wed Oct 11 05:45:54 UTC 2023","7741","","Дисциплина","Редактирование дисциплины","DisContingentEditingValidationTests","CheckUnableAddStudentFromAnotherCohortInEditing","Редактирование дисциплины: невозможно добавить студента из стороннего потока",""
"passed","Wed Oct 11 05:35:21 UTC 2023","Wed Oct 11 05:35:28 UTC 2023","6486","","Поток","Редактирование потока","CohortEditingTests","CheckCancelCohortEditing","Редактирование потока ДО: работает кнопка 'Отмена', если страница редактирование был открыть со страницы потока",""
"passed","Wed Oct 11 05:32:48 UTC 2023","Wed Oct 11 05:32:53 UTC 2023","4916","Активность","Контрольная","Редактирование контрольной","TestActivityEditingTests","ErrorWithNegativeValueInMinThreshold","Редактирование контрольной: ошибка валидации при отрицательным значением в поле 'Минимальный порог баллов'",""
"passed","Wed Oct 11 05:33:05 UTC 2023","Wed Oct 11 05:33:17 UTC 2023","11308","Активность","Контрольная","Результат прохождения теста","TestActivityResultTests","TeacherCanLeaveCommentOnAnswer","Результат прохождения: преподаватель может удалить комментарий к ответу, если включена опция подробная информация о результатах",""
"passed","Wed Oct 11 05:33:21 UTC 2023","Wed Oct 11 05:33:29 UTC 2023","8390","","Чат","Дисциплина","DisciplineChatTests","CheckSendTextMessageInDisciplineChat","Список чатов - комната дисциплины: можно отправить текстовое сообщение",""
"passed","Wed Oct 11 05:40:58 UTC 2023","Wed Oct 11 05:41:00 UTC 2023","2046","","Материал","Конструктор тест-тренажера","TestTrainBlocksAndVariantsValidationTests","ImpossibleToAddVariantInTestTrain","Конструктор теста-тренажера: отсутствует возможность добавить вариант",""
"passed","Wed Oct 11 05:38:23 UTC 2023","Wed Oct 11 05:38:29 UTC 2023","5987","","Подразделения","","DivisionCommonTests","EditDivision","Редактирование название подразделения",""
"passed","Wed Oct 11 05:37:27 UTC 2023","Wed Oct 11 05:37:46 UTC 2023","18751","","Чат","Групповой чат","GroupChatTests","CheckAddGroupChatWithUsers","Список чатов - групповой чат: можно добавить новый чат для групп и студентов",""
"passed","Wed Oct 11 05:35:08 UTC 2023","Wed Oct 11 05:35:16 UTC 2023","8006","","Поток","Создание потока","CohortCreationWarningModalTests","CheckCreateCohortWithMismatchWarningOfDuration","Создание потока: предупреждение о несоответствии длительности потока для программ длительностью 144 часа",""
"passed","Wed Oct 11 05:38:09 UTC 2023","Wed Oct 11 05:38:18 UTC 2023","9021","","Библиотека","","BulkActionsLibraryTests","CheckChooseButtonExistInMenu","Библиотека: наличие пункта “Выбрать” в меню при правом клике на каталог или материал",""
"passed","Wed Oct 11 05:44:39 UTC 2023","Wed Oct 11 05:44:51 UTC 2023","11340","Активность","Контрольная","Прохождение теста","TestActivityStatusWithTwoOrMoreAttemptsTests","StatusExistIfAtLeastOneCompletedAttempt","Страница индивидуальной контрольной: статус отображается, если есть хотя бы одна завершенная попытка",""
