"Status","Start Time","Stop Time","Duration in ms","Parent Suite","Suite","Sub Suite","Test Class","Test Method","Name","Description"
"passed","Mon Oct 16 05:32:17 UTC 2023","Mon Oct 16 05:32:29 UTC 2023","12383","","Дисциплина","Редактирование дисциплины","DisContingentEditingTests","CheckAddTeacherByUserInfoInEditing","Редактирование дисциплины: добавление преподавателя по ссылке на профиль",""
"passed","Mon Oct 16 05:25:17 UTC 2023","Mon Oct 16 05:25:40 UTC 2023","22659","","Активность","Обычная активность","ActivityAddingTests","CheckAddMaterialFromLibraryActivity","Редактирование активности: можно добавить материал типа текст из библиотеки",""
"passed","Mon Oct 16 05:33:58 UTC 2023","Mon Oct 16 05:34:08 UTC 2023","9441","","Материал","Конструктор теста","TestQuestionsValidationTests","CheckAndUncheckAnswerOptionInTest","Конструктор теста: возможность отметить вариант ответа как “верный”",""
"passed","Mon Oct 16 05:35:42 UTC 2023","Mon Oct 16 05:35:56 UTC 2023","13253","","Профиль","","GeneralUserInfoEditingTests","CheckUserNameFiledsInTransliteration","Редактирование профиля пользователя: можно изменить ФИО в транслитерации",""
"passed","Mon Oct 16 05:30:50 UTC 2023","Mon Oct 16 05:30:56 UTC 2023","6239","","Дисциплина","Редактирование дисциплины","DisciplineAccessTests","CheckOtherOrgAdminChangeDiscipline","Редактирование дисциплины: нет возможности редактировать у администратора организации, к которому дисциплина НЕ относится",""
"passed","Mon Oct 16 05:31:36 UTC 2023","Mon Oct 16 05:31:40 UTC 2023","3753","","Дисциплина","Страница дисциплины","DisciplineRightMenuTests","CheckOpenDisciplineChatFromDisPage","Страница дисциплины: можно открыть мини-чат нажав 'Открыть чат дисциплины'",""
"passed","Mon Oct 16 05:26:33 UTC 2023","Mon Oct 16 05:26:34 UTC 2023","1610","","Активность","Обычная активность","ActivityEditingTests","CheckDeleteActivityWithGrades","Редактирование активности: невозможно удалить активность с оценками",""
"passed","Mon Oct 16 05:29:49 UTC 2023","Mon Oct 16 05:30:06 UTC 2023","16798","","Чат","Личный чат","PersonalChatTests","CheckPinLastMessageInPersonalChat","Список чатов - личный чат: можно закреплять сообщения",""
"passed","Mon Oct 16 05:32:48 UTC 2023","Mon Oct 16 05:32:55 UTC 2023","7190","","Дисциплина","Редактирование дисциплины","DisContingentEditingValidationTests","CheckOnlyCohortStudentsAreShownInListOfStudents","Редактирование дисциплины: в выпадающем списке поля Студенты отображаются только студенты потока",""
"passed","Mon Oct 16 05:28:11 UTC 2023","Mon Oct 16 05:28:19 UTC 2023","7556","","Чат","Чат решения","TaskChatTests","CheckSendTextMessageInTaskChat","Список чатов - обсуждение решения: можно отправить текстовое сообщение",""
"passed","Mon Oct 16 05:32:24 UTC 2023","Mon Oct 16 05:32:28 UTC 2023","4490","","Дисциплина","Создание дисциплины","DisContingentCreationValidationTests","CheckOnlyCohortGroupsAreShownInListOfGroups","Создание дисциплины: в выпадающем списке поля Группы отображаются только группы потока",""
"passed","Mon Oct 16 05:32:03 UTC 2023","Mon Oct 16 05:32:11 UTC 2023","7483","","Дисциплина","Страница дисциплины","DisciplineStudentTests","CheckAttendanceByStudent","Страница посещаемости дисциплины: невозможности отметки/снятия посещаемости студентом",""
"passed","Mon Oct 16 05:26:55 UTC 2023","Mon Oct 16 05:27:02 UTC 2023","6548","Активность","Контрольная","Результат прохождения теста","TestActivityResultTests","ClockIconAndTruFalseButtonsAreDisplayed","Результат прохождения: отображается иконка часы, кнопки верно и неверно в вопросах с типом ответа свободный ответ или файл",""
"passed","Mon Oct 16 05:32:30 UTC 2023","Mon Oct 16 05:32:31 UTC 2023","1374","","Подразделения","","DivisionCommonTests","CreateDivisionIfrequiredNotFields","Cоздание подразделения если не заполнено обязательно поле",""
"passed","Mon Oct 16 05:31:12 UTC 2023","Mon Oct 16 05:31:18 UTC 2023","6165","","Дисциплина","Редактирование дисциплины","DisciplineAccessTests","CheckIfSuperAdminChangeDiscipline","Редактирование дисциплины: есть возможность редактировать у суперадминистратора",""
"passed","Mon Oct 16 05:27:34 UTC 2023","Mon Oct 16 05:27:41 UTC 2023","6799","","Активность","Шаблон активности контрольной","TestTemplateEditingTests","SuccessSaveWithCorrectValueNumberOfAttemptsInTestActivityTemplate","Редактирование шаблона контрольной: успешное сохранение при корректных значениях в 'Количество попыток сдачи'",""
"passed","Mon Oct 16 05:31:32 UTC 2023","Mon Oct 16 05:31:36 UTC 2023","4125","","Дисциплина","Редактирование дисциплины","DisciplineEditingValidationTests","CheckIfCreditNotFilled","Редактирование дисциплины: отображение ошибки валидации для поля 'Кредиты' с значением > 15",""
"passed","Mon Oct 16 05:38:16 UTC 2023","Mon Oct 16 05:38:43 UTC 2023","26884","","Чат","Групповой чат","GroupChatTests","CheckFindSentMessageInGroupChat","Список чатов - групповой чат: можно найти отправленное сообщение",""
"passed","Mon Oct 16 05:30:37 UTC 2023","Mon Oct 16 05:30:45 UTC 2023","8565","","Дисциплина","Редактирование дисциплины","DisciplineEditingTests","CheckSetNameField","Редактирование дисциплины: можно изменить название",""
"passed","Mon Oct 16 05:33:51 UTC 2023","Mon Oct 16 05:34:03 UTC 2023","12151","","Материал","Конструктор тест-тренажера","TestTrainBlocksAndVariantsValidationTests","DeleteBlockTestTrain","Конструктор теста-тренажера: можно удалить блок",""
"passed","Mon Oct 16 05:30:46 UTC 2023","Mon Oct 16 05:30:59 UTC 2023","12784","","Дисциплина","Редактирование дисциплины","DisciplineDurationTests","ErrorWhenEndDateLessStartDateInDiscipline","Редактирование дисциплины: наличия ошибки если дата окончания меньше даты начала",""
"passed","Mon Oct 16 05:34:31 UTC 2023","Mon Oct 16 05:34:42 UTC 2023","11795","","Материал","Конструктор тест-тренажера","TestTrainQuestionsValidationTests","EditCommentInTestTrainQuestion","Конструктор теста-тренажера: можно изменить комментарий к вопросу",""
"passed","Mon Oct 16 05:34:51 UTC 2023","Mon Oct 16 05:34:56 UTC 2023","4619","","Программа","","ProgramCreationTests","CreateHighProgramOverviewFields","Cоздание обр программы ДПО: если заполнить только обязательные поля",""
"passed","Mon Oct 16 05:38:39 UTC 2023","Mon Oct 16 05:38:45 UTC 2023","5294","","Дисциплина","Страница дисциплины","DisciplineActivitiesBlockTests","CheckActivityVolumeIsDisplayed","Страница дисциплины: отображается объём ОА",""
"passed","Mon Oct 16 05:25:40 UTC 2023","Mon Oct 16 05:25:44 UTC 2023","4079","","Активность","Задание","TaskWithSolutionStudentTests","CheckEditSolution","Страница решение задания: можно редактировать решения",""
"passed","Mon Oct 16 05:31:38 UTC 2023","Mon Oct 16 05:31:43 UTC 2023","4976","","Дисциплина","Редактирование дисциплины","DisciplineEditingTests","CheckPossibilityTurnOnIOT","Редактирование дисциплины: можно включить/отключить ИОТ, если в дисциплине нет активностей",""
"failed","Mon Oct 16 05:38:17 UTC 2023","Mon Oct 16 05:38:32 UTC 2023","15171","","Чат","Мини-чат группового чата","GroupMiniChatTests+ChatEditing","CheckSendGroupChatToArchiveInMinichat","Миничат - групповой чат: можно отправить чат в архив",""
"passed","Mon Oct 16 05:27:10 UTC 2023","Mon Oct 16 05:27:20 UTC 2023","10116","Активность","Контрольная","Результат прохождения теста","TestActivityResultTests","TeacherCanLeaveCommentOnAnswer","Результат прохождения: преподаватель может изменить комментарий к ответу, если включена опция подробная информация о результатах",""
"passed","Mon Oct 16 05:26:01 UTC 2023","Mon Oct 16 05:26:10 UTC 2023","8479","","Активность","Обычная активность","ActivityEditingTests","CheckClearAddedTagsFromActivity","Редактирование активности: можно очистить теги знаний",""
"passed","Mon Oct 16 05:34:14 UTC 2023","Mon Oct 16 05:34:25 UTC 2023","11553","","Материал","Конструктор теста","TestBlocksAndVariantsValidationTests","CheckAddTestBlock","Конструктор теста: можно добавить блок",""
"passed","Mon Oct 16 05:38:32 UTC 2023","Mon Oct 16 05:38:49 UTC 2023","16523","","Чат","Личный чат","PersonalChatTests","CheckAddNewPersonalChat","Список чатов - личный чат: можно добавить новый чат",""
"passed","Mon Oct 16 05:25:59 UTC 2023","Mon Oct 16 05:26:08 UTC 2023","8504","","Активность","Задание","TaskWithSolutionStudentTests","CheckAbilityToEditAssessmentOfAnotherStudentsSolution","Страница решение задания: можно редактировать поставленную оценку к решении другого студента, если включена 'Взаимопроверка'",""
"passed","Mon Oct 16 05:38:51 UTC 2023","Mon Oct 16 05:38:59 UTC 2023","8068","","Дисциплина","Редактирование дисциплины","DisciplineEditingTests","CheckSetShortnameField","Редактирование дисциплины: можно изменить краткое название, сделав двойной клик по названию дисциплины",""
"passed","Mon Oct 16 05:29:51 UTC 2023","Mon Oct 16 05:30:00 UTC 2023","8982","","Чат","Мини-чат страницы решений","TaskPageMiniChatTests","CheckDeleteMessageInTaskPageMiniChat","Чат на странице решения: можно удалить сообщение",""
"passed","Mon Oct 16 05:29:34 UTC 2023","Mon Oct 16 05:29:40 UTC 2023","6207","","Поток","Редактирование потока","CohortEditingTests","CheckRemoveCohortWithoutDisciplinesAndSemesters","Редактирование потока: можно удалить поток без дисциплин и семестров",""
"passed","Mon Oct 16 05:30:09 UTC 2023","Mon Oct 16 05:30:14 UTC 2023","4796","","Поток","Редактирование потока","CohortEditingValidationTests","CheckIsNotPossibleRemoveCohortInProgramNatDemography","Редактирование потока ДО (СЗ): нет возможности удалить поток",""
"passed","Mon Oct 16 05:31:22 UTC 2023","Mon Oct 16 05:31:50 UTC 2023","28171","","Дисциплина","Страница дисциплины","DisciplineStudentTests","CheckPinDisciplineForStudent","Страница дисциплины: работает закрепление или открепление дисциплины в боковом меню для студента",""
"passed","Mon Oct 16 05:34:57 UTC 2023","Mon Oct 16 05:35:02 UTC 2023","4679","","Программа","","ProgramEditingTests","CheckRemoveEducPaidProgramWithoutCohort","Редактирование программы ДО: можно удалить платную программу без потоков",""
"passed","Mon Oct 16 05:35:07 UTC 2023","Mon Oct 16 05:35:11 UTC 2023","3633","","Программа","","ProgramEditingTests","CheckRemoveProgramWithNationalProject","Редактирование программы ДО: невозможно удалить программу с проектом СЗ",""
"passed","Mon Oct 16 05:27:29 UTC 2023","Mon Oct 16 05:27:40 UTC 2023","11430","","Активность","Шаблон активности контрольной","TestTemplateCreatingTests","CheckExecModeTestActivityTemplate","Создание шаблона контрольной: с режимом выполнения 'Индивидуальный'",""
"passed","Mon Oct 16 05:26:31 UTC 2023","Mon Oct 16 05:26:35 UTC 2023","3703","","Активность","Задание","TaskActivityTeacherTests","CheckSendSolutionForRevision","Страница решение задания: можно отправить решения на доработку",""
"passed","Mon Oct 16 05:35:08 UTC 2023","Mon Oct 16 05:35:15 UTC 2023","6428","","Программа","","ProgramInfoPageTests","CheckWindowsSendEducationProgramToArchive","Страница обр программы: При архивации обр программы появляется модалка подтверждения действия",""
"passed","Mon Oct 16 05:32:54 UTC 2023","Mon Oct 16 05:32:59 UTC 2023","5210","","Библиотека","","LibraryActionPanelTests","CheckFindMaterialByName","Библиотека, плиточный вид: можно найти материал в поиске по названию",""
"passed","Mon Oct 16 05:30:09 UTC 2023","Mon Oct 16 05:30:16 UTC 2023","7343","","Поток","Страница потока","CohortInfoTests","CheckAccessStudentToActivityCohortArchive","Страница потока: после восстановления из архива восстанавливается доступ к активностям",""
"passed","Mon Oct 16 05:32:15 UTC 2023","Mon Oct 16 05:32:21 UTC 2023","5624","","Подразделения","","DivisionCommonTests","CreateDivision","Создать подразделение заполнить только обязательные поля",""
"passed","Mon Oct 16 05:26:10 UTC 2023","Mon Oct 16 05:26:18 UTC 2023","8459","","Активность","Обычная активность","ActivityEditingTests","CheckEditValueScormResultScore","Редактирование активности: можно переключать значения в поле 'Оценка по SCORM результату'",""
"passed","Mon Oct 16 05:38:49 UTC 2023","Mon Oct 16 05:38:55 UTC 2023","6128","","Дисциплина","Создание дисциплины","DisciplineCreationTests","CancelCreatingDiscipline"," Cоздание дисциплины в потоке ДО: работает кнопка 'Отмена'",""
"passed","Mon Oct 16 05:34:22 UTC 2023","Mon Oct 16 05:34:41 UTC 2023","19121","","Материал","Конструктор теста","TestAddingQuestionsTests","CheckAddFileTestQuestion","Конструктор теста: можно добавить вопрос с типом ответа “Файл”",""
"passed","Mon Oct 16 05:32:38 UTC 2023","Mon Oct 16 05:32:54 UTC 2023","15416","","Дисциплина","Редактирование дисциплины","DisContingentEditingTests","CheckAddGroupAndStudentToDiscipline","Редактирование дисциплины: добавления к дисциплине групп и студентов",""
"passed","Mon Oct 16 05:26:38 UTC 2023","Mon Oct 16 05:26:47 UTC 2023","9449","Активность","Контрольная","Результат прохождения теста","TestActivityResultTests","StudentCanViewDetailedResultInfo","Результат прохождения: студент может просматривать подробную информацию о результатах, если включена соответственная опция",""
"passed","Mon Oct 16 05:34:37 UTC 2023","Mon Oct 16 05:34:47 UTC 2023","9954","","Материал","Конструктор тест-тренажера","TestTrainQuestionAnswersValidationTests","CheckAddOneMoreOptionInComparisonTestQuestionInTestTrain","Конструктор теста-тренажера: можно добавить еще один вариант на сопоставление в вопрос с типом ответа 'Сопоставление'",""
"passed","Mon Oct 16 05:28:06 UTC 2023","Mon Oct 16 05:28:14 UTC 2023","8067","","Чат","Групповой чат","GroupChatTests","CheckSendEmptyMessageInGroupChat","Список чатов - групповой чат: невозможно отправить пустое сообщение",""
"passed","Mon Oct 16 05:32:37 UTC 2023","Mon Oct 16 05:32:46 UTC 2023","8612","","Библиотека","","BulkActionsLibraryTests","CheckSelectMultipleItems","Библиотека: можно выбрать несколько элементов",""
"passed","Mon Oct 16 05:27:30 UTC 2023","Mon Oct 16 05:27:37 UTC 2023","7073","","Активность","Обычный шаблон активности","TemplateEditingTests","CheckEditDescriptionActivityTemplate","Редактирование шаблона активности: можно изменить описание",""
"passed","Mon Oct 16 05:31:39 UTC 2023","Mon Oct 16 05:32:00 UTC 2023","20256","","Чат","Групповой чат","GroupChatTests","CheckAddGroupChatWithUsers","Список чатов - групповой чат: можно добавить новый чат для групп и студентов",""
"passed","Mon Oct 16 05:30:08 UTC 2023","Mon Oct 16 05:30:16 UTC 2023","7759","","Чат","Дисциплина","DisciplineChatTests","CheckSwitchToAnotherDisciplineChatRoom","Список чатов - комната дисциплины: можно переключать комнаты",""
"passed","Mon Oct 16 05:25:56 UTC 2023","Mon Oct 16 05:25:59 UTC 2023","3085","","Активность","Задание","TaskWithSolutionStudentTests","CheckAbilityToSeeListSolutions","Страница решение задания: можно просмотреть список всех решений, если включена 'Решения открыты всем'",""
"passed","Mon Oct 16 05:27:06 UTC 2023","Mon Oct 16 05:27:16 UTC 2023","10256","Активность","Контрольная","Прохождение теста","TestActivityStatusWithOneAttemptTests","StatusIsPendingReviewForAttemptsNeedsReview","Страница командной контрольной: статус ожидает проверки, если в попытке есть хотя бы один вопрос, требующий проверки",""
"passed","Mon Oct 16 05:31:10 UTC 2023","Mon Oct 16 05:31:19 UTC 2023","8824","","Дисциплина","Страница дисциплины","DisciplineAnalyticsTests","CheckExpandFiltersOfAnalyticsTable","Страница аналитика дисциплины: можно раскрывать фильтры таблицы аналитики",""
"passed","Mon Oct 16 05:32:21 UTC 2023","Mon Oct 16 05:32:29 UTC 2023","8445","","Библиотека","","LibraryActionPanelTests","CheckCreateCatalog","Библиотека, плиточный вид: можно создать каталог",""
"passed","Mon Oct 16 05:24:59 UTC 2023","Mon Oct 16 05:25:19 UTC 2023","19619","","Активность","Обычная активность","ActivityEditingFormatTests","CheckActivityFormatIsOffline","Редактирование активности: проверка формата активности офлайн",""
"passed","Mon Oct 16 05:30:10 UTC 2023","Mon Oct 16 05:30:12 UTC 2023","2629","","Поток","Завершение обучения","EducationCompletionPageTests","FindStudentWithName","Поиск студента по ФИО на странице завершения обучения потока",""
"passed","Mon Oct 16 05:28:58 UTC 2023","Mon Oct 16 05:29:11 UTC 2023","12644","","Чат","Мини-чат страницы решений","TaskPageMiniChatTests","CheckAddQuoteToLastMessageInTaskPageMiniChat","Чат на странице решения: можно цитировать сообщению",""
"passed","Mon Oct 16 05:35:20 UTC 2023","Mon Oct 16 05:35:37 UTC 2023","16479","","Профиль","","AddressAndContactsEditingTests","CheckCountryField","Редактирование профиля пользователя: можно изменить страну",""
"passed","Mon Oct 16 05:26:52 UTC 2023","Mon Oct 16 05:26:58 UTC 2023","5901","Активность","Контрольная","Редактирование контрольной","TestActivityEditingTests","SuccessSaveWithPositiveValueTimeLimitInTestActivity","Редактирование контрольной: успешное сохранение при положительных значениях в поле 'Временной лимит'",""
"passed","Mon Oct 16 05:27:25 UTC 2023","Mon Oct 16 05:27:35 UTC 2023","10697","Активность","Контрольная","Прохождение теста","TestActivityStatusWithOneAttemptTests","CheckStatusScoreColorAndIcon","Страница индивидуальной контрольной: статус и цвет у количества баллов в попытке различаются в зависимости от успешности",""
"passed","Mon Oct 16 05:27:55 UTC 2023","Mon Oct 16 05:28:08 UTC 2023","13242","","Активность","Шаблон активности контрольной","TestTemplateAddingTests","CheckAddTextMaterialToTestActivityTemplate","Редактирование шаблона контрольной: можно добавить материал типа текст из библиотеки",""
"passed","Mon Oct 16 05:33:52 UTC 2023","Mon Oct 16 05:34:03 UTC 2023","11385","","Библиотека","","LibraryInTileViewTests","CheckRemoveMaterialInTileView","Библиотека, плиточный вид: можно удалить материал",""
"passed","Mon Oct 16 05:28:53 UTC 2023","Mon Oct 16 05:29:02 UTC 2023","9047","","Чат","Чат решения","TaskChatTests","CheckSendEmojiInTaskChat","Список чатов - обсуждение решения: можно отправить смайлики",""
"passed","Mon Oct 16 05:29:16 UTC 2023","Mon Oct 16 05:29:18 UTC 2023","1515","","Поток","Создание потока","CohortCreationValidationTests","CheckCreateCohortBySelectingCheckboxRegistrationLinkInProgramNatDemography","Создание потока ДО (СЗ): нет возможности выбрать галку ‘Разрешена регистрация по ссылке’",""
"passed","Mon Oct 16 05:31:32 UTC 2023","Mon Oct 16 05:31:36 UTC 2023","3807","","Дисциплина","Страница дисциплины","DisciplineRightMenuTests","CheckEditButtonForTeacher","Страница дисциплины: работает кнопка 'Редактировать' для преподавателя",""
"passed","Mon Oct 16 05:31:09 UTC 2023","Mon Oct 16 05:31:17 UTC 2023","8432","","Дисциплина","Редактирование дисциплины","DisciplineDurationTests","CheckIfStartDateEmptyInDiscipline","Редактирование дисциплины: наличия ошибки если поле дата начала пустое",""
"passed","Mon Oct 16 05:30:33 UTC 2023","Mon Oct 16 05:30:59 UTC 2023","25890","","Дисциплина","Страница дисциплины","DisciplineAnalyticsTests","CheckExportDisciplineAnalytics","Страница аналитика дисциплины: работает экспорт аналитики дисциплины",""
"passed","Mon Oct 16 05:27:40 UTC 2023","Mon Oct 16 05:27:52 UTC 2023","12024","","Активность","Шаблон активности контрольной","TestTemplateCreatingTests","CheckExecModeTestActivityTemplate","Создание шаблона контрольной: с режимом выполнения 'Командный'",""
