"Status","Start Time","Stop Time","Duration in ms","Parent Suite","Suite","Sub Suite","Test Class","Test Method","Name","Description"
"passed","Thu Nov 16 06:10:56 UTC 2023","Thu Nov 16 06:11:02 UTC 2023","6348","","Чат","Дисциплина","DisciplineChatTests","CheckSendFileMessageInDisciplineChat","Список чатов - комната дисциплины: можно прикрепить и отправить файл с компьютера",""
"passed","Thu Nov 16 06:19:30 UTC 2023","Thu Nov 16 06:19:32 UTC 2023","1863","Активность","Контрольная","Редактирование контрольной","TestActivityEditingTests","CheckExecutionModeFieldIsNotClickable","Поле Режим выполнения некликабельно",""
"passed","Thu Nov 16 06:08:40 UTC 2023","Thu Nov 16 06:08:58 UTC 2023","17636","","Активность","Обычная активность","ActivityAddingTests","CheckRemoveMaterialActivity","Редактирование активности: можно удалять материалы",""
"passed","Thu Nov 16 06:17:04 UTC 2023","Thu Nov 16 06:17:08 UTC 2023","3707","","Профиль","","UserInfoPageTests","CheckBlockOfPassedActivitiesAreDisplayedForTeacher","Страница профиля пользователя: под преподавателем отображаются пройденные активности студента",""
"passed","Thu Nov 16 06:13:15 UTC 2023","Thu Nov 16 06:13:25 UTC 2023","10160","","Подразделения","Создание подразделения","DivisionCreationTests","CheckCreateDivisionWithFillingAllFields","Можно создать подразделение, если заполнены все поля",""
"passed","Thu Nov 16 06:12:25 UTC 2023","Thu Nov 16 06:12:28 UTC 2023","3143","","Дисциплина","Редактирование дисциплины","DisciplineEditingValidationTests","CheckIfNameNotFilledInEditing","Редактирование дисциплины: отображение ошибки валидации для поля 'Название', если поле не заполнено",""
"passed","Thu Nov 16 06:12:59 UTC 2023","Thu Nov 16 06:13:09 UTC 2023","10759","","Дисциплина","Страница дисциплины","DisciplineAnalyticsTests","CheckResetButton","Страница аналитика дисциплины: работает кнопка “Сбросить”",""
"passed","Thu Nov 16 06:07:50 UTC 2023","Thu Nov 16 06:07:54 UTC 2023","4359","","Активность","Обычный шаблон активности","TemplateEditingTests","CheckEditActivityTemplate","Редактирование шаблона активности: работает кнопка 'Редактировать' для преподавателя",""
"passed","Thu Nov 16 06:08:26 UTC 2023","Thu Nov 16 06:08:34 UTC 2023","7461","Активность","Контрольная","Редактирование контрольной","TestActivityEditingTests","CheckErrorInNumOfAttemptsFieldWithIncorrectValue","Ошибка валидации в поле Количество попыток сдачи, если введено отрицательное значение",""
"failed","Thu Nov 16 06:19:46 UTC 2023","Thu Nov 16 06:19:46 UTC 2023","326","","Активность","Обычный шаблон активности","TemplateAddingTests","CheckAddTestTrainTypeMaterialToActivityPlan","Можно добавить материал типа Тест-тренажёра из Библиотеки в шаблон","
SetUp SetUp method failed
"
"passed","Thu Nov 16 06:16:50 UTC 2023","Thu Nov 16 06:16:54 UTC 2023","3817","","Профиль","","UserInfoPageTests","CheckStudentCanOpenPageOfPassedActivities","Страница профиля пользователя: под студентом можно перейти на страницу пройденных активностей",""
"passed","Thu Nov 16 06:12:12 UTC 2023","Thu Nov 16 06:12:24 UTC 2023","12404","","Дисциплина","Редактирование дисциплины","DisciplineAccessTests","CheckOrgAdminChangeDiscipline","Редактирование дисциплины: есть возможность редактировать у администратора организации, к которому дисциплина относится",""
"passed","Thu Nov 16 06:13:52 UTC 2023","Thu Nov 16 06:14:03 UTC 2023","10586","","Библиотека","","BulkActionsLibraryTests","CheckCancelSelectedItems","Библиотека: можно отменить режим выбора, нажав на кнопку “Отмена” или сняв отметки с выбранных элементов",""
"passed","Thu Nov 16 06:09:51 UTC 2023","Thu Nov 16 06:09:59 UTC 2023","7704","Активность","Контрольная","Результат прохождения теста","TestActivityResultTests","CheckMarkIncorrectTextOrFileAnswer","Результат прохождения: можно отметить 'Не верно' ответ вопроса с типом ответа свободный ответ или файл",""
"passed","Thu Nov 16 06:16:10 UTC 2023","Thu Nov 16 06:16:12 UTC 2023","2353","","Организация","Страница организации","OrganizationPageTests","CheckTransitionToOrgEditPage","Страница организации: работает кнопка Редактировать",""
"passed","Thu Nov 16 06:15:39 UTC 2023","Thu Nov 16 06:15:49 UTC 2023","10406","","Организация","Мой тариф","MyPlanOrganizationPageTests","CheckOpenMyPlanPageFromOrganizationPage","Страница организации: переход на страницу Мой тариф",""
"passed","Thu Nov 16 06:07:12 UTC 2023","Thu Nov 16 06:07:19 UTC 2023","6828","","Активность","Обычная активность","ActivityEditingTests","CheckAddTagInActivity","Редактирование активности: можно добавлять теги знаний",""
"passed","Thu Nov 16 06:13:55 UTC 2023","Thu Nov 16 06:13:58 UTC 2023","2286","","Подразделения","Страница подразделения","DivisionPageTests","CheckProjectLabelIsDisplayedForAdditionalPrograms","Лейбл образовательного проекта отображается под названием программы ДО",""
"passed","Thu Nov 16 06:11:46 UTC 2023","Thu Nov 16 06:11:54 UTC 2023","7268","","Дисциплина","Страница дисциплины","DisciplineAnalyticsTests","CheckDisciplineAnalyticsIsOpen","Страница аналитика дисциплины: при переходе на вкладку “Аналитика” открывается аналитика дисциплины",""
"passed","Thu Nov 16 06:08:22 UTC 2023","Thu Nov 16 06:08:40 UTC 2023","17527","","Активность","Обычная активность","ActivityAddingTests","CheckAddTestTrainToActivity","Можно добавить материал типа Тест-тренажёра из Библиотеки в активность",""
"passed","Thu Nov 16 06:12:15 UTC 2023","Thu Nov 16 06:12:21 UTC 2023","6034","","Дисциплина","Страница дисциплины","DisciplineAnalyticsTests","CheckOpenNotificationMailingListFromAnalytics","Страница аналитика дисциплины: можно перейти в рассылку уведомлений",""
"passed","Thu Nov 16 06:06:55 UTC 2023","Thu Nov 16 06:07:02 UTC 2023","7144","","Активность","Обычная активность","ActivityEditingTests","CheckEditTypeActivity","Редактирование активности: можно переключать значения в поле 'Тип активности'",""
"passed","Thu Nov 16 06:14:46 UTC 2023","Thu Nov 16 06:14:55 UTC 2023","8631","","Материал","Конструктор теста","TestSettingsValidationTests","AddAuthorInTest","Конструктор теста: можно добавить автора",""
"passed","Thu Nov 16 06:08:33 UTC 2023","Thu Nov 16 06:08:47 UTC 2023","13200","Активность","Контрольная","Прохождение теста","TestActivityStatusWithOneAttemptTests","NoStatusWithOneIncompleteAttempt","Страница индивидуальной контрольной: отсутствует статус и иконка для одной незавершенной попыткой",""
"passed","Thu Nov 16 06:13:07 UTC 2023","Thu Nov 16 06:13:10 UTC 2023","2851","","Дисциплина","Редактирование дисциплины","DisciplineEditingTests","CheckCancelButtonWork","Редактирование дисциплины: работает кнопка Отмена",""
"passed","Thu Nov 16 06:08:48 UTC 2023","Thu Nov 16 06:08:58 UTC 2023","9450","Активность","Контрольная","Редактирование контрольной","TestActivityEditingTests","CheckEditScoreValueInControlTypeActivity","Можно переключать значения в поле Оценка в контрольной",""
"passed","Thu Nov 16 06:07:21 UTC 2023","Thu Nov 16 06:07:31 UTC 2023","10138","","Активность","Задание","TaskActivityCreatingTests","CheckCreateTaskIfMinThresholdNotFilled","Нельзя создать задание, если поле 'Минимальный порог баллов' не заполнено",""
"passed","Thu Nov 16 06:07:05 UTC 2023","Thu Nov 16 06:07:10 UTC 2023","4948","","Активность","Задание","TaskActivityTeacherTests","CheckSetIndividualDate","Можно установить индивидуальный срок сдачи",""
"passed","Thu Nov 16 06:11:11 UTC 2023","Thu Nov 16 06:11:13 UTC 2023","2476","","Чат","Личный чат","PersonalChatTests","CheckOpenImageInPersonalChat","Список чатов - личный чат: можно раскрывать изображения",""
"passed","Thu Nov 16 06:09:20 UTC 2023","Thu Nov 16 06:09:25 UTC 2023","5230","","Активность","Шаблон активности контрольной","TestTemplateEditingTests","CheckErrorInEditingNumOfAttemptsWithIncorrectValue","Ошибка валидации в поле Количество попыток сдачи, если введено значение 0",""
"passed","Thu Nov 16 06:11:33 UTC 2023","Thu Nov 16 06:11:39 UTC 2023","5832","","Чат","Групповой чат","GroupChatTests","CheckChangeGroupChatName","Список чатов - групповой чат: можно изменить название чата",""
"passed","Thu Nov 16 06:09:09 UTC 2023","Thu Nov 16 06:09:14 UTC 2023","4639","Активность","Контрольная","Редактирование контрольной","TestActivityEditingTests","CheckErrorInMinThresholdFieldWithIncorrectValue","Ошибка валидации в поле Минимальный порог баллов, если введено отрицательное значение",""
"passed","Thu Nov 16 06:11:27 UTC 2023","Thu Nov 16 06:11:35 UTC 2023","7455","","Поток","Создание потока","CohortCreationTests","CheckCreateCohortByFillingMaxNumberOfStudents","Создание потока: можно создать поток, заполнив поле ‘Максимальное количество студентов’",""
"passed","Thu Nov 16 06:16:33 UTC 2023","Thu Nov 16 06:16:40 UTC 2023","6896","","Профиль","","AddressAndContactsEditingTests","CheckCityField","Редактирование профиля пользователя: можно изменить город",""
"passed","Thu Nov 16 06:07:10 UTC 2023","Thu Nov 16 06:07:15 UTC 2023","5250","","Активность","Задание","TaskActivityTeacherTests","CheckGradeSolutionWithZeroValue","Можно оценить решения значением '0'",""
"passed","Thu Nov 16 06:09:06 UTC 2023","Thu Nov 16 06:09:22 UTC 2023","15853","Активность","Контрольная","Страница контрольной","TestCommandActivityTests","CheckEditTeamInCommandControlActivity","Можно редактировать команду в командной контрольной",""
"passed","Thu Nov 16 06:07:36 UTC 2023","Thu Nov 16 06:07:47 UTC 2023","10882","","Активность","Обычный шаблон активности","TemplateAddingTests","CheckAddFileTypeMaterialToActivityPlan","Можно загрузить материал типа Файл с компьютера в шаблон",""
"passed","Thu Nov 16 06:14:42 UTC 2023","Thu Nov 16 06:14:48 UTC 2023","5506","","Дисциплина","Редактирование дисциплины","DisContingentEditingTests","CheckCreateDisciplineByUncheckingBoxAllCohortStudents","Редактирование дисциплины: есть возможность сохранить дисциплину сняв галку ‘Все студенты потока’",""
"passed","Thu Nov 16 06:19:51 UTC 2023","Thu Nov 16 06:20:04 UTC 2023","13109","","Библиотека","","LibraryInTileViewTests","CheckRenameMaterialInTileView","Библиотека, плиточный вид: можно переименовать материал",""
"passed","Thu Nov 16 06:16:36 UTC 2023","Thu Nov 16 06:16:50 UTC 2023","14622","","Расписание","","ScheduleTests","CheckClickabilityOfTodayButton","Проверка кликабельности кнопки Сегодня, если выбрана не сегодняшняя дата",""
"passed","Thu Nov 16 06:06:51 UTC 2023","Thu Nov 16 06:07:03 UTC 2023","11759","","Активность","Обычная активность","ActivityAddingTests","CheckAddFileMaterialToActivity","Можно загрузить материал типа Файл с компьютера в активность",""
"passed","Thu Nov 16 06:14:00 UTC 2023","Thu Nov 16 06:14:09 UTC 2023","9667","","Материал","Конструктор теста","TestCreationTests","TestCreation","Конструктор теста: создание теста",""
"passed","Thu Nov 16 06:06:59 UTC 2023","Thu Nov 16 06:07:09 UTC 2023","9385","","Активность","Обычная активность","ActivityEditingFormatTests","CheckActivityFormatIsHybrid","Редактирование активности: проверка формата активности гибрид",""
"passed","Thu Nov 16 06:11:51 UTC 2023","Thu Nov 16 06:11:57 UTC 2023","6423","","Чат","Дисциплина","DisciplineChatTests","CheckMembersOfDisciplineChatIsDisplayed","Список чатов - комната дисциплины: отображаются участники чата при клике на блок с аватарками",""
"passed","Thu Nov 16 06:12:33 UTC 2023","Thu Nov 16 06:12:51 UTC 2023","17111","","Дисциплина","Создание дисциплины","DisContingentCreationTests","CheckAddTeacherByUserInfoInCreation","Создание дисциплины: добавление преподавателя по email’у",""
"passed","Thu Nov 16 06:10:07 UTC 2023","Thu Nov 16 06:10:21 UTC 2023","14599","","Чат","Чат для заметок","NotesChatTests","CheckEditLastMessageInNotesChat","Список чатов - чат для заметок: можно редактировать сообщение в течение 4 часов после отправки",""
"passed","Thu Nov 16 06:19:13 UTC 2023","Thu Nov 16 06:19:23 UTC 2023","10265","","Активность","Обычный шаблон активности","TemplateEditingTests","CheckEditTypeActivityTemplate","Редактирование шаблона активности: можно переключать значения в поле 'Тип активности'",""
"passed","Thu Nov 16 06:11:13 UTC 2023","Thu Nov 16 06:11:20 UTC 2023","6616","","Чат","Личный чат","PersonalChatTests","CheckSendMessageByTappingEnterInPersonalChat","Список чатов - личный чат: можно отправить сообщения по нажатию на Enter",""
"passed","Thu Nov 16 06:11:39 UTC 2023","Thu Nov 16 06:11:53 UTC 2023","13875","","Чат","Групповой чат","GroupChatTests","CheckSendGroupChatToArchive","Список чатов - групповой чат: можно отправить чат в архив",""
"passed","Thu Nov 16 06:12:35 UTC 2023","Thu Nov 16 06:12:43 UTC 2023","8050","","Дисциплина","Создание дисциплины","DisContingentCreationValidationTests","CheckUnableAddGroupFromAnotherCohortInCreation","Создание дисциплины: невозможно добавить группу из стороннего потока",""
"passed","Thu Nov 16 06:07:07 UTC 2023","Thu Nov 16 06:07:12 UTC 2023","5342","","Активность","Обычная активность","ActivityEditingTests","CheckEditDescriptionActivity","Редактирование активности: можно изменить описание",""
"passed","Thu Nov 16 06:14:49 UTC 2023","Thu Nov 16 06:14:57 UTC 2023","8455","","Материал","Конструктор теста","TestQuestionsValidationTests","CheckAndUncheckAnswerOptionInTest","Конструктор теста: возможность отметить вариант ответа как “верный”",""
"passed","Thu Nov 16 06:11:18 UTC 2023","Thu Nov 16 06:11:25 UTC 2023","7032","","Чат","Мини-чат страницы решений","TaskPageMiniChatTests","CheckSendMessageByTappingEnterInTaskPageMiniChat","Чат на странице решения: можно отправить сообщения по нажатию на Enter",""
"passed","Thu Nov 16 06:15:50 UTC 2023","Thu Nov 16 06:15:51 UTC 2023","1203","","Организация","Мой тариф","MyPlanOrganizationPageTests","CheckOpenTableActiveUsers","Страница Мой тариф: проверка открытия таблицы активных пользователей",""
"passed","Thu Nov 16 06:10:38 UTC 2023","Thu Nov 16 06:10:45 UTC 2023","6126","","Поток","Создание потока","CohortCreationValidationTests","CheckCreateCohortIfStartDateGreaterThanEndDate","Создание потока: ошибка валидации, если дата начала больше чем дата окончания",""
"passed","Thu Nov 16 06:14:03 UTC 2023","Thu Nov 16 06:14:08 UTC 2023","4484","","Библиотека","","LibraryActionPanelTests","CheckFindMaterialsByType","Библиотека, плиточный вид: работает поиск по типу материала",""
"passed","Thu Nov 16 06:07:41 UTC 2023","Thu Nov 16 06:07:43 UTC 2023","1882","","Активность","Задание","TaskWithSolutionStudentTests","CheckImpossibilityToEditAnotherStudentsSolutionGrade","Нет возможности оценить решения другого студента, если не включена 'Взаимопроверка'",""
"passed","Thu Nov 16 06:16:08 UTC 2023","Thu Nov 16 06:16:15 UTC 2023","6283","","Материал","Конструктор тест-тренажера","TestTrainQuestionAnswersValidationTests","CheckRemoveAnswerFromFreeAnswerExactMatchQuestionInTestTrain","Конструктор теста-тренажера: можно удалить вариант ответа из вопроса с типом ответа 'Свободный ответ' – 'Точное совпадение'",""
"passed","Thu Nov 16 06:09:31 UTC 2023","Thu Nov 16 06:09:37 UTC 2023","6453","","Активность","Шаблон активности контрольной","TestTemplateEditingTests","CheckSuccessEditingNumOfAttemptsWithCorrectValue","Успешное сохранение при корректных значениях в поле Количество попыток сдачи",""
"passed","Thu Nov 16 06:11:45 UTC 2023","Thu Nov 16 06:11:58 UTC 2023","12413","","Дисциплина","Страница дисциплины","DisciplineActivitiesBlockTests","CheckAddModuleInDiscipline","Страница дисциплины: создание модуля",""
"passed","Thu Nov 16 06:11:50 UTC 2023","Thu Nov 16 06:11:54 UTC 2023","4080","","Дисциплина","Редактирование дисциплины","DisciplineAccessTests","CheckIfOtherAdminEducProgChangeDiscipline","Редактирование дисциплины: нет возможности редактировать у администратора образовательной программы, к которой дисциплина НЕ относится",""
"passed","Thu Nov 16 06:11:02 UTC 2023","Thu Nov 16 06:11:11 UTC 2023","8737","","Чат","Групповой чат","GroupChatTests","CheckAddReactionToLastMessageInGroupChat","Список чатов - групповой чат: можно добавить реакцию на сообщение",""
"passed","Thu Nov 16 06:07:33 UTC 2023","Thu Nov 16 06:07:41 UTC 2023","8121","","Активность","Задание","TaskWithSolutionStudentTests","CheckAbilityToEditAssessmentOfAnotherStudentsSolution","Можно редактировать поставленную оценку к решении другого студента, если включена 'Взаимопроверка'",""
"passed","Thu Nov 16 06:15:52 UTC 2023","Thu Nov 16 06:15:56 UTC 2023","3248","","Организация","Страница организации","OrganizationPageTests","CheckTooltipIsDisplayedByHoverProjectIcon","Страница организации: отображается тултип при наведении на иконку участника проекта",""
"passed","Thu Nov 16 06:11:53 UTC 2023","Thu Nov 16 06:11:59 UTC 2023","5862","","Чат","Групповой чат","GroupChatTests","CheckRestoreGroupChatFromArchive","Список чатов - групповой чат: можно восстановить чат из архива",""
"passed","Thu Nov 16 06:16:15 UTC 2023","Thu Nov 16 06:16:20 UTC 2023","5851","","Материал","Конструктор тест-тренажера","TestTrainQuestionAnswersValidationTests","CheckRemoveAnswerFromComparisionQuestionInTestTrain","Конструктор теста-тренажера: можно удалить один вариант на сопоставление из вопроса с типом ответа ‘Сопоставление’",""
"passed","Thu Nov 16 06:11:33 UTC 2023","Thu Nov 16 06:11:42 UTC 2023","8350","","Чат","Мини-чат страницы решений","TaskPageMiniChatTests","CheckDeleteMessageInTaskPageMiniChat","Чат на странице решения: можно удалить сообщение",""
"passed","Thu Nov 16 06:14:32 UTC 2023","Thu Nov 16 06:14:38 UTC 2023","6646","","Материал","Конструктор теста","TestQuestionsValidationTests","CheckRemoveCommentInTestQuestion","Конструктор теста: можно удалить комментария к вопросу",""
"passed","Thu Nov 16 06:07:15 UTC 2023","Thu Nov 16 06:07:23 UTC 2023","8197","","Активность","Задание","TaskActivityTeacherTests","CheckGradeSolutionValueAboveAndBelowScore","Можно оценить решения значением выше минимального порога баллов",""
"passed","Thu Nov 16 06:12:52 UTC 2023","Thu Nov 16 06:12:54 UTC 2023","2478","","Дисциплина","Создание дисциплины","DisContingentCreationValidationTests","CheckIsDisabledCheckboxAllStudentInCreatingDiscipline","Создание дисциплины (СЗ): галка ‘Все студенты потока’ дизаблена и невозможно его снять",""
"skipped","Thu Nov 16 06:19:53 UTC 2023","Thu Nov 16 06:19:54 UTC 2023","349","","Библиотека","","LibraryMaterialTests","CheckVisibilityOfLaTeXMaterialPage","Страница материала: проверка отображения LaTeX материала",""
"passed","Thu Nov 16 06:12:10 UTC 2023","Thu Nov 16 06:12:18 UTC 2023","7557","","Дисциплина","Редактирование дисциплины","DisciplineDurationTests","ErrorWhenEndDateLessStartDateInDiscipline","Редактирование дисциплины: наличия ошибки если дата окончания меньше даты начала",""
"passed","Thu Nov 16 06:11:26 UTC 2023","Thu Nov 16 06:11:28 UTC 2023","2200","","Поток","Завершение обучения","EducationCompletionPageTests","FindStudentWithName","Поиск студента по ФИО на странице завершения обучения потока",""
"passed","Thu Nov 16 06:13:28 UTC 2023","Thu Nov 16 06:13:48 UTC 2023","19300","","Библиотека","","LibraryInListViewTests","CheckMoveMaterialToCatalogInListView","Библиотека, списочный вид: можно переместить материал в другой каталог",""
"passed","Thu Nov 16 06:11:27 UTC 2023","Thu Nov 16 06:11:43 UTC 2023","15546","","Чат","Личный чат","PersonalChatTests","CheckPinLastMessageInPersonalChat","Список чатов - личный чат: можно закреплять сообщения",""
