"Status","Start Time","Stop Time","Duration in ms","Parent Suite","Suite","Sub Suite","Test Class","Test Method","Name","Description"
"passed","Thu Sep 21 16:53:53 UTC 2023","Thu Sep 21 16:53:59 UTC 2023","6638","","Программа","","ProgramInfoPageTests","CheckNoAccessStudentToMaterialsEducationalProgramArchive","Страница обр программы: Студенты не имеют доступ к материалам архивной обр программы по прямой ссылки ",""
"passed","Thu Sep 21 16:50:10 UTC 2023","Thu Sep 21 16:50:16 UTC 2023","6356","","Дисциплина","Редактирование дисциплины","DisciplineEditingTests","CheckSwitchLanguage","Редактирование дисциплины: можно переключать значения в поле 'Язык'",""
"passed","Thu Sep 21 16:50:50 UTC 2023","Thu Sep 21 16:51:00 UTC 2023","10394","","Дисциплина","Редактирование дисциплины","DisContingentEditingValidationTests","CheckAddStudentFromGroupInTeachersField","Редактирование дисциплины: наличия ошибки при попытке указать преподавателем студента из группы",""
"passed","Thu Sep 21 16:51:42 UTC 2023","Thu Sep 21 16:51:58 UTC 2023","15861","","Библиотека","","RemovingTemplatesTests","CheckDeleteProgramTemplateFromWhichCohortIsCreated","Страница библиотеки: можно удалить шаблон программы по которому был создан поток",""
"passed","Thu Sep 21 16:52:03 UTC 2023","Thu Sep 21 16:52:14 UTC 2023","10930","","Материал","Конструктор теста","TestBlocksAndVariantsValidationTests","CheckRemoveTestVariant","Конструктор теста: можно удалить вариант",""
"passed","Thu Sep 21 16:44:26 UTC 2023","Thu Sep 21 16:44:33 UTC 2023","7149","","Активность","Обычная активность","ActivityEditingTests","CheckEditActivity","Редактирование активности: работает кнопка 'Редактировать' для преподавателя",""
"passed","Thu Sep 21 16:53:53 UTC 2023","Thu Sep 21 16:54:04 UTC 2023","11942","","Расписание","","ScheduleSettingsTests","SyncGoogleCalendar","Страница расписания: проверка подключения синхронизации с google календарем",""
"passed","Thu Sep 21 16:49:19 UTC 2023","Thu Sep 21 16:49:24 UTC 2023","4558","","Дисциплина","Редактирование дисциплины","DisciplineAccessTests","CheckIfOtherTeacherChangeDiscipline","Редактирование дисциплины: нет возможности редактировать у преподавателя другой дисциплины",""
"passed","Thu Sep 21 16:53:56 UTC 2023","Thu Sep 21 16:54:04 UTC 2023","8778","","Материал","Конструктор тест-тренажера","TestTrainQuestionAnswersValidationTests","RemoveAnswerFromQuestionInTestTrain","Конструктор теста-тренажера: можно удалить вариант ответа из вопроса с типом ответа 'Выбор из вариантов'",""
"passed","Thu Sep 21 16:49:18 UTC 2023","Thu Sep 21 16:49:23 UTC 2023","5066","","Дисциплина","Настройка чата дисциплины","DisciplineChatBlockTests","CheckChatMissingFromList","Страница чата: отсутствия блокированного чата в списке чатов",""
"passed","Thu Sep 21 16:55:08 UTC 2023","Thu Sep 21 16:55:38 UTC 2023","29718","","Библиотека","","BulkActionsLibraryTests","CheckConfirmModalIsAppearWhenRemovingSelectedItems","Библиотека: при попытке удалить выбранных элементов отображается модалка подтверждения",""
"passed","Thu Sep 21 16:49:49 UTC 2023","Thu Sep 21 16:49:52 UTC 2023","2686","","Поток","","CohortEditingValidationTests","CheckIsNotPossibleRemoveCohortWithSemestersOrDisciplines","Редактирование потока: нет возможности удалить поток, если есть хотя бы одна дисциплина или семестр",""
"passed","Thu Sep 21 16:59:32 UTC 2023","Thu Sep 21 17:00:39 UTC 2023","66948","","Библиотека","","BulkActionsLibraryTests","CheckMoveMultipleSelectedItemsToAnotherDirectory","Библиотека: можно переместить несколько выбранных элементов в другой каталог",""
"passed","Thu Sep 21 16:52:53 UTC 2023","Thu Sep 21 16:53:02 UTC 2023","9547","","Материал","Конструктор тест-тренажера","TestTrainBlocksAndVariantsValidationTests","EditTestTrainBlockName","Конструктор теста-тренажера: можно переименовать блок",""
"passed","Thu Sep 21 16:54:25 UTC 2023","Thu Sep 21 16:54:28 UTC 2023","3321","","Профиль","","AddressAndContactsEditingTests","CheckBlockContactFieldsBeforeInterPassword","Редактирование профиля пользователя: поля 'Контакты' заблокированы до ввода пароля",""
"passed","Thu Sep 21 16:54:02 UTC 2023","Thu Sep 21 16:54:15 UTC 2023","13426","","Материал","Конструктор тест-тренажера","TestTrainQuestionsValidationTests","CheckAndUncheckAnswerOptionInTestTrain","Конструктор теста-тренажера: возможность снять отметку “верный” у варианта ответа",""
"passed","Thu Sep 21 16:53:02 UTC 2023","Thu Sep 21 16:53:16 UTC 2023","13465","","Материал","Конструктор тест-тренажера","TestTrainBlocksAndVariantsValidationTests","AddBlockTestTrain","Конструктор теста-тренажера: можно добавить блок",""
"passed","Thu Sep 21 16:44:33 UTC 2023","Thu Sep 21 16:44:40 UTC 2023","6306","","Активность","Задание","TaskWithoutSolutionStudentTests","CheckSendTextSolution","Страница решение задания: можно отправить текстовый ответ",""
"passed","Thu Sep 21 16:51:42 UTC 2023","Thu Sep 21 16:51:57 UTC 2023","14694","","Библиотека","","LibraryInListViewTests","CheckRenameMaterialInListView","Библиотека, списочный вид: можно переименовать материал",""
"passed","Thu Sep 21 16:54:04 UTC 2023","Thu Sep 21 16:54:12 UTC 2023","7083","","Расписание","","ScheduleSettingsTests","DisconnectWithSyncGoogleCalendar","Страница расписания: проверка отключения синхронизации с google календарем",""
"passed","Thu Sep 21 16:59:31 UTC 2023","Thu Sep 21 16:59:36 UTC 2023","5801","","Поток","","CohortInfoTests","CheckWindowsRestoreCohortArchive","Страница потока: При восстановлении из архива потока появляется модалка подтверждения действия",""
"passed","Thu Sep 21 16:49:12 UTC 2023","Thu Sep 21 16:49:21 UTC 2023","8351","","Чат","Групповой чат","GroupChatTests","CheckDeleteMessageInGroupChat","Список чатов - групповой чат: можно удалить сообщение",""
"passed","Thu Sep 21 16:44:57 UTC 2023","Thu Sep 21 16:45:09 UTC 2023","12738","","Активность","Обычная активность","ActivityAddingTests","CheckAddTestNotInControlTypeActivity","Редактирование активности: наличия ошибки при добавлении теста из библиотеки не в контрольную",""
"passed","Thu Sep 21 16:50:02 UTC 2023","Thu Sep 21 16:50:11 UTC 2023","8523","","Дисциплина","Страница дисциплины","DisciplineAnalyticsTests","CheckExpandFiltersOfAnalyticsTable","Страница аналитика дисциплины: можно раскрывать фильтры таблицы аналитики",""
"passed","Thu Sep 21 16:46:58 UTC 2023","Thu Sep 21 16:47:00 UTC 2023","2469","Активность","Контрольная","Редактирование контрольной","TestActivityEditingTests","ErrorWhenDeletingTestActivityWithAttempts","Редактирование контрольной: невозможно удалить контрольную при наличии оценок",""
"passed","Thu Sep 21 16:50:12 UTC 2023","Thu Sep 21 16:50:26 UTC 2023","14702","","Дисциплина","Создание дисциплины","DisContingentCreationTests","CheckAddTeacherByUserInfoInCreation","Создание дисциплины: добавление преподавателя по email’у",""
"passed","Thu Sep 21 16:46:09 UTC 2023","Thu Sep 21 16:46:11 UTC 2023","1896","","Активность","Обычный шаблон активности","TemplateAddingTests","CheckAbsenceScormScoreFieldActivityTemplate","Редактирование шаблона активности: отсутствия поля оценка по SCORM результату, если не добавлен SCORM пакет",""
"passed","Thu Sep 21 16:44:38 UTC 2023","Thu Sep 21 16:44:46 UTC 2023","8272","","Активность","Обычная активность","ActivityEditingTests+ActivityEditingFormatTests","CheckActivityFormatIsOffline","Редактирование активности: проверка формата активности офлайн",""
"skipped","Thu Sep 21 16:59:31 UTC 2023","Thu Sep 21 16:59:32 UTC 2023","544","","Библиотека","","LibraryMaterialTests","CheckVisibilityOfLaTeXMaterialPage","Страница материала: проверка отображения LaTeX материала",""
"passed","Thu Sep 21 16:45:52 UTC 2023","Thu Sep 21 16:46:05 UTC 2023","12491","Активность","Контрольная","Создание контрольной","TestActivityCreatingTests","CheckExecModeTestActivity","Создание контрольной: можно создать контрольную с режимом выполнения 'Индивидуальный'",""
"passed","Thu Sep 21 16:45:46 UTC 2023","Thu Sep 21 16:45:53 UTC 2023","6313","","Активность","Обычный шаблон активности","TemplateEditingValidationTests","CheckNegativeEditVolumeActivityTemplate","Редактирование шаблона активности: отображение ошибки валидации для поля 'Объём' с значением > 100",""
"passed","Thu Sep 21 16:47:01 UTC 2023","Thu Sep 21 16:47:17 UTC 2023","15880","Активность","Контрольная","Прохождение теста","TestActivityStatusWithTwoOrMoreAttemptsTests","ResultOfPassingDependOnSettings","Страница индивидуальной контрольной: результат тестирования из попытках зависеть от настройки 'За последнюю попытку'",""
"passed","Thu Sep 21 16:50:26 UTC 2023","Thu Sep 21 16:50:43 UTC 2023","16443","","Дисциплина","Создание дисциплины","DisContingentCreationTests","CheckAddTeacherByUserInfoInCreation","Создание дисциплины: добавление преподавателя из списка",""
"passed","Thu Sep 21 16:49:40 UTC 2023","Thu Sep 21 16:49:46 UTC 2023","5287","","Дисциплина","Создание дисциплины","DisciplineCreationTests","CancelCreatingDiscipline"," Cоздание дисциплины в потоке ДО: работает кнопка 'Отмена'",""
"passed","Thu Sep 21 16:48:11 UTC 2023","Thu Sep 21 16:48:16 UTC 2023","5112","","Поток","","CohortCreationValidationTests","CheckCreateCohortIfStartAndEndDateAreSame","Создание потока: ошибка валидации, если дата начала и окончания совпадают",""
"passed","Thu Sep 21 16:51:02 UTC 2023","Thu Sep 21 16:51:24 UTC 2023","21769","","Библиотека","","LibraryInListViewTests","CheckMoveMaterialToCatalogInListView","Библиотека, списочный вид: можно переместить материал в другой каталог",""
"passed","Thu Sep 21 16:45:23 UTC 2023","Thu Sep 21 16:45:31 UTC 2023","8285","","Активность","Обычная активность","ActivityDurationTests","CheckEditVolumeActivityWithCorrectValues","Редактирование активности: успешное сохранение при корректных значениях в поля 'Объём'",""
"passed","Thu Sep 21 16:52:00 UTC 2023","Thu Sep 21 16:52:10 UTC 2023","9456","","Материал","Конструктор теста","TestQuestionAnswersValidationTests","CheckAddOneMoreAnswerVariantInQuestionWithFreeAnswerExactMatch","Конструктор теста: можно добавить еще один вариант ответа в вопрос с типом ответа 'Свободный ответ - точное совпадение'",""
"passed","Thu Sep 21 16:49:31 UTC 2023","Thu Sep 21 16:49:44 UTC 2023","12994","","Чат","Личный чат","PersonalChatTests","CheckAddNewPersonalChat","Список чатов - личный чат: можно добавить новый чат",""
"passed","Thu Sep 21 16:48:24 UTC 2023","Thu Sep 21 16:48:38 UTC 2023","13983","","Поток","","CohortEditingTests","CheckEditCohortWhenAllRequiredFieldsAreFilled","Редактирование потока: успешное сохранение, если все обязательные поля корректно заполнены",""
"passed","Thu Sep 21 16:50:59 UTC 2023","Thu Sep 21 16:51:09 UTC 2023","9618","","Дисциплина","Шаблон дисциплины","DisTemplateTests","CheckAddModuleInDisTemplate","Страница шаблона дисциплины: можно добавить модуль",""
"passed","Thu Sep 21 16:48:36 UTC 2023","Thu Sep 21 16:48:44 UTC 2023","7012","","Чат","Чат решения","TaskChatTests","CheckSendFileMessageInTaskChat","Список чатов - обсуждение решения: можно прикрепить и отправить файл с компьютера",""
"passed","Thu Sep 21 16:45:05 UTC 2023","Thu Sep 21 16:45:15 UTC 2023","10255","","Активность","Обычная активность","ActivityEditingTests","CheckClearAddedTagsFromActivity","Редактирование активности: можно очистить теги знаний",""
"passed","Thu Sep 21 16:47:52 UTC 2023","Thu Sep 21 16:47:58 UTC 2023","5284","","Поток","","CohortCreationValidationTests","CheckCreateCohortIfNameNotFilled","Создание потока: ошибка валидации, если название не указано",""
"passed","Thu Sep 21 16:53:15 UTC 2023","Thu Sep 21 16:53:27 UTC 2023","12657","","Материал","Конструктор тест-тренажера","TestTrainQuestionsValidationTests","AddCommentInTestTrainQuestion","Конструктор теста-тренажера: можно добавить комментарий к вопросу",""
"passed","Thu Sep 21 16:54:06 UTC 2023","Thu Sep 21 16:54:17 UTC 2023","11196","","Профиль","","AddressAndContactsEditingTests","CheckCountryField","Редактирование профиля пользователя: можно изменить страну",""
"passed","Thu Sep 21 16:47:47 UTC 2023","Thu Sep 21 16:48:01 UTC 2023","13627","","Чат","Дисциплина","DisciplineChatTests","CheckCallInDisciplineChat","Список чатов - комната дисциплины: можно сделать звонок",""
"passed","Thu Sep 21 16:51:11 UTC 2023","Thu Sep 21 16:51:14 UTC 2023","3495","","Дисциплина","Редактирование дисциплины","DisContingentEditingValidationTests","CheckIsDisabledCheckboxAllStudentInEditingDiscipline","Редактирование дисциплины: галка ‘Все студенты потока’ дизаблена и невозможно его снять, если дисциплина относится к нацпроекту",""
"passed","Thu Sep 21 16:49:21 UTC 2023","Thu Sep 21 16:49:30 UTC 2023","9466","","Чат","Групповой чат","GroupChatTests","CheckChangeGroupChatName","Список чатов - групповой чат: можно изменить название чата",""
"passed","Thu Sep 21 16:47:30 UTC 2023","Thu Sep 21 16:47:38 UTC 2023","8028","","Активность","Шаблон активности контрольной","TestTemplateEditingTests","CheckEditValueScormResultScoreInTemplate","Редактирование шаблона контрольной: можно переключать значения в поле 'Оценка по SCORM результату'",""
"passed","Thu Sep 21 16:50:08 UTC 2023","Thu Sep 21 16:50:11 UTC 2023","3261","","Чат","Групповой чат","GroupChatTests","CheckMembersOfGroupChatIsDisplayed","Список чатов - групповой чат: отображаются участники чата при клике на блок с аватарками",""
"passed","Thu Sep 21 16:47:49 UTC 2023","Thu Sep 21 16:48:02 UTC 2023","12675","","Чат","Чат для заметок","NotesChatTests","CheckAddQuoteToLastMessageInNotesChat","Список чатов - чат для заметок: можно цитировать сообщению",""
"passed","Thu Sep 21 16:49:47 UTC 2023","Thu Sep 21 16:49:53 UTC 2023","6105","","Дисциплина","Редактирование дисциплины","DisciplineAccessTests","CheckIfAdminUniverChangeDiscipline","Редактирование дисциплины: есть возможность редактировать у администратора университета, к которому дисциплина относится",""
"passed","Thu Sep 21 16:51:36 UTC 2023","Thu Sep 21 16:51:48 UTC 2023","11659","","Материал","Конструктор теста","TestCreationTests","TestCreation","Конструктор теста: создание теста",""
"passed","Thu Sep 21 16:59:32 UTC 2023","Thu Sep 21 16:59:46 UTC 2023","14277","Активность","Контрольная","Результат прохождения теста","TestActivityResultTests","TeacherCanLeaveCommentOnAnswer","Результат прохождения: преподаватель может оставить комментарий к ответу, если включена опция подробная информация о результатах",""
"passed","Thu Sep 21 16:54:02 UTC 2023","Thu Sep 21 16:54:04 UTC 2023","1585","","Университет","","UniversityTests","ShowTooltipToIelement","Страница Мой тариф: проверка появления тултипа при наведении курсора на значек 'i'",""
"passed","Thu Sep 21 16:49:33 UTC 2023","Thu Sep 21 16:49:38 UTC 2023","5438","","Поток","","CohortInfoTests","CheckNotAccessToUploadsForStudents","Страница потока: отсутствия доступа студента к выгрузкам",""
"passed","Thu Sep 21 16:49:01 UTC 2023","Thu Sep 21 16:49:05 UTC 2023","4070","","Поток","","CohortEditingValidationTests","CheckEditCohortIfEachDateNotFilled","Редактирование потока: ошибка валидации, если дата окончания не заполнена",""
"passed","Thu Sep 21 16:52:36 UTC 2023","Thu Sep 21 16:52:46 UTC 2023","9400","","Материал","Конструктор теста","TestSettingsValidationTests","ClearTagsFromTest","Конструктор теста: можно удалить теги знаний",""
"passed","Thu Sep 21 16:45:01 UTC 2023","Thu Sep 21 16:45:11 UTC 2023","9886","","Активность","Задание","TaskActivityTeacherTests","CheckGradeSolutionValueAboveAndBelowScore","Страница решение задания: можно оценить решения значением ниже минимального порога баллов",""
"passed","Thu Sep 21 16:48:17 UTC 2023","Thu Sep 21 16:48:23 UTC 2023","6314","","Чат","Дисциплина","DisciplineChatTests","CheckFindDisciplineChatByNameInSearch","Список чатов - комната дисциплины: можно найти чат в поиске по названию",""
"passed","Thu Sep 21 16:52:51 UTC 2023","Thu Sep 21 16:52:59 UTC 2023","8194","","Материал","Конструктор теста","TestQuestionAnswersValidationTests","CheckRemoveAnswerFromFreeAnswerExactMatchQuestion","Конструктор теста: можно удалить вариант ответа из вопроса с типом ответа 'Свободный ответ' – 'Точное совпадение'",""
"passed","Thu Sep 21 16:52:05 UTC 2023","Thu Sep 21 16:52:28 UTC 2023","22545","","Материал","Конструктор тест-тренажера","TestTrainAddingQuestionsTests","AddQuestionInTestTrain","Конструктор теста-тренажера: можно добавить вопрос с типом ответа “Выбор из вариантов”",""
"passed","Thu Sep 21 16:50:47 UTC 2023","Thu Sep 21 16:51:04 UTC 2023","17157","","Дисциплина","Страница дисциплины","DisciplineAnalyticsTests","CheckResetButton","Страница аналитика дисциплины: работает кнопка “Сбросить”",""
"passed","Thu Sep 21 16:51:03 UTC 2023","Thu Sep 21 16:51:14 UTC 2023","10915","","Библиотека","","BulkActionsLibraryTests","CheckAppearanceOfMoveDeleteAndCancelButtons","Библиотека: появление кнопок переместить, удалить, и отмена при активации режима выбора",""
"passed","Thu Sep 21 16:53:27 UTC 2023","Thu Sep 21 16:53:40 UTC 2023","12310","","Материал","Конструктор тест-тренажера","TestTrainQuestionsValidationTests","EditCommentInTestTrainQuestion","Конструктор теста-тренажера: можно изменить комментарий к вопросу",""
"passed","Thu Sep 21 16:50:32 UTC 2023","Thu Sep 21 16:50:45 UTC 2023","13124","","Дисциплина","Редактирование дисциплины","DisContingentEditingTests","CheckAddTeacherByUserInfoInEditing","Редактирование дисциплины: добавление преподавателя по email’у",""
"passed","Thu Sep 21 16:47:34 UTC 2023","Thu Sep 21 16:47:47 UTC 2023","13111","","Чат","Дисциплина","DisciplineChatTests","CheckAddQuoteToLastMessageInDisciplineChat","Список чатов - комната дисциплины: можно цитировать сообщению",""
"passed","Thu Sep 21 16:51:30 UTC 2023","Thu Sep 21 16:51:32 UTC 2023","1598","","Библиотека","","StudentLibraryTests","CheckStudentNotAllowedPutContentInStock","Страница материала: студенту недоступно выставление своего материала на Биржу",""
"passed","Thu Sep 21 16:52:28 UTC 2023","Thu Sep 21 16:52:36 UTC 2023","8647","","Материал","Конструктор теста","TestSettingsValidationTests","ChangeLevelAssimilationInTestTag","Конструктор теста: можно изменить уровень усвоения в добавленном теге знаний",""
"passed","Thu Sep 21 16:50:56 UTC 2023","Thu Sep 21 16:50:59 UTC 2023","3546","","Дисциплина","Шаблон дисциплины","DisTemplateTests","CheckCreateDisTemplateIfRequiredFieldsNotFilled","Создание шаблона дисциплины: невозможно создать шаблон, если не заполнены обязательные поля",""
"passed","Thu Sep 21 16:48:06 UTC 2023","Thu Sep 21 16:48:19 UTC 2023","12913","","Чат","Личный чат","PersonalChatTests","CheckCallInPersonalChat","Список чатов - личный чат: можно сделать звонок",""
"passed","Thu Sep 21 16:49:25 UTC 2023","Thu Sep 21 16:49:29 UTC 2023","4438","","Поток","","CohortEditingValidationTests","CheckEditCohortIfStartAndEndDateNotFilled","Редактирование потока: ошибка валидации, если дата начала и окончания не заполнены",""
"passed","Thu Sep 21 16:45:48 UTC 2023","Thu Sep 21 16:45:56 UTC 2023","7470","","Активность","Обычный шаблон активности","TemplateEditingTests","CheckAddTagInActivityTemplate","Редактирование шаблона активности: можно добавлять теги знаний",""
"passed","Thu Sep 21 16:53:30 UTC 2023","Thu Sep 21 16:53:44 UTC 2023","13513","","Материал","Конструктор тест-тренажера","TestTrainBlocksAndVariantsValidationTests","CheckRemoveQuestionFromTestTrain","Конструктор теста-тренажера: можно удалить вопрос",""
