"Status","Start Time","Stop Time","Duration in ms","Parent Suite","Suite","Sub Suite","Test Class","Test Method","Name","Description"
"passed","Thu Sep 21 16:54:23 UTC 2023","Thu Sep 21 16:54:25 UTC 2023","2685","","Расписание","","ScheduleTests","MobileVersionScheduleShowThreeDaysMode","Страница расписания: мобильная версия проверка показа режима 3 дня",""
"passed","Thu Sep 21 16:51:27 UTC 2023","Thu Sep 21 16:51:48 UTC 2023","20687","","Материал","Конструктор теста","TestAddingQuestionsTests","CheckAddMultipleChoiceTestQuestion","Конструктор теста: можно добавить вопрос с типом ответа “Выбор из вариантов”",""
"passed","Thu Sep 21 16:50:36 UTC 2023","Thu Sep 21 16:50:47 UTC 2023","10421","","Дисциплина","Шаблон дисциплины","DisTemplateTests","CheckCreateDisTemplateWithFillingRequiredFields","Создание шаблона дисциплины: можно создать шаблон, если заполнены все обязательные поля",""
"passed","Thu Sep 21 16:45:56 UTC 2023","Thu Sep 21 16:46:02 UTC 2023","5944","Активность","Контрольная","Редактирование контрольной","TestActivityEditingTests","ErrorWithIncorrectValueNumberOfAttemptsInTestActivity","Редактирование контрольной: отображение ошибки валидации для поля 'Количество попыток сдачи' с значением '0'",""
"passed","Thu Sep 21 16:44:56 UTC 2023","Thu Sep 21 16:45:00 UTC 2023","3952","","Активность","Задание","TaskWithSolutionStudentTests","CheckRemoveSolution","Страница решение задания: наличия ошибки при удалении решения",""
"passed","Thu Sep 21 16:52:59 UTC 2023","Thu Sep 21 16:53:08 UTC 2023","8670","","Материал","Конструктор теста","TestQuestionAnswersValidationTests","CheckRemoveAnswerFromComparisionQuestion","Конструктор теста: можно удалить один вариант на сопоставление из вопроса с типом ответа ‘Сопоставление’",""
"passed","Thu Sep 21 16:47:24 UTC 2023","Thu Sep 21 16:47:30 UTC 2023","6060","","Активность","Шаблон активности контрольной","TestTemplateEditingTests","SwitchCheckboxDisplayStudentsDetailedResultInfoInTestActivityTemplate","Редактирование шаблона контрольной: переключение чекбокса 'Отображать студентам подробную информацию о результатах'",""
"passed","Thu Sep 21 17:00:08 UTC 2023","Thu Sep 21 17:00:14 UTC 2023","5210","Активность","Контрольная","Прохождение теста","TestActivityStatusWithOneAttemptTests","NoStatusWithOneIncompleteAttempt","Страница командной контрольной: отсутствует статус и иконка для одной незавершенной попыткой",""
"passed","Thu Sep 21 16:45:47 UTC 2023","Thu Sep 21 16:45:51 UTC 2023","3201","Активность","Контрольная","Редактирование контрольной","TestActivityEditingTests","ExecutionModeFieldIsNotClickableInTestActivity","Редактирование контрольной: поле 'Режим выполнения' некликабельно",""
"passed","Thu Sep 21 16:52:36 UTC 2023","Thu Sep 21 16:52:48 UTC 2023","11682","","Материал","Конструктор теста","TestQuestionsValidationTests","CheckAndUncheckAnswerOptionInTest","Конструктор теста: возможность отметить вариант ответа как “верный”",""
"passed","Thu Sep 21 16:48:31 UTC 2023","Thu Sep 21 16:48:38 UTC 2023","6949","","Чат","Групповой чат","GroupChatTests","CheckFindGroupChatByNameInSearch","Список чатов - групповой чат: можно найти чат в поиске по названию",""
"passed","Thu Sep 21 16:44:48 UTC 2023","Thu Sep 21 16:44:52 UTC 2023","4505","","Активность","Задание","TaskWithSolutionStudentTests","CheckSendFileSolution","Страница решение задания: можно отправить файловый ответ",""
"passed","Thu Sep 21 16:51:27 UTC 2023","Thu Sep 21 16:51:39 UTC 2023","11300","","Дисциплина","Редактирование дисциплины","DisContingentEditingTests","CheckRemoveGroupAndStudentFromDiscipline","Редактирование дисциплины: открепления от дисциплины групп и студентов",""
"passed","Thu Sep 21 16:51:48 UTC 2023","Thu Sep 21 16:52:11 UTC 2023","22818","","Материал","Конструктор теста","TestAddingQuestionsTests","CheckAddQuestionWithFreeAnswerManualCheck","Конструктор теста: можно добавить вопрос с типом ответа “Свободный ответ” - “Ручная проверка”",""
"failed","Thu Sep 21 17:00:14 UTC 2023","Thu Sep 21 17:00:14 UTC 2023","597","Активность","Контрольная","Прохождение теста","TestActivityStatusWithOneAttemptTests","StatusIsPendingReviewForAttemptsNeedsReview","Страница индивидуальной контрольной: статус ожидает проверки, если в попытке есть хотя бы один вопрос, требующий проверки",""
"passed","Thu Sep 21 16:49:10 UTC 2023","Thu Sep 21 16:49:12 UTC 2023","2123","","Поток","Завершение обучения","EducationCompletionPageTests","FindStudentWithName","Поиск студента по ФИО на странице завершения обучения",""
"passed","Thu Sep 21 16:45:31 UTC 2023","Thu Sep 21 16:45:36 UTC 2023","5456","","Активность","Обычная активность","ActivityDurationTests","CheckEditVolumeActivityWithIncorrectValues","Редактирование активности: отображение ошибки валидации для поля 'Объём' с отрицательным значением",""
"passed","Thu Sep 21 16:59:56 UTC 2023","Thu Sep 21 17:00:05 UTC 2023","9070","Активность","Контрольная","Результат прохождения теста","TestActivityResultTests","TeacherCanLeaveCommentOnAnswer","Результат прохождения: преподаватель может удалить комментарий к ответу, если включена опция подробная информация о результатах",""
"passed","Thu Sep 21 16:46:54 UTC 2023","Thu Sep 21 16:47:00 UTC 2023","5979","","Активность","Шаблон активности контрольной","TestTemplateEditingTests","ErrorWithIncorrectValueNumberOfAttemptsInTestActivityTemplate","Редактирование шаблона контрольной: отображение ошибки валидации для поля 'Количество попыток сдачи' с значением > 20",""
"passed","Thu Sep 21 16:49:42 UTC 2023","Thu Sep 21 16:49:51 UTC 2023","9110","","Дисциплина","Настройка чата дисциплины","DisciplineChatBlockTests","CheckBlockAndUnblockChatDiscipline","Редактирование дисциплины: снятия блокировки чата дисциплины",""
"passed","Thu Sep 21 16:48:56 UTC 2023","Thu Sep 21 16:49:05 UTC 2023","8921","","Чат","Чат решения","TaskChatTests","CheckAddReactionToLastMessageInTaskChat","Список чатов - обсуждение решения: можно добавить реакцию на сообщение",""
"passed","Thu Sep 21 16:48:09 UTC 2023","Thu Sep 21 16:48:21 UTC 2023","11365","","Чат","Групповой чат","GroupChatTests","CheckSendEmojiInGroupChat","Список чатов - групповой чат: можно отправить смайлики",""
"passed","Thu Sep 21 17:00:22 UTC 2023","Thu Sep 21 17:00:25 UTC 2023","3067","Активность","Контрольная","Прохождение теста","TestActivityStatusWithOneAttemptTests","StatusChangesIfMinThresholdChanges","Страница командной контрольной: статус меняется, если преподаватель меняет минимальный порог баллов",""
"passed","Thu Sep 21 16:54:28 UTC 2023","Thu Sep 21 16:54:31 UTC 2023","3239","","Расписание","","ScheduleSettingsTests","ChangeTextBlackoutNameSchedule","Страница расписания: проверка изменения текста затемнения прошедших активностей",""
"passed","Thu Sep 21 16:54:15 UTC 2023","Thu Sep 21 16:54:18 UTC 2023","3177","","Расписание","","ScheduleTests","DesktopScheduleNoChooseThreeDaysMode","Страница расписания: в десктопе нет возможности выбрать 3 дня",""
"passed","Thu Sep 21 16:47:53 UTC 2023","Thu Sep 21 16:48:03 UTC 2023","9471","Активность","Контрольная","Результат прохождения теста","TestActivityResultTests","CheckMarkIncorrectTextOrFileAnswer","Результат прохождения: можно отметить 'Не верно' ответ вопроса с типом ответа свободный ответ или файл",""
"passed","Thu Sep 21 16:45:53 UTC 2023","Thu Sep 21 16:45:54 UTC 2023","1710","","Активность","Обычный шаблон активности","TemplateEditingValidationTests","CheckNotExistScormResultScoreField","Редактирование шаблона активности: отсутствует поля 'Оценка по SCORM результату', если добавлен SCORM пакет в шаблон активности типов кроме контрольной",""
"passed","Thu Sep 21 16:51:04 UTC 2023","Thu Sep 21 16:51:13 UTC 2023","8573","","Дисциплина","Страница дисциплины","DisciplineAnalyticsTests","CheckActivityAndVolumeTooltipIsDisplayed","Страница аналитика дисциплины: у заголовок “Активности” и “Объём” есть тултип",""
"passed","Thu Sep 21 16:45:42 UTC 2023","Thu Sep 21 16:45:47 UTC 2023","5789","","Активность","Обычная активность","ActivityDurationTests","CheckEditVolumeActivityWithIncorrectValues","Редактирование активности: отображение ошибки валидации для поля 'Объём' с значением > 100",""
"passed","Thu Sep 21 16:52:43 UTC 2023","Thu Sep 21 16:52:51 UTC 2023","8318","","Материал","Конструктор теста","TestQuestionAnswersValidationTests","CheckRemoveAnswerFromMultipleChoiceQuestion","Конструктор теста: можно удалить вариант ответа из вопроса с типом ответа 'Выбор из вариантов'",""
"passed","Thu Sep 21 16:53:44 UTC 2023","Thu Sep 21 16:53:47 UTC 2023","2592","","Программа","","ProgramEditingTests","CheckRemoveProgramWithNationalProject","Редактирование программы ДО: невозможно удалить программу с проектом СЗ",""
"passed","Thu Sep 21 16:46:45 UTC 2023","Thu Sep 21 16:47:01 UTC 2023","16384","Активность","Контрольная","Прохождение теста","TestActivityStatusWithTwoOrMoreAttemptsTests","ResultOfPassingDependOnSettings","Страница командной контрольной: результат тестирования из попытках зависеть от настройки 'За лучшую попытку'",""
"passed","Thu Sep 21 16:49:44 UTC 2023","Thu Sep 21 16:49:49 UTC 2023","4832","","Дисциплина","Страница дисциплины","DisciplineActivitiesBlockTests","CheckCancelAddTopic","Страница дисциплины: отмена создания темы",""
"passed","Thu Sep 21 16:47:58 UTC 2023","Thu Sep 21 16:48:04 UTC 2023","6717","","Поток","","CohortCreationValidationTests","CheckCreateCohortIfEachDateNotFilled","Создание потока: ошибка валидации, если дата начала не указана",""
"passed","Thu Sep 21 16:50:33 UTC 2023","Thu Sep 21 16:50:39 UTC 2023","6075","","Дисциплина","Редактирование дисциплины","DisciplineEditingTests","CheckAddTagInDiscipline","Редактирование дисциплины: можно добавлять теги знаний",""
"passed","Thu Sep 21 16:48:50 UTC 2023","Thu Sep 21 16:48:56 UTC 2023","6202","","Поток","","CohortEditingValidationTests","CheckEditCohortIfNameNotFilled","Редактирование потока: ошибка валидации, если название не заполнено",""
"failed","Thu Sep 21 17:00:21 UTC 2023","Thu Sep 21 17:00:22 UTC 2023","635","Активность","Контрольная","Прохождение теста","TestActivityStatusWithOneAttemptTests","StatusChangesIfMinThresholdChanges","Страница индивидуальной контрольной: статус меняется, если преподаватель меняет минимальный порог баллов",""
"passed","Thu Sep 21 16:53:05 UTC 2023","Thu Sep 21 16:53:18 UTC 2023","13017","","Материал","Конструктор тест-тренажера","TestTrainCreationTests","TestCreation","Конструктор теста-тренажера: создание теста-тренажера",""
"passed","Thu Sep 21 16:48:26 UTC 2023","Thu Sep 21 16:48:36 UTC 2023","10828","","Чат","Чат решения","TaskChatTests","CheckSendEmojiInTaskChat","Список чатов - обсуждение решения: можно отправить смайлики",""
"passed","Thu Sep 21 16:53:10 UTC 2023","Thu Sep 21 16:53:25 UTC 2023","15133","","Материал","Конструктор теста","TestBlocksAndVariantsValidationTests","DeleteTestBlock","Конструктор теста: можно удалить блок",""
"passed","Thu Sep 21 16:52:48 UTC 2023","Thu Sep 21 16:53:00 UTC 2023","11972","","Материал","Конструктор теста","TestQuestionsValidationTests","CheckAndUncheckAnswerOptionInTest","Конструктор теста: возможность снять отметку “верный” у варианта ответа",""
"passed","Thu Sep 21 16:52:10 UTC 2023","Thu Sep 21 16:52:24 UTC 2023","14475","","Библиотека","","LibraryInTileViewTests","CheckCopyMaterialToCatalogInTileView","Библиотека, плиточный вид: можно скопировать материал в другой каталог",""
"passed","Thu Sep 21 16:53:08 UTC 2023","Thu Sep 21 16:53:16 UTC 2023","8364","","Материал","Конструктор теста","TestQuestionAnswersValidationTests","CheckRemoveAnswerFromSortingQuestion","Конструктор теста: можно удалить опцию из вопроса с типом ответа 'Сортировка'",""
"passed","Thu Sep 21 16:59:31 UTC 2023","Thu Sep 21 16:59:40 UTC 2023","8736","","Активность","Обычная активность","ActivityEditingTests","CheckSertificationDisciplineActivity","Редактирование активности: проверка включения Аттестации по дисциплине",""
"passed","Thu Sep 21 16:49:26 UTC 2023","Thu Sep 21 16:49:32 UTC 2023","5923","","Дисциплина","Настройка чата дисциплины","DisciplineChatBlockTests","CheckNotAccessOpenChatActivity","Страница активности: отсутствия доступа к кнопке 'Открыть чат активности', если чат дисциплины заблокирован",""
"passed","Thu Sep 21 16:50:56 UTC 2023","Thu Sep 21 16:51:06 UTC 2023","10410","","Дисциплина","Редактирование дисциплины","DisContingentEditingTests","CheckAddTeacherByUserInfoInEditing","Редактирование дисциплины: добавление преподавателя по ссылке на профиль",""
"passed","Thu Sep 21 16:50:00 UTC 2023","Thu Sep 21 16:50:09 UTC 2023","8920","","Дисциплина","Создание дисциплины","DisciplineCreationValidationTests","CheckIfCreditValuesNotAllowed","Создание дисциплины ДО: отображение ошибки валидации для поля 'Кредиты' с значением 0",""
"passed","Thu Sep 21 16:51:00 UTC 2023","Thu Sep 21 16:51:11 UTC 2023","10406","","Дисциплина","Редактирование дисциплины","DisContingentEditingValidationTests","CheckAddStudentsInTeachersField","Редактирование дисциплины: наличия ошибки при попытке указать преподавателем студента из поля 'Студенты'",""
"passed","Thu Sep 21 16:51:03 UTC 2023","Thu Sep 21 16:51:13 UTC 2023","10631","","Библиотека","","LibraryActionPanelTests","CheckCreateTextMaterial","Библиотека, плиточный вид: можно создать материал типа 'Текстовый материал'",""
"passed","Thu Sep 21 16:49:17 UTC 2023","Thu Sep 21 16:49:26 UTC 2023","8193","","Дисциплина","Страница дисциплины","DisciplineAnalyticsTests","CheckDisciplineAnalyticsIsOpen","Страница аналитика дисциплины: при переходе на вкладку “Аналитика” открывается аналитика дисциплины",""
"passed","Thu Sep 21 16:50:22 UTC 2023","Thu Sep 21 16:50:28 UTC 2023","6852","","Дисциплина","Редактирование дисциплины","DisciplineDurationTests","CheckIfStartDateEmptyInDiscipline","Редактирование дисциплины: наличия ошибки если поле дата начала пустое",""
"passed","Thu Sep 21 16:45:09 UTC 2023","Thu Sep 21 16:45:13 UTC 2023","3425","","Активность","Задание","TaskWithSolutionStudentTests","CheckAbilityToSeeListSolutions","Страница решение задания: можно просмотреть список всех решений, если включена 'Решения открыты всем'",""
"passed","Thu Sep 21 16:47:01 UTC 2023","Thu Sep 21 16:47:15 UTC 2023","13995","","Активность","Шаблон активности контрольной","TestTemplateAddingTests","CheckAddTextMaterialToTestActivityTemplate","Редактирование шаблона контрольной: можно добавить материал типа текст из библиотеки",""
"passed","Thu Sep 21 16:45:20 UTC 2023","Thu Sep 21 16:45:35 UTC 2023","15064","","Активность","Задание","TaskActivityMulticriteriaTests","CheckCreateTaskWithValuesInCriteria","Создание задания: можно задать значения критерия (заполнены поля значения и баллов)",""
"passed","Thu Sep 21 16:45:31 UTC 2023","Thu Sep 21 16:46:07 UTC 2023","36099","","Активность","Обычная активность","ActivityContentVisibilityTests","CheckVisibilityMaterialOutsideTimeActivity","Редактирование активности: видимость материала вне времени проведения активности",""
"passed","Thu Sep 21 16:54:04 UTC 2023","Thu Sep 21 16:54:05 UTC 2023","1558","","Университет","","UniversityTests","CheckOpenTableActiveUsers","Страница Мой тариф: проверка открытия таблицы активных пользователей",""
"passed","Thu Sep 21 16:49:32 UTC 2023","Thu Sep 21 16:49:39 UTC 2023","7329","","Поток","","CohortEditingValidationTests","CheckIsNotPossibleChangeDatesInEditingCohort","Редактирование потока ДО (СЗ): нет возможности изменить даты потока, если в нем есть слушатели",""
"passed","Thu Sep 21 16:47:24 UTC 2023","Thu Sep 21 16:47:40 UTC 2023","16180","","Чат","Групповой чат","GroupChatTests","CheckEditLastMessageInGroupChat","Список чатов - групповой чат: можно редактировать сообщение в течение 4 часов после отправки",""
"passed","Thu Sep 21 16:50:33 UTC 2023","Thu Sep 21 16:50:36 UTC 2023","3467","","Дисциплина","Страница дисциплины","DisciplineStudentTests","CheckNoEditButtonForStudent","Страница дисциплины: отсутствия кнопки 'Редактировать' у студента",""
"passed","Thu Sep 21 16:53:47 UTC 2023","Thu Sep 21 16:53:53 UTC 2023","6174","","Программа","","ProgramInfoPageTests","CheckNoAccessStudentToActivityEducationalProgramArchive","Страница обр программы: Студенты не имеют доступ к активностям архивной обр программы",""
"passed","Thu Sep 21 16:47:57 UTC 2023","Thu Sep 21 16:48:13 UTC 2023","16081","","Чат","Чат решения","TaskChatTests","CheckEditLastMessageInTaskChat","Список чатов - обсуждение решения: можно редактировать сообщение в течение 4 часов после отправки",""
"passed","Thu Sep 21 16:49:19 UTC 2023","Thu Sep 21 16:49:25 UTC 2023","6723","","Чат","Дисциплина","DisciplineChatTests","CheckSwitchToAnotherDisciplineChatRoom","Список чатов - комната дисциплины: можно переключать комнаты",""
"passed","Thu Sep 21 16:45:25 UTC 2023","Thu Sep 21 16:45:35 UTC 2023","9319","","Активность","Задание","TaskWithSolutionStudentTests","CheckAbilityToEvaluateAnotherStudentsSolution","Страница решение задания: можно оценить решения другого студента, если включена 'Взаимопроверка'",""
"passed","Thu Sep 21 16:48:27 UTC 2023","Thu Sep 21 16:48:34 UTC 2023","7500","","Поток","","CohortCreationWarningModalTests","CheckCreateCohortWithoutMismatchWarningOfDuration","Создание потока: нет предупреждения о несоответствии длительности потока для программ кроме 72, 144 и 256 часов",""
"passed","Thu Sep 21 16:47:43 UTC 2023","Thu Sep 21 16:47:54 UTC 2023","10391","","Чат","Мини-чат страницы решений","TaskPageMiniChatTests","CheckSendTextMessageInTaskPageMiniChat","Чат на странице решения: можно отправить текстовое сообщение",""
"passed","Thu Sep 21 16:50:48 UTC 2023","Thu Sep 21 16:50:58 UTC 2023","9870","","Дисциплина","Страница дисциплины","DisciplineMarksAndAttendanceTests","CheckAttendanceByTeacher","Страница посещаемости дисциплины: отметки/снятия посещаемости преподавателем",""
"passed","Thu Sep 21 16:53:48 UTC 2023","Thu Sep 21 16:54:02 UTC 2023","13333","","Материал","Конструктор тест-тренажера","TestTrainQuestionsValidationTests","CheckAndUncheckAnswerOptionInTestTrain","Конструктор теста-тренажера: возможность отметить вариант ответа как “верный”",""
"passed","Thu Sep 21 16:44:46 UTC 2023","Thu Sep 21 16:44:52 UTC 2023","5829","","Активность","Задание","TaskActivityTeacherTests","CheckGradeSolutionWithZeroValue","Страница решение задания: можно оценить решения значением '0'",""
"passed","Thu Sep 21 16:54:10 UTC 2023","Thu Sep 21 16:54:15 UTC 2023","4571","","Университет","","UniversityTests","CheckNoAccessAuditorToRatePage","Страница Мой тариф: проверка перехода аудитора по прямой ссылке",""
"passed","Thu Sep 21 16:54:12 UTC 2023","Thu Sep 21 16:54:16 UTC 2023","4197","","Расписание","","ScheduleSettingsTests","ErrorSyncGoogleCalendar","Страница расписания: проверка некорректного подключения к синхронизации с google календарем",""
"passed","Thu Sep 21 16:45:06 UTC 2023","Thu Sep 21 16:45:09 UTC 2023","3244","","Активность","Задание","TaskWithSolutionStudentTests","CheckTransitionToMySolution","Страница активности: работает кнопка 'Моё решение' для студента",""
"passed","Thu Sep 21 16:50:43 UTC 2023","Thu Sep 21 16:50:59 UTC 2023","16408","","Дисциплина","Создание дисциплины","DisContingentCreationTests","CheckAddTeacherByUserInfoInCreation","Создание дисциплины: добавление преподавателя по ссылке на профиль",""
