"Status","Start Time","Stop Time","Duration in ms","Parent Suite","Suite","Sub Suite","Test Class","Test Method","Name","Description"
"passed","Tue Sep 03 05:50:14 UTC 2024","Tue Sep 03 05:50:29 UTC 2024","15157","","Звонок","","CallTests","CheckTurnOnOffEquipmentInCall","Страница звонка: можно включить/отключить камеру в звонке",""
"passed","Tue Sep 03 05:47:38 UTC 2024","Tue Sep 03 05:48:01 UTC 2024","22354","Активность","Задание","Страница решения задания для студента","TaskWithoutSolutionStudentTests","CheckAccessFormWithoutSolutionForNewActivity","Отправка решений после даты окончания активности у новой активность",""
"passed","Tue Sep 03 06:01:11 UTC 2024","Tue Sep 03 06:01:40 UTC 2024","29330","","Библиотека","","LibraryInListViewTests","CheckCopyMaterialToCatalogInListView","Библиотека, списочный вид: можно скопировать материал в другой каталог",""
"passed","Tue Sep 03 06:04:52 UTC 2024","Tue Sep 03 06:05:04 UTC 2024","12330","","Материал","Конструктор тест-тренажера","TestTrainQuestionsValidationTests","RemoveCommentInTestTrainQuestion","Конструктор теста-тренажера: можно удалить комментарий к вопросу",""
"passed","Tue Sep 03 05:56:26 UTC 2024","Tue Sep 03 05:56:38 UTC 2024","11381","","Чат","Миничат обсуждение решения","TaskMiniChatTests","CheckSendFileMessageInTaskMiniChat","Можно прикрепить и отправить файл с компьютера в миничате обсуждении решения",""
"passed","Tue Sep 03 05:58:59 UTC 2024","Tue Sep 03 05:59:06 UTC 2024","7438","","Дисциплина","Страница дисциплины","DisciplineStudentTests","CheckAttendanceByStudent","У студента нет возможности отметить/снять посещаемость",""
"passed","Tue Sep 03 05:48:50 UTC 2024","Tue Sep 03 05:49:02 UTC 2024","12106","Активность","Обычная активность","Редактирование активности","ActivityEditingTests","CheckSertificationDisciplineActivity","Проверка включения опции Аттестация по дисциплине",""
"passed","Tue Sep 03 06:00:04 UTC 2024","Tue Sep 03 06:00:06 UTC 2024","2588","","Подразделения","Редактирование подразделения","DivisionEditingTests","CheckDeleteDivisionType","Невозможно сохранить подразделение очистив поле Тип",""
"passed","Tue Sep 03 05:58:55 UTC 2024","Tue Sep 03 05:59:03 UTC 2024","8229","","Дисциплина","Создание дисциплины","DisciplineCreationValidationTests","CheckIfCreditValuesNotAllowed","Отображение ошибки валидации для поля 'Кредиты' с отрицательным значением в ВО",""
"passed","Tue Sep 03 05:55:46 UTC 2024","Tue Sep 03 05:55:52 UTC 2024","5417","","Чат","Миничат личного чата","PersonalMiniChatTests","CheckFindSentMessageInPersonalMiniChat","Можно найти отправленное сообщение в миничате личного чата",""
"passed","Tue Sep 03 06:07:24 UTC 2024","Tue Sep 03 06:07:27 UTC 2024","3327","","Профиль","","UserInfoPageTests","CheckIfUserActivityIsLoading","Страница профиля пользователя: загружается блок 'Работа в Odin' для пользователя",""
"passed","Tue Sep 03 05:59:35 UTC 2024","Tue Sep 03 05:59:53 UTC 2024","18659","","Дисциплина","Создание дисциплины","DisContingentCreationTests","CheckAddTeacherByUserInfoInCreation","Добавление преподавателя по ссылке на профиль",""
"passed","Tue Sep 03 05:57:52 UTC 2024","Tue Sep 03 05:57:53 UTC 2024","1206","","Поток","Создание потока","CohortCreationValidationTests","CheckCreateCohortBySelectingCheckboxRegistrationLinkInProgramNatDemography","Создание потока ДО (СЗ): нет возможности выбрать галку ‘Разрешена регистрация по ссылке’",""
"passed","Tue Sep 03 05:57:38 UTC 2024","Tue Sep 03 05:57:47 UTC 2024","8117","","Дисциплина","Страница дисциплины","DisciplineActivitiesBlockTests","CheckCancelAddModule","Отмена создания модуля у дисциплины",""
"passed","Tue Sep 03 06:06:18 UTC 2024","Tue Sep 03 06:06:46 UTC 2024","28647","","Расписание","","ScheduleSettingsTests","CheckBlackoutOfPastActivities","Проверка затемнения прошедших активностей",""
"passed","Tue Sep 03 05:53:59 UTC 2024","Tue Sep 03 05:54:10 UTC 2024","10390","","Чат","Групповой чат","GroupChatMessageTests","CheckSendEmojiInGroupChat","Можно отправить смайлики в групповом чате",""
"passed","Tue Sep 03 06:02:34 UTC 2024","Tue Sep 03 06:03:32 UTC 2024","58253","","Материал","Конструктор теста","TestAddingQuestionsTests","CheckAddQuestionWithFreeAnswerManualCheck","Конструктор теста: можно добавить вопрос с типом ответа “Свободный ответ” - “Ручная проверка”",""
"broken","Tue Sep 03 06:06:28 UTC 2024","Tue Sep 03 06:07:10 UTC 2024","41968","","Программа","","ProgramCreationTests","CreateHighProgramFillAllFields","Если заполнить все поля программы ВО",""
"passed","Tue Sep 03 05:51:52 UTC 2024","Tue Sep 03 05:52:07 UTC 2024","15536","","Чат","Чат комнаты дисциплины","DisciplineRoomChatTests","CheckMembersOfDisciplineRoomChatIsDisplayed","Отображаются участники чата комнаты дисциплины при клике на блок с аватарками",""
"passed","Tue Sep 03 05:55:14 UTC 2024","Tue Sep 03 05:55:28 UTC 2024","14083","","Чат","Чат комнаты дисциплины","DisciplineRoomChatTests","CheckListRoomCreateForm","Проверка выпадающих списков в форме создания комнаты",""
"passed","Tue Sep 03 05:56:36 UTC 2024","Tue Sep 03 05:56:40 UTC 2024","4155","","Поток","Редактирование потока","CohortEditingTests","CheckCancelCohortEditingByDirectLink","Редактирование потока ДО: работает кнопка 'Отмена', если страница редактирование был открыть по прямой ссылке",""
"passed","Tue Sep 03 05:54:02 UTC 2024","Tue Sep 03 05:54:12 UTC 2024","9427","","Чат","Групповой чат","GroupChatTests","CheckSendGroupChatToArchive","Можно отправить групповой чат в архив",""
"passed","Tue Sep 03 06:06:04 UTC 2024","Tue Sep 03 06:06:11 UTC 2024","7100","","Расписание","","ScheduleSettingsTests","CheckSyncErrorWithGoogleCalendarIsAppear","Проверка некорректного подключения к синхронизации с Google календарем",""
"passed","Tue Sep 03 05:56:33 UTC 2024","Tue Sep 03 05:56:43 UTC 2024","10162","","Чат","Миничат страницы решений","TaskPageMiniChatTests","CheckAddReactionToLastMessageInTaskPageMiniChat","Можно добавить реакцию на сообщение в миничате страницы решений",""
"skipped","Tue Sep 03 06:15:21 UTC 2024","Tue Sep 03 06:15:21 UTC 2024","328","","Библиотека","","LibraryMaterialTests","CheckVisibilityOfLaTeXMaterialPreview","Превью материала: LaTeX отображается как PDF",""
"passed","Tue Sep 03 05:54:58 UTC 2024","Tue Sep 03 05:55:08 UTC 2024","10188","","Чат","Миничат группового чата","GroupMiniChatMessageTests","CheckSendFileMessageInGroupMiniChat","Можно прикрепить и отправить файл с компьютера в миничате группового чата",""
"passed","Tue Sep 03 05:55:00 UTC 2024","Tue Sep 03 05:55:17 UTC 2024","16444","","Чат","Миничат обсуждение решения","TaskMiniChatTests","CheckSendTextMessageInTaskMiniChat","Можно отправить текстовое сообщение в миничате обсуждении решения",""
"passed","Tue Sep 03 06:07:27 UTC 2024","Tue Sep 03 06:07:32 UTC 2024","5037","","Профиль","","UserInfoPageTests","CheckTransitionToEditProfileWorks","Страница профиля пользователя: кнопка 'Редактировать' работает для пользователя",""
"passed","Tue Sep 03 05:54:29 UTC 2024","Tue Sep 03 05:54:38 UTC 2024","9386","","Чат","Чат для заметок","NotesChatTests","CheckSendEmptyMessageInNotesChat","Невозможно отправить пустое сообщение в чате для заметок",""
"passed","Tue Sep 03 05:52:21 UTC 2024","Tue Sep 03 05:52:29 UTC 2024","8775","","Чат","Чат комнаты дисциплины","DisciplineRoomChatTests","CheckChangeDisciplineChatRoomStatus","Можно изменить доступ к чату комнаты дисциплины",""
"passed","Tue Sep 03 05:59:47 UTC 2024","Tue Sep 03 06:00:11 UTC 2024","24678","","Дисциплина","Дисциплина с ИОТ","IOTGraphTests","CheckAddBlockAboveFirstBlock","Страница дисциплины с ИОТ: над первым блоком можно добавить ещё один блок",""
"passed","Tue Sep 03 05:58:38 UTC 2024","Tue Sep 03 05:58:46 UTC 2024","8460","","Дисциплина","Создание дисциплины","DisciplineCreationValidationTests","CheckIfCreditValuesNotAllowed","Отображение ошибки валидации для поля 'Кредиты' со значением 0 в ВО",""
"passed","Tue Sep 03 06:04:02 UTC 2024","Tue Sep 03 06:04:19 UTC 2024","17293","","Материал","Конструктор тест-тренажера","TestTrainQuestionAnswersValidationTests","AddAnswerForQuestionInTestTrain","Конструктор теста-тренажера: можно добавить еще один вариант ответа в вопрос с типом ответа 'Выбор из вариантов'",""
"passed","Tue Sep 03 05:46:13 UTC 2024","Tue Sep 03 05:46:34 UTC 2024","20559","Активность","Обычная активность","Создание активности","ActivityCreatingTests","CreateActivityInModule","Можно создать активность в дисциплине (в модуле)",""
"passed","Tue Sep 03 05:49:15 UTC 2024","Tue Sep 03 05:49:50 UTC 2024","34964","Активность","Контрольная","Страница контрольной","TestCommandActivityTests","CheckAddTeamToCommandControlActivity","Можно добавить команду в командной контрольной",""
"passed","Tue Sep 03 06:05:03 UTC 2024","Tue Sep 03 06:05:06 UTC 2024","3359","","Организация","Мой тариф","MyPlanOrganizationPageTests","CheckOpenTableActiveUsers","Страница Мой тариф: проверка открытия таблицы активных пользователей",""
"passed","Tue Sep 03 06:06:19 UTC 2024","Tue Sep 03 06:06:51 UTC 2024","32013","","Биржа","","LotCreationTests","PostMaterialOnStock","Страница материала: преподаватель может выставить материал на Биржу",""
"passed","Tue Sep 03 05:50:13 UTC 2024","Tue Sep 03 05:50:41 UTC 2024","28298","Активность","Контрольная","Редактирование контрольной","TestActivityAddingTests","CheckAddScormPackageToControlTypeActivity","Можно добавить SCORM-пакет из Библиотеки в контрольную",""
"passed","Tue Sep 03 05:48:42 UTC 2024","Tue Sep 03 05:48:52 UTC 2024","10714","Активность","Задание","Страница решения задания для студента","TaskWithSolutionStudentTests","CheckAbilityToEditAssessmentOfAnotherStudentsSolution","Можно редактировать поставленную оценку в решении другого студента, если включена опция Взаимопроверка",""
"passed","Tue Sep 03 05:58:01 UTC 2024","Tue Sep 03 05:58:07 UTC 2024","5570","","Дисциплина","Страница дисциплины","DisciplineActivitiesBlockTests","CheckCancelAddTopic","Отмена создания темы у дисциплины",""
"passed","Tue Sep 03 06:04:00 UTC 2024","Tue Sep 03 06:04:10 UTC 2024","10732","","Материал","Конструктор теста","TestSettingsValidationTests","EditTestPointsLimit","Конструктор теста: можно изменить минимальный порог баллов",""
"passed","Tue Sep 03 05:58:47 UTC 2024","Tue Sep 03 05:58:50 UTC 2024","3340","","Дисциплина","Создание дисциплины","DisContingentCreationValidationTests","CheckGroupsAndStudentsFiledsIsAppearInCreation","После снятия галки с чекбокса ‘Все студенты потока’ появляются поля Группы и Студенты",""
"passed","Tue Sep 03 06:00:44 UTC 2024","Tue Sep 03 06:00:51 UTC 2024","7238","","Библиотека","","BulkActionsLibraryTests","CheckInSelectModeFirstElementIsSelected","Библиотека: при переходе в режим выбора первый элемент должен быть выбран",""
"passed","Tue Sep 03 06:00:22 UTC 2024","Tue Sep 03 06:00:39 UTC 2024","16829","","Дисциплина","Дисциплина с ИОТ","IOTThemesAndModulesTests","CheckCannotCreateModuleOrTopicInsideTopic","Страница дисциплины с ИОТ: внутри темы нельзя создать модуль или тему",""
"passed","Tue Sep 03 05:54:49 UTC 2024","Tue Sep 03 05:54:58 UTC 2024","9512","","Чат","Миничат группового чата","GroupMiniChatMessageTests","CheckSendEmojiInGroupMiniChat","Можно отправить смайлики в миничате группового чата",""
"passed","Tue Sep 03 05:55:52 UTC 2024","Tue Sep 03 05:56:03 UTC 2024","11064","","Чат","Миничат личного чата","PersonalMiniChatTests","CheckSendEmojiInPersonalMiniChat","Можно отправить смайлики в миничате личного чата",""
"passed","Tue Sep 03 05:50:20 UTC 2024","Tue Sep 03 05:50:30 UTC 2024","10355","Активность","Шаблон активности контрольной","Редактирование шаблона контрольной","TestTemplateEditingTests","CheckEditScoreValueInControlActivityPlan","Можно переключать значения в поле Оценка в шаблон контрольной",""
"passed","Tue Sep 03 05:55:43 UTC 2024","Tue Sep 03 05:55:48 UTC 2024","4992","","Поток","Создание потока","CohortCreationTests","CheckCancelCohortCreation","Создание потока ДО: работает кнопка 'Отмена', если страница создание был открыть со страницы программы",""
"passed","Tue Sep 03 05:48:03 UTC 2024","Tue Sep 03 05:48:11 UTC 2024","8787","","Активность","Обычный шаблон активности","TemplateEditingTests","CheckEditTypeInActivityTemplate","Можно переключать значения в поле Тип активности",""
"passed","Tue Sep 03 06:02:48 UTC 2024","Tue Sep 03 06:03:06 UTC 2024","18193","","Библиотека","","LibraryInTileViewTests","CheckRemoveMaterialInTileView","Библиотека, плиточный вид: можно удалить материал",""
"passed","Tue Sep 03 05:47:18 UTC 2024","Tue Sep 03 05:47:47 UTC 2024","28836","Активность","Задание","Создание задания","TaskActivityMulticriteriaTests","CheckCreateTaskWithValuesInCriteria","Можно задать значения критериям (заполнены поля Значения критерия и Баллов)",""
"passed","Tue Sep 03 05:56:16 UTC 2024","Tue Sep 03 05:56:25 UTC 2024","9279","","Чат","Личный чат","PersonalChatTests","CheckPinLastMessageInPersonalChat","Можно закреплять сообщение в личном чате",""
"passed","Tue Sep 03 05:52:49 UTC 2024","Tue Sep 03 05:52:57 UTC 2024","8383","","Чат","Групповой чат","GroupChatMessageTests","CheckSendTextMessageInGroupChat","Можно отправить текстовое сообщение в групповом чате",""
"passed","Tue Sep 03 05:51:47 UTC 2024","Tue Sep 03 05:51:55 UTC 2024","8879","","Чат","Чат комнаты дисциплины","DisciplineRoomChatMessageTests","CheckAddQuoteToLastMessageInDisciplineRoomChat","Можно цитировать сообщение в чате комнаты дисциплины",""
"passed","Tue Sep 03 05:51:38 UTC 2024","Tue Sep 03 05:51:57 UTC 2024","19216","","Чат","Миничат группового звонка","GroupChatCallTests","CheckSendTextMessageInGroupCallChat","Можно отправить текстовое сообщение в миничате группового звонка",""
"passed","Tue Sep 03 05:58:04 UTC 2024","Tue Sep 03 05:58:15 UTC 2024","10983","","Дисциплина","Редактирование дисциплины","DisciplineAccessTests","CheckOrgAdminChangeDiscipline","У администратора организации, к которой дисциплина относится, есть возможность редактирования",""
"passed","Tue Sep 03 05:52:28 UTC 2024","Tue Sep 03 05:52:38 UTC 2024","10078","","Чат","Чат комнаты дисциплины","DisciplineRoomChatMessageTests","CheckSendMessageByTappingEnterInDisciplineRoomChat","Можно отправить сообщения по нажатию на Enter в чате комнаты дисциплины",""
"passed","Tue Sep 03 05:58:29 UTC 2024","Tue Sep 03 05:58:34 UTC 2024","4428","","Дисциплина","Страница дисциплины","DisciplineRightMenuTests","CheckEditButtonForTeacher","Работает кнопка 'Редактировать' для преподавателя",""
"passed","Tue Sep 03 05:57:20 UTC 2024","Tue Sep 03 05:57:34 UTC 2024","13936","","Поток","Страница потока","CohortInfoTests","CheckNoAccessStudentToActivityCohortArchive","Страница потока: студенты не имеют доступа к активностям архивного потока",""
"passed","Tue Sep 03 05:55:41 UTC 2024","Tue Sep 03 05:55:51 UTC 2024","10637","","Чат","Чат для заметок","NotesChatTests","CheckAddReactionToLastMessageInNotesChat","Можно добавить реакцию на сообщение в чате для заметок",""
"passed","Tue Sep 03 06:00:10 UTC 2024","Tue Sep 03 06:00:17 UTC 2024","7386","","Дисциплина","Редактирование дисциплины","DisContingentEditingValidationTests","CheckIsDisabledCheckboxAllStudentInEditingDiscipline","Галка Все студенты потока задизейблена и невозможно ее снять, если дисциплина относится к Нацпроекту",""
"passed","Tue Sep 03 05:57:10 UTC 2024","Tue Sep 03 05:57:13 UTC 2024","2985","","Поток","Редактирование потока","CohortEditingValidationTests","CheckIsNotPossibleSelectingCheckboxRegistrationLinkInEditingCohort","Редактирование потока ДО (СЗ): нет возможности выбрать галку ‘Разрешена регистрация по ссылке’",""
"passed","Tue Sep 03 05:50:13 UTC 2024","Tue Sep 03 05:50:43 UTC 2024","29714","Активность","Контрольная","Прохождение теста","TestActivityStatusWithOneAttemptTests","CheckStatusIsPendingReviewForAttemptsNeedsReview","Статус Ожидает проверки, если в попытке есть хотя бы один вопрос, требующий проверки в командной контрольной",""
"passed","Tue Sep 03 05:58:28 UTC 2024","Tue Sep 03 05:58:33 UTC 2024","5747","","Дисциплина","Создание дисциплины","DisContingentCreationValidationTests","CheckUnableAddGroupFromAnotherCohortInCreation","Невозможно добавить группу из стороннего потока",""
"passed","Tue Sep 03 05:58:13 UTC 2024","Tue Sep 03 05:58:23 UTC 2024","9227","","Дисциплина","Создание дисциплины","DisciplineCreationValidationTests","CheckIfDescriptionNotFilledInCreation","Отображение ошибки валидации для поля 'Описание', если поле не заполнено в ВО",""
"passed","Tue Sep 03 05:50:09 UTC 2024","Tue Sep 03 05:50:13 UTC 2024","3556","Активность","Шаблон активности контрольной","Редактирование шаблона контрольной","TestTemplateEditingTests","CheckErrorInEditingNumOfAttemptsWithIncorrectValue","Ошибка валидации в поле Количество попыток сдачи, если введено значение больше 20",""
"passed","Tue Sep 03 05:55:38 UTC 2024","Tue Sep 03 05:55:46 UTC 2024","7509","","Чат","Обсуждение решения","TaskChatTests","CheckAddQuoteToLastMessageInTaskChat","Можно цитировать сообщение в обсуждении решения",""
"passed","Tue Sep 03 06:02:10 UTC 2024","Tue Sep 03 06:02:27 UTC 2024","17092","","Материал","Конструктор теста","TestBlocksAndVariantsValidationTests","CheckAddTestVariant","Конструктор теста: можно добавить вариант",""
"passed","Tue Sep 03 05:58:49 UTC 2024","Tue Sep 03 05:59:02 UTC 2024","12737","","Дисциплина","Редактирование дисциплины","DisciplineEditingTests","CheckAddTagInDiscipline","Можно добавлять теги знаний",""
"passed","Tue Sep 03 05:48:34 UTC 2024","Tue Sep 03 05:48:42 UTC 2024","7405","Активность","Задание","Страница решения задания для студента","TaskWithSolutionStudentTests","CheckAbilityToSeeListSolutions","Можно просмотреть список всех решений, если включена опция Решения открыты всем",""
"passed","Tue Sep 03 06:04:04 UTC 2024","Tue Sep 03 06:04:14 UTC 2024","10146","","Материал","Конструктор теста","TestQuestionAnswersValidationTests","CheckRemoveAnswerFromFreeAnswerExactMatchQuestion","Конструктор теста: можно удалить вариант ответа из вопроса с типом ответа 'Свободный ответ' – 'Точное совпадение'",""
"passed","Tue Sep 03 05:54:06 UTC 2024","Tue Sep 03 05:54:13 UTC 2024","6943","","Чат","Чат комнаты дисциплины","DisciplineRoomChatTests","CheckImpossibleToAddRoomIfNameFieldNotFilled","Невозможно добавить комнату, если не заполнено поле Название",""
"passed","Tue Sep 03 05:59:52 UTC 2024","Tue Sep 03 06:00:10 UTC 2024","17868","","Дисциплина","Редактирование дисциплины","DisContingentEditingValidationTests","CheckAddStudentsInTeachersField","Появление ошибки при попытке указать преподавателем студента из поля Студенты",""
"passed","Tue Sep 03 05:54:38 UTC 2024","Tue Sep 03 05:54:45 UTC 2024","6953","","Чат","Личный чат","PersonalChatTests","CheckDisciplineRoomIsOpened","Можно открыть личный чат",""
"passed","Tue Sep 03 05:53:13 UTC 2024","Tue Sep 03 05:53:30 UTC 2024","17159","","Чат","Миничат звонка дисциплины","DisciplineChatCallTests","CheckAddReactionToLastMessageInDisciplineCallChat","Можно добавить реакцию на сообщение в миничате звонка дисциплины",""
"passed","Tue Sep 03 06:06:51 UTC 2024","Tue Sep 03 06:07:05 UTC 2024","13572","","Биржа","","StockMarketTests","CheckSearchForDisciplineTemplateByActivityName","Биржа: шаблон дисциплины можно найти по названию его активности",""
"passed","Tue Sep 03 05:54:25 UTC 2024","Tue Sep 03 05:54:55 UTC 2024","29892","","Чат","Групповой чат","GroupChatTests","CheckAddGroupChatWithUsers","Можно добавить новый групповой чат для групп и студентов",""
"passed","Tue Sep 03 05:45:47 UTC 2024","Tue Sep 03 05:46:13 UTC 2024","25593","Активность","Обычная активность","Создание активности","ActivityCreatingTests","CreateActivityWithoutModule","Можно создать активность в дисциплине без модуля",""
