"Status","Start Time","Stop Time","Duration in ms","Parent Suite","Suite","Sub Suite","Test Class","Test Method","Name","Description"
"passed","Tue Oct 31 06:14:40 UTC 2023","Tue Oct 31 06:14:46 UTC 2023","6684","","Материал","Конструктор тест-тренажера","TestTrainQuestionAnswersValidationTests","CheckAddOneMoreOptionInComparisonTestQuestionInTestTrain","Конструктор теста-тренажера: можно добавить еще один вариант на сопоставление в вопрос с типом ответа 'Сопоставление'",""
"passed","Tue Oct 31 06:13:00 UTC 2023","Tue Oct 31 06:13:06 UTC 2023","5636","","Дисциплина","Редактирование дисциплины","DisContingentEditingValidationTests","CheckOnlyCohortGroupsAreShownInListOfGroups","Редактирование дисциплины: в выпадающем списке поля Группы отображаются только группы потока",""
"passed","Tue Oct 31 06:13:10 UTC 2023","Tue Oct 31 06:13:12 UTC 2023","2085","","Подразделения","Страница подразделения","DivisionPageTests","CheckProjectLabelIsDisplayedForAdditionalPrograms","Лейбл образовательного проекта отображается под названием программы ДО",""
"passed","Tue Oct 31 06:07:52 UTC 2023","Tue Oct 31 06:07:56 UTC 2023","4069","Активность","Контрольная","Редактирование контрольной","TestActivityEditingTests","ErrorWithIncorrectValueNumberOfAttemptsInTestActivity","Редактирование контрольной: отображение ошибки валидации для поля 'Количество попыток сдачи' с значением '0'",""
"passed","Tue Oct 31 06:11:20 UTC 2023","Tue Oct 31 06:11:27 UTC 2023","7533","","Чат","Чат для заметок","NotesChatTests","CheckDeleteMessageInNotesChat","Список чатов - чат для заметок: можно удалить сообщение",""
"passed","Tue Oct 31 06:14:27 UTC 2023","Tue Oct 31 06:14:34 UTC 2023","6786","","Материал","Конструктор теста","TestSettingsValidationTests","EditTestTimeLimit","Конструктор теста: можно изменить временной лимит",""
"passed","Tue Oct 31 06:14:34 UTC 2023","Tue Oct 31 06:14:47 UTC 2023","12298","","Организация","Создание организации","OrganizationCreationTests","CheckCreateOrganization","Создание организации: можно создать организацию, если заполнены только обязательные поля",""
"passed","Tue Oct 31 06:10:11 UTC 2023","Tue Oct 31 06:10:23 UTC 2023","11838","","Поток","Редактирование потока","CohortEditingTests","CheckEditCohortWhenAllRequiredFieldsAreFilled","Редактирование потока: успешное сохранение, если все обязательные поля корректно заполнены",""
"passed","Tue Oct 31 06:14:22 UTC 2023","Tue Oct 31 06:14:33 UTC 2023","10741","","Библиотека","","LibraryInListViewTests","CheckRemoveCatalogViaActionsButton","Библиотека, списочный вид: можно удалить каталог через actions-кнопки",""
"passed","Tue Oct 31 06:08:11 UTC 2023","Tue Oct 31 06:08:20 UTC 2023","8412","Активность","Контрольная","Прохождение теста","TestActivityPassingTests","PassingTest","Прохождение теста: можно пройти тест командной контрольной",""
"passed","Tue Oct 31 06:09:16 UTC 2023","Tue Oct 31 06:09:25 UTC 2023","8718","","Чат","Мини-чат группового чата","GroupMiniChatTests","CheckSendTextMessageInGroupMiniChat","Миничат - групповой чат: можно отправить текстовое сообщение",""
"passed","Tue Oct 31 06:12:15 UTC 2023","Tue Oct 31 06:12:21 UTC 2023","6669","","Дисциплина","Шаблон дисциплины","DisTemplateTests","CheckCreateDisTemplateWithFillingRequiredFields","Создание шаблона дисциплины: можно создать шаблон, если заполнены все обязательные поля",""
"passed","Tue Oct 31 06:14:49 UTC 2023","Tue Oct 31 06:14:51 UTC 2023","2412","","Организация","Страница организации","OrganizationPageTests","CheckTransitionToOrgLibraryPage","Страница организации: работает переход к библиотеке организации",""
"passed","Tue Oct 31 06:09:49 UTC 2023","Tue Oct 31 06:10:03 UTC 2023","14883","","Чат","Чат решения","TaskChatTests","CheckEditLastMessageInTaskChat","Список чатов - обсуждение решения: можно редактировать сообщение в течение 4 часов после отправки",""
"passed","Tue Oct 31 06:15:22 UTC 2023","Tue Oct 31 06:15:27 UTC 2023","5059","","Расписание","","ScheduleTests","CheckRememberingSelectedScheduleModes","Проверка запоминания выбора режимов расписания",""
"passed","Tue Oct 31 06:11:13 UTC 2023","Tue Oct 31 06:11:19 UTC 2023","6150","","Поток","Страница потока","CohortInfoTests","CheckNoAccessStudentToMaterialsCohortArchive","Страница потока: студенты не имеют доступ к материалам архивного потока по прямой ссылки",""
"passed","Tue Oct 31 06:06:51 UTC 2023","Tue Oct 31 06:06:59 UTC 2023","8619","","Активность","Задание","TaskActivityMulticriteriaTests","CheckCreateTaskWithoutPointOfCriteria","Нельзя создать задание с критериями, если не заполнены баллы критериев",""
"passed","Tue Oct 31 06:07:30 UTC 2023","Tue Oct 31 06:07:31 UTC 2023","1331","","Активность","Обычная активность","ActivityAddingTests","CheckAbsenceScormScoreField","Редактирование активности: отсутствия поля оценка по SCORM результату, если не добавлен SCORM пакет",""
"passed","Tue Oct 31 06:08:25 UTC 2023","Tue Oct 31 06:08:36 UTC 2023","11661","","Активность","Шаблон активности контрольной","TestTemplateCreatingTests","CreateTestActivityTemplate","Создание шаблона контрольной: если заполнены обязательные поля",""
"passed","Tue Oct 31 06:06:19 UTC 2023","Tue Oct 31 06:06:41 UTC 2023","21763","","Активность","Обычная активность","ActivityCreatingTests","CreateActivityWithoutModule","Cоздание активности: можно создать активность в дисциплине без модуля",""
"passed","Tue Oct 31 06:10:57 UTC 2023","Tue Oct 31 06:11:00 UTC 2023","2198","","Поток","Завершение обучения","EducationCompletionPageTests","FindStudentWithName","Поиск студента по ФИО на странице завершения обучения потока",""
"passed","Tue Oct 31 06:07:18 UTC 2023","Tue Oct 31 06:07:35 UTC 2023","16996","","Активность","Обычная активность","ActivityEditingTests","CheckDeleteActivityWithoutGrades","Редактирование активности: можно удалить активность без оценок",""
"passed","Tue Oct 31 06:13:51 UTC 2023","Tue Oct 31 06:14:02 UTC 2023","10362","","Материал","Конструктор теста","TestQuestionsValidationTests","CheckEditTestQuestionPionts","Конструктор теста: можно изменить баллы для вопроса",""
"passed","Tue Oct 31 06:08:02 UTC 2023","Tue Oct 31 06:08:10 UTC 2023","8389","","Активность","Задание","TaskWithSolutionStudentTests","CheckAbilityToEditAssessmentOfAnotherStudentsSolution","Можно редактировать поставленную оценку к решении другого студента, если включена 'Взаимопроверка'",""
"passed","Tue Oct 31 06:07:43 UTC 2023","Tue Oct 31 06:07:51 UTC 2023","7712","","Активность","Задание","TaskActivityTeacherTests","CheckGradeSolutionIncorrectValues","Отображение ошибки валидации для поля баллы, если вводить пробел",""
"passed","Tue Oct 31 06:12:43 UTC 2023","Tue Oct 31 06:12:53 UTC 2023","9157","","Дисциплина","Создание дисциплины","DisContingentCreationTests","CheckCreateDisciplineByCheckingBoxAllCohortStudents","Создание дисциплины: есть возможность создать дисциплину выбрав галку ‘Все студенты потока’",""
"passed","Tue Oct 31 06:14:09 UTC 2023","Tue Oct 31 06:14:28 UTC 2023","19361","","Материал","Конструктор тест-тренажера","TestTrainAddingQuestionsTests","CheckAddQuestionInTestTrainFreeAnswerWithDiapason","Конструктор теста-тренажера: можно добавить вопрос с типом ответа “Свободный ответ” - “Диапазон”",""
"passed","Tue Oct 31 06:14:31 UTC 2023","Tue Oct 31 06:14:40 UTC 2023","8920","","Материал","Конструктор тест-тренажера","TestTrainQuestionAnswersValidationTests","CheckAddOneMoreAnswerVariantInQuestionWithFreeAnswerExactMatchInTestTrain","Конструктор теста-тренажера: можно добавить еще один вариант ответа в вопрос с типом ответа 'Свободный ответ - точное совпадение'",""
"passed","Tue Oct 31 06:10:41 UTC 2023","Tue Oct 31 06:10:46 UTC 2023","5460","","Поток","Редактирование потока","CohortEditingTests","CheckEditCohortWithFillingAdministratorField","Редактирование потока ТГУ: успешное сохранение, с корректными значениями в поле ‘Администраторы потока’",""
"passed","Tue Oct 31 06:13:35 UTC 2023","Tue Oct 31 06:13:40 UTC 2023","4965","","Библиотека","","LibraryActionPanelTests","CheckFindMaterialByName","Библиотека, плиточный вид: можно найти материал в поиске по названию",""
"passed","Tue Oct 31 06:10:30 UTC 2023","Tue Oct 31 06:10:37 UTC 2023","6085","","Чат","Групповой чат","GroupChatTests","CheckSendMessageByTappingEnterInGroupChat","Список чатов - групповой чат: можно отправить сообщения по нажатию на Enter",""
"passed","Tue Oct 31 06:12:37 UTC 2023","Tue Oct 31 06:12:41 UTC 2023","3290","","Подразделения","Редактирование подразделения","DivisionEditingTests","CheckEditDivisionType","Можно поменять тип подразделения",""
"passed","Tue Oct 31 06:11:48 UTC 2023","Tue Oct 31 06:11:51 UTC 2023","2482","","Дисциплина","Редактирование дисциплины","DisciplineEditingValidationTests","CheckImpossibilityTurnOnOrOffIOT","Редактирование дисциплины: невозможно включить ИОТ, если в дисциплине есть активности",""
"passed","Tue Oct 31 06:12:26 UTC 2023","Tue Oct 31 06:12:37 UTC 2023","10420","","Дисциплина","Редактирование дисциплины","DisContingentEditingTests","CheckAddTeacherByUserInfoInEditing","Редактирование дисциплины: добавление преподавателя из списка",""
"passed","Tue Oct 31 06:12:26 UTC 2023","Tue Oct 31 06:12:32 UTC 2023","6167","","Дисциплина","Страница дисциплины","DisciplineAnalyticsTests","CheckActivityAndVolumeTooltipIsDisplayed","Страница аналитика дисциплины: у заголовок “Активности” и “Объём” есть тултип",""
"passed","Tue Oct 31 06:14:38 UTC 2023","Tue Oct 31 06:14:42 UTC 2023","4154","","Организация","Редактирование организации","OrganizationEditingTests","CheckCancelOrganizationEditing","Редактирование организации: работает кнопка Отмена",""
"passed","Tue Oct 31 06:12:03 UTC 2023","Tue Oct 31 06:12:17 UTC 2023","13876","","Дисциплина","Создание дисциплины","DisContingentCreationTests","CheckAddTeacherByUserInfoInCreation","Создание дисциплины: добавление преподавателя по email’у",""
"passed","Tue Oct 31 06:06:38 UTC 2023","Tue Oct 31 06:06:42 UTC 2023","4141","","Активность","Обычная активность","ActivityEditingTests","CheckEditNameActivity","Редактирование активности: можно изменить название",""
"passed","Tue Oct 31 06:12:57 UTC 2023","Tue Oct 31 06:13:00 UTC 2023","3676","","Дисциплина","Редактирование дисциплины","DisContingentEditingValidationTests","CheckGroupsAndStudentsFiledsIsAppearInEditing","Редактирование дисциплины: после снятии галки ‘Все студенты потока’ появляется поля Группы и Студенты",""
"passed","Tue Oct 31 06:10:55 UTC 2023","Tue Oct 31 06:11:00 UTC 2023","4890","","Поток","Редактирование потока","CohortEditingValidationTests","CheckEditCohortIfStartDateGreaterThanEndDate","Редактирование потока: ошибка валидации, если дата начала больше чем дата окончания",""
"passed","Tue Oct 31 06:13:15 UTC 2023","Tue Oct 31 06:13:31 UTC 2023","16105","","Библиотека","","LibraryInTileViewTests","CheckMoveMaterialToCatalogInTileView","Библиотека, плиточный вид: можно переместить материал в другой каталог",""
"passed","Tue Oct 31 06:06:50 UTC 2023","Tue Oct 31 06:07:00 UTC 2023","9872","","Активность","Обычная активность","ActivityCreatingTests","CreateActivityInTopic","Cоздание активности: можно создать активность в дисциплине в теме",""
"passed","Tue Oct 31 06:13:39 UTC 2023","Tue Oct 31 06:13:46 UTC 2023","7239","","Материал","Конструктор теста","TestQuestionAnswersValidationTests","CheckAddOneMoreOptionInComparisonTestQuestion","Конструктор теста: можно добавить еще один вариант на сопоставление в вопрос с типом ответа 'Сопоставление'",""
"passed","Tue Oct 31 06:14:35 UTC 2023","Tue Oct 31 06:14:36 UTC 2023","1118","","Организация","Мой тариф","MyPlanOrganizationPageTests","CheckOpenTableActiveUsers","Страница Мой тариф: проверка открытия таблицы активных пользователей",""
"passed","Tue Oct 31 06:09:57 UTC 2023","Tue Oct 31 06:10:03 UTC 2023","5602","","Поток","Создание потока","CohortCreationValidationTests","CheckCreateCohortIfEachDateNotFilled","Создание потока: ошибка валидации, если дата окончания  не указана",""
"passed","Tue Oct 31 06:06:19 UTC 2023","Tue Oct 31 06:06:51 UTC 2023","32126","","Активность","Обычная активность","ActivityEditingFormatTests","CheckActivityFormatIsOffline","Редактирование активности: проверка формата активности офлайн",""
"passed","Tue Oct 31 06:10:53 UTC 2023","Tue Oct 31 06:10:56 UTC 2023","3414","","Поток","Завершение обучения","EducationCompletionPageTests","CheckTransitionToEducationCompletionPage","Переход со страницы потока на страницу завершения обучения потока",""
"passed","Tue Oct 31 06:14:48 UTC 2023","Tue Oct 31 06:15:07 UTC 2023","18348","","Материал","Конструктор теста","TestAddingQuestionsTests","CheckAddComparisonTestQuestion","Конструктор теста: можно добавить вопрос с типом ответа “Сопоставление”",""
"passed","Tue Oct 31 06:09:48 UTC 2023","Tue Oct 31 06:10:03 UTC 2023","14813","","Чат","Личный чат","PersonalChatTests","CheckEditLastMessageInPersonalChat","Список чатов - личный чат: можно редактировать сообщение в течение 4 часов после отправки",""
"passed","Tue Oct 31 06:11:07 UTC 2023","Tue Oct 31 06:11:13 UTC 2023","5274","","Поток","Страница потока","CohortInfoTests","CheckAccessStudentToActivityCohortArchive","Страница потока: после восстановления из архива восстанавливается доступ к активностям",""
"passed","Tue Oct 31 06:12:52 UTC 2023","Tue Oct 31 06:13:03 UTC 2023","11128","","Библиотека","","LibraryInTileViewTests","CheckRenameCatalog","Библиотека, плиточный вид: можно переименовать каталог",""
"passed","Tue Oct 31 06:14:46 UTC 2023","Tue Oct 31 06:14:49 UTC 2023","2479","","Организация","Страница организации","OrganizationPageTests","CheckTooltipIsDisplayedByHoverProjectIcon","Страница организации: отображается тултип при наведении на иконку участника проекта",""
"passed","Tue Oct 31 06:14:09 UTC 2023","Tue Oct 31 06:14:18 UTC 2023","9133","","Материал","Конструктор тест-тренажера","TestTrainCreationTests","TestCreation","Конструктор теста-тренажера: создание теста-тренажера",""
"passed","Tue Oct 31 06:06:19 UTC 2023","Tue Oct 31 06:06:39 UTC 2023","19598","","Активность","Обычная активность","ActivityDurationTests","CheckIfDatesFilledCorrectInAcivity","Редактирование активности: успешное сохранение, если обе даты корректно заполнены",""
"passed","Tue Oct 31 06:13:06 UTC 2023","Tue Oct 31 06:13:11 UTC 2023","5276","","Библиотека","","BulkActionsLibraryTests","CheckCancelSelectedItems","Библиотека: можно отменить режим выбора, нажав на кнопку “Отмена” или сняв отметки с выбранных элементов",""
"passed","Tue Oct 31 06:12:15 UTC 2023","Tue Oct 31 06:12:18 UTC 2023","2915","","Дисциплина","Редактирование дисциплины","DisciplineEditingTests","CheckCancelButtonWork","Редактирование дисциплины: работает кнопка Отмена",""
"passed","Tue Oct 31 06:09:08 UTC 2023","Tue Oct 31 06:09:14 UTC 2023","6356","","Активность","Обычный шаблон активности","TemplateEditingTests","CheckEditDescriptionActivityTemplate","Редактирование шаблона активности: можно изменить описание",""
"passed","Tue Oct 31 06:07:41 UTC 2023","Tue Oct 31 06:07:53 UTC 2023","11774","Активность","Контрольная","Редактирование контрольной","TestActivityAddingTests","AddTestToTestActivity","Редактирование контрольной: можно добавить материал типа тест из библиотеки",""
"passed","Tue Oct 31 06:06:59 UTC 2023","Tue Oct 31 06:07:02 UTC 2023","2520","","Активность","Задание","TaskActivityTeacherTests","CheckGotoSolutions","Работает кнопка 'Перейти к решениям' для преподавателя",""
"passed","Tue Oct 31 06:10:32 UTC 2023","Tue Oct 31 06:10:42 UTC 2023","9580","","Чат","Чат для заметок","NotesChatTests","CheckSendEmojiInNotesChat","Список чатов - чат для заметок: можно отправить смайлики",""
"passed","Tue Oct 31 06:10:37 UTC 2023","Tue Oct 31 06:10:42 UTC 2023","5036","","Поток","Редактирование потока","CohortEditingValidationTests","CheckEditCohortIfNameNotFilled","Редактирование потока: ошибка валидации, если название не заполнено",""
"passed","Tue Oct 31 06:09:43 UTC 2023","Tue Oct 31 06:09:52 UTC 2023","9412","","Чат","Мини-чат страницы решений","TaskPageMiniChatTests","CheckSendTextMessageInTaskPageMiniChat","Чат на странице решения: можно отправить текстовое сообщение",""
"passed","Tue Oct 31 06:13:33 UTC 2023","Tue Oct 31 06:13:46 UTC 2023","12764","","Библиотека","","LibraryInListViewTests","CheckRemoveMaterialInListView","Библиотека, списочный вид: можно удалить материал",""
"failed","Tue Oct 31 06:17:55 UTC 2023","Tue Oct 31 06:18:28 UTC 2023","33042","","Библиотека","","LibraryActionPanelTests","CheckSwitchToAnotherLibrary","Библиотека, плиточный вид: можно переключаться на другую Библиотеку",""
"passed","Tue Oct 31 06:12:16 UTC 2023","Tue Oct 31 06:12:18 UTC 2023","2210","","Дисциплина","Создание дисциплины","DisContingentCreationValidationTests","CheckIsDisabledCheckboxAllStudentInCreatingDiscipline","Создание дисциплины (СЗ): галка ‘Все студенты потока’ дизаблена и невозможно его снять",""
"passed","Tue Oct 31 06:14:56 UTC 2023","Tue Oct 31 06:15:00 UTC 2023","3662","","Программа","","ProgramCreationTests","AddEducationProgaramWithError","Cоздание обр программы ДПО: если не заполнить одно обязательное поле",""
"passed","Tue Oct 31 06:08:45 UTC 2023","Tue Oct 31 06:08:51 UTC 2023","6182","","Активность","Шаблон активности контрольной","TestTemplateEditingTests","ErrorWithIncorrectValueNumberOfAttemptsInTestActivityTemplate","Редактирование шаблона контрольной: отображение ошибки валидации для поля 'Количество попыток сдачи' с отрицательным значением",""
"passed","Tue Oct 31 06:14:08 UTC 2023","Tue Oct 31 06:14:22 UTC 2023","14410","","Библиотека","","LibraryInListViewTests","CheckCopyMaterialViaActionsButton","Библиотека, списочный вид: можно скопировать материал через actions-кнопки",""
"passed","Tue Oct 31 06:14:20 UTC 2023","Tue Oct 31 06:14:31 UTC 2023","10690","","Материал","Конструктор тест-тренажера","TestTrainQuestionAnswersValidationTests","AddAnswerForQuestionInTestTrain","Конструктор теста-тренажера: можно добавить еще один вариант ответа в вопрос с типом ответа 'Выбор из вариантов'",""
"passed","Tue Oct 31 06:07:22 UTC 2023","Tue Oct 31 06:07:49 UTC 2023","26379","","Активность","Обычная активность","ActivityContentVisibilityTests","CheckVisibilityMaterialOutsideTimeActivity","Редактирование активности: видимость материала вне времени проведения активности",""
"passed","Tue Oct 31 06:10:03 UTC 2023","Tue Oct 31 06:10:15 UTC 2023","11577","","Чат","Чат решения","TaskChatTests","CheckAddQuoteToLastMessageInTaskChat","Список чатов - обсуждение решения: можно цитировать сообщению",""
"passed","Tue Oct 31 06:11:20 UTC 2023","Tue Oct 31 06:11:30 UTC 2023","10455","","Дисциплина","Страница дисциплины","DisciplineActivitiesBlockTests","CheckAddTopicInDiscipline","Страница дисциплины: создание темы",""
"passed","Tue Oct 31 06:15:03 UTC 2023","Tue Oct 31 06:15:08 UTC 2023","4677","","Программа","","ProgramEditingTests","CheckRemoveProgramFromItsAdministrator","Редактирование программы ДО: нет возможности удаления программы у его админа",""
"passed","Tue Oct 31 06:09:25 UTC 2023","Tue Oct 31 06:09:39 UTC 2023","13963","","Чат","Мини-чат группового чата","GroupMiniChatTests","CheckCallInGroupMiniChat","Миничат - групповой чат: можно сделать звонок",""
"passed","Tue Oct 31 06:07:48 UTC 2023","Tue Oct 31 06:07:52 UTC 2023","3613","","Активность","Обычная активность","ActivityDurationTests","CheckEditVolumeActivityWithIncorrectValues","Редактирование активности: отображение ошибки валидации для поля 'Объём' с значением '0'",""
