"Status","Start Time","Stop Time","Duration in ms","Parent Suite","Suite","Sub Suite","Test Class","Test Method","Name","Description"
"passed","Tue Sep 03 05:59:29 UTC 2024","Tue Sep 03 05:59:52 UTC 2024","22671","","Дисциплина","Дисциплина с ИОТ","IOTThemesAndModulesTests","CheckCannotCreateModuleInsideModule","Страница дисциплины с ИОТ: внутри модуля нельзя создать модуль",""
"passed","Tue Sep 03 05:58:02 UTC 2024","Tue Sep 03 05:58:12 UTC 2024","10155","","Дисциплина","Страница дисциплины","DisciplineAnalyticsTests","CheckOpenNotificationMailingListFromAnalytics","Можно перейти в рассылку уведомлений из аналитики дисциплины",""
"passed","Tue Sep 03 05:58:15 UTC 2024","Tue Sep 03 05:58:18 UTC 2024","3308","","Дисциплина","Редактирование дисциплины","DisciplineEditingValidationTests","CheckIfDescriptionNotFilledInEditing","Отображение ошибки валидации для поля Описание, если поле не заполнено в дисциплине ДО",""
"passed","Tue Sep 03 05:48:51 UTC 2024","Tue Sep 03 05:48:59 UTC 2024","8512","","Активность","Обычный шаблон активности","TemplateEditingTests","CheckEditActivityTemplateVolume","Успешное сохранение при корректных значениях в поле Объем в академических часах",""
"passed","Tue Sep 03 05:59:12 UTC 2024","Tue Sep 03 05:59:22 UTC 2024","10127","","Дисциплина","Редактирование дисциплины","DisContingentEditingValidationTests","CheckUnableAddGroupFromAnotherCohortInEditing","Редактирование дисциплины: невозможно добавить группу из стороннего потока",""
"passed","Tue Sep 03 05:59:53 UTC 2024","Tue Sep 03 05:59:59 UTC 2024","5753","","Подразделения","Редактирование подразделения","DivisionEditingTests","CheckEditDivisionName","Можно редактировать название подразделения",""
"passed","Tue Sep 03 06:06:50 UTC 2024","Tue Sep 03 06:07:02 UTC 2024","11695","","Профиль","","AddressAndContactsEditingTests","CheckCityField","Редактирование профиля пользователя: можно изменить город",""
"passed","Tue Sep 03 06:04:42 UTC 2024","Tue Sep 03 06:04:43 UTC 2024","1781","","Материал","Конструктор тест-тренажера","TestTrainBlocksAndVariantsValidationTests","ImpossibleToAddVariantInTestTrain","Конструктор теста-тренажера: отсутствует возможность добавить вариант",""
"passed","Tue Sep 03 06:06:55 UTC 2024","Tue Sep 03 06:07:03 UTC 2024","7932","","Расписание","","ScheduleTests","CheckRememberingSelectedScheduleModes","Проверка запоминания выбора режимов расписания",""
"passed","Tue Sep 03 05:50:21 UTC 2024","Tue Sep 03 05:50:25 UTC 2024","4173","Активность","Контрольная","Редактирование контрольной","TestActivityEditingTests","CheckErrorIsAppearIfRemoveTestActivityWithScore","Невозможно удалить контрольную при наличии оценок",""
"passed","Tue Sep 03 05:54:19 UTC 2024","Tue Sep 03 05:54:29 UTC 2024","10156","","Чат","Чат для заметок","NotesChatTests","CheckSendTextMessageInNotesChat","Можно отправить текстовое сообщение в чате для заметок",""
"passed","Tue Sep 03 05:58:46 UTC 2024","Tue Sep 03 05:58:55 UTC 2024","8268","","Дисциплина","Создание дисциплины","DisciplineCreationValidationTests","CheckIfCreditValuesNotAllowed","Отображение ошибки валидации для поля 'Кредиты' с отрицательным значением в ДО",""
"passed","Tue Sep 03 06:02:22 UTC 2024","Tue Sep 03 06:02:45 UTC 2024","22736","","Материал","Конструктор теста","TestQuestionAnswersValidationTests","CheckAddAnswerVariantInMultipleChoiceTestQuestion","Конструктор теста: можно добавить еще один вариант ответа в вопрос с типом ответа 'Выбор из вариантов'",""
"passed","Tue Sep 03 05:56:10 UTC 2024","Tue Sep 03 05:56:25 UTC 2024","15482","","Поток","Создание потока","CohortCreationTests","CheckCreateCohortWhenAllRequiredFieldsAreFilled","Создание потока ДО: можно создать поток, если все обязательные поля корректно заполнены",""
"passed","Tue Sep 03 05:46:55 UTC 2024","Tue Sep 03 05:47:11 UTC 2024","15090","Активность","Задание","Страница решения задания для преподавателя","TaskActivityTeacherTests","CheckGradeSolutionValueAboveAndBelowScore","Можно оценить решение значением выше минимального порога баллов",""
"passed","Tue Sep 03 05:58:44 UTC 2024","Tue Sep 03 05:58:47 UTC 2024","2210","","Дисциплина","Создание дисциплины","DisContingentCreationValidationTests","CheckIsDisabledCheckboxAllStudentInCreatingDiscipline","Чекбокс ‘Все студенты потока’ задизейблен и его невозможно снять",""
"passed","Tue Sep 03 05:50:26 UTC 2024","Tue Sep 03 05:50:48 UTC 2024","22348","","Чат","Миничат комнаты дисциплины","AccessToClosedRoomInMiniChat","CheckAccessToClosedRoomInMinichat","Отсутствие доступа в закрытую комнату в миничате пользователю, не состоящему в ней",""
"passed","Tue Sep 03 06:03:29 UTC 2024","Tue Sep 03 06:03:41 UTC 2024","11690","","Материал","Конструктор тест-тренажера","TestTrainBlocksAndVariantsValidationTests","EditTestTrainBlockName","Конструктор теста-тренажера: можно переименовать блок",""
"passed","Tue Sep 03 06:05:46 UTC 2024","Tue Sep 03 06:06:00 UTC 2024","14201","","Расписание","","ScheduleSettingsTests","CheckConnectSyncWithGoogleCalendar","Проверка подключения синхронизации с Google календарем",""
"passed","Tue Sep 03 06:07:41 UTC 2024","Tue Sep 03 06:07:47 UTC 2024","6713","","Профиль","","UserInfoPageTests","CheckStudentCannotViewPassedActivitiesOfAnotherStudent","Страница профиля пользователя: студент не может посмотреть пройденные активности другого студента",""
"passed","Tue Sep 03 06:07:07 UTC 2024","Tue Sep 03 06:07:14 UTC 2024","7589","","Профиль","","AddressAndContactsEditingTests","CheckUnlockContactFieldsAfterInterPassword","Редактирование профиля пользователя: после ввода пароля можно разблокировать полей 'Контакты'",""
"passed","Tue Sep 03 05:54:03 UTC 2024","Tue Sep 03 05:54:18 UTC 2024","14368","","Чат","Групповой чат","GroupChatMessageActionTests","CheckStartDiscussionUnderLeftSideMessageInGroupChat","Начать обсуждение с другим участником в групповом чате",""
"passed","Tue Sep 03 05:52:57 UTC 2024","Tue Sep 03 05:53:09 UTC 2024","11804","","Чат","Миничат дисциплины","DisciplineMiniChatTests","CheckAddReactionToLastMessageInDisciplineMiniChat","Можно добавить реакцию на сообщение в миничате дисциплины",""
"passed","Tue Sep 03 06:04:19 UTC 2024","Tue Sep 03 06:04:33 UTC 2024","13620","","Материал","Конструктор тест-тренажера","TestTrainQuestionAnswersValidationTests","CheckAddOneMoreAnswerVariantInQuestionWithFreeAnswerExactMatchInTestTrain","Конструктор теста-тренажера: можно добавить еще один вариант ответа в вопрос с типом ответа 'Свободный ответ - точное совпадение'",""
"passed","Tue Sep 03 05:46:08 UTC 2024","Tue Sep 03 05:46:18 UTC 2024","9941","Активность","Обычная активность","Редактирование активности","ActivityEditingFormatTests","CheckSwitchToOfflineActivityFormat","Можно переключится на формат активности Офлайн",""
"passed","Tue Sep 03 05:48:20 UTC 2024","Tue Sep 03 05:48:29 UTC 2024","8499","Активность","Задание","Страница решения задания для студента","TaskWithSolutionStudentTests","CheckRemoveSolution","Появление ошибки при удалении решения",""
"passed","Tue Sep 03 05:56:48 UTC 2024","Tue Sep 03 05:56:58 UTC 2024","10662","","Чат","Миничат личного чата","PersonalMiniChatTests","CheckDeleteMessageInPersonalMiniChat","Можно удалить сообщение в миничате личного чата",""
"passed","Tue Sep 03 05:51:18 UTC 2024","Tue Sep 03 05:51:37 UTC 2024","18670","","Чат","Миничат звонка комнаты дисциплины","DisciplineRoomChatCallTests","CheckSendEmptyMessageInDisciplineRoomCallChat","Невозможно отправить пустое сообщение в миничате звонка комнаты дисциплины",""
"passed","Tue Sep 03 06:06:44 UTC 2024","Tue Sep 03 06:06:55 UTC 2024","10990","","Расписание","","ScheduleTests","CheckThreeDayModeIsNotDisplayed","В десктопе нет возможности выбрать режим 3 дня",""
"passed","Tue Sep 03 05:45:47 UTC 2024","Tue Sep 03 05:46:27 UTC 2024","39481","Активность","Обычная активность","Редактирование активности","ActivityContentVisibilityTests","CheckVisibilityMaterialDuringActivity","Видимость материала во время проведения активности",""
"passed","Tue Sep 03 05:51:16 UTC 2024","Tue Sep 03 05:51:25 UTC 2024","9424","","Чат","Чат дисциплины","DisciplineChatTests","CheckSendEmptyMessageInDisciplineChat","Невозможно отправить пустое сообщение в чате дисциплины",""
"passed","Tue Sep 03 06:01:19 UTC 2024","Tue Sep 03 06:01:22 UTC 2024","2593","","Подразделения","Страница подразделения","DivisionPageTests","CheckExpandListOfArchivedPrograms","Можно посмотреть список архивных программ",""
"passed","Tue Sep 03 05:59:22 UTC 2024","Tue Sep 03 05:59:36 UTC 2024","13795","","Дисциплина","Редактирование дисциплины","DisContingentEditingValidationTests","CheckUnableAddStudentFromAnotherCohortInEditing","Редактирование дисциплины: невозможно добавить студента из стороннего потока",""
"passed","Tue Sep 03 06:02:43 UTC 2024","Tue Sep 03 06:03:09 UTC 2024","26283","","Библиотека","","LibraryInListViewTests","CheckMoveMaterialViaActionsButton","Библиотека, списочный вид: можно переместить материал через actions-кнопки",""
"passed","Tue Sep 03 05:57:47 UTC 2024","Tue Sep 03 05:58:06 UTC 2024","18897","","Поток","Страница потока","CohortInfoTests","CheckNoAccessStudentToMaterialsCohortArchive","Страница потока: студенты не имеют доступ к материалам архивного потока по прямой ссылки",""
"passed","Tue Sep 03 05:55:59 UTC 2024","Tue Sep 03 05:56:07 UTC 2024","8770","","Чат","Личный чат","PersonalChatTests","CheckSendMessageByTappingEnterInPersonalChat","Можно отправить сообщение по нажатию на Enter в личном чате",""
"passed","Tue Sep 03 06:06:13 UTC 2024","Tue Sep 03 06:06:35 UTC 2024","22448","","Расписание","","StudentScheduleSettingsTests","CheckAbilityToHideCompletedActivities","Проверка возможности скрыть пройденные активности под студентом",""
"passed","Tue Sep 03 05:56:14 UTC 2024","Tue Sep 03 05:56:26 UTC 2024","12031","","Чат","Миничат обсуждение решения","TaskMiniChatTests","CheckSendEmojiInTaskMiniChat","Можно отправить смайлики в миничате обсуждении решения",""
"passed","Tue Sep 03 05:57:12 UTC 2024","Tue Sep 03 05:57:28 UTC 2024","16328","","Чат","Миничат личного звонка","PersonalChatCallTests","CheckDeleteMessageInPersonalCallChat","Можно удалить сообщение в миничате личного звонка",""
"passed","Tue Sep 03 05:47:53 UTC 2024","Tue Sep 03 05:47:59 UTC 2024","6261","Активность","Обычная активность","Редактирование активности","ActivityDurationTests","CheckEditActivityVolumeWithIncorrectValue","Отображение ошибки валидации для поля Объем в академических часах со значением 0",""
"passed","Tue Sep 03 05:50:30 UTC 2024","Tue Sep 03 05:50:39 UTC 2024","8717","Активность","Шаблон активности контрольной","Редактирование шаблона контрольной","TestTemplateEditingTests","CheckSuccessEditingTimeLimitWithCorrectValue","Успешное сохранение при корректных значениях в поле Временной лимит",""
"passed","Tue Sep 03 06:03:04 UTC 2024","Tue Sep 03 06:03:17 UTC 2024","12739","","Материал","Конструктор теста","TestBlocksAndVariantsValidationTests","CheckDuplicateTestQuestion","Конструктор теста: можно дублировать вопрос",""
"passed","Tue Sep 03 06:01:50 UTC 2024","Tue Sep 03 06:01:57 UTC 2024","7109","","Экзамен","","ExamCreateEditTests","CheckEditExamName","Проверка на редактирование названия экзамена",""
"passed","Tue Sep 03 05:55:31 UTC 2024","Tue Sep 03 05:55:40 UTC 2024","9222","","Чат","Миничат для заметок","NotesMiniChatTests","CheckSendMessageByTappingEnterInNotesMiniChat","Можно отправить сообщение по нажатию на Enter в миничате для заметок",""
"broken","Tue Sep 03 06:02:03 UTC 2024","Tue Sep 03 06:02:34 UTC 2024","31198","","Материал","Конструктор теста","TestAddingQuestionsTests","CheckAddMultipleChoiceTestQuestion","Конструктор теста: можно добавить вопрос с типом ответа “Выбор из вариантов”",""
"passed","Tue Sep 03 05:53:35 UTC 2024","Tue Sep 03 05:53:55 UTC 2024","19213","","Чат","Миничат группового звонка","GroupChatCallTests","CheckSendMessageByTappingEnterInGroupCallChat","Можно отправить сообщение по нажатию на Enter в миничате группового звонка",""
"broken","Tue Sep 03 05:54:02 UTC 2024","Tue Sep 03 05:54:08 UTC 2024","5928","","Чат","Миничат группового чата","GroupMiniChatMessageTests","CheckSendEmptyMessageInGroupMiniChat","Невозможно отправить пустое сообщение в миничате группового чата",""
"passed","Tue Sep 03 05:55:09 UTC 2024","Tue Sep 03 05:55:17 UTC 2024","7911","","Чат","Миничат для заметок","NotesMiniChatTests","CheckSendEmojiInNotesMiniChat","Можно отправить смайлики в миничате для заметок",""
"passed","Tue Sep 03 05:56:21 UTC 2024","Tue Sep 03 05:56:28 UTC 2024","6855","","Поток","Создание потока","CohortCreationValidationTests","CheckCreateCohortIfStartDateGreaterThanEndDate","Создание потока: ошибка валидации, если дата начала больше чем дата окончания",""
"passed","Tue Sep 03 06:01:35 UTC 2024","Tue Sep 03 06:01:49 UTC 2024","13714","","Дисциплина","Редактирование дисциплины","DisContingentEditingTests","CheckEditDisciplineByCheckingBoxAllCohortStudents","Есть возможность сохранить дисциплину выбрав галку Все студенты потока",""
"passed","Tue Sep 03 06:03:28 UTC 2024","Tue Sep 03 06:03:40 UTC 2024","12665","","Материал","Конструктор теста","TestQuestionAnswersValidationTests","CheckAddCommentInTestAnswer","Конструктор теста: можно добавить комментарий к варианту ответа",""
"passed","Tue Sep 03 05:58:44 UTC 2024","Tue Sep 03 05:58:48 UTC 2024","3672","","Дисциплина","Страница дисциплины","DisciplineStudentTests","CheckGradesDropdownForStudent","Отсутствие кнопки 'Итоговые оценки (ведомость)' у студента",""
"passed","Tue Sep 03 05:59:57 UTC 2024","Tue Sep 03 06:00:00 UTC 2024","2913","","Подразделения","Создание подразделения","DivisionCreationTests","CheckCopyNameToShortnameFieldByDoubleClicking","Можно скопировать название в поле краткое название двойным кликом",""
"passed","Tue Sep 03 05:55:40 UTC 2024","Tue Sep 03 05:55:50 UTC 2024","10138","","Чат","Миничат для заметок","NotesMiniChatTests","CheckAddReactionToLastMessageInNotesMiniChat","Можно добавить реакцию на сообщение в миничате для заметок",""
"passed","Tue Sep 03 05:52:05 UTC 2024","Tue Sep 03 05:52:19 UTC 2024","13407","","Чат","Миничат комнаты дисциплины","DisciplineRoomMiniChatMessageTests","CheckAddQuoteToLastMessageInDisciplineRoomMiniChat","Можно цитировать сообщение в миничате добавленной комнаты",""
"passed","Tue Sep 03 05:52:55 UTC 2024","Tue Sep 03 05:53:05 UTC 2024","9102","","Чат","Групповой чат","GroupChatMessageActionTests","CheckDeleteMessageInGroupChat","Можно удалить сообщение из группового чата",""
"passed","Tue Sep 03 05:48:33 UTC 2024","Tue Sep 03 05:48:39 UTC 2024","6156","Активность","Контрольная","Редактирование контрольной","TestActivityEditingTests","CheckErrorInNumOfAttemptsFieldWithIncorrectValue","Ошибка валидации в поле Количество попыток сдачи, если введено значение больше 20",""
"passed","Tue Sep 03 05:56:00 UTC 2024","Tue Sep 03 05:56:10 UTC 2024","10176","","Чат","Миничат для заметок","NotesMiniChatTests","CheckDeleteMessageInNotesMiniChat","Можно удалить сообщение в миничате для заметок",""
"passed","Tue Sep 03 05:46:57 UTC 2024","Tue Sep 03 05:47:45 UTC 2024","47710","Активность","Обычная активность","Создание активности","ActivityCreatingTests","CheckCreateActivityFromTemplate","Можно создать активность из шаблона",""
"passed","Tue Sep 03 05:56:25 UTC 2024","Tue Sep 03 05:56:33 UTC 2024","8358","","Чат","Личный чат","PersonalChatTests","CheckDeleteMessageInPersonalChat","Можно удалить сообщение из личного чата",""
"passed","Tue Sep 03 06:05:52 UTC 2024","Tue Sep 03 06:06:27 UTC 2024","34668","","Материал","Конструктор теста","TestAddingQuestionsTests","CheckAddSortingTestQuestion","Конструктор теста: можно добавить вопрос с типом ответа “Сортировка”",""
"passed","Tue Sep 03 05:50:29 UTC 2024","Tue Sep 03 05:50:40 UTC 2024","11023","","Звонок","","CallTests","CheckTurnOnOffEquipmentInCall","Страница звонка: можно включить/отключить микрофон в звонке",""
"passed","Tue Sep 03 05:47:07 UTC 2024","Tue Sep 03 05:47:27 UTC 2024","19784","Активность","Обычная активность","Редактирование активности","ActivityDurationTests","ErrorWhenEndDateLessStartDateInActivity","Отображение ошибки валидации для полей дат, если дата окончания меньше даты начала",""
"passed","Tue Sep 03 05:54:20 UTC 2024","Tue Sep 03 05:54:29 UTC 2024","9048","","Чат","Миничат группового чата","GroupMiniChatMessageTests","CheckAddQuoteToLastMessageInGroupMiniChat","Можно цитировать сообщение в миничате группового чата",""
"passed","Tue Sep 03 05:55:17 UTC 2024","Tue Sep 03 05:55:27 UTC 2024","10673","","Чат","Миничат обсуждение решения","TaskMiniChatTests","CheckSendEmptyMessageInTaskMiniChat","Невозможно отправить пустое сообщение в миничате обсуждении решения",""
"passed","Tue Sep 03 06:01:13 UTC 2024","Tue Sep 03 06:01:37 UTC 2024","24111","","Библиотека","","LibraryActionPanelTests","CheckCreateTextMaterial","Библиотека, плиточный вид: можно создать материал типа 'Текстовый материал'",""
"passed","Tue Sep 03 05:55:34 UTC 2024","Tue Sep 03 05:55:46 UTC 2024","12179","","Чат","Миничат личного чата","PersonalMiniChatTests","CheckCallInPersonalMiniChat","Можно сделать звонок в миничате личного чата",""
"broken","Tue Sep 03 06:00:40 UTC 2024","Tue Sep 03 06:00:55 UTC 2024","14279","","Экзамен","","ExamCreateEditTests","CreateExamRVP","Создание экзамена РВП",""
"passed","Tue Sep 03 06:02:24 UTC 2024","Tue Sep 03 06:02:39 UTC 2024","15451","","Материал","Конструктор теста","TestQuestionsValidationTests","CheckAddCommentInTestQuestion","Конструктор теста: можно добавить комментария к вопросу",""
"passed","Tue Sep 03 06:07:33 UTC 2024","Tue Sep 03 06:07:38 UTC 2024","5617","","Биржа","","StockMarketLotTests","CheckTransitionToOwnMaterialPage","Страница лота: кнопка Страница материала работает для преподавателя, выставившего этот материал на Биржу",""
"passed","Tue Sep 03 05:49:50 UTC 2024","Tue Sep 03 05:50:21 UTC 2024","31264","Активность","Контрольная","Прохождение теста","TestActivityStatusWithTwoOrMoreAttemptsTests","CheckResultOfPassingDependOnSettings","Результат тестирования в попытках зависит от настройки За лучшую попытку в индивидуальной контрольной",""
"passed","Tue Sep 03 06:06:05 UTC 2024","Tue Sep 03 06:06:11 UTC 2024","6458","","Программа","","ProgramEditingTests","CheckRemoveProgramFromItsAdministrator","Проверка удаления программы ДО админом данной программы",""
"passed","Tue Sep 03 05:57:57 UTC 2024","Tue Sep 03 05:58:08 UTC 2024","10772","","Дисциплина","Редактирование дисциплины","DisciplineEditingTests","CheckSetNameField","Можно изменить название",""
"passed","Tue Sep 03 05:57:36 UTC 2024","Tue Sep 03 05:57:45 UTC 2024","9125","","Дисциплина","Настройка чата дисциплины","DisciplineChatBlockTests","CheckNotAccessOpenChatActivity","Страница активности: нет доступа к кнопке Открыть чат дисциплины, если чат отключен",""
"passed","Tue Sep 03 05:56:26 UTC 2024","Tue Sep 03 05:56:32 UTC 2024","6122","","Поток","Создание потока","CohortCreationWarningModalTests","CheckCreateCohortWithMismatchWarningOfDuration","Создание потока: предупреждение о несоответствии длительности потока для программ длительностью 144 часа",""
"passed","Tue Sep 03 05:51:25 UTC 2024","Tue Sep 03 05:51:38 UTC 2024","12891","","Чат","Чат дисциплины","DisciplineChatTests","CheckEditLastMessageInDisciplineChat","Можно редактировать сообщение в течение 4 часов после отправки в чате дисциплины",""
"passed","Tue Sep 03 05:56:24 UTC 2024","Tue Sep 03 05:56:34 UTC 2024","9589","","Чат","Обсуждение решения","TaskChatTests","CheckDeleteMessageInTaskChat","Можно удалить сообщение из обсуждении решения",""
"passed","Tue Sep 03 05:54:00 UTC 2024","Tue Sep 03 05:54:22 UTC 2024","22631","","Чат","Миничат группового чата","GroupMiniChatTests","CheckRestoreGroupChatFromArchiveInMinichat","Можно восстановить групповой чат из архива в миничате",""
