"Status","Start Time","Stop Time","Duration in ms","Parent Suite","Suite","Sub Suite","Test Class","Test Method","Name","Description"
"passed","Mon Nov 20 05:31:30 UTC 2023","Mon Nov 20 05:31:33 UTC 2023","2701","","Программа","","ProgramEditingTests","CheckRemoveProgramWithCohort","Редактирование программы ДО: невозможно удалить программу с потоками",""
"passed","Mon Nov 20 05:21:26 UTC 2023","Mon Nov 20 05:21:38 UTC 2023","12383","","Активность","Задание","TaskActivityCreatingTests","CheckCreateTaskWithMutualVerification","Можно создать задание с взаимопроверкой",""
"passed","Mon Nov 20 05:30:04 UTC 2023","Mon Nov 20 05:30:10 UTC 2023","6572","","Материал","Конструктор теста","TestSettingsValidationTests","AddTagInTest","Конструктор теста: можно добавлять теги знаний",""
"passed","Mon Nov 20 05:27:28 UTC 2023","Mon Nov 20 05:27:35 UTC 2023","6797","","Дисциплина","Редактирование дисциплины","DisciplineDurationTests","CheckIfEndDateEmptyInDiscipline","Редактирование дисциплины: наличия ошибки если поле дата окончания пустое",""
"passed","Mon Nov 20 05:24:18 UTC 2023","Mon Nov 20 05:24:30 UTC 2023","11882","","Чат","Мини-чат группового чата","GroupMiniChatTests","CheckSendTextMessageInGroupMiniChat","Миничат - групповой чат: можно отправить текстовое сообщение",""
"passed","Mon Nov 20 05:26:42 UTC 2023","Mon Nov 20 05:26:52 UTC 2023","9735","","Чат","Чат для заметок","NotesChatTests","CheckAddReactionToLastMessageInNotesChat","Список чатов - чат для заметок: можно добавить реакцию на сообщение",""
"passed","Mon Nov 20 05:23:42 UTC 2023","Mon Nov 20 05:23:45 UTC 2023","2816","Активность","Контрольная","Редактирование контрольной","TestActivityEditingTests","CheckErrorIsAppearIfRemoveTestActivityWithScore","Невозможно удалить контрольную при наличии оценок",""
"passed","Mon Nov 20 05:25:16 UTC 2023","Mon Nov 20 05:25:20 UTC 2023","4598","","Поток","Создание потока","CohortCreationValidationTests","CheckCreateCohortIfStartAndEndDateAreSame","Создание потока: ошибка валидации, если дата начала и окончания совпадают",""
"passed","Mon Nov 20 05:31:09 UTC 2023","Mon Nov 20 05:31:11 UTC 2023","2403","","Организация","Создание организации","OrganizationCreationTests","CheckCopyNameToShortnameByDoubleClicking","Создание организации: можно скопировать название в поле краткое название двойным кликом",""
"failed","Mon Nov 20 05:34:45 UTC 2023","Mon Nov 20 05:34:46 UTC 2023","438","","Активность","Шаблон активности контрольной","TestTemplateEditingTests","CheckErrorInEditingNumOfAttemptsWithIncorrectValue","Ошибка валидации в поле Количество попыток сдачи, если введено значение 0",""
"passed","Mon Nov 20 05:24:33 UTC 2023","Mon Nov 20 05:24:48 UTC 2023","14581","","Чат","Дисциплина","DisciplineChatTests","CheckAddQuoteToLastMessageInDisciplineChat","Список чатов - комната дисциплины: можно цитировать сообщению",""
"passed","Mon Nov 20 05:23:53 UTC 2023","Mon Nov 20 05:24:13 UTC 2023","19642","Активность","Контрольная","Прохождение теста","TestActivityStatusWithOneAttemptTests","CheckStatusScoreColorAndIcon","Страница командной контрольной: статус и цвет у количества баллов в попытке различаются в зависимости от успешности",""
"passed","Mon Nov 20 05:29:45 UTC 2023","Mon Nov 20 05:29:57 UTC 2023","11618","","Библиотека","","LibraryInListViewTests","CheckRenameMaterialInListView","Библиотека, списочный вид: можно переименовать материал",""
"passed","Mon Nov 20 05:24:47 UTC 2023","Mon Nov 20 05:24:59 UTC 2023","12535","","Чат","Мини-чат страницы решений","TaskPageMiniChatTests","CheckSendTextMessageInTaskPageMiniChat","Чат на странице решения: можно отправить текстовое сообщение",""
"passed","Mon Nov 20 05:29:40 UTC 2023","Mon Nov 20 05:29:47 UTC 2023","6867","","Материал","Конструктор теста","TestQuestionAnswersValidationTests","CheckAddOneMoreOptionInComparisonTestQuestion","Конструктор теста: можно добавить еще один вариант на сопоставление в вопрос с типом ответа 'Сопоставление'",""
"passed","Mon Nov 20 05:23:29 UTC 2023","Mon Nov 20 05:23:42 UTC 2023","13057","","Активность","Шаблон активности контрольной","TestTemplateCreatingTests","CreateTestActivityTemplate","Можно создать шаблон контрольной, если заполнены обязательные поля",""
"passed","Mon Nov 20 05:25:45 UTC 2023","Mon Nov 20 05:25:48 UTC 2023","3250","","Поток","Редактирование потока","CohortEditingTests","CheckEditCohortByFillingMaxNumberOfStudents","Редактирование потока: успешное сохранение, с корректными значениями в поле ‘Максимальное количество студентов’",""
"passed","Mon Nov 20 05:21:52 UTC 2023","Mon Nov 20 05:21:56 UTC 2023","4025","","Активность","Задание","TaskWithSolutionStudentTests","CheckAbilityToSeeListSolutions","Можно просмотреть список всех решений, если включена 'Решения открыты всем'",""
"passed","Mon Nov 20 05:25:24 UTC 2023","Mon Nov 20 05:25:45 UTC 2023","21602","","Чат","Дисциплина","DisciplineChatTests","CheckFindDisciplineChatByNameInSearch","Список чатов - комната дисциплины: можно найти чат в поиске по названию",""
"passed","Mon Nov 20 05:22:25 UTC 2023","Mon Nov 20 05:22:39 UTC 2023","13932","","Активность","Обычная активность","ActivityEditingTests","CheckDeleteActivityWithoutGrades","Редактирование активности: можно удалить активность без оценок",""
"passed","Mon Nov 20 05:22:34 UTC 2023","Mon Nov 20 05:22:51 UTC 2023","17718","Активность","Контрольная","Прохождение теста","TestActivityPassingTests","CheckPassingTestInControlActivity","Можно пройти тест индивидуальной контрольной",""
"passed","Mon Nov 20 05:27:47 UTC 2023","Mon Nov 20 05:27:53 UTC 2023","5837","","Дисциплина","Редактирование дисциплины","DisciplineEditingTests","CheckSetDescriptionField","Редактирование дисциплины: можно изменить описание",""
"passed","Mon Nov 20 05:31:57 UTC 2023","Mon Nov 20 05:32:04 UTC 2023","6961","","Профиль","","UserInfoPageTests","CheckIfUserPhotoCanBeDeleted","Страница профиля пользователя: можно удалить фото",""
"passed","Mon Nov 20 05:25:48 UTC 2023","Mon Nov 20 05:25:54 UTC 2023","5781","","Поток","Редактирование потока","CohortEditingTests","CheckRemoveCohortWithoutDisciplinesAndSemesters","Редактирование потока: можно удалить поток без дисциплин и семестров",""
"passed","Mon Nov 20 05:21:27 UTC 2023","Mon Nov 20 05:21:30 UTC 2023","2678","","Активность","Задание","TaskActivityTeacherTests","CheckGradeSolutionWithoutValue","Кнопка 'Оценить' некликабельна, если решение еще не оценено",""
"passed","Mon Nov 20 05:32:17 UTC 2023","Mon Nov 20 05:32:21 UTC 2023","3966","","Профиль","","UserInfoPageTests","CheckStudentCannotViewPassedActivitiesOfAnotherStudent","Страница профиля пользователя: студент не может посмотреть пройденные активности другого студента",""
"passed","Mon Nov 20 05:23:30 UTC 2023","Mon Nov 20 05:23:58 UTC 2023","28170","Активность","Контрольная","Прохождение теста","TestActivityStatusWithTwoOrMoreAttemptsTests","ResultOfPassingDependOnSettings","Страница командной контрольной: результат тестирования из попытках зависеть от настройки 'За лучшую попытку'",""
"passed","Mon Nov 20 05:27:40 UTC 2023","Mon Nov 20 05:27:46 UTC 2023","5709","","Дисциплина","Редактирование дисциплины","DisciplineEditingValidationTests","CheckIfCreditNotFilled","Редактирование дисциплины: отображение ошибки валидации для поля 'Кредиты' с отрицательным значением",""
"passed","Mon Nov 20 05:25:39 UTC 2023","Mon Nov 20 05:25:46 UTC 2023","6950","","Чат","Групповой чат","GroupChatTests","CheckFindGroupChatByNameInSearch","Список чатов - групповой чат: можно найти чат в поиске по названию",""
"passed","Mon Nov 20 05:30:17 UTC 2023","Mon Nov 20 05:30:44 UTC 2023","26614","","Библиотека","","LibraryInListViewTests","CheckMoveMaterialViaActionsButton","Библиотека, списочный вид: можно переместить материал через actions-кнопки",""
"passed","Mon Nov 20 05:30:55 UTC 2023","Mon Nov 20 05:31:08 UTC 2023","12893","","Библиотека","","LibraryInTileViewTests","CheckRemoveCatalog","Библиотека, плиточный вид: можно удалить каталог",""
"passed","Mon Nov 20 05:23:18 UTC 2023","Mon Nov 20 05:23:30 UTC 2023","11807","Активность","Контрольная","Результат прохождения теста","TestActivityResultTests","TeacherCanLeaveCommentOnAnswer","Результат прохождения: преподаватель может изменить комментарий к ответу, если включена опция подробная информация о результатах",""
"passed","Mon Nov 20 05:23:12 UTC 2023","Mon Nov 20 05:23:30 UTC 2023","18711","Активность","Контрольная","Страница контрольной","TestCommandActivityTests","CheckEditTeamInCommandControlActivity","Можно редактировать команду в командной контрольной",""
"passed","Mon Nov 20 05:28:03 UTC 2023","Mon Nov 20 05:28:18 UTC 2023","15284","","Дисциплина","Страница дисциплины","DisciplineMarksAndAttendanceTests","ChecEditTotalFormula","Страница оценок дисциплины: редактирования формулы промежуточного результата",""
"passed","Mon Nov 20 05:23:13 UTC 2023","Mon Nov 20 05:23:20 UTC 2023","7117","Активность","Контрольная","Редактирование контрольной","TestActivityEditingTests","CheckSuccessSaveWithCorrectValueInTimeLimitField","Успешное сохранение при корректных значениях в поле Временной лимит",""
"passed","Mon Nov 20 05:27:20 UTC 2023","Mon Nov 20 05:27:30 UTC 2023","9970","","Дисциплина","Страница дисциплины","DisciplineAnalyticsTests","CheckOpenNotificationMailingListFromAnalytics","Страница аналитика дисциплины: можно перейти в рассылку уведомлений",""
"passed","Mon Nov 20 05:25:01 UTC 2023","Mon Nov 20 05:25:16 UTC 2023","14751","","Чат","Чат решения","TaskChatTests","CheckAddQuoteToLastMessageInTaskChat","Список чатов - обсуждение решения: можно цитировать сообщению",""
"passed","Mon Nov 20 05:30:18 UTC 2023","Mon Nov 20 05:30:27 UTC 2023","9266","","Материал","Конструктор теста","TestSettingsValidationTests","ClearTagsFromTest","Конструктор теста: можно удалить теги знаний",""
"passed","Mon Nov 20 05:25:53 UTC 2023","Mon Nov 20 05:25:57 UTC 2023","3879","","Чат","Дисциплина","DisciplineChatTests","CheckOpenImageInDisciplineChat","Список чатов - комната дисциплины: можно раскрывать изображения",""
"passed","Mon Nov 20 05:26:52 UTC 2023","Mon Nov 20 05:26:57 UTC 2023","5423","","Чат","Дисциплина","DisciplineChatTests","CheckMembersOfDisciplineChatIsDisplayed","Список чатов - комната дисциплины: отображаются участники чата при клике на блок с аватарками",""
"passed","Mon Nov 20 05:29:54 UTC 2023","Mon Nov 20 05:30:02 UTC 2023","7697","","Материал","Конструктор теста","TestBlocksAndVariantsValidationTests","CheckDuplicateTestQuestion","Конструктор теста: можно дублировать вопрос",""
"passed","Mon Nov 20 05:28:34 UTC 2023","Mon Nov 20 05:28:42 UTC 2023","7972","","Библиотека","","BulkActionsLibraryTests","CheckChooseButtonExistInMenu","Библиотека: наличие пункта “Выбрать” в меню при правом клике на каталог или материал",""
"passed","Mon Nov 20 05:30:06 UTC 2023","Mon Nov 20 05:30:14 UTC 2023","7726","","Материал","Конструктор тест-тренажера","TestTrainBlocksAndVariantsValidationTests","EditTestTrainBlockName","Конструктор теста-тренажера: можно переименовать блок",""
"passed","Mon Nov 20 05:31:30 UTC 2023","Mon Nov 20 05:31:41 UTC 2023","10340","","Расписание","","ScheduleSettingsTests","CheckConnectSyncWithGoogleCalendar","Проверка подключения синхронизации с Google календарем",""
"passed","Mon Nov 20 05:27:05 UTC 2023","Mon Nov 20 05:27:17 UTC 2023","11464","","Дисциплина","Редактирование дисциплины","DisciplineDurationTests","CheckIfDatesFilledCorrectInDiscipline","Редактирование дисциплины: успешное сохранение, если обе даты корректно заполнены",""
"passed","Mon Nov 20 05:27:20 UTC 2023","Mon Nov 20 05:27:25 UTC 2023","4168","","Дисциплина","Редактирование дисциплины","DisciplineEditingValidationTests","CheckIfShortnameNotFilledInEditing","Редактирование дисциплины: отображение ошибки валидации для поля 'Краткое название', если поле не заполнено",""
"passed","Mon Nov 20 05:22:39 UTC 2023","Mon Nov 20 05:22:47 UTC 2023","8515","","Активность","Обычный шаблон активности","TemplateEditingTests","CheckEditVolumeActivityTemplate","Редактирование шаблона активности: успешное сохранение при корректных значениях в поля 'Объём'",""
"skipped","Mon Nov 20 05:35:01 UTC 2023","Mon Nov 20 05:35:02 UTC 2023","354","","Библиотека","","LibraryMaterialTests","CheckVisibilityOfLaTeXMaterialPreview","Превью материала: LaTeX отображается как PDF",""
"passed","Mon Nov 20 05:22:09 UTC 2023","Mon Nov 20 05:22:17 UTC 2023","7617","","Активность","Задание","TaskActivityTeacherTests","CheckGradeSolutionIncorrectValues","Отображение ошибки валидации для поля баллы, если вводить пробел",""
"passed","Mon Nov 20 05:26:14 UTC 2023","Mon Nov 20 05:26:18 UTC 2023","4046","","Поток","Страница потока","CohortInfoTests","CheckWindowsSendCohortArchive","Страница потока: при архивации потока появляется модалка подтверждения действия",""
"passed","Mon Nov 20 05:23:00 UTC 2023","Mon Nov 20 05:23:08 UTC 2023","7699","Активность","Контрольная","Результат прохождения теста","TestActivityResultTests","ClockIconAndTruFalseButtonsAreDisplayed","Результат прохождения: отображается иконка часы, кнопки верно и неверно в вопросах с типом ответа свободный ответ или файл",""
"passed","Mon Nov 20 05:27:38 UTC 2023","Mon Nov 20 05:27:49 UTC 2023","10491","","Дисциплина","Создание дисциплины","DisciplineCreationValidationTests","CheckIfCreditValuesNotAllowed","Создание дисциплины ДО: отображение ошибки валидации для поля 'Кредиты' с отрицательным значением",""
"passed","Mon Nov 20 05:28:19 UTC 2023","Mon Nov 20 05:28:25 UTC 2023","5901","","Дисциплина","Создание дисциплины","DisContingentCreationValidationTests","CheckOnlyCohortStudentsAreShownInListOfStudents","Создание дисциплины: в выпадающем списке поля Студенты отображаются только студенты потока",""
"passed","Mon Nov 20 05:32:11 UTC 2023","Mon Nov 20 05:32:13 UTC 2023","1832","","Профиль","","UserInfoPageTests","CheckBlockOfPassedActivitiesAreDisplayed","Страница профиля пользователя: для студента отображаются пройденные активности",""
"passed","Mon Nov 20 05:26:41 UTC 2023","Mon Nov 20 05:26:47 UTC 2023","6586","","Дисциплина","Редактирование дисциплины","DisciplineAccessTests","CheckIfAdminEducProgChangeDiscipline","Редактирование дисциплины: есть возможность редактировать у администратора образовательной программы, к которой дисциплина относится",""
"passed","Mon Nov 20 05:21:28 UTC 2023","Mon Nov 20 05:21:56 UTC 2023","28118","","Активность","Обычная активность","ActivityContentVisibilityTests","CheckHideMaterial","Редактирование активности: можно скрыть материал",""
"passed","Mon Nov 20 05:24:42 UTC 2023","Mon Nov 20 05:24:59 UTC 2023","16986","","Чат","Личный чат","PersonalChatTests","CheckEditLastMessageInPersonalChat","Список чатов - личный чат: можно редактировать сообщение в течение 4 часов после отправки",""
"passed","Mon Nov 20 05:26:50 UTC 2023","Mon Nov 20 05:27:03 UTC 2023","12519","","Дисциплина","Страница дисциплины","DisciplineActivitiesBlockTests","CheckAddTopicInDiscipline","Страница дисциплины: создание темы",""
"passed","Mon Nov 20 05:28:55 UTC 2023","Mon Nov 20 05:29:11 UTC 2023","16086","","Дисциплина","Редактирование дисциплины","DisContingentEditingTests","CheckAddGroupAndStudentToDiscipline","Редактирование дисциплины: добавления к дисциплине групп и студентов",""
"passed","Mon Nov 20 05:28:35 UTC 2023","Mon Nov 20 05:28:40 UTC 2023","4351","","Подразделения","Редактирование подразделения","DivisionEditingTests","CheckEditDivisionType","Можно поменять тип подразделения",""
"passed","Mon Nov 20 05:22:22 UTC 2023","Mon Nov 20 05:22:29 UTC 2023","6838","","Активность","Обычный шаблон активности","TemplateEditingTests","CheckAddTagInActivityTemplate","Редактирование шаблона активности: можно добавлять теги знаний",""
"passed","Mon Nov 20 05:22:08 UTC 2023","Mon Nov 20 05:22:16 UTC 2023","8604","","Активность","Задание","TaskWithSolutionStudentTests","CheckAbilityToEvaluateAnotherStudentsSolution","Можно оценить решения другого студента, если включена 'Взаимопроверка'",""
"passed","Mon Nov 20 05:26:30 UTC 2023","Mon Nov 20 05:26:45 UTC 2023","14571","","Дисциплина","Страница дисциплины","DisciplineActivitiesBlockTests","CheckAddModuleInDiscipline","Страница дисциплины: создание модуля",""
"passed","Mon Nov 20 05:25:36 UTC 2023","Mon Nov 20 05:25:50 UTC 2023","13538","","Поток","Создание потока","CohortCreationWarningModalTests","CheckCreateCohortAfterChangeMismatchWarningOfDuration","Создание потока: можно создать поток после внесения правок в длительность потока",""
"passed","Mon Nov 20 05:30:10 UTC 2023","Mon Nov 20 05:30:18 UTC 2023","8038","","Материал","Конструктор теста","TestSettingsValidationTests","ChangeLevelAssimilationInTestTag","Конструктор теста: можно изменить уровень усвоения в добавленном теге знаний",""
"passed","Mon Nov 20 05:25:09 UTC 2023","Mon Nov 20 05:25:16 UTC 2023","6904","","Поток","Создание потока","CohortCreationValidationTests","CheckCreateCohortIfEachDateNotFilled","Создание потока: ошибка валидации, если дата окончания  не указана",""
"passed","Mon Nov 20 05:26:10 UTC 2023","Mon Nov 20 05:26:21 UTC 2023","10831","","Чат","Чат для заметок","NotesChatTests","CheckSendEmojiInNotesChat","Список чатов - чат для заметок: можно отправить смайлики",""
"passed","Mon Nov 20 05:27:50 UTC 2023","Mon Nov 20 05:27:58 UTC 2023","7962","","Дисциплина","Создание дисциплины","DisContingentCreationValidationTests","CheckUnableAddGroupFromAnotherCohortInCreation","Создание дисциплины: невозможно добавить группу из стороннего потока",""
"passed","Mon Nov 20 05:29:30 UTC 2023","Mon Nov 20 05:29:36 UTC 2023","5480","","Дисциплина","Редактирование дисциплины","DisContingentEditingTests","CheckCreateDisciplineByUncheckingBoxAllCohortStudents","Редактирование дисциплины: есть возможность сохранить дисциплину сняв галку ‘Все студенты потока’",""
"passed","Mon Nov 20 05:26:19 UTC 2023","Mon Nov 20 05:26:20 UTC 2023","1816","","Поток","Завершение обучения","EducationCompletionPageTests","CheckTransitionToCohortInfoPage","Переход со страницы завершения обучения на страницу потока",""
"passed","Mon Nov 20 05:27:15 UTC 2023","Mon Nov 20 05:27:22 UTC 2023","7355","","Дисциплина","Редактирование дисциплины","DisciplineEditingTests","CheckSetNameField","Редактирование дисциплины: можно изменить название",""
"passed","Mon Nov 20 05:23:23 UTC 2023","Mon Nov 20 05:23:30 UTC 2023","6862","Активность","Контрольная","Прохождение теста","TestActivityStatusWithOneAttemptTests","StatusChangesIfMinThresholdChanges","Страница индивидуальной контрольной: статус меняется, если преподаватель меняет минимальный порог баллов",""
"passed","Mon Nov 20 05:21:30 UTC 2023","Mon Nov 20 05:21:35 UTC 2023","5216","","Активность","Задание","TaskWithSolutionStudentTests","CheckSendFileSolution","Можно отправить файловый ответ",""
"passed","Mon Nov 20 05:27:25 UTC 2023","Mon Nov 20 05:27:38 UTC 2023","13320","","Дисциплина","Создание дисциплины","DisciplineCreationTests","CreatDisciplineFromDisciplineTemplate","Создание дисциплины ДО: можно создать дисциплину из шаблона дисциплины без активностей",""
"passed","Mon Nov 20 05:25:21 UTC 2023","Mon Nov 20 05:25:25 UTC 2023","4293","","Поток","Редактирование потока","CohortEditingTests","CheckCancelCohortEditingByDirectLink","Редактирование потока ДО: работает кнопка 'Отмена', если страница редактирование был открыть по прямой ссылке",""
