"Status","Start Time","Stop Time","Duration in ms","Parent Suite","Suite","Sub Suite","Test Class","Test Method","Name","Description"
"passed","Thu Sep 21 16:49:27 UTC 2023","Thu Sep 21 16:49:32 UTC 2023","4784","","Дисциплина","Страница дисциплины","DisciplineActivitiesBlockTests","CheckCancelAddModule","Страница дисциплины: отмена создания модуля",""
"passed","Thu Sep 21 16:50:06 UTC 2023","Thu Sep 21 16:50:29 UTC 2023","23498","","Дисциплина","Страница дисциплины","DisciplineStudentTests","CheckPinDisciplineForStudent","Страница дисциплины: работает закрепление или открепление дисциплины в боковом меню для студента",""
"passed","Thu Sep 21 16:51:25 UTC 2023","Thu Sep 21 16:51:42 UTC 2023","17052","","Библиотека","","RemovingTemplatesTests","CheckDeleteProgramTemplate","Страница библиотеки: можно удалить шаблон программы",""
"passed","Thu Sep 21 16:59:46 UTC 2023","Thu Sep 21 16:59:56 UTC 2023","9782","Активность","Контрольная","Результат прохождения теста","TestActivityResultTests","TeacherCanLeaveCommentOnAnswer","Результат прохождения: преподаватель может изменить комментарий к ответу, если включена опция подробная информация о результатах",""
"passed","Thu Sep 21 16:46:16 UTC 2023","Thu Sep 21 16:46:24 UTC 2023","8633","Активность","Контрольная","Редактирование контрольной","TestActivityEditingTests","EditingGradeFieldsInTestActivity","Редактирование контрольной: можно переключать значения в поле 'Оценка'",""
"passed","Thu Sep 21 16:47:24 UTC 2023","Thu Sep 21 16:47:33 UTC 2023","8640","","Чат","Чат для заметок","NotesChatTests","CheckSendEmptyMessageInNotesChat","Список чатов - чат для заметок: невозможно отправить пустое сообщение",""
"passed","Thu Sep 21 16:51:14 UTC 2023","Thu Sep 21 16:51:25 UTC 2023","11182","","Библиотека","","BulkActionsLibraryTests","CheckInSelectModeFirstElementIsSelected","Библиотека: при переходе в режим выбора первый элемент должен быть выбран",""
"passed","Thu Sep 21 16:48:24 UTC 2023","Thu Sep 21 16:48:35 UTC 2023","11659","","Чат","Личный чат","PersonalChatTests","CheckSendEmojiInPersonalChat","Список чатов - личный чат: можно отправить смайлики",""
"passed","Thu Sep 21 16:49:57 UTC 2023","Thu Sep 21 16:50:02 UTC 2023","5669","","Дисциплина","Редактирование дисциплины","DisciplineEditingTests","CheckSetNameField","Редактирование дисциплины: можно изменить название",""
"passed","Thu Sep 21 16:50:39 UTC 2023","Thu Sep 21 16:50:49 UTC 2023","9864","","Дисциплина","Страница дисциплины","DisciplineRightMenuTests","CheckDisCreditsAndVolumeIsDisplayed","Страница дисциплины: отображаются кредиты и объём дисциплины",""
"passed","Thu Sep 21 16:46:17 UTC 2023","Thu Sep 21 16:46:25 UTC 2023","8514","Активность","Контрольная","Результат прохождения теста","TestActivityResultTests","ClockIconAndTruFalseButtonsAreDisplayed","Результат прохождения: отображается иконка часы, кнопки верно и неверно в вопросах с типом ответа свободный ответ или файл",""
"passed","Thu Sep 21 16:49:30 UTC 2023","Thu Sep 21 16:49:39 UTC 2023","8968","","Чат","Групповой чат","GroupChatTests","CheckSendGroupChatToArchive","Список чатов - групповой чат: можно отправить чат в архив",""
"passed","Thu Sep 21 16:47:44 UTC 2023","Thu Sep 21 16:47:53 UTC 2023","9680","Активность","Контрольная","Результат прохождения теста","TestActivityResultTests","MarkIncorrectAnswerThatWasMarkedAsCorrect","Результат прохождения: можно отметить 'Не верно' ответ вопроса, который был отмечен как 'Верно'",""
"passed","Thu Sep 21 16:50:35 UTC 2023","Thu Sep 21 16:50:38 UTC 2023","3211","","Дисциплина","Создание дисциплины","DisContingentCreationValidationTests","CheckGroupsAndStudentsFiledsIsAppearInCreation","Создание дисциплины: после снятии галки ‘Все студенты потока’ появляется поля Группы и Студенты",""
"passed","Thu Sep 21 16:45:00 UTC 2023","Thu Sep 21 16:45:06 UTC 2023","5830","","Активность","Задание","TaskWithSolutionStudentTests","CheckSendSolutionForAnotherStudent","Страница решение задания: нет возможности отправить решения за другого студента",""
"passed","Thu Sep 21 16:51:19 UTC 2023","Thu Sep 21 16:51:23 UTC 2023","3898","","Дисциплина","Страница дисциплины","DisciplineAnalyticsTests","CheckStubIsDisplayedIfNoStudentsInDiscipline","Страница аналитика дисциплины: отображается заглушка, если в дисциплине нет студентов или активностей",""
"passed","Thu Sep 21 16:53:25 UTC 2023","Thu Sep 21 16:53:48 UTC 2023","23567","","Материал","Конструктор теста","TestAddingQuestionsTests","CheckAddComparisonTestQuestion","Конструктор теста: можно добавить вопрос с типом ответа “Сопоставление”",""
"passed","Thu Sep 21 16:51:32 UTC 2023","Thu Sep 21 16:51:45 UTC 2023","12147","","Библиотека","","LibraryActionPanelTests","CheckAddFileToLibrary","Библиотека, плиточный вид: можно загрузить материал типа “Файл” с компьютера",""
"passed","Thu Sep 21 16:59:31 UTC 2023","Thu Sep 21 16:59:45 UTC 2023","13673","","Материал","Конструктор теста","TestQuestionsValidationTests","CheckEditTestQuestionPionts","Конструктор теста: можно изменить баллы для вопроса",""
"passed","Thu Sep 21 16:52:48 UTC 2023","Thu Sep 21 16:52:57 UTC 2023","8641","","Материал","Конструктор теста","TestBlocksAndVariantsValidationTests","CheckRenameTestBlock","Конструктор теста: можно переименовать блок",""
"passed","Thu Sep 21 16:47:43 UTC 2023","Thu Sep 21 16:48:02 UTC 2023","18928","","Чат","Мини-чат решения","TaskMiniChatTests","CheckSendTextMessageInTaskMiniChat","Миничат - обсуждение решения: можно отправить текстовое сообщение",""
"passed","Thu Sep 21 16:49:43 UTC 2023","Thu Sep 21 16:49:51 UTC 2023","8622","","Дисциплина","Создание дисциплины","DisciplineCreationValidationTests","CheckIfShortnameNotFilledInCreation","Создание дисциплины ДО: отображение ошибки валидации для поля 'Краткое название', если поле не заполнено",""
"passed","Thu Sep 21 16:49:09 UTC 2023","Thu Sep 21 16:49:14 UTC 2023","4228","","Дисциплина","Редактирование дисциплины","DisciplineAccessTests","CheckIfTeacherChangeDiscipline","Редактирование дисциплины: есть возможность редактировать у преподавателя этой дисциплины",""
"passed","Thu Sep 21 16:47:28 UTC 2023","Thu Sep 21 16:47:36 UTC 2023","7556","Активность","Контрольная","Результат прохождения теста","TestActivityResultTests","TeacherCannotLeaveCommentOnAnswer","Результат прохождения: преподаватель не может оставить комментарий к ответу, если отключена опция подробная информация о результатах",""
"passed","Thu Sep 21 16:50:42 UTC 2023","Thu Sep 21 16:50:48 UTC 2023","6182","","Дисциплина","Создание дисциплины","DisContingentCreationValidationTests","CheckOnlyCohortStudentsAreShownInListOfStudents","Создание дисциплины: в выпадающем списке поля Студенты отображаются только студенты потока",""
"passed","Thu Sep 21 16:45:27 UTC 2023","Thu Sep 21 16:45:42 UTC 2023","15064","","Активность","Обычный шаблон активности","TemplateAddingTests","CheckAddMaterialFromLibraryActivityTemplate","Редактирование шаблона активности: можно добавить материал типа текст из библиотеки",""
"passed","Thu Sep 21 16:45:39 UTC 2023","Thu Sep 21 16:45:53 UTC 2023","13967","Активность","Контрольная","Редактирование контрольной","TestActivityAddingTests","CheckAddFileToTestActivity","Редактирование контрольной: можно загрузить материал типа файл с компьютера",""
"passed","Thu Sep 21 16:48:04 UTC 2023","Thu Sep 21 16:48:25 UTC 2023","21249","","Поток","","CohortCreationTests","CheckCreateCohortFromTemplateWhenAllRequiredFieldsAreFilled","Создание потока ДО: можно создать поток из шаблона, если все обязательные поля корректно заполнены",""
"passed","Thu Sep 21 16:48:03 UTC 2023","Thu Sep 21 16:48:10 UTC 2023","7631","Активность","Контрольная","Результат прохождения теста","TestActivityResultTests","MarkCorrectAnswerThatWasMarkedAsIncorrect","Результат прохождения: можно отметить 'Верно' ответ вопроса, который был отмечен как 'Не верно'",""
"passed","Thu Sep 21 16:44:59 UTC 2023","Thu Sep 21 16:45:31 UTC 2023","32431","","Активность","Обычная активность","ActivityContentVisibilityTests","CheckHideMaterial","Редактирование активности: можно скрыть материал",""
"passed","Thu Sep 21 16:49:53 UTC 2023","Thu Sep 21 16:50:02 UTC 2023","9393","","Дисциплина","Страница дисциплины","DisciplineAnalyticsTests","CheckOpenNotificationMailingListFromAnalytics","Страница аналитика дисциплины: можно перейти в рассылку уведомлений",""
"passed","Thu Sep 21 16:44:41 UTC 2023","Thu Sep 21 16:44:53 UTC 2023","12207","","Активность","Задание","TaskActivityMulticriteriaTests","CheckCreateTaskMultiCriteria","Создание задания: можно создать задание с критерием",""
"passed","Thu Sep 21 16:52:37 UTC 2023","Thu Sep 21 16:53:02 UTC 2023","24633","","Материал","Конструктор теста","TestAddingQuestionsTests","CheckAddQuestionWithFreeAnswerRange","Конструктор теста: можно добавить вопрос с типом ответа “Свободный ответ” - “Диапазон”",""
"passed","Thu Sep 21 16:45:22 UTC 2023","Thu Sep 21 16:45:25 UTC 2023","2983","","Активность","Задание","TaskWithSolutionStudentTests","CheckImpossibilityToEditAnotherStudentsSolutionGrade","Страница решение задания: нет возможности оценить решения другого студента, если не включена 'Взаимопроверка'",""
"passed","Thu Sep 21 16:50:51 UTC 2023","Thu Sep 21 16:50:55 UTC 2023","4349","","Подразделения","","DivisionCommonTests","CreateDivision","Создать подразделение заполнить только обязательные поля",""
"passed","Thu Sep 21 16:54:37 UTC 2023","Thu Sep 21 16:54:39 UTC 2023","2023","","Профиль","","UserInfoPageTests","CheckIfUserActivityIsLoading","Страница профиля пользователя: загружается блок 'Работа в Odin' для пользователя",""
"passed","Thu Sep 21 16:49:26 UTC 2023","Thu Sep 21 16:49:32 UTC 2023","5971","","Дисциплина","Страница дисциплины","DisciplineAnalyticsTests","CheckThreeDotMenuOnAnalyticsTabIsDisplayed","Страница аналитика дисциплины: наличие тридот меню на вкладке “Аналитика”",""
"passed","Thu Sep 21 16:59:31 UTC 2023","Thu Sep 21 16:59:45 UTC 2023","13792","","Библиотека","","LibraryInTileViewTests","CheckRenameMaterialInTileView","Библиотека, плиточный вид: можно переименовать материал",""
"passed","Thu Sep 21 16:51:17 UTC 2023","Thu Sep 21 16:51:32 UTC 2023","14434","","Дисциплина","Шаблон дисциплины","DisTemplateTests","CheckAddActivityInDisTemplate","Страница шаблона дисциплины: можно добавить шаблон активности выбрав его из библиотеки",""
"passed","Thu Sep 21 16:48:17 UTC 2023","Thu Sep 21 16:48:23 UTC 2023","6545","","Чат","Чат для заметок","NotesChatTests","CheckSendFileMessageInNotesChat","Список чатов - чат для заметок: можно прикрепить и отправить файл с компьютера",""
"passed","Thu Sep 21 16:48:56 UTC 2023","Thu Sep 21 16:49:12 UTC 2023","16679","","Чат","Групповой чат","GroupChatTests","CheckPinLastMessageInGroupChat","Список чатов - групповой чат: можно закреплять сообщения",""
"passed","Thu Sep 21 16:50:54 UTC 2023","Thu Sep 21 16:51:03 UTC 2023","8748","","Библиотека","","BulkActionsLibraryTests","CheckChooseButtonExistInMenu","Библиотека: наличие пункта “Выбрать” в меню при правом клике на каталог или материал",""
"passed","Thu Sep 21 16:47:01 UTC 2023","Thu Sep 21 16:47:10 UTC 2023","9307","","Чат","Дисциплина","DisciplineChatTests","CheckSendTextMessageInDisciplineChat","Список чатов - комната дисциплины: можно отправить текстовое сообщение",""
"passed","Thu Sep 21 16:49:55 UTC 2023","Thu Sep 21 16:50:06 UTC 2023","11077","","Дисциплина","Редактирование дисциплины","DisciplineDurationTests","CheckIfDatesFilledCorrectInDiscipline","Редактирование дисциплины: успешное сохранение, если обе даты корректно заполнены",""
"passed","Thu Sep 21 16:50:21 UTC 2023","Thu Sep 21 16:50:35 UTC 2023","13622","","Дисциплина","Страница дисциплины","DisciplineAnalyticsTests","CheckFilterByStudentName","Страница аналитика дисциплины: работает фильтр по имени студента",""
"passed","Thu Sep 21 16:52:11 UTC 2023","Thu Sep 21 16:52:37 UTC 2023","25985","","Материал","Конструктор теста","TestAddingQuestionsTests","CheckAddQuestionWithFreeAnswerExactMatch","Конструктор теста: можно добавить вопрос с типом ответа “Свободный ответ” - “Точное совпадение”",""
"passed","Thu Sep 21 16:50:25 UTC 2023","Thu Sep 21 16:50:28 UTC 2023","3376","","Дисциплина","Страница дисциплины","DisciplineRightMenuTests","CheckOpenDisciplineChatFromDisPage","Страница дисциплины: можно открыть мини-чат нажав 'Открыть чат дисциплины'",""
"passed","Thu Sep 21 16:48:56 UTC 2023","Thu Sep 21 16:49:00 UTC 2023","3403","","Поток","","CohortInfoTests","CheckWindowsSendCohortArchive","Страница потока: При архивации потока появляется модалка подтверждения действия",""
"passed","Thu Sep 21 16:54:10 UTC 2023","Thu Sep 21 16:54:12 UTC 2023","1986","","Расписание","","ScheduleTests","GoToSchedulePage","Страница расписания: при переходе с дашборда открывается расписание",""
"passed","Thu Sep 21 16:50:02 UTC 2023","Thu Sep 21 16:50:10 UTC 2023","7842","","Дисциплина","Редактирование дисциплины","DisciplineEditingTests","CheckSetShortnameField","Редактирование дисциплины: можно изменить краткое название, сделав двойной клик по названию дисциплины",""
"passed","Thu Sep 21 16:45:40 UTC 2023","Thu Sep 21 16:45:46 UTC 2023","6317","","Активность","Обычный шаблон активности","TemplateEditingValidationTests","CheckNegativeEditVolumeActivityTemplate","Редактирование шаблона активности: отображение ошибки валидации для поля 'Объём' с значением '0'",""
"passed","Thu Sep 21 16:46:33 UTC 2023","Thu Sep 21 16:46:47 UTC 2023","14181","","Активность","Шаблон активности контрольной","TestTemplateAddingTests","AddTestToTestActivityTemplate","Редактирование шаблона контрольной: можно добавить материал типа тест из библиотеки",""
"passed","Thu Sep 21 16:44:46 UTC 2023","Thu Sep 21 16:44:56 UTC 2023","9798","","Активность","Обычная активность","ActivityEditingTests+ActivityEditingFormatTests","CheckActivityFormatIsHybrid","Редактирование активности: проверка формата активности гибрид",""
"passed","Thu Sep 21 16:49:15 UTC 2023","Thu Sep 21 16:49:25 UTC 2023","9856","","Поток","","CohortEditingValidationTests","CheckEditCohortIfStartDateGreaterThanEndDate","Редактирование потока: ошибка валидации, если дата начала больше чем дата окончания",""
"passed","Thu Sep 21 16:44:57 UTC 2023","Thu Sep 21 16:45:05 UTC 2023","8236","","Активность","Обычная активность","ActivityEditingTests","CheckAddTagInActivity","Редактирование активности: можно добавлять теги знаний",""
"passed","Thu Sep 21 16:48:57 UTC 2023","Thu Sep 21 16:49:05 UTC 2023","8274","","Чат","Мини-чат страницы решений","TaskPageMiniChatTests","CheckSendMessageByTappingEnterInTaskPageMiniChat","Чат на странице решения: можно отправить сообщения по нажатию на Enter",""
"passed","Thu Sep 21 16:45:53 UTC 2023","Thu Sep 21 16:46:02 UTC 2023","9708","Активность","Контрольная","Прохождение теста","TestActivityPassingTests","PassingTest","Прохождение теста: можно пройти тест индивидуальной контрольной",""
"passed","Thu Sep 21 16:54:33 UTC 2023","Thu Sep 21 16:54:43 UTC 2023","10041","","Профиль","","AddressAndContactsEditingTests","CheckEmailField","Редактирование профиля пользователя: можно изменить email",""
"passed","Thu Sep 21 16:59:41 UTC 2023","Thu Sep 21 16:59:47 UTC 2023","5812","","Программа","","ProgramEditingTests","CheckRemoveProgramWithoutCohort","Редактирование программы ВО: можно удалить программу без потоков",""
"passed","Thu Sep 21 16:46:35 UTC 2023","Thu Sep 21 16:46:45 UTC 2023","10386","","Активность","Шаблон активности контрольной","TestTemplateCreatingTests","CreateTestActivityTemplate","Создание шаблона контрольной: если заполнены обязательные поля",""
"passed","Thu Sep 21 16:44:39 UTC 2023","Thu Sep 21 16:44:46 UTC 2023","7044","","Активность","Задание","TaskActivityTeacherTests","CheckSetIndividualDate","Страница решение задания: можно установить индивидуальный срок сдачи",""
"passed","Thu Sep 21 16:50:36 UTC 2023","Thu Sep 21 16:50:41 UTC 2023","4467","","Дисциплина","Страница дисциплины","DisciplineStudentTests","CheckGradingByStudent","Страница оценок дисциплины: невозможности выставления оценки студентом",""
"passed","Thu Sep 21 16:50:08 UTC 2023","Thu Sep 21 16:50:11 UTC 2023","3082","","Дисциплина","Редактирование дисциплины","DisciplineEditingValidationTests","CheckImpossibilityTurnOnOrOffIOT","Редактирование дисциплины: невозможно включить ИОТ, если в дисциплине есть активности",""
"passed","Thu Sep 21 16:47:06 UTC 2023","Thu Sep 21 16:47:12 UTC 2023","5876","","Активность","Шаблон активности контрольной","TestTemplateEditingTests","EditingGradeFieldsInTestActivityTemplate","Редактирование шаблона контрольной: переключение значения в поле 'Оценка'",""
"passed","Thu Sep 21 16:53:16 UTC 2023","Thu Sep 21 16:53:27 UTC 2023","10762","","Материал","Конструктор теста","TestQuestionAnswersValidationTests","CheckEditCommentInTestAnswer","Конструктор теста: можно изменить комментарий к варианту ответа",""
"passed","Thu Sep 21 16:54:53 UTC 2023","Thu Sep 21 16:54:59 UTC 2023","5590","","Профиль","","UserInfoPageTests","CheckSetPassword","Страница профиля пользователя: можно изменить пароль",""
"passed","Thu Sep 21 16:49:57 UTC 2023","Thu Sep 21 16:50:01 UTC 2023","4160","","Дисциплина","Редактирование дисциплины","DisciplineEditingValidationTests","CheckIfNameNotFilledInEditing","Редактирование дисциплины: отображение ошибки валидации для поля 'Название', если поле не заполнено",""
"passed","Thu Sep 21 16:54:16 UTC 2023","Thu Sep 21 16:54:19 UTC 2023","3360","","Расписание","","ScheduleSettingsTests","CancelSyncGoogleCalendar","Страница расписания: проверка кнопки Отмена синхронизации с google календарем",""
"passed","Thu Sep 21 16:44:41 UTC 2023","Thu Sep 21 16:44:49 UTC 2023","7398","","Активность","Обычная активность","ActivityEditingTests","CheckEditNameActivity","Редактирование активности: можно изменить название",""
"passed","Thu Sep 21 16:48:35 UTC 2023","Thu Sep 21 16:48:46 UTC 2023","11601","","Чат","Мини-чат страницы решений","TaskPageMiniChatTests","CheckSendEmojiInTaskInTaskPageMiniChat","Чат на странице решения: можно отправить смайлики",""
"passed","Thu Sep 21 16:52:23 UTC 2023","Thu Sep 21 16:53:39 UTC 2023","75308","","Библиотека","","BulkActionsLibraryTests","CheckCancelSelectedItems","Библиотека: можно отменить режим выбора, нажав на кнопку “Отмена” или сняв отметки с выбранных элементов",""
"passed","Thu Sep 21 16:44:35 UTC 2023","Thu Sep 21 16:44:41 UTC 2023","6336","","Активность","Задание","TaskActivityMulticriteriaTests","CheckMultiCriteriaCheckboxInTask","Создание задания: чекбокс многокритериальная проверка не отображается, если выбрана взаимопроверка",""
"passed","Thu Sep 21 16:45:41 UTC 2023","Thu Sep 21 16:45:52 UTC 2023","11844","Активность","Контрольная","Создание контрольной","TestActivityCreatingTests","CreateTestActivity","Создание контрольной: можно создать контрольную, если заполнены обязательные поля",""
"passed","Thu Sep 21 16:46:49 UTC 2023","Thu Sep 21 16:46:54 UTC 2023","5909","","Активность","Шаблон активности контрольной","TestTemplateEditingTests","ErrorWithIncorrectValueNumberOfAttemptsInTestActivityTemplate","Редактирование шаблона контрольной: отображение ошибки валидации для поля 'Количество попыток сдачи' с значением '0'",""
