"Status","Start Time","Stop Time","Duration in ms","Parent Suite","Suite","Sub Suite","Test Class","Test Method","Name","Description"
"passed","Tue Feb 06 01:27:37 UTC 2024","Tue Feb 06 01:28:13 UTC 2024","36680","Активность","Контрольная","Прохождение теста","TestActivityStatusWithTwoOrMoreAttemptsTests","CheckResultOfPassingDependOnSettings","Результат тестирования в попытках зависит от настройки За лучшую попытку в индивидуальной контрольной",""
"passed","Tue Feb 06 01:26:10 UTC 2024","Tue Feb 06 01:26:15 UTC 2024","4560","Активность","Задание","Страница решения задания для студента","TaskWithSolutionStudentTests","CheckRemoveSolution","Появление ошибки при удалении решения",""
"passed","Tue Feb 06 01:31:33 UTC 2024","Tue Feb 06 01:31:40 UTC 2024","7435","","Чат","Групповой чат","GroupChatTests","CheckRestoreGroupChatFromArchive","можно восстановить чат из архива",""
"passed","Tue Feb 06 01:29:43 UTC 2024","Tue Feb 06 01:30:05 UTC 2024","21225","","Чат","Мини-чат дисциплины","DisciplineMiniChatTests","CheckPinLastMessageInDisciplineMiniChat","можно закреплять сообщения",""
"passed","Tue Feb 06 01:35:40 UTC 2024","Tue Feb 06 01:35:49 UTC 2024","8761","","Библиотека","","LibraryActionPanelTests","CheckCreateCatalog","Библиотека, плиточный вид: можно создать каталог",""
"passed","Tue Feb 06 01:36:26 UTC 2024","Tue Feb 06 01:36:38 UTC 2024","11895","","Дисциплина","Дисциплина с ИОТ","IOTGraphTests","CheckBlockRemoving","Страница дисциплины с ИОТ: можно удалить блок",""
"passed","Tue Feb 06 01:33:18 UTC 2024","Tue Feb 06 01:33:22 UTC 2024","3947","","Поток","Редактирование потока","CohortEditingValidationTests","CheckEditCohortIfEachDateNotFilled","Редактирование потока: ошибка валидации, если дата окончания не заполнена",""
"passed","Tue Feb 06 01:38:57 UTC 2024","Tue Feb 06 01:39:07 UTC 2024","9390","","Профиль","","GeneralUserInfoEditingTests","CheckUserNameFiledsInTransliteration","Редактирование профиля пользователя: можно изменить ФИО в транслитерации",""
"passed","Tue Feb 06 01:27:32 UTC 2024","Tue Feb 06 01:27:45 UTC 2024","13297","","Звонок","","CallTests","CheckTurnOnOffEquipmentInCall","Страница звонка: можно включить/отключить микрофон в звонке",""
"passed","Tue Feb 06 01:32:55 UTC 2024","Tue Feb 06 01:33:00 UTC 2024","5146","","Чат","Мини-чат личного чата","PersonalMiniChatTests","CheckOpenImageInPersonalMiniChat","можно раскрывать изображения",""
"passed","Tue Feb 06 01:26:05 UTC 2024","Tue Feb 06 01:26:12 UTC 2024","7351","Активность","Задание","Страница решения задания для преподавателя","TaskActivityTeacherTests","CheckGradeSolutionIncorrectValues","Отображение ошибки валидации для поля Баллы со значением отлично",""
"passed","Tue Feb 06 01:26:02 UTC 2024","Tue Feb 06 01:26:05 UTC 2024","3290","","Активность","Обычный шаблон активности","TemplateEditingValidationTests","CheckScormResultScoreFieldNotDisplayed","Отсутствует поле Оценка по SCORM результату, если SCORM пакет был добавлен не в контрольную",""
"passed","Tue Feb 06 01:25:17 UTC 2024","Tue Feb 06 01:25:29 UTC 2024","12228","Активность","Задание","Создание задания","TaskActivityMulticriteriaTests","CheckCreateTaskMultiCriteria","Можно создать активность типа Задание с критериями",""
"passed","Tue Feb 06 01:38:14 UTC 2024","Tue Feb 06 01:38:19 UTC 2024","5085","","Организация","Создание организации","OrganizationCreationTests","CheckValidationErrorInRequiredFieldsIfTheyNotFilled","Создание организации: ошибка валидации в обязательных полях, если они не заполнены",""
"passed","Tue Feb 06 01:27:45 UTC 2024","Tue Feb 06 01:28:04 UTC 2024","18359","","Чат","Мини-чат звонка дисциплины","DisciplineChatCallTests","CheckSendEmptyMessageInDisciplineCallChat","невозможно отправить пустое сообщение",""
"passed","Tue Feb 06 01:28:35 UTC 2024","Tue Feb 06 01:28:52 UTC 2024","16879","","Чат","Мини-чат дисциплины","DisciplineMiniChatTests","CheckCallInDisciplineMiniChat","можно сделать звонок",""
"passed","Tue Feb 06 01:32:16 UTC 2024","Tue Feb 06 01:32:31 UTC 2024","15284","","Чат","Мини-чат личного чата","PersonalMiniChatTests","CheckCallInPersonalMiniChat","можно сделать звонок",""
"passed","Tue Feb 06 01:36:15 UTC 2024","Tue Feb 06 01:36:33 UTC 2024","18132","","Библиотека","","RemovingTemplatesTests","CheckDeleteProgramTemplateFromWhichCohortIsCreated","Страница библиотеки: можно удалить шаблон программы по которому был создан поток",""
"passed","Tue Feb 06 01:31:19 UTC 2024","Tue Feb 06 01:31:28 UTC 2024","9536","","Чат","Мини-чат для заметок","NotesMiniChatTests","CheckSendEmojiInNotesMiniChat","можно отправить смайлики",""
"passed","Tue Feb 06 01:27:41 UTC 2024","Tue Feb 06 01:27:49 UTC 2024","7756","Активность","Контрольная","Результат прохождения теста","TestActivityResultTests","CheckMarkCorrectAnswerThatWasMarkedAsIncorrect","Можно отметить Верно на ответ в вопросе, который был отмечен как Неверно",""
"passed","Tue Feb 06 01:32:44 UTC 2024","Tue Feb 06 01:32:56 UTC 2024","11651","","Поток","Создание потока","CohortCreationValidationTests","CheckCreateCohortFromUnsuitableTemplate","Создание потока ВО: невозможно создать поток из шаблона программы ДО",""
"passed","Tue Feb 06 01:37:56 UTC 2024","Tue Feb 06 01:38:03 UTC 2024","7235","","Материал","Конструктор теста","TestSettingsValidationTests","EditTestTimeLimit","Конструктор теста: можно изменить временной лимит",""
"passed","Tue Feb 06 01:32:18 UTC 2024","Tue Feb 06 01:32:30 UTC 2024","11495","","Поток","Создание потока","CohortCreationTests","CheckCreateCohortWhenAllRequiredFieldsAreFilled","Создание потока ВО: можно создать поток, если все обязательные поля корректно заполнены",""
"passed","Tue Feb 06 01:39:09 UTC 2024","Tue Feb 06 01:39:14 UTC 2024","4341","","Профиль","","UserInfoPageTests","CheckTransitionToEditProfileWorks","Страница профиля пользователя: кнопка 'Редактировать' работает для пользователя",""
"passed","Tue Feb 06 01:25:09 UTC 2024","Tue Feb 06 01:25:17 UTC 2024","8052","Активность","Задание","Страница активности","TaskActivityInfoPageTests","CheckTransitionToMySolution","Работает кнопка Мое решение для студента",""
"passed","Tue Feb 06 01:38:21 UTC 2024","Tue Feb 06 01:38:23 UTC 2024","2368","","Организация","Страница организации","OrganizationPageTests","CheckTransitionToOrgEditPage","Страница организации: работает кнопка Редактировать",""
"passed","Tue Feb 06 01:29:28 UTC 2024","Tue Feb 06 01:29:35 UTC 2024","7591","","Чат","Групповой чат","GroupChatTests","CheckSendEmptyMessageInGroupChat","невозможно отправить пустое сообщение",""
"passed","Tue Feb 06 01:34:06 UTC 2024","Tue Feb 06 01:34:09 UTC 2024","3044","","Дисциплина","Редактирование дисциплины","DisciplineEditingValidationTests","CheckIfShortnameNotFilledInEditing","Отображение ошибки валидации для поля Краткое название, если поле не заполнено в дисциплине ДО",""
"passed","Tue Feb 06 01:32:14 UTC 2024","Tue Feb 06 01:32:20 UTC 2024","6457","","Поток","Создание потока","CohortCreationWarningModalTests","CheckCreateCohortWithMismatchWarningOfDuration","Создание потока: предупреждение о несоответствии длительности потока для программ длительностью 72 часа",""
"passed","Tue Feb 06 01:33:38 UTC 2024","Tue Feb 06 01:33:55 UTC 2024","17438","","Дисциплина","Страница дисциплины","DisciplineAnalyticsTests","CheckExportDisciplineAnalytics","Работает экспорт аналитики дисциплины",""
"passed","Tue Feb 06 01:35:35 UTC 2024","Tue Feb 06 01:35:39 UTC 2024","3512","","Дисциплина","Редактирование дисциплины","DisContingentEditingValidationTests","CheckGroupsAndStudentsFiledsIsAppearInEditing","После снятии галки Все студенты потока появляются поля Группы и Студенты",""
"passed","Tue Feb 06 01:32:38 UTC 2024","Tue Feb 06 01:32:44 UTC 2024","5765","","Поток","Создание потока","CohortCreationValidationTests","CheckCreateCohortIfStartAndEndDateNotFilled","Создание потока: ошибка валидации, если даты начала и окончания не указаны",""
"passed","Tue Feb 06 01:29:35 UTC 2024","Tue Feb 06 01:29:50 UTC 2024","14812","","Чат","Групповой чат","GroupChatTests","CheckEditLastMessageInGroupChat","можно редактировать сообщение в течение 4 часов после отправки",""
"passed","Tue Feb 06 01:25:56 UTC 2024","Tue Feb 06 01:25:59 UTC 2024","2963","","Активность","Обычный шаблон активности","TemplateEditingValidationTests","CheckEditActivityTemplateVolumeWithIncorrectValue","Ошибка валидации в поле Объем в академических часах, если введено значение 0",""
"passed","Tue Feb 06 01:26:52 UTC 2024","Tue Feb 06 01:26:56 UTC 2024","3885","","Активность","Обычная активность","ActivityEditingTests","CheckSertificationDisciplineActivity","Проверка включения опции Аттестация по дисциплине",""
"passed","Tue Feb 06 01:32:57 UTC 2024","Tue Feb 06 01:33:03 UTC 2024","5721","","Поток","Создание потока","CohortCreationWarningModalTests","CheckImpossibleCreateCohortIgnoringMismatchWarningOfDuration","Создание потока ДО (СЗ): невозможно создать поток без исправления длительности потока",""
"passed","Tue Feb 06 01:36:07 UTC 2024","Tue Feb 06 01:36:26 UTC 2024","19038","","Библиотека","","BulkActionsLibraryTests","CheckMoveMultipleSelectedItemsToAnotherDirectory","Библиотека: можно переместить несколько выбранных элементов в другой каталог",""
"passed","Tue Feb 06 01:33:03 UTC 2024","Tue Feb 06 01:33:10 UTC 2024","7050","","Чат","Чат решения","TaskChatTests","CheckDeleteMessageInTaskChat","можно удалить сообщение",""
"passed","Tue Feb 06 01:35:40 UTC 2024","Tue Feb 06 01:35:51 UTC 2024","10461","","Дисциплина","Шаблон дисциплины","DisTemplateTests","CheckCreateActivityInDisTemplate","Можно добавить шаблон активности в шаблон дисциплины, создав его",""
"passed","Tue Feb 06 01:25:24 UTC 2024","Tue Feb 06 01:25:31 UTC 2024","7055","","Активность","Обычная активность","ActivityEditingTests","CheckEditActivityDescription","Можно изменить описание",""
"passed","Tue Feb 06 01:30:25 UTC 2024","Tue Feb 06 01:30:42 UTC 2024","16697","","Чат","Мини-чат звонка дисциплины","DisciplineRoomChatCallTests","CheckSendMessageByTappingEnterInDisciplineRoomCallChat","можно отправить сообщения по нажатию на Enter",""
"passed","Tue Feb 06 01:34:47 UTC 2024","Tue Feb 06 01:34:56 UTC 2024","9007","","Дисциплина","Редактирование дисциплины","DisciplineEditingTests","CheckDeleteDisciplineWithoutGrades","Можно удалить дисциплину без оценок",""
"passed","Tue Feb 06 01:39:13 UTC 2024","Tue Feb 06 01:39:22 UTC 2024","9356","","Расписание","","ScheduleSettingsTests","CheckAbilityToHidePastActivities","Проверка возможности скрыть прошедшие активности",""
"passed","Tue Feb 06 01:26:56 UTC 2024","Tue Feb 06 01:27:02 UTC 2024","6082","","Активность","Обычная активность","ActivityEditingTests","CheckActivityMaxThreshold","Проверка установки Максимального порога баллов в активности Кода будущего",""
"passed","Tue Feb 06 01:35:28 UTC 2024","Tue Feb 06 01:35:35 UTC 2024","6336","","Библиотека","","BulkActionsLibraryTests","CheckChooseButtonExistInMenu","Библиотека: наличие пункта “Выбрать” в меню при правом клике на каталог или материал",""
"passed","Tue Feb 06 01:35:57 UTC 2024","Tue Feb 06 01:36:07 UTC 2024","9780","","Библиотека","","BulkActionsLibraryTests","CheckCancelSelectedItems","Библиотека: можно отменить режим выбора, нажав на кнопку “Отмена” или сняв отметки с выбранных элементов",""
"passed","Tue Feb 06 01:38:59 UTC 2024","Tue Feb 06 01:39:07 UTC 2024","7994","","Профиль","","UserInfoPageTests","CheckIfUserPhotoCanBeDeleted","Страница профиля пользователя: можно удалить фото",""
"passed","Tue Feb 06 01:35:59 UTC 2024","Tue Feb 06 01:36:19 UTC 2024","19628","","Дисциплина","Дисциплина с ИОТ","IOTGraphTests","CheckAddChildBlockBetweenBlocks","Страница дисциплины с ИОТ: между блоками можно добавить ещё один дочерний блок",""
"passed","Tue Feb 06 01:35:09 UTC 2024","Tue Feb 06 01:35:17 UTC 2024","7652","","Дисциплина","Создание дисциплины","DisciplineCreationValidationTests","CheckIfCreditValuesNotAllowed","Отображение ошибки валидации для поля 'Кредиты' со значением > 15 в ДО",""
"passed","Tue Feb 06 01:34:00 UTC 2024","Tue Feb 06 01:34:05 UTC 2024","4990","","Дисциплина","Редактирование дисциплины","DisciplineAccessTests","CheckIfSuperAdminChangeDiscipline","У суперадминистратора есть возможность редактирования",""
"passed","Tue Feb 06 01:27:04 UTC 2024","Tue Feb 06 01:27:12 UTC 2024","7386","Активность","Контрольная","Редактирование контрольной","TestActivityEditingTests","CheckChangeSelectionOfCheckboxDisplayingDetailedResult","Можно отметить/снять галку с чекбокса Отображать студентам подробную информацию о результатах",""
"passed","Tue Feb 06 01:33:06 UTC 2024","Tue Feb 06 01:33:20 UTC 2024","14497","","Чат","Мини-чат решения","TaskMiniChatTests","CheckSendEmojiInTaskMiniChat","можно отправить смайлики",""
"passed","Tue Feb 06 01:25:57 UTC 2024","Tue Feb 06 01:26:05 UTC 2024","7407","Активность","Задание","Страница решения задания для преподавателя","TaskActivityTeacherTests","CheckGradeSolutionIncorrectValues","Отображение ошибки валидации для поля Баллы, если вводить пробел",""
"passed","Tue Feb 06 01:34:32 UTC 2024","Tue Feb 06 01:34:42 UTC 2024","10132","","Дисциплина","Страница дисциплины","DisciplineRightMenuTests","CreateTemplateFromDiscipline","Создание шаблона из дисциплины",""
"passed","Tue Feb 06 01:37:20 UTC 2024","Tue Feb 06 01:37:38 UTC 2024","18086","","Библиотека","","LibraryInListViewTests","CheckCopyMaterialViaActionsButton","Библиотека, списочный вид: можно скопировать материал через actions-кнопки",""
"passed","Tue Feb 06 01:29:47 UTC 2024","Tue Feb 06 01:29:54 UTC 2024","6940","","Чат","Дисциплина","DisciplineRoomChatTests","CheckDeleteMessageInDisciplineRoomChat","можно удалить сообщение",""
"passed","Tue Feb 06 01:26:56 UTC 2024","Tue Feb 06 01:26:58 UTC 2024","1591","Активность","Задание","Страница решения задания для студента","TaskWithSolutionStudentTests","CheckImpossibilityToEditAnotherStudentsSolutionGrade","Нет возможности оценить решение другого студента, если не включена опция Взаимопроверка",""
"passed","Tue Feb 06 01:35:02 UTC 2024","Tue Feb 06 01:35:05 UTC 2024","3584","","Дисциплина","Шаблон дисциплины","DisTemplateTests","CheckCreateDisTemplateWithFillingRequiredFields","Можно создать шаблон дисциплины, если заполнены все обязательные поля",""
"passed","Tue Feb 06 01:38:41 UTC 2024","Tue Feb 06 01:38:45 UTC 2024","3863","","Расписание","","ScheduleTests","CheckTransitionToSchedulePage","Расписание можно открыть из блока Ближайшие активности",""
"passed","Tue Feb 06 01:37:37 UTC 2024","Tue Feb 06 01:37:50 UTC 2024","13352","","Материал","Конструктор теста","TestBlocksAndVariantsValidationTests","DeleteTestBlock","Конструктор теста: можно удалить блок",""
"passed","Tue Feb 06 01:27:15 UTC 2024","Tue Feb 06 01:27:25 UTC 2024","10306","Активность","Шаблон активности контрольной","Редактирование шаблона контрольной","TestTemplateAddingTests","CheckAddTestToControlActivityPlan","Можно добавить материал типа Тест из Библиотеки в шаблон контрольной",""
"passed","Tue Feb 06 01:34:09 UTC 2024","Tue Feb 06 01:34:15 UTC 2024","6672","","Дисциплина","Страница дисциплины","DisciplineMarksAndAttendanceTests","CheckFinalGradesByTeacher","Проверка работы кнопки ‘Итоговые оценки (ведомость)’ у преподавателя",""
"passed","Tue Feb 06 01:33:37 UTC 2024","Tue Feb 06 01:33:48 UTC 2024","10841","","Дисциплина","Страница дисциплины","DisciplineActivitiesBlockTests","CheckAddTopicInDiscipline","Создание темы у дисциплины",""
"passed","Tue Feb 06 01:32:37 UTC 2024","Tue Feb 06 01:32:49 UTC 2024","11827","","Чат","Мини-чат страницы решений","TaskPageMiniChatTests","CheckAddQuoteToLastMessageInTaskPageMiniChat","можно цитировать сообщению",""
"passed","Tue Feb 06 01:31:29 UTC 2024","Tue Feb 06 01:31:47 UTC 2024","18359","","Чат","Мини-чат звонка дисциплины","DisciplineRoomChatCallTests","CheckDeleteMessageInDisciplineRoomCallChat","можно удалить сообщение",""
"passed","Tue Feb 06 01:33:39 UTC 2024","Tue Feb 06 01:33:46 UTC 2024","6778","","Поток","Редактирование потока","CohortEditingValidationTests","CheckIsNotPossibleChangeDatesInEditingCohort","Редактирование потока ДО (СЗ): нет возможности изменить даты потока, если в нем есть слушатели",""
"passed","Tue Feb 06 01:28:54 UTC 2024","Tue Feb 06 01:29:21 UTC 2024","26623","","Чат","Мини-чат группового звонка","GroupChatCallTests","CheckEditLastMessageInGroupCallChat","можно редактировать сообщение в течение 4 часов после отправки",""
"passed","Tue Feb 06 01:31:51 UTC 2024","Tue Feb 06 01:32:13 UTC 2024","22193","","Чат","Мини-чат личного звонка","PersonalChatCallTests","CheckAddQuoteToLastMessageInPersonalCallChat","можно цитировать сообщению",""
"passed","Tue Feb 06 01:33:53 UTC 2024","Tue Feb 06 01:33:56 UTC 2024","3362","","Дисциплина","Страница дисциплины","DisciplineActivitiesBlockTests","CheckActivityVolumeIsDisplayed","Отображается объём ОА у дисциплины",""
"passed","Tue Feb 06 01:26:31 UTC 2024","Tue Feb 06 01:26:40 UTC 2024","8980","Активность","Контрольная","Результат прохождения теста","TestActivityResultTests","CheckStudentCanViewDetailedResultInfo","Студент не может просматривать подробную информацию о результатах, если соответствующий чекбокс выключен",""
"passed","Tue Feb 06 01:33:14 UTC 2024","Tue Feb 06 01:33:23 UTC 2024","9056","","Чат","Мини-чат страницы решений","TaskPageMiniChatTests","CheckAddReactionToLastMessageInTaskPageMiniChat","можно добавить реакцию на сообщение",""
"skipped","Tue Feb 06 01:42:40 UTC 2024","Tue Feb 06 01:42:41 UTC 2024","354","","Библиотека","","LibraryMaterialTests","CheckVisibilityOfLaTeXMaterialPage","Страница материала: проверка отображения LaTeX материала",""
"passed","Tue Feb 06 01:32:17 UTC 2024","Tue Feb 06 01:32:18 UTC 2024","1506","","Поток","Создание потока","CohortCreationTests","CheckCancelCohortCreationByDirectLink","Создание потока ДО: работает кнопка 'Отмена', если страница создание был открыть по прямой ссылке",""
"passed","Tue Feb 06 01:33:36 UTC 2024","Tue Feb 06 01:33:40 UTC 2024","4242","","Дисциплина","Настройка чата дисциплины","DisciplineChatBlockTests","CheckChatMissingFromList","Отключенный чат дисциплины отсутствует в списке чатов",""
"passed","Tue Feb 06 01:34:06 UTC 2024","Tue Feb 06 01:34:11 UTC 2024","5942","","Дисциплина","Редактирование дисциплины","DisciplineEditingTests","CheckSetShortnameField","Можно изменить краткое название, сделав двойной клик по названию дисциплины",""
"passed","Tue Feb 06 01:32:49 UTC 2024","Tue Feb 06 01:32:57 UTC 2024","8685","","Чат","Мини-чат страницы решений","TaskPageMiniChatTests","CheckSendEmojiInTaskInTaskPageMiniChat","можно отправить смайлики",""
"passed","Tue Feb 06 01:29:07 UTC 2024","Tue Feb 06 01:29:28 UTC 2024","20497","","Чат","Мини-чат звонка дисциплины","DisciplineChatCallTests","CheckSendEmojiInDisciplineCallChat","можно отправить смайлики",""
"passed","Tue Feb 06 01:28:04 UTC 2024","Tue Feb 06 01:28:21 UTC 2024","17316","","Чат","Мини-чат дисциплины","DisciplineMiniChatTests","CheckEditLastMessageInDisciplineMiniChat","можно редактировать сообщение в течение 4 часов после отправки",""
"passed","Tue Feb 06 01:32:46 UTC 2024","Tue Feb 06 01:32:55 UTC 2024","8473","","Чат","Мини-чат личного чата","PersonalMiniChatTests","CheckSendFileMessageInPersonalMiniChat","можно прикрепить и отправить файл с компьютера",""
"passed","Tue Feb 06 01:33:54 UTC 2024","Tue Feb 06 01:34:00 UTC 2024","5510","","Дисциплина","Редактирование дисциплины","DisciplineAccessTests","CheckOrgAdminChangeDiscipline","У администратора организации, к которой дисциплина относится, есть возможность редактирования",""
"passed","Tue Feb 06 01:28:30 UTC 2024","Tue Feb 06 01:28:57 UTC 2024","26941","","Чат","Мини-чат звонка дисциплины","DisciplineRoomChatCallTests","CheckEditLastMessageInDisciplineRoomCallChat","можно редактировать сообщение в течение 4 часов после отправки",""
