"Status","Start Time","Stop Time","Duration in ms","Parent Suite","Suite","Sub Suite","Test Class","Test Method","Name","Description"
"passed","Wed Aug 16 04:35:09 UTC 2023","Wed Aug 16 04:35:17 UTC 2023","7745","","Чат","Чат для заметок","NotesChatTests","CheckSendTextMessageInNotesChat","Список чатов - чат для заметок: можно отправить текстовое сообщение",""
"passed","Wed Aug 16 04:43:29 UTC 2023","Wed Aug 16 04:43:39 UTC 2023","10819","","Расписание","","ScheduleSettingsTests","ShowLastActivitySchedule","Страница расписания: проверка показать прошедшие активности",""
"passed","Wed Aug 16 04:39:37 UTC 2023","Wed Aug 16 04:39:49 UTC 2023","12008","","Дисциплина","Создание дисциплины","DisciplineCreationTests","CreatDisciplineFromDisciplineTemplate","Создание дисциплины ВО: можно создать дисциплину из шаблона дисциплины без активностей",""
"passed","Wed Aug 16 04:43:05 UTC 2023","Wed Aug 16 04:43:14 UTC 2023","8158","","Материал","Конструктор тест-тренажера","TestTrainSettingsValidationTests","RemoveAuthorInTestTrain","Конструктор теста-тренажера: можно удалить автора",""
"passed","Wed Aug 16 04:41:53 UTC 2023","Wed Aug 16 04:42:03 UTC 2023","9519","","Материал","Конструктор теста","TestQuestionAnswersValidationTests","AddOneMoreOptionInComparisonTestQuestion","Конструктор теста: можно добавить еще один вариант на сопоставление в вопрос с типом ответа 'Сопоставление'",""
"passed","Wed Aug 16 04:41:35 UTC 2023","Wed Aug 16 04:41:43 UTC 2023","7875","","Дисциплина","Дисциплина с ИОТ","IOTGraphTests","CheckGoToBlockEditing","Страница дисциплины с ИОТ: можно перейти в редактирование блока",""
"passed","Wed Aug 16 04:43:16 UTC 2023","Wed Aug 16 04:43:25 UTC 2023","8678","","Расписание","","ScheduleSettingsTests","BlackoutNameSchedule","Страница расписания: проверка затемнения прошедших активностей",""
"passed","Wed Aug 16 04:39:51 UTC 2023","Wed Aug 16 04:40:04 UTC 2023","12520","","Дисциплина","Страница дисциплины","DisciplineMarksAndAttendanceTests","CheckAddTotalFormula","Страница оценок дисциплины: добавления формулы промежуточного результата",""
"passed","Wed Aug 16 04:35:27 UTC 2023","Wed Aug 16 04:35:35 UTC 2023","8035","","Чат","Мини-чат для заметок","NotesMiniChatTests","CheckSendEmptyMessageInNotesMiniChat","Миничат - чат для заметок: невозможно отправить пустое сообщение",""
"passed","Wed Aug 16 04:41:55 UTC 2023","Wed Aug 16 04:42:03 UTC 2023","7746","","Материал","Конструктор теста","TestBlocksAndVariantsValidationTests","MigrateTestQuestion","Конструктор теста: можно перенести вопрос в другой вариант",""
"passed","Wed Aug 16 04:33:37 UTC 2023","Wed Aug 16 04:33:47 UTC 2023","9634","","Активность","Задание","TaskActivityTeacherTests","CheckGradeSolutionValueAboveAndBelowScore","Страница решение задания: можно оценить решения значением ниже минимального порога баллов",""
"passed","Wed Aug 16 04:39:47 UTC 2023","Wed Aug 16 04:39:50 UTC 2023","3216","","Дисциплина","Редактирование дисциплины","DisciplineEditingValidationTests","CheckIfCreditNotFilled","Редактирование дисциплины: отображение ошибки валидации для поля 'Кредиты' с отрицательным значением",""
"passed","Wed Aug 16 04:43:14 UTC 2023","Wed Aug 16 04:43:21 UTC 2023","7701","","Материал","Конструктор тест-тренажера","TestTrainSettingsValidationTests","AddTagInTestTrain","Конструктор теста-тренажера: можно добавлять теги знаний",""
"passed","Wed Aug 16 04:36:08 UTC 2023","Wed Aug 16 04:36:11 UTC 2023","2698","","Чат","Чат для заметок","NotesChatTests","CheckOpenImageInNotesChat","Список чатов - чат для заметок: можно раскрывать изображения",""
"passed","Wed Aug 16 04:40:42 UTC 2023","Wed Aug 16 04:40:49 UTC 2023","7488","","Дисциплина","Шаблон дисциплины","DisTemplateTests","CheckAddTopicInDisTemplate","Страница шаблона дисциплины: можно добавить тему",""
"passed","Wed Aug 16 04:40:58 UTC 2023","Wed Aug 16 04:41:10 UTC 2023","11753","","Дисциплина","Редактирование дисциплины","DisContingentEditingTests","CheckRemoveGroupAndStudentFromDiscipline","Редактирование дисциплины: открепления от дисциплины групп и студентов",""
"passed","Wed Aug 16 04:34:13 UTC 2023","Wed Aug 16 04:34:14 UTC 2023","1472","","Активность","Обычный шаблон активности","TemplateAddingTests","CheckAbsenceScormScoreFieldActivityTemplate","Редактирование шаблона активности: отсутствия поля оценка по SCORM результату, если не добавлен SCORM пакет",""
"passed","Wed Aug 16 04:38:39 UTC 2023","Wed Aug 16 04:38:42 UTC 2023","2920","","Поток","","CohortEditingTests","CheckEditCohortByCheckingCheckboxRegistrationLink","Редактирование потока ДО: успешное сохранение, при отметке/снятии галки ‘Разрешена регистрация по ссылке’",""
"passed","Wed Aug 16 04:34:48 UTC 2023","Wed Aug 16 04:34:57 UTC 2023","9840","","Активность","Шаблон активности контрольной","TestTemplateCreatingTests","CheckExecModeTestActivityTemplate","Создание шаблона контрольной: с режимом выполнения 'Индивидуальный'",""
"passed","Wed Aug 16 04:38:57 UTC 2023","Wed Aug 16 04:39:01 UTC 2023","4350","","Дисциплина","Редактирование дисциплины","DisciplineAccessTests","CheckIfStudentChangeDiscipline","Редактирование дисциплины: нет возможности редактировать у студента",""
"passed","Wed Aug 16 04:34:36 UTC 2023","Wed Aug 16 04:34:43 UTC 2023","6674","","Активность","Контрольная активность","TestActivityResultTests","ClockIconAndTruFalseButtonsAreDisplayed","Результат прохождения теста: отображается иконка часы и кнопки верно/не верно в вопросах с типом ответа свободный ответ или файл",""
"passed","Wed Aug 16 04:37:26 UTC 2023","Wed Aug 16 04:37:32 UTC 2023","6769","","Поток","","CohortCreationValidationTests","CheckCreateCohortIfEachDateNotFilled","Создание потока: ошибка валидации, если дата начала не указана",""
"passed","Wed Aug 16 04:34:06 UTC 2023","Wed Aug 16 04:34:11 UTC 2023","5626","","Активность","Обычный шаблон активности","TemplateEditingValidationTests","CheckNegativeEditVolumeActivityTemplate","Редактирование шаблона активности: отображение ошибки валидации для поля 'Объём' с значением > 100",""
"passed","Wed Aug 16 04:41:11 UTC 2023","Wed Aug 16 04:41:18 UTC 2023","6581","","Библиотека","","LibraryActionPanelTests","CheckFindMaterialByName","Библиотека, плиточный вид: можно найти материал в поиске по названию",""
"passed","Wed Aug 16 04:43:31 UTC 2023","Wed Aug 16 04:43:42 UTC 2023","11319","","Профиль","","GeneralUserInfoEditingTests","ValidatingUserNameFields","Редактирование профиля пользователя: можно изменить ФИО",""
"passed","Wed Aug 16 04:38:25 UTC 2023","Wed Aug 16 04:38:28 UTC 2023","2843","","Поток","","CohortEditingTests","CheckCancelCohortEditingByDirectLink","Редактирование потока ВО: работает кнопка 'Отмена'",""
"passed","Wed Aug 16 04:43:18 UTC 2023","Wed Aug 16 04:43:30 UTC 2023","12307","","Биржа","","StockMarketLotTests","PurchaseLotByTeacher","Страница лота: преподаватель может приобрести материал на бирже",""
"passed","Wed Aug 16 04:40:32 UTC 2023","Wed Aug 16 04:40:34 UTC 2023","2664","","Дисциплина","Шаблон дисциплины","DisTemplateTests","CheckCreateDisTemplateIfRequiredFieldsNotFilled","Создание шаблона дисциплины: невозможно создать шаблон, если не заполнены обязательные поля",""
"passed","Wed Aug 16 04:33:01 UTC 2023","Wed Aug 16 04:33:23 UTC 2023","21560","","Активность","Обычная активность","ActivityEditingTests+ActivityContentVisibilityTests","CheckVisibilityMaterialDuringActivity","Редактирование активности: видимость материала во время проведения активности",""
"passed","Wed Aug 16 04:42:52 UTC 2023","Wed Aug 16 04:42:55 UTC 2023","2817","","Материал","Конструктор тест-тренажера","TestTrainBlocksAndVariantsValidationTests","ImpossibleToAddVariantInTestTrain","Конструктор теста-тренажера: отсутствует возможность добавить вариант",""
"passed","Wed Aug 16 04:38:19 UTC 2023","Wed Aug 16 04:38:26 UTC 2023","7766","","Чат","Мини-чат страницы решений","TaskPageMiniChatTests","CheckSendMessageByTappingEnterInTaskPageMiniChat","Чат обсуждение решения: можно отправить сообщения по нажатию на Enter",""
"passed","Wed Aug 16 04:42:58 UTC 2023","Wed Aug 16 04:43:00 UTC 2023","1679","","Программа","","ProgramCreationTests","CheckCancelCreatingProgram","Cоздание обр программы ВО: проверка кнопки 'Отмена'",""
"passed","Wed Aug 16 04:36:03 UTC 2023","Wed Aug 16 04:36:13 UTC 2023","9623","","Чат","Мини-чат для заметок","NotesMiniChatTests","CheckSendEmojiInNotesMiniChat","Миничат - чат для заметок: можно отправить смайлики",""
"passed","Wed Aug 16 04:39:59 UTC 2023","Wed Aug 16 04:40:08 UTC 2023","9166","","Дисциплина","Создание дисциплины","DisciplineCreationTests","CreatDisciplineFromDisciplineTemplateWithActivities","Создание дисциплины ВО: можно создать дисциплину из шаблона дисциплины с активностями",""
"passed","Wed Aug 16 04:43:31 UTC 2023","Wed Aug 16 04:43:47 UTC 2023","15603","","Профиль","","UserInfoPageTests","CheckAddUserPhotoButtonIsClickable","Страница профиля пользователя: можно загрузить фото",""
"passed","Wed Aug 16 04:37:24 UTC 2023","Wed Aug 16 04:37:45 UTC 2023","20984","","Чат","Дисциплина","DisciplineChatTests","CheckPinLastMessageInDisciplineChat","Список чатов - комната дисциплины: можно закреплять сообщения",""
"passed","Wed Aug 16 04:37:58 UTC 2023","Wed Aug 16 04:38:25 UTC 2023","27740","","Поток","","CohortCreationTests","CheckCreateCohortFromTemplateWhenAllRequiredFieldsAreFilled","Создание потока ВО: можно создать поток из шаблона, если все обязательные поля корректно заполнены",""
"passed","Wed Aug 16 04:41:49 UTC 2023","Wed Aug 16 04:41:55 UTC 2023","6601","","Материал","Конструктор теста","TestBlocksAndVariantsValidationTests","DuplicateTestQuestion","Конструктор теста: можно дублировать вопрос",""
"passed","Wed Aug 16 04:41:07 UTC 2023","Wed Aug 16 04:41:23 UTC 2023","16372","","Дисциплина","Дисциплина с ИОТ","IOTThemesAndModulesTests","CheckCannotCreateModuleOrTopicInsideTopic","Страница дисциплины с ИОТ: внутри темы нельзя создать модуль или тему",""
"passed","Wed Aug 16 04:38:26 UTC 2023","Wed Aug 16 04:38:35 UTC 2023","8712","","Чат","Мини-чат страницы решений","TaskPageMiniChatTests","CheckAddReactionToLastMessageInTaskPageMiniChat","Чат обсуждение решения: можно добавить реакцию на сообщение",""
"passed","Wed Aug 16 04:42:53 UTC 2023","Wed Aug 16 04:42:57 UTC 2023","3428","","Программа","","ProgramCreationTests","CreateHighEducProgramOverviewFields","Cоздание обр программы ВО: если заполнить только обязательные поля",""
"passed","Wed Aug 16 04:33:16 UTC 2023","Wed Aug 16 04:33:21 UTC 2023","4455","","Активность","Задание","TaskWithSolutionStudentTests","CheckEditSolution","Страница решение задания: можно редактировать решения",""
"passed","Wed Aug 16 04:34:11 UTC 2023","Wed Aug 16 04:34:12 UTC 2023","1131","","Активность","Обычный шаблон активности","TemplateEditingValidationTests","CheckNotExistScormResultScoreField","Редактирование шаблона активности: отсутствует поля 'Оценка по SCORM результату', если добавлен SCORM пакет в шаблон активности типов кроме контрольной",""
"passed","Wed Aug 16 04:42:53 UTC 2023","Wed Aug 16 04:43:01 UTC 2023","8489","","Расписание","","ScheduleSettingsTests","SyncGoogleCalendar","Страница расписания: проверка подключения синхронизации с google календарем",""
"passed","Wed Aug 16 04:39:13 UTC 2023","Wed Aug 16 04:39:33 UTC 2023","19773","","Дисциплина","Страница дисциплины","DisciplineAnalyticsTests","CheckExportDisciplineAnalytics","Страница аналитика дисциплины: работает экспорт аналитики дисциплины",""
"passed","Wed Aug 16 04:35:34 UTC 2023","Wed Aug 16 04:35:58 UTC 2023","23469","","Чат","Мини-чат звонка дисциплины","DisciplineChatCallTests","CheckEditLastMessageInDisciplineCallChat","Миничат звонка - комната дисциплины: можно редактировать сообщение в течение 4 часов после отправки",""
"passed","Wed Aug 16 04:39:09 UTC 2023","Wed Aug 16 04:39:14 UTC 2023","4769","","Поток","","CohortEditingValidationTests","CheckIsNotPossibleChangeDatesInEditingCohort","Редактирование потока ДО (СЗ): нет возможности изменить даты потока, если в нем есть слушатели",""
"passed","Wed Aug 16 04:40:45 UTC 2023","Wed Aug 16 04:40:49 UTC 2023","4152","","Подразделения","","DivisionCommonTests","EditDivision","Редактирование название подразделения",""
"passed","Wed Aug 16 04:34:16 UTC 2023","Wed Aug 16 04:34:26 UTC 2023","9205","","Активность","Обычный шаблон активности","TemplateEditingTests","CheckClearAddedTagsFromActivityTemplate","Редактирование шаблона активности: можно очистить теги знаний",""
"passed","Wed Aug 16 04:33:47 UTC 2023","Wed Aug 16 04:33:52 UTC 2023","5572","","Активность","Обычная активность","ActivityEditingTests+ActivityDurationTests","CheckEditVolumeActivityWithCorrectValues","Редактирование активности: успешное сохранение при корректных значениях в поля 'Объём'",""
"passed","Wed Aug 16 04:42:14 UTC 2023","Wed Aug 16 04:42:27 UTC 2023","13638","","Библиотека","","LibraryInTileViewTests","CheckRemoveCatalog","Библиотека, плиточный вид: можно удалить каталог",""
"passed","Wed Aug 16 04:41:03 UTC 2023","Wed Aug 16 04:41:11 UTC 2023","8260","","Библиотека","","LibraryActionPanelTests","CheckSwitchToAnotherLibrary","Библиотека, плиточный вид: можно переключаться на другую Библиотеку",""
"passed","Wed Aug 16 04:38:16 UTC 2023","Wed Aug 16 04:38:25 UTC 2023","8676","","Чат","Мини-чат личного чата","PersonalMiniChatTests","CheckDeleteMessageInPersonalMiniChat","Миничат - личный чат: можно удалить сообщение",""
"passed","Wed Aug 16 04:39:01 UTC 2023","Wed Aug 16 04:39:08 UTC 2023","7445","","Дисциплина","Страница дисциплины","DisciplineAnalyticsTests","CheckDisciplineAnalyticsIsOpen","Страница аналитика дисциплины: при переходе на вкладку “Аналитика” открывается аналитика дисциплины",""
"passed","Wed Aug 16 04:42:35 UTC 2023","Wed Aug 16 04:42:50 UTC 2023","14419","","Материал","Конструктор теста","TestBlocksAndVariantsValidationTests","DeleteTestBlock","Конструктор теста: можно удалить блок",""
"passed","Wed Aug 16 04:40:07 UTC 2023","Wed Aug 16 04:40:21 UTC 2023","13957","","Дисциплина","Создание дисциплины","DisContingentCreationTests","CheckAddTeacherByUserInfoInCreation","Создание дисциплины: добавление преподавателя по ссылке на профиль",""
"passed","Wed Aug 16 04:41:57 UTC 2023","Wed Aug 16 04:42:03 UTC 2023","6549","","Материал","Конструктор теста","TestSettingsValidationTests","AddTagInTest","Конструктор теста: можно добавлять теги знаний",""
"passed","Wed Aug 16 04:37:22 UTC 2023","Wed Aug 16 04:37:40 UTC 2023","18754","","Чат","Мини-чат страницы решений","TaskPageMiniChatTests","CheckEditLastMessageInTaskPageMiniChat","Чат обсуждение решения: можно редактировать сообщение в течение 4 часов после отправки",""
"passed","Wed Aug 16 04:35:28 UTC 2023","Wed Aug 16 04:35:45 UTC 2023","17015","","Чат","Мини-чат личного звонка","PersonalChatCallTests","CheckSendTextMessageInPersonalCallChat","Миничат звонка - личный чат: можно отправить текстовое сообщение",""
"passed","Wed Aug 16 04:34:03 UTC 2023","Wed Aug 16 04:34:10 UTC 2023","6416","","Активность","Обычный шаблон активности","TemplateEditingTests","CheckEditDescriptionActivityTemplate","Редактирование шаблона активности: можно изменить описание",""
"passed","Wed Aug 16 04:36:17 UTC 2023","Wed Aug 16 04:36:26 UTC 2023","8877","","Чат","Чат для заметок","NotesChatTests","CheckAddReactionToLastMessageInNotesChat","Список чатов - чат для заметок: можно добавить реакцию на сообщение",""
"passed","Wed Aug 16 04:40:00 UTC 2023","Wed Aug 16 04:40:05 UTC 2023","5441","","Дисциплина","Редактирование дисциплины","DisciplineEditingTests","CheckCancelButtonWork","Редактирование дисциплины: работает кнопка Отмена",""
"skipped","Wed Aug 16 04:41:00 UTC 2023","Wed Aug 16 04:41:01 UTC 2023","290","","Библиотека","","LibraryMaterialTests","CheckVisibilityOfLaTeXMaterialPage","Страница материала: проверка отображения LaTeX материала",""
"passed","Wed Aug 16 04:33:46 UTC 2023","Wed Aug 16 04:33:58 UTC 2023","12061","","Активность","Обычный шаблон активности","TemplateAddingTests","CheckAddTestNotInControlTypeActivityTemplate","Редактирование шаблона активности: наличия ошибки при добавлении теста из библиотеки не в контрольную",""
"passed","Wed Aug 16 04:39:14 UTC 2023","Wed Aug 16 04:39:18 UTC 2023","3399","","Поток","","CohortEditingValidationTests","CheckIsNotPossibleRemoveCohortWithStudents","Редактирование потока ДО (СЗ): отсутствует кнопка ‘Удалить поток’, если в потоке есть слушатели",""
"passed","Wed Aug 16 04:38:08 UTC 2023","Wed Aug 16 04:38:15 UTC 2023","6570","","Поток","","CohortCreationWarningModalTests","CheckCreateCohortWithMismatchWarningOfDuration","Создание потока: предупреждение о несоответствии длительности потока для программ 72 часов",""
"passed","Wed Aug 16 04:40:47 UTC 2023","Wed Aug 16 04:40:51 UTC 2023","3197","","Дисциплина","Редактирование дисциплины","DisContingentEditingValidationTests","CheckGroupsAndStudentsFiledsIsAppearInEditing","Редактирование дисциплины: после снятии галки ‘Все студенты потока’ появляется поля Группы и Студенты",""
"passed","Wed Aug 16 04:35:02 UTC 2023","Wed Aug 16 04:35:08 UTC 2023","5822","","Активность","Шаблон активности контрольной","TestTemplateEditingTests","SuccessSaveWithCorrectValueNumberOfAttemptsInTestActivityTemplate","Редактирование шаблона контрольной: успешное сохранение при корректных значениях в 'Количество попыток сдачи'",""
"passed","Wed Aug 16 04:33:52 UTC 2023","Wed Aug 16 04:33:56 UTC 2023","4172","","Активность","Обычная активность","ActivityEditingTests+ActivityDurationTests","CheckEditVolumeActivityWithIncorrectValues","Редактирование активности: отображение ошибки валидации для поля 'Объём' с отрицательным значением",""
"passed","Wed Aug 16 04:43:31 UTC 2023","Wed Aug 16 04:43:35 UTC 2023","4317","","Университет","","UniversityTests","CheckNoAccessAuditorToRatePage","Страница Мой тариф: проверка перехода аудитора по прямой ссылке",""
"passed","Wed Aug 16 04:40:09 UTC 2023","Wed Aug 16 04:40:18 UTC 2023","8930","","Дисциплина","Создание дисциплины","DisciplineCreationValidationTests","CheckIfCreditValuesNotAllowed","Создание дисциплины ДО: отображение ошибки валидации для поля 'Кредиты' с отрицательным значением",""
"passed","Wed Aug 16 04:37:44 UTC 2023","Wed Aug 16 04:37:57 UTC 2023","12475","","Чат","Мини-чат личного чата","PersonalMiniChatTests","CheckAddReactionToLastMessageInPersonalMiniChat","Миничат - личный чат: можно добавить реакцию на сообщение",""
"failed","Wed Aug 16 04:34:54 UTC 2023","Wed Aug 16 04:34:54 UTC 2023","403","","Активность","Контрольная активность","TestActivityStatusWithTwoOrMoreAttemptsTests","ResultOfPassingDependOnSettings","Страница командной контрольной: результат тестирования из попытках зависеть от настройки 'За лучшую попытку'",""
"passed","Wed Aug 16 04:37:15 UTC 2023","Wed Aug 16 04:37:30 UTC 2023","14381","","Чат","Мини-чат звонка дисциплины","DisciplineChatCallTests","CheckOpenImageInDisciplineCallChat","Миничат звонка - комната дисциплины: можно раскрывать изображения",""
"passed","Wed Aug 16 04:34:51 UTC 2023","Wed Aug 16 04:35:02 UTC 2023","10369","","Активность","Контрольная активность","TestActivityResultTests","TeacherCanLeaveCommentOnAnswer","Результат прохождения теста: преподаватель может изменить комментарий к ответу, если включена опция подробная информация о результатах",""
"passed","Wed Aug 16 04:39:57 UTC 2023","Wed Aug 16 04:40:11 UTC 2023","14071","","Дисциплина","Страница дисциплины","DisciplineAnalyticsTests","CheckFilterByStudentName","Страница аналитика дисциплины: работает фильтр по имени студента",""
