"Status","Start Time","Stop Time","Duration in ms","Parent Suite","Suite","Sub Suite","Test Class","Test Method","Name","Description"
"passed","Tue Oct 31 06:13:56 UTC 2023","Tue Oct 31 06:14:04 UTC 2023","7935","","Материал","Конструктор теста","TestSettingsValidationTests","ChangeLevelAssimilationInTestTag","Конструктор теста: можно изменить уровень усвоения в добавленном теге знаний",""
"passed","Tue Oct 31 06:11:23 UTC 2023","Tue Oct 31 06:11:38 UTC 2023","15302","","Дисциплина","Создание дисциплины","DisciplineCreationTests","CreatDisciplineIfReqFieldsAreFilled","Создание дисциплины ДО: можно создать дисциплину, если заполнены обязательные поля",""
"passed","Tue Oct 31 06:13:30 UTC 2023","Tue Oct 31 06:13:39 UTC 2023","8779","","Материал","Конструктор теста","TestQuestionAnswersValidationTests","CheckAddOneMoreAnswerVariantInQuestionWithFreeAnswerExactMatch","Конструктор теста: можно добавить еще один вариант ответа в вопрос с типом ответа 'Свободный ответ - точное совпадение'",""
"passed","Tue Oct 31 06:07:20 UTC 2023","Tue Oct 31 06:07:30 UTC 2023","10183","","Активность","Обычная активность","ActivityAddingTests","CheckAddTestNotInControlTypeActivity","Редактирование активности: наличия ошибки при добавлении теста из библиотеки не в контрольную",""
"passed","Tue Oct 31 06:10:39 UTC 2023","Tue Oct 31 06:10:45 UTC 2023","6320","","Чат","Мини-чат страницы решений","TaskPageMiniChatTests","CheckSendFileMessageInTaskPageMiniChat","Чат на странице решения: можно прикрепить и отправить файл с компьютера",""
"passed","Tue Oct 31 06:15:16 UTC 2023","Tue Oct 31 06:15:27 UTC 2023","11628","","Профиль","","UserInfoPageTests","CheckAddUserPhotoButtonIsClickable","Страница профиля пользователя: можно загрузить фото",""
"passed","Tue Oct 31 06:09:33 UTC 2023","Tue Oct 31 06:09:43 UTC 2023","9825","","Активность","Шаблон активности контрольной","TestTemplateEditingTests","CheckEditValueScormResultScoreInTemplate","Редактирование шаблона контрольной: можно переключать значения в поле 'Оценка по SCORM результату'",""
"passed","Tue Oct 31 06:11:55 UTC 2023","Tue Oct 31 06:12:00 UTC 2023","4931","","Дисциплина","Редактирование дисциплины","DisciplineAccessTests","CheckIfSuperAdminChangeDiscipline","Редактирование дисциплины: есть возможность редактировать у суперадминистратора",""
"passed","Tue Oct 31 06:10:23 UTC 2023","Tue Oct 31 06:10:30 UTC 2023","6622","","Чат","Чат решения","TaskChatTests","CheckSendFileMessageInTaskChat","Список чатов - обсуждение решения: можно прикрепить и отправить файл с компьютера",""
"passed","Tue Oct 31 06:09:32 UTC 2023","Tue Oct 31 06:09:41 UTC 2023","8160","","Чат","Чат решения","TaskChatTests","CheckSendTextMessageInTaskChat","Список чатов - обсуждение решения: можно отправить текстовое сообщение",""
"passed","Tue Oct 31 06:15:21 UTC 2023","Tue Oct 31 06:15:28 UTC 2023","6887","","Расписание","","ScheduleSettingsTests","CheckCancelConnectSyncWithGoogleCalendar","Проверка кнопки Отмена синхронизации с Google календарем",""
"passed","Tue Oct 31 06:14:33 UTC 2023","Tue Oct 31 06:14:42 UTC 2023","8745","","Материал","Конструктор теста","TestQuestionAnswersValidationTests","CheckEditCommentInTestAnswer","Конструктор теста: можно изменить комментарий к варианту ответа",""
"passed","Tue Oct 31 06:14:33 UTC 2023","Tue Oct 31 06:14:47 UTC 2023","13742","","Библиотека","","LibraryInListViewTests","CheckRemoveMaterialViaActionsButton","Библиотека, списочный вид: можно удалить материал через actions-кнопки",""
"passed","Tue Oct 31 06:07:39 UTC 2023","Tue Oct 31 06:07:44 UTC 2023","4644","","Активность","Обычная активность","ActivityDurationTests","CheckEditVolumeActivityWithCorrectValues","Редактирование активности: успешное сохранение при корректных значениях в поля 'Объём'",""
"passed","Tue Oct 31 06:06:59 UTC 2023","Tue Oct 31 06:07:05 UTC 2023","5479","","Активность","Задание","TaskActivityMulticriteriaTests","CheckSetValuesCheckboxInCriteria","При отметке чекбокса 'Задать значения', у критерия не отображается поле 'Макс баллов'",""
"passed","Tue Oct 31 06:07:46 UTC 2023","Tue Oct 31 06:07:48 UTC 2023","1952","Активность","Контрольная","Редактирование контрольной","TestActivityEditingTests","ExecutionModeFieldIsNotClickableInTestActivity","Редактирование контрольной: поле 'Режим выполнения' некликабельно",""
"passed","Tue Oct 31 06:07:40 UTC 2023","Tue Oct 31 06:07:42 UTC 2023","1706","","Активность","Обычный шаблон активности","TemplateEditingValidationTests","CheckNotExistScormResultScoreField","Редактирование шаблона активности: отсутствует поля 'Оценка по SCORM результату', если добавлен SCORM пакет в шаблон активности типов кроме контрольной",""
"passed","Tue Oct 31 06:15:18 UTC 2023","Tue Oct 31 06:15:22 UTC 2023","3729","","Расписание","","ScheduleTests","CheckThreeDayModeIsNotDisplayed","В десктопе нет возможности выбрать режим 3 дня",""
"passed","Tue Oct 31 06:14:54 UTC 2023","Tue Oct 31 06:15:02 UTC 2023","8408","","Материал","Конструктор тест-тренажера","TestTrainSettingsValidationTests","ChangeLevelAssimilationInTestTrainTag","Конструктор теста-тренажера: можно изменить уровень усвоения в добавленном теге знаний",""
"passed","Tue Oct 31 06:07:50 UTC 2023","Tue Oct 31 06:07:56 UTC 2023","5848","","Активность","Задание","TaskWithSolutionStudentTests","CheckSendSolutionForAnotherStudent","Нет возможности отправить решения за другого студента",""
"passed","Tue Oct 31 06:14:55 UTC 2023","Tue Oct 31 06:15:02 UTC 2023","6449","","Материал","Конструктор тест-тренажера","TestTrainQuestionAnswersValidationTests","RemoveAnswerFromQuestionInTestTrain","Конструктор теста-тренажера: можно удалить вариант ответа из вопроса с типом ответа 'Выбор из вариантов'",""
"passed","Tue Oct 31 06:15:00 UTC 2023","Tue Oct 31 06:15:10 UTC 2023","10464","","Программа","","ProgramCreationTests","CreateAdditionalProgramFillAllFields","Cоздание обр программы ДПО: если заполнить все поля",""
"passed","Tue Oct 31 06:09:14 UTC 2023","Tue Oct 31 06:09:22 UTC 2023","7975","Активность","Контрольная","Результат прохождения теста","TestActivityResultTests","CheckMarkIncorrectTextOrFileAnswer","Результат прохождения: можно отметить 'Не верно' ответ вопроса с типом ответа свободный ответ или файл",""
"passed","Tue Oct 31 06:09:23 UTC 2023","Tue Oct 31 06:09:56 UTC 2023","33379","","Звонок","","CallTests","CheckGreenFrameIsDisplayedOnAnotherUsersCard","Страница звонка: отображается зеленая рамка у карточки собеседника при разговоре",""
"passed","Tue Oct 31 06:14:51 UTC 2023","Tue Oct 31 06:14:55 UTC 2023","4040","","Программа","","ProgramCreationTests","CreateHighProgramOverviewFields","Cоздание обр программы ДПО: если заполнить только обязательные поля",""
"passed","Tue Oct 31 06:11:11 UTC 2023","Tue Oct 31 06:11:17 UTC 2023","6212","","Дисциплина","Страница дисциплины","DisciplineAnalyticsTests","CheckDisciplineAnalyticsIsOpen","Страница аналитика дисциплины: при переходе на вкладку “Аналитика” открывается аналитика дисциплины",""
"passed","Tue Oct 31 06:08:53 UTC 2023","Tue Oct 31 06:09:05 UTC 2023","11906","","Активность","Обычный шаблон активности","TemplateAddingTests","CheckRemoveMaterialActivityTemplate","Редактирование шаблона активности: можно удалять материалы",""
"passed","Tue Oct 31 06:15:26 UTC 2023","Tue Oct 31 06:15:31 UTC 2023","4547","","Профиль","","AddressAndContactsEditingTests","CheckUnlockContactFieldsAfterInterPassword","Редактирование профиля пользователя: после ввода пароля можно разблокировать полей 'Контакты'",""
"passed","Tue Oct 31 06:06:53 UTC 2023","Tue Oct 31 06:07:22 UTC 2023","29030","","Активность","Обычная активность","ActivityContentVisibilityTests","CheckHideMaterial","Редактирование активности: можно скрыть материал",""
"failed","Tue Oct 31 06:17:57 UTC 2023","Tue Oct 31 06:18:11 UTC 2023","13636","","Организация","Редактирование организации","OrganizationEditingTests","CheckAccessibleFieldsForAdmin","Редактирование организации: администратор организации может редактировать только поля ответственных лиц",""
"passed","Tue Oct 31 06:08:40 UTC 2023","Tue Oct 31 06:08:41 UTC 2023","1654","Активность","Контрольная","Редактирование контрольной","TestActivityEditingTests","ErrorWhenDeletingTestActivityWithAttempts","Редактирование контрольной: невозможно удалить контрольную при наличии оценок",""
"passed","Tue Oct 31 06:07:02 UTC 2023","Tue Oct 31 06:07:18 UTC 2023","15804","","Активность","Обычная активность","ActivityEditingTests","CheckEditValueScormResultScore","Редактирование активности: можно переключать значения в поле 'Оценка по SCORM результату'",""
"passed","Tue Oct 31 06:09:05 UTC 2023","Tue Oct 31 06:09:14 UTC 2023","8844","","Чат","Дисциплина","DisciplineChatTests","CheckSendTextMessageInDisciplineChat","Список чатов - комната дисциплины: можно отправить текстовое сообщение",""
"passed","Tue Oct 31 06:09:00 UTC 2023","Tue Oct 31 06:09:08 UTC 2023","7820","","Активность","Обычный шаблон активности","TemplateEditingTests","CheckEditNameActivityTemplate","Редактирование шаблона активности: можно изменить название",""
"passed","Tue Oct 31 06:12:34 UTC 2023","Tue Oct 31 06:12:44 UTC 2023","10049","","Подразделения","Создание подразделения","DivisionCreationTests","CheckCreateDivisionWithFillingAllFields","Можно создать подразделение, если заполнены все поля",""
"passed","Tue Oct 31 06:11:31 UTC 2023","Tue Oct 31 06:11:38 UTC 2023","6714","","Чат","Групповой чат","GroupChatTests","CheckRestoreGroupChatFromArchive","Список чатов - групповой чат: можно восстановить чат из архива",""
"passed","Tue Oct 31 06:08:32 UTC 2023","Tue Oct 31 06:08:40 UTC 2023","7897","Активность","Контрольная","Редактирование контрольной","TestActivityEditingTests","SwitchCheckboxDisplayStudentsDetailedResultInfoInTestActivity","Редактирование контрольной: можно отметить или снять галку с чекбокса 'Отображать студентам подробную информацию о результатах'",""
"passed","Tue Oct 31 06:09:00 UTC 2023","Tue Oct 31 06:09:06 UTC 2023","6347","Активность","Контрольная","Результат прохождения теста","TestActivityResultTests","CheckMarkCorrectTextOrFileAnswer","Результат прохождения: можно отметить 'Верно' ответ вопроса с типом ответа свободный ответ или файл",""
"passed","Tue Oct 31 06:13:55 UTC 2023","Tue Oct 31 06:14:08 UTC 2023","13027","","Материал","Конструктор тест-тренажера","TestTrainBlocksAndVariantsValidationTests","DeleteBlockTestTrain","Конструктор теста-тренажера: можно удалить блок",""
"passed","Tue Oct 31 06:11:12 UTC 2023","Tue Oct 31 06:11:31 UTC 2023","19179","","Чат","Групповой чат","GroupChatTests","CheckSendGroupChatToArchive","Список чатов - групповой чат: можно отправить чат в архив",""
"passed","Tue Oct 31 06:11:31 UTC 2023","Tue Oct 31 06:11:37 UTC 2023","6415","","Дисциплина","Редактирование дисциплины","DisciplineEditingTests","CheckSetNameField","Редактирование дисциплины: можно изменить название",""
"passed","Tue Oct 31 06:12:17 UTC 2023","Tue Oct 31 06:12:23 UTC 2023","6676","","Дисциплина","Редактирование дисциплины","DisContingentEditingValidationTests","CheckUnableAddStudentFromAnotherCohortInEditing","Редактирование дисциплины: невозможно добавить студента из стороннего потока",""
"passed","Tue Oct 31 06:12:44 UTC 2023","Tue Oct 31 06:13:01 UTC 2023","17105","","Библиотека","","LibraryInListViewTests","CheckMoveMaterialToCatalogInListView","Библиотека, списочный вид: можно переместить материал в другой каталог",""
"passed","Tue Oct 31 06:15:01 UTC 2023","Tue Oct 31 06:15:03 UTC 2023","2123","","Программа","","ProgramEditingTests","CheckRemoveProgramWithNationalProject","Редактирование программы ДО: невозможно удалить программу с проектом СЗ",""
"passed","Tue Oct 31 06:09:05 UTC 2023","Tue Oct 31 06:09:21 UTC 2023","15822","Активность","Контрольная","Прохождение теста","TestActivityStatusWithTwoOrMoreAttemptsTests","ResultOfPassingDependOnSettings","Страница индивидуальной контрольной: результат тестирования из попытках зависеть от настройки 'За последнюю попытку'",""
"passed","Tue Oct 31 06:11:41 UTC 2023","Tue Oct 31 06:11:43 UTC 2023","2826","","Дисциплина","Редактирование дисциплины","DisciplineEditingValidationTests","CheckIfNameNotFilledInEditing","Редактирование дисциплины: отображение ошибки валидации для поля 'Название', если поле не заполнено",""
"passed","Tue Oct 31 06:08:33 UTC 2023","Tue Oct 31 06:08:49 UTC 2023","15999","Активность","Контрольная","Прохождение теста","TestActivityStatusWithTwoOrMoreAttemptsTests","ResultOfPassingDependOnSettings","Страница индивидуальной контрольной: результат тестирования из попытках зависеть от настройки 'За лучшую попытку'",""
"passed","Tue Oct 31 06:13:11 UTC 2023","Tue Oct 31 06:13:12 UTC 2023","1398","","Библиотека","","StudentLibraryTests","CheckStudentNotAllowedPutContentInStock","Страница материала: студенту недоступно выставление своего материала на Биржу",""
"passed","Tue Oct 31 06:09:41 UTC 2023","Tue Oct 31 06:09:49 UTC 2023","8021","","Чат","Чат решения","TaskChatTests","CheckSendEmptyMessageInTaskChat","Список чатов - обсуждение решения: невозможно отправить пустое сообщение",""
"passed","Tue Oct 31 06:08:16 UTC 2023","Tue Oct 31 06:08:31 UTC 2023","15544","Активность","Контрольная","Страница контрольной","TestCommandActivityTests","AddCommandToControlTypeActivityInCommandMode","Страница командной контрольной: можно добавить команду",""
"passed","Tue Oct 31 06:14:22 UTC 2023","Tue Oct 31 06:14:33 UTC 2023","11185","","Материал","Конструктор тест-тренажера","TestTrainQuestionsValidationTests","AddCommentInTestTrainQuestion","Конструктор теста-тренажера: можно добавить комментарий к вопросу",""
"passed","Tue Oct 31 06:14:54 UTC 2023","Tue Oct 31 06:14:56 UTC 2023","2486","","Организация","Страница организации","OrganizationPageTests","CheckIconAndTooltipDisplayedForClosedDivision","Страница организации: у закрытых подразделений отображается иконка и тултип",""
"passed","Tue Oct 31 06:11:58 UTC 2023","Tue Oct 31 06:12:07 UTC 2023","8751","","Дисциплина","Страница дисциплины","DisciplineAnalyticsTests","CheckFilterByStudentName","Страница аналитика дисциплины: работает фильтр по имени студента",""
"passed","Tue Oct 31 06:07:44 UTC 2023","Tue Oct 31 06:07:48 UTC 2023","3965","","Активность","Обычная активность","ActivityDurationTests","CheckEditVolumeActivityWithIncorrectValues","Редактирование активности: отображение ошибки валидации для поля 'Объём' с отрицательным значением",""
"passed","Tue Oct 31 06:14:08 UTC 2023","Tue Oct 31 06:14:19 UTC 2023","10978","","Материал","Конструктор тест-тренажера","TestTrainBlocksAndVariantsValidationTests","CheckRemoveQuestionFromTestTrain","Конструктор теста-тренажера: можно удалить вопрос",""
"passed","Tue Oct 31 06:15:35 UTC 2023","Tue Oct 31 06:15:39 UTC 2023","3676","","Профиль","","UserInfoPageTests","CheckTransitionToEditProfileWorks","Страница профиля пользователя: кнопка 'Редактировать' работает для пользователя",""
"passed","Tue Oct 31 06:15:03 UTC 2023","Tue Oct 31 06:15:11 UTC 2023","8096","","Расписание","","ScheduleTests","CheckStubIsDisplayedIfNoEvents","Отображается заглушка в режиме Расписание, если нет событий",""
"failed","Tue Oct 31 06:17:49 UTC 2023","Tue Oct 31 06:17:52 UTC 2023","2684","","Подразделения","Страница подразделения","DivisionPageTests","CheckTypeAndHoursOfProgramsIsDisplayed","Лейблы тип и количество часов отображаются под названием программы",""
"passed","Tue Oct 31 06:07:15 UTC 2023","Tue Oct 31 06:07:19 UTC 2023","3808","","Активность","Задание","TaskWithSolutionStudentTests","CheckEditSolution","Можно редактировать решения",""
"passed","Tue Oct 31 06:12:18 UTC 2023","Tue Oct 31 06:12:25 UTC 2023","7065","","Дисциплина","Редактирование дисциплины","DisciplineEditingTests","CheckDeleteDisciplineWithoutGrades","Редактирование дисциплины: можно удалить дисциплину без оценок",""
"passed","Tue Oct 31 06:08:00 UTC 2023","Tue Oct 31 06:08:12 UTC 2023","12248","Активность","Контрольная","Результат прохождения теста","TestActivityResultTests","StudentCanViewDetailedResultInfo","Результат прохождения: студент может просматривать подробную информацию о результатах, если включена соответственная опция",""
"passed","Tue Oct 31 06:10:16 UTC 2023","Tue Oct 31 06:10:28 UTC 2023","11788","","Чат","Мини-чат страницы решений","TaskPageMiniChatTests","CheckAddQuoteToLastMessageInTaskPageMiniChat","Чат на странице решения: можно цитировать сообщению",""
"passed","Tue Oct 31 06:13:50 UTC 2023","Tue Oct 31 06:13:56 UTC 2023","6205","","Материал","Конструктор теста","TestSettingsValidationTests","AddTagInTest","Конструктор теста: можно добавлять теги знаний",""
"passed","Tue Oct 31 06:07:59 UTC 2023","Tue Oct 31 06:08:02 UTC 2023","3034","","Активность","Задание","TaskWithSolutionStudentTests","CheckAbilityToSeeListSolutions","Можно просмотреть список всех решений, если включена 'Решения открыты всем'",""
"passed","Tue Oct 31 06:11:51 UTC 2023","Tue Oct 31 06:11:58 UTC 2023","7469","","Дисциплина","Страница дисциплины","DisciplineAnalyticsTests","CheckHideFiltersOfAnalyticsTable","Страница аналитика дисциплины: можно скрывать фильтры таблицы аналитики",""
"passed","Tue Oct 31 06:14:00 UTC 2023","Tue Oct 31 06:14:05 UTC 2023","4841","","Библиотека","","LibraryActionPanelTests","CheckChangeViewOfLibraryInTileView","Библиотека: можно переключать текущий вид библиотеки со “Списка” на “Плитку”",""
"passed","Tue Oct 31 06:14:33 UTC 2023","Tue Oct 31 06:14:41 UTC 2023","7778","","Материал","Конструктор тест-тренажера","TestTrainSettingsValidationTests","AddAuthorInTestTrain","Конструктор теста-тренажера: можно добавить автора",""
"passed","Tue Oct 31 06:11:52 UTC 2023","Tue Oct 31 06:12:07 UTC 2023","15376","","Дисциплина","Страница дисциплины","DisciplineRightMenuTests","CheckPinDisciplineForTeacher","Работает кнопка закрепления/открепления из главного меню для преподавателя",""
"passed","Tue Oct 31 06:15:16 UTC 2023","Tue Oct 31 06:15:23 UTC 2023","7373","","Профиль","","AddressAndContactsEditingTests","CheckCityField","Редактирование профиля пользователя: можно изменить город",""
"passed","Tue Oct 31 06:12:13 UTC 2023","Tue Oct 31 06:12:26 UTC 2023","12251","","Дисциплина","Страница дисциплины","DisciplineRightMenuTests","CreateTemplateFromDiscipline","Страница дисциплины: создание шаблона из дисциплины",""
"passed","Tue Oct 31 06:12:37 UTC 2023","Tue Oct 31 06:12:41 UTC 2023","3459","","Дисциплина","Страница дисциплины","DisciplineAnalyticsTests","CheckStubIsDisplayedIfNoStudentsInDiscipline","Страница аналитика дисциплины: отображается заглушка, если в дисциплине нет студентов или активностей",""
"passed","Tue Oct 31 06:13:34 UTC 2023","Tue Oct 31 06:13:50 UTC 2023","16575","","Материал","Конструктор тест-тренажера","TestTrainAddingQuestionsTests","AddQuestionInTestTrain","Конструктор теста-тренажера: можно добавить вопрос с типом ответа “Выбор из вариантов”",""
"passed","Tue Oct 31 06:06:19 UTC 2023","Tue Oct 31 06:06:32 UTC 2023","12691","","Активность","Обычная активность","ActivityEditingTests","CheckEditActivity","Редактирование активности: работает кнопка 'Редактировать' для преподавателя",""
