"Status","Start Time","Stop Time","Duration in ms","Parent Suite","Suite","Sub Suite","Test Class","Test Method","Name","Description"
"passed","Thu Mar 13 07:18:36 UTC 2025","Thu Mar 13 07:19:07 UTC 2025","31512","","Поток","Страница потока","CohortInfoTests","CheckAccessStudentToActivityCohortArchive","Страница потока: после восстановления из архива восстанавливается доступ к активностям",""
"passed","Thu Mar 13 07:35:08 UTC 2025","Thu Mar 13 07:35:35 UTC 2025","26495","","Материал","Конструктор тест-тренажера","TestTrainSettingsValidationTests","EditTestTrainStudyTime","Конструктор теста-тренажера: можно изменить время изучения",""
"passed","Thu Mar 13 07:25:23 UTC 2025","Thu Mar 13 07:25:55 UTC 2025","32284","","Дисциплина","Шаблон дисциплины","DisTemplateTests","CheckCreateActivityInDisTemplate","Можно добавить шаблон активности в шаблон дисциплины, создав его",""
"passed","Thu Mar 13 07:20:30 UTC 2025","Thu Mar 13 07:20:54 UTC 2025","24404","","Дисциплина","Редактирование дисциплины","DisciplineEditingTests","CheckSwitchLanguage","Можно переключать значения в поле Язык",""
"passed","Thu Mar 13 07:32:21 UTC 2025","Thu Mar 13 07:32:27 UTC 2025","6301","","Организация","Мой тариф","MyPlanOrganizationPageTests","CheckAmountDueTooltipAppears","Отображается тултип при наведении курсора на значок i в блоке Расчет данных",""
"passed","Thu Mar 13 07:23:49 UTC 2025","Thu Mar 13 07:23:57 UTC 2025","8199","","Подразделения","Создание подразделения","DivisionCreationTests","CheckCopyNameToShortnameFieldByDoubleClicking","Можно скопировать название в поле краткое название двойным кликом",""
"passed","Thu Mar 13 07:33:07 UTC 2025","Thu Mar 13 07:33:17 UTC 2025","9994","","Организация","Создание организации","OrganizationCreationTests","CheckCopyNameToShortnameByDoubleClicking","Можно скопировать название в поле краткое название двойным кликом",""
"passed","Thu Mar 13 07:22:18 UTC 2025","Thu Mar 13 07:22:34 UTC 2025","16506","","Дисциплина","Создание дисциплины","DisContingentCreationValidationTests","CheckUnableAddStudentFromAnotherCohortInCreation","Невозможно добавить студента из стороннего потока",""
"broken","Thu Mar 13 07:44:46 UTC 2025","Thu Mar 13 07:45:54 UTC 2025","67900","","Экзамен","","TestCenterTests","CheckExamineesAuthorization","Проверка авторизации экзаменуемого",""
"passed","Thu Mar 13 07:34:37 UTC 2025","Thu Mar 13 07:34:50 UTC 2025","12482","","Программа","","ProgramEditingTests","CheckRemoveProgramWithCohort","Невозможно удалить программу ДО с потоками",""
"passed","Thu Mar 13 07:46:28 UTC 2025","Thu Mar 13 07:47:08 UTC 2025","40161","","Материал","Конструктор тест-тренажера","TestTrainAddingQuestionsTests","CheckAddQuestionInTestTrainFreeAnswerWithEqual","Конструктор теста-тренажера: можно добавить вопрос с типом ответа “Свободный ответ” - “Точное совпадение”",""
"passed","Thu Mar 13 07:46:25 UTC 2025","Thu Mar 13 07:47:09 UTC 2025","43828","","Материал","Конструктор теста","TestAddingQuestionsTests","CheckAddQuestionWithFreeAnswerRange","Конструктор теста: можно добавить вопрос с типом ответа “Свободный ответ” - “Диапазон”",""
"passed","Thu Mar 13 07:32:51 UTC 2025","Thu Mar 13 07:33:19 UTC 2025","28113","","Материал","Конструктор тест-тренажера","TestTrainQuestionsValidationTests","RemoveCommentInTestTrainQuestion","Конструктор теста-тренажера: можно удалить комментарий к вопросу",""
"passed","Thu Mar 13 07:24:45 UTC 2025","Thu Mar 13 07:24:57 UTC 2025","12284","","Подразделения","Страница подразделения","DivisionPageTests","CheckPinAndUnpinButtonOfDivisionInMainMenu","Работает кнопка закрепления/открепления из главного меню",""
"passed","Thu Mar 13 07:00:17 UTC 2025","Thu Mar 13 07:01:58 UTC 2025","100585","Активность","Обычная активность","Редактирование активности","ActivityContentVisibilityTests","CheckVisibilityMaterialDuringActivity","Видимость материала во время проведения активности",""
"passed","Thu Mar 13 07:17:22 UTC 2025","Thu Mar 13 07:17:36 UTC 2025","14575","","Поток","Редактирование потока","CohortEditingValidationTests","CheckEditCohortIfStartAndEndDateNotFilled","Редактирование потока: ошибка валидации, если даты начала и окончания не заполнены",""
"passed","Thu Mar 13 07:27:20 UTC 2025","Thu Mar 13 07:27:28 UTC 2025","8291","","Дисциплина","Страница дисциплины","DisciplineAnalyticsTests","CheckStubIsDisplayedIfNoStudentsInDiscipline","В аналитики отображается заглушка, если в дисциплине нет студентов или активностей",""
"passed","Thu Mar 13 07:08:52 UTC 2025","Thu Mar 13 07:09:16 UTC 2025","24025","Активность","Шаблон активности контрольной","Редактирование шаблона контрольной","TestTemplateEditingTests","CheckErrorInEditingNumOfAttemptsWithIncorrectValue","Ошибка валидации в поле Количество попыток сдачи, если введено отрицательное значение",""
"passed","Thu Mar 13 07:27:07 UTC 2025","Thu Mar 13 07:27:38 UTC 2025","30813","","Материал","Конструктор теста","TestCreationTests","TestCreation","Конструктор теста: создание теста",""
"passed","Thu Mar 13 07:20:58 UTC 2025","Thu Mar 13 07:21:26 UTC 2025","27602","","Дисциплина","Создание дисциплины","DisciplineCreationValidationTests","CheckIfCreditValuesNotAllowed","Отображение ошибки валидации для поля 'Кредиты' с отрицательным значением в ДО",""
"passed","Thu Mar 13 07:24:49 UTC 2025","Thu Mar 13 07:25:23 UTC 2025","33800","","Дисциплина","Шаблон дисциплины","DisTemplateTests","CheckAddActivityInDisTemplate","Можно добавить шаблон активности в шаблон дисциплины, выбрав его из библиотеки",""
"passed","Thu Mar 13 07:23:46 UTC 2025","Thu Mar 13 07:24:17 UTC 2025","31087","","Экзамен","","ExamCreateEditTests","CreateExamPatent","Создание экзамена Патент",""
"passed","Thu Mar 13 07:22:45 UTC 2025","Thu Mar 13 07:23:16 UTC 2025","30898","","Дисциплина","Редактирование дисциплины","DisContingentEditingTests","CheckAddTeacherByUserInfoInEditing","Редактирование дисциплины: добавление преподавателя из списка",""
"passed","Thu Mar 13 07:22:52 UTC 2025","Thu Mar 13 07:23:06 UTC 2025","13605","","Дисциплина","Создание дисциплины","DisContingentCreationValidationTests","CheckOnlyCohortGroupsAreShownInListOfGroups","В выпадающем списке поля Группы отображаются только группы потока при создании дисциплины",""
"passed","Thu Mar 13 07:36:45 UTC 2025","Thu Mar 13 07:36:48 UTC 2025","2543","","Профиль","","UserInfoPageTests","CheckIfUserActivityIsLoading","Страница профиля пользователя: загружается блок 'Работа в Odin' для пользователя",""
"passed","Thu Mar 13 07:21:52 UTC 2025","Thu Mar 13 07:22:15 UTC 2025","23209","","Дисциплина","Редактирование дисциплины","DisciplineEditingTests","CheckAddTagInDiscipline","Можно добавлять теги знаний",""
"passed","Thu Mar 13 07:43:55 UTC 2025","Thu Mar 13 07:44:21 UTC 2025","26216","","Дисциплина","Страница дисциплины","DisciplineMarksAndAttendanceTests","CheckFinalGradesByTeacher","Проверка работы кнопки ‘Итоговые оценки (ведомость)’ у преподавателя",""
"passed","Thu Mar 13 07:23:30 UTC 2025","Thu Mar 13 07:23:40 UTC 2025","9801","","Подразделения","Редактирование подразделения","DivisionEditingTests","CheckEditDivisionType","Можно поменять тип подразделения",""
"passed","Thu Mar 13 07:27:09 UTC 2025","Thu Mar 13 07:28:00 UTC 2025","51288","","Библиотека","","BulkActionsLibraryTests","CheckMoveMultipleSelectedItemsToAnotherDirectory","Библиотека: можно переместить несколько выбранных элементов в другой каталог",""
"passed","Thu Mar 13 07:23:57 UTC 2025","Thu Mar 13 07:24:10 UTC 2025","12587","","Дисциплина","Редактирование дисциплины","DisContingentEditingValidationTests","CheckIsDisabledCheckboxAllStudentInEditingDiscipline","Галка Все студенты потока задизейблена и невозможно ее снять, если дисциплина относится к Нацпроекту",""
"passed","Thu Mar 13 07:15:35 UTC 2025","Thu Mar 13 07:16:03 UTC 2025","28487","","Чат","Чат для заметок","NotesChatTests","CheckSendFileMessageInNotesChat","Можно прикрепить и отправить файл с компьютера в чате для заметок",""
"passed","Thu Mar 13 07:35:00 UTC 2025","Thu Mar 13 07:35:11 UTC 2025","10884","","Организация","Страница организации","OrganizationPageTests","CheckIconAndTooltipDisplayedForClosedDivision","У закрытых подразделений отображается иконка и тултип",""
"passed","Thu Mar 13 07:26:42 UTC 2025","Thu Mar 13 07:26:50 UTC 2025","8098","","Библиотека","","StudentLibraryTests","CheckStudentNotAllowedPutContentInStock","Страница материала: студенту недоступно выставление своего материала на Биржу",""
"passed","Thu Mar 13 07:30:39 UTC 2025","Thu Mar 13 07:31:16 UTC 2025","37019","","Библиотека","","LibraryInListViewTests","CheckRemoveCatalogViaActionsButton","Библиотека, списочный вид: можно удалить каталог через actions-кнопки",""
"passed","Thu Mar 13 07:35:38 UTC 2025","Thu Mar 13 07:35:56 UTC 2025","18200","","Расписание","","StudentScheduleSettingsTests","CheckDisplayOfCompletedActivities","Проверка отображения пройденных активностей под студентом",""
"passed","Thu Mar 13 07:26:03 UTC 2025","Thu Mar 13 07:26:53 UTC 2025","49390","","Дисциплина","Страница дисциплины","DisciplineAnalyticsTests","CheckActivityAndVolumeTooltipIsDisplayed","В аналитики у заголовков  ‘Активности’ и ‘Объем’ есть тултип",""
"passed","Thu Mar 13 07:47:50 UTC 2025","Thu Mar 13 07:48:10 UTC 2025","20114","","Материал","Конструктор тест-тренажера","TestTrainAddingQuestionsTests","CheckAddQuestionInTestTrainSort","Конструктор теста-тренажера: можно добавить вопрос с типом ответа “Сортировка”",""
"passed","Thu Mar 13 07:34:48 UTC 2025","Thu Mar 13 07:35:07 UTC 2025","18788","","Расписание","","ScheduleTests","CheckColorLegendIsDisplayed","Отображается цветовая легенда событий расписания",""
"passed","Thu Mar 13 07:03:37 UTC 2025","Thu Mar 13 07:04:12 UTC 2025","35493","Активность","Обычная активность","Редактирование активности","ActivityAddingTests","CheckAddScormPackageActivity","Можно добавить материал типа SCORM из Библиотеки",""
"passed","Thu Mar 13 07:15:07 UTC 2025","Thu Mar 13 07:15:24 UTC 2025","17395","","Поток","Редактирование потока","CohortEditingTests","CheckCancelCohortEditing","Редактирование потока ДО: работает кнопка 'Отмена', если страница редактирование был открыть со страницы потока",""
"passed","Thu Mar 13 07:26:19 UTC 2025","Thu Mar 13 07:27:13 UTC 2025","53586","","Библиотека","","LibraryInListViewTests","CheckCopyMaterialToCatalogInListView","Библиотека, списочный вид: можно скопировать материал в другой каталог",""
"passed","Thu Mar 13 07:23:07 UTC 2025","Thu Mar 13 07:24:00 UTC 2025","52504","","Дисциплина","Страница дисциплины","DisciplineAnalyticsTests","CheckFilterByStudentName","Проверка фильтра аналитики по имени студента",""
"passed","Thu Mar 13 07:04:28 UTC 2025","Thu Mar 13 07:04:43 UTC 2025","14213","","Активность","Обычный шаблон активности","TemplateEditingValidationTests","CheckEditActivityTemplateVolumeWithIncorrectValue","Ошибка валидации в поле Объем в академических часах, если введено значение больше 100",""
"passed","Thu Mar 13 07:04:02 UTC 2025","Thu Mar 13 07:04:19 UTC 2025","17398","","Активность","Обычный шаблон активности","TemplateAddingTests","CheckScormScoreFieldNotDisplayed","Отсутствует поле Оценка по SCORM результату, если SCORM пакет не добавлен в шаблон активности",""
"passed","Thu Mar 13 07:21:23 UTC 2025","Thu Mar 13 07:21:38 UTC 2025","14596","","Дисциплина","Редактирование дисциплины","DisciplineEditingValidationTests","CheckIfCreditNotFilled","Отображение ошибки валидации для поля Кредиты с значением 0 в дисциплине ДО",""
"passed","Thu Mar 13 07:05:59 UTC 2025","Thu Mar 13 07:06:30 UTC 2025","30887","Активность","Контрольная","Редактирование контрольной","TestActivityEditingTests","CheckErrorInNumOfAttemptsFieldWithIncorrectValue","Ошибка валидации в поле Количество попыток сдачи, если введено отрицательное значение",""
"passed","Thu Mar 13 07:32:06 UTC 2025","Thu Mar 13 07:32:39 UTC 2025","33090","","Материал","Конструктор теста","TestQuestionAnswersValidationTests","CheckRemoveAnswerFromComparisionQuestion","Конструктор теста: можно удалить один вариант на сопоставление из вопроса с типом ответа ‘Сопоставление’",""
"passed","Thu Mar 13 07:14:15 UTC 2025","Thu Mar 13 07:14:59 UTC 2025","44395","","Чат","Чат для заметок","NotesChatTests","CheckFindSentMessageInNotesChat","Можно найти отправленное сообщение в чате для заметок",""
"passed","Thu Mar 13 07:32:24 UTC 2025","Thu Mar 13 07:32:37 UTC 2025","12399","","Материал","Конструктор тест-тренажера","TestTrainBlocksAndVariantsValidationTests","ImpossibleToAddVariantInTestTrain","Конструктор теста-тренажера: отсутствует возможность добавить вариант",""
"passed","Thu Mar 13 07:08:34 UTC 2025","Thu Mar 13 07:09:08 UTC 2025","34198","Активность","Контрольная","Редактирование контрольной","TestActivityEditingTests","CheckSuccessSaveWithCorrectValueInTimeLimitField","Успешное сохранение при корректных значениях в поле Временной лимит",""
"passed","Thu Mar 13 07:36:44 UTC 2025","Thu Mar 13 07:36:55 UTC 2025","10415","","Профиль","","AddressAndContactsEditingTests","CheckEmailField","Редактирование профиля пользователя: можно изменить email",""
"passed","Thu Mar 13 07:29:54 UTC 2025","Thu Mar 13 07:30:28 UTC 2025","34214","","Материал","Конструктор тест-тренажера","TestTrainBlocksAndVariantsValidationTests","EditTestTrainBlockName","Конструктор теста-тренажера: можно переименовать блок",""
"passed","Thu Mar 13 07:33:06 UTC 2025","Thu Mar 13 07:33:29 UTC 2025","23581","","Материал","Конструктор теста","TestSettingsValidationTests","EditTestTimeLimit","Конструктор теста: можно изменить временной лимит",""
"passed","Thu Mar 13 07:02:31 UTC 2025","Thu Mar 13 07:02:53 UTC 2025","22192","Активность","Задание","Страница решения задания для студента","TaskWithoutSolutionStudentTests","CheckAccessFormWithoutSolution","Отправка решений после даты окончания активности",""
"passed","Thu Mar 13 07:33:54 UTC 2025","Thu Mar 13 07:34:09 UTC 2025","15079","","Организация","Страница организации","OrganizationPageTests","CheckTooltipIsDisplayedByHoverProjectIcon","Отображается тултип при наведении на иконку участника проекта",""
"passed","Thu Mar 13 07:36:52 UTC 2025","Thu Mar 13 07:36:55 UTC 2025","2858","","Профиль","","UserInfoPageTests","CheckStudentCanOpenPageOfPassedActivities","Страница профиля пользователя: под студентом можно перейти на страницу пройденных активностей",""
"passed","Thu Mar 13 07:08:27 UTC 2025","Thu Mar 13 07:08:39 UTC 2025","11512","Активность","Контрольная","Прохождение теста","TestActivityPassingTests","CheckUnablePassTestAfterTheEndOfActivity","Невозможно пройти тест после окончания активности",""
"passed","Thu Mar 13 07:43:07 UTC 2025","Thu Mar 13 07:43:28 UTC 2025","20806","Активность","Задание","Страница решения задания для преподавателя","TaskActivityTeacherTests","CheckGradeSolutionValueAboveAndBelowScore","Можно оценить решение значением ниже минимального порога баллов",""
"passed","Thu Mar 13 07:42:07 UTC 2025","Thu Mar 13 07:42:22 UTC 2025","15445","Активность","Контрольная","Редактирование контрольной","TestActivityEditingTests","CheckExecutionModeFieldIsNotClickable","Поле Режим выполнения некликабельно",""
"passed","Thu Mar 13 07:18:09 UTC 2025","Thu Mar 13 07:18:17 UTC 2025","7999","","Поток","Завершение обучения","EducationCompletionPageTests","FindStudentWithName","Поиск студента по ФИО на странице завершения обучения потока",""
"passed","Thu Mar 13 07:27:37 UTC 2025","Thu Mar 13 07:28:26 UTC 2025","49518","","Материал","Конструктор теста","TestAddingQuestionsTests","CheckAddQuestionWithFreeAnswerManualCheck","Конструктор теста: можно добавить вопрос с типом ответа “Свободный ответ” - “Ручная проверка”",""
"passed","Thu Mar 13 07:04:43 UTC 2025","Thu Mar 13 07:04:54 UTC 2025","11294","","Активность","Обычный шаблон активности","TemplateEditingValidationTests","CheckScormResultScoreFieldNotDisplayed","Отсутствует поле Оценка по SCORM результату, если SCORM пакет был добавлен не в контрольную",""
"passed","Thu Mar 13 07:20:08 UTC 2025","Thu Mar 13 07:20:48 UTC 2025","40002","","Дисциплина","Настройка чата дисциплины","DisciplineChatBlockTests","CheckBlockAndUnblockChatDiscipline","Проверка включения чата дисциплины в уже созданной дисциплине",""
"passed","Thu Mar 13 07:05:34 UTC 2025","Thu Mar 13 07:06:24 UTC 2025","50290","Активность","Контрольная","Редактирование контрольной","TestActivityAddingTests","CheckAddTestToControlTypeActivity","Можно добавить материал типа Тест из Библиотеки в контрольную",""
"passed","Thu Mar 13 07:21:52 UTC 2025","Thu Mar 13 07:22:09 UTC 2025","17682","","Дисциплина","Редактирование дисциплины","DisciplineEditingValidationTests","CheckIfCreditNotFilled","Отображение ошибки валидации для поля Кредиты с значением > 15 в дисциплине ДО",""
"passed","Thu Mar 13 07:01:15 UTC 2025","Thu Mar 13 07:01:54 UTC 2025","39808","Активность","Задание","Создание задания","TaskActivityMulticriteriaTests","CheckCreateTaskMultiCriteria","Можно создать активность типа Задание с критериями",""
"passed","Thu Mar 13 07:10:59 UTC 2025","Thu Mar 13 07:11:32 UTC 2025","33199","","Чат","Чат дисциплины","DisciplineChatTests","CheckSendTextMessageInDisciplineChat","Можно отправить текстовое сообщение в чате дисциплины",""
"passed","Thu Mar 13 07:32:58 UTC 2025","Thu Mar 13 07:33:23 UTC 2025","25725","","Организация","Редактирование организации","OrganizationEditingTests","CheckCancelOrganizationEditing","Работает кнопка Отмена",""
"passed","Thu Mar 13 07:29:22 UTC 2025","Thu Mar 13 07:29:59 UTC 2025","36997","","Материал","Конструктор теста","TestSettingsValidationTests","EditTestDescription","Конструктор теста: можно изменить описание теста",""
"passed","Thu Mar 13 07:29:50 UTC 2025","Thu Mar 13 07:30:24 UTC 2025","33905","","Материал","Конструктор теста","TestQuestionsValidationTests","CheckAndUncheckAnswerOptionInTest","Конструктор теста: возможность отметить вариант ответа как “верный”",""
"passed","Thu Mar 13 07:46:47 UTC 2025","Thu Mar 13 07:47:02 UTC 2025","14994","","Профиль","","GeneralUserInfoEditingTests","ValidatingUserNameFields","Редактирование профиля пользователя: можно изменить ФИО",""
"passed","Thu Mar 13 07:02:51 UTC 2025","Thu Mar 13 07:03:34 UTC 2025","42781","Активность","Обычная активность","Редактирование активности","ActivityDurationTests","ErrorWhenEndDateLessStartDateInActivity","Отображение ошибки валидации для полей дат, если дата окончания меньше даты начала",""
"passed","Thu Mar 13 07:35:35 UTC 2025","Thu Mar 13 07:35:47 UTC 2025","12400","","Расписание","","ScheduleTests","CheckTransitionToSchedulePage","Расписание можно открыть из блока Ближайшие активности",""
"passed","Thu Mar 13 07:31:44 UTC 2025","Thu Mar 13 07:32:24 UTC 2025","39705","","Материал","Конструктор тест-тренажера","TestTrainBlocksAndVariantsValidationTests","CheckRemoveTestTrainQuestion","Конструктор теста-тренажера: можно удалить вопрос",""
"passed","Thu Mar 13 07:16:45 UTC 2025","Thu Mar 13 07:17:20 UTC 2025","35092","","Чат","Чат для заметок","NotesChatTests","CheckAddReactionToLastMessageInNotesChat","Можно добавить реакцию на сообщение в чате для заметок",""
"passed","Thu Mar 13 07:03:54 UTC 2025","Thu Mar 13 07:04:13 UTC 2025","18897","","Активность","Обычный шаблон активности","TemplateEditingValidationTests","CheckEditActivityTemplateVolumeWithIncorrectValue","Ошибка валидации в поле Объем в академических часах, если введено отрицательное значение",""
"passed","Thu Mar 13 07:32:46 UTC 2025","Thu Mar 13 07:33:13 UTC 2025","26607","","Материал","Конструктор тест-тренажера","TestTrainSettingsValidationTests","AddAuthorInTestTrain","Конструктор теста-тренажера: можно добавить автора",""
