"Status","Start Time","Stop Time","Duration in ms","Parent Suite","Suite","Sub Suite","Test Class","Test Method","Name","Description"
"passed","Wed Oct 11 05:41:50 UTC 2023","Wed Oct 11 05:41:55 UTC 2023","4423","","Расписание","","ScheduleTests","CheckMemoryModeSchedule","Страница расписания: проверка запоминания выбора режима расписания",""
"passed","Wed Oct 11 05:45:07 UTC 2023","Wed Oct 11 05:45:36 UTC 2023","28945","","Чат","Личный чат","PersonalChatTests","CheckFindSentMessageInPersonalChat","Список чатов - личный чат: можно найти отправленное сообщение",""
"passed","Wed Oct 11 05:33:34 UTC 2023","Wed Oct 11 05:33:46 UTC 2023","11503","","Чат","Групповой чат","GroupChatTests","CheckSendTextMessageInGroupChat","Список чатов - групповой чат: можно отправить текстовое сообщение",""
"passed","Wed Oct 11 05:39:19 UTC 2023","Wed Oct 11 05:39:28 UTC 2023","9420","","Материал","Конструктор теста","TestBlocksAndVariantsValidationTests","CheckRenameTestVariant","Конструктор теста: можно переименовать вариант",""
"passed","Wed Oct 11 05:33:34 UTC 2023","Wed Oct 11 05:33:40 UTC 2023","6422","","Активность","Шаблон активности контрольной","TestTemplateEditingTests","SuccessSaveWithCorrectValueNumberOfAttemptsInTestActivityTemplate","Редактирование шаблона контрольной: успешное сохранение при корректных значениях в 'Количество попыток сдачи'",""
"passed","Wed Oct 11 05:36:40 UTC 2023","Wed Oct 11 05:36:49 UTC 2023","8806","","Дисциплина","Создание дисциплины","DisciplineCreationValidationTests","CheckIfNameNotFilledInCreation","Создание дисциплины ДО: отображение ошибки валидации для поля 'Название', если поле не заполнено",""
"passed","Wed Oct 11 05:41:46 UTC 2023","Wed Oct 11 05:41:54 UTC 2023","7875","","Профиль","","AddressAndContactsEditingTests","CheckCityField","Редактирование профиля пользователя: можно изменить город",""
"passed","Wed Oct 11 05:33:07 UTC 2023","Wed Oct 11 05:33:19 UTC 2023","12167","","Активность","Шаблон активности контрольной","TestTemplateCreatingTests","CreateTestActivityTemplate","Создание шаблона контрольной: если заполнены обязательные поля",""
"passed","Wed Oct 11 05:36:29 UTC 2023","Wed Oct 11 05:36:36 UTC 2023","7136","","Поток","Страница потока","CohortInfoTests","CheckNoAccessStudentToMaterialsCohortArchive","Страница потока: студенты не имеют доступ к материалам архивного потока по прямой ссылки",""
"passed","Wed Oct 11 05:39:28 UTC 2023","Wed Oct 11 05:39:39 UTC 2023","11231","","Материал","Конструктор теста","TestSettingsValidationTests","EditTestDescription","Конструктор теста: можно изменить описание теста",""
"passed","Wed Oct 11 05:31:20 UTC 2023","Wed Oct 11 05:31:30 UTC 2023","9580","","Активность","Задание","TaskWithSolutionStudentTests","CheckAbilityToEditAssessmentOfAnotherStudentsSolution","Страница решение задания: можно редактировать поставленную оценку к решении другого студента, если включена 'Взаимопроверка'",""
"passed","Wed Oct 11 05:36:55 UTC 2023","Wed Oct 11 05:37:03 UTC 2023","8779","","Дисциплина","Настройка чата дисциплины","DisciplineChatBlockTests","CheckBlockAndUnblockChatDiscipline","Редактирование дисциплины: снятия блокировки чата дисциплины",""
"passed","Wed Oct 11 05:35:10 UTC 2023","Wed Oct 11 05:35:24 UTC 2023","13338","","Чат","Мини-чат страницы решений","TaskPageMiniChatTests","CheckAddQuoteToLastMessageInTaskPageMiniChat","Чат на странице решения: можно цитировать сообщению",""
"passed","Wed Oct 11 05:31:08 UTC 2023","Wed Oct 11 05:31:20 UTC 2023","12375","","Активность","Обычная активность","ActivityDurationTests","CheckIfEndDateEmptyInAcivity","Редактирование активности: успешное сохранение, если заполнена только дата начала",""
"passed","Wed Oct 11 05:35:31 UTC 2023","Wed Oct 11 05:35:40 UTC 2023","8925","","Чат","Чат решения","TaskChatTests","CheckAddReactionToLastMessageInTaskChat","Список чатов - обсуждение решения: можно добавить реакцию на сообщение",""
"failed","Wed Oct 11 05:45:38 UTC 2023","Wed Oct 11 05:45:43 UTC 2023","4624","","Дисциплина","Редактирование дисциплины","DisContingentEditingTests","CheckCreateDisciplineByUncheckingBoxAllCohortStudents","Редактирование дисциплины: есть возможность сохранить дисциплину сняв галку ‘Все студенты потока’",""
"passed","Wed Oct 11 05:35:12 UTC 2023","Wed Oct 11 05:35:22 UTC 2023","9124","","Чат","Дисциплина","DisciplineChatTests","CheckFindDisciplineChatByNameInSearch","Список чатов - комната дисциплины: можно найти чат в поиске по названию",""
"passed","Wed Oct 11 05:40:39 UTC 2023","Wed Oct 11 05:40:57 UTC 2023","17668","","Библиотека","","LibraryInListViewTests","CheckRemoveCatalogViaActionsButton","Библиотека, списочный вид: можно удалить каталог через actions-кнопки",""
"passed","Wed Oct 11 05:31:15 UTC 2023","Wed Oct 11 05:31:27 UTC 2023","12362","","Активность","Задание","TaskActivityCreatingTests","CheckCreateTaskWithMutualVerification","Создание задания: можно создать задание с взаимопроверкой",""
"passed","Wed Oct 11 05:40:23 UTC 2023","Wed Oct 11 05:40:30 UTC 2023","7181","","Материал","Конструктор теста","TestBlocksAndVariantsValidationTests","CheckRenameTestBlock","Конструктор теста: можно переименовать блок",""
"passed","Wed Oct 11 05:35:40 UTC 2023","Wed Oct 11 05:35:49 UTC 2023","9380","","Чат","Чат решения","TaskChatTests","CheckDeleteMessageInTaskChat","Список чатов - обсуждение решения: можно удалить сообщение",""
"passed","Wed Oct 11 05:41:17 UTC 2023","Wed Oct 11 05:41:24 UTC 2023","7130","","Материал","Конструктор тест-тренажера","TestTrainQuestionAnswersValidationTests","CheckRemoveAnswerFromFreeAnswerExactMatchQuestionInTestTrain","Конструктор теста-тренажера: можно удалить вариант ответа из вопроса с типом ответа 'Свободный ответ' – 'Точное совпадение'",""
"passed","Wed Oct 11 05:32:00 UTC 2023","Wed Oct 11 05:32:06 UTC 2023","5238","","Активность","Обычная активность","ActivityDurationTests","CheckEditVolumeActivityWithIncorrectValues","Редактирование активности: отображение ошибки валидации для поля 'Объём' с значением '0'",""
"passed","Wed Oct 11 05:30:46 UTC 2023","Wed Oct 11 05:31:02 UTC 2023","15624","","Активность","Обычная активность","ActivityEditingFormatTests","CheckActivityFormatIsOffline","Редактирование активности: проверка формата активности офлайн",""
"passed","Wed Oct 11 05:37:22 UTC 2023","Wed Oct 11 05:37:31 UTC 2023","9316","","Дисциплина","Создание дисциплины","DisciplineCreationValidationTests","CheckIfCreditValuesNotAllowed","Создание дисциплины ДО: отображение ошибки валидации для поля 'Кредиты' с значением > 15",""
"passed","Wed Oct 11 05:36:55 UTC 2023","Wed Oct 11 05:37:02 UTC 2023","7468","","Дисциплина","Страница дисциплины","DisciplineAnalyticsTests","CheckOpenNotificationMailingListFromAnalytics","Страница аналитика дисциплины: можно перейти в рассылку уведомлений",""
"passed","Wed Oct 11 05:31:48 UTC 2023","Wed Oct 11 05:32:03 UTC 2023","15416","","Активность","Обычная активность","ActivityAddingTests","CheckAddTestNotInControlTypeActivity","Редактирование активности: наличия ошибки при добавлении теста из библиотеки не в контрольную",""
"failed","Wed Oct 11 05:44:38 UTC 2023","Wed Oct 11 05:45:12 UTC 2023","33717","","Активность","Обычная активность","ActivityEditingTests","CheckDeleteActivityWithoutGrades","Редактирование активности: можно удалить активность без оценок",""
"passed","Wed Oct 11 05:40:30 UTC 2023","Wed Oct 11 05:40:43 UTC 2023","13288","","Материал","Конструктор теста","TestBlocksAndVariantsValidationTests","CheckAddTestBlock","Конструктор теста: можно добавить блок",""
"passed","Wed Oct 11 05:40:10 UTC 2023","Wed Oct 11 05:40:18 UTC 2023","7366","","Материал","Конструктор тест-тренажера","TestTrainBlocksAndVariantsValidationTests","EditTestTrainBlockName","Конструктор теста-тренажера: можно переименовать блок",""
"passed","Wed Oct 11 05:37:55 UTC 2023","Wed Oct 11 05:38:14 UTC 2023","19301","","Дисциплина","Редактирование дисциплины","DisContingentEditingValidationTests","CheckAddStudentFromGroupInTeachersField","Редактирование дисциплины: наличия ошибки при попытке указать преподавателем студента из группы",""
"passed","Wed Oct 11 05:31:36 UTC 2023","Wed Oct 11 05:31:46 UTC 2023","9983","","Активность","Задание","TaskActivityTeacherTests","CheckGradeSolutionIncorrectValues","Страница решение задания: отображение ошибки валидации для поля баллы с значением 'отлично'",""
"passed","Wed Oct 11 05:31:39 UTC 2023","Wed Oct 11 05:31:53 UTC 2023","14070","","Активность","Обычный шаблон активности","TemplateAddingTests","CheckAddFileMaterialActivityTemplate","Редактирование шаблона активности: можно загрузить материал типа файл с компьютера",""
"passed","Wed Oct 11 05:41:42 UTC 2023","Wed Oct 11 05:41:46 UTC 2023","4447","","Расписание","","ScheduleSettingsTests","ErrorSyncGoogleCalendar","Страница расписания: проверка некорректного подключения к синхронизации с google календарем",""
"passed","Wed Oct 11 05:31:04 UTC 2023","Wed Oct 11 05:31:14 UTC 2023","10046","","Активность","Задание","TaskActivityMulticriteriaTests","CheckCreateTaskWithoutPointOfCriteria","Создание задания: нельзя создать задание с критериями, если не заполнены баллы критериев",""
"passed","Wed Oct 11 05:41:18 UTC 2023","Wed Oct 11 05:41:30 UTC 2023","11992","","Материал","Конструктор тест-тренажера","TestTrainQuestionsValidationTests","CheckAndUncheckAnswerOptionInTestTrain","Конструктор теста-тренажера: возможность снять отметку “верный” у варианта ответа",""
"passed","Wed Oct 11 05:41:53 UTC 2023","Wed Oct 11 05:41:56 UTC 2023","3059","","Профиль","","GeneralUserInfoEditingTests","CheckSwitchToOwnTransliteration","Редактирование профиля пользователя: можно переключить свитч транслитерации",""
"passed","Wed Oct 11 05:36:15 UTC 2023","Wed Oct 11 05:36:23 UTC 2023","7116","","Чат","Дисциплина","DisciplineChatTests","CheckSwitchToAnotherDisciplineChatRoom","Список чатов - комната дисциплины: можно переключать комнаты",""
"passed","Wed Oct 11 05:38:10 UTC 2023","Wed Oct 11 05:38:21 UTC 2023","11839","","Дисциплина","Шаблон дисциплины","DisTemplateTests","CheckCreateDisTemplateWithFillingAllFields","Создание шаблона дисциплины: можно создать шаблон, если заполнены все поля",""
"failed","Wed Oct 11 05:45:22 UTC 2023","Wed Oct 11 05:45:59 UTC 2023","37889","","Чат","Мини-чат решения","TaskMiniChatTests","CheckSendTextMessageInTaskMiniChat","Миничат - обсуждение решения: можно отправить текстовое сообщение","
SetUp SetUp method failed
"
"passed","Wed Oct 11 05:38:33 UTC 2023","Wed Oct 11 05:38:40 UTC 2023","6985","","Библиотека","","LibraryMaterialTests","CheckMyLibraryBreadCrumb","Страница материала: работает хлебная крошка 'Моя библиотека'",""
"passed","Wed Oct 11 05:36:11 UTC 2023","Wed Oct 11 05:36:27 UTC 2023","16179","","Чат","Групповой чат","GroupChatTests","CheckPinLastMessageInGroupChat","Список чатов - групповой чат: можно закреплять сообщения",""
"passed","Wed Oct 11 05:31:53 UTC 2023","Wed Oct 11 05:32:08 UTC 2023","14965","","Активность","Обычный шаблон активности","TemplateAddingTests","CheckAddMaterialFromLibraryActivityTemplate","Редактирование шаблона активности: можно добавить материал типа текст из библиотеки",""
"passed","Wed Oct 11 05:33:18 UTC 2023","Wed Oct 11 05:33:32 UTC 2023","13598","","Звонок","","CallTests","CheckTurnOnOffEquipmentInCall","Страница звонка: можно включить/отключить камеру в звонке",""
"passed","Wed Oct 11 05:32:21 UTC 2023","Wed Oct 11 05:32:37 UTC 2023","15064","Активность","Контрольная","Редактирование контрольной","TestActivityAddingTests","AddTestSimulatorToTestActivity","Редактирование контрольной: можно добавить материал типа тест-тренажёр из библиотеки",""
"passed","Wed Oct 11 05:39:36 UTC 2023","Wed Oct 11 05:39:48 UTC 2023","12351","","Материал","Конструктор теста","TestQuestionAnswersValidationTests","CheckAddOneMoreAnswerVariantInQuestionWithFreeAnswerExactMatch","Конструктор теста: можно добавить еще один вариант ответа в вопрос с типом ответа 'Свободный ответ - точное совпадение'",""
"passed","Wed Oct 11 05:30:43 UTC 2023","Wed Oct 11 05:30:51 UTC 2023","7511","","Активность","Задание","TaskWithSolutionStudentTests","CheckSendFileSolution","Страница решение задания: можно отправить файловый ответ",""
"passed","Wed Oct 11 05:31:04 UTC 2023","Wed Oct 11 05:31:15 UTC 2023","10816","","Активность","Задание","TaskActivityCreatingTests","CheckCreateTaskWithOpenSolutions","Создание задания: можно создать задание с открытыми решениями",""
"passed","Wed Oct 11 05:37:15 UTC 2023","Wed Oct 11 05:37:18 UTC 2023","2617","","Дисциплина","Редактирование дисциплины","DisciplineEditingValidationTests","CheckImpossibilityTurnOnOrOffIOT","Редактирование дисциплины: невозможно отключить ИОТ, если в дисциплине есть активности",""
"passed","Wed Oct 11 05:36:46 UTC 2023","Wed Oct 11 05:36:49 UTC 2023","2550","","Поток","Редактирование потока","CohortEditingValidationTests","CheckIsNotPossibleRemoveCohortWithSemestersOrDisciplines","Редактирование потока: нет возможности удалить поток, если есть хотя бы одна дисциплина или семестр",""
"passed","Wed Oct 11 05:30:53 UTC 2023","Wed Oct 11 05:31:27 UTC 2023","34027","","Активность","Обычная активность","ActivityContentVisibilityTests","CheckHideMaterial","Редактирование активности: можно скрыть материал",""
"passed","Wed Oct 11 05:38:00 UTC 2023","Wed Oct 11 05:38:09 UTC 2023","8535","","Дисциплина","Создание дисциплины","DisContingentCreationValidationTests","CheckOnlyCohortStudentsAreShownInListOfStudents","Создание дисциплины: в выпадающем списке поля Студенты отображаются только студенты потока",""
"passed","Wed Oct 11 05:35:45 UTC 2023","Wed Oct 11 05:35:50 UTC 2023","5214","","Поток","Редактирование потока","CohortEditingTests","CheckEditCohortByCheckingCheckboxRegistrationLink","Редактирование потока ДО: успешное сохранение, при отметке/снятии галки ‘Разрешена регистрация по ссылке’",""
"passed","Wed Oct 11 05:40:00 UTC 2023","Wed Oct 11 05:40:11 UTC 2023","10612","","Материал","Конструктор теста","TestQuestionAnswersValidationTests","CheckAddOneMoreOptionInSortingTestQuestion","Конструктор теста: можно добавить еще одну опцию в вопрос с типом ответа 'Сортировка'",""
"passed","Wed Oct 11 05:37:11 UTC 2023","Wed Oct 11 05:37:26 UTC 2023","14439","","Дисциплина","Страница дисциплины","DisciplineMarksAndAttendanceTests","CheckGradingByTeacher","Страница оценок дисциплины: выставления оценки преподавателем",""
"passed","Wed Oct 11 05:35:31 UTC 2023","Wed Oct 11 05:35:43 UTC 2023","12141","","Поток","Создание потока","CohortCreationWarningModalTests","CheckCreateCohortAfterChangeMismatchWarningOfDuration","Создание потока: можно создать поток после внесения правок в длительность потока",""
"failed","Wed Oct 11 05:44:38 UTC 2023","Wed Oct 11 05:45:18 UTC 2023","39361","Активность","Контрольная","Редактирование контрольной","TestActivityAddingTests","CheckAddTextMaterialToTestActivity","Редактирование контрольной: можно добавить материал типа текст из библиотеки",""
"passed","Wed Oct 11 05:41:50 UTC 2023","Wed Oct 11 05:41:58 UTC 2023","7968","","Расписание","","ScheduleSettingsTests","BlackoutNameSchedule","Страница расписания: проверка затемнения прошедших активностей",""
"passed","Wed Oct 11 05:40:47 UTC 2023","Wed Oct 11 05:40:57 UTC 2023","10061","","Материал","Конструктор тест-тренажера","TestTrainQuestionsValidationTests","EditCommentInTestTrainQuestion","Конструктор теста-тренажера: можно изменить комментарий к вопросу",""
"passed","Wed Oct 11 05:41:20 UTC 2023","Wed Oct 11 05:41:21 UTC 2023","1560","","Организация","Страница организации","OrganizationPageTests","CheckTransitionToEditPage","Страница организации: работает кнопка Редактировать",""
"passed","Wed Oct 11 05:31:57 UTC 2023","Wed Oct 11 05:32:00 UTC 2023","3029","Активность","Контрольная","Редактирование контрольной","TestActivityEditingTests","ExecutionModeFieldIsNotClickableInTestActivity","Редактирование контрольной: поле 'Режим выполнения' некликабельно",""
"failed","Wed Oct 11 05:44:39 UTC 2023","Wed Oct 11 05:44:52 UTC 2023","12905","Активность","Контрольная","Прохождение теста","TestActivityStatusWithOneAttemptTests","CheckStatusScoreColorAndIcon","Страница индивидуальной контрольной: статус и цвет у количества баллов в попытке различаются в зависимости от успешности",""
"passed","Wed Oct 11 05:34:29 UTC 2023","Wed Oct 11 05:34:46 UTC 2023","16105","","Чат","Чат решения","TaskChatTests","CheckEditLastMessageInTaskChat","Список чатов - обсуждение решения: можно редактировать сообщение в течение 4 часов после отправки",""
"passed","Wed Oct 11 05:35:59 UTC 2023","Wed Oct 11 05:36:06 UTC 2023","7176","","Чат","Личный чат","PersonalChatTests","CheckSendMessageByTappingEnterInPersonalChat","Список чатов - личный чат: можно отправить сообщения по нажатию на Enter",""
"passed","Wed Oct 11 05:42:28 UTC 2023","Wed Oct 11 05:42:32 UTC 2023","4207","","Профиль","","UserInfoPageTests","CheckBlockOfPassedActivitiesAreDisplayedForTeacher","Страница профиля пользователя: под преподавателем отображаются пройденные активности студента",""
"passed","Wed Oct 11 05:31:05 UTC 2023","Wed Oct 11 05:31:12 UTC 2023","6464","","Активность","Задание","TaskWithSolutionStudentTests","CheckSendSolutionForAnotherStudent","Страница решение задания: нет возможности отправить решения за другого студента",""
"passed","Wed Oct 11 05:33:48 UTC 2023","Wed Oct 11 05:33:57 UTC 2023","8519","","Активность","Шаблон активности контрольной","TestTemplateEditingTests","SuccessSaveWithPositiveValueTimeLimitInTestActivityTemplate","Редактирование шаблона контрольной: успешное сохранение при положительных значениях в 'Временной лимит'",""
"passed","Wed Oct 11 05:36:48 UTC 2023","Wed Oct 11 05:36:53 UTC 2023","4243","","Дисциплина","Редактирование дисциплины","DisciplineAccessTests","CheckOtherOrgAdminChangeDiscipline","Редактирование дисциплины: нет возможности редактировать у администратора организации, к которому дисциплина НЕ относится",""
"passed","Wed Oct 11 05:32:03 UTC 2023","Wed Oct 11 05:32:05 UTC 2023","2330","","Активность","Обычная активность","ActivityAddingTests","CheckAbsenceScormScoreField","Редактирование активности: отсутствия поля оценка по SCORM результату, если не добавлен SCORM пакет",""
"passed","Wed Oct 11 05:36:12 UTC 2023","Wed Oct 11 05:36:17 UTC 2023","5769","","Поток","Редактирование потока","CohortEditingValidationTests","CheckEditCohortIfStartAndEndDateAreSame","Редактирование потока: ошибка валидации, если даты начала и окончания совпадают",""
"passed","Wed Oct 11 05:35:31 UTC 2023","Wed Oct 11 05:35:45 UTC 2023","14193","","Поток","Редактирование потока","CohortEditingTests","CheckEditCohortWhenAllRequiredFieldsAreFilled","Редактирование потока: успешное сохранение, если все обязательные поля корректно заполнены",""
"passed","Wed Oct 11 05:36:33 UTC 2023","Wed Oct 11 05:36:38 UTC 2023","4692","","Дисциплина","Страница дисциплины","DisciplineActivitiesBlockTests","CheckCancelAddModule","Страница дисциплины: отмена создания модуля",""
"passed","Wed Oct 11 05:37:21 UTC 2023","Wed Oct 11 05:37:37 UTC 2023","16562","","Дисциплина","Создание дисциплины","DisContingentCreationTests","CheckAddTeacherByUserInfoInCreation","Создание дисциплины: добавление преподавателя по email’у",""
"passed","Wed Oct 11 05:36:43 UTC 2023","Wed Oct 11 05:36:55 UTC 2023","11070","","Дисциплина","Настройка чата дисциплины","DisciplineChatBlockTests","CheckBlockAndUnblockChatDiscipline","Редактирование дисциплины: блокировка чата дисциплины",""
