"Status","Start Time","Stop Time","Duration in ms","Parent Suite","Suite","Sub Suite","Test Class","Test Method","Name","Description"
"passed","Thu Mar 13 07:35:41 UTC 2025","Thu Mar 13 07:35:55 UTC 2025","14215","","Расписание","","ScheduleSettingsTests","CheckCancelConnectSyncWithGoogleCalendar","Проверка кнопки Отмена синхронизации с Google календарем",""
"passed","Thu Mar 13 07:13:25 UTC 2025","Thu Mar 13 07:13:38 UTC 2025","12495","","Чат","Групповой чат","GroupChatMessageTests","CheckOpenImageInGroupChat","Можно раскрывать изображения в групповом чате",""
"passed","Thu Mar 13 07:21:26 UTC 2025","Thu Mar 13 07:21:49 UTC 2025","23095","","Дисциплина","Создание дисциплины","DisciplineCreationValidationTests","CheckIfCreditValuesNotAllowed","Отображение ошибки валидации для поля 'Кредиты' со значением > 15 в ДО",""
"passed","Thu Mar 13 07:34:54 UTC 2025","Thu Mar 13 07:35:12 UTC 2025","17507","","Организация","Редактирование организации","OrganizationEditingTests","CheckRemoveCustomResolution","Можно удалить пользовательскую резолюцию",""
"passed","Thu Mar 13 07:25:31 UTC 2025","Thu Mar 13 07:25:51 UTC 2025","19903","","Экзамен","","ExamCreateEditTests","CheckEditExamName","Проверка на редактирование названия экзамена",""
"passed","Thu Mar 13 07:07:38 UTC 2025","Thu Mar 13 07:08:10 UTC 2025","31987","Активность","Шаблон активности контрольной","Создание шаблона контрольной","TestTemplateCreatingTests","CreateTestActivityTemplate","Можно создать шаблон контрольной, если заполнены обязательные поля",""
"passed","Thu Mar 13 07:00:52 UTC 2025","Thu Mar 13 07:01:16 UTC 2025","23599","Активность","Задание","Страница решения задания для преподавателя","TaskActivityTeacherTests","CheckSetIndividualDate","Можно установить индивидуальный срок сдачи",""
"passed","Thu Mar 13 07:42:10 UTC 2025","Thu Mar 13 07:42:37 UTC 2025","26445","Активность","Контрольная","Страница контрольной","TestCommandActivityTests","CheckAddTeamToCommandControlActivity","Можно добавить команду в командной контрольной",""
"passed","Thu Mar 13 07:25:29 UTC 2025","Thu Mar 13 07:25:45 UTC 2025","15910","","Библиотека","","BulkActionsLibraryTests","CheckAppearanceOfMoveDeleteAndCancelButtons","Библиотека: появление кнопок переместить, удалить, и отмена при активации режима выбора",""
"passed","Thu Mar 13 07:43:48 UTC 2025","Thu Mar 13 07:44:16 UTC 2025","28315","","Дисциплина","Страница дисциплины","DisciplineActivitiesBlockTests","CheckAddModuleInDiscipline","Cоздание модуля у дисциплины",""
"passed","Thu Mar 13 07:22:48 UTC 2025","Thu Mar 13 07:23:29 UTC 2025","41206","","Дисциплина","Редактирование дисциплины","DisciplineEditingTests","CheckDeleteDisciplineWithoutGrades","Можно удалить дисциплину без оценок",""
"passed","Thu Mar 13 07:24:00 UTC 2025","Thu Mar 13 07:24:57 UTC 2025","57208","","Дисциплина","Страница дисциплины","DisciplineAnalyticsTests","CheckFilterByGroupName","Проверка фильтра аналитики по названию группы",""
"passed","Thu Mar 13 07:01:38 UTC 2025","Thu Mar 13 07:02:17 UTC 2025","39007","Активность","Обычная активность","Редактирование активности","ActivityDurationTests","CheckIfEndDateEmptyInAcivity","Успешное сохранение, если заполнена только дата начала",""
"passed","Thu Mar 13 07:09:08 UTC 2025","Thu Mar 13 07:09:40 UTC 2025","31394","Активность","Контрольная","Редактирование контрольной","TestActivityEditingTests","CheckErrorInMinThresholdFieldWithIncorrectValue","Ошибка валидации в поле Минимальный порог баллов, если введено отрицательное значение",""
"passed","Thu Mar 13 07:06:01 UTC 2025","Thu Mar 13 07:06:35 UTC 2025","33613","Активность","Контрольная","Прохождение теста","TestActivityStatusWithOneAttemptTests","CheckNoStatusWithOneIncompleteAttempt","Отсутствует статус и иконка для одной незавершенной попытки в индивидуальной контрольной",""
"passed","Thu Mar 13 07:11:05 UTC 2025","Thu Mar 13 07:11:25 UTC 2025","19803","Активность","Контрольная","Редактирование контрольной","TestActivityEditingTests","CheckErrorIsAppearIfRemoveTestActivityWithScore","Невозможно удалить контрольную при наличии оценок",""
"passed","Thu Mar 13 07:15:59 UTC 2025","Thu Mar 13 07:16:12 UTC 2025","13107","","Чат","Личный чат","PersonalChatTests","CheckOpenImageInPersonalChat","Можно раскрывать изображения в личном чате",""
"passed","Thu Mar 13 07:19:30 UTC 2025","Thu Mar 13 07:20:01 UTC 2025","30803","","Дисциплина","Редактирование дисциплины","DisciplineEditingTests","CheckSetNameField","Можно изменить название",""
"passed","Thu Mar 13 07:23:16 UTC 2025","Thu Mar 13 07:23:48 UTC 2025","32094","","Дисциплина","Шаблон дисциплины","DisTemplateTests","CheckCreateDisTemplateWithFillingAllFields","Можно создать шаблон дисциплины, если заполнены все поля",""
"passed","Thu Mar 13 07:27:14 UTC 2025","Thu Mar 13 07:27:35 UTC 2025","20892","","Материал","Конструктор теста","TestBlocksAndVariantsValidationTests","CheckRenameTestVariant","Конструктор теста: можно переименовать вариант",""
"passed","Thu Mar 13 07:16:48 UTC 2025","Thu Mar 13 07:17:11 UTC 2025","22799","","Поток","Редактирование потока","CohortEditingTests","CheckCreateCohortWithMismatchWarningOfDuration","Редактирование потока: появление модалки, если продолжительность потока меньше часов программы",""
"passed","Thu Mar 13 07:33:51 UTC 2025","Thu Mar 13 07:34:04 UTC 2025","13195","","Организация","Редактирование организации","OrganizationEditingTests","CheckUnableToRemoveDefaultResolution","Нельзя удалить резолюцию по умолчанию",""
"passed","Thu Mar 13 07:06:53 UTC 2025","Thu Mar 13 07:07:59 UTC 2025","66778","Активность","Контрольная","Страница контрольной","TestCommandActivityTests","CheckEditTeamInCommandControlActivity","Можно редактировать команду в командной контрольной",""
"passed","Thu Mar 13 07:11:32 UTC 2025","Thu Mar 13 07:11:57 UTC 2025","25089","","Чат","Чат дисциплины","DisciplineChatTests","CheckSendEmptyMessageInDisciplineChat","Невозможно отправить пустое сообщение в чате дисциплины",""
"passed","Thu Mar 13 07:24:04 UTC 2025","Thu Mar 13 07:24:28 UTC 2025","24190","","Дисциплина","Шаблон дисциплины","DisTemplateTests","CheckAddModuleInDisTemplate","Можно добавить модуль в шаблон дисциплины",""
"passed","Thu Mar 13 07:16:14 UTC 2025","Thu Mar 13 07:16:26 UTC 2025","11492","","Чат","Чат дисциплины","DisciplineChatTests","CheckOpenImageInDisciplineChat","Можно раскрывать изображения в чате дисциплины",""
"passed","Thu Mar 13 07:19:07 UTC 2025","Thu Mar 13 07:19:41 UTC 2025","34090","","Поток","Страница потока","CohortInfoTests","CheckNoAccessStudentToMaterialsCohortArchive","Страница потока: студенты не имеют доступ к материалам архивного потока по прямой ссылки",""
"passed","Thu Mar 13 07:04:33 UTC 2025","Thu Mar 13 07:04:51 UTC 2025","17899","","Активность","Обычный шаблон активности","TemplateEditingTests","CheckEditActivityTemplateDescription","Можно изменить описание шаблона активности",""
"passed","Thu Mar 13 07:07:58 UTC 2025","Thu Mar 13 07:08:28 UTC 2025","29711","Активность","Шаблон активности контрольной","Редактирование шаблона контрольной","TestTemplateAddingTests","CheckAddTextMaterialToControlActivityPlan","Можно добавить материал типа Текст из Библиотеки в шаблон контрольной",""
"passed","Thu Mar 13 07:02:46 UTC 2025","Thu Mar 13 07:03:35 UTC 2025","48803","Активность","Обычная активность","Создание активности","ActivityCreatingTests","CheckCreateActivityFromTemplate","Можно создать активность из шаблона",""
"passed","Thu Mar 13 07:07:59 UTC 2025","Thu Mar 13 07:08:27 UTC 2025","28503","Активность","Контрольная","Прохождение теста","TestActivityPassingTests","CheckCancelSendingForReview","Можно отменить отправку на проверку (Изменить ответы)",""
"passed","Thu Mar 13 07:21:19 UTC 2025","Thu Mar 13 07:21:36 UTC 2025","16895","","Дисциплина","Редактирование дисциплины","DisciplineEditingTests","CheckSetDescriptionField","Можно изменить описание",""
"passed","Thu Mar 13 07:05:36 UTC 2025","Thu Mar 13 07:06:21 UTC 2025","45604","Активность","Контрольная","Прохождение теста","TestActivityPassingTests","CheckPassingTestInControlActivity","Можно пройти тест индивидуальной контрольной",""
"passed","Thu Mar 13 07:19:04 UTC 2025","Thu Mar 13 07:19:23 UTC 2025","19591","","Дисциплина","Настройка чата дисциплины","DisciplineChatBlockTests","CheckNotAccessOpenChatActivity","Страница активности: нет доступа к кнопке Открыть чат дисциплины, если чат отключен",""
"passed","Thu Mar 13 07:34:07 UTC 2025","Thu Mar 13 07:34:37 UTC 2025","29798","","Материал","Конструктор тест-тренажера","TestTrainQuestionAnswersValidationTests","CheckRemoveAnswerFromFreeAnswerExactMatchQuestionInTestTrain","Конструктор теста-тренажера: можно удалить вариант ответа из вопроса с типом ответа 'Свободный ответ' – 'Точное совпадение'",""
"passed","Thu Mar 13 07:31:04 UTC 2025","Thu Mar 13 07:31:44 UTC 2025","40488","","Материал","Конструктор тест-тренажера","TestTrainBlocksAndVariantsValidationTests","DeleteBlockTestTrain","Конструктор теста-тренажера: можно удалить блок",""
"passed","Thu Mar 13 07:27:57 UTC 2025","Thu Mar 13 07:28:24 UTC 2025","27217","","Материал","Конструктор теста","TestQuestionsValidationTests","CheckAddCommentInTestQuestion","Конструктор теста: можно добавить комментария к вопросу",""
"passed","Thu Mar 13 07:20:09 UTC 2025","Thu Mar 13 07:20:33 UTC 2025","23382","","Дисциплина","Редактирование дисциплины","DisciplineAccessTests","CheckIfAdminPodrChangeDiscipline","У администратора подразделения, к которому дисциплина относится, есть возможность редактирования",""
"passed","Thu Mar 13 07:17:38 UTC 2025","Thu Mar 13 07:18:10 UTC 2025","31697","","Чат","Личный чат","PersonalChatTests","CheckDeleteMessageInPersonalChat","Можно удалить сообщение из личного чата",""
"passed","Thu Mar 13 07:01:19 UTC 2025","Thu Mar 13 07:01:44 UTC 2025","24205","Активность","Обычная активность","Редактирование активности","ActivityEditingTests","CheckEditActivityName","Можно изменить название",""
"passed","Thu Mar 13 07:20:42 UTC 2025","Thu Mar 13 07:21:01 UTC 2025","19007","","Дисциплина","Редактирование дисциплины","DisciplineEditingValidationTests","CheckIfDescriptionNotFilledInEditing","Отображение ошибки валидации для поля Описание, если поле не заполнено в дисциплине ДО",""
"passed","Thu Mar 13 07:34:49 UTC 2025","Thu Mar 13 07:35:00 UTC 2025","10699","","Организация","Страница организации","OrganizationPageTests","CheckTransitionToOrgEditPage","Работает кнопка Редактировать",""
"passed","Thu Mar 13 07:13:38 UTC 2025","Thu Mar 13 07:14:09 UTC 2025","31013","","Чат","Групповой чат","GroupChatMessageTests","CheckSendMessageByTappingEnterInGroupChat","Можно отправить сообщение по нажатию на Enter в групповом чате",""
"passed","Thu Mar 13 07:14:46 UTC 2025","Thu Mar 13 07:15:12 UTC 2025","25493","","Чат","Миничат страницы решений","TaskPageMiniChatTests","CheckAddQuoteToLastMessageInTaskPageMiniChat","Можно цитировать сообщение в миничате страницы решений",""
"passed","Thu Mar 13 07:19:41 UTC 2025","Thu Mar 13 07:20:02 UTC 2025","20293","","Дисциплина","Страница дисциплины","DisciplineActivitiesBlockTests","CheckCancelAddTopic","Отмена создания темы у дисциплины",""
"passed","Thu Mar 13 07:10:50 UTC 2025","Thu Mar 13 07:11:36 UTC 2025","46099","","Чат","Групповой чат","GroupChatTests","CheckCallInGroupChat","Можно сделать звонок в групповом чате",""
"passed","Thu Mar 13 07:14:20 UTC 2025","Thu Mar 13 07:14:47 UTC 2025","27217","","Поток","Создание потока","CohortCreationValidationTests","CheckCreateCohortIfNameNotFilled","Создание потока: ошибка валидации, если название не указано",""
"passed","Thu Mar 13 07:28:33 UTC 2025","Thu Mar 13 07:29:02 UTC 2025","29098","","Библиотека","","LibraryActionPanelTests","CheckChangeViewOfLibraryInTileView","Библиотека: можно переключать текущий вид Библиотеки с “Плитка” на “Список”",""
"passed","Thu Mar 13 07:25:51 UTC 2025","Thu Mar 13 07:26:19 UTC 2025","28297","","Экзамен","","ExamCreateEditTests","EditExamAddExaminer","Редактирование экзамена добавление экзаменатора",""
"passed","Thu Mar 13 07:17:08 UTC 2025","Thu Mar 13 07:17:38 UTC 2025","30496","","Чат","Личный чат","PersonalChatTests","CheckPinLastMessageInPersonalChat","Можно закреплять сообщение в личном чате",""
"passed","Thu Mar 13 07:05:32 UTC 2025","Thu Mar 13 07:05:46 UTC 2025","14576","","Активность","Обычный шаблон активности","TemplateEditingTests","CheckEditActivityTemplateVolume","Успешное сохранение при корректных значениях в поле Объем в академических часах",""
"passed","Thu Mar 13 07:29:02 UTC 2025","Thu Mar 13 07:29:43 UTC 2025","40197","","Библиотека","","LibraryActionPanelTests","CheckChangeViewOfLibraryInTileView","Библиотека: можно переключать текущий вид библиотеки со “Списка” на “Плитку”",""
"passed","Thu Mar 13 07:17:04 UTC 2025","Thu Mar 13 07:17:22 UTC 2025","18207","","Поток","Редактирование потока","CohortEditingValidationTests","CheckEditCohortIfStartDateGreaterThanEndDate","Редактирование потока: ошибка валидации, если дата начала больше чем дата окончания",""
"passed","Thu Mar 13 07:22:21 UTC 2025","Thu Mar 13 07:23:07 UTC 2025","46380","","Дисциплина","Страница дисциплины","DisciplineAnalyticsTests","CheckHideFiltersOfAnalyticsTable","Можно скрывать фильтры таблицы аналитики",""
"passed","Thu Mar 13 07:30:51 UTC 2025","Thu Mar 13 07:31:16 UTC 2025","24886","","Материал","Конструктор теста","TestSettingsValidationTests","AddTagInTest","Конструктор теста: можно добавлять теги знаний",""
"passed","Thu Mar 13 07:13:26 UTC 2025","Thu Mar 13 07:13:57 UTC 2025","30886","","Чат","Групповой чат","GroupChatMessageActionTests","CheckAddQuoteToLeftSideMessageInGroupChat","Можно цитировать сообщение другого участника в групповом чате",""
"passed","Thu Mar 13 07:19:30 UTC 2025","Thu Mar 13 07:20:54 UTC 2025","84897","","Дисциплина","Страница дисциплины","DisciplineAnalyticsTests","CheckExportDisciplineAnalytics","Работает экспорт аналитики дисциплины",""
"broken","Thu Mar 13 07:43:37 UTC 2025","Thu Mar 13 07:44:20 UTC 2025","42694","Активность","Контрольная","Результат прохождения теста","TestActivityResultTests","CheckTeacherCanLeaveCommentOnAnswer","Преподаватель может оставить комментарий к ответу, если была отмечена галка Отображать студентам подробную информацию о результатах",""
"passed","Thu Mar 13 07:16:30 UTC 2025","Thu Mar 13 07:16:55 UTC 2025","24497","","Поток","Создание потока","CohortCreationWarningModalTests","CheckCreateCohortIgnoringMismatchWarningOfDuration","Создание потока: можно создать поток без исправления длительности потока",""
"passed","Thu Mar 13 07:24:17 UTC 2025","Thu Mar 13 07:24:45 UTC 2025","27599","","Экзамен","","ExamCreateEditTests","CreateExamRVP","Создание экзамена РВП",""
"passed","Thu Mar 13 07:35:07 UTC 2025","Thu Mar 13 07:35:35 UTC 2025","27998","","Расписание","","ScheduleTests","CheckStubIsDisplayedIfNoEvents","Отображается заглушка в режиме Расписание, если нет событий",""
"passed","Thu Mar 13 07:42:43 UTC 2025","Thu Mar 13 07:43:07 UTC 2025","24280","Активность","Задание","Страница решения задания для преподавателя","TaskActivityTeacherTests","CheckGradeSolutionValueAboveAndBelowScore","Можно оценить решение значением выше минимального порога баллов",""
"passed","Thu Mar 13 07:16:28 UTC 2025","Thu Mar 13 07:16:56 UTC 2025","27385","","Чат","Обсуждение решения","TaskChatTests","CheckSendMessageByTappingEnterInTaskChat","Можно отправить сообщение по нажатию на Enter в обсуждении решения",""
"passed","Thu Mar 13 07:00:19 UTC 2025","Thu Mar 13 07:01:38 UTC 2025","79303","Активность","Обычная активность","Редактирование активности","ActivityDurationTests","CheckIfDatesFilledCorrectInAcivity","Успешное сохранение, если обе даты корректно заполнены",""
"broken","Thu Mar 13 07:45:55 UTC 2025","Thu Mar 13 07:46:35 UTC 2025","40113","Активность","Контрольная","Результат прохождения теста","TestActivityResultTests","CheckMarkIncorrectTextOrFileAnswer","Можно отметить Неверно в ответе на  вопрос с типом ответа Свободный ответ или Файл",""
"passed","Thu Mar 13 07:16:38 UTC 2025","Thu Mar 13 07:17:08 UTC 2025","30002","","Чат","Личный чат","PersonalChatTests","CheckAddReactionToLastMessageInPersonalChat","Можно добавить реакцию на сообщение в личном чате",""
"passed","Thu Mar 13 07:04:00 UTC 2025","Thu Mar 13 07:04:18 UTC 2025","17689","Активность","Задание","Страница решения задания для преподавателя","TaskActivityTeacherTests","CheckGradeSolutionIncorrectValues","Отображение ошибки валидации для поля Баллы, если вводить пробел",""
"passed","Thu Mar 13 07:18:30 UTC 2025","Thu Mar 13 07:18:47 UTC 2025","16090","","Чат","Чат дисциплины","DisciplineChatTests","CheckSwitchToAnotherDisciplineChatRoom","Можно переключаться между комнатами чатов дисциплины",""
"passed","Thu Mar 13 07:12:15 UTC 2025","Thu Mar 13 07:12:52 UTC 2025","37707","","Чат","Групповой чат","GroupChatMessageTests","CheckSendEmojiInGroupChat","Можно отправить смайлики в групповом чате",""
"passed","Thu Mar 13 07:35:36 UTC 2025","Thu Mar 13 07:35:58 UTC 2025","21639","","Материал","Конструктор тест-тренажера","TestTrainQuestionAnswersValidationTests","AddCommentInTestTrainAnswer","Конструктор теста-тренажера: можно изменить комментарий к варианту ответа",""
"passed","Thu Mar 13 07:24:57 UTC 2025","Thu Mar 13 07:26:03 UTC 2025","66599","","Дисциплина","Страница дисциплины","DisciplineAnalyticsTests","CheckResetButton","Проверка кнопки ‘Сбросить’ фильтр в аналитике",""
"passed","Thu Mar 13 07:07:47 UTC 2025","Thu Mar 13 07:08:26 UTC 2025","39622","Активность","Контрольная","Редактирование контрольной","TestActivityAddingTests","CheckAddScormPackageToControlTypeActivity","Можно добавить SCORM-пакет из Библиотеки в контрольную",""
"passed","Thu Mar 13 07:35:47 UTC 2025","Thu Mar 13 07:35:57 UTC 2025","9898","","Расписание","","ScheduleTests","CheckClickabilityOfTodayButton","Проверка кликабельности кнопки Сегодня, если выбрана не сегодняшняя дата",""
"passed","Thu Mar 13 07:28:24 UTC 2025","Thu Mar 13 07:28:49 UTC 2025","24684","","Материал","Конструктор теста","TestQuestionsValidationTests","CheckEditCommentInTestQuestion","Конструктор теста: можно изменить комментарий к вопросу",""
"passed","Thu Mar 13 07:03:30 UTC 2025","Thu Mar 13 07:05:35 UTC 2025","124796","Активность","Обычная активность","Редактирование активности","ActivityContentVisibilityTests","CheckVisibilityMaterialOutsideTimeActivity","Видимость материала вне времени проведения активности",""
"passed","Thu Mar 13 07:42:58 UTC 2025","Thu Mar 13 07:43:37 UTC 2025","38389","","Чат","Групповой чат","GroupChatTests","CheckAddGroupChatWithUsers","Можно добавить новый групповой чат для групп и студентов",""
"passed","Thu Mar 13 07:00:51 UTC 2025","Thu Mar 13 07:01:19 UTC 2025","28272","Активность","Обычная активность","Редактирование активности","ActivityEditingTests","CheckEditActivityType","Можно переключать значения в поле 'Тип активности'",""
"passed","Thu Mar 13 07:01:46 UTC 2025","Thu Mar 13 07:01:58 UTC 2025","12702","Активность","Задание","Страница решения задания для студента","TaskWithoutSolutionStudentTests","CheckSendEmptySolution","Появление ошибки при отправке пустого решения",""
"passed","Thu Mar 13 07:15:24 UTC 2025","Thu Mar 13 07:15:35 UTC 2025","10391","","Поток","Редактирование потока","CohortEditingTests","CheckCancelCohortEditingByDirectLink","Редактирование потока ДО: работает кнопка 'Отмена', если страница редактирование был открыть по прямой ссылке",""
"passed","Thu Mar 13 07:12:58 UTC 2025","Thu Mar 13 07:13:41 UTC 2025","42699","","Чат","Чат для заметок","NotesChatTests","CheckEditLastMessageInNotesChat","Можно редактировать сообщение в течение 4 часов после отправки в чате для заметок",""
