"Status","Start Time","Stop Time","Duration in ms","Parent Suite","Suite","Sub Suite","Test Class","Test Method","Name","Description"
"passed","Mon Oct 16 05:31:26 UTC 2023","Mon Oct 16 05:31:39 UTC 2023","13674","","Чат","Групповой чат","GroupChatTests","CheckRestoreGroupChatFromArchive","Список чатов - групповой чат: можно восстановить чат из архива",""
"passed","Mon Oct 16 05:29:33 UTC 2023","Mon Oct 16 05:29:43 UTC 2023","9309","","Чат","Дисциплина","DisciplineChatTests","CheckAddReactionToLastMessageInDisciplineChat","Список чатов - комната дисциплины: можно добавить реакцию на сообщение",""
"passed","Mon Oct 16 05:32:44 UTC 2023","Mon Oct 16 05:33:04 UTC 2023","19475","","Библиотека","","RemovingTemplatesTests","CheckDeleteProgramTemplate","Страница библиотеки: можно удалить шаблон программы",""
"passed","Mon Oct 16 05:32:04 UTC 2023","Mon Oct 16 05:32:08 UTC 2023","4354","","Чат","Групповой чат","GroupChatTests","CheckAddGroupChatRoomWithoutName","Список чатов - групповой чат: невозможно добавить чат, если не заполнен поля 'Название'",""
"passed","Mon Oct 16 05:34:39 UTC 2023","Mon Oct 16 05:34:43 UTC 2023","4026","","Организация","Мой тариф","MyPlanOrganizationPageTests","CheckClickOnLinkActivyUsers","Страница Мой тариф: проверка перехода в профиль пользователя из таблицы активных пользователей",""
"passed","Mon Oct 16 05:30:10 UTC 2023","Mon Oct 16 05:30:27 UTC 2023","17979","","Чат","Групповой чат","GroupChatTests","CheckPinLastMessageInGroupChat","Список чатов - групповой чат: можно закреплять сообщения",""
"passed","Mon Oct 16 05:31:50 UTC 2023","Mon Oct 16 05:31:57 UTC 2023","7489","","Дисциплина","Редактирование дисциплины","DisContingentEditingValidationTests","CheckUnableAddGroupFromAnotherCohortInEditing","Редактирование дисциплины: невозможно добавить группу из стороннего потока",""
"passed","Mon Oct 16 05:34:35 UTC 2023","Mon Oct 16 05:34:36 UTC 2023","1553","","Организация","Мой тариф","MyPlanOrganizationPageTests","CheckOpenTableActiveUsers","Страница Мой тариф: проверка открытия таблицы активных пользователей",""
"passed","Mon Oct 16 05:24:59 UTC 2023","Mon Oct 16 05:25:05 UTC 2023","6081","","Активность","Обычная активность","ActivityEditingTests","CheckEditActivity","Редактирование активности: работает кнопка 'Редактировать' для преподавателя",""
"passed","Mon Oct 16 05:35:57 UTC 2023","Mon Oct 16 05:35:58 UTC 2023","1848","","Профиль","","UserInfoPageTests","CheckIfUserActivityIsLoading","Страница профиля пользователя: загружается блок 'Работа в Odin' для пользователя",""
"passed","Mon Oct 16 05:32:41 UTC 2023","Mon Oct 16 05:32:48 UTC 2023","6915","","Дисциплина","Шаблон дисциплины","DisTemplateTests","CheckAddTopicInDisTemplate","Страница шаблона дисциплины: можно добавить тему",""
"passed","Mon Oct 16 05:33:40 UTC 2023","Mon Oct 16 05:33:52 UTC 2023","11954","","Библиотека","","LibraryInTileViewTests","CheckRemoveCatalog","Библиотека, плиточный вид: можно удалить каталог",""
"passed","Mon Oct 16 05:26:00 UTC 2023","Mon Oct 16 05:26:05 UTC 2023","5602","","Активность","Обычный шаблон активности","TemplateEditingValidationTests","CheckNegativeEditVolumeActivityTemplate","Редактирование шаблона активности: отображение ошибки валидации для поля 'Объём' с значением '0'",""
"passed","Mon Oct 16 05:30:16 UTC 2023","Mon Oct 16 05:30:24 UTC 2023","8217","","Поток","Страница потока","CohortInfoTests","CheckNoAccessStudentToMaterialsCohortArchive","Страница потока: студенты не имеют доступ к материалам архивного потока по прямой ссылки",""
"passed","Mon Oct 16 05:27:48 UTC 2023","Mon Oct 16 05:27:54 UTC 2023","5816","","Активность","Шаблон активности контрольной","TestTemplateEditingTests","SuccessSaveWithPositiveValueTimeLimitInTestActivityTemplate","Редактирование шаблона контрольной: успешное сохранение при положительных значениях в 'Временной лимит'",""
"passed","Mon Oct 16 05:38:27 UTC 2023","Mon Oct 16 05:38:33 UTC 2023","5518","","Активность","Обычный шаблон активности","TemplateEditingTests","CheckEditNameActivityTemplate","Редактирование шаблона активности: можно изменить название",""
"passed","Mon Oct 16 05:30:19 UTC 2023","Mon Oct 16 05:30:25 UTC 2023","5516","","Дисциплина","Редактирование дисциплины","DisciplineAccessTests","CheckIfOtherTeacherChangeDiscipline","Редактирование дисциплины: нет возможности редактировать у преподавателя другой дисциплины",""
"passed","Mon Oct 16 05:27:59 UTC 2023","Mon Oct 16 05:28:06 UTC 2023","6627","Активность","Контрольная","Результат прохождения теста","TestActivityResultTests","MarkCorrectAnswerThatWasMarkedAsIncorrect","Результат прохождения: можно отметить 'Верно' ответ вопроса, который был отмечен как 'Не верно'",""
"passed","Mon Oct 16 05:33:56 UTC 2023","Mon Oct 16 05:34:05 UTC 2023","8809","","Материал","Конструктор теста","TestSettingsValidationTests","ChangeLevelAssimilationInTestTag","Конструктор теста: можно изменить уровень усвоения в добавленном теге знаний",""
"passed","Mon Oct 16 05:26:45 UTC 2023","Mon Oct 16 05:26:58 UTC 2023","12958","Активность","Контрольная","Редактирование контрольной","TestActivityAddingTests","CheckAddTextMaterialToTestActivity","Редактирование контрольной: можно добавить материал типа текст из библиотеки",""
"passed","Mon Oct 16 05:29:23 UTC 2023","Mon Oct 16 05:29:30 UTC 2023","7497","","Чат","Мини-чат страницы решений","TaskPageMiniChatTests","CheckSendFileMessageInTaskPageMiniChat","Чат на странице решения: можно прикрепить и отправить файл с компьютера",""
"passed","Mon Oct 16 05:27:58 UTC 2023","Mon Oct 16 05:28:05 UTC 2023","7989","","Чат","Дисциплина","DisciplineChatTests","CheckSendEmptyMessageInDisciplineChat","Список чатов - комната дисциплины: невозможно отправить пустое сообщение",""
"passed","Mon Oct 16 05:29:21 UTC 2023","Mon Oct 16 05:29:30 UTC 2023","8517","","Поток","Создание потока","CohortCreationWarningModalTests","CheckCreateCohortWithoutMismatchWarningOfDuration","Создание потока: нет предупреждения о несоответствии длительности потока для программ длительностью кроме 72, 144 и 256 часов",""
"passed","Mon Oct 16 05:29:49 UTC 2023","Mon Oct 16 05:29:53 UTC 2023","3822","","Поток","Страница потока","CohortInfoTests","CheckWindowsRestoreCohortArchive","Страница потока: при восстановлении потока из архива появляется модалка подтверждения действия",""
"passed","Mon Oct 16 05:35:42 UTC 2023","Mon Oct 16 05:35:50 UTC 2023","7677","","Расписание","","ScheduleTests","CheckMemoryModeSchedule","Страница расписания: проверка запоминания выбора режима расписания",""
"passed","Mon Oct 16 05:33:39 UTC 2023","Mon Oct 16 05:33:51 UTC 2023","11634","","Материал","Конструктор тест-тренажера","TestTrainBlocksAndVariantsValidationTests","AddBlockTestTrain","Конструктор теста-тренажера: можно добавить блок",""
"passed","Mon Oct 16 05:25:46 UTC 2023","Mon Oct 16 05:25:55 UTC 2023","8750","","Активность","Обычная активность","ActivityEditingTests","CheckEditDescriptionActivity","Редактирование активности: можно изменить описание",""
"passed","Mon Oct 16 05:33:33 UTC 2023","Mon Oct 16 05:33:41 UTC 2023","7884","","Библиотека","","LibraryInListViewTests","CheckEditMaterialViaActionsButton","Библиотека, списочный вид: можно редактировать материал через actions-кнопки",""
"passed","Mon Oct 16 05:25:58 UTC 2023","Mon Oct 16 05:26:06 UTC 2023","8301","","Активность","Задание","TaskActivityTeacherTests","CheckGradeSolutionValueAboveAndBelowScore","Страница решение задания: можно оценить решения значением ниже минимального порога баллов",""
"failed","Mon Oct 16 05:38:41 UTC 2023","Mon Oct 16 05:39:34 UTC 2023","52615","","Активность","Обычная активность","ActivityContentVisibilityTests","CheckVisibilityMaterialOutsideTimeActivity","Редактирование активности: видимость материала вне времени проведения активности",""
"passed","Mon Oct 16 05:29:34 UTC 2023","Mon Oct 16 05:29:42 UTC 2023","7961","","Чат","Мини-чат страницы решений","TaskPageMiniChatTests","CheckSendMessageByTappingEnterInTaskPageMiniChat","Чат на странице решения: можно отправить сообщения по нажатию на Enter",""
"passed","Mon Oct 16 05:32:43 UTC 2023","Mon Oct 16 05:33:07 UTC 2023","24024","","Библиотека","","LibraryInListViewTests","CheckCopyMaterialToCatalogInListView","Библиотека, списочный вид: можно скопировать материал в другой каталог",""
"passed","Mon Oct 16 05:25:54 UTC 2023","Mon Oct 16 05:26:00 UTC 2023","5921","","Активность","Обычный шаблон активности","TemplateEditingValidationTests","CheckNegativeEditVolumeActivityTemplate","Редактирование шаблона активности: отображение ошибки валидации для поля 'Объём' с отрицательным значением",""
"passed","Mon Oct 16 05:31:17 UTC 2023","Mon Oct 16 05:31:24 UTC 2023","7569","","Дисциплина","Редактирование дисциплины","DisciplineEditingTests","CheckSwitchLanguage","Редактирование дисциплины: можно переключать значения в поле 'Язык'",""
"passed","Mon Oct 16 05:33:56 UTC 2023","Mon Oct 16 05:34:12 UTC 2023","15394","","Библиотека","","LibraryInListViewTests","CheckCopyMaterialViaActionsButton","Библиотека, списочный вид: можно скопировать материал через actions-кнопки",""
"passed","Mon Oct 16 05:29:36 UTC 2023","Mon Oct 16 05:29:43 UTC 2023","6711","","Чат","Групповой чат","GroupChatTests","CheckSendFileMessageInGroupChat","Список чатов - групповой чат: можно прикрепить и отправить файл с компьютера",""
"passed","Mon Oct 16 05:29:14 UTC 2023","Mon Oct 16 05:29:27 UTC 2023","13004","","Поток","Редактирование потока","CohortEditingTests","CheckEditCohortWhenAllRequiredFieldsAreFilled","Редактирование потока: успешное сохранение, если все обязательные поля корректно заполнены",""
"passed","Mon Oct 16 05:33:03 UTC 2023","Mon Oct 16 05:33:19 UTC 2023","16077","","Библиотека","","LibraryInTileViewTests","CheckMoveMaterialToCatalogInTileView","Библиотека, плиточный вид: можно переместить материал в другой каталог",""
"passed","Mon Oct 16 05:34:16 UTC 2023","Mon Oct 16 05:34:28 UTC 2023","11422","","Материал","Конструктор тест-тренажера","TestTrainQuestionAnswersValidationTests","AddAnswerForQuestionInTestTrain","Конструктор теста-тренажера: можно добавить еще один вариант ответа в вопрос с типом ответа 'Выбор из вариантов'",""
"passed","Mon Oct 16 05:31:57 UTC 2023","Mon Oct 16 05:32:03 UTC 2023","5978","","Дисциплина","Страница дисциплины","DisciplineStudentTests","CheckGradingByStudent","Страница оценок дисциплины: невозможности выставления оценки студентом",""
"passed","Mon Oct 16 05:32:21 UTC 2023","Mon Oct 16 05:32:24 UTC 2023","2736","","Подразделения","","DivisionCommonTests","CheckCancelCreateDivision","Cоздание подразделения проверка кнопки 'Отмена'",""
"passed","Mon Oct 16 05:30:06 UTC 2023","Mon Oct 16 05:30:09 UTC 2023","3024","","Поток","Редактирование потока","CohortEditingValidationTests","CheckIsNotPossibleRemoveCohortWithStudents","Редактирование потока ДО (СЗ): отсутствует кнопка ‘Удалить поток’, если в потоке есть слушатели",""
"passed","Mon Oct 16 05:26:24 UTC 2023","Mon Oct 16 05:26:32 UTC 2023","8483","Активность","Контрольная","Создание контрольной","TestActivityCreatingTests","CheckExecModeTestActivity","Создание контрольной: можно создать контрольную с режимом выполнения 'Командный'",""
"passed","Mon Oct 16 05:32:46 UTC 2023","Mon Oct 16 05:32:52 UTC 2023","5977","","Библиотека","","BulkActionsLibraryTests","CheckCancelSelectedItems","Библиотека: можно отменить режим выбора, нажав на кнопку “Отмена” или сняв отметки с выбранных элементов",""
"passed","Mon Oct 16 05:31:58 UTC 2023","Mon Oct 16 05:32:18 UTC 2023","19615","","Дисциплина","Страница дисциплины","DisciplineAnalyticsTests","CheckResetButton","Страница аналитика дисциплины: работает кнопка “Сбросить”",""
"passed","Mon Oct 16 05:30:24 UTC 2023","Mon Oct 16 05:30:30 UTC 2023","6009","","Дисциплина","Настройка чата дисциплины","DisciplineChatBlockTests","CheckChatMissingFromList","Страница чата: отсутствия блокированного чата в списке чатов",""
"passed","Mon Oct 16 05:32:21 UTC 2023","Mon Oct 16 05:32:30 UTC 2023","8892","","Дисциплина","Шаблон дисциплины","DisTemplateTests","CheckCreateDisTemplateWithFillingAllFields","Создание шаблона дисциплины: можно создать шаблон, если заполнены все поля",""
"passed","Mon Oct 16 05:35:20 UTC 2023","Mon Oct 16 05:35:30 UTC 2023","10338","","Программа","","ProgramInfoPageTests","CheckNoAccessStudentToActivityEducationalProgramArchive","Страница обр программы: Студенты не имеют доступ к активностям архивной обр программы",""
"passed","Mon Oct 16 05:30:01 UTC 2023","Mon Oct 16 05:30:09 UTC 2023","8153","","Поток","Создание потока","CohortCreationTests","CheckCreateCohortByFillingMaxNumberOfStudents","Создание потока: можно создать поток, заполнив поле ‘Максимальное количество студентов’",""
"passed","Mon Oct 16 05:27:07 UTC 2023","Mon Oct 16 05:27:12 UTC 2023","5145","Активность","Контрольная","Редактирование контрольной","TestActivityEditingTests","SwitchCheckboxDisplayStudentsDetailedResultInfoInTestActivity","Редактирование контрольной: можно отметить или снять галку с чекбокса 'Отображать студентам подробную информацию о результатах'",""
"passed","Mon Oct 16 05:30:59 UTC 2023","Mon Oct 16 05:31:09 UTC 2023","9473","","Дисциплина","Редактирование дисциплины","DisciplineDurationTests","CheckIfEndDateEmptyInDiscipline","Редактирование дисциплины: наличия ошибки если поле дата окончания пустое",""
"passed","Mon Oct 16 05:28:39 UTC 2023","Mon Oct 16 05:28:51 UTC 2023","11759","","Чат","Чат для заметок","NotesChatTests","CheckAddQuoteToLastMessageInNotesChat","Список чатов - чат для заметок: можно цитировать сообщению",""
"passed","Mon Oct 16 05:30:42 UTC 2023","Mon Oct 16 05:30:50 UTC 2023","8600","","Дисциплина","Редактирование дисциплины","DisciplineAccessTests","CheckIfAdminPodrChangeDiscipline","Редактирование дисциплины: есть возможность редактировать у администратора подразделения, к которому дисциплина относится",""
"passed","Mon Oct 16 05:31:44 UTC 2023","Mon Oct 16 05:31:58 UTC 2023","14546","","Дисциплина","Страница дисциплины","DisciplineAnalyticsTests","CheckFilterByGroupName","Страница аналитика дисциплины: работает фильтр по названию группы",""
"passed","Mon Oct 16 05:35:52 UTC 2023","Mon Oct 16 05:36:02 UTC 2023","9991","","Расписание","","ScheduleSettingsTests","ShowLastActivitySchedule","Страница расписания: проверка показать прошедшие активности",""
"passed","Mon Oct 16 05:30:25 UTC 2023","Mon Oct 16 05:30:30 UTC 2023","5498","","Дисциплина","Редактирование дисциплины","DisciplineAccessTests","CheckIfOtherAdminEducProgChangeDiscipline","Редактирование дисциплины: нет возможности редактировать у администратора образовательной программы, к которой дисциплина НЕ относится",""
"failed","Mon Oct 16 05:39:07 UTC 2023","Mon Oct 16 05:39:39 UTC 2023","32398","","Дисциплина","Создание дисциплины","DisContingentCreationValidationTests","CheckUnableAddGroupFromAnotherCohortInCreation","Создание дисциплины: невозможно добавить группу из стороннего потока",""
"passed","Mon Oct 16 05:28:48 UTC 2023","Mon Oct 16 05:28:58 UTC 2023","9952","","Чат","Дисциплина","DisciplineChatTests","CheckSendEmojiInDisciplineChat","Список чатов - комната дисциплины: можно отправить смайлики",""
"passed","Mon Oct 16 05:28:29 UTC 2023","Mon Oct 16 05:28:41 UTC 2023","11716","","Чат","Групповой чат","GroupChatTests","CheckAddQuoteToLastMessageInGroupChat","Список чатов - групповой чат: можно цитировать сообщению",""
"passed","Mon Oct 16 05:27:20 UTC 2023","Mon Oct 16 05:27:37 UTC 2023","16464","","Звонок","","CallTests","CheckTurnOnOffEquipmentInCall","Страница звонка: можно включить/отключить камеру в звонке",""
"passed","Mon Oct 16 05:25:00 UTC 2023","Mon Oct 16 05:25:06 UTC 2023","5256","","Активность","Задание","TaskActivityMulticriteriaTests","CheckMultiCriteriaCheckboxInTask","Создание задания: чекбокс многокритериальная проверка не отображается, если выбрана взаимопроверка",""
"passed","Mon Oct 16 05:27:50 UTC 2023","Mon Oct 16 05:27:58 UTC 2023","7466","","Чат","Дисциплина","DisciplineChatTests","CheckSendTextMessageInDisciplineChat","Список чатов - комната дисциплины: можно отправить текстовое сообщение",""
"passed","Mon Oct 16 05:32:08 UTC 2023","Mon Oct 16 05:32:17 UTC 2023","9285","","Дисциплина","Создание дисциплины","DisContingentCreationValidationTests","CheckUnableAddStudentFromAnotherCohortInCreation","Создание дисциплины: невозможно добавить студента из стороннего потока",""
"passed","Mon Oct 16 05:34:55 UTC 2023","Mon Oct 16 05:34:57 UTC 2023","1337","","Организация","Страница организации","OrganizationPageTests","CheckTransitionToEditPage","Страница организации: работает кнопка Редактировать",""
"passed","Mon Oct 16 05:31:24 UTC 2023","Mon Oct 16 05:31:34 UTC 2023","9184","","Дисциплина","Редактирование дисциплины","DisciplineEditingTests","CheckSwitchControlType","Редактирование дисциплины: можно переключать значения в поле 'Вид контроля'",""
"passed","Mon Oct 16 05:29:26 UTC 2023","Mon Oct 16 05:29:37 UTC 2023","11235","","Чат","Чат для заметок","NotesChatTests","CheckSendEmojiInNotesChat","Список чатов - чат для заметок: можно отправить смайлики",""
"passed","Mon Oct 16 05:27:37 UTC 2023","Mon Oct 16 05:27:48 UTC 2023","11755","","Звонок","","CallTests","CheckTurnOnOffEquipmentInCall","Страница звонка: можно включить/отключить микрофон в звонке",""
"passed","Mon Oct 16 05:25:07 UTC 2023","Mon Oct 16 05:25:16 UTC 2023","8556","","Активность","Задание","TaskActivityCreatingTests","CheckCreateTaskWithOpenSolutions","Создание задания: можно создать задание с открытыми решениями",""
"passed","Mon Oct 16 05:39:19 UTC 2023","Mon Oct 16 05:39:33 UTC 2023","13107","","Дисциплина","Создание дисциплины","DisContingentCreationTests","CheckAddTeacherByUserInfoInCreation","Создание дисциплины: добавление преподавателя из списка",""
"passed","Mon Oct 16 05:35:33 UTC 2023","Mon Oct 16 05:35:37 UTC 2023","4478","","Расписание","","ScheduleTests","ActiveTidayButtonSchedule","Страница расписания: проверка кликабельности Сегодня",""
"passed","Mon Oct 16 05:32:01 UTC 2023","Mon Oct 16 05:32:14 UTC 2023","13019","","Дисциплина","Редактирование дисциплины","DisciplineEditingTests","CheckDeleteDisciplineWithoutGrades","Редактирование дисциплины: можно удалить дисциплину без оценок",""
"passed","Mon Oct 16 05:31:50 UTC 2023","Mon Oct 16 05:31:54 UTC 2023","3830","","Дисциплина","Страница дисциплины","DisciplineStudentTests","CheckGradesDropdownForStudent","Страница оценок дисциплины: отсутствия кнопки 'Итоговые оценки (ведомость)' у студента",""
"passed","Mon Oct 16 05:28:28 UTC 2023","Mon Oct 16 05:28:34 UTC 2023","5303","","Поток","Создание потока","CohortCreationValidationTests","CheckCreateCohortIfNameNotFilled","Создание потока: ошибка валидации, если название не указано",""
"passed","Mon Oct 16 05:28:43 UTC 2023","Mon Oct 16 05:28:58 UTC 2023","15721","","Чат","Мини-чат страницы решений","TaskPageMiniChatTests","CheckEditLastMessageInTaskPageMiniChat","Чат на странице решения: можно редактировать сообщение в течение 4 часов после отправки",""
"passed","Mon Oct 16 05:34:16 UTC 2023","Mon Oct 16 05:34:18 UTC 2023","1647","","Материал","Конструктор тест-тренажера","TestTrainBlocksAndVariantsValidationTests","ImpossibleToAddVariantInTestTrain","Конструктор теста-тренажера: отсутствует возможность добавить вариант",""
