"Status","Start Time","Stop Time","Duration in ms","Parent Suite","Suite","Sub Suite","Test Class","Test Method","Name","Description"
"passed","Mon Nov 20 05:22:30 UTC 2023","Mon Nov 20 05:22:42 UTC 2023","12084","Активность","Контрольная","Создание контрольной","TestActivityCreatingTests","CheckCreateActivityBySpecifyingControlMode","Можно создать контрольную с режимом выполнения Командный",""
"passed","Mon Nov 20 05:21:10 UTC 2023","Mon Nov 20 05:21:14 UTC 2023","4204","","Активность","Задание","TaskWithoutSolutionStudentTests","CheckSendEmptySolution","Наличие ошибки при отправки пустого решения",""
"passed","Mon Nov 20 05:31:11 UTC 2023","Mon Nov 20 05:31:16 UTC 2023","5686","","Материал","Конструктор тест-тренажера","TestTrainQuestionAnswersValidationTests","RemoveAnswerFromQuestionInTestTrain","Конструктор теста-тренажера: можно удалить вариант ответа из вопроса с типом ответа 'Выбор из вариантов'",""
"passed","Mon Nov 20 05:26:04 UTC 2023","Mon Nov 20 05:26:11 UTC 2023","7052","","Поток","Редактирование потока","CohortEditingTests","CheckEditCohortWithFillingAdministratorField","Редактирование потока ТГУ: успешное сохранение, с корректными значениями в поле ‘Администраторы потока’",""
"passed","Mon Nov 20 05:30:27 UTC 2023","Mon Nov 20 05:30:32 UTC 2023","5576","","Материал","Конструктор теста","TestQuestionAnswersValidationTests","CheckRemoveAnswerFromSortingQuestion","Конструктор теста: можно удалить опцию из вопроса с типом ответа 'Сортировка'",""
"passed","Mon Nov 20 05:22:01 UTC 2023","Mon Nov 20 05:22:13 UTC 2023","11986","","Активность","Обычный шаблон активности","TemplateAddingTests","CheckAddTextTypeMaterialToActivityPlan","Можно добавить материал типа Текст из Библиотеки в шаблон",""
"passed","Mon Nov 20 05:30:30 UTC 2023","Mon Nov 20 05:30:42 UTC 2023","11798","","Материал","Конструктор теста","TestBlocksAndVariantsValidationTests","CheckAddTestBlock","Конструктор теста: можно добавить блок",""
"passed","Mon Nov 20 05:31:19 UTC 2023","Mon Nov 20 05:31:20 UTC 2023","1668","","Организация","Страница организации","OrganizationPageTests","CheckTooltipIsDisplayedByHoverProjectIcon","Страница организации: отображается тултип при наведении на иконку участника проекта",""
"passed","Mon Nov 20 05:23:51 UTC 2023","Mon Nov 20 05:24:08 UTC 2023","16919","","Активность","Шаблон активности контрольной","TestTemplateAddingTests","CheckAddTextMaterialToControlActivityPlan","Можно добавить материал типа Текст из Библиотеки в шаблон контрольной",""
"passed","Mon Nov 20 05:31:43 UTC 2023","Mon Nov 20 05:31:49 UTC 2023","5643","","Материал","Конструктор тест-тренажера","TestTrainQuestionAnswersValidationTests","CheckRemoveCommentFromTestTrainAnswer","Конструктор теста-тренажера: проверка ошибки валидации при удалении комментария к варианту ответа",""
"passed","Mon Nov 20 05:25:53 UTC 2023","Mon Nov 20 05:26:04 UTC 2023","10526","","Чат","Групповой чат","GroupChatTests","CheckAddReactionToLastMessageInGroupChat","Список чатов - групповой чат: можно добавить реакцию на сообщение",""
"passed","Mon Nov 20 05:22:55 UTC 2023","Mon Nov 20 05:23:10 UTC 2023","15034","Активность","Контрольная","Прохождение теста","TestActivityStatusWithOneAttemptTests","StatusIsPendingReviewForAttemptsNeedsReview","Страница индивидуальной контрольной: статус ожидает проверки, если в попытке есть хотя бы один вопрос, требующий проверки",""
"passed","Mon Nov 20 05:30:47 UTC 2023","Mon Nov 20 05:30:56 UTC 2023","8695","","Материал","Конструктор тест-тренажера","TestTrainQuestionAnswersValidationTests","CheckAddOneMoreAnswerVariantInQuestionWithFreeAnswerExactMatchInTestTrain","Конструктор теста-тренажера: можно добавить еще один вариант ответа в вопрос с типом ответа 'Свободный ответ - точное совпадение'",""
"passed","Mon Nov 20 05:29:07 UTC 2023","Mon Nov 20 05:29:09 UTC 2023","2277","","Подразделения","Страница подразделения","DivisionPageTests","CheckExpandListOfArchivedPrograms","Можно посмотреть список архивных программ",""
"passed","Mon Nov 20 05:32:04 UTC 2023","Mon Nov 20 05:32:12 UTC 2023","7465","","Профиль","","GeneralUserInfoEditingTests","CheckBirthField","Редактирование профиля пользователя: можно изменить дату рождения",""
"passed","Mon Nov 20 05:28:53 UTC 2023","Mon Nov 20 05:28:55 UTC 2023","1645","","Подразделения","Страница подразделения","DivisionPageTests","CheckTransitionToDivEditPage","Работает кнопка Редактировать на странице подразделения",""
"passed","Mon Nov 20 05:30:27 UTC 2023","Mon Nov 20 05:30:35 UTC 2023","8025","","Материал","Конструктор тест-тренажера","TestTrainCreationTests","TestCreation","Конструктор теста-тренажера: создание теста-тренажера",""
"passed","Mon Nov 20 05:25:11 UTC 2023","Mon Nov 20 05:25:19 UTC 2023","7879","","Поток","Создание потока","CohortCreationWarningModalTests","CheckCreateCohortWithMismatchWarningOfDuration","Создание потока: предупреждение о несоответствии длительности потока для программ длительностью 144 часа",""
"passed","Mon Nov 20 05:24:53 UTC 2023","Mon Nov 20 05:25:00 UTC 2023","7139","","Поток","Создание потока","CohortCreationValidationTests","CheckCreateCohortIfNameNotFilled","Создание потока: ошибка валидации, если название не указано",""
"passed","Mon Nov 20 05:28:32 UTC 2023","Mon Nov 20 05:28:43 UTC 2023","11839","","Дисциплина","Создание дисциплины","DisContingentCreationTests","CheckCreateDisciplineByCheckingBoxAllCohortStudents","Создание дисциплины: есть возможность создать дисциплину выбрав галку ‘Все студенты потока’",""
"passed","Mon Nov 20 05:24:26 UTC 2023","Mon Nov 20 05:24:36 UTC 2023","10161","Активность","Контрольная","Результат прохождения теста","TestActivityResultTests","MarkCorrectAnswerThatWasMarkedAsIncorrect","Результат прохождения: можно отметить 'Верно' ответ вопроса, который был отмечен как 'Не верно'",""
"passed","Mon Nov 20 05:26:55 UTC 2023","Mon Nov 20 05:27:03 UTC 2023","8421","","Чат","Групповой чат","GroupChatTests","CheckRestoreGroupChatFromArchive","Список чатов - групповой чат: можно восстановить чат из архива",""
"passed","Mon Nov 20 05:28:47 UTC 2023","Mon Nov 20 05:28:54 UTC 2023","7592","","Библиотека","","BulkActionsLibraryTests","CheckInSelectModeFirstElementIsSelected","Библиотека: при переходе в режим выбора первый элемент должен быть выбран",""
"passed","Mon Nov 20 05:32:14 UTC 2023","Mon Nov 20 05:32:17 UTC 2023","3430","","Расписание","","ScheduleTests","CheckThreeDayModeIsDisplayedInMobileVersion","Проверка отображение режима 3 дня в мобильной версии",""
"passed","Mon Nov 20 05:24:53 UTC 2023","Mon Nov 20 05:24:59 UTC 2023","6109","","Поток","Создание потока","CohortCreationTests","CheckCancelCohortCreation","Создание потока ДО: работает кнопка 'Отмена', если страница создание был открыть со страницы программы",""
"passed","Mon Nov 20 05:25:11 UTC 2023","Mon Nov 20 05:25:24 UTC 2023","12877","","Чат","Дисциплина","DisciplineChatTests","CheckSendEmojiInDisciplineChat","Список чатов - комната дисциплины: можно отправить смайлики",""
"passed","Mon Nov 20 05:24:20 UTC 2023","Mon Nov 20 05:24:37 UTC 2023","17196","","Чат","Групповой чат","GroupChatTests","CheckEditLastMessageInGroupChat","Список чатов - групповой чат: можно редактировать сообщение в течение 4 часов после отправки",""
"passed","Mon Nov 20 05:31:43 UTC 2023","Mon Nov 20 05:31:52 UTC 2023","8484","","Профиль","","GeneralUserInfoEditingTests","ValidatingUserNameFields","Редактирование профиля пользователя: можно изменить ФИО",""
"passed","Mon Nov 20 05:30:56 UTC 2023","Mon Nov 20 05:31:03 UTC 2023","6753","","Материал","Конструктор тест-тренажера","TestTrainQuestionAnswersValidationTests","CheckAddOneMoreOptionInComparisonTestQuestionInTestTrain","Конструктор теста-тренажера: можно добавить еще один вариант на сопоставление в вопрос с типом ответа 'Сопоставление'",""
"passed","Mon Nov 20 05:24:04 UTC 2023","Mon Nov 20 05:24:15 UTC 2023","11122","","Чат","Дисциплина","DisciplineChatTests","CheckSendEmptyMessageInDisciplineChat","Список чатов - комната дисциплины: невозможно отправить пустое сообщение",""
"passed","Mon Nov 20 05:27:00 UTC 2023","Mon Nov 20 05:27:13 UTC 2023","13026","","Дисциплина","Настройка чата дисциплины","DisciplineChatBlockTests","CheckBlockAndUnblockChatDiscipline","Редактирование дисциплины: блокировка чата дисциплины",""
"passed","Mon Nov 20 05:26:38 UTC 2023","Mon Nov 20 05:26:40 UTC 2023","1435","","Поток","Редактирование потока","CohortEditingValidationTests","CheckIsNotPossibleEditCohort","Редактирование потока ДО (СЗ): нет возможности редактировать поток программы 2021 года, если в нем есть слушатели",""
"passed","Mon Nov 20 05:28:47 UTC 2023","Mon Nov 20 05:28:55 UTC 2023","7985","","Дисциплина","Редактирование дисциплины","DisContingentEditingTests","CheckRemoveTeacherFromDiscipline","Редактирование дисциплины: открепления преподавателя от дисциплины",""
"passed","Mon Nov 20 05:28:30 UTC 2023","Mon Nov 20 05:28:39 UTC 2023","8190","","Подразделения","Страница подразделения","DivisionPageTests","CheckUploadOrDeleteAvatarForDivision","Можно загрузить/удалить аватар для подразделения",""
"passed","Mon Nov 20 05:26:53 UTC 2023","Mon Nov 20 05:26:59 UTC 2023","5421","","Дисциплина","Страница дисциплины","DisciplineAnalyticsTests","CheckThreeDotMenuOnAnalyticsTabIsDisplayed","Страница аналитика дисциплины: наличие тридот меню на вкладке “Аналитика”",""
"passed","Mon Nov 20 05:28:53 UTC 2023","Mon Nov 20 05:29:03 UTC 2023","9916","","Библиотека","","LibraryInTileViewTests","CheckRenameCatalog","Библиотека, плиточный вид: можно переименовать каталог",""
"passed","Mon Nov 20 05:27:49 UTC 2023","Mon Nov 20 05:27:59 UTC 2023","9673","","Дисциплина","Создание дисциплины","DisciplineCreationValidationTests","CheckIfCreditValuesNotAllowed","Создание дисциплины ДО: отображение ошибки валидации для поля 'Кредиты' с значением > 15",""
"passed","Mon Nov 20 05:22:57 UTC 2023","Mon Nov 20 05:22:59 UTC 2023","2169","","Активность","Обычный шаблон активности","TemplateAddingTests","CheckAbsenceScormScoreFieldActivityTemplate","Редактирование шаблона активности: отсутствия поля оценка по SCORM результату, если не добавлен SCORM пакет",""
"passed","Mon Nov 20 05:25:31 UTC 2023","Mon Nov 20 05:25:37 UTC 2023","5687","","Чат","Личный чат","PersonalChatTests","CheckFindSentMessageInPersonalChat","Список чатов - личный чат: можно найти отправленное сообщение",""
"passed","Mon Nov 20 05:31:35 UTC 2023","Mon Nov 20 05:31:38 UTC 2023","3169","","Расписание","","ScheduleTests","CheckColorLegendIsDisplayed","Отображается цветовая легенда событий расписания",""
"passed","Mon Nov 20 05:30:53 UTC 2023","Mon Nov 20 05:31:01 UTC 2023","8029","","Организация","Мой тариф","MyPlanOrganizationPageTests","CheckOpenMyPlanPageFromOrganizationPage","Страница организации: переход на страницу Мой тариф",""
"passed","Mon Nov 20 05:22:38 UTC 2023","Mon Nov 20 05:22:43 UTC 2023","4574","Активность","Контрольная","Редактирование контрольной","TestActivityEditingTests","CheckErrorInNumOfAttemptsFieldWithIncorrectValue","Ошибка валидации в поле Количество попыток сдачи, если введено значение 0",""
"passed","Mon Nov 20 05:25:46 UTC 2023","Mon Nov 20 05:25:53 UTC 2023","7659","","Чат","Групповой чат","GroupChatTests","CheckSendMessageByTappingEnterInGroupChat","Список чатов - групповой чат: можно отправить сообщения по нажатию на Enter",""
"passed","Mon Nov 20 05:23:00 UTC 2023","Mon Nov 20 05:23:10 UTC 2023","9917","Активность","Контрольная","Прохождение теста","TestActivityPassingTests","CheckAfterPassingTestNumOfAttemptsDecreasedByOne","После прохождения теста количество попыток уменьшилось на единицу",""
"passed","Mon Nov 20 05:25:35 UTC 2023","Mon Nov 20 05:25:39 UTC 2023","3567","","Чат","Групповой чат","GroupChatTests","CheckOpenImageInGroupChat","Список чатов - групповой чат: можно раскрывать изображения",""
"passed","Mon Nov 20 05:26:52 UTC 2023","Mon Nov 20 05:27:09 UTC 2023","16902","","Чат","Чат для заметок","NotesChatTests","CheckPinLastMessageInNotesChat","Список чатов - чат для заметок: можно закреплять сообщения",""
"passed","Mon Nov 20 05:21:36 UTC 2023","Mon Nov 20 05:21:42 UTC 2023","6647","","Активность","Задание","TaskActivityTeacherTests","CheckGradeSolutionWithZeroValue","Можно оценить решения значением '0'",""
"passed","Mon Nov 20 05:22:25 UTC 2023","Mon Nov 20 05:22:29 UTC 2023","3830","","Активность","Задание","TaskActivityTeacherTests","CheckSendSolutionForRevision","Можно отправить решения на доработку",""
"passed","Mon Nov 20 05:29:41 UTC 2023","Mon Nov 20 05:29:47 UTC 2023","5143","","Библиотека","","LibraryActionPanelTests","CheckChangeViewOfLibraryInTileView","Библиотека: можно переключать текущий вид библиотеки со “Списка” на “Плитку”",""
"failed","Mon Nov 20 05:34:45 UTC 2023","Mon Nov 20 05:35:16 UTC 2023","31825","","Активность","Обычный шаблон активности","TemplateAddingTests","CheckAddTestNotInControlTypeActivityTemplate","Редактирование шаблона активности: наличия ошибки при добавлении теста из библиотеки не в контрольную",""
"passed","Mon Nov 20 05:29:05 UTC 2023","Mon Nov 20 05:29:07 UTC 2023","2306","","Подразделения","Страница подразделения","DivisionPageTests","CheckProjectLabelIsDisplayedForAdditionalPrograms","Лейбл образовательного проекта отображается под названием программы ДО",""
"passed","Mon Nov 20 05:25:25 UTC 2023","Mon Nov 20 05:25:41 UTC 2023","16028","","Поток","Редактирование потока","CohortEditingTests","CheckEditCohortWhenAllRequiredFieldsAreFilled","Редактирование потока: успешное сохранение, если все обязательные поля корректно заполнены",""
"passed","Mon Nov 20 05:26:15 UTC 2023","Mon Nov 20 05:26:19 UTC 2023","4432","","Поток","Редактирование потока","CohortEditingValidationTests","CheckEditCohortIfEachDateNotFilled","Редактирование потока: ошибка валидации, если дата окончания не заполнена",""
"passed","Mon Nov 20 05:31:38 UTC 2023","Mon Nov 20 05:31:47 UTC 2023","8647","","Расписание","","ScheduleTests","CheckStubIsDisplayedIfNoEvents","Отображается заглушка в режиме Расписание, если нет событий",""
"passed","Mon Nov 20 05:28:14 UTC 2023","Mon Nov 20 05:28:18 UTC 2023","3538","","Дисциплина","Редактирование дисциплины","DisciplineEditingTests","CheckCancelButtonWork","Редактирование дисциплины: работает кнопка Отмена",""
"passed","Mon Nov 20 05:23:52 UTC 2023","Mon Nov 20 05:24:03 UTC 2023","10931","Активность","Контрольная","Результат прохождения теста","TestActivityResultTests","CheckMarkCorrectTextOrFileAnswer","Результат прохождения: можно отметить 'Верно' ответ вопроса с типом ответа свободный ответ или файл",""
"passed","Mon Nov 20 05:27:29 UTC 2023","Mon Nov 20 05:27:32 UTC 2023","3443","","Дисциплина","Редактирование дисциплины","DisciplineEditingValidationTests","CheckImpossibilityTurnOnOrOffIOT","Редактирование дисциплины: невозможно включить ИОТ, если в дисциплине есть активности",""
"passed","Mon Nov 20 05:27:53 UTC 2023","Mon Nov 20 05:28:00 UTC 2023","7164","","Дисциплина","Редактирование дисциплины","DisciplineEditingTests","CheckPossibilityTurnOnIOT","Редактирование дисциплины: можно включить/отключить ИОТ, если в дисциплине нет активностей",""
"passed","Mon Nov 20 05:31:08 UTC 2023","Mon Nov 20 05:31:19 UTC 2023","11401","","Материал","Конструктор тест-тренажера","TestTrainQuestionsValidationTests","CheckAndUncheckAnswerOptionInTestTrain","Конструктор теста-тренажера: возможность отметить вариант ответа как “верный”",""
"passed","Mon Nov 20 05:22:15 UTC 2023","Mon Nov 20 05:22:25 UTC 2023","9631","","Активность","Обычная активность","ActivityEditingTests","CheckEditValueScormResultScore","Редактирование активности: можно переключать значения в поле 'Оценка по SCORM результату'",""
"passed","Mon Nov 20 05:26:29 UTC 2023","Mon Nov 20 05:26:39 UTC 2023","10064","","Поток","Страница потока","CohortInfoTests","CheckNoAccessStudentToActivityCohortArchive","Страница потока: студенты не имеют доступа к активностям архивного потока",""
"passed","Mon Nov 20 05:22:29 UTC 2023","Mon Nov 20 05:22:43 UTC 2023","13428","Активность","Контрольная","Редактирование контрольной","TestActivityAddingTests","CheckAddTestToControlTypeActivity","Можно добавить материал типа Тест из Библиотеки в контрольную",""
"passed","Mon Nov 20 05:24:42 UTC 2023","Mon Nov 20 05:24:59 UTC 2023","17074","","Чат","Чат для заметок","NotesChatTests","CheckEditLastMessageInNotesChat","Список чатов - чат для заметок: можно редактировать сообщение в течение 4 часов после отправки",""
"passed","Mon Nov 20 05:25:38 UTC 2023","Mon Nov 20 05:25:58 UTC 2023","20109","","Поток","Создание потока","CohortCreationValidationTests","CheckCreateCohortFromUnsuitableTemplate","Создание потока ДО: невозможно создать поток из шаблона программы ВО",""
"passed","Mon Nov 20 05:21:39 UTC 2023","Mon Nov 20 05:21:43 UTC 2023","3564","","Активность","Задание","TaskWithSolutionStudentTests","CheckRemoveSolution","Наличие ошибки при удалении решения",""
"passed","Mon Nov 20 05:29:57 UTC 2023","Mon Nov 20 05:30:04 UTC 2023","6614","","Материал","Конструктор теста","TestSettingsValidationTests","RemoveAuthorFromTest","Конструктор теста: можно удалить автора",""
"passed","Mon Nov 20 05:26:22 UTC 2023","Mon Nov 20 05:26:30 UTC 2023","7473","","Дисциплина","Редактирование дисциплины","DisciplineAccessTests","CheckIfStudentChangeDiscipline","Редактирование дисциплины: нет возможности редактировать у студента",""
"passed","Mon Nov 20 05:22:27 UTC 2023","Mon Nov 20 05:22:32 UTC 2023","5480","","Активность","Обычный шаблон активности","TemplateEditingValidationTests","CheckNegativeEditVolumeActivityTemplate","Редактирование шаблона активности: отображение ошибки валидации для поля 'Объём' с значением > 100",""
"passed","Mon Nov 20 05:24:05 UTC 2023","Mon Nov 20 05:24:14 UTC 2023","8991","","Активность","Шаблон активности контрольной","TestTemplateEditingTests","CheckSuccessEditingTimeLimitWithCorrectValue","Успешное сохранение при корректных значениях в поле Временной лимит",""
"passed","Mon Nov 20 05:31:58 UTC 2023","Mon Nov 20 05:32:12 UTC 2023","13694","","Расписание","","ScheduleSettingsTests","CheckPastActivitiesAreDarkened","Проверка затемнения прошедших активностей",""
"passed","Mon Nov 20 05:23:58 UTC 2023","Mon Nov 20 05:24:25 UTC 2023","27049","Активность","Контрольная","Прохождение теста","TestActivityStatusWithTwoOrMoreAttemptsTests","ResultOfPassingDependOnSettings","Страница индивидуальной контрольной: результат тестирования из попытках зависеть от настройки 'За последнюю попытку'",""
"passed","Mon Nov 20 05:23:50 UTC 2023","Mon Nov 20 05:24:16 UTC 2023","26254","","Чат","Мини-чат звонка дисциплины","DisciplineChatCallTests","CheckSendTextMessageInDisciplineCallChat","Миничат звонка - комната дисциплины: можно отправить текстовое сообщение",""
"passed","Mon Nov 20 05:25:58 UTC 2023","Mon Nov 20 05:26:01 UTC 2023","3181","","Чат","Личный чат","PersonalChatTests","CheckOpenImageInPersonalChat","Список чатов - личный чат: можно раскрывать изображения",""
"passed","Mon Nov 20 05:31:20 UTC 2023","Mon Nov 20 05:31:48 UTC 2023","27294","","Организация","Страница организации","OrganizationPageTests","CheckTransitionToOrgLibraryPage","Страница организации: работает переход к библиотеке организации",""
"passed","Mon Nov 20 05:30:50 UTC 2023","Mon Nov 20 05:31:00 UTC 2023","9998","","Материал","Конструктор тест-тренажера","TestTrainQuestionsValidationTests","EditCommentInTestTrainQuestion","Конструктор теста-тренажера: можно изменить комментарий к вопросу",""
