"Status","Start Time","Stop Time","Duration in ms","Parent Suite","Suite","Sub Suite","Test Class","Test Method","Name","Description"
"passed","Mon Feb 05 05:59:29 UTC 2024","Mon Feb 05 05:59:35 UTC 2024","5815","Активность","Задание","Страница решения задания для студента","TaskWithoutSolutionStudentTests","CheckAccessFormWithoutSolution","Отправка решений после даты окончания активности",""
"passed","Mon Feb 05 06:11:49 UTC 2024","Mon Feb 05 06:11:56 UTC 2024","7669","","Материал","Конструктор теста","TestQuestionAnswersValidationTests","CheckAddCommentInTestAnswer","Конструктор теста: можно добавить комментарий к варианту ответа",""
"passed","Mon Feb 05 06:06:47 UTC 2024","Mon Feb 05 06:06:56 UTC 2024","8903","","Чат","Чат решения","TaskChatTests","CheckAddReactionToLastMessageInTaskChat","можно добавить реакцию на сообщение",""
"passed","Mon Feb 05 05:59:18 UTC 2024","Mon Feb 05 05:59:22 UTC 2024","4704","Активность","Задание","Страница решения задания для преподавателя","TaskActivityTeacherTests","CheckGradeSolutionWithZeroValue","Можно оценить решения значением 0",""
"passed","Mon Feb 05 06:05:01 UTC 2024","Mon Feb 05 06:05:09 UTC 2024","8242","","Чат","Личный чат","PersonalChatTests","CheckSendEmptyMessageInPersonalChat","невозможно отправить пустое сообщение",""
"passed","Mon Feb 05 06:13:01 UTC 2024","Mon Feb 05 06:13:04 UTC 2024","3001","","Программа","","ProgramEditingTests","CheckRemoveProgramWithoutCohort","Можно удалить программу ВО без потоков",""
"passed","Mon Feb 05 06:10:14 UTC 2024","Mon Feb 05 06:10:20 UTC 2024","6539","","Библиотека","","BulkActionsLibraryTests","CheckAppearanceOfMoveDeleteAndCancelButtons","Библиотека: появление кнопок переместить, удалить, и отмена при активации режима выбора",""
"passed","Mon Feb 05 06:07:08 UTC 2024","Mon Feb 05 06:07:12 UTC 2024","4591","","Поток","Редактирование потока","CohortEditingTests","CheckCancelCohortEditing","Редактирование потока ВО: работает кнопка 'Отмена', если страница редактирование был открыть со страницы потока",""
"passed","Mon Feb 05 06:12:40 UTC 2024","Mon Feb 05 06:12:46 UTC 2024","5530","","Организация","Редактирование организации","OrganizationEditingTests","CheckCancelOrganizationEditing","Редактирование организации: работает кнопка Отмена",""
"passed","Mon Feb 05 06:17:26 UTC 2024","Mon Feb 05 06:17:28 UTC 2024","1907","","Организация","Страница организации","OrganizationPageTests","CheckTooltipIsDisplayedByHoverProjectIcon","Страница организации: отображается тултип при наведении на иконку участника проекта",""
"passed","Mon Feb 05 05:59:56 UTC 2024","Mon Feb 05 06:00:09 UTC 2024","13162","Активность","Задание","Создание задания","TaskActivityMulticriteriaTests","CheckCreateTaskWithValuesInCriteria","Можно задать значения критериям (заполнены поля Значения критерия и Баллов)",""
"passed","Mon Feb 05 05:59:33 UTC 2024","Mon Feb 05 05:59:39 UTC 2024","6556","","Активность","Обычная активность","ActivityEditingTests","CheckAddTagToActivity","Можно добавлять теги знаний",""
"passed","Mon Feb 05 06:09:32 UTC 2024","Mon Feb 05 06:09:38 UTC 2024","6095","","Дисциплина","Страница дисциплины","DisciplineMarksAndAttendanceTests","CheckAttendanceByTeacher","Преподаватель может поставить/убрать галочку посещаемости",""
"passed","Mon Feb 05 06:06:30 UTC 2024","Mon Feb 05 06:06:49 UTC 2024","18283","","Чат","Чат для заметок","NotesChatTests","CheckPinLastMessageInNotesChat","можно закреплять сообщения",""
"passed","Mon Feb 05 06:10:17 UTC 2024","Mon Feb 05 06:10:22 UTC 2024","5774","","Подразделения","Создание подразделения","DivisionCreationTests","CheckCancelCreateDivision","Проверка кнопки Отмена при создании подразделения",""
"passed","Mon Feb 05 06:01:56 UTC 2024","Mon Feb 05 06:02:22 UTC 2024","26415","","Чат","Мини-чат звонка дисциплины","DisciplineChatCallTests","CheckEditLastMessageInDisciplineCallChat","можно редактировать сообщение в течение 4 часов после отправки",""
"passed","Mon Feb 05 06:06:57 UTC 2024","Mon Feb 05 06:07:05 UTC 2024","8793","","Чат","Личный чат","PersonalChatTests","CheckDeleteMessageInPersonalChat","можно удалить сообщение",""
"passed","Mon Feb 05 06:06:37 UTC 2024","Mon Feb 05 06:06:43 UTC 2024","6195","","Поток","Создание потока","CohortCreationValidationTests","CheckCreateCohortIfEachDateNotFilled","Создание потока: ошибка валидации, если дата начала не указана",""
"passed","Mon Feb 05 06:17:14 UTC 2024","Mon Feb 05 06:17:31 UTC 2024","16310","","Чат","Личный чат","PersonalChatTests","CheckAddNewPersonalChat","можно добавить новый чат",""
"passed","Mon Feb 05 06:09:18 UTC 2024","Mon Feb 05 06:09:23 UTC 2024","4537","","Дисциплина","Редактирование дисциплины","DisciplineEditingValidationTests","CheckDeleteDisciplineWithGrades","Невозможно удалить дисциплину с оценками",""
"passed","Mon Feb 05 05:59:05 UTC 2024","Mon Feb 05 05:59:18 UTC 2024","12479","","Активность","Обычная активность","ActivityAddingTests","CheckAddFileMaterialToActivity","Можно загрузить материал типа Файл с компьютера в активность",""
"passed","Mon Feb 05 06:09:46 UTC 2024","Mon Feb 05 06:09:58 UTC 2024","12647","","Дисциплина","Дисциплина с ИОТ","IOTGraphTests","CheckAddFirstBlock","Страница дисциплины с ИОТ: можно добавить первый блок",""
"passed","Mon Feb 05 06:13:11 UTC 2024","Mon Feb 05 06:13:14 UTC 2024","2070","","Программа","","ProgramEditingTests","CheckRemoveProgramWithNationalProject","Невозможно удалить программу ДО с проектом СЗ",""
"passed","Mon Feb 05 06:11:43 UTC 2024","Mon Feb 05 06:11:49 UTC 2024","6408","","Материал","Конструктор тест-тренажера","TestTrainBlocksAndVariantsValidationTests","EditTestTrainBlockName","Конструктор теста-тренажера: можно переименовать блок",""
"passed","Mon Feb 05 06:11:39 UTC 2024","Mon Feb 05 06:11:56 UTC 2024","16322","","Материал","Конструктор тест-тренажера","TestTrainAddingQuestionsTests","AddQuestionInTestTrain","Конструктор теста-тренажера: можно добавить вопрос с типом ответа “Выбор из вариантов”",""
"passed","Mon Feb 05 06:04:13 UTC 2024","Mon Feb 05 06:04:27 UTC 2024","14531","","Чат","Мини-чат звонка дисциплины","DisciplineRoomChatCallTests","CheckOpenImageInDisciplineRoomCallChat","можно раскрывать изображения",""
"passed","Mon Feb 05 06:02:55 UTC 2024","Mon Feb 05 06:03:04 UTC 2024","9154","","Чат","Групповой чат","GroupChatMessageTests","CheckDiscussToLastMessageotherUsersInGroupChat","Начать обсуждение с другим участником в групповом чате",""
"passed","Mon Feb 05 06:02:45 UTC 2024","Mon Feb 05 06:02:59 UTC 2024","14307","","Чат","Мини-чат звонка дисциплины","DisciplineChatCallTests","CheckFindSentMessageInDisciplineCallChat","можно найти отправленное сообщение",""
"passed","Mon Feb 05 06:09:50 UTC 2024","Mon Feb 05 06:09:55 UTC 2024","5545","","Дисциплина","Создание дисциплины","DisContingentCreationValidationTests","CheckOnlyCohortStudentsAreShownInListOfStudents","В выпадающем списке поля Студенты отображаются только студенты потока при создании дисциплины",""
"passed","Mon Feb 05 06:07:12 UTC 2024","Mon Feb 05 06:07:20 UTC 2024","8691","","Чат","Мини-чат личного чата","PersonalMiniChatTests","CheckSendMessageByTappingEnterInPersonalMiniChat","можно отправить сообщения по нажатию на Enter",""
"passed","Mon Feb 05 06:05:09 UTC 2024","Mon Feb 05 06:05:25 UTC 2024","15793","","Чат","Личный чат","PersonalChatTests","CheckEditLastMessageInPersonalChat","можно редактировать сообщение в течение 4 часов после отправки",""
"passed","Mon Feb 05 06:07:56 UTC 2024","Mon Feb 05 06:07:59 UTC 2024","3192","","Поток","Завершение обучения","EducationCompletionPageTests","CheckTransitionToEducationCompletionPage","Переход со страницы потока на страницу завершения обучения потока",""
"passed","Mon Feb 05 06:05:34 UTC 2024","Mon Feb 05 06:05:44 UTC 2024","9504","","Чат","Мини-чат для заметок","NotesMiniChatTests","CheckSendEmojiInNotesMiniChat","можно отправить смайлики",""
"passed","Mon Feb 05 06:01:45 UTC 2024","Mon Feb 05 06:01:54 UTC 2024","8737","Активность","Контрольная","Результат прохождения теста","TestActivityResultTests","CheckMarkIncorrectTextOrFileAnswer","Можно отметить Неверно в ответе на  вопрос с типом ответа Свободный ответ или Файл",""
"passed","Mon Feb 05 06:13:31 UTC 2024","Mon Feb 05 06:13:40 UTC 2024","8556","","Профиль","","GeneralUserInfoEditingTests","ValidatingUserNameFields","Редактирование профиля пользователя: можно изменить ФИО",""
"passed","Mon Feb 05 06:12:37 UTC 2024","Mon Feb 05 06:12:40 UTC 2024","3444","","Организация","Мой тариф","MyPlanOrganizationPageTests","CheckClosedTableActiveUsers","Страница Мой тариф: проверка закрытия таблицы активных пользователей",""
"passed","Mon Feb 05 06:11:18 UTC 2024","Mon Feb 05 06:11:39 UTC 2024","20710","","Материал","Конструктор теста","TestAddingQuestionsTests","CheckAddQuestionWithFreeAnswerManualCheck","Конструктор теста: можно добавить вопрос с типом ответа “Свободный ответ” - “Ручная проверка”",""
"passed","Mon Feb 05 06:08:29 UTC 2024","Mon Feb 05 06:08:33 UTC 2024","3878","","Дисциплина","Редактирование дисциплины","DisciplineAccessTests","CheckOtherOrgAdminChangeDiscipline","У администратора организации, к которой дисциплина НЕ относится, нет возможности редактирования",""
"passed","Mon Feb 05 06:02:56 UTC 2024","Mon Feb 05 06:03:07 UTC 2024","11337","","Чат","Групповой чат","GroupChatTests","CheckAddQuoteToLastMessageInGroupChat","можно цитировать сообщению",""
"passed","Mon Feb 05 06:17:14 UTC 2024","Mon Feb 05 06:17:29 UTC 2024","14238","","Чат","Мини-чат группового звонка","GroupChatCallTests","CheckOpenImageInGroupCallChat","можно раскрывать изображения",""
"passed","Mon Feb 05 05:59:31 UTC 2024","Mon Feb 05 05:59:40 UTC 2024","9454","Активность","Задание","Создание задания","TaskActivityMulticriteriaTests","CheckCreateTaskWithoutNameOfCriteria","Нельзя создать активность типа Задание с критериями, если не заполнено название критерия",""
"passed","Mon Feb 05 06:10:16 UTC 2024","Mon Feb 05 06:10:20 UTC 2024","3539","","Дисциплина","Редактирование дисциплины","DisContingentEditingValidationTests","CheckIsDisabledCheckboxAllStudentInEditingDiscipline","Галка Все студенты потока задизейблена и невозможно ее снять, если дисциплина относится к Нацпроекту",""
"passed","Mon Feb 05 06:08:01 UTC 2024","Mon Feb 05 06:08:03 UTC 2024","1891","","Поток","Завершение обучения","EducationCompletionPageTests","FindStudentWithName","Поиск студента по ФИО на странице завершения обучения потока",""
"passed","Mon Feb 05 05:59:07 UTC 2024","Mon Feb 05 05:59:11 UTC 2024","3226","Активность","Задание","Страница решения задания для преподавателя","TaskActivityTeacherTests","CheckGradeSolutionWithoutValue","Кнопка Оценить некликабельна, если решение еще не оценено",""
"passed","Mon Feb 05 06:08:44 UTC 2024","Mon Feb 05 06:08:53 UTC 2024","8751","","Дисциплина","Создание дисциплины","DisciplineCreationValidationTests","CheckIfDescriptionNotFilledInCreation","Отображение ошибки валидации для поля 'Описание', если поле не заполнено в ВО",""
"passed","Mon Feb 05 06:08:12 UTC 2024","Mon Feb 05 06:08:17 UTC 2024","4659","","Дисциплина","Страница дисциплины","DisciplineActivitiesBlockTests","CheckCancelAddModule","Отмена создания модуля у дисциплины",""
"passed","Mon Feb 05 06:05:25 UTC 2024","Mon Feb 05 06:05:37 UTC 2024","11968","","Чат","Личный чат","PersonalChatTests","CheckAddQuoteToLastMessageInPersonalChat","можно цитировать сообщению",""
"passed","Mon Feb 05 05:59:55 UTC 2024","Mon Feb 05 05:59:58 UTC 2024","2915","","Активность","Обычный шаблон активности","TemplateAddingTests","CheckScormScoreFieldNotDisplayed","Отсутствует поле Оценка по SCORM результату, если SCORM пакет не добавлен в шаблон активности",""
"passed","Mon Feb 05 06:10:33 UTC 2024","Mon Feb 05 06:10:45 UTC 2024","12088","","Дисциплина","Дисциплина с ИОТ","IOTGraphTests","CheckAddChildBlockBetweenBlocks","Страница дисциплины с ИОТ: между блоками можно добавить ещё один дочерний блок",""
"passed","Mon Feb 05 06:04:02 UTC 2024","Mon Feb 05 06:04:16 UTC 2024","14315","","Чат","Мини-чат группового чата","GroupMiniChatTests+ChatEditing","CheckRestoreGroupChatFromArchiveInMinichat","можно восстановить чат из архива",""
"passed","Mon Feb 05 06:09:06 UTC 2024","Mon Feb 05 06:09:09 UTC 2024","3305","","Дисциплина","Страница дисциплины","DisciplineRightMenuTests","CheckOpenDisciplineChatFromDisPage","Можно открыть мини-чат нажав кнопку ‘Открыть чат дисциплины’",""
"passed","Mon Feb 05 05:59:40 UTC 2024","Mon Feb 05 05:59:50 UTC 2024","9998","Активность","Задание","Создание задания","TaskActivityMulticriteriaTests","CheckCreateTaskWithoutPointOfCriteria","Нельзя создать активность типа Задание с критериями, если не заполнен балл критерия",""
"passed","Mon Feb 05 06:09:08 UTC 2024","Mon Feb 05 06:09:22 UTC 2024","14556","","Дисциплина","Создание дисциплины","DisContingentCreationTests","CheckAddTeacherByUserInfoInCreation","Добавление преподавателя из списка",""
"passed","Mon Feb 05 06:08:48 UTC 2024","Mon Feb 05 06:08:55 UTC 2024","7151","","Дисциплина","Страница дисциплины","DisciplineMarksAndAttendanceTests","CheckFinalGradesByTeacher","Проверка работы кнопки ‘Итоговые оценки (ведомость)’ у преподавателя",""
"passed","Mon Feb 05 06:09:38 UTC 2024","Mon Feb 05 06:09:41 UTC 2024","2833","","Дисциплина","Создание дисциплины","DisContingentCreationValidationTests","CheckIsDisabledCheckboxAllStudentInCreatingDiscipline","Чекбокс ‘Все студенты потока’ задизейблен и его невозможно снять",""
"passed","Mon Feb 05 06:05:20 UTC 2024","Mon Feb 05 06:05:25 UTC 2024","5198","","Чат","Мини-чат группового чата","GroupMiniChatTests","CheckOpenImageInGroupMiniChat","можно раскрывать изображения",""
"passed","Mon Feb 05 06:06:43 UTC 2024","Mon Feb 05 06:06:49 UTC 2024","5719","","Поток","Создание потока","CohortCreationValidationTests","CheckCreateCohortIfEachDateNotFilled","Создание потока: ошибка валидации, если дата окончания  не указана",""
"passed","Mon Feb 05 06:03:17 UTC 2024","Mon Feb 05 06:03:28 UTC 2024","10726","","Чат","Мини-чат дисциплины","DisciplineMiniChatTests","CheckSendMessageByTappingEnterInDisciplineMiniChat","можно отправить сообщения по нажатию на Enter",""
"passed","Mon Feb 05 06:13:52 UTC 2024","Mon Feb 05 06:14:02 UTC 2024","9984","","Биржа","","StockMarketLotTests","PurchaseLotByTeacher","Страница лота: преподаватель может приобрести материал на Бирже",""
"passed","Mon Feb 05 06:01:52 UTC 2024","Mon Feb 05 06:02:11 UTC 2024","18126","","Чат","Мини-чат дисциплины","DisciplineMiniChatTests","CheckEditLastMessageInDisciplineMiniChat","можно редактировать сообщение в течение 4 часов после отправки",""
"passed","Mon Feb 05 06:07:07 UTC 2024","Mon Feb 05 06:07:12 UTC 2024","4915","","Чат","Мини-чат личного чата","PersonalMiniChatTests","CheckOpenImageInPersonalMiniChat","можно раскрывать изображения",""
"passed","Mon Feb 05 06:10:21 UTC 2024","Mon Feb 05 06:10:35 UTC 2024","14333","","Дисциплина","Редактирование дисциплины","DisContingentEditingTests","CheckAddGroupAndStudentToDiscipline","Добавления к дисциплине групп и студентов",""
"passed","Mon Feb 05 06:00:12 UTC 2024","Mon Feb 05 06:00:17 UTC 2024","4585","Активность","Контрольная","Редактирование контрольной","TestActivityEditingTests","CheckErrorInNumOfAttemptsFieldWithIncorrectValue","Ошибка валидации в поле Количество попыток сдачи, если введено отрицательное значение",""
"passed","Mon Feb 05 06:01:59 UTC 2024","Mon Feb 05 06:02:12 UTC 2024","13176","","Чат","Мини-чат дисциплины","DisciplineRoomMiniChatTests","CheckSendTextMessageInDisciplineRoomMiniChat","можно отправить текстовое сообщение",""
"passed","Mon Feb 05 06:03:38 UTC 2024","Mon Feb 05 06:03:56 UTC 2024","18227","","Чат","Дисциплина","DisciplineRoomChatTests","CheckPinLastMessageInDisciplineRoomChat","можно закреплять сообщения",""
"passed","Mon Feb 05 06:12:11 UTC 2024","Mon Feb 05 06:12:20 UTC 2024","9153","","Материал","Конструктор теста","TestSettingsValidationTests","ClearTagsFromTest","Конструктор теста: можно удалить теги знаний",""
"passed","Mon Feb 05 06:10:07 UTC 2024","Mon Feb 05 06:10:09 UTC 2024","1816","","Подразделения","Редактирование подразделения","DivisionEditingTests","CheckDeleteDivisionType","Нет возможности удалить значение в поле Тип",""
"passed","Mon Feb 05 06:02:08 UTC 2024","Mon Feb 05 06:02:40 UTC 2024","32465","","Чат","Мини-чат дисциплины","DisciplineRoomMiniChatTests+ChatEditing","CheckChangeDisciplineChatRoomStatusInMinichat","Можно изменить доступ к комнате",""
"passed","Mon Feb 05 06:10:20 UTC 2024","Mon Feb 05 06:10:21 UTC 2024","1394","","Подразделения","Страница подразделения","DivisionPageTests","CheckTransitionToDivEditPage","Работает кнопка Редактировать на странице подразделения",""
"passed","Mon Feb 05 06:05:22 UTC 2024","Mon Feb 05 06:05:33 UTC 2024","10935","","Чат","Мини-чат личного чата","PersonalMiniChatTests","CheckSendTextMessageInPersonalMiniChat","можно отправить текстовое сообщение",""
"passed","Mon Feb 05 06:11:29 UTC 2024","Mon Feb 05 06:11:35 UTC 2024","5725","","Библиотека","","LibraryActionPanelTests","CheckChangeViewOfLibraryInTileView","Библиотека: можно переключать текущий вид библиотеки со “Списка” на “Плитку”",""
"passed","Mon Feb 05 06:03:10 UTC 2024","Mon Feb 05 06:03:18 UTC 2024","7296","","Чат","Дисциплина","DisciplineRoomChatTests","CheckSendFileMessageInDisciplineRoomChat","можно прикрепить и отправить файл с компьютера",""
"passed","Mon Feb 05 06:06:57 UTC 2024","Mon Feb 05 06:07:07 UTC 2024","9578","","Чат","Мини-чат личного чата","PersonalMiniChatTests","CheckSendFileMessageInPersonalMiniChat","можно прикрепить и отправить файл с компьютера",""
"passed","Mon Feb 05 06:07:39 UTC 2024","Mon Feb 05 06:07:43 UTC 2024","3823","","Поток","Страница потока","CohortInfoTests","CheckWindowsSendCohortArchive","Страница потока: при архивации потока появляется модалка подтверждения действия",""
"passed","Mon Feb 05 06:12:19 UTC 2024","Mon Feb 05 06:12:25 UTC 2024","5460","","Материал","Конструктор теста","TestQuestionAnswersValidationTests","CheckRemoveAnswerFromSortingQuestion","Конструктор теста: можно удалить опцию из вопроса с типом ответа 'Сортировка'",""
"passed","Mon Feb 05 06:11:44 UTC 2024","Mon Feb 05 06:11:54 UTC 2024","9375","","Материал","Конструктор теста","TestBlocksAndVariantsValidationTests","CheckMigrateTestQuestion","Конструктор теста: можно перенести вопрос в другой вариант",""
"passed","Mon Feb 05 06:01:00 UTC 2024","Mon Feb 05 06:01:10 UTC 2024","10413","Активность","Контрольная","Результат прохождения теста","TestActivityResultTests","CheckTeacherCanLeaveCommentOnAnswer","Преподаватель может изменить комментарий к ответу, если была отмечена галка Отображать студентам подробную информацию о результатах",""
"passed","Mon Feb 05 06:08:40 UTC 2024","Mon Feb 05 06:08:44 UTC 2024","3854","","Дисциплина","Редактирование дисциплины","DisciplineEditingValidationTests","CheckIfNameNotFilledInEditing","Отображение ошибки валидации для поля Название, если поле не заполнено в дисциплине ДО",""
"passed","Mon Feb 05 06:01:42 UTC 2024","Mon Feb 05 06:02:11 UTC 2024","29678","","Звонок","","CallTests","CheckGreenFrameIsDisplayedOnAnotherUsersCard","Страница звонка: отображается зеленая рамка у карточки собеседника при разговоре",""
"passed","Mon Feb 05 06:02:09 UTC 2024","Mon Feb 05 06:02:27 UTC 2024","18424","","Чат","Мини-чат звонка дисциплины","DisciplineRoomChatCallTests","CheckSendEmptyMessageInDisciplineRoomCallChat","невозможно отправить пустое сообщение",""
"passed","Mon Feb 05 06:13:48 UTC 2024","Mon Feb 05 06:13:55 UTC 2024","7631","","Профиль","","UserInfoPageTests","CheckIfUserPhotoCanBeDeleted","Страница профиля пользователя: можно удалить фото",""
"passed","Mon Feb 05 06:04:01 UTC 2024","Mon Feb 05 06:04:19 UTC 2024","18389","","Чат","Мини-чат группового чата","GroupMiniChatTests","CheckEditLastMessageInGroupMiniChat","можно редактировать сообщение в течение 4 часов после отправки",""
