"Status","Start Time","Stop Time","Duration in ms","Parent Suite","Suite","Sub Suite","Test Class","Test Method","Name","Description"
"passed","Wed Aug 16 04:39:55 UTC 2023","Wed Aug 16 04:40:07 UTC 2023","12831","","Дисциплина","Создание дисциплины","DisContingentCreationTests","CheckAddTeacherByUserInfoInCreation","Создание дисциплины: добавление преподавателя из списка",""
"passed","Wed Aug 16 04:38:23 UTC 2023","Wed Aug 16 04:38:24 UTC 2023","1393","","Поток","","CohortCreationValidationTests","CheckCreateCohortBySelectingCheckboxRegistrationLinkInProgramNatDemography","Создание потока ДО (СЗ): нет возможности выбрать галку ‘Разрешена регистрация по ссылке’",""
"failed","Wed Aug 16 04:34:54 UTC 2023","Wed Aug 16 04:34:55 UTC 2023","537","","Активность","Контрольная активность","TestActivityStatusWithTwoOrMoreAttemptsTests","ResultOfPassingDependOnSettings","Страница индивидуальной контрольной: результат тестирования из попытках зависеть от настройки 'За последнюю попытку'",""
"passed","Wed Aug 16 04:35:28 UTC 2023","Wed Aug 16 04:35:34 UTC 2023","6342","","Активность","Шаблон активности контрольной","TestTemplateEditingTests","CheckEditValueScormResultScoreInTemplate","Редактирование шаблона контрольной: можно переключать значения в поле 'Оценка по SCORM результату'",""
"passed","Wed Aug 16 04:33:19 UTC 2023","Wed Aug 16 04:33:27 UTC 2023","7893","","Активность","Обычная активность","ActivityEditingTests","CheckEditDescriptionActivity","Редактирование активности: можно изменить описание",""
"passed","Wed Aug 16 04:35:35 UTC 2023","Wed Aug 16 04:35:50 UTC 2023","15450","","Чат","Мини-чат для заметок","NotesMiniChatTests","CheckEditLastMessageInNotesMiniChat","Миничат - чат для заметок: можно редактировать сообщение в течение 4 часов после отправки",""
"passed","Wed Aug 16 04:34:28 UTC 2023","Wed Aug 16 04:34:36 UTC 2023","7305","","Активность","Контрольная активность","TestActivityPassingTests","PassingTest","Прохождения теста: командная контрольная",""
"passed","Wed Aug 16 04:42:27 UTC 2023","Wed Aug 16 04:42:34 UTC 2023","7163","","Материал","Конструктор теста","TestSettingsValidationTests","EditTestPointsLimit","Конструктор теста: можно изменить минимальный порог баллов",""
"passed","Wed Aug 16 04:39:30 UTC 2023","Wed Aug 16 04:39:39 UTC 2023","8463","","Дисциплина","Страница дисциплины","DisciplineMarksAndAttendanceTests","CheckFinalGradesByTeacher","Страница оценок дисциплины: работает кнопка 'Итоговые оценки (ведомость)' у преподавателя",""
"passed","Wed Aug 16 04:37:19 UTC 2023","Wed Aug 16 04:37:26 UTC 2023","6614","","Поток","","CohortCreationValidationTests","CheckCreateCohortIfNameNotFilled","Создание потока: ошибка валидации, если название не указано",""
"passed","Wed Aug 16 04:33:33 UTC 2023","Wed Aug 16 04:33:48 UTC 2023","15353","","Активность","Обычная активность","ActivityCreatingTests","CheckCreateActivityFromTemplate","Cоздание активности: можно создать активность из шаблона",""
"passed","Wed Aug 16 04:33:56 UTC 2023","Wed Aug 16 04:34:01 UTC 2023","5028","","Активность","Обычная активность","ActivityEditingTests+ActivityDurationTests","CheckEditVolumeActivityWithIncorrectValues","Редактирование активности: отображение ошибки валидации для поля 'Объём' с значением '0'",""
"passed","Wed Aug 16 04:43:00 UTC 2023","Wed Aug 16 04:43:02 UTC 2023","2166","","Программа","","ProgramCreationTests","AddEducationProgaramWithError","Cоздание обр программы ДПО: если не заполнить одно обязательное поле",""
"passed","Wed Aug 16 04:33:27 UTC 2023","Wed Aug 16 04:33:37 UTC 2023","10431","","Активность","Обычная активность","ActivityEditingTests+ActivityDurationTests","CheckIfStartDateEmptyInAcivity","Редактирование активности: успешное сохранение, если заполнена только дата окончания",""
"passed","Wed Aug 16 04:33:48 UTC 2023","Wed Aug 16 04:33:51 UTC 2023","3680","","Активность","Обычный шаблон активности","TemplateEditingTests","CheckEditActivityTemplate","Редактирование шаблона активности: работает кнопка 'Редактировать' для преподавателя",""
"passed","Wed Aug 16 04:40:43 UTC 2023","Wed Aug 16 04:41:07 UTC 2023","23700","","Дисциплина","Дисциплина с ИОТ","IOTThemesAndModulesTests","CheckCreateTopicOrActivityInsideModule","Страница дисциплины с ИОТ: внутри модуля можно создать темы или активности",""
"passed","Wed Aug 16 04:33:54 UTC 2023","Wed Aug 16 04:34:00 UTC 2023","6008","","Активность","Обычный шаблон активности","TemplateEditingValidationTests","CheckNegativeEditVolumeActivityTemplate","Редактирование шаблона активности: отображение ошибки валидации для поля 'Объём' с отрицательным значением",""
"passed","Wed Aug 16 04:41:24 UTC 2023","Wed Aug 16 04:41:48 UTC 2023","24275","","Дисциплина","Дисциплина с ИОТ","IOTThemesAndModulesTests","CheckCreateActivityInsideTopic","Страница дисциплины с ИОТ: внутри темы можно создать активность",""
"passed","Wed Aug 16 04:36:11 UTC 2023","Wed Aug 16 04:36:17 UTC 2023","6431","","Чат","Чат для заметок","NotesChatTests","CheckSendMessageByTappingEnterInNotesChat","Список чатов - чат для заметок: можно отправить сообщения по нажатию на Enter",""
"passed","Wed Aug 16 04:43:15 UTC 2023","Wed Aug 16 04:43:41 UTC 2023","26883","","Материал","Конструктор теста","TestAddingQuestionsTests","AddComparisonTestQuestion","Конструктор теста: можно добавить вопрос с типом ответа 'Сопоставление'",""
"passed","Wed Aug 16 04:39:56 UTC 2023","Wed Aug 16 04:39:59 UTC 2023","3637","","Дисциплина","Страница дисциплины","DisciplineStudentTests","CheckGradingByStudent","Страница оценок дисциплины: невозможности выставления оценки студентом",""
"passed","Wed Aug 16 04:33:47 UTC 2023","Wed Aug 16 04:33:56 UTC 2023","8706","","Активность","Задание","TaskActivityTeacherTests","CheckGradeSolutionIncorrectValues","Страница решение задания: отображение ошибки валидации для поля баллы с отрицательным значением",""
"passed","Wed Aug 16 04:40:45 UTC 2023","Wed Aug 16 04:40:51 UTC 2023","5866","","Дисциплина","Страница дисциплины","DisciplineAnalyticsTests","CheckStudentActivityGraphIsDisplayed","Страница аналитика дисциплины: отображается график действия студента",""
"passed","Wed Aug 16 04:39:56 UTC 2023","Wed Aug 16 04:40:00 UTC 2023","4310","","Дисциплина","Редактирование дисциплины","DisciplineEditingTests","CheckClearAddedTagsFromDiscipline","Редактирование дисциплины: можно очистить теги знаний",""
"passed","Wed Aug 16 04:40:44 UTC 2023","Wed Aug 16 04:40:47 UTC 2023","3531","","Дисциплина","Редактирование дисциплины","DisContingentEditingValidationTests","CheckIsDisabledCheckboxAllStudentInEditingDiscipline","Редактирование дисциплины: галка ‘Все студенты потока’ дизаблена и невозможно его снять, если дисциплина относится к нацпроекту",""
"passed","Wed Aug 16 04:41:08 UTC 2023","Wed Aug 16 04:41:21 UTC 2023","12304","","Материал","Конструктор теста","TestBlocksAndVariantsValidationTests","AddTestVariant","Конструктор теста: можно добавить вариант",""
"passed","Wed Aug 16 04:43:18 UTC 2023","Wed Aug 16 04:43:22 UTC 2023","3934","","Университет","","UniversityTests","OpenRatePage","Страница университета: переход на страницу Мой тариф",""
"passed","Wed Aug 16 04:36:29 UTC 2023","Wed Aug 16 04:36:44 UTC 2023","14440","","Чат","Мини-чат личного чата","PersonalMiniChatTests","CheckCallInPersonalMiniChat","Миничат - личный чат: можно сделать звонок",""
"passed","Wed Aug 16 04:36:18 UTC 2023","Wed Aug 16 04:36:21 UTC 2023","2676","","Чат","Мини-чат для заметок","NotesMiniChatTests","CheckOpenImageInNotesMiniChat","Миничат - чат для заметок: можно раскрывать изображения",""
"passed","Wed Aug 16 04:33:42 UTC 2023","Wed Aug 16 04:33:44 UTC 2023","1539","","Активность","Обычная активность","ActivityEditingTests+ActivityAddingTests","CheckAbsenceScormScoreField","Редактирование активности: отсутствия поля оценка по SCORM результату, если не добавлен SCORM пакет",""
"passed","Wed Aug 16 04:38:08 UTC 2023","Wed Aug 16 04:38:15 UTC 2023","7100","","Чат","Мини-чат страницы решений","TaskPageMiniChatTests","CheckSendFileMessageInTaskPageMiniChat","Чат обсуждение решения: можно прикрепить и отправить файл с компьютера",""
"passed","Wed Aug 16 04:38:51 UTC 2023","Wed Aug 16 04:38:55 UTC 2023","4650","","Поток","","CohortInfoTests","CheckAccessStudentToActivityCohortArchive","Страница потока: После восстановлении из архива восстанавливается доступ",""
"passed","Wed Aug 16 04:34:05 UTC 2023","Wed Aug 16 04:34:08 UTC 2023","3435","","Активность","Обычная активность","ActivityEditingTests","CheckOnRatingActivity","Страница редактирование активности: Проверка вкл выставления оценки за активность",""
"passed","Wed Aug 16 04:36:03 UTC 2023","Wed Aug 16 04:36:14 UTC 2023","10704","","Чат","Личный чат","PersonalChatTests","CheckAddQuoteToLastMessageInPersonalChat","Список чатов - личный чат: можно цитировать сообщению",""
"passed","Wed Aug 16 04:43:39 UTC 2023","Wed Aug 16 04:43:48 UTC 2023","9115","","Материал","Конструктор тест-тренажера","TestTrainSettingsValidationTests","EditTestTrainStudyTime","Конструктор теста-тренажера: можно изменить время изучения",""
"passed","Wed Aug 16 04:40:24 UTC 2023","Wed Aug 16 04:40:43 UTC 2023","19638","","Дисциплина","Дисциплина с ИОТ","IOTThemesAndModulesTests","CheckCannotCreateModuleInsideModule","Страница дисциплины с ИОТ: внутри модуля нельзя создать модуль",""
"passed","Wed Aug 16 04:38:17 UTC 2023","Wed Aug 16 04:38:41 UTC 2023","23783","","Чат","Мини-чат группового звонка","GroupChatCallTests","CheckPinLastMessageInGroupCallChat","Миничат звонка - групповой чат: можно закреплять сообщения",""
"passed","Wed Aug 16 04:33:01 UTC 2023","Wed Aug 16 04:33:11 UTC 2023","10276","","Активность","Задание","TaskActivityCreatingTests","CheckCreateTaskActivity","Создание задания: можно создать задание, если заполнены все обязательные поля",""
"passed","Wed Aug 16 04:34:56 UTC 2023","Wed Aug 16 04:35:04 UTC 2023","8080","","Активность","Контрольная активность","TestActivityStatusWithOneAttemptTests","CheckStatusScoreColorAndIcon","Страница индивидуальной контрольной: статус и цвет у количества баллов в попытке различаются в зависимости от успешности",""
"passed","Wed Aug 16 04:33:31 UTC 2023","Wed Aug 16 04:33:46 UTC 2023","14562","","Активность","Обычный шаблон активности","TemplateAddingTests","CheckAddMaterialFromLibraryActivityTemplate","Редактирование шаблона активности: можно добавить материал типа текст из библиотеки",""
"passed","Wed Aug 16 04:33:58 UTC 2023","Wed Aug 16 04:34:13 UTC 2023","14979","","Активность","Обычный шаблон активности","TemplateAddingTests","CheckAddTestSimulatorNotInControlTypeTemplate","Редактирование шаблона активности: можно добавить материал типа тест-тренажёра из библиотеки не в контрольную",""
"passed","Wed Aug 16 04:36:48 UTC 2023","Wed Aug 16 04:37:04 UTC 2023","15595","","Чат","Мини-чат личного звонка","PersonalChatCallTests","CheckFindSentMessageInPersonalCallChat","Миничат звонка - личный чат: можно найти отправленное сообщение",""
"passed","Wed Aug 16 04:34:52 UTC 2023","Wed Aug 16 04:34:56 UTC 2023","4202","","Активность","Контрольная активность","TestActivityEditingTests","ErrorWithNegativeValueInMinThreshold","Редактирование контрольной: ошибка валидации при отрицательным значением в 'Минимальный порог баллов'",""
"passed","Wed Aug 16 04:42:20 UTC 2023","Wed Aug 16 04:42:48 UTC 2023","28382","","Библиотека","","LibraryInListViewTests","CheckMoveMaterialViaActionsButton","Библиотека, списочный вид: можно переместить материал через actions-кнопки",""
"failed","Wed Aug 16 04:34:59 UTC 2023","Wed Aug 16 04:35:08 UTC 2023","9056","","Чат","Дисциплина","DisciplineChatTests","CheckSendTextMessageInDisciplineChat","Список чатов - комната дисциплины: можно отправить текстовое сообщение",""
"passed","Wed Aug 16 04:36:43 UTC 2023","Wed Aug 16 04:36:52 UTC 2023","8979","","Чат","Чат для заметок","NotesChatTests","CheckDeleteMessageInNotesChat","Список чатов - чат для заметок: можно удалить сообщение",""
"passed","Wed Aug 16 04:39:37 UTC 2023","Wed Aug 16 04:39:43 UTC 2023","6217","","Дисциплина","Страница дисциплины","DisciplineStudentTests","CheckPinDisciplineForStudent","Страница дисциплины: работает кнопка 'Закрепить в главном меню' у студента",""
"passed","Wed Aug 16 04:37:04 UTC 2023","Wed Aug 16 04:37:24 UTC 2023","20142","","Чат","Мини-чат группового звонка","GroupChatCallTests","CheckSendFileMessageInGroupCallChat","Миничат звонка - групповой чат: можно прикрепить и отправить файл с компьютера",""
"passed","Wed Aug 16 04:41:29 UTC 2023","Wed Aug 16 04:41:37 UTC 2023","8088","","Материал","Конструктор теста","TestBlocksAndVariantsValidationTests","DuplicateTestVariant","Конструктор теста: можно дублировать вариант",""
"passed","Wed Aug 16 04:39:39 UTC 2023","Wed Aug 16 04:39:51 UTC 2023","12297","","Дисциплина","Страница дисциплины","DisciplineMarksAndAttendanceTests","CheckGradingByTeacher","Страница оценок дисциплины: выставления оценки преподавателем",""
"passed","Wed Aug 16 04:43:42 UTC 2023","Wed Aug 16 04:43:46 UTC 2023","4019","","Профиль","","GeneralUserInfoEditingTests","CheckSwitchToOwnTransliteration","Редактирование профиля пользователя: можно включить транслитерацию",""
"passed","Wed Aug 16 04:38:30 UTC 2023","Wed Aug 16 04:38:41 UTC 2023","11119","","Чат","Мини-чат решения","TaskMiniChatTests","CheckSendMessageByTappingEnterInTaskMiniChat","Миничат - обсуждение решения: можно отправить сообщения по нажатию на Enter",""
"passed","Wed Aug 16 04:41:23 UTC 2023","Wed Aug 16 04:41:38 UTC 2023","14975","","Библиотека","","LibraryActionPanelTests","CheckAddFileToLibrary","Библиотека, плиточный вид: можно загрузить материал типа “Файл” с компьютера",""
"passed","Wed Aug 16 04:43:03 UTC 2023","Wed Aug 16 04:43:08 UTC 2023","5114","","Программа","","ProgramInfoPageTests","CheckNoAccessStudentToMaterialsEducationalProgramArchive","Страница обр программы: Студенты не имеют доступ к материалам архивной обр программы по прямой ссылки ",""
"passed","Wed Aug 16 04:34:04 UTC 2023","Wed Aug 16 04:34:12 UTC 2023","7936","","Активность","Контрольная активность","TestActivityCreatingTests","CreateTestActivity","Создание контрольной: если заполнены обязательные поля",""
"passed","Wed Aug 16 04:43:13 UTC 2023","Wed Aug 16 04:43:19 UTC 2023","6367","","Расписание","","ScheduleTests","CheckMemoryModeSchedule","Страница расписания: проверка запоминания выбора режима расписания",""
"passed","Wed Aug 16 04:39:06 UTC 2023","Wed Aug 16 04:39:10 UTC 2023","3533","","Дисциплина","Настройка чата дисциплины","DisciplineChatBlockTests","CheckNotAccessOpenChatDiscipline","Страница дисциплины: отсутствия доступа к кнопке 'Открыть чат дисциплины', если чат дисциплины заблокирован",""
"passed","Wed Aug 16 04:39:16 UTC 2023","Wed Aug 16 04:39:26 UTC 2023","10551","","Дисциплина","Создание дисциплины","DisciplineCreationTests","CreatDisciplineIfReqFieldsAreFilled","Создание дисциплины ДО: можно создать дисциплину, если заполнены обязательные поля",""
"passed","Wed Aug 16 04:34:49 UTC 2023","Wed Aug 16 04:35:03 UTC 2023","14574","","Активность","Шаблон активности контрольной","TestTemplateAddingTests","AddTestToTestActivityTemplate","Редактирование шаблона контрольной: можно добавить материал типа тест из библиотеки",""
"passed","Wed Aug 16 04:33:36 UTC 2023","Wed Aug 16 04:33:45 UTC 2023","8920","","Активность","Задание","TaskWithSolutionStudentTests","CheckAbilityToEditAssessmentOfAnotherStudentsSolution","Страница решение задания: можно редактировать поставленную оценку к решении другого студента, если включена 'Взаимопроверка'",""
"passed","Wed Aug 16 04:34:45 UTC 2023","Wed Aug 16 04:34:51 UTC 2023","5786","","Активность","Шаблон активности контрольной","TestTemplateEditingTests","ErrorWithIncorrectValueNumberOfAttemptsInTestActivityTemplate","Редактирование шаблона контрольной: отображение ошибки валидации для поля 'Количество попыток сдачи' с отрицательным значением",""
"passed","Wed Aug 16 04:40:32 UTC 2023","Wed Aug 16 04:40:39 UTC 2023","7749","","Дисциплина","Дисциплина с ИОТ","IOTDisciplineCreationTests","CheckCreatDisciplineWithIOT","Создание дисциплины ДО: можно создать дисциплину с ИОТ",""
"passed","Wed Aug 16 04:34:12 UTC 2023","Wed Aug 16 04:34:16 UTC 2023","4087","","Активность","Контрольная активность","TestActivityEditingTests","ErrorWithIncorrectValueNumberOfAttemptsInTestActivity","Редактирование контрольной: отображение ошибки валидации для поля 'Количество попыток сдачи' с отрицательным значением",""
"passed","Wed Aug 16 04:41:04 UTC 2023","Wed Aug 16 04:41:07 UTC 2023","2264","","Библиотека","","StudentLibraryTests","CheckStudentNotAllowedPutContentInStock","Страница материала: студенту недоступно выставление своего материала на Биржу",""
"passed","Wed Aug 16 04:43:21 UTC 2023","Wed Aug 16 04:43:29 UTC 2023","7652","","Материал","Конструктор тест-тренажера","TestTrainSettingsValidationTests","ChangeLevelAssimilationInTestTrainTag","Конструктор теста-тренажера: можно изменить уровень усвоения в добавленном теге знаний",""
"passed","Wed Aug 16 04:41:30 UTC 2023","Wed Aug 16 04:41:42 UTC 2023","12110","","Материал","Конструктор теста","TestQuestionsValidationTests","AddCommentInTestQuestion","Конструктор теста: можно добавить комментария к вопросу",""
"passed","Wed Aug 16 04:36:28 UTC 2023","Wed Aug 16 04:36:34 UTC 2023","6112","","Чат","Чат решения","TaskChatTests","CheckSendFileMessageInTaskChat","Список чатов - обсуждение решения: можно прикрепить и отправить файл с компьютера",""
"passed","Wed Aug 16 04:40:39 UTC 2023","Wed Aug 16 04:40:44 UTC 2023","4729","","Подразделения","","DivisionCommonTests","CreateDivisionAllRequiredFields","Cоздание подразделения заполнить все поля",""
"passed","Wed Aug 16 04:36:00 UTC 2023","Wed Aug 16 04:36:08 UTC 2023","7582","","Активность","Контрольная активность","TestActivityResultTests","CheckMarkIncorrectTextOrFileAnswer","Результат прохождения теста: можно отметить 'Не верно' ответ вопроса с типом ответа свободный ответ или файл",""
"passed","Wed Aug 16 04:36:40 UTC 2023","Wed Aug 16 04:37:04 UTC 2023","24355","","Чат","Мини-чат группового звонка","GroupChatCallTests","CheckSendEmojiInGroupCallChat","Миничат звонка - групповой чат: можно отправить смайлики",""
"passed","Wed Aug 16 04:42:59 UTC 2023","Wed Aug 16 04:43:08 UTC 2023","9299","","Биржа","","LotCreationTests","PostMaterialOnStock","Страница материала: преподаватель может выставить материал на биржу",""
"passed","Wed Aug 16 04:40:26 UTC 2023","Wed Aug 16 04:40:35 UTC 2023","8489","","Дисциплина","Создание дисциплины","DisciplineCreationValidationTests","CheckIfCreditValuesNotAllowed","Создание дисциплины ДО: отображение ошибки валидации для поля 'Кредиты' с значением > 15",""
"passed","Wed Aug 16 04:40:01 UTC 2023","Wed Aug 16 04:40:15 UTC 2023","13999","","Дисциплина","Редактирование дисциплины","DisContingentEditingTests","CheckAddTeacherByUserInfoInEditing","Редактирование дисциплины: добавление преподавателя по email’у",""
"passed","Wed Aug 16 04:41:21 UTC 2023","Wed Aug 16 04:41:29 UTC 2023","8322","","Материал","Конструктор теста","TestBlocksAndVariantsValidationTests","RenameTestVariant","Конструктор теста: можно переименовать вариант",""
"passed","Wed Aug 16 04:41:06 UTC 2023","Wed Aug 16 04:41:34 UTC 2023","28370","","Материал","Конструктор теста","TestAddingQuestionsTests","AddMultipleChoiceTestQuestion","Конструктор теста: можно добавить вопрос с типом ответа 'Выбор из вариантов'",""
