"Status","Start Time","Stop Time","Duration in ms","Parent Suite","Suite","Sub Suite","Test Class","Test Method","Name","Description"
"passed","Mon Feb 05 06:04:08 UTC 2024","Mon Feb 05 06:04:29 UTC 2024","20640","","Чат","Мини-чат звонка дисциплины","DisciplineChatCallTests","CheckAddReactionToLastMessageInDisciplineCallChat","можно добавить реакцию на сообщение",""
"passed","Mon Feb 05 06:04:19 UTC 2024","Mon Feb 05 06:04:35 UTC 2024","16040","","Чат","Мини-чат группового чата","GroupMiniChatTests","CheckAddQuoteToLastMessageInGroupMiniChat","можно цитировать сообщению",""
"passed","Mon Feb 05 06:09:44 UTC 2024","Mon Feb 05 06:09:55 UTC 2024","10931","","Дисциплина","Шаблон дисциплины","DisTemplateTests","CheckCreateDisTemplateWithFillingAllFields","Можно создать шаблон дисциплины, если заполнены все поля",""
"passed","Mon Feb 05 06:09:49 UTC 2024","Mon Feb 05 06:09:59 UTC 2024","10009","","Дисциплина","Создание дисциплины","DisContingentCreationTests","CheckCreateDisciplineByUncheckingBoxAllCohortStudents","Можно создать дисциплину, отключив чекбокс ‘Все студенты потока’",""
"passed","Mon Feb 05 06:12:45 UTC 2024","Mon Feb 05 06:13:06 UTC 2024","20790","","Материал","Конструктор теста","TestAddingQuestionsTests","CheckAddComparisonTestQuestion","Конструктор теста: можно добавить вопрос с типом ответа “Сопоставление”",""
"passed","Mon Feb 05 06:09:53 UTC 2024","Mon Feb 05 06:10:02 UTC 2024","8709","","Дисциплина","Дисциплина с ИОТ","IOTDisciplineCreationTests","CheckCreatDisciplineWithIOT","Можно создать дисциплину ДО с ИОТ",""
"passed","Mon Feb 05 06:09:44 UTC 2024","Mon Feb 05 06:09:50 UTC 2024","5410","","Дисциплина","Создание дисциплины","DisContingentCreationValidationTests","CheckOnlyCohortGroupsAreShownInListOfGroups","В выпадающем списке поля Группы отображаются только группы потока при создании дисциплины",""
"passed","Mon Feb 05 06:08:08 UTC 2024","Mon Feb 05 06:08:19 UTC 2024","11542","","Дисциплина","Создание дисциплины","DisciplineCreationTests","CreatDisciplineIfReqFieldsAreFilled","Можно создать дисциплину ВО, если заполнены обязательные поля",""
"passed","Mon Feb 05 06:03:20 UTC 2024","Mon Feb 05 06:03:28 UTC 2024","7566","","Чат","Дисциплина","DisciplineRoomChatTests","CheckSendMessageByTappingEnterInDisciplineRoomChat","можно отправить сообщения по нажатию на Enter",""
"passed","Mon Feb 05 06:02:55 UTC 2024","Mon Feb 05 06:03:18 UTC 2024","23657","","Чат","Мини-чат звонка дисциплины","DisciplineRoomChatCallTests","CheckAddQuoteToLastMessageInDisciplineRoomCallChat","можно цитировать сообщению",""
"passed","Mon Feb 05 06:17:15 UTC 2024","Mon Feb 05 06:17:20 UTC 2024","5266","","Чат","Чат для заметок","NotesChatTests","CheckFindSentMessageInNotesChat","Можно найти отправленное сообщение в чате для заметок",""
"passed","Mon Feb 05 05:59:05 UTC 2024","Mon Feb 05 05:59:25 UTC 2024","19790","","Активность","Обычная активность","ActivityContentVisibilityTests","CheckVisibilityMaterialDuringActivity","Видимость материала во время проведения активности",""
"passed","Mon Feb 05 06:01:06 UTC 2024","Mon Feb 05 06:01:27 UTC 2024","20446","Активность","Контрольная","Прохождение теста","TestActivityStatusWithTwoOrMoreAttemptsTests","CheckResultOfPassingDependOnSettings","Результат тестирования в попытках зависит от настройки За лучшую попытку в командной контрольной",""
"passed","Mon Feb 05 06:00:36 UTC 2024","Mon Feb 05 06:00:46 UTC 2024","9882","Активность","Контрольная","Прохождение теста","TestActivityStatusWithTwoOrMoreAttemptsTests","CheckStatusExistIfAtLeastOneCompletedAttempt","Статус отображается, если есть хотя бы одна завершенная попытка в командной контрольной",""
"passed","Mon Feb 05 06:01:13 UTC 2024","Mon Feb 05 06:01:15 UTC 2024","2393","Активность","Контрольная","Редактирование контрольной","TestActivityEditingTests","CheckErrorIsAppearIfRemoveTestActivityWithScore","Невозможно удалить контрольную при наличии оценок",""
"passed","Mon Feb 05 06:08:20 UTC 2024","Mon Feb 05 06:08:28 UTC 2024","7712","","Дисциплина","Создание дисциплины","DisciplineCreationValidationTests","CheckIfNameNotFilledInCreation","Отображение ошибки валидации для поля 'Название', если поле не заполнено в ДО",""
"passed","Mon Feb 05 06:01:10 UTC 2024","Mon Feb 05 06:01:21 UTC 2024","10894","Активность","Контрольная","Результат прохождения теста","TestActivityResultTests","CheckTeacherCanLeaveCommentOnAnswer","Преподаватель может удалить комментарий к ответу, если была отмечена галка Отображать студентам подробную информацию о результатах",""
"passed","Mon Feb 05 06:06:29 UTC 2024","Mon Feb 05 06:06:39 UTC 2024","9443","","Чат","Мини-чат страницы решений","TaskPageMiniChatTests","CheckSendEmptyMessageInTaskPageMiniChat","невозможно отправить пустое сообщение",""
"passed","Mon Feb 05 06:10:07 UTC 2024","Mon Feb 05 06:10:14 UTC 2024","6894","","Библиотека","","BulkActionsLibraryTests","CheckChooseButtonExistInMenu","Библиотека: наличие пункта “Выбрать” в меню при правом клике на каталог или материал",""
"passed","Mon Feb 05 06:08:48 UTC 2024","Mon Feb 05 06:08:55 UTC 2024","6990","","Дисциплина","Редактирование дисциплины","DisciplineEditingTests","CheckSwitchLanguage","Можно переключать значения в поле Язык",""
"passed","Mon Feb 05 06:11:01 UTC 2024","Mon Feb 05 06:11:11 UTC 2024","9741","","Материал","Конструктор теста","TestBlocksAndVariantsValidationTests","CheckAddTestVariant","Конструктор теста: можно добавить вариант",""
"passed","Mon Feb 05 06:07:17 UTC 2024","Mon Feb 05 06:07:24 UTC 2024","6740","","Поток","Создание потока","CohortCreationWarningModalTests","CheckCreateCohortWithoutMismatchWarningOfDuration","Создание потока: нет предупреждения о несоответствии длительности потока для программ длительностью кроме 72, 144 и 256 часов",""
"passed","Mon Feb 05 06:02:51 UTC 2024","Mon Feb 05 06:02:55 UTC 2024","3362","","Чат","Групповой чат","GroupChatMessageTests","CheckOpenDiscussWindow","Раскрытие панели обсуждения в групповом чате",""
"passed","Mon Feb 05 06:00:22 UTC 2024","Mon Feb 05 06:00:33 UTC 2024","11326","Активность","Контрольная","Создание контрольной","TestActivityCreatingTests","CheckCreateActivityBySpecifyingControlMode","Можно создать контрольную с режимом выполнения Командный",""
"passed","Mon Feb 05 06:00:10 UTC 2024","Mon Feb 05 06:00:12 UTC 2024","2580","Активность","Контрольная","Редактирование контрольной","TestActivityEditingTests","CheckExecutionModeFieldIsNotClickable","Поле Режим выполнения некликабельно",""
"passed","Mon Feb 05 06:03:56 UTC 2024","Mon Feb 05 06:04:13 UTC 2024","17014","","Чат","Мини-чат звонка дисциплины","DisciplineRoomChatCallTests","CheckSendFileMessageInDisciplineRoomCallChat","можно прикрепить и отправить файл с компьютера",""
"passed","Mon Feb 05 06:11:48 UTC 2024","Mon Feb 05 06:12:00 UTC 2024","12311","","Библиотека","","LibraryInTileViewTests","CheckRemoveMaterialInTileView","Библиотека, плиточный вид: можно удалить материал",""
"passed","Mon Feb 05 06:06:00 UTC 2024","Mon Feb 05 06:06:09 UTC 2024","9357","","Чат","Дисциплина","DisciplineRoomChatTests","CheckRestoreDisciplineChatRoomFromArchive","можно восстановить чат из архива",""
"passed","Mon Feb 05 06:08:53 UTC 2024","Mon Feb 05 06:09:01 UTC 2024","7963","","Дисциплина","Создание дисциплины","DisciplineCreationValidationTests","CheckIfDescriptionNotFilledInCreation","Отображение ошибки валидации для поля 'Описание', если поле не заполнено в ДО",""
"passed","Mon Feb 05 06:12:51 UTC 2024","Mon Feb 05 06:12:55 UTC 2024","4161","","Программа","","ProgramCreationTests","CreateHighProgramOverviewFields","Заполнить только обязательные поля у программы ДПО",""
"passed","Mon Feb 05 06:06:34 UTC 2024","Mon Feb 05 06:06:35 UTC 2024","1624","","Поток","Создание потока","CohortCreationTests","CheckCancelCohortCreationByDirectLink","Создание потока ВО: работает кнопка 'Отмена', если страница создание был открыть по прямой ссылке",""
"passed","Mon Feb 05 06:10:19 UTC 2024","Mon Feb 05 06:10:33 UTC 2024","13725","","Дисциплина","Дисциплина с ИОТ","IOTGraphTests","CheckAddBlockBetweenBlocks","Страница дисциплины с ИОТ: между блоками можно добавить ещё один блок",""
"passed","Mon Feb 05 06:06:22 UTC 2024","Mon Feb 05 06:06:38 UTC 2024","16685","","Чат","Мини-чат личного чата","PersonalMiniChatTests","CheckCallInPersonalMiniChat","можно сделать звонок",""
"passed","Mon Feb 05 06:08:41 UTC 2024","Mon Feb 05 06:08:48 UTC 2024","6687","","Дисциплина","Редактирование дисциплины","DisciplineEditingTests","CheckSetShortnameField","Можно изменить краткое название, сделав двойной клик по названию дисциплины",""
"passed","Mon Feb 05 06:00:58 UTC 2024","Mon Feb 05 06:01:09 UTC 2024","11260","Активность","Контрольная","Страница контрольной","TestCommandActivityTests","CheckRemoveTeamFromCommandControlActivity","Можно удалить команду из командной контрольной",""
"passed","Mon Feb 05 06:01:55 UTC 2024","Mon Feb 05 06:02:07 UTC 2024","11958","","Чат","Дисциплина","DisciplineChatTests","CheckAddQuoteToLastMessageInDisciplineChat","Можно цитировать сообщение",""
"passed","Mon Feb 05 06:13:21 UTC 2024","Mon Feb 05 06:13:27 UTC 2024","6100","","Материал","Конструктор тест-тренажера","TestTrainQuestionAnswersValidationTests","CheckRemoveCommentFromTestTrainAnswer","Конструктор теста-тренажера: проверка ошибки валидации при удалении комментария к варианту ответа",""
"passed","Mon Feb 05 06:11:49 UTC 2024","Mon Feb 05 06:12:01 UTC 2024","11399","","Материал","Конструктор тест-тренажера","TestTrainBlocksAndVariantsValidationTests","AddBlockTestTrain","Конструктор теста-тренажера: можно добавить блок",""
"passed","Mon Feb 05 05:59:06 UTC 2024","Mon Feb 05 05:59:18 UTC 2024","12400","","Активность","Обычная активность","ActivityDurationTests","CheckIfDatesFilledCorrectInAcivity","Успешное сохранение, если обе даты корректно заполнены",""
"passed","Mon Feb 05 06:00:09 UTC 2024","Mon Feb 05 06:00:17 UTC 2024","8110","","Активность","Обычный шаблон активности","TemplateAddingTests","CheckRemoveMaterialFromActivityTemplate","Можно удалить материал из шаблона активности",""
"passed","Mon Feb 05 06:04:11 UTC 2024","Mon Feb 05 06:04:31 UTC 2024","19342","","Чат","Групповой чат","GroupChatTests","CheckPinLastMessageInGroupChat","Можно закреплять сообщения в групповом чате",""
"passed","Mon Feb 05 06:09:43 UTC 2024","Mon Feb 05 06:09:53 UTC 2024","10430","","Дисциплина","Дисциплина с ИОТ","IOTDisciplineCreationTests","CheckCreatDisciplineWithIOT","Можно создать дисциплину ВО с ИОТ",""
"passed","Mon Feb 05 05:59:41 UTC 2024","Mon Feb 05 05:59:45 UTC 2024","3435","","Активность","Обычная активность","ActivityAddingTests","CheckAbsenceScormScoreField","Отсутствие поля Оценка по SCORM результату, если не добавлен SCORM пакет",""
"passed","Mon Feb 05 06:13:40 UTC 2024","Mon Feb 05 06:13:43 UTC 2024","3004","","Профиль","","GeneralUserInfoEditingTests","CheckSwitchToOwnTransliteration","Редактирование профиля пользователя: можно переключить свитч транслитерации",""
"passed","Mon Feb 05 06:09:55 UTC 2024","Mon Feb 05 06:09:58 UTC 2024","2794","","Дисциплина","Шаблон дисциплины","DisTemplateTests","CheckCreateDisTemplateIfRequiredFieldsNotFilled","Невозможно создать шаблон дисциплины, если не заполнены обязательные поля",""
"passed","Mon Feb 05 06:04:44 UTC 2024","Mon Feb 05 06:04:54 UTC 2024","10162","","Чат","Мини-чат для заметок","NotesMiniChatTests","CheckSendTextMessageInNotesMiniChat","можно отправить текстовое сообщение",""
"passed","Mon Feb 05 06:06:02 UTC 2024","Mon Feb 05 06:06:18 UTC 2024","16188","","Чат","Мини-чат для заметок","NotesMiniChatTests","CheckAddReactionToLastMessageInNotesMiniChat","можно добавить реакцию на сообщение",""
"passed","Mon Feb 05 06:13:11 UTC 2024","Mon Feb 05 06:13:14 UTC 2024","3416","","Расписание","","ScheduleTests","CheckColorLegendIsDisplayed","Отображается цветовая легенда событий расписания",""
"passed","Mon Feb 05 06:00:53 UTC 2024","Mon Feb 05 06:01:01 UTC 2024","8261","Активность","Шаблон активности контрольной","Редактирование шаблона контрольной","TestTemplateAddingTests","CheckAddFileToControlActivityPlan","Можно загрузить материал типа Файл с компьютера в шаблон контрольной",""
"passed","Mon Feb 05 06:08:20 UTC 2024","Mon Feb 05 06:08:27 UTC 2024","7204","","Поток","Создание потока","CohortCreationTests","CheckCreateCohortByFillingMaxNumberOfStudents","Создание потока: можно создать поток, заполнив поле ‘Максимальное количество студентов’",""
"passed","Mon Feb 05 06:10:49 UTC 2024","Mon Feb 05 06:10:54 UTC 2024","4576","","Библиотека","","StudentLibraryTests","CheckAvailabilityOfContentCreation","Библиотека студента: недоступно создание материалов кроме добавления файла и создания текстового материала",""
"passed","Mon Feb 05 06:08:03 UTC 2024","Mon Feb 05 06:08:31 UTC 2024","28023","","Чат","Мини-чат личного звонка","PersonalChatCallTests","CheckPinLastMessageInPersonalCallChat","можно закреплять сообщения",""
"passed","Mon Feb 05 06:11:00 UTC 2024","Mon Feb 05 06:11:22 UTC 2024","21621","","Библиотека","","RemovingTemplatesTests","CheckDeleteProgramTemplateFromWhichCohortIsCreated","Страница библиотеки: можно удалить шаблон программы по которому был создан поток",""
"passed","Mon Feb 05 06:07:43 UTC 2024","Mon Feb 05 06:07:46 UTC 2024","3458","","Поток","Страница потока","CohortInfoTests","CheckWindowsRestoreCohortArchive","Страница потока: при восстановлении потока из архива появляется модалка подтверждения действия",""
"passed","Mon Feb 05 06:09:22 UTC 2024","Mon Feb 05 06:09:26 UTC 2024","4216","","Дисциплина","Страница дисциплины","DisciplineStudentTests","CheckGradingByStudent","У студента нет возможности выставить оценку",""
"passed","Mon Feb 05 06:04:22 UTC 2024","Mon Feb 05 06:04:38 UTC 2024","16419","","Чат","Чат для заметок","NotesChatTests","CheckEditLastMessageInNotesChat","можно редактировать сообщение в течение 4 часов после отправки",""
"passed","Mon Feb 05 06:17:46 UTC 2024","Mon Feb 05 06:17:58 UTC 2024","12271","","Чат","Мини-чат решения","TaskMiniChatTests","CheckSendFileMessageInTaskMiniChat","можно прикрепить и отправить файл с компьютера",""
"passed","Mon Feb 05 06:08:28 UTC 2024","Mon Feb 05 06:08:36 UTC 2024","8201","","Дисциплина","Создание дисциплины","DisciplineCreationValidationTests","CheckIfShortnameNotFilledInCreation","Отображение ошибки валидации для поля 'Краткое название', если поле не заполнено в ВО",""
"passed","Mon Feb 05 06:13:21 UTC 2024","Mon Feb 05 06:13:28 UTC 2024","6964","","Расписание","","ScheduleSettingsTests","CheckSyncErrorWithGoogleCalendarIsAppear","Проверка некорректного подключения к синхронизации с Google календарем",""
"passed","Mon Feb 05 06:07:06 UTC 2024","Mon Feb 05 06:07:23 UTC 2024","17315","","Поток","Создание потока","CohortCreationValidationTests","CheckCreateCohortFromUnsuitableTemplate","Создание потока ВО: невозможно создать поток из шаблона программы ДО",""
"passed","Mon Feb 05 06:00:31 UTC 2024","Mon Feb 05 06:00:43 UTC 2024","12063","Активность","Контрольная","Редактирование контрольной","TestActivityAddingTests","CheckAddTestTrainToControlTypeActivity","Можно добавить материал типа Тест-тренажёр из Библиотеки в контрольную",""
"passed","Mon Feb 05 06:07:40 UTC 2024","Mon Feb 05 06:07:47 UTC 2024","7171","","Поток","Редактирование потока","CohortEditingTests","CheckCreateCohortWithMismatchWarningOfDuration","Редактирование потока: появление модалки, если продолжительность потока меньше часов программы",""
"passed","Mon Feb 05 06:07:35 UTC 2024","Mon Feb 05 06:07:44 UTC 2024","8899","","Поток","Создание потока","CohortCreationWarningModalTests","CheckCreateCohortIgnoringMismatchWarningOfDuration","Создание потока: можно создать поток без исправления длительности потока",""
"passed","Mon Feb 05 06:00:43 UTC 2024","Mon Feb 05 06:00:55 UTC 2024","12342","Активность","Контрольная","Редактирование контрольной","TestActivityAddingTests","CheckAddTextMaterialToControlTypeActivity","Можно добавить материал типа Текст из Библиотеки в контрольную",""
"passed","Mon Feb 05 06:11:43 UTC 2024","Mon Feb 05 06:11:50 UTC 2024","7676","","Материал","Конструктор теста","TestQuestionsValidationTests","CheckRemoveCommentInTestQuestion","Конструктор теста: можно удалить комментария к вопросу",""
"passed","Mon Feb 05 06:08:53 UTC 2024","Mon Feb 05 06:09:08 UTC 2024","14554","","Дисциплина","Создание дисциплины","DisContingentCreationTests","CheckAddTeacherByUserInfoInCreation","Добавление преподавателя по email",""
"passed","Mon Feb 05 06:11:12 UTC 2024","Mon Feb 05 06:11:19 UTC 2024","7441","","Дисциплина","Дисциплина с ИОТ","IOTGraphTests","CheckGetOutOfBlock","Страница дисциплины с ИОТ: можно выйти из графа",""
"passed","Mon Feb 05 06:12:02 UTC 2024","Mon Feb 05 06:12:25 UTC 2024","22321","","Материал","Конструктор теста","TestAddingQuestionsTests","CheckAddQuestionWithFreeAnswerRange","Конструктор теста: можно добавить вопрос с типом ответа “Свободный ответ” - “Диапазон”",""
"passed","Mon Feb 05 06:13:06 UTC 2024","Mon Feb 05 06:13:26 UTC 2024","20555","","Материал","Конструктор теста","TestAddingQuestionsTests","CheckAddSortingTestQuestion","Конструктор теста: можно добавить вопрос с типом ответа “Сортировка”",""
"passed","Mon Feb 05 06:11:25 UTC 2024","Mon Feb 05 06:11:39 UTC 2024","13484","","Библиотека","","LibraryInListViewTests","CheckRemoveMaterialInListView","Библиотека, списочный вид: можно удалить материал",""
"passed","Mon Feb 05 06:03:44 UTC 2024","Mon Feb 05 06:03:50 UTC 2024","6121","","Чат","Мини-чат дисциплины","DisciplineRoomMiniChatTests","CheckOpenImageInDisciplineRoomMiniChat","можно раскрывать изображения",""
"passed","Mon Feb 05 06:13:02 UTC 2024","Mon Feb 05 06:13:06 UTC 2024","3619","","Программа","","ProgramCreationTests","AddEducationProgaramWithError","Если не заполнить одно обязательное поле у программы ДПО",""
"passed","Mon Feb 05 06:08:32 UTC 2024","Mon Feb 05 06:08:35 UTC 2024","3457","","Дисциплина","Страница дисциплины","DisciplineActivitiesBlockTests","CheckActivityVolumeIsDisplayed","Отображается объём ОА у дисциплины",""
"passed","Mon Feb 05 06:00:39 UTC 2024","Mon Feb 05 06:00:40 UTC 2024","1487","Активность","Задание","Страница решения задания для студента","TaskWithSolutionStudentTests","CheckImpossibilityToEditAnotherStudentsSolutionGrade","Нет возможности оценить решение другого студента, если не включена опция Взаимопроверка",""
"passed","Mon Feb 05 06:09:56 UTC 2024","Mon Feb 05 06:10:06 UTC 2024","9716","","Дисциплина","Редактирование дисциплины","DisContingentEditingValidationTests","CheckAddStudentFromGroupInTeachersField","Появление ошибки при попытке указать преподавателем студента из группы",""
"passed","Mon Feb 05 06:11:56 UTC 2024","Mon Feb 05 06:12:15 UTC 2024","19233","","Материал","Конструктор тест-тренажера","TestTrainAddingQuestionsTests","CheckAddQuestionInTestTrainFreeAnswerWithEqual","Конструктор теста-тренажера: можно добавить вопрос с типом ответа “Свободный ответ” - “Точное совпадение”",""
"passed","Mon Feb 05 06:10:06 UTC 2024","Mon Feb 05 06:10:16 UTC 2024","10631","","Дисциплина","Редактирование дисциплины","DisContingentEditingValidationTests","CheckAddStudentsInTeachersField","Появление ошибки при попытке указать преподавателем студента из поля Студенты",""
"passed","Mon Feb 05 06:00:44 UTC 2024","Mon Feb 05 06:00:50 UTC 2024","5098","Активность","Контрольная","Редактирование контрольной","TestActivityEditingTests","CheckErrorInTimeLimitFieldWithIncorrectValue","Ошибка валидации в поле Временной лимит, если введено отрицательное значение",""
"passed","Mon Feb 05 06:03:51 UTC 2024","Mon Feb 05 06:04:08 UTC 2024","17734","","Чат","Мини-чат звонка дисциплины","DisciplineChatCallTests","CheckSendMessageByTappingEnterInDisciplineCallChat","можно отправить сообщения по нажатию на Enter",""
